,comment_id,text,score,awards,timestamp,author
0,gpmnt80,[removed],1,0,1614841402,[deleted]
1,gpmntas,Well better be a part of Skynet when it rise!,13,0,1614841404,stiivN
2,gpmnuhw,[removed],1,0,1614841432,[deleted]
3,gpmnv97,[removed],1,0,1614841450,[deleted]
4,gpmnw92,Planitar pleas fly again 🚀,3,0,1614841474,bierbottle
5,gpmnwsl,PLTR to the moon 🚀🚀🚀🚀🚀🚀🚀🚀🚀🌕🌕🌕🌕🌕🌕🌕🌕🌕🌕🌕🌕🌕🌕🌕🌕🌕,12,0,1614841487,No-Math-5079
6,gpmo3iy,"Already got a bunch of calls, both short and mid terms. And have been buying a few more over the pass few days to average down the price.",1,0,1614841641,SomeRandomSomeWhere
7,gpmo8ah,And another 600k+ shares to ARKW,0,0,1614841756,jaredrc2001
8,gpmodv6,Idk about you but im waiting for roblox,1,0,1614841888,DankDude3
9,gpmoe6x,[removed],1,0,1614841896,[deleted]
10,gpmol9w,I like the stonk 🚀,2,0,1614842059,SFserviceman415
11,gpmolvj,[removed],1,0,1614842073,[deleted]
12,gpmoo7a,"Same, bud. I keep buying the dip, but the dip keeps dipping.",1,0,1614842128,FortuneMustache
13,gpmoux3,""" hottest AI "". One word, shill.",1,0,1614842286,ilikeasianbooty
14,gpmoyij,Thank you for this comment. Now all readers can wait for eternal torment.,24,0,1614842374,RealNeonKnight
15,gpmoyjd,"I don't understand why everyone thinks it needs to take off in near time. It already moved more than 150% in less than year. 

I like it as long time holding but there wasn't as much significant information to gather new investors till we get to know gow revenue changed.",1,0,1614842375,Tymon_Mizantrop
16,gpmp1bs,Its been kept down by HF probably. I am just loading more every week.,3,0,1614842441,cryptodgn
17,gpmp1u6,[removed],1,0,1614842453,[deleted]
18,gpmp25k,No it's better you don't even know about it. Because then you're gonn help building it and do not get punished.,8,0,1614842461,RealNeonKnight
19,gpmphdw,[removed],1,0,1614842826,[deleted]
20,gpmplyb,[removed],1,0,1614842936,[deleted]
21,gpmpu6p,[removed],1,0,1614843129,[deleted]
22,gpmpx4m,I need more disposable money to buy shares,1,0,1614843202,007fan007
23,gpmpztv,[removed],1,0,1614843270,[deleted]
24,gpmq08i,"This shit isn't funny. Who wants to make it with me though? *dOnT kiLl uR crEAtoRs, pLeaS*",0,0,1614843280,Slyx37
25,gpmq1wx,[removed],1,0,1614843317,[deleted]
26,gpmq3wq,"PRetty sure AI is like the stephen king novel where the vending machine shoots the sodas. 

Or transformers, where your toilet could be a decepticon.",1,0,1614843368,cyphonismus
27,gpmq5zy,"It seems silly not to talk about it. Like a superstition. But, I looked it up once and ill reference it, but don't like to say it. We're going to need one hell of a horcrux, Harry.",1,0,1614843419,Slyx37
28,gpmqhq2,[removed],1,0,1614843708,[deleted]
29,gpmqypn,[removed],1,0,1614844126,[deleted]
30,gpmr1v2,"Jokes on you, sold my PLTR to buy more GME.",-1,0,1614844204,Shigurame
31,gpmr2kq,"God damn, I was thinking about averaging down, but now someone on WSB tries to sell me the stock and I don't know if that means it will fall even further......",1,0,1614844222,PM_ME_YOUR__BOOTY
32,gpmr52g,[removed],1,0,1614844287,[deleted]
33,gpmrawu,cant you hold the shares though and sell covered calls or puts to reduce the cost basis per share?,8,0,1614844441,funterra
34,gpmrkcw,[removed],1,0,1614844680,[deleted]
35,gpmrlbq,"&gt; Mama Cathie is (further) in as well

i think forecasts aren't taking into account the growth of business with pre-existing customers. it's not just about adding new logo's and partnerships (which they are doing at breakneck speed for fortune 500 clients), it's about demonstrating immense value for their existing customers and jacking the price up as high as they want because the company can't afford not to have them.

they in effect own these clients once they start using their product.",1,0,1614844704,TheRealDevDev
36,gpmrmqh,"First of all, I think PLTR looks very promising for a long-term hold.   


But just to air out some scepticism - how come that people haven't been talking about this before? It didn't IPO recently, so the stock has been available for a while - how come it's ""now"" that everyone is praising this stock?  


(I am a certified retard who just started trading 1 month ago, and is trying to learn).",3,0,1614844742,FlyFallHD
37,gpmrndp,"Also an extra note for the insider selloff:

Palantir insiders sold via 10b5-1 plan, as required by insider trading regulations, which means that the decision to sell at this time was in the distant past (months ago). Most people here are acting like they are just panic dumping their shares, which is not true. They got paid in shares for years and can now finally sell some of it.",14,0,1614844758,mikemechanics
38,gpmrppu,"I've been in since Early November and plan to YOLO all my GME profits into PLTR as soon as they reach decent highs (this step is taking more time than i had anticipated). My goal is to have around 2000 shares, possibly with an average inferior to $30, to use as a theta farm.

positions: 400 shares at $25, 5 Jul 35c",7,0,1614844817,Scatamarano89
39,gpmrrch,[removed],1,0,1614844857,[deleted]
40,gpmrtum,Positions?,5,0,1614844921,Marcipanas
41,gpms3ex,So where can I buy stocks of Cyberdyne,3,0,1614845164,unmovable_busquets
42,gpms8ai,[removed],1,0,1614845290,[deleted]
43,gpmsfgt,[removed],1,0,1614845473,[deleted]
44,gpmsfoo,[removed],1,0,1614845479,[deleted]
45,gpmskck,[removed],1,0,1614845595,[deleted]
46,gpmsmyu,Same. They’re going to burn it down around me anyways. I want to see the fireworks for myself.,1,0,1614845662,ObscuredReasoning
47,gpmso1r,[removed],1,0,1614845690,[deleted]
48,gpmsrnp,"Do the Alan Turing test.
Are you an IA? Yes or no?",9,0,1614845778,detectivesolanas
49,gpmt05x,PLTR is literally antithetical to America.,7,0,1614845989,justinthedark89
50,gpmt1ef,"Thank you. Someone had to say it. Don't you think a company like Apple with the Cashflow and moat that it has wouldn't heavily invest in ""AI"" if it could do stuff. Or Microsoft, or Google, FB, you name it.  


Machine learning/AI is just a buzzword now because people think that you can literally turn that toaster into a fighter jet and AI is the future. It is, but I think people have to understand that AI is something that needs to still be programmed and NO ONE has figured out to make a machine learn like a human. NO ONE.",1,0,1614846021,kciarnie
51,gpmtoc7,[removed],1,0,1614846621,[deleted]
52,gpmtpkq,[removed],1,0,1614846655,[deleted]
53,gpmtqif,You can sell covered calls against LEAPS too. If you have the money to buy 100 shares of X company that's fine. LEAPS are a nice way to essentially own 100 shares for a bit cheaper if you're on a budget or new to trading.,6,0,1614846681,copywrite
54,gpmttec,[removed],1,0,1614846757,[deleted]
55,gpmtu0e,"I work in Walmart as maintenance, I can guarantee you our automatic scrubber ain’t taking over crap. 

Thing can barely go down an aisle without getting stuck on a piece of paper protruding 4 inches past the shelf.",1,0,1614846773,The_Chimeran_Hybrid
56,gpmu2lj,[deleted],6,0,1614847008,[deleted]
57,gpmu52i,[removed],1,0,1614847074,[deleted]
58,gpmu94v,"Alright you win, in for a 1500 shares at open",5,0,1614847183,whitemonkreturns
59,gpmu9q0,[removed],1,0,1614847199,[deleted]
60,gpmua15,[removed],1,0,1614847208,[deleted]
61,gpmuauy,[removed],1,0,1614847229,[deleted]
62,gpmvb6c,God-damned socialist robots!,1,0,1614848212,Dunge0nMast0r
63,gpmvc9h,[removed],1,0,1614848242,[deleted]
64,gpmvm2n,People have been talking about it for awhile. But it’s just hit some lows so people are willing to jump back in,3,0,1614848505,yrrrrrrrr
65,gpmvmqz,What GME gains?,14,0,1614848523,ateranol
66,gpmw3cp,[removed],1,0,1614848979,[deleted]
67,gpmwafi,[removed],1,0,1614849176,[deleted]
68,gpmwai8,"I talked with my buddy yesterday and was joking that PLTR looks like future Skynet... Damn, now i have confirmation",3,0,1614849178,tuna_pannini
69,gpmwzwb,"ok, just joined the party for 1000 shares   🚀🚀🚀",2,0,1614849858,LordDegen
70,gpmx0lk,[removed],1,0,1614849876,[deleted]
71,gpmx8tn,[removed],1,0,1614850099,[deleted]
72,gpmyir9,"&gt; antithetical 

why",0,0,1614851353,KingOfPoros
73,gpmyuhm,"They want to strip all privacy away from people.
Also the entire idea of ""pre-crime"" is antithetical to the whole innocent until proven guilty concept this country is supposed to embody.
Guilty be for you commit a crime.
There absolutely no way that can be exploited.

It's lock step with the CIA and the police state.
How is it anything other than antiAmerican?",7,0,1614851675,justinthedark89
74,gpmyuxv,"IF YOU'RE GOING TO FILIBUSTER, YOU SHOULD RUN FOR SENATE!


*I am a bot, and this action was performed automatically. Please [contact the moderators of this subreddit](/message/compose/?to=/r/wallstreetbets) if you have any questions or concerns.*",2,0,1614851688,AutoModerator
75,gpmyuxo,"AI might not intentionally take over the world, but it could fuck things up quite easily if people are not extremely careful with it

the danger comes when seemingly simple ""motivations"" (as i like to call them) lead to totally unintended behaviour

for example, if an AI's primary motivation was 'efficiency' then it might determine that humans are an obstacle to this.  if it had the means, it might then attempt to remove humans.

but i still think we're a very long way from AI that could actually threaten humans.  you'd have to be a moron to give AI control of a nuke or whatever

a la Uncle Bob:  coders *WILL* kill millions of people in the future.  he has a lecture series on proper design and implementation, and he says that coding needs to become a proper profession such as being an architect or whatever, where there are high level standards that we all agree on - because right now, mistakes are made constantly and bodge-jobs are done to fix things.  It's already happened a bunch of times where sloppy code has led to thousands of deaths",1,0,1614851688,nolitteringplease346
76,gpmz5rb,NASDAQ tanking cause of rising bond yields - it's gonna drag all growth/tech stocks down. It would be better to wait and see what kind of trick the fed comes up to prop this up before going in.,2,0,1614851978,structee
77,gpmz9p5,[removed],1,0,1614852084,[deleted]
78,gpmzfk6,Fuck off wench. The whole notion of big brother is watching is total horse shit... because cameras are installed everywhere these days and they already have information on us. PLTR is disrupting terrorist attacks before they happen...Not gathering information about what time your mom’s boyfriend comes over and pipes her...,-3,0,1614852241,August-West-77
79,gpmzsrw,anybody that buys pltr because they hope to make huge gains in the next 2-3 months is an Idiot,1,0,1614852604,BLACK-C4T
80,gpmzw29,"Pltr is literally skynet. Fuck it, I’m in.",1,0,1614852691,Jakeallenmusic
81,gpn01qi,[removed],1,0,1614852840,[deleted]
82,gpn0xe9,[removed],1,0,1614853706,[deleted]
83,gpn10u4,Do you have a source for what you saw? It's a good point tbh.,1,0,1614853799,Horfield
84,gpn1e0z,"2.5mill shares in total btw. Arkw i believe, 600k",1,0,1614854150,droshake
85,gpn1pkb,"the analogy comparing a toaster to a fighter jet is just wrong in that context. 

to use the toaster analogy, you would have to stay in the construct of ""cooking"" so to speak.   
with self improving  and self teaching / learning AI (which already exists) you start with something that doesn´tr even know what a toast is, but giving all ingredients and tools.   
and rather sooner than later you end up with a 5 star michelin chef AI without ever  teaching the AI all the intricacies of cooking. it will teach itself and learn it all, just because it understood and built upon the basic principles. it all does this  on scale of speed impossible to match for any human. 

(sidenote: I doubt cooking will ever be the area AI will be pretty good at, but the example brings the point across). 

AI already can learn writing, reading, image recognition etc.

&amp;#x200B;

only because the current publicly available version of google translator is bad, does not mean AI is not worth the effort. a coouple of years ago, MSFT had a key note presentation where AI was able to translate chinese into english. in real time. speech to speech. 

also:  
using the evolution of human society and the time that was needed to  achieve this evolution and actually comparing this to improvement speeds of AI is ... ""problematic"" as speeds of development is ever increasing, no matter the topic. 

 it took but only a couple of years (relatively) to go from the first concept of flight to planes much that can reach the upper amtosphere. 

the very first programmable computer was built in 1941. now we have supercomputers with 415.5 petaflops. thats less than 100 years.   
and humans had to solve countless limitations during this time. yet development speeds keep improving. 

MuZero, a learning algorithm based on AlphZero, played / learned games without ever being taught the rules. 

Alphazero ""learned"" chess by playing it against itself for 24  hours. 

AlphaGo learned Go (a much more complex problem mathermatically than Chess)  in 3 hours.  

&amp;#x200B;

basically its evolution on speed. 

AI will revolutionize whole industries (it already has). we are only at the beginning.",8,0,1614854456,psykikk_streams
86,gpn2at9,Say some punk kids strap a bulletproof vest on a bear. Whaddya got? Invincible bears.,3,0,1614855017,CrazyInYourEd
87,gpn2bz8,"We, the Europoors started to buy in, and lower our buy ins.",1,0,1614855048,oemer54
88,gpn2dwo,Holy filibuster,2,0,1614855097,eatmykarma
89,gpn2t28,[removed],1,0,1614855490,[deleted]
90,gpn2tr2,"AI expecially had some rough weeks, but it will come back up stronger than ever🚀",1,0,1614855510,MrKeks13
91,gpn3gf1,Rates aren’t even rising. Yields are rising. You’re also calling me a bear which is funny. I’m neutral at 40x sales. This sub used to be filled with degenerates who understood how shit works but did stupid stuff anyway. Now it’s filled with new accounts who think their 6 months trading in the greatest bull run of all time makes them Warren Buffett.,2,0,1614856079,BagofBabbish
92,gpn3hbc,I agree but it's not like these informations are very hard to find. It would take you 2 minutes at max to get this data.,4,0,1614856102,istike29
93,gpn3joj,"People don’t understand you can be bullish on expensive stocks, but Palantir is not undervalued.",3,0,1614856159,BagofBabbish
94,gpn3le7,"Ayyy finally another CRSR holder. Not gonna lie, getting scared a lil bit LOL but I know the company will continue to do good. If only I could say the same for WISH, the other stock dragging my portfolio to the ground",16,0,1614856202,Crazy_Gam3r
95,gpn3llg,"No, I’m going to laugh at your stupid ass when you blow up your account",1,0,1614856207,BagofBabbish
96,gpn3n92,Idk about you yankees but in the UK they think we memed too hard and the leverage requirements are way up on pltr,1,0,1614856248,paid_shill5
97,gpn3zbk,They added 2.7 M! 600K on ARKW!,1,0,1614856546,SorryLifeguard7
98,gpn45i4,[removed],1,0,1614856697,[deleted]
99,gpn4coc,"I'm sitting at $27.77 avg ;-; every day's been a pain

Edit: OFC I'M HOLDING, NO PAPER HANDS AROUND HERE",1,0,1614856872,crankymotor
