,comment_id,text,score,awards,timestamp,author
0,gpgpy1u,Might as well,5,0,1614721963,edukated4lyfe
1,gpgq004,"According to posts on this sub, the whole frigging market is going into squeeze.",29,0,1614721988,Nashtark
2,gpgq92t,"Been on my radar for a bit. I think it's a legit play. Stimulus is going to cause a retail surge as COVID winds down and we go into the summer. Decent fundamentals, tons of SI... going to destroy earnings. Shorts are going to be clobbered AGAIN on this.",7,0,1614722099,singluon
3,gpgqbos,RemindMe! 20 days.,3,0,1614722131,Smo-Kingweed
4,gpgqdfb,"Shares Outstanding 89.91M · Public Float 31.06M


Lets get some itm calls. and run that shit up.",8,0,1614722153,tsa004
5,gpgqeo4,"I'M RECLAIMING MY TIME!!!


*I am a bot, and this action was performed automatically. Please [contact the moderators of this subreddit](/message/compose/?to=/r/wallstreetbets) if you have any questions or concerns.*",1,0,1614722168,AutoModerator
6,gpgqemy,"I will be messaging you in 20 days on [**2021-03-22 21:55:31 UTC**](http://www.wolframalpha.com/input/?i=2021-03-22%2021:55:31%20UTC%20To%20Local%20Time) to remind you of [**this link**](https://np.reddit.com/r/wallstreetbets/comments/lwdfu2/gamma_squeeze_knocking_on_the_door_aso/gpgqbos/?context=3)

[**6 OTHERS CLICKED THIS LINK**](https://np.reddit.com/message/compose/?to=RemindMeBot&amp;subject=Reminder&amp;message=%5Bhttps%3A%2F%2Fwww.reddit.com%2Fr%2Fwallstreetbets%2Fcomments%2Flwdfu2%2Fgamma_squeeze_knocking_on_the_door_aso%2Fgpgqbos%2F%5D%0A%0ARemindMe%21%202021-03-22%2021%3A55%3A31%20UTC) to send a PM to also be reminded and to reduce spam.

^(Parent commenter can ) [^(delete this message to hide from others.)](https://np.reddit.com/message/compose/?to=RemindMeBot&amp;subject=Delete%20Comment&amp;message=Delete%21%20lwdfu2)

*****

|[^(Info)](https://np.reddit.com/r/RemindMeBot/comments/e1bko7/remindmebot_info_v21/)|[^(Custom)](https://np.reddit.com/message/compose/?to=RemindMeBot&amp;subject=Reminder&amp;message=%5BLink%20or%20message%20inside%20square%20brackets%5D%0A%0ARemindMe%21%20Time%20period%20here)|[^(Your Reminders)](https://np.reddit.com/message/compose/?to=RemindMeBot&amp;subject=List%20Of%20Reminders&amp;message=MyReminders%21)|[^(Feedback)](https://np.reddit.com/message/compose/?to=Watchful1&amp;subject=RemindMeBot%20Feedback)|
|-|-|-|-|",1,0,1614722168,RemindMeBot
7,gpgqo1p,"Good bot

Holy fuck thoses bots are funny.",3,0,1614722283,Nashtark
8,gpgqp02,They blew the last earnings out of the water. Earnings surprise was 139.47. I'm sure they'll do even better with the coming earnings.,5,0,1614722295,Smo-Kingweed
9,gpgqqht,Why 20 days? Is there is something that I should know?,1,0,1614722314,Nashtark
10,gpgrou8,"OP mentions gamma squeeze, doesn’t actually know what gamma is.",12,0,1614722745,KAT-PWR
11,gpgrtft,"Ok, I’m in 👍🏽📈",1,0,1614722803,Enki906
12,gpgrzoe,"And thank you for the bananas and rockets, they really spoke to me at my level 😂
ASO 🚀🚀🚀🦍",3,0,1614722883,Enki906
13,gpgsmsp,Fuck it. I am in you mad lad. I like Academy anyway.,1,0,1614723180,bedlamensues
14,gpgsov8,RemindMe! 15 days,1,0,1614723207,RebootItAgain
15,gpgssjq,Governor Abbott opened  Texas 100% and got rid of mask mandaste today. I know I’ve seen Academy Sports there before. Maybe good for business? Idk I mostly loose money.,3,0,1614723254,Penny_Wise_Investor
16,gpgt66h,Whoa whoa you might be onto something.,1,0,1614723432,_SpectreVenom_
17,gpgt9rf,RemindMe! 19 days,2,0,1614723478,S0ulbiteCO
18,gpgtai6,[removed],1,0,1614723488,[deleted]
19,gpgtcpw,"I live within 20 minutes of 2 of their stores in Texas, and there are always people lined up at open to try to buy ammo.  The ammo shortage is supposed to last well into next year, and Academy gets more regular shipments and doesn't mark up as much as the mom and pop stores do.

On top of that, all of their stores are currently in red states, where people buy a fuckton of ammo.

Source: [https://imgur.com/oJv1QkZ](https://imgur.com/oJv1QkZ)

They have built-in foot traffic from gun owners who are likely more predisposed to buy the rest of their sports and outdoor inventory(softball gloves, grills, golf clubs) than non-gun owners and all of their locations are in red states - 38% in Texas.

They increased net income 112% in 2020.  And ammo shortage is supposed to run into 2022.",3,0,1614723517,Luka-Step-Back
20,gpgtv8b,Gamma squeeze is when a lot of options get bought up the market makers that sold them have to hedge the risk so they buy or sell shares in the direction of the options - simplified definition,2,0,1614723759,BenHuff102
21,gpgtybu,I know what gamma is retard. I’m saying the OP is retarded and doesn’t know what a gamma squeeze is.,6,0,1614723800,KAT-PWR
22,gpgu6w6,Hmm - it hit above $26 on Feb 16th but nothing significant happened wrt to the end of the week or February 19 calls,2,0,1614723913,peezy02
23,gpgv9hh,If Covid winds down.,1,0,1614724424,Strange_Quark4Lyfe
24,gpgvfmu,So we apes with extra tendies should think about liking ASO? Show me the waaay!,2,0,1614724508,HaliButtCheeks
25,gpgvfxo,Fuck it I'm in,1,0,1614724512,jrjohns3575
26,gpgvo7z,[removed],1,0,1614724623,[deleted]
27,gpgwhfq,"It already has started. Stores are packed here (FL). Also Biden literally just said there will be enough vaccines for all American adults by May. Timing is perfect.

I'm doing a DD soon - I am bullish.",2,0,1614725011,singluon
28,gpgwnwq,RemindMe! 10 days.,1,0,1614725097,Mark_Sargent
29,gpgwq7i,RemindMe! 15 days,1,0,1614725128,PilotNacho
30,gpgwqgl,"Add to that Texas just [turned off the mask mandate](https://www.cbsnews.com/news/texas-mask-mandate-statewide-lifted-governor-abbott-coronavirus/#app). Lots of AOS in Texas, hugely popular there.",2,0,1614725132,ramblingrocket
31,gpgwvl1,[removed],1,0,1614725200,[deleted]
32,gpgx51q,Positions? With screenshot,1,0,1614725325,Ubango_v2
33,gpgxrvg,This is definitely something that we should all be considering! Thanks for the ~DD.,1,0,1614725625,flipfloptoast
34,gpgxt5i,"Fair play didn't see the announcement from Biden, I am also just a degenerate Canadian new to this whole Ape lifestyle.",1,0,1614725642,Strange_Quark4Lyfe
35,gpgxyk0,"I eat crayons

Mainly red ones...",1,0,1614725716,Nashtark
36,gpgy0z3,"This is a great stock. They absolutely crushed their Q3 expectations in October of last year. Let me remind you this would have included some pretty awful Covid numbers with store closure. They are reporting Q4 in a few weeks and will have ""Holiday"" sales along with more store openings. You better believe they are going to crush their Q4 numbers.",1,0,1614725748,mcpoyles
37,gpgy34p,"You're either an orangutan, can't read or both. Anyways here's more bananas and rocket for you 🍌🍌🍌🚀🚀🚀.",0,0,1614725777,Smo-Kingweed
38,gpgy4bs,"I eat both, good to not overwhelm your gut biome with 1 kind of crayon. 

But positions from this retard OP would be nice.",2,0,1614725793,Ubango_v2
39,gpgy4f3,Definitely on to something here...  I’m thinking of grabbing those $30c for 3/19,4,0,1614725794,prezzo
40,gpgy5s3,"I checked OP's profile for shill evidence and this dude is actually funny as fuck. 

Top posts are ""unethical/illegal life pro tips"" such as ""if a cop pulls you over and you have illegal shit in your car just tie it to a helium balloon and send it to the sky. The cop won't risk getting in trouble for trying to shoot it down.""

Well, I don't wanna shoot down this DD. I wanna see it go to the sky. Ill grab a few calls if they're pennies on the dollar. 

Thanks OP. Cya later or fuck you later time will tell

Edit: the stock has had continuous growth since going public and the cheapest calls are still over 1$ per share. 

No thanks. I want to buy life insurance on a company bleeding bleeding death not on a company that eats vegan and does yoga",2,0,1614725812,Deep_six_6
41,gpgyz52,"I live in Texas and every Saturday morning Academy has a huge line of people waiting to get in and buy ammo, and they sell out fast. This post is the first post I’ve seen bringing attention to ASO, I will do some more DD tonight, but unless I see something terrible, I’ll be buying 10 $30c 3/19 in the morning since they are like .30 cents. Thanks for this, now time to roll the dice!",2,0,1614726210,Traditional-Appeal52
42,gpgyzac,Both Texas and Mississippi announce reopenings in next 10 days,1,0,1614726212,rcliv
43,gpgz2jg,It's like one of the top 5 shorted stocks out there though. Definitely has squeeze potential.,2,0,1614726256,singluon
44,gpgza5r,"I’m not saying it’s not true.

Some much squeezing.

I’m not that ancient on that sub, is this always like that or are we in squeeze glut?",1,0,1614726362,Nashtark
45,gpgzwby,Texas just opened up also. And Biden announced that the vaccination plan for citizens is happening 1 month earlier - it was either May or April,1,0,1614726668,Kutaifa
46,gph0b0n,"still accurate? At least according to Schwab, the short interest on ASO is only 14% as of Feb 15.",1,0,1614726873,WTF_HomeSlice
47,gph0mwi,There’s a lot of DD done that suggests something big happening on the 19th,1,0,1614727037,anonymaus74
48,gph2o2c,Automod bot reclaiming time from remindmebot. The future is now,1,0,1614728069,da_muffinman
49,gph2wg3,That's out of total outstanding shares. It's like 40% of float.,1,0,1614728188,singluon
50,gph2ye1,Why doesn't this qualify,1,0,1614728216,da_muffinman
51,gph348r,You DD'd the DDer,1,0,1614728300,da_muffinman
52,gph3xyp,All right then time to get some Tendies from these fucking HOGGERS.,2,0,1614728725,Strange_Quark4Lyfe
53,gph3zbb,Ah I gotcha.,1,0,1614728744,WTF_HomeSlice
54,gph7xa8,Why was this removed?,2,0,1614730762,rcliv
55,gphthob,😂 good DD,2,0,1614741839,Smo-Kingweed
56,gpip7ez,"Yeah, thats sus. Came back to read but its gone.",2,0,1614765757,m-mmm
