,comment_id,text,score,awards,timestamp,author
0,gpg076q,BAN,7,0,1614710963,peeingattention
1,gpg07s9,#Ban,7,0,1614710970,LEEJANDZ
2,gpg0aat,"Gtfo of here, Vlad.",5,0,1614710999,Nikkiwikkiwakka
3,gpg0b6d,"Vlad made his own account, crazy",1,0,1614711010,Dogmeattt666
4,gpg0baf,permaban,4,0,1614711012,mtoms48
5,gpg0cad,BAN,4,0,1614711024,repsolrydeRR
6,gpg0cph,LMFAO what the fuck,1,0,1614711029,Suavecore_
7,gpg0hpk,"You sound like a RH schill
RH sh*t on the little guy with their antics, they will pay when their IPO goes live.",1,0,1614711088,Bearwires79
8,gpg13b8,no tendies for you,1,0,1614711341,Tendieman_420_69
9,gpg1mz7,get the fuck out thotbot,1,0,1614711571,trtonlydonthate
10,gpg2o4t,not user friendly? What is this a chucky cheese? If you can't figure out how to use a real broker gtfo. Ban.,1,0,1614712011,ShadowBlackCoyote
11,gpg2oy5,[removed],1,0,1614712021,[deleted]
12,gpg3353,"Okay RobinCrook intern coffee jockey.. no problem, first suck the Boston Creme out my cake hole... on the moon bitchs..",1,0,1614712189,tonystarks6969
