,comment_id,text,score,awards,timestamp,author
0,gphbnvm,bud take your gains before it is too late,61,0,1614732680,step40isback
1,gphbs6e,"Agreed. There are NO profits until you sell. But than, anyone who wouldn't cash out at that point... probably does not need the money as much as others here.",25,0,1614732743,Dazumbolschitt
2,gphbv8j,[removed],2,0,1614732787,[deleted]
3,gphc0v5,Where tf are y’all hearing about when to buy these stocks wtf I’m on many Reddit’s everyday still not getting shit except amc gme,14,0,1614732866,starkiller51515
4,gphcdvg,If it’s any consolation I’ve been seeing folks post RKT loss porn for months. Folks who won this time were largely right place right time when they stumbled on the RKT spam in wsb.,11,0,1614733053,rdlowreyAtTheDisco
5,gphcelr,"You gotta keep up to date and research but my man, this is a casino and you can lose it all like a lot of people do.",10,0,1614733064,Jojobeans10
6,gphchtq,Why would I sell now when it is certainly going up. Plus my hands are made of diamonds,-16,0,1614733110,ddyer248
7,gphciy9,"Same, so many people put it in a day or hours before it popped. I just don’t get it lmao. I’m long PLTR anyway.",1,0,1614733126,PsiAddict
8,gphckv6,Geez lol always seems to be how it works now I guess,3,0,1614733154,starkiller51515
9,gphcnj8,And you think there is no ceiling?  Do what you want.  Some of us need it more than others as I said.,8,0,1614733190,Dazumbolschitt
10,gphczle,"There is always a ceiling. If you need the $, you shouldn't be gambling with it. Hate the game. I am thinking this will hit $75 by the end of the week.",-12,0,1614733364,ddyer248
11,gphd03f,I made the mistake of not taking profits and I was big up like this take those profits bro,5,0,1614733372,RainyCityTay
12,gphdefz,"Damn... its like talking to my cousin who got kicked by a horse as a kid.  Speak slowly for the boy, people.",23,0,1614733579,Dazumbolschitt
13,gphdrjw,"Good luck to you!! Exciting ride for sure.

It's hard to know when great is good enough I found.

I'd sell the options asap. Don't want to be left holding that bag. That's a worse feeling than knowing you could have made more...at least for me. Especially if you're in 4 bagger land.

The stocks I'd take some profit and keep the rest. It is a good company after all.

After this passes. Sell covered calls on the remaining stocks to make some premium over time.

My position before COB today was:

2 $23C 3/5 @ $1.09 = $218

I bought last Friday.

Sold contracts separately today.

1 @ $6.35 (take cost + profit)

1 @ $14.00 - I may have left much on the table, but I have  over $1900 in the que for the next option opportunity.

Good luck to you.",2,0,1614733771,hereforlonghaul
14,gphdzbn,I have a position: 45 call 3/19. What’s the move to maximize my bananas?,1,0,1614733884,wannabebowhunter
15,gphea2l,Nice. Good for you 👌,1,0,1614734042,ThetaThoughts
16,gphel44,Why is it going to $75?,5,0,1614734204,garpla
17,gpher2t,RemindMe! 3 days,6,0,1614734290,jehovxh
18,gphes46,"I bought last month and almost sold a few days ago. Bought more when they announced the dividend, that seemed to be the trigger.",1,0,1614734304,vangogh88
19,gphetgs,"I will be messaging you in 3 days on [**2021-03-06 01:18:10 UTC**](http://www.wolframalpha.com/input/?i=2021-03-06%2001:18:10%20UTC%20To%20Local%20Time) to remind you of [**this link**](https://np.reddit.com/r/wallstreetbets/comments/lwh4u8/168k_gain_in_2_days_holding_for_more/gpher2t/?context=3)

[**4 OTHERS CLICKED THIS LINK**](https://np.reddit.com/message/compose/?to=RemindMeBot&amp;subject=Reminder&amp;message=%5Bhttps%3A%2F%2Fwww.reddit.com%2Fr%2Fwallstreetbets%2Fcomments%2Flwh4u8%2F168k_gain_in_2_days_holding_for_more%2Fgpher2t%2F%5D%0A%0ARemindMe%21%202021-03-06%2001%3A18%3A10%20UTC) to send a PM to also be reminded and to reduce spam.

^(Parent commenter can ) [^(delete this message to hide from others.)](https://np.reddit.com/message/compose/?to=RemindMeBot&amp;subject=Delete%20Comment&amp;message=Delete%21%20lwh4u8)

*****

|[^(Info)](https://np.reddit.com/r/RemindMeBot/comments/e1bko7/remindmebot_info_v21/)|[^(Custom)](https://np.reddit.com/message/compose/?to=RemindMeBot&amp;subject=Reminder&amp;message=%5BLink%20or%20message%20inside%20square%20brackets%5D%0A%0ARemindMe%21%20Time%20period%20here)|[^(Your Reminders)](https://np.reddit.com/message/compose/?to=RemindMeBot&amp;subject=List%20Of%20Reminders&amp;message=MyReminders%21)|[^(Feedback)](https://np.reddit.com/message/compose/?to=Watchful1&amp;subject=RemindMeBot%20Feedback)|
|-|-|-|-|",2,0,1614734324,RemindMeBot
20,gphethj,"I'M RECLAIMING MY TIME!!!


*I am a bot, and this action was performed automatically. Please [contact the moderators of this subreddit](/message/compose/?to=/r/wallstreetbets) if you have any questions or concerns.*",2,0,1614734325,AutoModerator
21,gphfr11,Sell half to be safe...,1,0,1614734799,FamiliarTerritory37
22,gphfsqc,[deleted],1,0,1614734822,[deleted]
23,gphg0xy,"I agree, OP - let your winners run. I subscribe to the “sell half &amp; let the rest ride” philosophy...but what do I know, I am just a simple ape 🦧after all. Godspeed.",2,0,1614734942,roomtempdaytraderITM
24,gphgakp,"Do yourself a favor and sell 25 of those contracts. RKT definitely has a future, but with this much volatility it can go the wrong way real fast. Wish you the best either way.",3,0,1614735079,Nerdowell
25,gphh07y,Don't get greedy,1,0,1614735446,sfaticat
26,gphi2po,Nice account history,2,0,1614735991,LickMyCockGoAway
27,gphjrws,If TLRY csn hit 72 this sure can.,2,0,1614736880,oneind
28,gphkxh3,Holding till at least Friday 3/5 when shorts either cover or owe $1.11 special dividend on every share.,1,0,1614737479,SkyaGold
29,gphsmoq,3 year old account - first post 25 days ago? 😆,1,0,1614741374,Albiondb80
30,gphsvx2,Sorry I have a life and didn't post for awhile. Retired now with plenty of time to post,0,0,1614741512,ddyer248
31,gpht0ym,[deleted],1,0,1614741589,[deleted]
32,gpi9yia,"Proud ape, take your gains and get out, put it in GME. If it collapsed you feel like an unhappy ape",1,0,1614752122,EonaCat
33,gpjvtrs,[removed],1,0,1614790758,[deleted]
34,gpky6r3,[removed],1,0,1614807289,[deleted]
