,comment_id,text,score,awards,timestamp,author
0,gpglwlf,Good work,2,0,1614720200,Stop-Gargling-Balls
1,gpgmygm,I think HF are pushing it down. Someone commented on shorts of 390000 about an hour before close. I’m buying more if it drops closer to 10. I think there will be a small surge near the end of the month. I’ll  do the same with AMC if it drops back near 5.,5,0,1614720659,AtomicHawkeye
2,gpgnu5r,But why?  I can't understand why they want to short it so heavily.  The moves they've been making...QNX and IVY are going to be ubiquitous.  It'd be nice if the HF would get on board the rocket.  There's plenty of room on here!,6,0,1614721047,spacep0p3
3,gpgogd7,BB is being hold back for quite some time. Almost scary when it is going to explode. Fun part is: when it breaks free it is going to really fly !,18,0,1614721313,plaatsvervanger
4,gpgon1d,It’s all about money. They will short it. The stock will drop. Retail investors will sell. They will get out of their short positions. Buy back millions of shares slowly then buy a huge lot at the end of the month. FOMO retail investors will start buying while its climbing. HF sell off profits slowly. There was a video about this regarding the last surge of meme stocks with the SEC talking about GME end of February.,8,0,1614721394,AtomicHawkeye
5,gpgonns,End of the month and we will see where BB goes. Earnings and FB deal will be known,13,0,1614721401,MonkeyFarmer1
6,gpgppxw,[removed],1,0,1614721864,[deleted]
7,gpgqsae,[removed],1,0,1614722335,[deleted]
8,gpgqst9,"I have 140 $25 3/19 calls that are painfully down. I hope it gets some movement before then. I bought some when share price was $20, then bought a bunch more to average down, but still painful to see down about $5k lol.",6,0,1614722341,Nakamura9812
9,gpgrmm3,My understanding is that the judge pushed off some part of it to later in the year...(correct me if I'm wrong),1,0,1614722716,joshuki
10,gpgtkwg,"Damn that must be painful to watch. What's your average now ?

I fomo'd 80% of my portfolio into BB when it was lifting off then it tanked shortly after? At what price do you plan to sell ?",3,0,1614723624,Earthrise1
11,gpgvr8z,[removed],1,0,1614724664,[deleted]
12,gpgw2wg,"Vanguard has the absolute worst UI/UX of any broker, so naturally they don't tell me my average cost, but by my math I'm at $13.99/share. 

When do I plan to what?  What's that last word mean?  Sell?  Is that like an exit strategy?  Because I've heard that word used around here a few times. Kidding, of course. My goal is to pull out my basis at $40, then ride it to either Uranus or the center of the Earth. I really do love the stock.",4,0,1614724818,spacep0p3
13,gpgwbr1,"Sold some Rocket 🚀 today to avg down BB

Holding 3000 shares @12.6 USD now 

started averaging down from 18 LOl",4,0,1614724934,theunderdogsardar
14,gpgwjqc,"I’ve got 100% of my portfolio in BB at $18 lmao. And since it has 100% margin requirement on TDA, I can’t trade until BB recovers 😭",3,0,1614725041,greaseballxwondo
15,gpgyoap,"If there's a short squeeze and the stock price briefly peaks and touches $13.99, would you be tempted to sell out everything and buy back in when it tanks to $10 again as it seems to love doing ? I'm just wondering if that's a good strategy?",1,0,1614726063,Earthrise1
16,gpgyqng,"I put all $30,000 of my one brokerage account into BB at $18 as well. It is a bad feeling for sure.",5,0,1614726096,Dramatic_Medicine_51
17,gph2w91,"I feel your pain, I’ve got 237 @ $22 but Monday I threw the last $300 in my account at 25 3/5 12c. I think it’s undervalued at this point and primed for takeoff.",2,0,1614728185,ged923
18,gph2z86,BB loves trading sideways. I don’t mind though.,3,0,1614728228,Original-Baki
19,gph4egi,BB = Blue Balls ffs,5,0,1614728960,da_muffinman
20,gph4mb0,"feelsbadman.jpg

Don't doubt your vibe",2,0,1614729071,da_muffinman
21,gph4nbr,"[feelsbadman.jpg](https://i.imgur.com/T0jNUbo.jpg)  


---
^(*Feedback welcome at /r/image_linker_bot* | )[^(Disable)](https://www.reddit.com/message/compose/?to=image_linker_bot&amp;subject=Ignore%20request&amp;message=ignore%20me)^( with ""ignore me"" via reply or PM)",1,0,1614729086,image_linker_bot
22,gph5589,This is why my fellow autist's... BUY THE DIP!,3,0,1614729338,OmegaPrecept
23,gph5b2l,Patience young grasshopper.  You will be reaping your rewards with in a year or perhaps 2.,2,0,1614729421,OmegaPrecept
24,gphgjh0,This is the way.  Obvs,1,0,1614735204,RelationshipOk3565
25,gphi9n5,"No, the suit was dismissed after a joint request from both parties after reaching a settlement.",5,0,1614736090,JuvenileRockmover
26,gphlcbt,"Pick me up, got in at $20/share",1,0,1614737687,TheXamYel
27,gpho8hk,I'm in for a piddly 10 shares. Seems like way too much upside and hardly any downside,1,0,1614739178,shannon247
28,gpht2u7,I thought I was big with my 2200 shares .. your the mothership,4,0,1614741617,railroadurrr
29,gphywe7,"Yikes dude, those dont cover earnings :/",4,0,1614744815,math_salts
30,gpi00nw,Buy the dip and don't paper hands! Fuck the shorters!,2,0,1614745463,Fission3D
31,gpi3q11,Yeah it’s a pretty tried and true playbook.,2,0,1614747756,theprinterison
32,gpi6fpa,"Expensive lesson. They have an investor conference call Thursday with someone at Morgan Stanley, plus the stimulus package should be passed in the next 10 days, yeah I’m grasping for straws, just trying to minimize the loss at this point. I’ll probably cash out then on 3/18 they announce a partnership or something lol.",1,0,1614749583,Nakamura9812
33,gpie29x,Bro just roll them forward,1,0,1614755387,math_salts
34,gpie2zg,Then sell calender spreads to hedge the cost.,1,0,1614755405,math_salts
35,gpigt4z,Gotta sell those weekly CCs!,2,0,1614757783,DrunknRcktScientst
36,gpj4ls5,"BB may have a rough year but they are positioning themself. I put 30% from my portfolio of my TFSA. This is a long play, I think eventually the domino will start to fall and picked up the benefits. They've been hiring lately to do more development, hopefully focusing on the partnership with Amazon.",2,0,1614778053,O-PEE-CHEE
37,gpj9a43,What do you mean roll them forward?,1,0,1614780618,Nakamura9812
38,gpjbd27,"I’m in at 375 at the same exact price. Feels bad man. I remember looking at the stock and contemplating selling it the same day when it hit like 27,28 and then the next day Robinhood slaughtered us",1,0,1614781667,HonestyMyOnlyPolicy
39,gpjw431,"Sell the calls you have, buy further out calls. Then sell the strike you did have for 3/19 to reduce your cost basis as a calender spread.

You dont have to make the calender spread, but I like to do it when I roll up.",1,0,1614790878,math_salts
40,gpk27c0,This man has balls of steel,1,0,1614793477,MrDitkovitchsRent
41,gpka3wo,"18% of one of my accounts and looking to up that...I like the stock, even tho its RED EVERY DAY!",1,0,1614796863,aceswild16z
42,gpl54o1,That’s what I thought you meant and that’s what my plan is either Friday or Monday. See if tomorrow’s investor conference moves the stock at all and sell on the trend up hopefully to minimize loss and buy further out ones. These calls seemed like a great idea back in January before the moon shot and share price was at like $18 lol.,2,0,1614810399,Nakamura9812
43,gpn9ht4,Good luck bro,1,0,1614860897,math_salts
