,comment_id,text,score,awards,timestamp,author
0,gpgnbjb,Bag holder,3,0,1614720821,blast4310
1,gpgnkqw,BB is actually a good company with high growth possibility. It just wont be an overnight success. Hold and buy on dips.,2,0,1614720934,djcarpentier
2,gpgnljx,"Thought wpuld go still up, bought at 14$ × 10shares",1,0,1614720944,diamondhandsowner
3,gpgo2pm,Bagholder as well🦍,1,0,1614721148,Churt1
4,gpgo6a5,Is this good or bad lmao xD?,1,0,1614721191,diamondhandsowner
5,gpgzvmf,Lol I think it will def move once the HFS take their foot off the meme stocks,1,0,1614726657,Churt1
