,comment_id,text,score,awards,timestamp,author
0,gpljj1t,[removed],1,0,1614817580,[deleted]
1,gpljvcy,"Tons of us don't give a fuck about GME, deal with it.",48,0,1614817759,Sp00dge
2,gplkc68,What the fuck are you going on about? Did you double up on your Adderall? It sounds like you doubled up on your Adderall. SQQQ shares or calls to float you thru the tech sinkhole inbound.,11,0,1614818048,UrMurGurdWTF
3,gplkcp0,[deleted],-7,0,1614818059,[deleted]
4,gplkovg,[removed],1,0,1614818277,[deleted]
5,gplkryy,Basically you’re saying if everyone liked the stock we’d be eating sweet tendies already?,15,0,1614818339,Aggroho
6,gpllcr2,A monkey in an ape suit?,12,0,1614818705,Hoffmanaut
7,gpllka1,"If you started a post with this title, it would have been deleted.",13,0,1614818833,rollover2323
8,gplltj7,Isn't that why its called a monkey suit?,0,0,1614818997,Rebelsquadro
9,gpllxct,[removed],1,0,1614819063,[deleted]
10,gplm7nl,Ask your wife's boyfriend.,13,0,1614819242,Hoffmanaut
11,gplm7od,"I am saying I like the stock. Others can like (or not like) the stock based on their own DD. We are not a hivemind, other comments are clearly proving that point.",-2,0,1614819242,Rebelsquadro
12,gplmdwq,"That's true but the point of the post was not to take a census of who gives a fuck about GME.
Thanks for contributing your two cents.",-15,0,1614819348,Rebelsquadro
13,gplmkr7,[removed],1,0,1614819467,[deleted]
14,gplnmgh,[removed],1,0,1614820086,[deleted]
15,gplnpbs,[removed],1,0,1614820134,[deleted]
16,gplnpd0,"Reddit has a new paid team called **Anti-Evil Operations** which goes around permanently banning accounts for saying bad words. We made automod block them so you don't lose your account for saying a word and getting reported. It's not our rule, it's the entire website now, we're just trying to look out for our people. Sorry.

*I am a bot, and this action was performed automatically. Please [contact the moderators of this subreddit](/message/compose/?to=/r/wallstreetbets) if you have any questions or concerns.*",3,0,1614820135,AutoModerator
17,gplnvd9,[removed],1,0,1614820232,[deleted]
18,gplnzf4,[deleted],1,0,1614820295,[deleted]
19,gplopy8,"Was it to sound like a fucking idiot? Because if it was, well done.",18,0,1614820711,The_Moisturizer
20,gplpa5z,is that why you have rule #2 to downvote all non hive minds that at all deviate from your personal party???,24,0,1614821002,shitt4brains
21,gplrdpl,[removed],1,0,1614822074,[deleted]
22,gplru2d,What if OP really deserved it?,3,0,1614822306,AsIWit
23,gplsg73,"It was a honest post even if it wasn't pretty. they aren't rules tho it was just easier to break it up in segments. Obviously its not my personal party but instead of running into each post and spamming how bad it is, I just opt to use the downvote and move on.",-12,0,1614822625,Rebelsquadro
24,gplsix4,[removed],1,0,1614822664,[deleted]
25,gpltgc3,me too......,1,0,1614823140,shitt4brains
26,gpltk8e,Dude people like you should fuck off,31,0,1614823194,Lonelymanure
27,gplx8ug,Appreciate your honesty and I didn't write this to farm karma. If I wanted to do that there are other subs I could've gone to.,-28,0,1614825004,Rebelsquadro
28,gpm0ncv,"I did yolo everything into GME. But had to get out for other plays. Also your thread title doesn’t really tie in with the body of your post. If you want an explanation for why everything is going down, look at SPY and ^DJI 1month chart.",4,0,1614826693,Dio_Eraclea
29,gpm21df,Lmfao literally no one cares 🤣🤣🤣,11,0,1614827408,WsbBetsdotcom
30,gpm2ntn,"Yea, despite the post not being super long I had to take several breaks to sort through my thoughts. It doesn't surprise me that it kind of derailed from the original premise. I wanted to generate a dialogue and was not sure how to proceed for a while. I took several breaks through writing it and I settled on just being honest with how I have been approaching WSB as of late.

There are tons of apes in WSB, equally as many different points of view. I hope when you got out of GME you did so with a positive tendy gain, and I wish tendies upon you in your future yolos.",-8,0,1614827730,Rebelsquadro
31,gpm3xiu,[deleted],1,0,1614828374,[deleted]
32,gpmc090,"Oh hell no, I got out at the bottom. Then you know what happened, GME went to 190 for a short time. But that would have been enough to recover the entire portfolio if I had sold there. Disgusted in my inability to diamond hands.",2,0,1614832927,Dio_Eraclea
33,gpmc9t0,[removed],1,0,1614833092,[deleted]
34,gpn9mop,Sorry to hear that. Well hopefully you are able to recover through your other investments.,1,0,1614860992,Rebelsquadro
35,gpn9pni,[removed],1,0,1614861050,[deleted]
36,gpnkcvx,Cool story,2,0,1614867323,Timo_TMK
37,gpny5xw,WSB isn't all GME dickbag,1,0,1614873651,Lucky-Development-15
