,comment_id,text,score,awards,timestamp,author
0,gpgk5ls,What country?  I will never go there,1,0,1614719466,antiloserz
1,gpgk6b9,"I’m in the U.K. and make gains tax free - try Spread Betting or use an ISA

Edit: For ISA try Trading 212",2,0,1614719475,Enki906
2,gpgk7no,Yeah but you commies get free shit so stop complaining,4,0,1614719490,thesmiter1
3,gpgk8c1,Tax?,1,0,1614719498,imhighwhatisthis
4,gpgk8dy,What country? The taxes here in the Netherlands are absurdly low,1,0,1614719499,icherradi
5,gpgk8l6,"I mean, I rather make 58k after paying taxes than nothing",9,0,1614719501,tooomuchpresssure
6,gpgk8pe,Call your senator... oh wait,1,0,1614719502,No_Hurry12
7,gpgk93k,[removed],1,0,1614719507,[deleted]
8,gpgk9da,Hey thats what Biden wants to do here,0,0,1614719510,ShyftyyIV
9,gpgkaov,"No tax if you do spread bets or isa in the U.K.  

Love to see it",3,0,1614719526,DonMatchThrddr
10,gpgkc18,Where the fuck do you live lol,1,0,1614719541,JohnOtrilby
11,gpgkext,If u make 100k you still end up with 58k,1,0,1614719575,I_Am_Hella_Bored
12,gpgkf9m,Denmark. But most countries in eu have high taxes compared to USA. USA is 0% tax if u dont make more than 38k. Thats insane.,1,0,1614719579,spacelyyy989
13,gpgkggk,"Umm if you make 100k and pay 42k on it, you still have +58k. 58k is a lot more than the 0 you will make by saying fuck it.",2,0,1614719593,spokismONE
14,gpgkhb6,I pay 0.375% tax on the capital regardless of how much I gain or lose (in the EU).,1,0,1614719603,knappis
15,gpgki36,Lol wut are you just evading taxes,1,0,1614719612,warr3nh
16,gpgkjtl,which country,1,0,1614719633,zakus5599
17,gpgklqx,"Poor people need trendies too.    Share you tendies,  or they will stab you.    Just easier to give them your tendies.",1,0,1614719655,DookieBeard
18,gpgkm0n,"How, we pay income tax on any profits. All I've found is a yearly 20 into an ISA, but it has to hit your current account fist unless I can get broker-isa transfer.",0,0,1614719658,wavespeech
19,gpgkp12,This dude doesn’t understand that that money pays for his healthcare lol.,1,0,1614719692,spokismONE
20,gpgkq4z,No it’s perfectly legal and makes sense for the type of trading. Look into it or DM me.,1,0,1614719704,Enki906
21,gpgkr8f,Wait options don’t get taxed in the uk?,1,0,1614719717,tossserouttt3483726
22,gpgkror,"I know but 42k in tax is insane. You take a big risk when investing and if u win some they take almost half. How is that fair, its fucked up",1,0,1614719722,spacelyyy989
23,gpgkvap,Yea thats every year right?,2,0,1614719764,spacelyyy989
24,gpgkzuf,These fuckers at the FCA restricted some of these so in the end people use this spread betting loophole where ‘gambling’ winnings is tax free.,1,0,1614719816,DonMatchThrddr
25,gpgl5nd,"Yes, on a yearly basis.",1,0,1614719883,knappis
26,gpgl5q0,"Oh, I pay zero tax on gains in Sweden (using an Investment savings account) but pay a rate of (simplifying shit) 0.375% on the capital that’s held in the account. Losses are non deductible though. Anyways I’m a good little socialist so I keep my investments red and avoid making profits at all cost to avoid dodging taxes on my gains.

TL:DR that’s not a fucking EU problem, go set a fire outside your parliament or something.",1,0,1614719884,SureGovernment
27,gpglaqb,Lmao,2,0,1614719942,spacelyyy989
28,gpglh17,#solidarity #💎🙌🏻,1,0,1614720017,SureGovernment
29,gpglml5,"Fun fact, some European countries has a bicameral parliament with senators.",2,0,1614720081,SureGovernment
30,gpgltnj,User name checks out. Thanks homie,1,0,1614720164,No_Hurry12
31,gpglwcb,But are u serious about the investment saving account not paying taxes?,2,0,1614720196,spacelyyy989
32,gpgnnog,Yea healthcare but in my country is highest tax in EU and dont get me started on the food prices and car insurance and apartment prices and etc. You have like 10% money left when you paid for everything.,1,0,1614720970,spacelyyy989
33,gpgoq0t,"Dead serious, but you do pay 0.375 % on the amount held in the account so if you just keep cash in the account (a pretty bad idea but possible) you still pay 0.375 % tax per year on that amount. If you’d made a killing on GME, say that you put money in your account bought at 20 then sold at 420 and withdrew the cash making you a million dollar profit, you’d pay like a thousand bucks in taxes (because of the short time frame).

Please do note that this is in a country that some consider socialistic.",1,0,1614721430,SureGovernment
34,gpgrodd,Do you think its possible to do that in Denmark too?,1,0,1614722739,spacelyyy989
35,gpgs2n9,No Idea.,1,0,1614722921,SureGovernment
36,gphehal,[ISA profits are tax free](https://www.nutmeg.com/isas/tax-benefits-of-isas),1,0,1614734147,Enki906
37,gpijx8d,"They are but I don't think I can eToro a withdrawal to an ISA. Would have to withdraw to current account first, that would then show as income wouldn't it? Also if we all made decent money in the UK we can only ISA 20 a year.
Death n taxes are inevitable I guess.",1,0,1614760672,wavespeech
38,gpiklyd,"True eToro to T212 ISA isn’t possible. ISA is limited to 20k per person, so you could use family members too (wife, kids, wife’s boyfriend etc)",1,0,1614761324,Enki906
