,comment_id,text,score,awards,timestamp,author
0,gpniy99,This will happen only after melt up. The crash won't happen until 3rd quarter or later. What you are seeing now is just a pull back before the final phase of the melt up which will be an epic rise convincing all skeptic investors to just buy the dip no matter what....and that is when the crash will happen.,3,0,1614866575,MarcusAngely
1,gpnjiyh,"You start with a little hedging, you get curious... before you know it you're a big **🏳‍🌈🐻** wanking into an oven glove over news images of human misery, atrocities and other natural disasters that'll make ur puts print. It's not healthy.",14,0,1614866883,nucleargeorge
2,gpnjl3f,[removed],1,0,1614866915,[deleted]
3,gpnjph4,We will bury them with it.,10,0,1614866981,Shortupdate
4,gpnjrve,"I was with you till you said the fed would issue bonds. Huh, wha? Since when does the Fed issue bonds? The Fed buys bonds, thus inflating their prices and lowering yields (interest rate paid on the bond). Prices move inverse to yields. The Fed needs to do this, because if they don’t, the treasury starts paying much more in interest. Remember those variable rate mortgages that fueled the housing crash? Same concept. While you can afford 1% interest just fine, at 4% you’re fucked. That’s the problem for the Treasury and Fed. There is no good way out. It’s inflation or sovereign bond crisis. So far for the past decade, they have chosen inflation. My bet is that even as inflation goes up, they won’t do shit to stop it and when rates creep up, they will respond to lower them. The alternative is unthinkable.",1,0,1614867016,VtechX
5,gpnkx13,"The reason behind the ROR being so high is that it was such an unknown. Few people knew about it, and fewer still believed in it as a store of value. At the time, it was mostly used as a decentralized way to transact money internationally for illicit goods or services. But, people now know about it, understand what it is, and demand the asset.   


Not entirely certain if it beats gold over the rest of my lifetime, but wouldn't be shocked if it did so over the next few years.",9,0,1614867612,WillyGeyser
6,gpnlgo2,"Yes, rising rates means lower valuation of existing low-rate bonds relative to new higher rate issues, driving prices down and yields further up. The Fed issuing more higher rate bonds will not create new cash inflows, but will move cash out of existing bonds into new higher rate issues, contributing to further yield rises (as outlined above). An ETF however is not holding a bond, but a selection of bonds. A US bond ETF's value relies on both the valuation of the bond market and the relative value of the dollar, as well as market confidence in the Fed's forward looking policy, its constituent holdings and its management. You are exposing yourself to bonds held by the fund manager, rather than owning the bonds themselves, so you can be somewhat protected from duration or default risk, however you remain exposed to fluctuations in macro market sentiment and do not have the guaranteed principle as when holding the bond itself (an ETF can lose 100% of its value). The underlying manager has the capacity to trade in bonds while you hold the same ETF, so its relative success versus the market depends on the activity of the manager. This depends on the riskiness and activity level of the Fund. A less active fund with lower risk will generally trade less outside its benchmark and in fact be more susceptible to market-aligned losses. With bond ETFs they will also balance the duration of their bonds or be fixed duration (10y, 5y, 30y etc) meaning they will be valued differently.

The likelihood is that the value of the ETF will fall as the market panics (already happening) and leaves the market or opportunistically moves into higher rate issues, but that the manager has the potential to reduce loss with trading activity depending on their philosophy, fund design and outlook.",3,0,1614867885,BaconPancakes1
7,gpnlmcj,[removed],1,0,1614867963,[deleted]
8,gpnluib,"Agreed, no way they raise interest rates. The FED has already said raising employment is their main goal.  Raising interests rates would kill jobs. I'm betting the FED announce today they're gonna sell off their short term bonds and move to suppressing long term bond yields like the 10 year.",6,0,1614868073,hikerboy20
9,gpnmh3u,"First, I'm literally retarded and have been trying to wrap my head around this stuff for the last few weeks by ironing out all the wrinkles so I can have the smoothest brain.

Wouldn't increasing the interest rate then increase his much the US national debt is growing?  I thought that the bonds interest rate was the same interest rate the US pays on all of it's debt.  I have been thinking that the stock market has been inflated because interest rates are hot garbage and, as you said, investors make no money on bonds compared to stock, so everyone and their wife's boyfriend has been dumping their money into stock vs bonds. 

With the US national debt increasing by ~$10T (I think) due to covid, I would imagine the feds would want to keep interest rates low, since higher interest rate means more debt. 

I'm not disagreeing with the assessment that rising the interest rate would allow people to shift to bonds, but I'm wondering the increased national debt plays into your ideas. 

Again, I'm retarded and trying to learn.",3,0,1614868386,Dooky710
10,gpnmhln,[removed],1,0,1614868393,[deleted]
11,gpnmw5j,Beginner here but wouldn’t people want to buy bonds right now if yields are high? Why would interest rate have to be raised a lot too?,6,0,1614868593,wombilybear
12,gpnnxeq,MicroStrategy might know as well.,1,0,1614869083,Sen_Hillary_Clinton
13,gpno4y4,Lol have you seen the last year in tmf?,2,0,1614869183,butzhavebeenseen
14,gpnotow,"You're forgetting that the supply decreases by half every four years. Given similar demand you can expect price to double every four years.

The only drawback is the high transaction fees which make it harder for economic activity on that network to provide a floor for the price when there's no hype (between 4 year cycles). Thankfully there is an alternative of the same name + Cash.",2,0,1614869510,FreelyBlue
15,gpnrfto,"People still don't really know about it. The number of people who take it seriously is concentrated online, so you see them more here, but I'd be shocked if more than .5% of the world owned any or really knew how it worked.",4,0,1614870695,IdiotCharizard
16,gpnsejc,"Supply is fixed, the ability to extract supply decreases by half. However, we have no idea how much is lost due to people chucking USB sticks and hard drives in the trash.",11,0,1614871118,WillyGeyser
17,gpnskln,I think you're underestimating that % dramatically but I understand your point. Almost definitely less than 20% own or know how it works.,2,0,1614871193,WillyGeyser
18,gpnso7r,We'll see at noon if you're a fucking prophet or not. Hope you got those calls in at the first dip like I did.,1,0,1614871239,Ordurski
19,gpnsw3r,Noon decides everything. Best of luck everyone involved. One wrong word from Powell and the market TANKS.,1,0,1614871336,Ordurski
20,gpnto8x,20% means 1.5 billion people. There's no way it's even close to 5% I guarantee.,9,0,1614871678,IdiotCharizard
21,gpnu639,[removed],1,0,1614871901,[deleted]
22,gpnvnl6,problem with yield curve control is once you start it... you can't stop.,2,0,1614872555,moonski
23,gpnvp6s,Calls on SPXS seems similar to Puts on SPXL to me. Look at the premiums and greeks to see which is better.,4,0,1614872575,lwtracr676
24,gpnvqp2,Thanks for this post. It really helped me to start doing research into how to invest when I know certain markets will be down since I have limited option capabilities. You can 💎 ✋ or make money then reinvest into the stocks you like. TIL about inverse ETFs.,1,0,1614872593,kittensNclaws
25,gpnw2o5,"I've sent an email to the owner of reddit to have it removed. This kind of enlightenment will only make the stock marked crash harder. People should live in ignorance and be like a fishing float in the financial oceans, rise with the tide and fall with the tide. I hate the truth when I can't have it for myself only.",17,0,1614872739,ddoubles
26,gpnx28c,"Good idea deleting your comments in that other thread showing you have zero idea how inflation and bond markets work. Why are you giving your opinion elsewhere on this topic if you don’t understand? Why not first learn how it works. Again, it’s like you learned basic Econ 101 rules that exist in vacuumes and keep applying them as gospel to every situation 

We’re living in a time that’s not subject to typical normal market behavior 

Stop talking about “devaluing the dollar” or inflation. Since the Great Recession where we’ve exploded expansionary policies both monetary and fiscal we’ve only seen about 1.7% average annual inflation.

We risk an era of deflation, not inflation. If we can barely move inflation up with so much stimulus and FED actions why now are you fearing inflation? 

JUST TAKE 2 WEEKS AND LEARN HOW IT WORKS FOR GOD SAKE",-3,0,1614873169,economist_corgz
27,gpnxohy,[deleted],1,0,1614873441,[deleted]
28,gpnyu62,"High transaction fees are only for a few of the big boys and their smart contract tokens (because it has scaled 1000x faster than it was designed to).  If this is holding you back, please for the love of god go look up PROOF OF STAKE VERSION 3.",1,0,1614873945,Chumbag_love
29,gpnz1ra,[removed],1,0,1614874037,[deleted]
30,gpo0qcu,Now I understand everything thank u,1,0,1614874775,nikkicarter1111
31,gpo1f8o,"electronic gold is probably inflated even more than the stock market at the moment.

The real gold is not much and was down for quite a while",6,0,1614875072,DogEatApple
32,gpo1qj5,Only go green,3,0,1614875206,DogEatApple
33,gpo2kxp,"Txstreet dot com, do you even use any of these networks?",1,0,1614875574,FreelyBlue
34,gpo2uxf,"only 0.5-1% of people have gold or silver holdings so yeah, defs not 20",4,0,1614875694,TheFullBottle
35,gpo2v2c,[removed],1,0,1614875695,[deleted]
36,gpo42vy,I actually stopped reading half way into this because this guy was making too much sense and it doesn't fit with my confirmation bias.,14,0,1614876220,General_Asleep
37,gpo48cg,Propably won't help. The USD is too big of a whale to not effect all other currencies of the world.,6,0,1614876284,dexter3player
38,gpo4bw4,SuPeRcyClE,1,0,1614876325,dexter3player
39,gpo4jdm,As there's an inverse correlation between GME and the overall market—for whatever reason—the idea is not too stupid.,9,0,1614876414,dexter3player
40,gpo4l2f,"its...an interesting situation. we have been in deflation for a few years, hence the QE. Only since the bat-flu has the printer really been going brrrr but we have been in QE for years. The QE is to try and offset the deflation. 

Interestingly though, now we see inflation but only in certain sectors. Collectibles (Hockey cards, pokemon, classic cars etc), housing, stocks, some building materials like lumber. We have not yet seen inflation in food or everyday goods so it doesnt appear that we actually have inflation, but we do, its here.

What OP pointed out is that when money velocity picks up, inflation runs rampant. So when vaccines roll out and everyone starts going back to normal, inflation hits hard and fast. Inflation has barely moved so bar because the money velocity has decreased so much with covid.

&amp;#x200B;

Hope you learned something, im no economist but im also not blind",6,0,1614876434,TheFullBottle
41,gpo5rpu,Why not put money into bonds then if they will drastically increase interest rates? More guaranteed then puts on total market collapse,2,0,1614876943,leblaun
42,gpo64d0,"No, the supply does not decrease, it's still growing all the way until the year 2100 or so. The halvening cuts the rate of supply *increase* in half, not the supply.",2,0,1614877094,Logpile98
43,gpo69mw,"1) We have not been in deflation. The rate of inflation has been surprisingly low given the extreme amount of monetary and fiscal action in response to two recessions and the wealthy demanding tax cuts

2) Yes, Covid increased deficit spending but even before then Trump increased the deficit from $400-600B (whatever base year your ideology sways you to choose) to over $1.6 TRILLION prior to Covid and during a period of growth. The complete opposite of what you should do. Even then, inflation barely budged. 

3) The velocity of money has shown to be a less and less essential variable over the last 10 years (I believe a factor of income and wealth inequality). We’ve seen enormous injections of money into the economy, but it’s not flowing to the average person and thus not increasing velocity significantly 

4) Housing prices increased because of an extreme housing shortage. The rate of 20-40yos who make up the housing market is at its lowest level in a generation. Maybe even two. 

Your point that once Covid is done, the increase in normal spending will resume and increase the velocity of money thus increasing inflation rapidly runs in complete contrast to what we’ve seen in the last decade. It’s again, people who have the most basic level of understanding of economic tools (QE, FED actions, federal stimulus, formulas designed to help students understand how inflation works in the context of vacuums) ignoring the variables of our current economic condition 

But yeah your, “hope you learned something” to me gave me a chuckle. I imagine your nerdy ass sitting there, positioning your glasses up higher, and typing the words “money velocity” and “QE”saying to yourself, “🤓 I bet this economist doesn’t even know about Pokémon cards and QE”",-5,0,1614877157,economist_corgz
44,gpo6dgb,That exact number is what I've seen thrown around,1,0,1614877202,babyd42
45,gpo6fke,"Supply and demand imply that it's new supply in order to reach equilibrium, but thanks for clarifying for anyone else that might be confused.",1,0,1614877227,FreelyBlue
46,gpo6lfh,"Remains to be seen whether it can decouple from the stock market though. It's growing but still a highly speculative asset, and that means it tanks in times of uncertainty. We've never seen what happens to it when the stock market goes through a real bear market.",14,0,1614877297,Logpile98
47,gpo6p3z,[removed],1,0,1614877341,[deleted]
48,gpo6zke,"I read the title, opened etrade, liquidated and bought SQQQ and DRV, and then rushed back here to see if I was being too hasty.


EDIT:  Truth is I did most of that yesterday.",8,0,1614877466,Chumbag_love
49,gpo7an4,"SQQQ, DRV, VXZ.",1,0,1614877600,Chumbag_love
50,gpo7rko,[deleted],0,0,1614877801,[deleted]
51,gpo7yib,His name is Michael Burry and He gave us Gamestop on a silver platter too.,10,0,1614877885,Chumbag_love
52,gpo8by1,"No, I don't Use number 1, number 2, or any of the number 2 side projects right now (at least for moving around).  DM me if you want info.  Honestly look up ""NUMBER 2"" PROOF OF WORK V3, just google it.",1,0,1614878046,Chumbag_love
53,gpo8rdp,[removed],1,0,1614878235,[deleted]
54,gpo8se3,What hardships exactly? The increase in velocity would suggest strong economic activity in the first place. If the economy is booming why would people not be buying new phones with the printed money?,2,0,1614878246,sebastian-RD
55,gpo8v0a,"By the time the general population is using it, they will have no idea that they are using it.

6% of the US alone uses/owns it.

32% of Nigeria uses criipto

21% of Vienam

20% of the philipeans

16% of Turkey

And the list goes on about ten more countries till you get to Japan at 5%.",2,0,1614878278,Chumbag_love
56,gpo8xgm,"Don't ask the good questions. OP has a very superficial understanding of macroeconomics and pArT 3 is unironically retarded. I'm still an ape but compared to op I'm einstein.

Right now yields are higher because the economy is expected to recover. People buy bonds when they lose faith in equities thus moving the price of the asset up and decreasing the yield. There are other buyers who always buy because they are forced to buy bonds since their retirement fund has a mandate to do so or because it's better than holding cash. Banks were forced to hold bonds according to rules since the 08 recession which count towards their reserve requirement (so fed could buy it back to print money) but all that got thrown out since covid and may not be back for ages since the Fed realised they do not actually have to securitize their debt. We're getting into modern monetary theory so let's leave it at that.

You are hearing about the yield increasing becoming a problem because if they become high bonds become desirable again and/or nobody will loan you money for stupid cheap since they can get that risk free. Fed does not have to 'raise' anything and they won't as said many times. Fed has a dual mandate, stable prices and full employment. If you read the Fed minutes from Feb they are expecting inflation in the short them which will average to their target inflation in the longer term. They specify that they won't stop easing for years and until they are happy with the unemployment rate. They can also cap yields if they want to issue more bonds. They have heaps of tools left at their disposal and you always trust the Fed since forward guidance is also one of their tools which means they will fucking tell you what they are going to do in the future.",7,0,1614878308,CoronaPooper
57,gpob6qa,"I respect your enthusiasm, but I'm happy with my investment in ""Number 1"" Cash. Currently the most undervalued project by a large margin.",2,0,1614879272,FreelyBlue
58,gpod4ei,I was listening to thoughts on the market yesterday about the bond yields and the last three times bond yields have started to rise stocks rose with it. The last time which was around 2016 tech outperformed the next best asset class (energy) by 100%. Bond yields typically rise in an early economic cycle and we find ourselves in a unique place because we can directly fight the cause of the recession unlike 08 because we are fighting a virus. Basic conclusion was stocks go up. Banks should perform well in this environment as well as other stocks that depend on reopening.,3,0,1614880100,coconutpanda
59,gpoe8ba,"Nice write up, always enjoy some macroecon",1,0,1614880571,onesugar
60,gpof27c,[removed],1,0,1614880917,[deleted]
61,gpohex5,[removed],1,0,1614881911,[deleted]
62,gpoifby,[removed],1,0,1614882329,[deleted]
63,gpojk6c,[removed],1,0,1614882805,[deleted]
64,gpoju7d,Then I'm investing in grave robberies,4,0,1614882923,oldcoldbellybadness
65,gpom1qe,[removed],1,0,1614883849,[deleted]
66,gpomlvb,[deleted],1,0,1614884085,[deleted]
67,gpoord9,[removed],1,0,1614884987,[deleted]
68,gpooufn,SQQQ UVXY VXX  are my plays,1,0,1614885024,United12345
69,gpoptds,(TL;DR)^(2): near future looks bad for stonks across the board,2,0,1614885428,Logpile98
70,gpovzl6,"u/shitilostagain solid post. Jerome gave us a nothingburger today. The bull in me was hoping he would either announce an Operation Twist to maintain control of the long term rates at expense of the short, or that he would provide some clarity on the SLR shenanigans expiring March 31st. 

I’m playing this different. I was in a solid amount of cash post-RKT, and I’m planning to use it to bolster my longs at discounts.

That said, my thesis is invalid if the Fed can’t get control. But I have faith they can. Imo they literally have to, and allowing rates to rise above 3-5% on the long end would cause chaos in the housing market as well as that selloff in risk equities you talked about. The problem this time, is that everyone’s retirement is tied to equities and homes. Just my thoughts, it’s a culmination of podcasts and readings. I think we climb higher, and I think we eventually drop but I don’t think this is the “big one”. Jerome still has some *exotic* ammo left, especially with what is essentially his new marriage to Yellen.",0,0,1614887939,hoodedcactus
71,gpp0zy3,"Check the supply of m2. Nobody is spending their stimulus money on anything. Also as OP states, an increase velocity with the amount of money supply would simply lead to inflation largely affecting the middle class and poor. Moratoriums are also gonna end soon and people will have to either foreclose or cut their spending elsewhere to stay afloat. Not to mention unemployment numbers are still insanely high. The money velocity that will come isn’t something that is a good indicator, at least not with the current money supply. The fed needs to raise interest to get money out of the stock market and put it in other areas.",1,0,1614890064,Me-Cree
72,gpp454p,Another even more bearish situation is if we get deflation coupled with higher rates. Investors may not trust US debt anymore,1,0,1614891380,ChrispyChicken1208
73,gpp52x3,"Debt is just a number. You have to think of it that way. Who exactly is gonna have the balls to call on the U.S to pay its debt when the time comes? Also most debt (I forget the number, could be like 70%) is owed by the U.S. to itself just pushing it away hoping for economic growth. It’s not a bad thing to pile on debt, also not a good thing either. But really we know no consequences for extreme debt so we will continue to acquire it. Really the only way we know how much is to much is when it’s too late.",2,0,1614891766,Me-Cree
74,gpp56vm,That's essentially stocks lol. They're one of the only things that almost automatically keep pace with inflation.,0,0,1614891812,CanadianAstronaut
75,gpp5lg9,bonds go down if rates go up.  Go back to remedial,1,0,1614891982,dotbomb_survivor
76,gpp5z56,"It would destroy the stock market, and actually help everyone else as it can reduce money supply and stop the burst of inflation we may we. The market is also due for a correction anyways. The low rates has inflated it immensely and needs to be pulled back down. This correction won’t be like a end all be all sorts thing, just a quick drop to a level which investors are then comfortable holding over buying bonds.",2,0,1614892145,Me-Cree
77,gpp963r,[removed],1,0,1614893529,[deleted]
78,gpp9mhy,Welcome to precious metal gang. Silver is real money codified into the US constitution.,6,0,1614893729,OneBawze
79,gppd9um,"PST up ~1%, TMV up ~2% today, my stocks down....a lot

I hate when I read smart things ,recognize that they are smart and completely ignore it in the morning....",3,0,1614895336,wtf-am-I-doing-69
80,gppdeuc,"Low interest rates 😂😂

Meanwhile in Denmark we are paying money just to have them sit in a bank account.",1,0,1614895399,tahmias
81,gppejfw,"Picks and shovels. 

It's who got rich off the gold rush as well",5,0,1614895906,scbtl
82,gppfn9y,"I mean, this exact post has been done 3 times in the last year (June and September being the previous times). Using the same charts. Using the same people repeating the same things.

The market has a correction (not crash), expectations get reset, paper hands get fleeced by the big boys, and then all the sudden it flips and is off to the races again. 

The valuation of things is stupid. The market was on super easy mode. It needs a reset. 

The worst thing for us degenerates and best thing for anyone long term is that we have a year where it's rangebound but relatively flat to allow for everything to breathe and realign. There will be plenty of plays, but it won't be everything you look at, and so there will be plenty of money to be made. A resurgence, not takeover, of values and the f word would be wonderful.",5,0,1614896411,scbtl
83,gppfxo6,"GME seems like the best hedge against a market meltdown. Always my green in a sea of red, or red in a sea of green.",2,0,1614896544,ShaidarHaran2
84,gppj3u3,Majority of money the fed is printing is NOT going into stocks.,1,0,1614898051,ahungrylilsandwhich
85,gppjj7y,[removed],1,0,1614898251,[deleted]
86,gppkmeq,The money print that tried to commit genocide of the gay bears has now become nutrition for the gay nears. Bears are now getting stronger and hungrier than ever,5,0,1614898768,Two_trays
87,gpplwio,"Be EXTREMELY careful with leveraged ETFs and read up on how they work before you buy, there are some quirks that can cost you money unexpectedly due to the way the are rebalanced.

Quick example; say you have index $ABC trading at $100 and short 3x leveraged $ABCS trading at $10. Tomorrow, $ABC drops to $90, and the day after, it returns to $100.

Tomorrow, $ABCS is $7 as you probably expect, but the day after tomorrow, $ABCS will NOT be back trading at $10, it'll  be $9.33 and you will have lost 7% due to the volatility of $ABC. If the reason why isn't immediately obvious, then, this is not financial advice, but you might want to do more research into how these things work before buying. (It's because 90 is 10% less than 100 and 7 is 30% less than 10, but while 100 is 11% more than 90, 10 is 42% more than 7, not 33% more.) Leveraged ETFs do better during strong directional motion but they lose more during volatility and sideways action. TANSTAAFL.",2,0,1614899392,ApopheniaPays
88,gppm36f,Because that's where big HF are in the most profits rn.,1,0,1614899486,Chumbag_love
89,gppmv93,"You have done an excellent job at wasting my time.


*I am a bot, and this action was performed automatically. Please [contact the moderators of this subreddit](/message/compose/?to=/r/wallstreetbets) if you have any questions or concerns.*",1,0,1614899870,AutoModerator
90,gppn8yl,[removed],1,0,1614900058,[deleted]
91,gppodgv,"Yeah for sure, its shouldn't be normal that something like a third of my position did at least 300% in the last 8 months. I have some SQQQ just to hedge a little, but I haven't sold any positions.",2,0,1614900622,General_Asleep
92,gppoe5x,Very small rocks,3,0,1614900632,lucidfer
93,gppsxyy,[removed],1,0,1614902954,[deleted]
94,gqaadpv,[removed],1,0,1615257555,[deleted]
