,comment_id,text,score,awards,timestamp,author
0,gpipnbk,"Sir, this is a catnip lounge.

*I am a bot, and this action was performed automatically. Please [contact the moderators of this subreddit](/message/compose/?to=/r/wallstreetbets) if you have any questions or concerns.*",6,0,1614766191,AutoModerator
1,gpipuk3, 🍌,5,0,1614766391,Aware_Rabbit_7046
2,gpiqer1,Yes but the problem is the company also owns all the machines that need to be purchased to replace the broken ones.  So... they are making even more money because they can jack up the costs because of the demand.,1,0,1614766955,Effiebaby1284
3,gpiqf1u,[removed],1,0,1614766964,[deleted]
4,gpirzdb,"as far as I know, terumo Sofia and something by medtronic (two big companies in the game) already produce top products compared to the jet 7 extraflex,",1,0,1614768522,El-Penguin
5,gpj1e3g,"Anything medical is bound to have lawsuits. Why? Because everyone dies, eventually. Grandma or grandpa dies, people are looking for someone to blame (and sue). Disclaimer: I know nothing about their products, but every therapy known to man has 100% failed at preventing a single death. Everyone will die eventually, regardless of medical intervention.",1,0,1614776060,drmskitty100
6,gpl8zf4,[removed],1,0,1614812224,[deleted]
