,comment_id,text,score,awards,timestamp,author
0,gph5ztp,Tendies... tendies for everyone!  Tendies for the people,1,0,1614729770,stonksrgud
1,gph69e6,"Et me $100, I’ll turn it into $1000 and give you back $200",4,0,1614729910,CanadianSweaty
2,gph6ko5,#RKT #SNES,1,0,1614730071,Rare_Imagination_168
3,gph72mq,"Guys. Get your dicks back inside her. GME moans for you. Her lips quiver for you. Her body aches for you. She remembers the last time you had her, you made her legs spasm uncontrollably. Quit stepping out and give her the attention she deserves from you",-3,0,1614730325,Ranyos1
4,gph7m5e,Every slut has a sell by date (confirmed by my wife),-2,0,1614730605,i-dm
5,gph7w0e,UWMC Is only at $10.,1,0,1614730744,Farmsales1
6,gph8nx1,🚀🚀🚀🚀🚀🚀,2,0,1614731140,SnooRadishes3452
7,gph9i9r,"In conclusion, BUY MORE GME",10,0,1614731572,Antweeezyy
8,gphakl1,Made 2200 on 2 calls that cost 400 thanks guys![gif](emote|free_emotes_pack|upvote),3,0,1614732116,Willing_Efficiency_8
9,gphhspa,RKTTTTTT!!!!!,0,0,1614735851,Strong-Fold6965
10,gphpfnv,Lmk if you’re feeling generous :D,0,0,1614739808,MatthewVC_
