,comment_id,text,score,awards,timestamp,author
0,gpg1coj,Their patents alone are worth the bag,4,0,1614711451,anonymous-shad0w
1,gpg28g7,Still an easy 4x or more at this price,1,0,1614711824,trashbinpilot
2,gpg4exo,"So, what's the play? Buy the stock &amp; hold it for eventual gains? Are you thinking LEAPs? Do you anticipate some of what you've disclosed in your DD to be discussed in their upcoming earnings announcement on 3-8 &amp; that spike the price? Should we be looking at 3-9 calls?

Dumb ape dunno how to get banana.",6,0,1614712748,Feisty_Taco_Fox
3,gpg4nkw,I have 227 shares @ 18.50,1,0,1614712850,Helixellfire
4,gpg53vo,"The following is only my opinion - not giving any financial or investing advice:

This company was previously run very poorly, definitely not the case any more. The stock price has been manipulated downward for quite some time now compared to the other players in this space. 

I need to watch what I say so I’ll leave with this. I Bought 6k shares at $1.00 - not selling. Not even close to selling. I wasn’t close at $24. Even today there seems to be a massive short campaign. It can only work for a little while longer. 

Also - again not giving advice just found this interesting, if a stock has an outstanding order that hasn’t been filled it cannot be shorted. So if everyone that held a stock were to put in a sell limit order of say $100 for a given stock on a good til cancel basis, it can’t be shorted and it won’t be sold until the price of that stock reaches $100 or higher. Imagine what would happen if everyone holding a stock did something like this... food for thought. Only my opinion. Be well friends. 🚀",2,0,1614713041,c2kreutz
5,gpg68o6,"Good DD, looks like it hasn’t bottomed yet.",3,0,1614713529,H0llyW00d-J
6,gpg9t1d,"If you ask me the earning announcement will be quite lack luster due to the fact that automotive manufacturers have not been able to get their hands on the samples to determine if MVIS is the company they want to work with. I feel very strongly that once the samples have been delivered early April discussions/partnerships/acquisitions ( big business moves) would pop up not long after that!

&amp;#x200B;

124 shares @ 17.30",3,0,1614715065,maraudingchemist
7,gpgat98,Ape will be patient for banana. 🦍,1,0,1614715499,Feisty_Taco_Fox
8,gpgaxpt,"as an overvalued silicon value trust fund baby, I have to inform that this was a penny stock not long ago.

what's stopping apple or M$ from making their own LiDAR

Or what if Elon is right and LiDAR isn't where its at",1,0,1614715551,towelheadass
9,gpgazaa,Don't share this here goddamn,3,0,1614715570,GrandMarshalEzreus
10,gpgcyzw,"I remember reading last spring that Luminar thought they could sell sub $1k lidar and I thought that was interesting, though to be honest I haven't followed up on it at all.

&amp;#x200B;

[https://arstechnica.com/cars/2020/05/volvo-cars-will-have-lidar-comparable-to-self-driving-cars-by-2022/](https://arstechnica.com/cars/2020/05/volvo-cars-will-have-lidar-comparable-to-self-driving-cars-by-2022/)",1,0,1614716434,antilleschris
11,gpgcz3w,What symbol do I lick,1,0,1614716435,AccomplishedNet8628
12,gpgdeol,Never bet against papa Elon,2,0,1614716620,Arpi576
13,gpgem9v,$MVIS,1,0,1614717130,Traditional-Band-692
14,gpgiul7,Don't tell me what to do,3,0,1614718903,maraudingchemist
15,gpgjlg4,🦍 see red. Stonk going on better sale soon?,2,0,1614719228,Hot_Condition8551
16,gpgjnlo,Why?,2,0,1614719255,Hot_Condition8551
17,gpgk1gk,"4 x 4/16 $25C

400 at $14.39 🚀",1,0,1614719418,Coitus_Mayfield
18,gpgkn0n,I want to see a bidding war for a buyout. All it takes is two leaks or rumours of potential bids and this is off to the races. Everyone will want to be the one to own the patent and license out to other manufacturers,3,0,1614719669,InteractiveBook
19,gpgknbf,Elon is wrong.,1,0,1614719672,GrandMarshalEzreus
20,gpglgi1,I can make suggestions,1,0,1614720010,GrandMarshalEzreus
21,gpgnqpb,This is wrong on so many levels. You must be retarded.,0,0,1614721005,StockAccount9999
22,gpgqpud,This is the best question I've ever seen in my life,1,0,1614722305,ugonlern2day
23,gpgtw3f,"Tesla is the only car manufacturer that thinks they can level 5 self drive without LiDAR, at least within the medium term. Every other car manufacturer has second mover advantage and Tesla is dealing with sunk coast.

""bUT iT's noT a CAr cOmpaNY"" only works if they don't write off the camera derived data lake they've built.

Everyone knows Tesla's tech kills people.  Not a moralistic argument about driving deaths from humans vs. robots because Tesla has probably saved 100x more lives than it has taken (insert Joker meme about it all being part of the plan). Cameras have a problem that current computing cannot solve... LiDAR does.

I'm not buying $MVIS or $TSLA at these prices",1,0,1614723770,HumbleHubris
24,gpgtx78,"Because they were going say ""I'm NoT dOnE fIlLiNg My BaGs YeT"" like this stock hasn't been discussed heavily on other parts of Reddit",2,0,1614723785,TickleRevolution
25,gpgul7o,Are they dealing in solid state LiDAR?,1,0,1614724105,NewAltProfAccount
26,gpgvdpk,Elon uses Lidar on his rockets. Also MVIS has many different avenues to grow besides Apple and M$ looking into them.,1,0,1614724481,Kellzbellz8888
27,gpgx0uw,[removed],1,0,1614725270,[deleted]
28,gpgxlpq,"Na just don't want you apes in my stonks,  you'll give it a bad name",1,0,1614725544,GrandMarshalEzreus
29,gph1bu2,Look at what happened to PLTR  :'( don't want the same to happen to my mavis,1,0,1614727388,GrandMarshalEzreus
30,gph5j2p,"This is a serious stock. The DD on r/MVIS will make your dick fly off.

3200 shares @ $12.45",2,0,1614729533,awesomedan24
31,gph92tb,"Are you aware of how it became a penny stock? It was all shareholder approved and openly communicated as part of a company strategy. New management came in to turn the company around and the dilution was necessary to pick up the pieces of what they were dealing with from previous management and create a viable runway. It doesn't change the fact that they have incredible tech, patents, and talented engineers.",1,0,1614731352,stopearthmachine
32,gphct1r,"Nothing, but other companies that make LiDAR are years behind MVIS and it isn’t really a technology you can just made in a few months time. By the time any other company could catch up, MVIS would already be leaps and bounds ahead once again. Apple is also notorious for buying out small companies too.",6,0,1614733270,SuggestiveAmoeba5
33,gphcxra,How did you find them back when they were a Penny stock/at $1?,2,0,1614733339,SuggestiveAmoeba5
34,gphgr90,Buying 70 shares on open. This tech is gonna be essential in the EV race of 2021/2022.,4,0,1614735317,excitedpeanut89
35,gphhkcu,Day drinking and I thought they did something completely different than they do,8,0,1614735734,c2kreutz
36,gphiewv,Alcohol is a solution,4,0,1614736165,SuggestiveAmoeba5
37,gphzlx8,I hold this In my IRA. LONNNNNG,2,0,1614745225,LibrarianSame
38,gpi68tn,Read the DD!,1,0,1614749452,Hopeful-Worker4640
39,gpiiwh3,Where’s the place to go to find actual advice and information? I just need a couple grand to fix my teeth :(,2,0,1614759715,FriendlyFort
40,gpim6cj,"Yep it's a cult over there alright, they will make anything mvis even if ain't",0,0,1614762821,Kentuckychickennow
41,gpim9s2,We had been hearing about alot of companies looking at them with no outcomes really,1,0,1614762915,Kentuckychickennow
42,gpio74s,"Wsb and all the stock forums on Reddit aren't a bad place to start but you should do your own DD after that, not financial advice.

Also, sometimes I find stocks just by looking at what's moving up or down, finding out what they do and if they are a good price point. I find some accidentally.

Others you can find just from products you know.",2,0,1614764778,GrandMarshalEzreus
43,gpj2q3n,Elon musk is not a fan of LIDAR and TSLA does not use it.,0,0,1614776922,Wackelkontakt_
44,gpj4bvs,"Holding 30 @ 21, patiently waiting for y'all to come pick me up again.",3,0,1614777894,CalligoMiles
45,gpkethu,Same. I just bought 20 more @ $16.00 to lower my average.,1,0,1614798919,Joksan24
46,gpm81if,MVIS doesn’t just do Lidar. Their technology is being used in the Microsoft Hololens currently,1,0,1614830618,NodnarbGrdn
47,gqa59py,"I read that for cars like Teslas that use cameras and computers to analyze the cameras input to determine actions, it costs much less to install a bunch of cameras and run the software. Whereas with LIDAR there are limitations to the capabilities, and it costs a lot more to implement LIDAR sensors into the cars. I understand Microvision has created cheaper LIDAR systems, but it seems that visual-based systems are still superior.
https://towardsdatascience.com/why-tesla-wont-use-lidar-57c325ae2ed5

EDIT: Its not just this-or-that. Teslas use radar and cameras together since cameras suck at seeing shit far away, so the radar takes on the long-distance seeing. LIDAR is gonna be superior to radar in that regard, but again it comes down to a cost analysis - if lidar is more expensive then it makes sense to just keep using radar if there isnt that much of a benefit.

But just because LIDAR isnt the best device to use right now for cars, doesnt mean there isnt an application for this tech. Industries that use LIDAR  include: agriculture, astronomy, agriculture, climate change, land management, land mapping, oil and gas exploration, meteorology, renewable energy, robotics, tsunami warning systems, and I'm sure a bunch of other shit.
https://blog.cloudfactory.com/interesting-lidar-applications",1,0,1615254750,gwardyeehaw
48,gqa8h7m,"LIDAR is best for long-range because cameras dont do well for long distance objects. So a combination of radar and cameras are implemented in Teslas, however if LIDAR are now affordable then a combination of LIDAR and cameras would be the ideal pairing. 
https://medium.com/0xmachina/lidar-vs-camera-which-is-the-best-for-self-driving-cars-9335b684f8d#:~:text=LiDAR%20requires%20much%20more%20data,probably%20won't%20be%20sufficient.",1,0,1615256517,gwardyeehaw
49,gqb9xmo,[removed],1,0,1615284593,[deleted]
50,gqhvmak,We’re coming bro!,2,0,1615411913,GreatGoogelyMoogly
