,comment_id,text,score,awards,timestamp,author
0,gpk2se8,Seems like OP is way overleveraged and crying about being a diamond handed ape.,2,0,1614793725,BlackDumbbell
1,gpk2xoz,"This aged gracefully. 5 hours later, it’s down over 30%. 💎🦍",1,0,1614793788,Reich_and_Gravy
2,gpk3aub,LMAO. The more I dig this thread the more retarded OP becomes.,3,0,1614793943,BlackDumbbell
3,gpk3g2v,"Reddit kind of stops working at a certain volume of submissions. There ends up being large patches of stuff that people don't bother to wade through. 

You need to trim out everything that isn't kosher rules-wise automatically if you can, and then mop up the rest and rescue the non-spam.",13,0,1614794006,zjz
4,gpk3pdu,"Ok, then I wish I could make a settings change that feeds me the info I'm looking, such as what I've been doing for the last month, which is to find other stuff besides gme. Thats all I'm saying, I like the up/down vote system, I just don't like being left in the dark when I'm already in the sub.",3,0,1614794114,Rhapsody_85
5,gpk43kq,"We will pick you up, brother.

Maybe

Is 50/50 we either save u or we don't",-1,0,1614794283,admiral_asswank
6,gpk44u5,"Honestly, thank you. That helps, I just wish the system was a little more intuitive, getting down to bottom takes a lot of time, and I dig into DD sources, going through all of that each day is a fucking job. Just saying.",2,0,1614794298,Rhapsody_85
7,gpk47ey,The hero we didn't deserve,1,0,1614794329,I-Beat-a-Drum
8,gpk4e1n,Absolute QUEEN,1,0,1614794408,djrm911
9,gpk4mhc,You're a homie. Thanks for all you do,1,0,1614794507,drubiks_cube
10,gpk4qsm,"I’ve been having a feeling like something important is going down this week. Idk why. This is the first post I’ve seen provide some evidence for this week let alone mentioning this week at all. If it doesn’t happen, I’ll hold for longer. One thing is for sure though, the pressure on GME is building. HODL",0,0,1614794558,DuckNumbertwo
11,gpk4yyi,10k off 1 $300 call isn’t exactly getting played. Your tunnel vision is playing you.,1,0,1614794658,RhoidRaging
12,gpk5fma,"Eat my dongus you fuckin nerd.

*I am a bot, and this action was performed automatically. Please [contact the moderators of this subreddit](/message/compose/?to=/r/wallstreetbets) if you have any questions or concerns.*",1,0,1614794857,AutoModerator
13,gpk5fli,"The ""no more gamestonks"" and then a fucking sticky promoting RKT megathread in a damn GME megathread was  clear as day fuckery.  The sticky stayed up!  Wtf is that?  RKT was a legit play, grats on people who made bank (fuck you).  That being said, who the fuck sticky's a post about a stock in an unrelated stock's megathread?  When has that ever been a thing?  RKT is actually a good long play, but yesterday's action and today's selloff was clearly a pump and dump. Those who sold gme and didn't get out of RKT in time learned a painful lesson.  It sucks but it's happened to us all at one point or another.",0,0,1614794857,At0micJunk
14,gpk5pj4,"You know there's a search function on subreddits, right?",2,0,1614794976,Dr_on_the_Internet
15,gpk5rhc,"&gt; Reddit kind of stops working at a certain volume of submissions

Agreed, but that's not specific to reddit.  Every community, grown to a certain size, becomes shit.  Whether it's by inclusivity and not offending anyone becoming more important than the original point of the community, or by newcomers co-opting the community for their own gain, or by bad actors maliciously disguising themselves among the new crowd, they're all shit.

This is why I said gatekeeping is necessary.  There is no return path.  You can not return to the good times.  Once a community is big enough, it's irreversibly fucked.

&gt; You need to trim out everything that isn't kosher rules-wise automatically if you can, and then mop up the rest and rescue the non-spam.

No, you need to jump ship.  Make your own new community with more hazing and gatekeeping.  Spending time trying to bail shit out of a sewer is retarded.  Spending _money_ doubly so.",-3,0,1614794999,Asdayasman
16,gpk5ri8,"You have done an excellent job at wasting my time.


*I am a bot, and this action was performed automatically. Please [contact the moderators of this subreddit](/message/compose/?to=/r/wallstreetbets) if you have any questions or concerns.*",4,0,1614794999,AutoModerator
17,gpk5w53,!pekofy,1,0,1614795055,Asdayasman
18,gpk5z1f,Citidel is charging up for GME payoff and oh boy did RKT net a windfall.,3,0,1614795090,At0micJunk
19,gpk6cf9,"I totally agree with you, most social medias, even news these days take into account your so called ""preferences"". Personally I dont want tailor made news that align with my values, I want the entire picture! So I can form my own rational opinion. Preferences only facilitate towards echo-chambers and disInformation. &lt;-- my opinion.",5,0,1614795252,Nosp1
20,gpk6x2o,Way to go. I enjoy all the nonsense -back and forth but just sitting here with my little bag- 10gme @ 341. I’m glad people are able to make money tho good job all!,1,0,1614795497,Gabbertlips
21,gpk7176,When gme actually short squeezes - this sub will be a casualty of it.  The moderators clearly don’t want that. Not too complicated.,0,0,1614795546,kAALiberty
22,gpk75al,Didnt rocket just destroy earnings.......,0,0,1614795595,BxBxfvtt1
23,gpk78kh,If the next one is APES or BANA we’ll be on to them for sure!,1,0,1614795634,mellymay313
24,gpk7a8t,I first read I thought it said donuts. Now I’m disappointed.,4,0,1614795654,tammigirl6767
25,gpk7c87,[removed],1,0,1614795678,[deleted]
26,gpk7che,Sort by new?,1,0,1614795681,lxnch50
27,gpk7eav,[removed],1,0,1614795703,[deleted]
28,gpk7fln,[removed],1,0,1614795719,[deleted]
29,gpk7w29,Too many emotional and political people with name_othername_123 accounts.  The sub is kill since membership went up 3x.,1,0,1614795914,ekjohnson9
30,gpk8lfi,Still doesn't address why quality GME DD is being deleted.,1,0,1614796211,tweedchemtrailblazer
31,gpk8rlh,Jet fuel can't melt steel beams,0,0,1614796285,The-Dirty-Dave
32,gpk90qc,The final solution is also the funniest: ban GME threads.,1,0,1614796393,almostalliteration
33,gpkaath,"Yeah dude I’m pretty sure you’re letting your emotions cloud your judgment. I’m not saying that you’re a bot. I’m saying that bots pumped the stock and citadel has gained handsomely from it in the exact same way that happened with silver. You do you, make your money. Relax.",1,0,1614796945,Adamapplejacks
34,gpkaj7m,I have gt5 on my ps3. Maybe i should play it,1,0,1614797047,SantasButhole
35,gpkaouz,"Sentiment perished on BB because they expect gains in 2-3 years. Now that everyone has bought in, it's a sit and forget scenario",1,0,1614797116,Allmightydohllah
36,gpkaqlc,i like your attitude,1,0,1614797137,GraharG
37,gpkb979,"Media breaks are very required these days. Straight up turn off your phone for a day or two so you have one less method of being ""constantly conmected"".",1,0,1614797362,tyrghast
38,gpkbbx3,"Yeah, but why would people want to buy fractional shares when they see more affordable tickets being lauded as “the next GME” and experiencing rapid increases in share price?


It’s all part of their plan, mate. Dilute the retail buying power by pointing at shiny objects...


Silver was a diversion.
Weed stocks were a diversion.
AMC was a diversion. 
RKT is a diversion.",1,0,1614797395,Bit-corn
39,gpkbnj1,"&gt;	Silver was a diversion. Weed stocks were a diversion. AMC was a diversion. RKT is a diversion.

This is not a deep state conspiracy, dude. None of those are diversions. They are alternative investments. They exist on their own accord and value. You are looking for the evil bad guy pulling the strings to take the eyes off GME. It's not real. Don't delude yourself thinking there is only one stock to buy. You are missing out on hundreds if not thousands of other opportunities by being so short-sighted.",2,0,1614797534,Warfaxx
40,gpkbzt8,I have seen this in relation to GME for some time. I use the WSBnew and GME subreddit bc the moderation here is obviously sketchy,0,0,1614797678,SnooRobots8901
41,gpkchyr,"Lmao, yes, other stocks surely do exist. But, I was specifically speaking to the ones that media portrayed WSB as directing “their” attention to. 


Remember the “WSB now takes aim for silver squeeze” bullshit reported on the media? Sure, there were a few posts about it, but that didn’t really happen here. 


Clearly, you’re just going to call me a tinfoil head, and that’s fine, but if you think that institutions aren’t actively attempting to manipulate retail buying power on this subreddit after all of the shady shit that went down here, then your head is in the sand.",3,0,1614797899,Bit-corn
42,gpkcn28,"I love u/zjz. It is the best mod I never knew about till now, but now, I love him.

Bro, I luv you!",1,0,1614797963,Salty-Layer-4102
43,gpkcr78,Thank you for communication and I hope people can and will understand where this is going . Stay Long 🍺,0,0,1614798013,iceburg1010
44,gpkcyfi,This subreddit has zero sway in the market. Don't think we're more powerful than we are.,1,0,1614798102,Warfaxx
45,gpkd2tq,Something really isn't right when tools make retarded posts like this. Go back to qanon you fuck.,-1,0,1614798154,Usual_Network_8708
46,gpkd38x,"""Nothing to see there, move along!""",1,0,1614798159,Crowbar_Freeman
47,gpkd4uc,Called it,3,0,1614798178,Effective-Camp-4664
48,gpkd819,"Admiral, you've been demoted to Vice Admiral. Please don't take this the wrong way, you're just not acting like that much of an asswank right now.",1,0,1614798217,byndr
49,gpkdebl,"Y’all mother fuckers better apologize to zjz. 

GME will moon but you gotta have patience. Be kind to the mods.",2,0,1614798295,Ok-Pitch8482
50,gpkdhhn,"Eat my dongus you fuckin nerd.

*I am a bot, and this action was performed automatically. Please [contact the moderators of this subreddit](/message/compose/?to=/r/wallstreetbets) if you have any questions or concerns.*",1,0,1614798334,AutoModerator
51,gpkdhgu,100% with you bud. Couldn't believe they stickied rhawkt so quickly and with such little dd.,0,0,1614798334,kelsier24
52,gpke9ng,[removed],1,0,1614798678,[deleted]
53,gpkefa8,"$GME, I tried to buy in for twice as much with margin on Robinhood and they wouldn't let me.  Very suspicious!

Oh and the guy that wrote the article above is long and boring.",1,0,1614798747,EasternPrint8
54,gpkefq4,An illusion?! What are you hiding?,1,0,1614798752,curtlikesmeat
55,gpkfa4i,Why are there 171 deleted replies? And the only comments remaining are comments fawning over zjz. It just looks really weird,1,0,1614799120,GettinCarsLikeSimeon
56,gpkfiky,someone big mad they bagholding,3,0,1614799220,Bmagic_
57,gpkfkm6,This is really gay,1,0,1614799244,GettinCarsLikeSimeon
58,gpkfkqu,Buy gme,1,0,1614799246,Vankyer
59,gpkfloc,[removed],1,0,1614799257,[deleted]
60,gpkfme7,[removed],1,0,1614799265,[deleted]
61,gpkfryn,ZJZ FOREVER!!!!!,1,0,1614799332,Runner20mph
62,gpkhafb,"You tell them buddy, it was hard to run mod duties with a million subscribers, now add another 8 to that, and it is damn near impossible. There will always be complainers, just keep doing what you already do.  I appreciate your hard work and the bots you have made are goddamn brilliant. Fuck anyone who says you don't have the best interest of the community in mind while making decisions.",1,0,1614799975,emfry821
63,gpkhda6,[removed],1,0,1614800007,[deleted]
64,gpkhg5r,"Maybe they felt ashamed and ungrateful for the work zjz puts into this sub, especially after his reply. That would explain the toneshift you mentioned. Not everything is a conspiracy.",0,0,1614800041,Bananplyte
65,gpkhnfz,"'1500 isn't outlandish'

🤣🤣🤣",2,0,1614800129,geneticanja
66,gpkhpjs,"I'm literally green, but whatever you tell yourself.",0,0,1614800153,admiral_asswank
67,gpkhsks,good bot,1,0,1614800188,kdods22402
68,gpkhwg0,"Asking a question isn't QAnon.

Nor is accepting the answer.

Nor is apologising for misguided sentiment.

See, this is why letting people use this slant is dangerous for wsb.",1,0,1614800233,admiral_asswank
69,gpkhz83,"Why are you mad? 

I saw tons of RKT posts.  I just sort out GME.",2,0,1614800265,Sen_Hillary_Clinton
70,gpki4ai,"Amen. 

This subreddit used to be very very flavorful. It still is, you just have to look.",2,0,1614800325,Sen_Hillary_Clinton
71,gpkiezh,[removed],1,0,1614800452,[deleted]
72,gpkiyfn,"You are amazing.

Now, where the fuck are all these deadbeats? How TF can you possibly be 6th from bottom when I see you doing a ton of the heavy lifting?",2,0,1614800685,jscoppe
73,gpkj9av,Not everything is a conspiracy you fucking apes,3,0,1614800816,itsjuicyjason
74,gpkjg1g,eh idc about the totem pole if I trust it,3,0,1614800896,zjz
75,gpkjhus,"I don't think it's sketchy.

I think it needs to have careful consideration of the volatility and power of the subreddit it has.

There's a lot of misinformation and poor information floating around. There's a LOT of money moving around. There's a LOT of group psychology at work here.

This needs a really steady and calm hand at the helm at all times... and yesterday I felt it wasn't substantial. They perhaps disagree. But... Well. Today seems markedly more tepid. Not because of my post! But because of better preparedness.",1,0,1614800918,admiral_asswank
76,gpkjzi9,.. why the fuck is “squazozzle” a thing now? I hate it so much,1,0,1614801131,whatwhatj
77,gpkl1wy,"So they're still raising capital, almost making it seem like they need to front the bill and not DTCC. Opinions?",0,0,1614801591,the_ssotf
78,gpkld0z,I’ve been thinking the same about this week and the chart supports it. Sharp jump then strong steady support for a few days before a sharper jump - same as late January. We are possibly days or even hours from this thing flying.,0,0,1614801725,CockBoySlurpie69
79,gpklwsh,Stopping by to say thank you for your time and effort.,1,0,1614801966,ChalkDinosaurs
80,gpklyzk,We're supposed to be making money? Fuck me...,1,0,1614801994,stompadillo
81,gpkmdst,"You're extremely appreciated &lt;3 Can't wait for the whole GME squeeze thing to be over. Don't get me wrong, I'm literally all in in GME, but I can't wait for the thing to just be over and wsb to be back again.",1,0,1614802174,Geamantan
82,gpkmnf9,[removed],1,0,1614802292,[deleted]
83,gpkmqci,More than one squeeze in the market. More than one stock in the market...no conspiracy just shift of interest.,2,0,1614802328,Abject-Mixture-8926
84,gpko4z1,"You're chatting with someone in a downvoted loop.

This just makes me trust you more.",0,0,1614802943,TheTangoFox
85,gpkod6q,"This may be a dumb question but that's never stopped me before: I assume mods are allowed to own stocks (but now that I think of it that may actually be an issue) but are you allowed to create or weigh in on posts about certain stocks? Like, is there any regulation or stipulations for mods, even though you are volunteering?

Also, I understand OPs point but he doesn't speak for everyone, there are those of us who have, and will continue to give you the benefit of the doubt.",1,0,1614803043,chef_in_va
86,gpkojx4,Good bot,1,0,1614803123,chef_in_va
87,gpkp0oh,I don't think there's actually any legal problem with me making a DD post but I've never felt compelled to.,2,0,1614803326,zjz
88,gpkp3iz,"This is probably gonna drown but I still want to thank you. Also the mod team in general but specifically you. When you left the quality of the entire sub was ass and I while it's still pretty much a GME-only sub (due to other topics getting bombarded into nothingness unless using the search function) it has become much, much better.

If everyone who appreciates your unpaid work for this shitshow would thank you every single time you'd probably run out of ""Sucks mod cuck"" flair to assign. But a lot of people I've been chatting in DMs with, mostly people from the sub 2 mill users time, really appreciate what you do. This sub could be used for mod gains but there's a lot of people still out there who have seen that before, would spot it again and get it shut down fast if needed. 


So: Thanks! Thanks for your work and taking the shit flung at you regardless what you do.",1,0,1614803361,F1remind
89,gpkp92v,"&gt;It wouldn't be bad if the mods occasionally rallied positive moral and reminded people they're on our side.

But this isn't really why they're here. They should be, and for the most part have been, focused on enforcing the agreed upon rules of the subreddit. They aren't the leaders of the sub, they are the zookeepers making sure us apes don't throw shit in each other's eye... So to speak.",1,0,1614803428,chef_in_va
90,gpkph28,He’s probably not old enough to get a beer to crack,3,0,1614803525,Skwink
91,gpkplxp,[deleted],1,0,1614803583,[deleted]
92,gpkpmmm,[removed],1,0,1614803591,[deleted]
93,gpkq69x,WSB still compromised,1,0,1614803828,ilikeasianbooty
94,gpkqan6,"I hope you wouldn't have any legal issues but if I were a well-known mod, in a sub that is getting a lot of attention, I wouldn't risk it. Although you might get invited to do a Zoom with DFV, Vlad, etc.",2,0,1614803881,chef_in_va
95,gpkqzan,"If y’all need any help, I have lots of free time. Nothing necessary except to continue letting me eat crayons",1,0,1614804176,Inaccr0chable
96,gpkqzye,[removed],1,0,1614804184,[deleted]
97,gpkr5a9,"what’s this all about? 

https://www.removeddit.com/r/wallstreetbets",2,0,1614804248,eula325
98,gpkr5fh,"Joined a year ago, you're great, and you give off no conspiracy vibes at all. 

Don't let people get to you.",1,0,1614804250,democritusparadise
99,gpkr65m,"That said, looking at what has been removed from the sub in recent weeks is very suspect. 

https://www.removeddit.com/r/wallstreetbets",1,0,1614804259,ARhinoLearns
