,comment_id,text,score,awards,timestamp,author
0,gpfsydk,Just buy at least one share and hold. You won’t be disappointed.,6,0,1614707845,Kboss777
1,gpft440,"Buy high,  sell never.",3,0,1614707913,CiciliaCNY
2,gpft5em,I’m a good man. Here’s a report: go fuck yourself. Enjoy.,5,0,1614707928,HankScorpioGlobexLtd
3,gpft9o0,Look up uncle Bruce talks about gme,2,0,1614707978,Current-Confident
4,gpft9ky,Buy stock. Dont sell. Lose money. Enjoy memes. Buy something nice for your wife's boyfriend. Lather rinse repeat.,2,0,1614707978,ByTheWay101
5,gpfta6e,Idiots with more money than sense manipulating a stock to screw over short sellers but then refusing to actually bother cashing in.,2,0,1614707985,Hatecraftianhorror
6,gpftaqd,"Buy stock,
Eat crayons ,
Wait for launch to the moon ,
 Btw I like the stock",1,0,1614707991,bluenosecam
7,gpftkme,Take your money and buy tocos! I like tocos,1,0,1614708110,I-ride-my-motorcycle
8,gpftvlr,"Here you go, summary of this week top voted DD posts https://www.reddit.com/search?q=gme%20flair%3ADD&amp;sort=top&amp;t=week",1,0,1614708244,Obvious_Equivalent_1
