,comment_id,text,score,awards,timestamp,author
0,gpp6vnv,Are you deadass B? What is this fuckery,1,0,1614892531,EnergyMatrix
1,gpp6w9f,"Suddenly feeling bullish on *The Cat in the Hat* and *Pontoffel Pock, Where are You*",44,0,1614892538,JB4GDI
2,gpp6wip,What are books?  Those the ones that are like little boxes that you open and has all those pictures that don't move or talk?  My parents had some of those I think.,2,0,1614892541,Ok_Entrepreneur_5833
3,gpp711k,"This is the most retarded thing I've seen today.  Well done.

Now I just gotta figure out how to buy calls on racist books...",72,0,1614892594,ShakeweightPro
4,gpp73mt,[removed],0,0,1614892626,[deleted]
5,gpp76y5,How do you sell them after they've been banned? I have one of the Dr Suess but ebay deleted my listing,16,0,1614892666,Severe-Pie-8148
6,gpp7fvj,"Any book that goes out of print can be really valuable. Take for instance, the kids book my mom read to me as a kid that went out of print, The Tall book of Make Believe. Still love it and wont ever sell it when i finally get possession of it, but the fuckin thing is like $425 for one thats beat to hell.",3,0,1614892775,N3UROTOXIN
7,gpp7t2q,"I sold all my GME to buy more copies of ""The Friendly ****** That Couldn't Stop ******* ****s"". It was my favourite book as a kid so I was feeling pretty bullish anyway, but I love the DD, thank you.",22,0,1614892935,DouglasReynholm2018
8,gpp83zo,Green eggs and ham. But you didn't hear that from me.,2,0,1614893065,Mobile_Junket1763
9,gpp8ik3,[removed],1,0,1614893243,[deleted]
10,gpp8mgp,Actually thinking these books are racist is the most retarded thing *I’ve* seen today.,28,0,1614893289,Ssuuddssyy
11,gpp8qub,This is the exact kind of bullshit I came here for.,94,0,1614893341,goochisdrunk
12,gpp8s8u,[removed],0,0,1614893359,[deleted]
13,gpp8toq,I love this level of autism. What are your book positions op?,21,0,1614893376,Quinnteligent
14,gpp93jd,This is the way,6,0,1614893498,Gbear831
15,gpp94ig,"Probably just wait a while for the sentiment shift.  ie, eBay deletes cat in the hat listings now because it's woke and trendy, but there's active listings of people selling original copies of Mein Kampf for hundreds of dollars.",16,0,1614893510,poorlyimplemented
16,gpp956i,[removed],1,0,1614893518,[deleted]
17,gpp9bar,[deleted],1,0,1614893593,[deleted]
18,gppah16,You have obviously never read One Fish Two Fish Red Fish Blue Fish,7,0,1614894100,wolfofwallstreet0
19,gppawut,Did you seriously spend all that time putting all those letters and numbers and words and lines and colors together? Did you use crayons? Just when I thought I’ve seen the dumbest shit possible you go and completely come up with the most amazing thing I’ve ever seen. Too bad I can’t read so I drew a few things with my crayons and I’m holding GME and buying Dr. Seuss books. Wife’s boyfriend approves.,5,0,1614894292,mfbawse
20,gppb7pk,Did someone say gourd futures?,5,0,1614894424,kingme805
21,gppbava,I have all of them. Mother fucker.,9,0,1614894463,sforpoor
22,gppcbgb,I am financially ruined (Dr. Seuss Book Futures),10,0,1614894912,roaf66
23,gppcbgy,"Nope, totally have. As an Asian American i just can’t help but laugh at the outrage cultures 2021 version of book burning and victimization Olympics.",25,0,1614894912,Ssuuddssyy
24,gppdj6o,"I'm with ya. It's a complete joke. Just need to find the next cancelled thing so I can cash in.

I just scrolled through 100s of beanie babies but unfortunately don't have a good eye for what's going to be considered racist",15,0,1614895455,wolfofwallstreet0
25,gppdvbg,[removed],1,0,1614895609,[deleted]
26,gppe0xe,[removed],1,0,1614895678,[deleted]
27,gppe1xo,[removed],1,0,1614895690,[deleted]
28,gppebrw,[removed],1,0,1614895810,[deleted]
29,gppefd8,[removed],1,0,1614895855,[deleted]
30,gppesul,I purchased 2 tons of Dr. Seuss books and I'm financially ruined,6,0,1614896022,discountedeggs
31,gppeyeb,WSB will now be WallStreetBooks,22,0,1614896093,Rebelsquadro
32,gppfoz2,Finally some relevant DD 📚🔥🚀,9,0,1614896433,And1ageek
33,gppi83e,This book is racist? Or am I getting whooshed?,2,0,1614897626,NewAltProfAccount
34,gppifyj,[removed],1,0,1614897730,[deleted]
35,gppiwzf,"Yeah, it's a joke... Big whoosh",3,0,1614897960,wolfofwallstreet0
36,gppk7pc,Ebay = NYSE 2.0,3,0,1614898573,wacckowb
37,gppmtww,What society was ever on the right side of history that banned books? The lunacy continues.,8,0,1614899851,sploot16
38,gppneh6,"They made a movie out of if too.  Everyone need to scoop up all the VHS tapes!

[https://www.imdb.com/title/tt0113419/?ref\_=nv\_sr\_srsg\_0](https://www.imdb.com/title/tt0113419/?ref_=nv_sr_srsg_0)",3,0,1614900135,epsho
39,gppno6g,"https://images.app.goo.gl/estb37FKKdkcEiXx6

Here ya go",8,0,1614900269,piemancer112
40,gppnwld,[removed],1,0,1614900388,[deleted]
41,gppo43b,Making wsb great again,4,0,1614900494,stagenamelaser
42,gppqgnw,Books??,2,0,1614901677,LMNOP-MD
43,gpps5vv,This is why I buy every racist book I come across.,4,0,1614902552,Finderskeepers91
44,gppuf85,[removed],1,0,1614903698,[deleted]
45,gppuohk,You’re trying to predict what the mob will get pissed about next? I think you’ve got better odds buying FDs.,2,0,1614903828,SamuelBrady
46,gppuyab,We can sell them on silk road along side the rocket launchers and kilos of heroin,9,0,1614903964,0Bubs0
47,gppvez4,Holy fuck you beat me to it,3,0,1614904199,Ssuuddssyy
48,gppvlqy,"Twas literally the second image on the Google search of ""racist beanie babies""",3,0,1614904293,piemancer112
49,gppw4hg,"Man, something I don’t Google enough it seems",3,0,1614904563,Ssuuddssyy
