,comment_id,text,score,awards,timestamp,author
0,gphl8ja,Stop. My penis can only get so erect.,5,0,1614737633,tax_dollars_go_brrr
1,gphlazm,"Or there is a .00001% this extremely highly speculative comment is wrong (it’s gotta be right if it’s viral on WSB), and she has no idea what the fuck is happening. This could remain a mystery to her forever. Like 10 years from now, someone tells her, remember that one day your LinkedIn got 1 million views in 24 hours? That was WSB. Should have known.",3,0,1614737668,PatGbtch
2,gphlbg3,Wait...we still have linked in accounts?  What is this...200!?!?,1,0,1614737674,NefariousnessEast721
3,gphlbyf,Wait... So the tweet isn't about frog day and Mcdonald's happy day where they serve free ice cream? Which happens to be on the 20th and there was a DD floating around here saying that the rocket take off is anywhere from March 15- March 19th.,1,0,1614737682,cryplewalk
4,gphlcvw,MY JAW JUST DROPPED LITERALLY,1,0,1614737695,Dramatic-Routine-919
5,gphlden,"Ugh, I hate and love you at the same time. Take my 2k",2,0,1614737703,Pragmatical_One
6,gphldjh,Cuz it looks like a rocket,38,0,1614737705,MyMyHooBoy
7,gphlfd9,I kinda thought that it could just mean shamrock shakes are back ¯\_(ツ)_/¯,3,0,1614737730,ikebenson
8,gphlfpj,Diamond hands babyyy,7,0,1614737735,Schnitzelman21
9,gphlgv8,Target LOCKED. Now I know what to spend my RKT winnings on,2,0,1614737752,F0urTheWin
10,gphlhyg,[removed],1,0,1614737767,[deleted]
11,gphlip4,"I mean, Cohen brought top talent from Amazon and Chewy. I don't think Hand joining GME is outside the realm of possibilities.",2,0,1614737776,Veloster_Raptor
12,gphlkja,[removed],1,0,1614737803,[deleted]
13,gphllyt,This!,4,0,1614737824,jetatx
14,gphlm5a,"You son of a bitch, I'm in!",8,0,1614737826,EldukayEQ
15,gphlojy,Thank you sir,1,0,1614737860,TheOlGripNSip
16,gphlr8u,"Crammmer won’t sleep tonight.
BoooYa!",19,0,1614737899,magajeff
17,gphlrom,Bought 5 after hours before reading any comments...  Am dumb 🦍.,1,0,1614737905,Reeks_of_Theon
18,gphlu2a,"Diamond hands, duh.",2,0,1614737940,VtechX
19,gphlucw,keeeenaaan kkk eee naaaaaan keeeeeeenaaaa ----- awwwww here it goes!,3,0,1614737944,jetatx
20,gphluvr,Yep lol,3,0,1614737951,Perryswoman
21,gphlvli,"Im am one wife over from a yolo...

But 100k for my handful of shares will suffice",1,0,1614737961,TheIrishJohn
22,gphm4i2,Is there any explanation why the volume was so high?,3,0,1614738087,ur_wcws_mcm
23,gphm4pm,Dammit! Just yesterday I was eating my ice cream cone and saw a frog whilst eating it. I was expecting a call from Mr. Cohen any day now ....,2,0,1614738090,ljgillzl
24,gphm5yh,"I held GME from 6, sold at 483, not sure how, me retard. Don’t worry, got it back at 50. I get how you feel.",1,0,1614738108,VtechX
25,gphm6bv,"There is also the possible Ribbit Capital link no-one mentions.

[https://www.businessinsider.com/ribbit-capital-fintech-investor-robinhood-coinbase-affirm-2021-2](https://www.businessinsider.com/ribbit-capital-fintech-investor-robinhood-coinbase-affirm-2021-2)",4,0,1614738114,Noderpsy
26,gphm6p9,"Ann Hands, like DiamANN FUCKIN HANDS???",1,0,1614738119,mattwayne1209
27,gphm7k3,[removed],1,0,1614738132,[deleted]
28,gphm9wn,Fuck it I'll buy _________,1,0,1614738165,lazy_herodotus
29,gphmaxp,"I have personally worked for Mrs. Hand. It was the best work experience I have ever had. There are normal-jobs, and then their are Hand-jobs.",48,0,1614738180,ljgillzl
30,gphmcxh,😂😂😂 depends how good she is with those 💎🤲,3,0,1614738209,HiveMind1000percent
31,gphmerk,I googled and it was a milf handy video?,2,0,1614738236,MexicanShitKitchen
32,gphmf7z,International frog day is the 20th 🐸,2,0,1614738242,markerAngry
33,gphmfbt,"I’m mildly retarded, can someone educate me please. Is he saying that frog ice cream company stonks magically turn into gamestoinks  if there’s some kind of acquisition?",1,0,1614738244,FrakeJedderson
34,gphmgyz,Indeed it is 😁👍,2,0,1614738267,Recipe_988
35,gphmk2u,Instructions unclear. All in on Boeing.,5,0,1614738312,c5dm
36,gphmkjd,"https://www.volitioncapital.com/news/portfolio/chewy/

scroll down to fun facts section

“Chewy’s first official board meeting included two slides, a lot of laughter, and a trip to McDonald’s for soft serve.”",5,0,1614738319,dfordesign
37,gphmlt4,in for 50 at market.,2,0,1614738337,jetatx
38,gphmm5r,Exactly.  Im lost. What am i supposed to buy. Im just a dumb ape looking for nana's,1,0,1614738342,irResponsibleApe89
39,gphmnf8,This is the most retarded thing I've seen. I'm IN!,3,0,1614738361,Maxamillion-X72
40,gphmnr5,[removed],1,0,1614738365,[deleted]
41,gphmok5,Right.  Anyone vetted in this industry got the tweet.  Shows how retarded for real the overwhelming mass of this community really is. Ha.,1,0,1614738377,Itchy_Craphole
42,gphmokb,Right.  Anyone vetted in this industry got the tweet.  Shows how retarded for real the overwhelming mass of this community really is. Ha.,-3,0,1614738377,Itchy_Craphole
43,gphmqeh,Fuck it I’m in,1,0,1614738403,TissueTar
44,gphmqrx,What stock,1,0,1614738409,Ogd_21
45,gphms6t," I'm not superstitious, but I am a little stitious",3,0,1614738428,rfd007694
46,gphmv2w,Too keen 4 u lol,1,0,1614738470,Quick-Raise8119
47,gphmvcb,Also makes sense why he specifically did an McDonald’s ice cream cone and not any other McDonald’s item. You hold an ice cream cone in A Hand.,19,0,1614738473,stop-man-bear-pig
48,gphmvsi,I've got my buy order in for the morning. Hope it doesn't gap up too hard!,1,0,1614738480,ReegsPreems
49,gphmzc2,Maxim highlighted it and it picked up steam,3,0,1614738532,MunleyCustomLeather
50,gphn0hz,LETS GOO LA DODGERS. Oh the company is from there? GO DODGERS,1,0,1614738547,Quick-Raise8119
51,gphn343,[removed],1,0,1614738585,[deleted]
52,gphn42o,Also I jerk off with my hands and I'm a jerk off. Who buys stocks with my hands? Me! The rabbit hole goes deep,61,0,1614738598,ItookAnumber4
53,gphn4y8,There was 14mil volume on slgg today yet only 7% increase. Can someone help me understand?,-1,0,1614738611,iPLANESWALK
54,gphn6yt,I dont think my tin foil hat is big enough for this yet.,2,0,1614738639,ChErRyPOPPINSaf
55,gphn77a,Occam’s Razor - ice cream cone = I scream Cohen,3,0,1614738643,TenaciousMoFo
56,gphn7d9,Looks like we going to Pluto boys,3,0,1614738646,XxOmniPotentxX
57,gphn7li,Go take a look at Ann Hand LLC website! On the front page is a 🚀 leaving earth!,18,0,1614738649,Wyatt-Earp1882
58,gphnarv,This is fucking bizarre as hell but if we all jump in that alone can blow the stock up double. Fuck it...I’m in.,1,0,1614738694,Psychological-Wolf37
59,gphnb3v,"On this blessed day, we are all retarded",1,0,1614738698,ItookAnumber4
60,gphnb8u,Smart enough to realize ones own retardation is deminishing,1,0,1614738700,Mysterybread21
61,gphnb7w,"I’ll hop on for 1000 shares...fuck it, we’ll do it live!",7,0,1614738700,arguable
62,gphnccr,[deleted],1,0,1614738716,[deleted]
63,gphncf9,I like the stock!,2,0,1614738717,Psychological-Wolf37
64,gphndfg,In for a 1000 AH,1,0,1614738732,arguable
65,gphndx2,[deleted],1,0,1614738739,[deleted]
66,gphnek4,Now this is taking down the wrong hole!,1,0,1614738748,Psychological-Wolf37
67,gphnem4,I buy,1,0,1614738749,deepstatebreak
68,gphngav,Bro wut? Why Wendy’s? Because it always fresh never frozen? Shit I’ll hit them buns,3,0,1614738773,XxOmniPotentxX
69,gphngt3,Explain to me the importance of that date other than “it’s frog day”,3,0,1614738780,OneTrip7662
70,gphni5w,How the fuck did you find this woman,1,0,1614738799,Skywalk88
71,gphnkf5,It’s a company in LA . It’s called the mofo  of baseball. LA DODGERS! Or it’s like down the the ride lol,1,0,1614738831,Quick-Raise8119
72,gphnl4i,...and you’re on the FBI’s watch list.,2,0,1614738841,ANJR2
73,gphnlug,Ugh thank you,5,0,1614738851,BenevolentFungi
74,gphnm7m,"Well, he did think Arnie had some good points when he was telling Gilbert that he's a big boy.",1,0,1614738857,ItookAnumber4
75,gphnm9s,How come no one has mentioned the Cover photo - a bunch of gamers reaching out to a diamond crystal,3,0,1614738858,trollwallstreet
76,gphns8t,They already have enough DD with the cone and frog connection. No further proof is needed.,2,0,1614738943,PatGbtch
77,gphnspz,"Aww fuck I thought he had tweeted something more recent, but that was DFV, guess I am having a stroke",1,0,1614738950,LaserGuidedPolarBear
78,gphnt84,I'm going to spend all night looking at her social media for secret codes. Seriously.,2,0,1614738958,ItookAnumber4
79,gphntm6,Just give me the ticker,2,0,1614738963,AtomicKittenz
80,gphnwpj,Crazy,1,0,1614739008,nas8612
81,gphnxip,"I have officially devolved 🦍

(Mom’d be SO proud of me now.
“Look Ma, 💎 👐‼️”)",3,0,1614739020,magajeff
82,gphny8q,Maybe for his wife...,2,0,1614739031,EdmondDantes2020
83,gpho0fm,🤔🤯,2,0,1614739063,kyle8484
84,gpho0lc,Don't mind if I do!,1,0,1614739065,Vertical_Monkey
85,gpho1yo,[removed],1,0,1614739085,[deleted]
86,gpho2up,Maybe for his wife’s boyfriend’s wife,1,0,1614739098,PatGbtch
87,gpho6nk,"see Jules, the funny thing about my ann hand is that it is located around my le coque...

But I can still get you booze. I can def get you some of that. I'm getting that fo sho'

&amp;#x200B;

&amp;#x200B;

$GME -- to the 8th House of Scorpio where my shares are being held.",1,0,1614739152,Rumpelstiltzkinz
88,gphoaeb,"Wtf I just saw a magic 8 ball for the first time in my life like 2 hours ago in a tv serie, and now I've read about one for the first time in my life too. Signs from god getting stronk.",4,0,1614739205,Careless-Fly
89,gphoc8e,It's yahoo finances fault they swap sides between the app and the website for after hours / regular hours prices,2,0,1614739231,pf_throawaynov162016
90,gphocm0,I think it would have a substantial price increase based on speculation and association with GME.,2,0,1614739237,c5dm
91,gphoe0x,"Yeah, I hear she gets traded more than gme",3,0,1614739257,EdmondDantes2020
92,gphoewb,They drink pee too?,1,0,1614739270,PantsOppressUs
93,gphof12,Screenshoted in case Ann goes “missing”.,1,0,1614739272,PatGbtch
94,gphofgb,"Same, 50 @ 4.22. Apes autistic together.",3,0,1614739278,VtechX
95,gphofrs,someone give this man some gold!,1,0,1614739282,bullet312
96,gphoi1a,"Based on this logic, the blockbuster post may be in reference to someone who helped destroy blockbuster. Maybe a Netflix executive? The peanuts / dumb a dumber one maybe a Warner executive or something along those lines?",1,0,1614739316,sapiel
97,gphoihb,Okay I’m so retarded but what’s the ticker symbol!!!,1,0,1614739323,bportillo
98,gphojt7,reverse image search that pic has the answer to that,0,0,1614739342,Did_I_Die
99,gphoml9,Why the fuck does this make sense,4,0,1614739383,usd97
