,comment_id,text,score,awards,timestamp,author
0,gpguc96,Yes. It’s the hedge funds taking momentum off GME onto something else. They use bots on this page to promote it (rkt),41,0,1614723984,Joe-Dirt-69
1,gpgukgp,"As shocking as it is to hear, but hedge funds hold more than one stock. And they’re even long on some of them!",18,0,1614724094,SportTheFoole
2,gpguspy,"Except no

RKT has more catalysts than GME and also a higher short interest at this point",6,0,1614724203,Trenchcoat_Economics
3,gpguyq1,"They're adding shares to hedge their puts.
Meaning they're net short on the stock. Meaning they're also bearish on RKT.",28,0,1614724281,BVdubs
4,gpgv7i6,"How could it be a trap, how would hedgefunds get revenge.",1,0,1614724398,JamesHighlander843
5,gpgvd8i,Source?,2,0,1614724475,usernamefindingsucks
6,gpgvgyr,"exactly. no offense to anyone holding gme but selling gamestop on monday and putting 5k into rkt at open today was a better decision to me than holding gme. up 50% at close. volume was off the charts on rkt and has been dwindling last few days on gamestop. rkt isnt a distraction from gamestop, for many people it was a better short term investment.",15,0,1614724526,ArtichokeJunior7193
7,gpgvhhn,$RKT is a pile of garbage home loans that will default. Just like before people are buying homes they cannot afford and accessing equity that they don’t need to utilize; $RKT approves everything. Not financial advice just one ‘tard’s vision of the future.,19,0,1614724532,MiGrouchyLife
8,gpgvhxo,"What’s more likely:

Retail is moving the prices on both GME and RKT. Bots pumping RKT convince people to sell their GME and buy RKT, which happens in high enough numbers to move the markets this drastically. Also something something ladder, something something distraction

Or that hedge funds predicted that GME will go down, and RKT will go up, and they invested based on that prediction.",10,0,1614724538,an0therreddituser73
9,gpgvmdp,"Literally Fintel data, and I only have access to the free information. Look at their put quantity and the institutions that are shorting, they're one of the major shorts including Citadel.",7,0,1614724599,BVdubs
10,gpgvoqs,Someone posted earlier take profits and give it back to the OG (g em e)let’s go crazy,4,0,1614724630,avocudo
11,gpgvvvr,"The number of people calling RKT shilling alongside dozens of people posting huge tendies on it is really bizarre. You could close a GME position, make bank on RKT, and buy back in to GME right where it was.",17,0,1614724725,-ksguy-
12,gpgw1zg,Let's conspirancy theory this shit.,3,0,1614724807,Collie_Stonks
13,gpgw21q,I am going to be looking for another reinvestment into GME after day trading it for RKT. Also will be looking into UWMC,3,0,1614724807,VeganCannabis
14,gpgwbjk,"I don't have a subscription either and it's showing locked on the number of puts.

Do you have a link?",1,0,1614724931,usernamefindingsucks
15,gpgwd6t,"im only buying back in on gamestop if the volume increases. today was 33 million, when the squeeze occured in january average volume was 150+ million. i agree it is a bit strange but volume today was off the fucking charts and to me in the short term is a much better play than gamestop",2,0,1614724954,ArtichokeJunior7193
16,gpgx1gy,"But then it can’t be a conspiracy!

Apes need everything to be a conspiracy",7,0,1614725278,KAT-PWR
17,gpgx500,Looks like GME bag holders are quite prone to conspiracy theories. Maybe you should look into the bag to see if the cat is alive or not?,2,0,1614725324,knappis
18,gpgx7vs,"I'm not defending the company, but RKT doesn't KEEP the loans, it closes them and passes them off to someone else almost the next day.  So they really, really, don't care what happens to them.",15,0,1614725363,TegidTathal
19,gpgxc8h,You sure are sounding like a fucking hedgie right now.....,1,0,1614725420,dumbdik
20,gpgxidx,GME LIKE TESLA IS STILL SHORTED. HUGE UPSIDE POTENTIAL 🍦💪💎🐸🚀😻😆,1,0,1614725501,Past-Construction-88
21,gpgxkj6,"So.. are you saying WSB users can actually invest in 2 different stocks at the same time?!

The butthurt in my fellow GME bag holders is real.",6,0,1614725529,sandersking
22,gpgxtbh,Mine is still held through them 👀,6,0,1614725644,Rydawg5143
23,gpgyh0p,"Lmao they sell loans to Fannie Mae as early as possible they don’t hold the paper you stupid dongus.  They underwrite, close, and service.",7,0,1614725964,fishythepete
24,gpgyhe6,Based and redpilled,3,0,1614725970,FartyMcShitButts
25,gpgylmj,"I just clicked your username and every comment you've ever had is on this thread about RKT.

So fuck off, I'll take my chances on a slow opening door number 1.",9,0,1614726027,Lazyback
26,gpgyn1c,"Hope they made a lot of money on RKT, they will need it to pay me for my GME shares.",3,0,1614726046,_Gibson_
27,gpgzf78,I just clicked your username and every comment you’ve ever had up until now is in the r/bronysgonewild subreddit,-8,0,1614726432,an0therreddituser73
28,gpgzfeu,finally a good post to read! not a ape banana post.,0,0,1614726435,belzer999
29,gpgzi1j,Source: your mom’s boyfriend.,2,0,1614726471,Romy90210
30,gpgzkl8,Lol,1,0,1614726506,Romy90210
31,gpgzl77,You sure sound like a cultist.,6,0,1614726515,Rv4g3
32,gpgzs45,I have top posts on WSB older than your account newtard.,2,0,1614726610,KAT-PWR
33,gph057k,Sounds like that triggered you a little....  Some brony related trama from your wifes boyfriend?,6,0,1614726791,usernamefindingsucks
34,gph0auf,I was joking lol,3,0,1614726871,dumbdik
35,gph0ea7,It was a joke man lol,3,0,1614726917,dumbdik
36,gph0edd,It didn’t because anyone can see I have lots of comments elsewhere,-5,0,1614726918,an0therreddituser73
37,gph0emy,Oh lol my bad,2,0,1614726922,KAT-PWR
38,gph0i9i,Aint nothing man lol a few people took it serious so its just me,1,0,1614726972,dumbdik
39,gph0y27,"Actually if you look at the mail from them they sold it pretty quickly after you signed. I got my mortgage through them and two months in they sent me a letter saying they sold it to Fannie Mae. However, you may not have noticed it because they still service the loan, so you still pay them.",2,0,1614727194,Dayvolt
40,gph2f69,"RKT is Pleasure Island, GME is Valhalla",2,0,1614727941,Moleskin21
41,gph3uwj,"Are you under the impression that you can only hold one stock at a time?

I still have 150+ shares of GME cost basis $120, I don't expect it to pop off until two weeks from now potentially.

If you hadn't blinded yourself by calling anything not GME ""shills and bots"", you could have made a shit load of money today and quadrupled your position on GME.  I only bought $300 in contracts, made over $3000 and am still holding some *in addition to* my GME position I still hold.",15,0,1614728681,histumness
42,gph4gc4,😂,1,0,1614728987,Sasquatters
43,gph4zju,[removed],1,0,1614729259,[deleted]
44,gph5ill,4.20M shares. conspiracy confirmed.,1,0,1614729526,infinitemixtape
45,gph5o17,And they make tons of money and they are paying a special dividend the shorts have to pay and buying back $1 billion in stock which fuks the hedge funds also. More losses the more they have to cover to stop losing. It all helps AMC and GME. 🚀🚽👀💍🧤,2,0,1614729604,Manlaw13
46,gph5uwq,Some of these fuckers are sounding like the stock market version of QANON. It's absurd,-2,0,1614729700,AdvantageLong8027
47,gph6np9,"Nope, it's the ILLUSION of a tropical island, when in reality it's more like the Fyre Festival.",-2,0,1614730116,m0rph_bw
48,gph72os,Rkt still gonna fly. The company is way undervalued,1,0,1614730326,Sufficient_Tough6253
49,gph9xyv,[removed],1,0,1614731799,[deleted]
50,gphbsjd,The point of holding is to not allow them to rebuy their shares. Every person that sells is some more they can swoop up. It may be at a huge loss at $120 but thats far better than $500 o beyond. They are playing the long game to get as many as they can before the squeeze happens.,14,0,1614732748,Greenteawizard87
51,gphc5z5,"The volume supports this theory. There were very large hedges or individual players invested in GME last week. All that volume is gone, and yesterday into today, it all appeared in RKT.",3,0,1614732940,BackgroundSearch30
52,gphdedx,"I had $300 left in my RH account. Still waiting on fidelity options approval. Turned the $300 into $6,500 thanks to RKT calls bought yesterday. Moving all cash to fidelity tomorrow and taking all RKT proceeds into GME. So this RKT blast has only helped the GME play.

Edit 1: forgot I first bought a GME call yesterday morning for $300 and sold it for $600. Then used the $600 for RKT calls. Have to thank WSB for the DD on RKT otherwise would have missed it completely. Only posted this because others were implying the RKT attention was taking away from GME while it has only served as a huge benefit for my GME position since all my RKT proceeds are going into GME.",24,0,1614733579,InterestingJacket222
53,gphelhq,Almost like SLVR ???????,19,0,1614734210,GlorpShmeemf
54,gpherwa,**Divide and conquer. Splitting your focus across multiple stock is the goal.** This works in politics and this works in the stock market. You guys are getting divided and conquered. Remember why you came here in the first place. GME.,6,0,1614734301,PacificRadish
55,gphf205,[deleted],1,0,1614734443,[deleted]
56,gphfif8,"Only one love GME!

HOLD THE LINE!!!",9,0,1614734676,BennosukeMusashi
57,gphfwi0,"People keep comparing the ""upcoming squeeze"" on Gamestop and AMC to the legendary squeeze we saw in January. This simply isn't true, circumstances are completely different. Funds are slowly covering their shorts with little to no increase in stock price, check the current shorts on AMC. Wen't from 0 short shares available at close on Friday to over 600,000 at close today. If the volume stays low, the price will remain somewhat unchanged, and they will continue to cover. Without volume and strength like we had in January you are battling an enemy you cannot beat. 33 million today on GME is laughable to what we had five weeks ago. Volume on both AMC and GME has been slowly decreasing since Friday.",-11,0,1614734877,ArtichokeJunior7193
58,gphg2zu,"To be fair, I don't think most people are hyped about RKT being a good long term play.",2,0,1614734971,AvalieV
59,gphgddc,"It sounds like a lot of you tard-o's are doing this. I'm sad I missed the RKT play, and now I'm wondering if all this extra cash in everyone's hands will be poured straight into the GME fuel tanks.",10,0,1614735118,Im_A_Canadian_Eh
60,gphgjr2,What was your strike price,1,0,1614735208,ArtichokeJunior7193
61,gphgxj9,Fuck RKT!! GME To The Moon. GME Is The Real Rocket 🚀,4,0,1614735407,Alert-Engineering-33
62,gphh206,When Media is positive on a stock - Ya already know,8,0,1614735471,ossitadinma
63,gphhdx1,4 3/12 $24.5 calls for $1.50. Not sure how to find history of trades on RH to post. Sold one at $15 and 1 at $20. Picked up some 3/5 $30 and $32 calls. Still sitting on 2 of the $24.5 and 1 $32,1,0,1614735641,InterestingJacket222
64,gphhwv2,People will get burned with RKT like silver and weed. GME is the only play 🙌🏼💎🚀🚀,1,0,1614735908,Important-Neck4264
65,gphirui,I’m still worried they’re going bankrupt before I get paid,14,0,1614736355,SirDblH
66,gphix7r,"Exactly! 

GME is the wife. RKT is the girlfriend. 

Smart aka Retarded Apes know you keep the wife happy no matter what. 

Divorce is far more expensive than creating a new Tinder account. 

Hold = Wife/GME",3,0,1614736432,redheelz
67,gphjesg,Fuck man solid ass profit today then eh?,2,0,1614736690,ArtichokeJunior7193
68,gphjnrr,Out of control! But just dumb luck - liked the DD and blindly pulled trigger.,1,0,1614736821,InterestingJacket222
69,gphk8oz,He’s a fed! 🚨,3,0,1614737123,_Rex_GSD
70,gphkpfx,This is the way,4,0,1614737366,Philip_McCrevasse
71,gphlkcx,Definitely a pump and dump like the weed stocks we saw before; they’ll make money on the way up then sell their shares forcing a push down in which they’ll make money on puts,11,0,1614737800,captin1110
72,gphm6ep,"It’s gotta be a bunch of fucking either (a) genuine fucking dumb fucks, who can’t stop projecting their paranoia and anxiety over listening to a whole bunch of random ass users on reddit... so they attack any other successful stock because they REALLY think it somehow pulls away from the GME squeeze... or (b) the hedgies have figured out how to at least ATTEMPT 3D Chess against us with the bots.

And I don’t trust any of you fucks in here enough, to fully believe one or the either.

What I DO know is... these fuckers had a hell of earnings call, they hold 15% of a mortgage market- as well as somehow increased profits during a pandemic, they were shorted like 30-35%, I keep seeing more and more commercials for them daily, the dividends are given on the 23rd, to get those you have to be a shareholder still on the end of the 8th, and today is the fucking 2nd...

So... I mean, yeah, we can all just bail tomorrow and take our small tendies to GME... but what fucking reason would that make sense? Other than to stop this from gaining more traction...

Again, im just a newly minted smooth brained retard here... but I think I might be doing a lot more ACTUAL reading/researching then the average dumb fucks who keep shouting AMC/GME simply because they bought high and fucking paranoid that r/DeepFuckingValue is never going to let them fuck their wives and/or husbands ever again.

If you wanna bail on RKT, bail.
If you wanna hold, HODL.

But the sheer number of people that are commenting in EVERY RKT THREAD to fucking bail, and leave, because “it’s going to get bad monday”.... seems pretty fucking excessive for a place that mostly tells each other how fucking retarded we all are.

Edit 1: This was posted 4 days ago. Everyone talking bout RKT is acting like we only knew of it because of a DD from yesterday.

https://www.google.com/amp/s/www.thestreet.com/.amp/investing/rocket-companies-surges-on-earnings-beat-and-upgrades

Edit 2: Also 4 days ago.

https://www.google.com/amp/s/investorplace.com/2021/02/rkt-stock-why-rocket-companies-shares-are-taking-off-today/amp/",4,0,1614738115,DogeBuysCyberTrucks
73,gphmq1g,They just raised their price target on $RIG too,3,0,1614738398,Engineer-Muted
74,gphpub4,[removed],1,0,1614740018,[deleted]
75,gphpyah,"No you are not reading it right my autist. See how it says ""PUTS""? Those are short positions...Cmon man!",3,0,1614740076,PerceptionWorking661
76,gphq4bc,This is the way,19,0,1614740162,gochuuuu
77,gphqf0n,My plan was to dump my gains into $sears when it goes public again and soon but if this case is true it looks like i will try to grab a few more og's. I'll be watching the dd.,20,0,1614740321,Plate-toe
78,gphqy2l,"Yes, that what I think those posts show....  they are short GME , and long  RKT.

Somebody in this thread claimed to have data showing that they are also short RKT, but they didn't give a screencap or a link of it so I can't verify.",1,0,1614740567,usernamefindingsucks
79,gphreup,"I'm looking at Fintel and can confirm that Citadel, Blackstone, and others have both short and call positions for RKT. It's true... Whether you want to take the ride is on you.",1,0,1614740782,PerceptionWorking661
80,gphsapu,WTF? When is this from?,1,0,1614741203,GETTINTHATSHIT
81,gphsl0h,both of those posts I linked to were earlier today,1,0,1614741350,usernamefindingsucks
82,gpht1it,It’s a fucking mortgage company enough said,2,0,1614741598,Jimmyprocessserver
83,gpht8bb,"Yup. DD says your 100% right. 4,882,600 puts and 1,842,400 call options. WTF?",1,0,1614741699,GETTINTHATSHIT
84,gphtpqk,"Explain to a retard ape like me: for call options, can I exercise them anytime before the expiration date? 

Like if I buy an option for 100 shares at a strike at 10, if the expiration date is a month away, but the stock triples, can I exercise right then and there?

I assume yes, because shorter term calls tend to look cheaper, but I want to make sure so I can go in _semi_ knowledgeable (but let's be real, my smooth brain will just continue doubling down on GME no matter what)",1,0,1614741959,MartinVanBallin
85,gphumg3,GME days to cover has always been like .5.  it hasn't been difficult for them to get shares when needed.  RKT is 6.5.,2,0,1614742450,b_tight
86,gphvsyk,this is the way,5,0,1614743088,not_ur_buddy_guy
87,gphw6vr,Nobody in GME got burnt 🤡👍,2,0,1614743297,uiucthrowaway420
88,gphxdkq,"Yes you can sell anytime as long as it is before the expiry date, but i highly suggest you read more about options. They is more to options than just selling above strike price.",3,0,1614743948,BatChat155
89,gpi1p8p,$RKT is a juicy steak that they are serving to get you off $GME.  Likely there will be more in the near future.  HODL GME but trade others then they loose both sides.,2,0,1614746490,wuguay
90,gpi1ytl,But the borrow fee on RKT is 60% and there is less short shares available as of close than GameStop. People betting against the stock are going to cover MUCH faster with a fee that high.,1,0,1614746656,ArtichokeJunior7193
91,gpi26ow,What ticker is that?,1,0,1614746790,Unbentmars
92,gpi3xst,They are net long. The puts are the hedge.,10,0,1614747898,quaeratioest
93,gpi4cvf,"The r one b that l can’t x named 

You figure it out

$Sears for the win",6,0,1614748176,Klowndude171
94,gpi5dfu,"I was looking at rkt a week ago after seeing dd somewhere on reddit (I bought pltr instead, thanks cathie...)

unfortunately didn't buy till this morning at 29, but it has definitely been brought up on wsb before yesterday",1,0,1614748853,BeNiceDontBeMean
95,gpi5lhm,So they just do the management for the loan? And take little risk? Genius. I like the stock more now.,4,0,1614749010,BeNiceDontBeMean
96,gpi693r,Sears and Roebuck duh,2,0,1614749457,Plate-toe
97,gpi6hou,"60% is to buy, 200% is to borrow for rkt.",1,0,1614749622,b_tight
98,gpi9atf,Can’t fucking wait to order some chicken tenders at Sears soon.,5,0,1614751633,sjunipero
99,gpihjlb,My gochu is the way,0,0,1614758456,tokidiary
