,comment_id,text,score,awards,timestamp,author
0,gphzbn4,Make sure you. Buy. The. Dip.,14,0,1614745060,Daymster
1,gphzjoa,Practice martial arts or yoga maybe?,5,0,1614745189,Le7emesens
2,gphzm9u,Don't doubt your vibe,4,0,1614745231,da_muffinman
3,gphznpm,Take profit every time,6,0,1614745254,nanidog
4,gphznvy,[deleted],1,0,1614745256,[deleted]
5,gphznwc,Bro you are asking the wrong people. We all are trying to dig out of a hole we dug ourselves,26,0,1614745257,tackboi
6,gphzp53,The fact that you’re looking for actual advise here is both hilarious and terrifying at the same time...,20,0,1614745277,the_kid87
7,gphzpah,"Day trading and swing trading are very different mentalities and strategies. I'd recommend focusing on one at a time.

Also you are going through what most traders did in the beginning to become proficient. Mitigating your errors is a very useful skill to develop early.",15,0,1614745279,refactorconsultants
8,gphzr8u,"Yes but how can you tell it's THE dip? Or do you buy smol amt every time there's any dip at all?   

Asking for a smooth-brained friend.",5,0,1614745310,nabbersauce
9,gphzs5q,"Never buy all time highs, never buy at market open, wait for the 10:50 dip",31,1,1614745326,mallard_meat
10,gphzs96,We're all doing it. Can't learn without failing.,5,0,1614745328,Dazumbolschitt
11,gphzsec,"Buy High , Sell Low this is the way.

This is financial advice",28,0,1614745330,Professional_Ice_410
12,gphzt7f,"I’m right with u,I  buy it turns red lol,learned to buy on red days and not be greedy it’s ok to take back original investment and hold for 🚀🦍",4,0,1614745342,Churt1
13,gphzu0w,"Limit your losses. If you make a trade and it turns against you, sell at a percentage you decide before the trade and look for the next one, you’ll have way more capital then holding on to a stock and hoping it turns back around.",3,0,1614745355,garpla
14,gphzu5u,Stay away from anything with less than 5 rockets.,20,0,1614745358,luxeinvestor
15,gphzuku,[removed],7,0,1614745365,[deleted]
16,gphzw1p,"Honestly? Don’t follow trends on WSB. This place is a giant get rich quick FOMO trigger factory. Unless you have time to follow posts hourly all day and have the ability and funds to make quick trades, you’re most likely always going to be trading on the stocks here after the peak has peaked. This is speculation central and most successful traders don’t trade much on speculation.",11,0,1614745389,simons1321
17,gphzwg1,"Wait for stocks to be undervalued. I like to look at the 50 day moving average on a 6mo chart with daily candles. Make sure you also sell when the stock over extends on this same chart and you should be good locking in profits. Wait for it to drop a few days a few days after the high and then go back in. This way you can ride the waves.

Stocks always pull back after a run, so wait for the dip and be patient. Also place a stop loss at you purchase price so you get triggered if it drops below your initial price.

If you have a long term investment (more that 1 yr) just buy the dip and hold for a year+

Let me know if you have any more Qs...",46,0,1614745396,FatherTrade
18,gphzxcb,"Do the opposite of what you have been doing....have 10 stocks now....downsize to 5....be patient...or get a B.S. in finance from Faber College....""Knowledge is Good"" my friend. That's where I got my degree, my Doctorate is from WSBU.",5,0,1614745410,dupree97
19,gphzyqj,"I just focus on the fundamentals and just constantly challenge myself to see if I can prove myself wrong.

All about the quality DD.",3,0,1614745433,obctau
20,gpi009r,"I’m with you man, same boat. I’m telling myself this is the lesson and the focus i take into the day is discipline and attempt at patience. Apparently the opportunities always arise. I assume having more liquidity and watch for entry points. Also having conviction in what I hold long. That seems to help ease my anxiety around short term flip potentials.",2,0,1614745458,Astra_shopping59
21,gpi08cs,[removed],1,0,1614745586,[deleted]
22,gpi0cli,When you see a mountain start to form in the horizon. You flip a coin.,8,0,1614745657,Daymster
23,gpi0d31,"
Trade less, make less mistakes. Buy companies that you trust. Take profits. Don’t panic. Discipline yourself. This is YOUR hard earned money you’re screwing with. Stop getting emotional and treat it like it matters. Don’t spend more than you’re willing to lose. Stay positive, recognize what you do wrong, and work on it. DISCIPLINE.",7,0,1614745665,boogiegotbops
24,gpi0i1x,"I have tried months of post nut clarity therapy, doesn’t work",1,0,1614745748,mul2m
25,gpi0l44,"Beat off more.  Trade less.

Trust me.  This is the way.",11,0,1614745799,monkey_sauce1313
26,gpi0nei,"If you buy calls or even puts buy them at least several months out, further out the better. Remember that it is NEVER wrong to pull profits. If a position shoots up you can sell half and let the other half ride. Lock in some profits…
Check out Greggory Mannarino’s work.",3,0,1614745838,Most-Entertainment47
27,gpi0of9,Set limit buys and sells to take the emotion out of the equation.  So the system will execute based on a trigger price.  How do you know what the right price is? You can do fundamentals or you can look at technical analysis. Or you can ask another ape.,2,0,1614745855,Silent-Storage7079
28,gpi0r7c,Trust him. He’s pre-med.,4,0,1614745903,bwanabass
29,gpi1aqs,stop being retarded. wait. actually i think you arent retarded enough.,2,0,1614746238,investintelIG
30,gpi1h4g,My advice to you is too start drinking heavily....,2,0,1614746350,dupree97
31,gpi1kj0,Lmao,3,0,1614746410,conceptkid
32,gpi1l1p,It stopped being a bull market 3 weeks ago if you ask me,1,0,1614746418,litalligator
33,gpi1uzp,🌮 dip,3,0,1614746589,WiscoBids
34,gpi21mz,"Best financial advice. This guy must work for Melvins
 Thank you for using your textured brain to share this valuable information Ken.",8,0,1614746704,Professional_Ice_410
35,gpi24lz,"Fair enough but I'm assuming since some pretty big names dip in and out of this group, someone in here would know how to give a half decent pep talk. I'm not looking for shitty ""buy this stock and join this discord to the moon"" advice, more hoping for mindset tips. I've been up 10k in a day - then had to sit on that stock for 3 months to get 10k profit back plus a small amount on top, all over one stupid mistake after trading patterns on that stock successfully a good 5-10 times. It's frustrating. Rant over.",8,0,1614746754,peculiar_mysteries
36,gpi29u0,"Stay calm
Take your time
Plan strategy",1,0,1614746841,RedDragon777
37,gpi2d7k,Dip? What's that? Is that a code Icarus?![gif](emote|free_emotes_pack|snoo),2,0,1614746898,peculiar_mysteries
38,gpi2hdt,Don’t feel bad about taking profit. You don’t have to sell everything either. Exit strategies aren’t sell all or nothing lols.,1,0,1614746970,noiamgodzilla
39,gpi2k3y,I prefer Russian roulette,6,0,1614747017,peculiar_mysteries
40,gpi2my2,But where are the big titties and lambos is in your equation,29,0,1614747065,pokesmot42o
41,gpi2u2d,"Great, I'm starting a reddit hole club, rumour has it all the cool kids are joining ;)",2,0,1614747190,peculiar_mysteries
42,gpi2v1s,PS: not a bro.,2,0,1614747206,peculiar_mysteries
43,gpi2vw9,That is unless the rockets are red in which case 5 is sufficient,3,0,1614747220,pokesmot42o
44,gpi2yb5,I’m not falling for that one again,4,0,1614747263,pokesmot42o
45,gpi2zu0,Um... how many rockets does SPCE have? Asking for a friend...,3,0,1614747289,peculiar_mysteries
46,gpi37oe,"Couldn't agree more. I've literally timed the dips based on buyer habits for everything from millennial stocks to blue chip, its funny how the dip patterns come at different times based on who's buying. But... my biggest issue seems to be riding the wave then getting cocky and screwed over on the last buy in when day trading",8,0,1614747428,peculiar_mysteries
47,gpi3btr,You belong here my friend. Where shall I send your hole club membership?,2,0,1614747502,peculiar_mysteries
48,gpi3fhj,"I've been looking into online yoga classes lately, now would probably be a great time",2,0,1614747567,peculiar_mysteries
49,gpi3j0v,So true. I always get screwed when I get greedy.,2,0,1614747629,peculiar_mysteries
50,gpi3m8e,You mean the coked out hooker in the passenger seat of the car parked out front isn’t with him?,7,0,1614747687,MadejustforWSB
51,gpi3mqq,"Think in terms of the trade, not the money.  Find an undervalued stock.  The less people talking about it the better.  Take a position.  If the stock “behaves”, add to your position.  If it acts wonky, average down or sell and find another.  When you start making profits, have a plan ahead of time what a sell target might be and sell at least half your position when you hit that target.  You can always buy back.  Buy more of your winners and less of your losers",3,0,1614747696,muchcoinmuchfun
52,gpi3rdk,[removed],1,0,1614747781,[deleted]
53,gpi3s84,"Thanks, hang in there",1,0,1614747796,peculiar_mysteries
54,gpi3v3v,Pre-med or pre-mad?,1,0,1614747849,peculiar_mysteries
55,gpi3zfg,"Be early. If you arent, if word is already out and your paying for someone elses gains; then move onto the next one",1,0,1614747929,TheApricotCavalier
56,gpi427x,[deleted],7,0,1614747979,[deleted]
57,gpi42ki,How much risk tolerance do you normally leverage for in your set losses? Generally my strategy has been keeping enough liquidity in my account to average down if I make a mistake and wait until the stock bottoms out to buy. It's worked but the downside is sometimes I'm waiting for 2-3 months without being able to trade,2,0,1614747985,peculiar_mysteries
58,gpi44mo,It’s a real doll with a hidden coke storage compartment sir!,5,0,1614748025,pokesmot42o
59,gpi45ei,Happy cake day!,3,0,1614748039,blackkoi
60,gpi4bpr,[deleted],1,0,1614748155,[deleted]
61,gpi4k6p,"I learned karate when I was a teenager, it helps, but I know it's very hard to be disciplined, even for me. The best way is to set up your own rules: e.g. no more than 10% loss, take profit and always celebrate if you have 20% profit or more, don't look back and think at the next opportunity...and... Stick with your rules (hardest part) :) good luck!",6,0,1614748311,Le7emesens
62,gpi54dc,Learning trading again is the single most painful experience of my life. I'd love to talk with a voice of reason to try and get it back together. Maybe we need a retard support group.,1,0,1614748681,anthonyburcheatscum
63,gpi5s7m,"Don’t be peer pressured into “diamond hands” holding. Set buy and sell limits that YOU are comfortable with and stick to them. 

I’ve fucked up so many times getting 10-20% gains in a day just to see them wiped out and end up losing money.",3,0,1614749138,lickybumbum69420
64,gpi6dqz,Settle down boys,3,0,1614749546,peculiar_mysteries
65,gpi6u0q,Buy something you like and hold it do not look at it for a quarter then come back check on it pat your self on the back and feel free to thank me,1,0,1614749859,TheStreetJunkie
66,gpi6xib,"This was exactly the pep talk I was looking for, any advice on.... oh never mind, I think I can figure that part out on my own",2,0,1614749927,peculiar_mysteries
67,gpi7437,Don't make your holes so big.,1,0,1614750054,AvalieV
68,gpi7e5j,I tried this and my stock split into two!,2,0,1614750247,AdNo7052
69,gpi7g77,"It’s Rush IN roulette...

Bababooie",5,0,1614750286,PromptComprehensive8
70,gpi7pop,"Had, had a coke storage compartment. It's filled will cum now",5,0,1614750471,evDev84
71,gpi814p,Master stop loss,1,0,1614750699,ldog50
72,gpi88bq,As a noob who previously did the opposite - Listen to them :&lt;,3,0,1614750845,Reelix
73,gpi8rk7,"It’s a common problem on the first generation coke compartment ...that water tight seal, well it’s only water proof.. and furthermore I refuse to clean it ! .. the torso won’t fit in my dishwasher and you try explaining to the car wash attendant what you are doing with a dismembered “love doll” duct taped to the hood of your lambo",3,0,1614751238,pokesmot42o
74,gpi9gp4,Actually good advise on WSB? WHO ARE YOU AND WHAT ARE YOU DOING HERE,6,0,1614751751,PinkFlyingElephant
75,gpibtgg,"Read up on false bottoms, and tops.",4,0,1614753559,FearTheBaldness
76,gpic5cx,"You mean you didn't lose it all??? Teach me, stonkpai!",1,0,1614753823,IlliterateInvesting
77,gpicjtw,"Read ""Reminiscences of a Stock Operator"". There's a character there called Old Turkey who might have a lesson or two for you.

[http://www.gutenberg.org/ebooks/60979](http://www.gutenberg.org/ebooks/60979)",1,0,1614754146,YOLOQuant
78,gpiej9j,Do you always set a stop loss?,1,0,1614755791,dub_life20
79,gpiewm2,No. Not always. Sometimes I start off with only a few shares and average down as it drops. When you feel like it’s reached support then dump in your full position.,3,0,1614756104,FatherTrade
80,gpiex1e,[removed],1,0,1614756114,[deleted]
81,gpiezqy,"I may be a retarded ape, but I am getting less retarded everyday.",2,0,1614756178,FatherTrade
82,gpifm4k,"Get out and run, they are going to collapse the economy, everyone starting to day trade, they want to take your assets and make you reliant on the govt",1,0,1614756719,WhereTheWavesAt
83,gpig25m,[deleted],1,0,1614757108,[deleted]
84,gpigrbe,[deleted],1,0,1614757736,[deleted]
85,gpih3pr,"I am a retarded ape, but am getting more retarded everyday. Hey at least my portfolio is growing (the bigger the red numbers, the better right?)",1,0,1614758054,PinkFlyingElephant
86,gpihgjo,"AMC and UWMC this week/next.  Tendie man will drop loads in ypur acct, guzzle loads then spit into PLTR stock and LEAPs",1,0,1614758379,Sp00dge
87,gpii43h,"If you could send it to :

Cubicle 3
Mens Restroom,
Wendy's Burgers
Florida City.
Florida 

I will receive it. Please don't send it to cubicle number 2 , this boy from Bulgaria has just moved in there he won't stop crying and queefing. He's uch a douche, I would go as far as saying he may actually be a cat.",4,0,1614758987,Professional_Ice_410
88,gpiis8d,"Personally I think we should use crayons aswell. 🚀🚀🚀🖍🖍🖍 The red ones are my favourite flavour because the remind my  of when my mum used to show me her sanitary towel and say ""I wish this was you""",1,0,1614759609,Professional_Ice_410
89,gpilif7,Leave my mum out of this,0,0,1614762181,Larrylegend89
90,gpilnav,"""Averaging down"" is amongst the dumbest philosophies pushed in this sub. Unless you literally only have a single company you believe in, there's almost definitely better places to put your money than a cratering stock you're ~~gambling~~ losing on. Buying more stock at a lower price doesn't change anything about your original position, you've just placed new bets",1,0,1614762311,oldcoldbellybadness
91,gpiudke,Do not become emotionally attached to any stock. You are here to make money and that is it. Do not buy a stock because of child hood memories when your RESEARCH says to not buy the stock. Also buy low and sell high and just because a stock is down doesn’t mean anything until you sell that stock. You only lose money when you sell.,1,0,1614770724,Boobybear8
92,gpiximp,"Another piece of advice : Always eat the Blue crayon first, it's just common sense.

I hope your herpes inflammation settles down soon too. X",0,0,1614773302,Professional_Ice_410
93,gpixvyz,"Brilliant financial advice. Would you be interested in joining a hedge fund I'm starting. With WSB members it's called Smooth Brain Mutual Funds?


We will only endorse YOLO investments with pension funds , children's college fees and inheritance lump sums.


We could use some one as smooth BRAINED as you to lead our investment research and crayon development department.",1,0,1614773581,Professional_Ice_410
94,gpj1lb6,She is a nice lady,2,0,1614776192,pokesmot42o
95,gpj1mk2,Cant stop won’t stop,2,0,1614776216,pokesmot42o
96,gpjdhz2,"Got it, it's on the way. Just in case, I sent one for you and one for the cat",2,0,1614782696,peculiar_mysteries
97,gpjncyc,"Thank you for the parcel, it was a very nice parcel. I would like to start by saying how good a parcel you sent me.",2,0,1614787132,Professional_Ice_410
98,gpjosjn,Thanks!,1,0,1614787759,dub_life20
99,gpjr9nw,"I do send good parcels. Believe me, I know parcel senders and I send the best parcels, nobody can send better parcels than me",2,0,1614788828,peculiar_mysteries
