,comment_id,text,score,awards,timestamp,author
0,gpl570j,That was a quick deletion I'll see it on r/gme anyway,6,0,1614810430,lakee9353
1,gpl64ac,It got autoremoved and is now approved you iron smooth brain.,29,0,1614810865,OPINION_IS_UNPOPULAR
2,gpl6mc3,Smoothbrain is my specialty. Not a wrinkle in sight it's like touching a ball bearing,6,0,1614811102,lakee9353
3,gpl6q2g,all i see are rockets shooting past the cloud of text,55,0,1614811152,ejomill
4,gpl7hgg,"Appreciate it, I expected it to get auto-nuked and you guys gave a swift reply. 🙏",12,0,1614811515,Souperdev
5,gpl7p61,This guy must be a fucking financial wizard!,5,0,1614811616,OffKilterOffer
6,gpl7snv,[removed],1,0,1614811662,[deleted]
7,gpl7tjn,Why can't they just buy Steam in GME shares?,3,0,1614811674,PharmerDale
8,gpl7yob,"Sir, this is a catnip lounge.

*I am a bot, and this action was performed automatically. Please [contact the moderators of this subreddit](/message/compose/?to=/r/wallstreetbets) if you have any questions or concerns.*",15,0,1614811741,AutoModerator
9,gpl886n,Who needs a helmet when you have an iron smooth brain,5,0,1614811864,mainingkirby
10,gpl8l3q,"Steam is pretty much all in on pc gaming, if GME could play the PC field while still taking a piece of console games that could either be a distraction or advantage.",101,0,1614812033,vizzoor
11,gpl8r8b,[removed],1,0,1614812115,[deleted]
12,gpl9fjb,[removed],1,0,1614812440,[deleted]
13,gpl9wo8,That 100B market cap gets me wet,21,0,1614812672,rustyham
14,gplajr2,[removed],1,0,1614812986,[deleted]
15,gplbkhv,I am not a cat.,7,0,1614813497,bestjakeisbest
16,gplby03,[removed],1,0,1614813684,[deleted]
17,gplc1ay,"As a game dev personally i think this market is oversaturated, steam is already in an arms race with epic games. Also i might have to sell as i'd be an insider which would mean no lambo.

I think they should focus on expanding into the PC building, deliver on demand, collectables area and try and offer a more refined service than amazon - while also offering some downloadable content. Chewy has a $45M market cap in a $200BN industry. The gaming industry is predicted to reach $300BN by 2026, a similar trajectory would result in a market cap of 60BN for gamestop, i.e $1K a share. If i were a shortseller, i'd want to be well out of here before we find out.

Converting the stores into rentable gaming spaces for tournaments and team games could also be an interesting venture.

Just don't see them competing with the already established indie game downloadable content scene! Either way BIG moves ahead.",46,0,1614813727,SnooWoofers9008
18,gplcutf,GameStop is still undervalued today even with this short squeeze hype,95,0,1614814133,ucaliptastree
19,gpldh3v,[removed],1,0,1614814443,[deleted]
20,gple4hz,"The market is definitely not oversaturated. Right now with the current industry tools, it's becoming more and more possible for medium/smaller studios to release games and see explosive growth. Now let's consider there are only 4 places developers can realistically expect to release their games for a sizeable profit.

1. Publisher platforms ([Battle.net](https://Battle.net), Origin, Uplay, etc.) generally only contain games published by the platform owner. So if you aren't published by them, this isn't an option. If you want to be published, be ready to either sell your IP or give them a massive cut of your revenue. I am talking 40%+, and that's if they even want to publish you which most don't.
2. You could release on Epic, who are hungry for games right now, but dealing with them is a bit of a pain in the ass because they are still working out their process for publishing and distribution, marketing/advertising, and price points/sales. They have a ways to go, but they are definitely headed in the right direction.
3. Or you can go to Steam, where 90% of the industry launches on, because they are very well established and you can be sure that your game will not only be seen, but priced fairly with extremely refined launch and release support. The cost? A 30% cut of your revenue. And everyone pays this, non-negotiable (unless you are a big boy publisher and then negotiations absolutely happen).
4. Or you can go to GoG or other smaller platforms, which are definitely an option but since they aren't as widely known or accepted you run the risk of lower sales.

Considering the amount of releases on Steam vs Epic, I don't think Epic is competing effectively yet. They won't be for a couple of years, I don't think. They are going in the right direction, but they have a ways to go, especially when they have multiple things on the go that could sap resources from the expansion like their continued Engine development and work they have to continue to do as a Publisher for games like Fortnite.

Gamestop doesn't have that problem. They are 100% sales and distribution. 100% focused on that. Not publishing, not developing, not tech development or research, simply sales and distribution. Even Steam still has to continue publishing and development for games like CS:GO and DOTA2. Gamestop is free from the shackles of publishing and development, and can focus all of their attention on digital and physical sales and distribution, and that fucking excites me.",25,0,1614814771,Souperdev
21,gple80n,[removed],1,0,1614814820,[deleted]
22,gplekyq,[removed],1,0,1614815002,[deleted]
23,gplfrut,"The bulk of my online purchases have been on gog or steam. Neither platform has served much purpose beyond purchasing convenience, convenient access to reviews and ease of software installation. I've had to install clients or register for shit sites/services in order to play other games (Bethesda jumps to kind, iirc there were serious problems at one point with their authorization service's compatibility), who knows how many of those one off accounts are out there.

Standardization would be awesome. Launching wow or cod or fn from the same client, standard logins across gaming sites and services, integration with console accounts. Gamestop big enough to get the industry to work with them on such a huge complicated project? It does not seem impossible, only gargantuan.

That reminds me can we get Shadow of the Colossus 2 now pls",20,0,1614815613,throwurfootaway
24,gplg8oq,"Personal speculation here. Not in the biz just a gamer. Steam would be tough to kill, it’s rooted itself as the go to for PC gaming. The only reason why Epic was able to take a chunk of their market ( last I heard they took about 25%, but that was months ago) was giving out free games. Even with free games they are no where near close to competing with Steam. 

GameStop already has an uphill battle with becoming an online presence. Don’t get me wrong I’m holding GME and want them to succeed, I just don’t think they will be able to be a threat to Steam for a long time. What could GameStop offer to publishers and customers that Steam couldn’t? Exclusivity deals would divide the market. And unless they want to undercut and take losses it would be tough for them to be more appealing than Steam.",10,0,1614815856,DrunkSpartan15
25,gplg9sz,I imagine a Gamestop app\* would allow me to sell my own game on it's marketplace for absolute trading inception. \*edit,5,0,1614815872,Audaylon
26,gplgvbk,I don't see how GameStop has any advantage when entering the online market to go after Steam compared to any random start up which might also make the attempt.  Their stores are a distraction and hindrance if anything.,15,0,1614816184,PaloLV
27,gplhinh,"You have done an excellent job at wasting my time.


*I am a bot, and this action was performed automatically. Please [contact the moderators of this subreddit](/message/compose/?to=/r/wallstreetbets) if you have any questions or concerns.*",4,0,1614816524,AutoModerator
28,gplhimq,"It won't be exclusivity deals, it will be a reduction in royalty rates. I would see 20% being still a massive revenue to them, without much required to get an online distribution platform up and running.

When Steam was first getting started over a decade ago, people thought the idea was rediculous. Now it's the industry standard. Steam's weakness is that they are a finely tuned, albeit large, machine. But large machines like that with as few developers to keep it running/make changes make things really hard to adapt to market changes.

Gamestop has the resources and connections to make it happen before Epic gets too deep, but their benefit is they aren't a publisher. They won't care about exclusives, they will just be an open distribution platform for games like their store is. And developers won't have a problem releasing there, because they can release on Steam AND Gamestop if they want, so there really is no downside.",-4,0,1614816524,Souperdev
29,gplhrxa,"Firstly, resources. Gamestop has the capital, brand recognition, and years upon years of industry connections and relationships. A startup would be impossible to compete with Steam, they would die instantly. But Gamestop is in a unique position where they could actually pull it off, and it isn't as hard as people think it might be.

Second, When developers release on a platform, if it isn't an exclusive there is nothing stopping them from releasing on multiple platforms. So as a dev, why wouldn't I release on Steam for a 30% cut AND Gamestop for a 20% cut (if they offer a reduction in royalties)? I would be mad not to do both, and if Gamestop can begin to build their presence online with a decent library of games alongside deals for consoles/merch/physical copies of console games they can compete in a way Steam can't.",14,0,1614816661,Souperdev
30,gpli0v9,Automod seems to know what a Tech Artist actually does. I feel personally attacked.,2,0,1614816792,Souperdev
31,gpli7ew,Okay I hear you.,3,0,1614816885,DrunkSpartan15
32,gplij81,My grand farther in Romania told me to the moon,12,0,1614817057,Both_Selection_7821
33,gpliox6,"Holy *moly* this would be an incredible announcement. Not even looking at the numbers there, I would 100% support and use non-bloated distribution software that helped support game devs more, not to mention all the other aspects of their business that they could tie this into.

Bonus meme cred idea: They just name the launcher **Diamond**.",20,0,1614817140,CookingwithMike
34,gplit9s,"Please this.  Valve is fat and lazy, take 'em down!",0,0,1614817203,ThePuertoRicoSuave
35,gpljafb,"They've got a great service, but being a monopoly I think they've gotten a bit complacent. Ripe for competition.",1,0,1614817454,Souperdev
36,gpljvph,"Read about Ryan Cohen's vision and execution at his former company Chewy. His focus on the player and creating an attractive, fun and easy to use e-commerce platform will be the keys to long term gme success imo",9,0,1614817764,xXmurderpigeonXx
37,gpljz66,"Epic has to be getting killed. As a regular PC gamer I think I spent 10 bucks on a really good deal game that I wanted, but otherwise all my games are on steam. No point in decentralizing where all my games are. But at the end of the day, given a good enough price on a game people like me will still buy a game if the price is good enough. Increased competition will lower all game prices. But gamers won't change platforms if they cannot play games with their friends on other platforms. They'll go to the platform with the most playerbase, which is steam currently. (i.e. if a steam player couldn't play with their friend because they're on Epic, or whatever, they'd make sure to only get steam games or vice versa)",3,0,1614817827,IAmHitlersWetDream
38,gplkh4a,"isnt every service like this that dont develop and publish their own games slowly losing their ground for a few years?

I think you're looking at this too much from the publisher perspective, especially since you're a game dev yourself. its easy enough to attract publishers to your platform, you just need to put a lower fee, but how would they attract customers quickly? The only reason Epic games is even ""the second best competitor"" to steam is because fortnite went super giga viral. GoG only exists because The Witcher was a huge hit. Battle.net is because of WoW and Hearthstone. I think theres a reason why all these guys make their own games, and its probably similar to why Netflix invests so much to produce their own shows, shit attracts customers.

With none of their own games, they will never get the Fortnite crowd, the League of legends crowd, the WoW crowd and most importantly the CSGO and Dota 2 crowd. Players have their roots dug so deep i have no clue how they could dig them out.

I dont think this is the play for Gamestop, but ill have to see what path they're gonna go and how they sell me the idea either way. Incase i sound like a hater, i own Gamestop.",12,0,1614818139,Ozbal42
39,gplkh4t,"IF YOU'RE GOING TO FILIBUSTER, YOU SHOULD RUN FOR SENATE!


*I am a bot, and this action was performed automatically. Please [contact the moderators of this subreddit](/message/compose/?to=/r/wallstreetbets) if you have any questions or concerns.*",6,0,1614818139,AutoModerator
40,gplkk4p,"GME will definitely have tough competition with Gamepass, Steam, and Epic Games just to name a few. Not saying it’s impossible, but it’s gonna be extremely difficult.",1,0,1614818193,Tyrion69Lannister
41,gplkts4,[removed],1,0,1614818370,[deleted]
42,gplkw2z,"if GME is really paying attention, they will make it driven by community and inclusive to curators and modders. I could see this being huge.",2,0,1614818408,IlliterateInvesting
43,gpllfem,Yah it seems more profitable to have gamestop become our version of amazon. It's a money printer,2,0,1614818750,Drew_Woodruff
44,gplnmgt,"Ehhh I don't know about the potential to overtake Steam. I think the potential to transition to a solid digital service is there, but Steam has been around for what, 18 years? They have so many features outside of just being an incredibly large digital store front. Message boards, user reviews, remote play, family share, coop streaming play, streaming, communities, chat, the market, steam workshop, etc. GameStop's digital storefront is going to have to find some very unique, enticing features to even think about making a dent in Steam's user base. 

Also the oversaturation is real, at least from a consumer standpoint. Right now I have Steam, Origin, Ubisoft Connect, Epic, Xbox, and the Microsoft Store, and even Stadia for some family that wanted to try gaming but didn't want a PC or console. Any time I'm crazy enough to buy something on any of those platforms (outside of Stadia) because there's a good sale I immediately add that game to my Steam library so I don't have to deal with the other apps. I get that I'm probably more of a hardcore example, but if I don't want to deal with multiple storefronts why would the more common gamer?

I'm excited for GameStop's digital turnaround too, but they're very late to a very crowded space and all those additional features will take expertise and resources they don't currently have, and quite a bit of time. As GameStop gets rolling every service will continue to improve their already existing services. By no means am I discounting your take from the developer side, but from where I'm at it's going to be a long road, but one I'm excited for nonetheless.

Edit - One more rational thought. A an adult that can appreciate the costs of business, reducing the cut the platform takes is great. As someone trying to play games, I don't give a shit. That won't attract a large user base.

Also completely forgot I have whatever Activision/Blizzards app is called. See what I mean?",8,0,1614820086,reddsteele
45,gplnvm4,It will likely never catch up to Steam but we desperately need some real competition in that sector.,4,0,1614820236,From_My_Brain
46,gplojgl,"I'm exclusively a PC gamer. I have 219 games on my 13 year old Steam account. If GameStop can give me a better alternative, I'll move over.",20,0,1614820614,Kandlejackk
47,gplosqb,"As a long time Steam veteran, I would be okay with this.",3,0,1614820752,C0NSCI0US
48,gplosuw,[removed],1,0,1614820754,[deleted]
49,gplpgws,"No.

Though, I'd much rather GME be a digital distributor than EA, Ubisoft, Activision. All of them feel like horrible revenue grabs and, as a result, I hate them.

Steam's solid and does it's job. It's not going anywhere but there's room, say, if GME buys GOG and goes from there.",5,0,1614821098,Good_Ad2273
50,gplpmsm,[removed],1,0,1614821181,[deleted]
51,gplpmu5,"Given competition, Steam's solid.

That said, maybe we can finally get a true Half-Life 3 or some shit.",3,0,1614821182,Good_Ad2273
52,gplpt56,"\*Actually, with NFTs this is technically possible.

I could see GME doing that.

That said, fuck artificial scarcity when it comes to gaming. That's how we got into PirateBay in the first place.",3,0,1614821271,Good_Ad2273
53,gplpz94,"When I was a little boy in Bulgaria in 1997, my father told me to tell you to buy and hold GME until is passes the moon 🌝 and I said , this is the way, back then...this is not financial advice because I don’t know how to add, just multiply...",4,0,1614821357,Pollution_Human
54,gplqzwz,[removed],1,0,1614821881,[deleted]
55,gplr4jt,[removed],1,0,1614821945,[deleted]
56,gpls7em,"Honestly, Steam is a hunk of shit right now. Not only is valve just leaving it a black box, their heavy reliance on micro-transactions and updates like operations, but refusing to come out with a 3rd anything is an insult. I'm still going to have my steam account, but it's really obvious they lack competition by their complete disinterest in improving pretty much anything.",6,0,1614822500,GroundhogExpert
57,gplsd74,"In the 13 years I've had a steam account, I can't remember any significant changes by the platform.",11,0,1614822583,Kandlejackk
58,gplsk8b,They made it a huge pain in the ass to log-in by requiring that you use steam guard so they can claim complete lack of liability if your shit gets stolen!,5,0,1614822683,GroundhogExpert
59,gplsnw1,I think I'm grandfathered in because I just use my simple login info I've had the whole time to log in.,4,0,1614822736,Kandlejackk
60,gplspdd,"GameStop already tried this. Remember Impulse? It was profitable when they bought it in 2011. GamesStop rebranded it twice, and then shut it down in 2014. It's not like Blockbuster passing on buying Netflix. It's like if Blockbuster purchased Netflix, then drove it into the ground.

As a customer, why would I buy digital games from GameStop, when I already did a decade ago and then they took them away from me? If Epic Game Store can't get people to buy games after pouring hundreds of millions to billions of dollars in exclusivity deals and free games, how could GameStop do that with less cash?",4,0,1614822758,mehlmao
61,gplt1v2,"They tried this way before they had any kind of focus on a digital platform, they hoped by buying it that it would just work out. It doesn't always work like that, sometimes you have to build a service that works with your current business from the ground up instead of just buying something and expecting it to integrate seamlessly with a completely different business model.

In 2011 they also didn't have Ryan, or any board members with any real interest in ecommerce.",3,0,1614822937,Souperdev
62,gplt45u,"Epic takes only 12%, and charges no royalties for Unreal Engine if you sell through their store. They've poured tons of Fortnite and Tencent money into giveaways and exclusivity deals. How could GameStop compete with that?",5,0,1614822970,mehlmao
63,gpltv29,"They also have the brand. If GameStop does something like this then everyone is going to trust them enough to purchase and play games from their online store, especially with all of the media attention they’ve been getting lately. Not only is GameStop a staple of our childhood, it’s the ultimate underdog story.",1,0,1614823345,Lesty7
64,gpltx5e,"Epic is still a publisher and deals with no physical items like consoles or merchandise. Gamestop is also NOT a publisher with great relations with almost every major player in the game industry. Being an unbiased party is much bigger than people realize, it's why they are able to distribute so effectively. Take that and infuse a Steam-like platform that also handles digital sales of physical merchandise like consoles and physical games and PC parts, and it broadens the horizons past just PC gaming. Something both Steam and Epic aren't doing and have no plans to do. To me this is like comparing buying things from Amazon or from a company directly. A lot of people just go to Amazon because everything is already there. Consolidation is big.",1,0,1614823376,Souperdev
65,gplu2xq,"They tried this around 2010 to like 2013. It was called Impulse and went terribly. Every one who purchased titles from the Impulse library, lost their entire collection when they discontinued the service.

Let's hope they do better this time around.",34,0,1614823456,Roflrex
66,gpludr7,"OK, so why do I buy my game accessories, PC parts, or other physical merchandise from GameStop instead of Amazon? I, and the rest of middle class America, already have Amazon prime. I can get stuff delivered next day. How does GameStop beat that infrastructure?",4,0,1614823602,mehlmao
67,gplurcu,[removed],1,0,1614823785,[deleted]
68,gplurpc,"I'd love to know myself. Ryan managed to do it with Chewy, if I was more aware about supply and distribution I'd be able to speculate but I can't speak to it. I just see its potential integration into a strong digital game platform. You can make the same argument for a lot of online retailers, but if no one was able to complete with Amazon then no online merchandise retailer would be in business right now.",4,0,1614823790,Souperdev
69,gplw847,"if they are really gonna be the next steam, they need to update their name to something more tech sounding. something like Vapor or Zeo or Gamlantir",1,0,1614824506,poopybumbum1
70,gplwmp8,"The “valuations” by people on this subreddit with literally no idea how business or finance work that essentially just boil down to “just replace the heavily entrenched market leaders and somehow maintain their profit margins at the same time” is getting painful. Ryan Cohen is a fairly successful manager, not a literal wizard",5,0,1614824707,Kryptonite55
71,gplwz0c,"Let's be (well at least I'm going to try) here, Gamestop in the long term is a trash company, they will go out if business in the mid term. The play with GME right now isn't about the actual company, it's a play against hedge funds trying to eliminate Gamestop and profit off the companies dissolution.",2,0,1614824875,cremater68
72,gplxc4m,[removed],1,0,1614825047,[deleted]
73,gplyl0g,"This is a solid idea, I cant believe I didnt realize that Steam has no competitors",-1,0,1614825664,slash_sin_
74,gplyrjz,[removed],1,0,1614825753,[deleted]
75,gplz2h0,GameStop is already working on 1 day shipping. Some products arrive in less than two hours from the time of order,2,0,1614825900,slash_sin_
76,gpm0w2d,"This is honestly where I hope they take the company, along with moving into Esports with their physical locations as venues. People will leave steam if there’s an alternative, at least I know I will.",1,0,1614826816,Bait_and_Swatch
77,gpm1010,"The barriers to entry don't seem to be difficult but Steam still dominates.  As you mention developers and especially AAA title devs have a ton of ways to distribute yet Steam just motors along.  I'm reminded of the quote that goes something like, ""in war everything is simple but even the simplest things are incredibly difficult.""",4,0,1614826871,PaloLV
78,gpm1j49,"While I understand your point, lumping Valve's games' business model and Steam as a platform's business model together is not a good way to discuss about this",7,0,1614827145,DashLeJoker
