,comment_id,text,score,awards,timestamp,author
0,gpfprb7,Install the AMC app on your Roku. 💯💯💯,1,0,1614706454,Ravstax
1,gpfpvz0,GME! Not advising but look how few shares are left...  I think you got distracted. Eyes on the prize. Do your thing!,2,0,1614706511,liveresujin
2,gpfpy0l,Done.   Have about 20 apps including Netflix and prime Video,2,0,1614706536,Greasytirdhands
3,gpfpzr2,GET is the next one,3,0,1614706558,TheBotsRcoming
4,gpfq0wm,Feel like we missed the mark by not getting in last March. Might be pretty close to topped out.,2,0,1614706572,forthrightsigning
5,gpfq12h,"It's a solid buy, based solely on their market share of streaming devices.",3,0,1614706574,SandersSol
6,gpfq6gd,"Heard them talking about this on their pillow talk

https://www.reddit.com/r/streetguru/comments/lw5qxb/roku_jp_morgan_says_deal_with_nielsen_serves_as/?utm_source=share&amp;utm_medium=ios_app&amp;utm_name=iossmf",2,0,1614706639,Tower_Climber
7,gpfqytw,"I have GME too.   125 shares   But unfortunately I bought them near ROKU prices.  I’ll
Hold to 100000 or zero.   Which ever occurs first LOL.",1,0,1614706983,Greasytirdhands
8,gpfrfmg,Love you ape &lt;3,1,0,1614707188,liveresujin
