,comment_id,text,score,awards,timestamp,author
0,gplxnr6,"Sir, this is a catnip lounge.

*I am a bot, and this action was performed automatically. Please [contact the moderators of this subreddit](/message/compose/?to=/r/wallstreetbets) if you have any questions or concerns.*",8,0,1614825206,AutoModerator
1,gply2x7,Bag holders unite should’ve sold at open,64,0,1614825416,RainyCityTay
2,gply3rf,"Sndl was the last one
I wanted to do a couple puts on rkt but didn’t have enough in my account as I put 500 more on amc yesterday lol",13,0,1614825427,ugod02010
3,gply68n,"No one thought RKT would squeeze. 

It's all about the long play due to it being undervalued and the divvy. 

The buyback is just a bonus. Where do you all come up with this stuff. RKT was here before GME

The pump and dump was new traders not knowing what they were doing and getting burned. If you wanted a GME squeeze you didn't do you DD on the company.",43,0,1614825463,Fragmented_Logik
4,gply7c5,Make them cover they got 2 days!,25,0,1614825478,wesss11
5,gply9fa,GME is the only ticket  (for now),-5,0,1614825507,GrapheneHands42069
6,gplyb2m,[removed],1,0,1614825529,[deleted]
7,gplybrp,[removed],1,0,1614825539,[deleted]
8,gplygvz,[removed],1,0,1614825608,[deleted]
9,gplyhfh,"I believe u can do one or two day trades in a 30 day period. And I believe they consider a day trade would be buy the stock or call in the am then sell it that same day. So not selling one stock and buying another

Please if I’m wrong let me know",0,0,1614825615,ugod02010
10,gplyq58,"Uhhhhhhhh seriously? You think people were here for $1 dividend. Fuck out of here. You know it was to fuck with the hedgies and squeeze the shit out of it. There's like 100 ""this will squeeze harder than gme"" posts on wsb a day.",5,0,1614825734,horrorhoney
11,gplytv5,[deleted],1,0,1614825785,[deleted]
12,gplyv0a,Pigs get slaughtered,34,0,1614825799,_TidePodEater
13,gplz09k,"Just.... no. 
People have been talking about a RKT squeeze for months. Frankly I *still* don’t understand the exact dynamics because I always thought a squeeze could theoretically make sense given low float high short interest and dividend and had wondered why it didn’t happen. 

You’ve learned entirely the wrong lesson. The right lesson is: 
**a TRUE short squeeze where hedge funds are forced to cover due to borrow recall is incredibly incredibly incredibly rare**
You can get a gamma squeeze. You can get a January short squeeze where hedge funds are losing money on both sides of their book and they have to cover because their NAV is declining while shorts are blowing up (they need to post more margin). But a situation where hedge funds *need* to cover because their stock is getting recalled is few and far between. These attempts will continue to follow the same short lived pattern.",6,0,1614825871,Verb0182
14,gplz13n,[removed],1,0,1614825882,[deleted]
15,gplz1ib,Next P&amp;D is SKT. Careful with that one,27,0,1614825888,Global-Sky-3102
16,gplz1kv,"No it was to fuck with shorts that have kept it under its market value as a company even though they smashed their earning by 3x with 9 billion and they made bank after IPO spike. The CEO said publicly he disliked that and the buyback is to get the company evaluated properly. Some have evaluated it at JPM status. Most are 35-40$ range. It could easily be higher. 

You should do you're own DD and not read omg gme squeeze!!!! Again people wanting that were the ones who got burned and the ones screaming distraction.",22,0,1614825889,Fragmented_Logik
17,gplz3eb,"RKT is a long play not a short squeeze IMO.  It’ll go up, buy and hold or buy leaps.

I sold before earnings because everytime I hold through earnings I lose.   Waiting to see where sis settles before hopping back in",10,0,1614825913,Jets237
18,gplz47e,"Exactly 
Easy abs simple way to explain what I been posted every time Hf , insider , bots been manipulate the narrative here 
We need to buy and hold AMC , GME 
WE LOCE THE STONK 
DONT FALL FOR this Trap 🪤 
Good job 🦍💎✋🏼🚀🌝",3,0,1614825924,MoRaLoSeVisH_13
19,gplza0f,[removed],1,0,1614826002,[deleted]
20,gplzapa,Wrong,1,0,1614826011,MoRaLoSeVisH_13
21,gplzb4m,[removed],1,0,1614826017,[deleted]
22,gplzelj,"Wrong , bots 
Citadel buy millions call
Before the price went up 
Now they sell millions puts 
Result 
WB lost $$ they make $$$",-3,0,1614826063,MoRaLoSeVisH_13
23,gplzenu,Well what’s wrong,1,0,1614826064,ugod02010
24,gplzh5m,[removed],1,0,1614826097,[deleted]
25,gplzor4,[removed],1,0,1614826201,[deleted]
26,gplzp1a,"I do my own DD, which is why I didn't invest in it (yet). I definitely think it's worth more than it is. But I knew this would happen because it has happened everyday for a month! 

Like someone needs to make a video like the SPCA makes and have that ""in the arms of the angel"" song playing, with RIP and list the 80 or some ""short squeeze"" stocks that were more short than squeeze. You get to same boost putting your money in cheap ass pharma stocks that every few months release a new ""we are so close to curing cancer!"" and the stock blows up for a hot minute. Next day back to $2.",-1,0,1614826205,horrorhoney
27,gplzp5b,"I think the hedge funds and big money are able to instantly settle trades as well. T+2 says you need to recieve payment within two days, doesn't say anything about how fast you can settle. This prevents us retail from making many trades as brikera hold on to cash most of the time for the two days.

I am tarded. This is not advise.",2,0,1614826207,Jackprot69
28,gpm04hw,"Not every stock going down is about a friggin hedgefund waging war on society, jesus christ.

This stock had two days of green and now it has a consolidation day on a red day. The dip was SO predictable.

Don't marry the stock...Unless it's GME.",31,0,1614826423,FractalAsshole
29,gpm0smb,[removed],1,0,1614826769,[deleted]
30,gpm0u2n,[removed],1,0,1614826789,[deleted]
31,gpm0vc7,[removed],1,0,1614826807,[deleted]
32,gpm12rn,"They need people to FOMO in to a stock in order to sell off their positions and not make it obvious. They use these events against us by leaving people holding bags, and using the media to blame it on redditors.",5,0,1614826911,XJcon
33,gpm170h,"I just googled SKT and hedgefunds, two funds showed up top of that list, Point72 and Citadel. Both of these assholes were involved with screwing everyone up and are now using is against each other for their gain. Believing more and more the only play is GME and anything else is gonna get a lot of people wrecked.",11,0,1614826972,caucasian_asian03
34,gpm1ex7,[removed],1,0,1614827086,[deleted]
35,gpm1fae,"Limit of 3 intraday trades in any 5 day period OR $25k in the account

Edit to add: just google pattern day trader",5,0,1614827091,Jule926
36,gpm1x86,ALL YOU NEED TO DO IS BUY AND HOLD GME!!!,14,0,1614827347,HienMighty
37,gpm1xic,[removed],1,0,1614827352,[deleted]
38,gpm21jg,AMC 2 💎✋🏼,4,0,1614827410,MoRaLoSeVisH_13
39,gpm2543,You can do 3 day trades in a 5 trading day rolling period. Buying and selling the same stock on the same day.,1,0,1614827460,AlRanger06
40,gpm25up,"Exactly 
Thanks 
I been posting This 
And people fell for this trap 🪤",7,0,1614827471,MoRaLoSeVisH_13
41,gpm292w,So then it doesn’t count selling one and jumping to another right?,1,0,1614827517,ugod02010
42,gpm2enq,If you bought the first today and sold today to jump into another that is still a day trade.,1,0,1614827598,AlRanger06
43,gpm2fst,[removed],1,0,1614827614,[deleted]
44,gpm2kau,"Ok. Yeah but only if I bought and sold the first one in that same day, so if I already had one and then sold and dumped that into something else it’s not? How about buying today then selling tomorrow",1,0,1614827678,ugod02010
45,gpm2kl1,"Day trade 
They have super computer 
They have many insider 
The algorithms they use is so fast they can buy and sell in nano seconds 
Plus the $$$",1,0,1614827682,MoRaLoSeVisH_13
46,gpm2m73,I wouldn’t trust AMC. If you believe in the long play sure. But for a squeeze I don’t trust the board when they do shit like this https://www.google.com/amp/s/www.businessinsider.in/entertainment/news/struggling-amc-is-giving-its-ceo-a-3-75-million-bonus-and-paying-8-3-million-bonuses-in-total-for-extraordinary-efforts-during-the-pandemic/amp_articleshow/81275161.cms,10,0,1614827706,HienMighty
47,gpm2o99,"Non-AMP Link: [https://www.businessinsider.in/entertainment/news/struggling-amc-is-giving-its-ceo-a-3-75-million-bonus-and-paying-8-3-million-bonuses-in-total-for-extraordinary-efforts-during-the-pandemic/articleshow/81275161.cms](https://www.businessinsider.in/entertainment/news/struggling-amc-is-giving-its-ceo-a-3-75-million-bonus-and-paying-8-3-million-bonuses-in-total-for-extraordinary-efforts-during-the-pandemic/articleshow/81275161.cms)

I'm a bot. [Why?](https://np.reddit.com/user/NoGoogleAMPBot/comments/lbz2sg/faq/) | [Code](https://github.com/laurinneff/no-google-amp-bot) | [Report issues](https://github.com/laurinneff/no-google-amp-bot/issues)",2,0,1614827736,NoGoogleAMPBot
48,gpm2q6f,"U think the board really care about the company 
When hedge fund are paying him $$$ to sabotage the company",-2,0,1614827764,MoRaLoSeVisH_13
49,gpm2s4y,Didn't hear MSM warning anyone this time. With GME everyone seemed so worried about us. Why is that?,25,0,1614827792,CrimsonSun99
50,gpm2sc8,[removed],2,0,1614827795,[deleted]
51,gpm2u2a,Buy today sell tomorrow is not a day trade. I trade the SPX weeklies on Mon Wed and Fri each week and have never exceeded the day trade limit.,1,0,1614827820,AlRanger06
52,gpm2utq,"Where are you getting that info from??

Here’s more DD on an investor selling out creating more shares

https://www.google.com/amp/s/www.barrons.com/amp/articles/amc-entertainment-investor-silver-lake-sells-stake-51611962182",4,0,1614827831,HienMighty
53,gpm2vo1,"Non-AMP Link: [https://www.barrons.com/articles/amc-entertainment-investor-silver-lake-sells-stake-51611962182](https://www.barrons.com/articles/amc-entertainment-investor-silver-lake-sells-stake-51611962182)

I'm a bot. [Why?](https://np.reddit.com/user/NoGoogleAMPBot/comments/lbz2sg/faq/) | [Code](https://github.com/laurinneff/no-google-amp-bot) | [Report issues](https://github.com/laurinneff/no-google-amp-bot/issues)",1,0,1614827843,NoGoogleAMPBot
54,gpm2x11,Thanks for the info! Appreciate it,2,0,1614827862,ugod02010
55,gpm30nc,[deleted],1,0,1614827914,[deleted]
56,gpm31h8,"Think out the box 
We all know the stock market is a casino for hedge fund 
The USA GDP IS BS 
HOT MONEY 💴 is coming every day form the federal reserve to manipulate the market 
Bond , stock , etc",0,0,1614827926,MoRaLoSeVisH_13
57,gpm33vt,So you’re assuming and guessing?,2,0,1614827959,HienMighty
58,gpm35ib,"Idk what people are mad about. Plenty of DD on RKT since September. If you bought in, you believed in the future of the company. They're going to be a bigger part of your life than you think in the future. 1000 @ 21",9,0,1614827983,hailfire27
59,gpm366t,"Nope 
Is the facts",0,0,1614827992,MoRaLoSeVisH_13
60,gpm388v,Goodluck,2,0,1614828021,HienMighty
61,gpm3cqa,"Think 2t in Biden recovery will
He consumption 
In the recovery stimulus package a lot $$$ to banks and hedge fund",-2,0,1614828083,MoRaLoSeVisH_13
62,gpm3dsf,[removed],1,0,1614828097,[deleted]
63,gpm3ebj,Bro I’m here to squeeze AMC I don’t care for them I like GME,1,0,1614828104,kylefin559
64,gpm3hl9,"Why the fuck is everything on here some version of GME fucking the hedge fund coolaid, shits getting old, there is a shit load of other tickets out there.",3,0,1614828148,E223476
65,gpm3ld8,[removed],1,0,1614828201,[deleted]
66,gpm3o3e,[removed],1,0,1614828240,[deleted]
67,gpm3s61,[removed],1,0,1614828298,[deleted]
68,gpm3txt,"It’s never enough for you 💎🙌, is it?",1,0,1614828322,tbarb00
69,gpm3x6j,To think that you’d have a better debate with a microwave than this.,2,0,1614828369,Onetufbewby
70,gpm3zn6,"😂😂 it’s their money, hope they make tendies.",2,0,1614828405,HienMighty
71,gpm464r,"I can open and close (sell) at anytime. I’m at of a max for 3 trades in a Week and I can sell unlimited at any time. I use Charles schwab, thus far no issues trading for 3 weeks and I’m over a 40% gain. Friday on the dip I’m putting in 1k into gme at the dip. And no I’m not a day trader, but working my way up to having 25k in by the end of the year. Currently have around 2k amassed",2,0,1614828498,guyonsomecouch12
72,gpm46iu,[removed],1,0,1614828504,[deleted]
73,gpm4fnc,"All the GME holders were telling you that this was a p*ump &amp; d*ump and my post about it got downvoted into oblivion yesterday. The numbers just didn't add up and they got the paper hands to sell their GME and AMC to go for the shiny glittery RKT, today they got hosed.",14,0,1614828633,Houstman
74,gpm4fzh,[removed],1,0,1614828638,[deleted]
75,gpm4jr1,[removed],1,0,1614828693,[deleted]
76,gpm4pco,Idk why y’all make everything relate back to gme like if pump and dumps didn’t exist prior to that,4,0,1614828777,TheSaintLaurentDove
77,gpm54c6,The dude talks like my old barber from Brooklyn.  The difference is my barber makes money.,2,0,1614828999,Onetufbewby
78,gpm58yf,Dude people who bought calls on Friday were up over 2000%. This was profit taking plain and simple. Rkt is still gonna pop alot of those people will re enter tomorrow.,3,0,1614829068,shuckmyspoon
79,gpm5erz,"Because the MSM is actively talking about ""Reddit PnD"" now, jesus christ, it's not trying to turn everything into GME.

It's interesting how worried they were about that, but every other ""PnD"" they are basically cheering it on.

Are we watching the same MSM?",10,0,1614829155,CrimsonSun99
80,gpm5jo2,[removed],1,0,1614829226,[deleted]
81,gpm5ru4,I don’t watch msm at all 🤷🏽‍♂️ i could careless about what cramer has to say. i just get on here to ride the next wave and buy puts after,1,0,1614829349,TheSaintLaurentDove
82,gpm5xxp,"Games stop was a 300 million dollar company that squeezed to become a 20 billion dollar company. Rkt went from 40 billion to 80 billion. If you truly thought this shit could double again you'd be crazy.

Gme had the potential to fall back to 5-20 dollars/go bankrupt. Rkt had the potential to give you a 50% loss. Nowhere near the same loss potential.

GME has been around since mid jan. Theres a new pump and dump every couple weeks. Not everyone of them is some scheme organized by ""the hedgefunds""",2,0,1614829442,ND_NB
83,gpm6m94,You're reading way too much into this.,1,0,1614829819,Nonethewiserer
84,gpm6p26,🦍 can't read. Use pictures for us retards. 💎👋🦍🚀🌙,1,0,1614829864,Leetomnsx
85,gpm7dyx,"To me it's more interesting what they aren't talking about, avoiding, distracting from, etc. It's basically the only way to get any useful information from them. I'm autistic so I notice patterns that others might not see.",0,0,1614830252,CrimsonSun99
86,gpm7emj,Media condemns the gme squeeze but all of a sudden promotes other squeezes ? C'mon. IT'S A TRAP,17,0,1614830263,Shwiftygains
87,gpm7ld0,[removed],1,0,1614830371,[deleted]
88,gpm7peb,People are going to try and generate sentiment on tickers in here to pump them and make money. Could be hedge funds could be random prop firms...doesnt matter. Influencing people to buy and sell shit to take their money is exactly what happens every day all over the place.,2,0,1614830433,0Bubs0
89,gpm7r0o,[removed],1,0,1614830457,[deleted]
90,gpm82te,If you have a cash account you can do more than 3 day trades in a 5 day period it must be cash account though and not a margin.,1,0,1614830638,noskilljoe
91,gpm8642,[removed],1,0,1614830689,[deleted]
92,gpm86p6,Bro you’re delusional. But continue holding those bags buddy,0,0,1614830698,TheSaintLaurentDove
93,gpm88i4,Watch some YouTube videos on how to get around pattern day trades should learn a few things to help you,1,0,1614830725,noskilljoe
94,gpm8alt,"?

What bags?

The fuck you on?

You a bot?",-1,0,1614830758,CrimsonSun99
95,gpm9bg4,It's getting a little tinfoil-hatty in here.,1,0,1614831336,DrSeuss19
96,gpm9c9b,You have no history here prior to gme. Either you’re the bot or just a dumbass,0,0,1614831349,TheSaintLaurentDove
97,gpm9iil,Problem can't be fixed. Cat is out of the bag...they are alert now...so first time was epic,1,0,1614831448,UltimateTraders
98,gpm9ixm,"Luckily, I used my Cramer Index as my sell signal on that one. 

“If it’s on Cramer’s lips, it’s time to abandon ship.”

Seriously though, the HF revenue stream thing is a great point. Even though it was a W for me, I’ll be more judicious in the future.",2,0,1614831454,Unemployable1593
99,gpm9mas,"You accuse people of having bags when I've never posted my position.

Fuck off.

I've lurked here since 2018, I actually was here when DFV made his first post about GameStop.

Gatekeeping much? Jesus. What's your issue?",-2,0,1614831508,CrimsonSun99
