,comment_id,text,score,awards,timestamp,author
0,gpk3wp5,Fellas: is it retarded to look at something aside from GME? 🦍🦍,3,0,1614794201,Kaamzs
1,gpk4i0l,Honestly no. As long as you don't close any open positions in GME you ape,8,0,1614794454,TomTom_ZH
2,gpk4wgr,"Very good DD, genuinely seems like a good investment opportunity as that sectors gets more and more into the tech world and it's user base grows. However, don't you think it might be detroned by other bigger corps (ex; Spotify) when they realise they could make some moners there?",6,0,1614794628,Bladings
3,gpk595n," алмазные руки к луне  

# 📈",2,0,1614794780,TotallyNotMehName
4,gpk5eva,"It’s definitively a possibility agreed. But Anghami already has that footing and it’s not something to scoff at. Lots of exclusive premieres and exclusive streaming with the biggest artists in that region. Honestly following Spotify closely the last few years, I can’t see them doing something this involved. They operate on a more broad scale and just roll out new tools for artists and new updates to the app etc. They haven’t really done much to try to expand their market and I can’t imagine them doing so, especially with Anghamis choke on this particular areas market, I just don’t see it happening but it’s always a possibility for sure.",1,0,1614794849,Kaamzs
5,gpkf0pw,great analysis. I can confirm that Anghami is very popular for music streaming in Egypt and arab gulf countries. This stock has great potenional I guess. Unfortunatly I couldn't find the ticker $VMAC in etoro.,2,0,1614799006,ramisalama
6,gpnbatp,[removed],1,0,1614862142,[deleted]
