,comment_id,text,score,awards,timestamp,author
0,gphebi4,no,45,0,1614734063,TrueRandomDude
1,gpheeav,"First of all, no.",86,0,1614734104,ConBroMitch
2,gpheiuh,"What needs to be kept in mind there is at least 200% synthetic shares of GameStop (I.E. fake shares) so their short interest represents that too, they say it’s 60% shorted on at least 300% of the actual share number which means at least  180% of GameStop is shorted!!! 🚀🚀🚀 so my fellow apes no matter what as long as we stick to the cause and hold gain momentum tell everyone to buy gme!!! It’s pretty much guaranteed money, there is actually a better chance of this rocket taking off than any other stock on the market!!! This is just one apes opinion who has done hundreds of hours in research I went all in at 38$ every pay will continue to go to the cause!!! I’ve spent more on dumber shit!!! This is probably one of my best purchases to come 🥰😍🚀🚀 Yahoo finance shows the truth look how much of the company % is owned the short interest is calculated off of that too!!! I did the math they can roughly pay 20 million a share before they are insolvent if they liquidate everything

Ps: my apologies about run on sentences but I own 2 companies and extremely busy but I made time for this!! When I say all in at 38$ I mean it!! I can always make it back we’re young..  we couldn’t make this opportunity come back!!",24,0,1614734170,Mvpkillla
3,gphejgi,If you have no problem holding and your emotions are completely under control then just hold the entire position. Just a suggestion.,17,0,1614734180,Arpyboi
4,gphekj0,"Sir thank you for your question.  When I was a young boy in Bulgaria, I never learned what an exit strategy was",248,0,1614734196,mr_wankyspanky
5,gpheknb,selling off my initial investment at 69420,70,0,1614734198,Newfarious
6,gphel1a,"Yeah right, cuz hedgies and brokers won't restrict anything and let it hit $1000",9,0,1614734203,Adalatmv
7,gphel8k,[deleted],1,0,1614734206,[deleted]
8,gphem4a,"Wtf! I don't even have any gme, unfortunately, but if I did they would ALL be sold at $1000. That's next level autism thinking you got going on homes!",-13,0,1614734219,Constant_Flounder_39
9,gphendx,"I'm just hoping for at least $200. If we hit $1,000, I might shove all my crayons up my bunghole in excitement and die.",20,0,1614734236,doritodip
10,gpheo7r,$GME is going to hit 1000 on what squeeze?,-6,0,1614734248,WallStreetWarrants
11,gpheok1,This is the way 😂👋💎,16,0,1614734253,Arpyboi
12,gphepbq,My wife’s boyfriend said I’m not allowed to sell...and then he called me a paper handed bitch.,48,0,1614734264,Professional-Bed-568
13,gpheplu,[deleted],1,0,1614734268,[deleted]
14,gpheqso,100k or bust.,140,1,1614734285,KeKaten
15,gphes69,Which stage is bargaining again 🤔,-4,0,1614734305,Groundbreaking_Arm47
16,gpheswk,Sounds like paper hands to me man 🤷‍♂️ That doesn't be very well received around these parts,5,0,1614734316,Arpyboi
17,gphet36,I'll sell 1 at that price and the rest never,9,0,1614734319,StayStrong888
18,gpheu0d,Proof or it didn't happen,17,0,1614734332,Arpyboi
19,gphevhb,69420 or gtfo,14,0,1614734353,Holdntowhtsgolden
20,gpheyrh,"They're already in shit from restricting trades the first time. If they do, they'll just be digging themselves a deeper hole. Either way they're fucked imo.",6,0,1614734399,Arpyboi
21,gphf0ma,Lol did you mean 100k,59,0,1614734424,code-music
22,gphf0ny,lol right,-1,0,1614734424,___fantastic
23,gphf2hg,Hard pass bro,3,0,1614734450,edukated4lyfe
24,gphf31j,But will it ACTUALLY hit $1000? That’s the question I need an answer to 😂,1,0,1614734458,ITSLILGEEK
25,gphf81u,Take them to the grave.,8,0,1614734529,Arpyboi
26,gphf9yp,"Sir, this is a casino.",6,0,1614734556,DekeKneePulls
27,gphfa5w,As he should.,18,0,1614734559,Arpyboi
28,gphfaod,👋💎,15,0,1614734566,Arpyboi
29,gphfb38,Need all those RKT share holders to sell and buy GME. The volume on a stock not being shorted is ridiculous.,6,0,1614734572,Joseph-Merrow
30,gphfbxl,"Can someone link me a YouTube video on this ""exit strategy"" I'm kind of retarded",6,0,1614734584,HairyRope
31,gphfc22,"Good post mate! 
Hate is a waste of time and that's all most of the comments are.
You're getting through, there's a few that'll take your advice.",5,0,1614734586,southsidestoic
32,gphfd5f,The gamma. Last time was just a test flight man.,3,0,1614734602,Arpyboi
33,gphfdlt,You have a sell button?,4,0,1614734608,chingy4545
34,gphfelp,the 1600% gain in a month was a test flight?,2,0,1614734622,WallStreetWarrants
35,gphfez9,How r they in shit. Did they get get shutdown ? Business as usual.,4,0,1614734628,Rpark444
36,gphffph,Must have made a typo 😂,13,0,1614734639,Arpyboi
37,gphffxz,[deleted],1,0,1614734642,[deleted]
38,gphfhzh,"That's not why I like this stock. But fuck, it helps.",5,0,1614734671,youngbudding
39,gphfi0z,Just because you sell Herbalife and Cutco doesn’t mean you own two companies fuckwit. 180% shorted lmfao 🤣.,-4,0,1614734671,fishythepete
40,gphfjh8,I usually do that to take out the loss factor but with this play it’s pretty obvious we’re going to $69420. I’m not selling a single share till then,2,0,1614734692,Jasbeats
41,gphfjxk,The one where rh fcked it up a few weeks ago.,2,0,1614734699,Rpark444
42,gphfk31,"I guess if we're gonna gamble, we might as well be completely irresponsible 😂 Go big or go home",3,0,1614734701,Arpyboi
43,gphflbs,I guess I’ll keep my 1 share 😂,5,0,1614734718,Majestic-Day-2616
44,gphflfx,I’m still holding to GME but a lot of WSB momentum has shifted to RKT,2,0,1614734719,-Chuchoter
45,gphfndj,Way is the thee,5,0,1614734747,foknrekt
46,gphfnm3,"Did this during the first rise. Cashed out, was happy, changed my mind, bought back in. I prefer burnt sienna crayons. Tastes better.",2,0,1614734750,Nerdso77
47,gphfo48,"What is an 'Exit Strategy'?

And why are you expecting the sqquueeeeezzze before the the end of the month???",2,0,1614734757,krussell25
48,gphfog9,I'm on my way to Target to buy the Crayola 120 count. One by one right up the stink sink. Hopefully my gains will be enough to cover my funeral and PR clean-up for my family.,13,0,1614734762,doritodip
49,gphfot4,dont try to rationalize yr own plans on us reeeetarrrds,0,0,1614734767,oneticketroundtrip
50,gphfp22,"Yeah sure man, here's a pretty decent video explaining exactly how to exit step by step:

https://youtu.be/dQw4w9WgXcQ",6,0,1614734771,Arpyboi
51,gphfpz2,I guess I'll sell at $999.99 then,3,0,1614734783,Rpark444
52,gphfsq0,"As long as you hold, you can shove whatever wherever you want.",5,0,1614734822,youngbudding
53,gphfsqe,"Thanks man. Hopefully this will convince someone who would have sold everything, to just let the winner run.",3,0,1614734822,Arpyboi
54,gphft33,They were up 20% today.,3,0,1614734827,Professional-Bed-568
55,gphfv36,I want what this guy is smoking that being said I’ll take 25 more in the morning,18,0,1614734856,csals85
56,gphfvy6,✊💎✊,1,0,1614734869,oneticketroundtrip
57,gphfw30,"Don't take too kindly, none a'tall.",0,0,1614734871,youngbudding
58,gphfwmu,Who knows 🤷‍♂️ We're speculating but that doesn't mean we can't have a plan,3,0,1614734879,Arpyboi
59,gphfxrf,When I was a young boy in Bulgaria men would touch me and I liked it ....,1,0,1614734896,Turtledung
60,gphfxvr,Great plan!    🚀 🦍 💎    H   -   O  -  L  -  D.,4,0,1614734897,Primatetoo
61,gphfzk2,Robinhood alone is facing 50+ lawsuits,2,0,1614734922,Arpyboi
62,gphg272,All I took away from that song was hodl,5,0,1614734960,HairyRope
63,gphg35u,"Yes, awesome. Now sell and buy GME. GME would gain 50% easily and keep going",6,0,1614734973,Joseph-Merrow
64,gphg37y,Thanks bro. Not even into that stuff but whatever it takes to get the WSB spirit back up again on GME. 🖍️🍑,5,0,1614734974,doritodip
65,gphg508,"If you sell, such pleasures are off the table unfortunately.",3,0,1614735000,Arpyboi
66,gphg8jm,I have a strong suspicion that he's snorting it man,10,0,1614735051,Arpyboi
67,gphgbgp,I think he did..lol,6,0,1614735091,Sweet_Committee_1345
68,gphggkv,"I dont own it. I'm bag holding on AMC, and I got 90 shares of GME at $120 avg. I'll never sell. I wrote it off at $48. Lots of Apes feel same.",6,0,1614735163,Professional-Bed-568
69,gphggut,"And second of all, HELL NO",22,0,1614735167,parlevoo
70,gphghfn,This is the way,13,0,1614735176,parlevoo
71,gphgids,You guys are getting paid?,5,0,1614735189,Arpyboi
72,gphgj59,Sharpie in pooper,2,0,1614735200,parlevoo
73,gphgj7b,Every little helps,4,0,1614735201,Arpyboi
74,gphgm7w,"Fair enough man. If you are emotionally strong and won't sell, then hold the shit out of your shares.",4,0,1614735244,Arpyboi
75,gphgnvc,"You spelt 690,420 wrong",11,0,1614735268,parlevoo
76,gphgp1g,Finally a voice of reason amongst all you clowns,58,0,1614735285,TheMoonAndAntartica
77,gphgq0j,That was always allowed man 👌💯,3,0,1614735299,Arpyboi
78,gphgq63,"Its ok, everyone has trouble typing $690,420 from time to time",9,0,1614735301,parlevoo
79,gphgqyh,Didn’t hear no bell,4,0,1614735313,Cannabiscookout
80,gphgr82,"Bro, just buy non-toxic crayons.",6,0,1614735316,coyotesloth
81,gphgrel,Work off the assumption that it will,3,0,1614735319,Arpyboi
82,gphgt39,My wife's boyfriend told me so,2,0,1614735343,Arpyboi
83,gphgwfj,My initial investment came from $31 worth of AMD stocks 5 years ago sooooo....yea...100k minimum it is!,9,0,1614735391,droys86
84,gphgx49,"Due to some very, very stupid moves early on, I'm too deep in ape dung to sell. Just doesn't make sense. So I hold. Pain before pleasure.",4,0,1614735401,doritodip
85,gphgx7r,Thatll never happen you idiot,-1,0,1614735402,definitely_not_stan
86,gphgy2k,At minimum you must have aluminium hands,2,0,1614735415,Arpyboi
87,gphh0bj,Only blue crayons or it’s a bitch move.,3,0,1614735448,BOOFIN_FART_TRIANGLE
88,gphh0mu,25 shares at 210. It is all I have. Wish I had more to invest.,3,0,1614735452,Joseph-Merrow
89,gphh2th,It happens to the best of us smooth brains,3,0,1614735483,code-music
90,gphh3io,"Ehhh, i reckon he’s got baking soda and a hot plate.",4,0,1614735493,coyotesloth
91,gphh87l,Trading GME these last couple months has turned my body very toxic. I fear for the crayons. I hope they lived a good life.,7,1,1614735561,doritodip
92,gphh8st,"Hold everything if you can, this post is to prevent as many paper hands as possible.",17,0,1614735569,Arpyboi
93,gphh96w,Just hold if u cant stack. I'm out of bullets.,3,0,1614735575,Professional-Bed-568
94,gphhbqe,This is the way,2,0,1614735611,Arpyboi
95,gphhdap,Make sure they cremate you. That'll be a fun rainbow covered mess to scrape off the tray.,6,0,1614735633,thePathUnknown
96,gphheeb,"Ape dung is good, we like ape dung.",3,0,1614735647,Arpyboi
97,gphhgte,"No bullets here. I originally had 23, and was able to snag two more on a dip.",3,0,1614735682,Joseph-Merrow
98,gphhi7b,You can sell GME?,3,0,1614735703,fakingglory
99,gphhjtl,"u/DeepFuckingValue about to roll up and comment ""130k""",34,0,1614735727,Arpyboi
