,comment_id,text,score,awards,timestamp,author
0,gpi3wfz,Sailence dude. They think the same thing will happen to uwmc that rkt did. And it might... maybe not a run up of 70% but still money to be made.,2,0,1614747874,BeNiceDontBeMean
1,gpi4gik,I have  a hard time believing that. I think there is a significant squeeze left to squeeze here.,1,0,1614748243,hoodatis
2,gpi4l3z,There is more short interest and greater upside here than gme...that's for sure. The only thing gme has at this point that rkt doesn't is popularity and dfv.,2,0,1614748327,hoodatis
3,gpi4njf,And dont apologize. Im from the deep south with a canadian sense of humor. We good.,2,0,1614748372,hoodatis
4,gpi53fv,Almost as annoying as posts like this.,-7,0,1614748664,wackassreddit
5,gpi58c3,I thought the short float was much lower than that of GME? Got any DD you could link? I have a stop loss at 37.50 but I’m tryna figure out whether to keep it or not.,1,0,1614748755,definitize
6,gpi58wq,"Same, I joined the day after gamestonk went from 18 to 36. I wasn't even a part of the old sub and still want it back",4,0,1614748767,Rocky-Bullwinkle
7,gpi5ygx,"Yeah I get ya. We all see it. That's where personal DD comes in. Too many smooth brain sheep not looking for themselves and blindly following. But we all knew that was coming. It'll work itself out will all the shills get bored and the sheep go broke. Then it'll be back to the WSB of old. With gambling YOLO monkeys and loss porn for the ages. Till then, stay strong and do your own DD. Obligatory not advice.",3,0,1614749254,botulinum95
8,gpi6f91,"What i saw as of 2/26 was gme short was 22% and 0.5 days to cover while rkt was 46% and 5 days to cover.  You also have to look at fundamentals...gme is on the long term down trend with a good strategic option to turn things around. Meanwhile, rkt just hit a grand slam out of the park.",3,0,1614749574,hoodatis
9,gpi6yfr,You’re not supposed to tell them I haven’t named my porn account dude,2,0,1614749946,large_block
10,gpi84jl,Tru retard indeed the short squeeze just happened,-3,0,1614750767,Im-a_dinosaur
11,gpi8gr8,Kinda shilly in here tonight 🥶,-3,0,1614751017,WilliamButtlicker87
12,gpi8z7z,I can confirm this. I went full on lazy with my username and I’m a real person. 🤷‍♀️,2,0,1614751396,Embarrassed_Hat_2904
13,gpi9gq6,I'd look into AESE as well. Super similar in market cap and potential. AESE has actually been doing in raw numbers.,1,0,1614751752,-Grant
14,gpia8lu,"Yeah the 95% gain short squeeze is squoze, but totally not the 2000% squeeze from GME round 1 or 150% Squeeze from GME round 2",-3,0,1614752332,PokemonInstinct
15,gpiaqxk,I am Groot,9,0,1614752721,Plate-toe
16,gpib4x1,[deleted],1,0,1614753020,[deleted]
17,gpib639,I cant call it shit and it got real bad when zjz was pinched but hes back and things are better. There ate 7+ million more of us in this group. Groups Form by finding a norm hence all the different subs here. Then its Storming where old norms fight new ideals and then the group Preforms once everyone circle jerks each other. Yes the place is different but a lot of things have changed and without these people our original ideas wouldn't have shown much of a proof of concept.  I thank the new people. They need to learn and be taught the ways here.,3,0,1614753046,Plate-toe
18,gpibkv3,WSBgod is a fraud,2,0,1614753369,quaeratioest
19,gpibpfe,I'll gladly take your bags.,1,0,1614753470,Necr0mancerr
20,gpibuht,Rkt is worth more than gme ever has been imo.,2,0,1614753583,Necr0mancerr
21,gpibvmr,RKT is just a fundraiser for GME 🚀🚀,-1,0,1614753607,quaeratioest
22,gpid4vc,"Gotta turn on meme free mode and start filtering with -GME.

Honestly hardly any of the GME DD is worth looking at. Ranges from stock brigading, (which isn't allowed) to delusional power fantasies expecting to take down financial groups with far more buying power than we could ever have.

I'm all for some retard support and the ""fuck yeah"" mentality but man the GME FOMO has made people think they can will a stock into making them billionaires. It's sad really.",2,0,1614754621,SomeDudeFromOnline
23,gpidqk3,[removed],1,0,1614755117,[deleted]
24,gpiec4j,![gif](emote|free_emotes_pack|yummy),-1,0,1614755622,Outrageous_Trade_103
25,gpieqwp,[deleted],2,0,1614755970,[deleted]
26,gpig0ms,I feel this discussion is were we should be. Not all these people getting pissy because you are putting your money into something you think is a good bet.,1,0,1614757070,McPenguinButtSalad
27,gpig56f,Sorry,1,0,1614757184,McPenguinButtSalad
28,gpihn24,"dude i feel you. i posted a RKT yolo because i sold a lot of my old holdings to get in early at 21.05 and i got so many downvotes and negative comments saying hf are shilling RKT 😂 i read the DDs and shocker, RKT is actually a good company that was undervalued. the amount of gme groupies here is making it harder to find gems that people are putting good effort in to shine a light on a potentially good stock. imagine an investing subreddit that only talked about one ticker lol that would be actually retarded.",1,0,1614758545,l0wryda
29,gpii0q2,[deleted],1,0,1614758900,[deleted]
30,gpiiqpz,"Why did we not get transparency about how GME megathreads were going to be handled, ahead of time?

First, the thread wasn't made.

Then the threads made by users were being manually deleted.

Then we got a comment stickied to the top of the daily thread saying words to the effect of ""no more GME daily threads, more news later.""

That comment got deleted.

Then we're told ""it's because interest in GME has died down"" (???????? Do you people LOOK at your own subreddit?)

Then RKT gets a sticky. It gets MASS brigaded by the rightly fucked off GME pushers.

Then we get told that the mods simply ""forgot"" to make the GME thread.

Then finally, it was because Opinion forgot to set an alarm.

...

What. The. Fuck. Is. Going. On.

You don't want people to believe in conspiracies? Act homogeneously and transparently.

I haven't seen ANY good DD on GME for DAYS even though there is TONS of important movement going on with it. Somehow RKT is the ONLY majorly mentioned DD ticker on Monday?

Everyone believes 3/19 is the MOASS date... BUT OPEN INTEREST IN GME IS HIGHER THIS FRIDAY. THIS. FRIDAY.

I don't want to believe asinine theories like top-down manipulation. So some clarity on this is going to deeply alleviate that poisonous sentiment.",-3,0,1614759569,admiral_asswank
31,gpiiqqf,"IF YOU'RE GOING TO FILIBUSTER, YOU SHOULD RUN FOR SENATE!


*I am a bot, and this action was performed automatically. Please [contact the moderators of this subreddit](/message/compose/?to=/r/wallstreetbets) if you have any questions or concerns.*",3,0,1614759569,AutoModerator
32,gpiiqqr,"Eat my dongus you fuckin nerd.

*I am a bot, and this action was performed automatically. Please [contact the moderators of this subreddit](/message/compose/?to=/r/wallstreetbets) if you have any questions or concerns.*",5,0,1614759570,AutoModerator
33,gpijh3o,They are I seen a post about them commenting on things that seem to be trending at such and such times.,1,0,1614760250,Necr0mancerr
34,gpikyug,perhaps you need to start your own sub for y'all paper hands 👐🧻,-1,0,1614761661,cptnic
35,gpilmlq,[removed],1,0,1614762291,[deleted]
36,gpimg4m,"I'm literally at a point where if I like a DD post on here, I'm pretty confident it will be profitable for me over a 24 hour timeframe.",4,0,1614763086,soggysloth
37,gpin7q4,"Nobody ever lost money by taking a profit.

I'm taking everything I'm reading on here with a grain of salt and making my own decisions, and no longer using money I can't afford to lose. 

The way I see it, I have free tickets to the ride now. I don't know if I'm going to enjoy it or not, but at least I'm not paying for the experience.",1,0,1614763823,soggysloth
38,gpinwq1,Not everything is a short squeeze you know. RKT SI isn't even abnormally high.,5,0,1614764498,TheLegendDevil
39,gpio2v9,That's what some are missing actually... Those that jumped in $GME at the top lost big... They need other opportunities to recoup cash so they can get back in $GME later... Honestly what needs to be done right now for this reddit thread is the next big stock... Save those that lost on $GME🤷🏼‍♂️🤷🏼‍♂️🤷🏼‍♂️,0,0,1614764666,Grand-Oil9984
40,gpipce6,"&gt; curtail the shit flinging 

Bruuh, we literally apes.",0,0,1614765894,Leenixus
41,gpit36e,[removed],1,0,1614769551,[deleted]
42,gpitc5t,"Gme needs to run its course. This sub will be back when the bots, shills, new traders stop posting. Right now gme is the biggest stock in the world and it won’t change till it’s squeezed.",3,0,1614769782,johnwithcheese
43,gpito0c,[removed],1,0,1614770082,[deleted]
44,gpiv6ld,Agreed it's like they're so mad everyone else is making money and they aren't,1,0,1614771420,ahungrylilsandwhich
45,gpivm74,Should they just make your investments for you too? Fuck dude do your own work.,1,0,1614771776,ahungrylilsandwhich
46,gpivnou,"Have the spam filters been turned up to 11 recently? Had a pretty amazing 3D printed WSBboy that I posted get immediately auto-modded with no response from mods when I sent a message...

Even a few months ago the mods would at least respond back if they thought the deletion was warranted....",1,0,1614771810,KimchiCuresEbola
47,gpivo2n,"After all the DD showing rocket had potential to live up to its name, I rolled it around in my head of dropping my gee em ee. But I have faith. Though the tendies would’ve been much sweeter with what little I got and the options I was eying up on Monday afternoon. 

FOMO is not the play. I hold my 73 with conviction even though I could’ve bought almost 1000",1,0,1614771819,jeepz127
48,gpivr68,😂😂😂 “squoze” 😂😂😂😂,0,0,1614771891,SweetIcedTee98
49,gpiw2qf,"Friend, you started a discussion about being annoying using the word ""Hella"".  Now may be the time for inner reflection.",1,0,1614772153,NemoNewbourne
50,gpj088s,Swear to God this sub is full of retards,1,0,1614775274,ahungrylilsandwhich
51,gpj0fql,"I didn’t understand Reddit when I signed up so I made this username to match my email so I wouldn’t forget it when I signed in , lo and behold it’s not just a normal username but a unique handle 😣",1,0,1614775417,ironm360
52,gpj12y0,"The RKT mega thread was stickied at the top of the very delayed GME thread. It’s more than just “another stock.”

I’m happy for everyone’s gains and excited for some of that to trickle into GME but there was something going on between the two.",-1,0,1614775856,Grazedaze
53,gpj12yf,"Eat my dongus you fuckin nerd.

*I am a bot, and this action was performed automatically. Please [contact the moderators of this subreddit](/message/compose/?to=/r/wallstreetbets) if you have any questions or concerns.*",1,0,1614775856,AutoModerator
54,gpj1oog,"RKT's SI of 40% is considered abnormally high. &gt; 20% is considered high. Take into account the float - it's a good opportunity to make money. That being said - don't expect a ""GME"" out of it. This is a different scenario.",1,0,1614776255,seanders_
55,gpj24iv,I think you might want to hold a bit things are not up this pre-am RKT will go another 20% after open . UWMC will not fair as well as it's all ready up 24% before open 11.38 high maybe 13-13.50 . but i really don't know shit just guessing,1,0,1614776539,turkey4724
56,gpj4zvp,How about making a GME flair and then a No-GME mode to filter it 😬😂,1,0,1614778278,noob_retard
57,gpjcb69,"I like your level headed response but I don't entirely agree. 

I do believe WSB does have the power to initiate a squeeze (or at least play a significant role). If I say 50% of WSB Degenerates are fake accounts (I believe that to be a conservative number) that still leaves 4.7 million of us legit. If each of those accounts have 10 shares of say GME, thats 47 million shares off the table. GME only has 45.16 million shares floating according to yahoo finance. All to say I think we downplay our own potential effect on the market. 

I can only speak for myself but the reason I down vote new DD is largely in response to the insane influx of new degenerates to WSB following when GME was making headlines the first time. I highly doubt those impersonator accounts (not all of them are) are here to support our noble intentions. There is simply just to much new DD to keep track of. Because of this I believe we have to be more vigilant than we have in the past, and part of me does not want to go fact finding every DD...I refuse to treat reddit as a second job...god bless you mods.

For the record I don't just down vote everything that is not GME. I do not down vote AMC because I honestly believe AMC DD (and BB) existed prior to the the surge of degenerates therefore making it more likely an honest DD with no ulterior motives.",1,0,1614782130,Rebelsquadro
58,gpjcb7p,"I'M RECLAIMING MY TIME!!!


*I am a bot, and this action was performed automatically. Please [contact the moderators of this subreddit](/message/compose/?to=/r/wallstreetbets) if you have any questions or concerns.*",2,0,1614782131,AutoModerator
59,gpjf7mw,"Everyone is pressuring people to buy GME because only about 5% (and I’m being generous) on here have any understanding of the markets and the rest piled on when they saw GME, bought the stock, and are now left with a plate of salted turd they can’t afford and are desperately trying to find an out.",4,0,1614783489,ziplocfullacock
60,gpjk89u,[removed],1,0,1614785753,[deleted]
61,gpjlfny,Bro the GME FANBOYS just stalked citron personally do not expect too much from them.,2,0,1614786289,Guruyu
62,gpjn373,So did you get into UWMC?,1,0,1614787015,TaloDee
63,gpjyjiz,[removed],1,0,1614791917,[deleted]
64,gpjzelg,"You don't know its coming actually. It probably already did happen. Whats going on now is you ""diamond handed"" fellas are trading back and forth. Where do you think those stocks are coming from? Frankly, I think the squeeze happened. And with how easy it is to buy GME as not many are truly holding I don't think it will again.",1,0,1614792288,HoboBandit82
65,gpk1pma,"You are right I do not know for 100% that the squeeze is coming but I trust my instincts that it is still on the table. Nothing in the stock market it 100%.

If the squeeze was the spike to 500 then what is this 100-120 wave we are riding right now? It surely isn't WSB single handedly creating a surge of 60-70 bucks from that 40 dollar bottom. Everyone and their mom seems to claim WSB is incapable of creating a squeeze play on their own. And if the claim is we are at the new fair market value of GME now then I also hold because I believe in the future of the stock.

I like the stock",1,0,1614793267,Rebelsquadro
66,gpknova,Hope you didn't lose everything cause the squeeze already happened.,1,0,1614802746,Im-a_dinosaur
67,gplpx8u,"\*\*Fun fact of the day for you apes: Melvin Capital has over 4,500 stock holdings (for ex. Apple, Microsoft, NIO, Facebook, Bank of America, Disney) . Good luck trying to NOT make them money. Stop bashing other companies as a ""distraction"" - it's literally impossible to not be investing alongside the hedge funds. If you think it's possible, then I suggest you start investing in Iranian equities lmfao.",1,0,1614821328,-_Ven_-
