,comment_id,text,score,awards,timestamp,author
0,gpkvaz7,"Yes, I did join pretty recently. So did about 8 million others I believe? 

The mention of other positions I'm holding was for the point of there being more in my portfolio than just memes. Other than trying to call out some of my positions because of their market caps, do you disagree with the sentiment? Is there not more to WSB than just GME posts?",1,0,1614806032,Basting_Rootwalla
1,gpkvbow,[removed],1,0,1614806041,[deleted]
2,gpkvkbc,[deleted],2,0,1614806144,[deleted]
3,gpkvkfn,🎺 🎺 🎺,12,0,1614806145,DavesNotWhere
4,gpkvt3f,"Haha exactly. I was going to buy $16,000 worth at $40 but I slept in the morning it started going up. It hit $180 and I thought ""yup, that's the peak"". Story of my life, constantly calling the perfect plays when I'm not actually in them. And mark my words, that's the peak of this squeeze. These people are delusional if they think it's getting anywhere near the highs it already did, much less $1k+.",4,0,1614806249,johnsnowthrow
5,gpkw514,"How many home loans have you applied for?  It seems all anal probes, errr, home loans suck.",3,0,1614806394,DavesNotWhere
6,gpkw6tl,[removed],1,0,1614806416,[deleted]
7,gpkwt7o,[removed],1,0,1614806689,[deleted]
8,gpkxhx6,[removed],1,0,1614806989,[deleted]
9,gpkxij6,i know i’m scared and when i get scared i need to hug something tight and i only own gme so i just end up hugging my shares tighter 🤷‍♂️,1,0,1614806996,Coral_Bones
10,gpkxj7l,Gay post is gay.,1,0,1614807004,DeepFuckingSquoze
11,gpkxp47,[removed],1,0,1614807076,[deleted]
12,gpkxujm,"RKT was literally the CEO declaring war on the hedge funds shorting him, and the stock went from around 25 up to 40, and now its back down to 28. These are facts. 

This shit about how every promoted stock not GME is the hedge funds is bullshit *not* just because it's baseless, but also because the actual volume of the people in this sub is not nearly as great as many people think it is.

The truth is that there are many opportunities to make money on the stock market, and you just hurt yourself by assuming your loyalty to a singular stock has any bearing on it's movement. By all means invest in what you believe in, but respect others for wanting to branch out.",6,0,1614807142,goatonastik
13,gpky0dc,So ape strong together?,2,0,1614807212,Fearless_Grapefruit1
14,gpky8c5,[removed],1,0,1614807308,[deleted]
15,gpkyr85,"Exactly, I made my own decision not to fomo into rkt. Thankfully.  I also have positions other than long gme.",1,0,1614807537,melanthius
16,gpkz29h,[removed],1,0,1614807672,[deleted]
17,gpkz3x5,[removed],1,0,1614807693,[deleted]
18,gpkzzy4,its so weird. i would have expected all the TP hands to have wandered off a long time ago.,2,0,1614808083,TheHedonyeast
19,gpl03vt,but you **can** be convinced that its not a pile of applesauce and thus that you can shatter it,12,0,1614808131,TheHedonyeast
20,gpl07z8,"GME was a team play, and there are tons of new people who only know GME.",1,0,1614808180,Nonethewiserer
21,gpl094u,Royal Caribbean,1,0,1614808195,artisans_of_earth
22,gpl09s0,"Aw you sold MVIS! That's like 30% of my portfolio. Although at this rate you will likely see RKT through to the 8th, maybe cash out depending on how the dividend payout goes and there will still be a dip for you to buy back into MVIS.",1,0,1614808203,hemareddit
23,gpl0i5c,"IF YOU'RE GOING TO FILIBUSTER, YOU SHOULD RUN FOR SENATE!


*I am a bot, and this action was performed automatically. Please [contact the moderators of this subreddit](/message/compose/?to=/r/wallstreetbets) if you have any questions or concerns.*",2,0,1614808307,AutoModerator
24,gpl0i43,[removed],1,0,1614808307,[deleted]
25,gpl0ktg,"Unfortunately, this is the way.",18,0,1614808340,bazacko
26,gpl0z6g,Nor do you need to. You just eat it.,3,0,1614808514,Nonethewiserer
27,gpl17q0,If you froze it first you could,106,1,1614808617,elboltonero
28,gpl19mx,"My theory is that RKT is an invention of the MSM shills who are afraid of the Reddit DD OGs.

I call it an MSMStock.",2,0,1614808641,pensando3
29,gpl1d9k,"&gt; ""yup, that's the peak""

Famous last words

RemindMe! 45 days",15,0,1614808686,da_muffinman
30,gpl1htj,"I will be messaging you in 1 month on [**2021-04-17 21:58:06 UTC**](http://www.wolframalpha.com/input/?i=2021-04-17%2021:58:06%20UTC%20To%20Local%20Time) to remind you of [**this link**](https://np.reddit.com/r/wallstreetbets/comments/lwta3q/i_love_this_community_but_we_need_to_talk/gpl1d9k/?context=3)

[**CLICK THIS LINK**](https://np.reddit.com/message/compose/?to=RemindMeBot&amp;subject=Reminder&amp;message=%5Bhttps%3A%2F%2Fwww.reddit.com%2Fr%2Fwallstreetbets%2Fcomments%2Flwta3q%2Fi_love_this_community_but_we_need_to_talk%2Fgpl1d9k%2F%5D%0A%0ARemindMe%21%202021-04-17%2021%3A58%3A06%20UTC) to send a PM to also be reminded and to reduce spam.

^(Parent commenter can ) [^(delete this message to hide from others.)](https://np.reddit.com/message/compose/?to=RemindMeBot&amp;subject=Delete%20Comment&amp;message=Delete%21%20lwta3q)

*****

|[^(Info)](https://np.reddit.com/r/RemindMeBot/comments/e1bko7/remindmebot_info_v21/)|[^(Custom)](https://np.reddit.com/message/compose/?to=RemindMeBot&amp;subject=Reminder&amp;message=%5BLink%20or%20message%20inside%20square%20brackets%5D%0A%0ARemindMe%21%20Time%20period%20here)|[^(Your Reminders)](https://np.reddit.com/message/compose/?to=RemindMeBot&amp;subject=List%20Of%20Reminders&amp;message=MyReminders%21)|[^(Feedback)](https://np.reddit.com/message/compose/?to=Watchful1&amp;subject=RemindMeBot%20Feedback)|
|-|-|-|-|",1,0,1614808742,RemindMeBot
31,gpl1hu7,"I'M RECLAIMING MY TIME!!!


*I am a bot, and this action was performed automatically. Please [contact the moderators of this subreddit](/message/compose/?to=/r/wallstreetbets) if you have any questions or concerns.*",1,0,1614808743,AutoModerator
32,gpl1oky,"The dividend isn't about getting the dividend. It's about pressure on the shorts. Yeah, if you get hard from moving $1.11 around for a net gain of 0 you're retarded.  But that was never the thesis.",2,0,1614808826,Nonethewiserer
33,gpl1td4,That's weird bc I can see it right now. Moving around and the like.,1,0,1614808886,da_muffinman
34,gpl20ci,"I've held shares of AMC and GME since January. I've also *sold* shares of AMC and GME, continue to buy dips, average down when I need to, taken profits along the way. With these profits I've bought shares of RKT, UWMC, and many others. You should obviously be trying to make money as you buy more shares, and you inevitably sell some of the shares you're buying in order to profit and multiply the number you can afford to hold.

Recently, I made money on SNDL and TLRY, but I still own TLRY. I look at it every once in a while, wondering if I should take the loss and throw the tiny amount of money at a different weed company. I have a small collection of weed stocks now, and I don't even smoke.

I don't even care about legalization as a social issue; I'm the opposite of a ""stock activist"". Regardless, I might miss my TLRY too much to ever sell. Now I want to see if it goes up just to resolve whether people who believed in it were right or not. It's a strange sort of sentimentality mixed with intellectual distraction that keeps me attached to some stocks, beyond reason.

Some of my stoks sit around gathering dust until I forget I own them, then I get notified some limit sell activated on a stock I was bagholding (but was I really tho) way back when it didn't moon. It's worth more to me sometimes to see resolution on the DD reasoning behind the purchase of certain stocks than it is to ""get to the moon"". I obviously want to get to the moon, but sometimes I wonder if it's just to be able to play this game at a different level -- not to enjoy a better quality of materialistic life.

I just like my stocks. ![gif](emote|free_emotes_pack|thinking_face_hmm)",3,0,1614808973,a0i
35,gpl2cmi,"lmfao this post reads like such a non-WSB r/all pleb that arrived with the initial GME breakout.

let's see checking post history... 

LMAO yup he's brand new talking about ""loving the community"" barf this is such r/all garbage who cares about your feelings",1,0,1614809125,ahypeman
36,gpl2kwj,"Fuck, I want to upvote this, but I need to downvote it in order to agree with it.",3,0,1614809227,fistymac
37,gpl2lbp,[removed],1,0,1614809232,[deleted]
38,gpl2yt8,any correlation between RKT and GME is 100% fabricated by the community and is unironically retarded,3,0,1614809404,Mjbishop327
39,gpl33r0,[removed],1,0,1614809466,[deleted]
40,gpl3h2f,[removed],1,0,1614809634,[deleted]
41,gpl3l7h,I'm buying diamonds for my grill,-1,0,1614809688,da_muffinman
42,gpl3ml9,"I only have calls on RKT. I made the classic mistake of being a true dumbass and holding at 2000% gains on my 3/5s at close yesterday. Apparently 2000% isn't enough when you're high on dopamine. Obviously those took a massive hit today. Should have set a stop-loss for today. Still made a profit, but lost about 1500% unrealized gains.

Still holding my 3/19s though.",2,0,1614809706,Basting_Rootwalla
43,gpl3tr6,"And these are the same people that told DFV he would be broke.  


The company will get to $1000 a share. It has a massive following, and if it follows through on its amazon-esque plans to offer games and computer parts delivered it should easily take a market share of a 200 odd-billion industry.  


If it will do that via squeeze or natural growth or both is neither here nor there.  


The company remains undervalued.",0,0,1614809798,utopian_potential
44,gpl410n,Yeah not one derogatory thing was said to me whilst reading this shit,2,0,1614809891,Coldkiller14
45,gpl44m7,They are sticking around for the “movement”,1,0,1614809938,Coldkiller14
46,gpl47vs,"Are we still pulling this narrative that WSB is just such a huge holder of GME that if they break us, it's all over and they have won? Next we're gonna act like WSB has the capability to pump and dump any stock they choose....

&amp;#x200B;

This is all plays from multiple big players and we're along for the ride.",2,0,1614809979,MoneyIndividual
47,gpl4fd5,[removed],1,0,1614810075,[deleted]
48,gpl4m8a,"I don't think you all realize how little power you have to move a stock. Hedge funds made it squeeze, both times. You're just along for the ride. $180 was when the hedge funds got out. I hope you did too. Edit: and it's not getting to $1k naturally any time soon either. 20 years? Ok, you got me there. It might get to $1k in 20 years. An $80 billion market cap in a $200 billion industry isn't easy. It's ridiculously difficult. Gamestop was declining before the pandemic. It was undervalued at $5, sure, but it's incredibly overvalued right now.",3,0,1614810163,johnsnowthrow
49,gpl4zmv,best math,1,0,1614810335,Azurpha
50,gpl54co,"I mean, it's not like I shorted it naked or something. Don't know why those would be my last words. I just think people who saw a stock go from $40 to $500 in 5 days and think that *isn't* the squeeze are delusional. And frankly, they're ruining whatever's left of this sub with their fanaticism.",4,0,1614810395,johnsnowthrow
51,gpl59pv,Anyone who makes long posts is 🌈,2,0,1614810466,GUHtFeeling
52,gpl5dkl,"""longtime lurker""

First comment on WSB was literally a month ago and about GME

gtfo. All of you thinking wsb is only about GME and nothing else made this sub cancerous af and not in a good way. Fucking hell, we were 500k members a year ago, now we have 9M more retards who think investing is only about holding GME and debunking fake ass conspiracy theories everytime someone tries to talk about something else

worse than the plague i swear

the mods should honestly ban the GME ticker and tgey would go elsewhere

edit: I get it, GME was a fucking hit and i loved it, but now its getting annoying. Don't get me wrong, I'd love to see it short squeeze to the moon but please calm your tits",0,0,1614810516,chad_loup
53,gpl5je8,"Dude fr, so sick of hearing hurdurhur gme!! Diamond hands ape together strongg!!!!

Like shut up already, if it was occasional update etc then fine but it’s gotten out of hand. And then we have people literally posting like: “alright boys whats the next pump 😎,lets make the institution’s bleed!”. 

They dont have the power that they think they do.

We have like 7 million new people too so the gme yells are deafening.",6,0,1614810592,cuntpuncher_69
54,gpl5t7h,Dude not everything is market manipulation,1,0,1614810720,cuntpuncher_69
55,gpl62aq,Thanks man. Great post.,2,0,1614810840,Ok-Composer-8278
56,gpl63pg,PIN THIS POST TO THE TOP 💎👐,2,0,1614810858,Wise-East2875
57,gpl6c27,I just got here and I'm too stupid to read this post,1,0,1614810967,tschmitty09
58,gpl6dm6,Why not both?,1,0,1614810987,MushyWasHere
59,gpl6fvm,Give up on this sub dude. It's dead.,2,0,1614811017,fungalfeet
60,gpl6iir,"At this point I’m content to sell into these mini squeezes and buy back in when it falls. Suggesting others do the same gets you called a bot, shill, and downvoted into oblivion.",2,0,1614811051,coinpile
61,gpl6ij8,"Yup, ive been holding for like 4 months",1,0,1614811052,cuntpuncher_69
62,gpl6vga,"When I was a teenager, I hung around on conspiracy boards. I noticed that anyone who had a thought or opinion that differed from the group, or questioned the narrative in any way, was called an “agent” sent there to sow discord and otherwise cause trouble. I’m seeing the exact same thing here as people call anyone who disagrees with them a “bot” or “shill” and it’s really concerning.",1,0,1614811222,coinpile
63,gpl6xow,omg stop manipulating my market,1,0,1614811251,Wildercard
64,gpl72hc,"&gt;Every time some one profits, some one else loses.

Well, the stock market isn't a zero-sum game for the most part",1,0,1614811314,30307Dawg
65,gpl77n6,This is manipulation,1,0,1614811384,cuntpuncher_69
66,gpl7ylw,"That depends if Cohen et al make the changes.

You don't think all the people on this wave - ie the customers of GME are going to let the store fall?

If Cohen offers an internet storefront like he did for Chewy that snatches into the Computer parts market, and the customers migrate back then why not?

The have a massive customer loyalty program, are global, just had terrible leadership and a poor internet presence. Both of those last two downsides are changing.

GME is currently 30$ above Chewy ($90). Chewy was started from the ground up and got market share on a 20 billion dollar pet industry .IF GME gets market share on a 200 billion dollar industry (in 5-10 years of course) what would the value of the stock be to you (If that hypothetical plays out)?",1,0,1614811740,utopian_potential
67,gpl7zew,[removed],1,0,1614811751,[deleted]
68,gpl93bv,There are bots. That much has been confirmed. Bots pushing GME actually. But where this sub loses me is calling anyone talking about anything besides GME a hedgie. Hedge funds do not need to go on reddit and pretend to be part of this group to maybe sway a handful of individual investors to sell. Also insulting people for taking profits is about the dumbest fucking thing I can think of on this sub. Don't take profits so my dumbass can maybe make an unrealistic gain,18,0,1614812276,xRATBAGx
69,gpl97ht,You are totally right.,1,0,1614812332,Megahuts
70,gpl9c2s,"most people who are in a cult, have no idea they are in a cult.",2,0,1614812393,night_goonch
71,gpl9lua,I'm buying an XL condom for my wife's boyfriend then buying oil tankers.,2,0,1614812525,PresumedLivingston
72,gpla13n,"I definitely get the suspicion of various posts on here. I feel it myself. However, this is a lot less interesting as a sub if we only talk about one trade. I think we need to be cool with people talking about other trades. Have our guards up for people who are shilling random nonsense (aside from the sort that makes WSB special), but not close ourselves off to new trade ideas.",2,0,1614812732,Paddy331
73,gpla9l2,My DD: just refinanced in January and moved my loan to another lender who was giving better rates. I’m a part of that 9% who left.,3,0,1614812848,King_Esot3ric
74,gpladul,Anecdotal evidence is not DD,2,0,1614812905,ecrane2018
75,gplb47v,"Well said, my fellow ape.",2,0,1614813270,fUnkleRico
76,gplbaxj,"Remember Apes together strong!!! NOT Apes togenther strong, but only if you buy GME.  NOT Apes togenther strong, but only if you buy RKT.

If you hold GME and you thing RTK is bad ... do nice DD on RKT since you are holding GME and ypu known you will sell at 69420000 , nothing will change. And doing nice DD on other stocks cang be good for your health, and mind.

If yoy get on RKT, you dont need to hate GME holder's .  We are all retarded APES.  **💎🙌**   🚀🚀 🚀🚀 We all love tendies  


Edit. I would like to remind that in diamond hands strategy was about holding long enough to drive GME to mega uper  squeeze. Not only for Diamong hands gains, but also for people who cant hanndle this tension .   
Remember we hold GME for every ape. Let others trade what they want. If uou really want help. do some DD about RKT",1,0,1614813363,shiew1111
77,gplbgtz,"Now if YOU had some applesauce, and I had some applesauce, and I had a spoon that reached aaaaaaaaaaaaallllll the way over to your applesauce....",0,0,1614813446,ludovic1313
78,gplboyk,[removed],1,0,1614813559,[deleted]
79,gplbrdy,[removed],1,0,1614813593,[deleted]
80,gplbs2z,[removed],1,0,1614813603,[deleted]
81,gplcb3p,[removed],1,0,1614813862,[deleted]
82,gplcmf0,"You think there's no squeeze left? What do you think is the price target for $GME 1, 3, 6 months from now? Can you support your position with technicals / data / facts?

I'm inclined to think $GME will continue to rise based on what I've seen, but I'm not married to the idea. They're still pushing the anti-gme narrative hard in the media which supports my bias. Change my mind",3,0,1614814019,da_muffinman
83,gpld2pv,"People have short attention spans. I think most here will forget about Gamestop within the next year even if they do change their business plan. Gamestop will have to offer something no one else does, or offer a better price. And I don't see them beating out Newegg et al for computer parts. I don't see them beating out Steam, GOG, et al for computer games, and I don't see them beating out the console stores for the convenience of purchasing a game from your couch. They're not going away completely, which is why the shorts were stupid, but I don't think they're coming back in a significant way either.

If they can do everything you say they will, sure, 5-10 years from now they could be worth $80 billion and it would be reasonable. That's a lot of what-ifs though when there are plenty of better stocks to look at during that time period.",1,0,1614814242,johnsnowthrow
84,gpld47b,What fucking unity. This is where we gamble individually and make money or lose it all. You retards are playing the game wrong,1,0,1614814263,MaleficentDistrict22
85,gpld585,This is fucking retarded. The goal is to make money. Hard stop. People are banging on each other over the stocks they trade?,1,0,1614814277,Drew1904
86,gpld6x0,[removed],1,0,1614814300,[deleted]
87,gpld72l,"What's it worth if they capture $25B? IDK, but I am guessing at least $300 per share. Perhaps $1,200 per share if they can capture $100B? I'd guess and say a large chunk of that $200B is going to game studios right now, and who knows, maybe they get in on that action somehow.",1,0,1614814302,Valuable_Ad3778
88,gpld75x,"Rkt was at a relatively low price and I read about the dude hating short sellers..so I dipped my toe in.

Didn't need to sell GME or AMC to do it.

Chill Getta.",1,0,1614814303,Replybot5000
89,gpldfhz,"If the trend is upward, that might not work as well as holding with a lower average. Granted, the last spike would have caused an overall increase in your position if you bought back in on today's dip. However, when you sell, you are betting that there will be another buy opportunity like that. It could have kept rising from that point.",1,0,1614814420,Valuable_Ad3778
90,gpldke5,"Anything that is not GME is a bot now apparently.  Sucks that this community is stuck on one company. Also... I have been long on RKT for months.. selling calls because it’s a manipulated stock... you guys fucked my covered calls up! Had to realign today. Lost out on 6 figure gains. I wouldn’t buy RKT at this price but I will say that there was unusual options activity in RKT a few weeks back at 30 strike price... and citadel I believe has a short position, they could have orchestrated this yes and used bots to pump it. I am just in RKT for it’s value and the CCs I have been doing are a bit fucked hopefully will return to its lower 20s price point.  Now selling 28-30 calls for 4/16",1,0,1614814489,EatTacosDaily
91,gpldpqp,"Hell even the DDs that isn't GME... Needs a whole section about ""shorts""

And at this point i assume anyone who spends their time talking about shorts... Don't know shit about what they're talking about",5,0,1614814564,fanfanye
92,gpldt3h,It worked for for other countries to do that to the U.S  so.....,1,0,1614814611,planetdaily420
93,gpldwnm,[removed],1,0,1614814660,[deleted]
94,gpldyby,Spankers for tankers,1,0,1614814684,deets2000
95,gple6fi,"IF YOU'RE GOING TO FILIBUSTER, YOU SHOULD RUN FOR SENATE!


*I am a bot, and this action was performed automatically. Please [contact the moderators of this subreddit](/message/compose/?to=/r/wallstreetbets) if you have any questions or concerns.*",0,0,1614814797,AutoModerator
96,gple6ey,"I think the possibility of a short squeeze still exists, but it's far less likely than it was in January. And I think they're not as easy to pull off as everyone thinks. In particular, I don't think retail investors have the power to do it. If you want to cite the January squeeze, that was hedge funds vs hedge funds. A price target on GME right now is virtually impossible with its volatility. I think it drops back down to the $40-$50 range, hedge funds will try to trigger small gamma squeezes now and then while it ping-pongs between there and $100-$150 until everyone here gets bored and quits. But since that's my thesis you're essentially asking me to tell you when I think people here are going to get bored and/or tired of bag holding for hedge funds. It already happened once (twice if you count the recent $180 high). It's not nearly as hyped as the first time. More people will drop off the wagon each time and sentiment will slowly shift to ""enough about GME already, that ship has sailed"".

Edit: And I think the only reason DFV is ""still in"" and even bought more shares is because he doesn't want the litigation, death threats, etc, etc that will come his way if he sells/sold at the peak, and he can afford it. It's a small price to pay for peace of mind. I really don't think even he is still in because he believes in the stock anymore. Dude has $15million, I doubt he could give a shit. But everyone knows his real name, that's a dangerous thing, and he knows it.",6,0,1614814797,johnsnowthrow
97,gplecff,"True, it could keep rising. That’s the risk you take with that strategy, lower gains. However, if it falls back down, you can buy back in having made more gains than you would by just sitting on shares.",3,0,1614814881,coinpile
98,gplej7p,"I'M RECLAIMING MY TIME!!!


*I am a bot, and this action was performed automatically. Please [contact the moderators of this subreddit](/message/compose/?to=/r/wallstreetbets) if you have any questions or concerns.*",0,0,1614814977,AutoModerator
99,gples8v,[removed],1,0,1614815105,[deleted]
