,comment_id,text,score,awards,timestamp,author
0,gpgt1ds,you don’t have to hold!,10,0,1614723369,mikeyj198
1,gpgt3as,Rip 🕯️🕯️🕯️,5,0,1614723394,salmonsimon
2,gpgt4zk,Me too man yoloed my life savings into spy puts expiring this week hopefully this works out! Gl,1,0,1614723417,fishermanallin
3,gpgt9e5,Market is tanking anyway. You’re fine,3,0,1614723473,lb-trice
4,gpgthll,Haha...this might actually work out at least,2,0,1614723580,joja0206
5,gpgtww2,You might win,4,0,1614723781,mjl1990uk
6,gpgu1sp,"You are buying leap puts on QQQ as in betting that NASDAQ will be going down over the course of the year?

You understand that companies are trying to make money and everyone involves in them is working towards increasing the value, which means that in most cases, you are likely to see values rise, not fall?

There are times for puts, but leap puts on QQQ?",9,0,1614723846,ElegantEntropy
7,gpgue16,"This will print.  Once job #s come out Friday, markets will sink... why?  Because those #s gonna look good.  Texas just fully reopened.  Rates will rise and stocks will fall.",0,0,1614724008,AlertConsideration95
8,gpgv57q,"Yikes, buy to close before you get assigned

edit: sorry, you bought. I thought you sold. you good then, sell to close or execute. you're in the money now",3,0,1614724368,Sheppard821
9,gpgvdgk,This is gonna print! You can also sell in the morning taking in your gains,1,0,1614724478,akura202
10,gpgvy3r,You're up. See how things go tomorrow.,3,0,1614724755,BuildBackRicher
11,gpgwwrs,You typed too much he’ll never read it,19,0,1614725216,fatnsassy69
12,gpgx0ou,[deleted],1,0,1614725268,[deleted]
13,gpgyjrd,About to add a zero to your investment given the current conditions,2,0,1614726002,Specific_Life
14,gpgz52u,Ahhh this is real WSB content. It’s been so long,1,0,1614726292,zomgstonks
15,gpgz728,"May 5 still wouldn't be a LEAP either. LEAP's would be Jan 2022, or Jan 2023.",2,0,1614726320,quiveringmass
16,gpgzc3c,Lost me at Y,11,0,1614726389,GushingGranny1
17,gpgzg68,Lmfao,4,0,1614726445,Deep_six_6
18,gpgzkiz,Sell first thing in the AM,1,0,1614726505,poloven
19,gph0yk7,This might actually print.,1,0,1614727202,rmme32
20,gph192w,I hope this prints for you.  You made me laugh so hard it made my day.,1,0,1614727350,MadSnikt
21,gph1h0f,[deleted],1,0,1614727461,[deleted]
22,gph1nwv,You can day trade options. i do it all the time.  Just sell them. you're in the money so take them off the table. You don't have to hold until expir. what the hell are you worried about ??. If you don't understand options go to [www.tastytrade.com](https://www.tastytrade.com) and get a FREE education.,1,0,1614727556,woofy28
23,gph9v36,[deleted],1,0,1614731757,[deleted]
24,gphfcfj,Probably not after the post market move up.,1,0,1614734591,RocketMoonShot
25,gphg4aq,god speed,1,0,1614734989,whooman12
26,gphms92,"Dudes leap puts is for mutual funds doing the hedge. Not a good ticker for us to make money.
If you want to pure gamble, do the nearest put",1,0,1614738429,arbitratex
27,gphukh2,Truly a brain of polished marble sculpted by Michelangelo himself.,1,0,1614742421,Skorpex
28,gphyz16,Hey what do you think about roblox? I’m here from your roblox DD around 2-3 months ago,2,0,1614744856,Dudesly-Games
29,gphzyns,I would recommend before anything going in youtube or anywhere to see what options are and then spending a few weeks learning it. Dont call it laziness.,1,0,1614745432,Individual-Jump-6654
30,gpj7ld0,"I still think RBLX is a truly unique company that will do well in the long run. However, considering the fact that tech stocks are now in decline as investors rotate to more ""value"" and reopening plays I do not really see this company as something that will soar on DPO day. In addition, most of its record 96% gains in revenue was due to the pandemic lockdown and right now the narrative is on reopening so I don't see this growth as sustainable. 
That being said, I probably will not buy in now on IPO day, rather wait until things settle down with the general tech sector before dipping in.",2,0,1614779729,GushingGranny1
31,gpj869q,Thanks!,1,0,1614780033,Dudesly-Games
32,gpkfi3m,This aged nicely,2,0,1614799215,BullfrogBrewing
33,gpkj8h6,\# Blessed,1,0,1614800806,GushingGranny1
