,comment_id,text,score,awards,timestamp,author
0,gph6603,"COVID cases, probably",81,0,1614729860,HardFlaccid
1,gph68l2,tuck fexas,-16,0,1614729898,Tendieman_420_69
2,gph693n,AMC baby!,34,0,1614729906,BigNastyPump
3,gph69l0,Masklessness.,4,0,1614729913,Archisaurus
4,gph6a96,So invest in ventilators???,12,0,1614729922,PhD_in_life
5,gph6au9,this guy has a big dick,7,0,1614729931,Ordinary-Altruistic
6,gph6bm1,Yup 😂😂,1,0,1614729943,4RichProd
7,gph6c46,AMC,10,0,1614729950,GalaxieTripster63
8,gph6evb,American freedom!!! You are still free to keep your paranoid a** at home with a mask on!,1,0,1614729989,vabensons
9,gph6fjo,Not even gonna lie. This news made me jump on the AMC bandwagon,20,0,1614729998,belacttu2
10,gph6gpr,"Replying to the question on the title, and from the perspective of a health professional, the only thing I forsee spiking is the number of new infections... That and any company related with pulmonary diseases.",-2,0,1614730015,dr3amcast3r
11,gph6h9d,Gme.,1,0,1614730022,malochico1
12,gph6hit,"I just got my first vaccine shot, waiting two weeks to get my next one.  Going to be some rising cases. I'll sit back with my popcorn.",-5,0,1614730026,ourgeneration_777
13,gph6hp3,"AMC, I may have liquidated your shares for the 🌝 gang, but I’ve still got a long dick call option waiting for your wife’s boyfriend.",1,0,1614730029,Opposite_Dimension_9
14,gph6irs,Yeah fuck those crybabies!,-5,0,1614730044,spenserhicks123
15,gph6l19,It's not really a bad idea all troll aside. I'm sure there's a market that would benefit from a cases spike,2,0,1614730077,belacttu2
16,gph6lhb,All this Freedom talk is giving me a Vet Stiffy.,2,0,1614730084,Lucchesse29
17,gph6qf8,Covid. Puts on Humans,4,0,1614730154,garpla
18,gph6s4n,Chucky Cheese. Fast Food . Fuel. Definitely Home Improvement market.,1,0,1614730178,GalaxieTripster63
19,gph6sbe,"Lol

People willingly destroying themselves

Unreal",1,0,1614730181,sourtwister
20,gph6scb,"I definitely agree there will be a case spike in the summer. Not just because of this, however, but because of human nature. Might seem like an odd and off color question, but as someone from that perspective, what companies have reaped profits from COVID aside from the obvious vaccine companies?",-3,0,1614730181,belacttu2
21,gph6u6o,Deez Nuts,2,0,1614730207,DanyyBoyy
22,gph6w51,"Uhhhh GME is based in Grapevine, Texas. You know what to do. 🦍💎👐🏼🚀🌝",41,0,1614730234,kennfabio
23,gph6yn1,"Domestic violence cases will drop so that means malt liquor, Newport and watermelon sales will plummet",-3,0,1614730269,spenserhicks123
24,gph70xk,"AAL, AMC, jack in the box. For sure.",1,0,1614730301,wsbgodly123
25,gph71eh,Feel free to explain dr. I'm all ears,1,0,1614730307,ourgeneration_777
26,gph72xe,"Think anything retail, including food, would see that dramatic of a spike? Fast food I almost hesitate on because I feel like people will take opportunities, good idea or not, to do things like grill out and have get togethers. I'd think the cold weather would spike fast food.",1,0,1614730329,belacttu2
27,gph73t1,"Covid cases, hospitalisation and death.",-1,0,1614730343,Shepherdspie_inyaeye
28,gph7798,When  you realize what you've done to yourself you'll be able to explain my post better than I could,0,0,1614730392,sourtwister
29,gph77sn,Think he's implying the vaccine will turn you gay,3,0,1614730400,spenserhicks123
30,gph791k,INTERSTING! Airlines didn't cross my mind.. duh. But why AA? Specific reason or just the positive trend of the group?,0,0,1614730418,belacttu2
31,gph7af3,This guys a sheep not an ape,5,0,1614730437,FCCHELPHELP
32,gph7c25,RAVE restaurant group out of TX 🔥🚀,2,0,1614730460,marknielsen777
33,gph7ecc,Time to invest in some strip clubs.,22,0,1614730493,altuser99
34,gph7fan,Freedom. Freedom will spike.,11,0,1614730507,TheRealRealSpider
35,gph7ggi,If you put 2 and 2 together you get 5 so it makes cents,7,0,1614730523,poloven
36,gph7goz,"I have been vaccinated as a child and still get flu vaccinations every year. Are you worried my thing may get too long for boxers,  I'll just move up s size of so.  Problem solved.  Wait, you are a computer chip conspiracy guy, are you?",-2,0,1614730526,ourgeneration_777
37,gph7h07,"Totally unsure how much trolling was meant to be in this post, but you legitimately made good points",4,0,1614730531,belacttu2
38,gph7gzw,He's a big baby in a poopy diaper,-2,0,1614730531,spenserhicks123
39,gph7jse,"Funeral homes, OTC cold meds, Restaurants that serve a lot of meat",-4,0,1614730572,TMallet
40,gph7p9z,"Implying, or hoping?",1,0,1614730648,ourgeneration_777
41,gph7prl,With all the shot plumbing issues from cold snap I'm sure 8 in 10 have to do repairs on their homes. Copper or Pex plumbing .,6,0,1614730655,GalaxieTripster63
42,gph7rrx,This is about the most retarded shit I’ve ever read and not in a good way like with GME.,0,0,1614730684,The-Special-One
43,gph7t3v,Calls on the rodeo.,2,0,1614730703,KyFly1
44,gph7tl1,It made me racist. Fucking Crackers.,3,0,1614730709,foerill_atm
45,gph7u6a,"I'm pretty sure that drinking,  smoking, and working in the industrial field will take its toll first lol.  YOLO!!!!",2,0,1614730718,ourgeneration_777
46,gph7yhm,"Not stupidity, it's already to the max.",1,0,1614730779,taumaturgo
47,gph7z1o,I mean $20 is $20 right,1,0,1614730787,spenserhicks123
48,gph80mn,"Small, locally owned businesses.. which is way, wayyy more important than some AMC movie theater or amusement parks.",4,0,1614730809,greenweezyi
49,gph80mh,This is one of the few comments I didn't downvote hahahaha,2,0,1614730809,spenserhicks123
50,gph81o5,That's the rumor,1,0,1614730824,ourgeneration_777
51,gph86bt,"People buy cold medicine anyway, it's how they make the meth you put up your butt",0,0,1614730890,spenserhicks123
52,gph86lw,Dumb spiked hugely in this post’s comments,4,0,1614730894,pomeroyarn
53,gph8afv,BLM destroyed local businesses before covid,-12,0,1614730948,spenserhicks123
54,gph8c2e,Yea.. I'm a little disappointed because I thought this particular forum would have a little less.. silly me,2,0,1614730971,belacttu2
55,gph8ejp,Didn't know that! Now I do!,11,0,1614731006,belacttu2
56,gph8f4v,What is America’s largest coffin manufacturer?,-3,0,1614731015,Voldebortron
57,gph8f93,Booze stocks. I’m in CSTZ and BUD,1,0,1614731017,Kristyn54321
58,gph8f8h,No masks and possible Texans licking handrails at AMC is why I’m investing in NyQuil,0,0,1614731017,TMallet
59,gph8grs,BUY and HOLD! GME to the MOON 🚀🌕,13,0,1614731038,Keepitlitt
60,gph8kol,"Blends with the home improvement stores comment. 

Security systems? A little paranoia as people creep out in to the world?",3,0,1614731094,belacttu2
61,gph8pdz,"American airlines is headquartered in Texas, they have the most international/domestic out of Texas.",1,0,1614731162,wsbgodly123
62,gph8qev,"My only thought there would be because AAL is based in Texas, but that probably doesn't impact things thaaaat much, does it?",2,0,1614731177,JsonWaterfalls
63,gph904w,That's the kind of info I came in here for! I appreciate it. That makes sense. Definitely going to add them to my portfolio and ride along,2,0,1614731315,belacttu2
64,gph91dd,"C’mon dude, “watermelon”? Seriously? Are you just trying to fulfill the “hicks” in your name or something?",0,0,1614731332,Kristyn54321
65,gph95v4,Covid cases,-4,0,1614731396,Perfect_Ride
66,gpha87w,"I know I’m retarded, but you’re like *actually* retarded. Cool shades bro!",6,0,1614731943,bayareanative11
67,gphah39,Ok doomer.,4,0,1614732067,ConBroMitch
68,gphavq6,[removed],1,0,1614732275,[deleted]
69,gphayb2,This is no place for emotional unstability karen 😎,-2,0,1614732312,spenserhicks123
70,gphazql,Thanks 🤤,-1,0,1614732333,spenserhicks123
71,gphb1uu,I went full retard on that one but I'm sticking to it!,-1,0,1614732364,spenserhicks123
72,gphbac6,Buy QDEL.  Testing ain’t over.,1,0,1614732486,ourpointofview
73,gphbfi6,time to invest in coffins,1,0,1614732559,darkspherei
74,gphbm1v,I'm investing in $COVID,3,0,1614732654,gwardyeehaw
75,gphbrik,How about companies that make the plumbing pipe or textiles that supply home improvements. I'm trying to find companies that produce the containers they put all garden products in to sell at nurseries etc.,1,0,1614732734,GalaxieTripster63
76,gphc07v,Coronavirus,1,0,1614732857,pliscan
77,gphc0nk,We don’t like the sheep,0,0,1614732863,localmontauk
78,gphc15h,"Covid, obviously.",3,0,1614732870,Simmons2pntO
79,gphc6r2,Funeral homes.,1,0,1614732951,Zeon2
80,gphcd5x,[deleted],-1,0,1614733043,[deleted]
81,gphcz8c,Boo this distraction,0,0,1614733359,Fcommiefornia
82,gphdh9h,hater I my self hate California✌,2,0,1614733622,Fcommiefornia
83,gphe1ye,"From Texas, everything has been open and half the state hasn’t worn masks in months",16,0,1614733923,Can2_RL_yt
84,gpheipn,[deleted],1,0,1614734168,[deleted]
85,gphem8w,"i remember there was a really short-lived game show that was a spinoff of ""The Man Show"" back in the day, early 00's. celebrities would come on and debate a hypothetical showdown between two random things. whiskey vs. beer, or fake tits vs. natural boobs, whatever. one episode was ""Texas vs. California"" and it was so great.",2,0,1614734220,[deleted]
86,gphepr1,"I'm not sure if it's still the case, but _a lot_ of the nursery containers we use are made in Italy and it takes a long time to order them. 

Another note about the nursery industry is that other than the big boxes, which basically sell distressed stock, all the big players are private companies. Monrovia, Bailey, Hines, etc. There isn't much exposure to this industry in public companies.

As far as the state of inventory, most everyone is short on product. Pickings will be slim this year at big boxes because they buy the garbage that independent nurseries have already passed over. Those nurseries will probably have to lower some standards this year which leaves the big boxes with even less.",4,0,1614734270,pspahn
87,gphf636,BOEING SPR CINEMARK PETROBRAS VALERO EXXON EPR DEVON HALIBURTON,8,0,1614734501,theta_007
88,gphfem0,"Love it, thank you",1,0,1614734623,belacttu2
89,gphg4tl,"Carnival and Royal Caribian have ships based out of Texas, and the travel market seems to be gaining even in the red days.",3,0,1614734998,doomshades
90,gphgepk,This is the correct answer.,2,0,1614735137,LORDOFTHEFATCHICKS
91,gphh3by,"Ohhhh noooooo people will get a virus with 0.02% chance of death, the horror.",-10,0,1614735490,CrimsonSun99
92,gphhalx,"&gt;strip clubs

god no those are just live onlyfans venues. Whorehouses are where the real money is at in TX.",2,0,1614735595,whytehorse2017
93,gphi67v,I can’t remember a time when 2 + 2 ever equaled 4,3,0,1614736042,TheCampingComedian
94,gphjww2,Onlyfans in 3D!,1,0,1614736951,hoppity21
95,gphjxnh,$COVD,3,0,1614736962,bro55man
96,gphkepf,Deaths due to Coronavirus.... Not financial advice... Just sayin',2,0,1614737210,realitycaptain
97,gphl319,"More than 500,000 Americans died already. That’s already 0.14% of the whole US dead - seven times more than your number. And only a fraction of the US has been infected so far. True fatality rate percentage of cases is probably closer to 2%, or 100x your dumb estimate",5,0,1614737555,colorless_green_idea
98,gphlcqr,covid cases...,3,0,1614737693,Big-Opportunist
99,gphm1xu,"Cruises, airlines, resorts, movies all holding steady",1,0,1614738051,J-a-S-p-E-r-
