,comment_id,text,score,awards,timestamp,author
0,gpfngtt,Low price gets split or extremely high price . Now it’s reasonable price,1,0,1614705453,samh2r
1,gpfni2h,Can y'all stop spamming these posts.,3,0,1614705468,WhoSchottYa
2,gpfniz2,That wouldn’t the assumption they paid back their debt,1,0,1614705479,ecrane2018
3,gpfnmmi,Good uncle Bruce!,2,0,1614705523,Scratch-Extension
4,gpfnogz,"It would be a great incentive to offer divvies, that’s a big ass market cap.",2,0,1614705547,WhatnotSoforth
5,gpfnwep,Unfortunately I cant share his livestream/video,1,0,1614705644,SheepherderOk9454
6,gpfnyyl,[deleted],1,0,1614705674,[deleted]
7,gpfo4az,"Low prices get consolidated 5-1 , high price get diluted 1-5. Ratios vary",1,0,1614705740,tossserouttt3483726
8,gpfo8bi,Shame! I’ll try,1,0,1614705789,Scratch-Extension
9,gpfo8j4,I am B) 👀,1,0,1614705792,SheepherderOk9454
