,comment_id,text,score,awards,timestamp,author
0,gpgkhvk,I love you,2,0,1614719610,Maximus_Crotchrocket
1,gpgkqt2,pretty uneventful day unless you followed someone who may or may not be Not a Jim Cramer’s Mother https://www.reddit.com/r/wallstreetbets/comments/lw34hk/when_you_claim_to_be_the_hero_of_retail_investors/gpf1b5x/?utm_source=share&amp;utm_medium=ios_app&amp;utm_name=iossmf&amp;context=3,1,0,1614719712,ghostofHRomney
2,gpgkrmi,I’m all for it as long as you are smart. Just don’t be the guy who puts their rent money in GME.,1,0,1614719722,Engineerguy32
3,gpgkw8t,Jim Cramer pees sitting down!,2,0,1614719775,Spiritual_Ad535
4,gpglabw,whoever that is just said something of the same spirit,1,0,1614719937,ghostofHRomney
