,comment_id,text,score,awards,timestamp,author
0,gpgkkyk,"I like the stock, I will buy more shares",2,0,1614719646,Maximus_Crotchrocket
1,gpgkpl4,"I mean.. you can look at the options and see they aren’t photoshopped.. 

RKT blew up today. Doesn’t mean people still aren’t holding GME",1,0,1614719698,seagens
2,gpgkpzt,"It's not though. RKT is undervalued and shorted lol I had 100 shares from when it was $19 alone. Lots of people probably making bank right now on it. I made a modest amount, but GME aside, anyway to stick it to hedgies and make money on top is a win for any of us.",1,0,1614719702,HandFew3887
3,gpgkq7l,"There are roughly 6,500 languages around the globe and this retarted decided to speak 📠",1,0,1614719705,Hassyhass
4,gpgks45,pretty uneventful day unless you followed someone who may or may not be Not a Jim Cramer’s Mother https://www.reddit.com/r/wallstreetbets/comments/lw34hk/when_you_claim_to_be_the_hero_of_retail_investors/gpf1b5x/?utm_source=share&amp;utm_medium=ios_app&amp;utm_name=iossmf&amp;context=3,1,0,1614719727,ghostofHRomney
5,gpgkxvc,Sure I’m a noob but I know you are butt hurt that RKT is the new GME (only an actual great thriving company that’s undervalued),1,0,1614719794,Icy_Dragonfruit2122
6,gpgkxyh,OP is right on!    News flooding coincided with pushing GME price down - through you an RKT bone to calm us down ...,1,0,1614719795,nextfriends88
