,comment_id,text,score,awards,timestamp,author
0,gppk1yc,People who still think rockets aren’t a meme are clowns. All aboard the wonkavator.,1,0,1614898496,TipStandard2999
1,gppklqm,Thanks! My wife's just told me that I should repay your kindness by asking if you'll be her new boyfriend,25,0,1614898760,VoxUmbra
2,gppkxq1,Apes only understand cave drawings and hand signals,13,0,1614898919,Coldplasma819
3,gppl9nt,The ultimate ape honor,24,0,1614899080,Solid_Adeptness_5978
4,gpplk6k,[removed],1,0,1614899224,[deleted]
5,gpplq4m,Charlie and the Stonk Factory $GME,1,0,1614899305,heleas03
6,gppltdn,There's no earthly way of knowing which direction we are going,0,0,1614899349,BetaSpreadsheet
7,gpplx6q,It’s prob just referencing the meme from back then where diamond hands ask DFV how far this is going to go lol,1,0,1614899402,youngheezy44
8,gppmby1,[removed],1,0,1614899604,[deleted]
9,gppmsq0,"I don’t know about any of this, but can we all just agree that Grandpa Joe is the real villain in Charlie and the chocolate factory?",1,0,1614899835,drhiggens
10,gppnf9e,[removed],1,0,1614900145,[deleted]
11,gppng0h,Willy Stonka is also good,3,0,1614900156,ljgillzl
12,gppnj1t,[removed],1,0,1614900199,[deleted]
13,gppo336,"I keep seeing $CUM in $ASS,  not sure what they mean though?",1,0,1614900479,donnyisabitchface
14,gppo32e,[removed],1,0,1614900479,[deleted]
15,gppo7if,Ok so when do I need to start farting my way back down,1,0,1614900540,lilwubbie23
16,gppogx9,"Probably are waiting to hit hard with shorts tomorrow to keep gamma in check at the end of the day,  volume was light all day until that spike,  simply put they where busy fucking the rest of the market and lef GME alone today.",1,0,1614900669,donnyisabitchface
17,gppomte,"If you didn't hear about it previously, then you are the first!",5,0,1614900751,ImChadYourSkinTag
18,gppooqy,Yes! It’s a great movie!,2,0,1614900779,donnyisabitchface
19,gppoq6i,He knew the answers,1,0,1614900798,donnyisabitchface
20,gppoq7n,"You must have a doctorate degree, that's proper crediting!",3,0,1614900799,F1remind
21,gppp1je,[removed],1,0,1614900956,[deleted]
22,gppp5lh,"Always inverse WSB, just sometimes you need to inverse the inverse.",6,0,1614901014,jay212127
23,gppp8fm,I dunno I just think it's about the wild ride we are all on today,1,0,1614901054,tysonsmithshootname
24,gpppp5m,"Shit, you just made me realize Charlie was the OG Diamond Hands.",1,0,1614901287,Meowslydale
25,gpppv1a,DeepBucketValue,2,0,1614901369,ljgillzl
26,gppq2l2,"I mean, how else are we going to stop to pick up our friends who bought at $300+? Gotta pick up the 🦍 homies too",6,0,1614901475,MrRedorBlue
27,gppqd62,"Also I think what makes it better than CN jokes is that it doesn’t have to be centered around DFV being tough, it’s the freest shitposting template I know of.",5,0,1614901626,Key_Ad_1683
28,gppqh6e,[removed],1,0,1614901684,[deleted]
29,gppqqd9,"Im taking the interpretation as no one really knows what's going on right now, and we're all in the same crazy boat that goes up and down and all over the place. I think DFV has the direction pretty firmly nailed and we just need to sit back and wait to get to where we're going. He'll let us know when it's time. Trust DFV.",1,0,1614901815,RaspberryPoptarts
30,gppr0m8,Legitimate,1,0,1614901963,Minidestroy100
31,gppr0ye,Nah it seems way more intentional than that. We're all passengers in this boat that no one has any idea the direction of. That's basically the GME market right now. But all the children end up at their destination with Wonka at the helm. He could have used any number of gifs to get his point across but it felt intentional. That boat ride mimics our ride through this market. So much disinformation and no one knows shit. We just gotta trust DFV.,17,0,1614901968,RaspberryPoptarts
32,gppr9zl,"As a tear roles down my cheek. I say to you sir, good job and you deserve an oscar!!!",9,0,1614902094,Blitzkreig11930
33,gpprpag,Jim Cramer is mad that all the buttons on an elevator don’t make different sounds when you push them,11,0,1614902312,Key_Ad_1683
34,gpprsvx,[removed],1,0,1614902364,[deleted]
35,gpprwuc,"I used the rocket scheme to double my quick investment, but then I'm a day trader for alot of shit and once I saw it double I immediately cashed out and bought more GME lol.",4,0,1614902421,RaspberryPoptarts
36,gpprytt,Don’t forget the bananagrams!,1,0,1614902450,Key_Ad_1683
37,gppshgg,Can Melvin capital be grand pa joe??? Cause f them both!,1,0,1614902720,legend1542
38,gpptcv1,[removed],1,0,1614903162,[deleted]
39,gpptdv8,HOOOLLLLDDDDD,1,0,1614903177,mr_robot003
40,gpptjbs,"This will probably get buried. For everyone who hasn't read ""the great glass elevator"" it is the sequel to the first book charlie and ""the chocolate factory"". It's great for kids and acceptable for adults. It's the sequel and one of the better book sequels that's little known to the public. It's a direct sequel so it occurs right after the first book. It's chaotic, has no defining plot scheme, and you get to actually visit loompaland. It's practically willy wonka part 2. I'd say it's the silmarillion of the wonkaverse. 

Anywho I feel like a lot of this subreddit's fanbase would enjoy reading the book. Highly recommend.

Also apes strong together.

Diamond hands.",32,0,1614903255,TheresNoAmosOnlyZuul
41,gppuhqd,"I ran a quick search and its playing on some channel called FreeForm at 830pm pst tonight.

Slumdog Millionaire from the previous tweet is on YouTube for FREE this week.",3,0,1614903732,95brnco
