,comment_id,text,score,awards,timestamp,author
0,gppchpo,Im in,1493,2,1614894989,REDbird-Crazy
1,gppckzz,"I just posted this there is no way you read the whole thing.

I like this guy",1641,1,1614895030,yodisc
2,gppcngb,This is happening. I’m so excited and proud I’m still on board. I can’t wait for it all to kick off again,696,0,1614895061,make_more_1013
3,gppcoxw,I skimmed thru it. Im retarded,664,0,1614895080,REDbird-Crazy
4,gppcp84,I LIKE THIS STOCK,96,0,1614895083,Mehoyer
5,gppcqce,"Buckle up kiddo, shits bout to get weird",459,1,1614895097,yodisc
6,gppcslc,That could explain some of the activity this afternoon. Market makers buying shares to cover ITM options. Hopefully we hold strong tomorrow and it continues.,3503,0,1614895124,fyreflight441
7,gppcwvz,Too short read twice TS;RT,294,0,1614895177,HughGRexn
8,gppcx05,"Literally all we have to do it hold, less supply, exponentially more demand",3871,6,1614895178,yodisc
9,gppcycu,[removed],1,0,1614895194,[deleted]
10,gppd103,"Last week nothing happened when contract went itm, options don’t affect price when their exercised I repeat options do not affect price when exercised. A gamma squeeze happens when people start buying heavily otm options that are naked.",128,0,1614895227,ecrane2018
11,gppd15b,Nice DD 💎🙌🚀🚀,14,0,1614895228,fellowhomosapien
12,gppd1al,Im in as well,49,0,1614895230,Mologna13
13,gppd1l9,I mean I’ll take it if it was a good enough read to do twice!,119,0,1614895234,yodisc
14,gppd3s1,[deleted],2,0,1614895261,[deleted]
15,gppd4ae,[removed],1,0,1614895267,[deleted]
16,gppd4ft,Great DD actually !,70,0,1614895269,HughGRexn
17,gppd5k5,"I mean look, eventually the shares needed to cover ITM contracts have to show up, they simply must.",7,0,1614895283,yodisc
18,gppd67x,"You had me at ""GME""",1347,0,1614895291,f0rce44
19,gppd6ei,"So... 🐒 go to moon soon!

🚀🚀🚀🌕",9,0,1614895293,HoIyGhost09
20,gppd8b5,"You guys really don't know how gamma squeezes work do you. Keep saying the same thing every fucking week despite being proven wrong over and over and over. 
Gamma squeezes happen when the market makers hedge options PURCHARSES not on option expiration!  Ffs.",77,1,1614895317,Ashpro2000
21,gppd8fx,So... buy more calls and stock got it!,140,0,1614895318,Remarkable-Cake-9113
22,gppd9do,Really appreciate that! I try my best,64,1,1614895330,yodisc
23,gppdaav,"Only if the options are written with naked contracts, otherwise their covered with shares they own",55,0,1614895342,ecrane2018
24,gppdass,[removed],1,0,1614895348,[deleted]
25,gppdat9,lets go,1,0,1614895348,Born-Awareness-5143
26,gppdf44,Saw words and bold words. Looks good I’m in,127,0,1614895403,lbuck12
27,gppdgre,Theta,9,0,1614895424,LavenderAutist
28,gppdhed,"Now im curious, did I miss something? Thats still 10% of total float. These market makers own 10% of float?",14,0,1614895432,yodisc
29,gppdhua,$1000+ a share is not a meme,24,0,1614895437,lorvious
30,gppdixr,"I read it, and thanks for insight",64,0,1614895452,buffalo_chum
31,gppdjh3,[removed],1,0,1614895459,[deleted]
32,gppdln9,"That “roof” is relative. It’s all percentage chances. And that percentage is truly unknown because we CANT know all of the variables in the equation that creates it. The unknown unknowns can throw a wrench in the plans of anything. Things like platforms preventing buying/selling. Internet outages anywhere along the core hub lines. Shit, even things like a terrorist attack, military action, big earthquake, CEO heart attack, your mom tripping over your empty Dew bottles, who fucking knows. 



But, the higher the closing price the better. More ITM is better.",102,0,1614895487,fuckofakaboom
33,gppdn4o,Cant you explain it again?,5,0,1614895506,REDbird-Crazy
34,gppdrqb,Dont forget BIG words too,48,0,1614895565,yodisc
35,gppdrzo,there isn't enough retail buying and holding.,15,0,1614895568,bugz1234
36,gppdv4o,[removed],1,0,1614895607,[deleted]
37,gppdvly,""" In a **gamma squeeze**,  the price of a stock transiently increases based on an investor buying  many options to drive up the prices of select stocks due to option  sellers needing to hedge their trades on the underlying stocks ""

The price doesnt go up because an option was purchased, it goes up because market makers have to hedge and buy shares to do so once it becomes apparent they are ITM",16,0,1614895613,yodisc
38,gppdwd9,Thank you for the great post; so you're saying to double down? I see what you did there. The reward far outweighs the risk.,18,0,1614895622,psychothepit
39,gppdx5v,Quality analysis and conjecture,1,0,1614895632,kulji84
40,gppe5dj,I just like the stock,1,0,1614895731,koolguykso
41,gppe644,[removed],1,0,1614895740,[deleted]
42,gppe7xc,Very big,10,0,1614895762,lbuck12
43,gppe7wy,Options shares don’t have to come from the float.,18,0,1614895762,ecrane2018
44,gppe9g0,All I got was buy GME calls,19,0,1614895781,thebestatheist
45,gppea1o,"Yawn.  

Lots of talking, just hold.",7,0,1614895788,Semi-Nerdy
46,gppedzn,Where do they come from?,10,0,1614895838,yodisc
47,gppehfk,Shares the option seller owns. The shares just traded hands at below market cost of the buyer choices to exercise the option.,19,0,1614895880,ecrane2018
48,gppeijr,[removed],1,0,1614895895,[deleted]
49,gppeiyb,[removed],1,0,1614895900,[deleted]
50,gppejmf,So your saying I should add to my current position got it!! CHEIF,2,0,1614895908,kylefin559
51,gppek4i,[removed],1,0,1614895914,[deleted]
52,gppekpj,"If he's in, I'm in",79,0,1614895922,JMKPOhio
53,gppennm,"I hope it comes true.

Today I bought 10 long calls @ $140 Mar 19, When it was around $137.

I was hoping it would spike tomorrow. Or the option play come into being.

I’m already down 5k on the options at this point, but I made 15k on Amazon puts today so I was willing to take a risk.

If it doesn’t spike tomorrow, I might have to sell my options for some more loss.",-4,0,1614895959,chueu
54,gppep6c,"Every day there seems to be a new day or reason for why this is gonna moon, it’s making me nauseated.",112,0,1614895978,HotSauceyBoy
55,gppepo8,RemindMe! 3 days,1,0,1614895984,NecJack
56,gppeq9k,[removed],1,0,1614895991,[deleted]
57,gpperhy,"You are right, the option seller does own those shares. But those shares come from somewhere, a portion of the float!",12,0,1614896006,yodisc
58,gppessg,"I will be messaging you in 3 days on [**2021-03-07 22:13:04 UTC**](http://www.wolframalpha.com/input/?i=2021-03-07%2022:13:04%20UTC%20To%20Local%20Time) to remind you of [**this link**](https://np.reddit.com/r/wallstreetbets/comments/lxwhpy/gme_possibility_of_gamma_squeeze_just_went/gppepo8/?context=3)

[**CLICK THIS LINK**](https://np.reddit.com/message/compose/?to=RemindMeBot&amp;subject=Reminder&amp;message=%5Bhttps%3A%2F%2Fwww.reddit.com%2Fr%2Fwallstreetbets%2Fcomments%2Flxwhpy%2Fgme_possibility_of_gamma_squeeze_just_went%2Fgppepo8%2F%5D%0A%0ARemindMe%21%202021-03-07%2022%3A13%3A04%20UTC) to send a PM to also be reminded and to reduce spam.

^(Parent commenter can ) [^(delete this message to hide from others.)](https://np.reddit.com/message/compose/?to=RemindMeBot&amp;subject=Delete%20Comment&amp;message=Delete%21%20lxwhpy)

*****

|[^(Info)](https://np.reddit.com/r/RemindMeBot/comments/e1bko7/remindmebot_info_v21/)|[^(Custom)](https://np.reddit.com/message/compose/?to=RemindMeBot&amp;subject=Reminder&amp;message=%5BLink%20or%20message%20inside%20square%20brackets%5D%0A%0ARemindMe%21%20Time%20period%20here)|[^(Your Reminders)](https://np.reddit.com/message/compose/?to=RemindMeBot&amp;subject=List%20Of%20Reminders&amp;message=MyReminders%21)|[^(Feedback)](https://np.reddit.com/message/compose/?to=Watchful1&amp;subject=RemindMeBot%20Feedback)|
|-|-|-|-|",1,0,1614896021,RemindMeBot
59,gppestg,"I'M RECLAIMING MY TIME!!!


*I am a bot, and this action was performed automatically. Please [contact the moderators of this subreddit](/message/compose/?to=/r/wallstreetbets) if you have any questions or concerns.*",3,0,1614896021,AutoModerator
60,gppevih,That's the amount of confirmation bias that I needed,5791,3,1614896055,AntiqueFisherman
61,gppevh4,But they will only affect the price of the underlying the option writer no longer owns those shares and has to buy them back at higher prices.,12,0,1614896055,ecrane2018
62,gppevy6,"Well, Uncle Bruce seems convinced at least some of them are caught with their pants down because they issued naked calls thinking there was no way that it goes back up.",6,0,1614896061,InternationalMatch13
63,gppexzt,"i used the speed reading method - picked out all the **bold words and i saw a lot of ""DOUBLE""** \- does this mean we all need to double down??",16,0,1614896088,greenday10Dsurfer
64,gppf28u,"So where Im going with this post is if every week the market makers need 10% of the float, its not sustainable. They simply do not own that many shares no matter what anyone says. They NEED to eventually start buying more shares to cover in future weeks, even if this week they do have the 10% needed",10,0,1614896141,yodisc
65,gppf44q,"You have to exercise the options for this to happen.  If you have 100 to 125c, come up with the 10 to 12.5g to exercise.  Otherwise the shares they are holding for you will be sold off Monday,  dropping the price. 

If you can't exercise,  sell it so someone can buy it and exercise themselves.",8,0,1614896166,solidgryffin
66,gppf5c5,[removed],1,0,1614896181,[deleted]
67,gppf6s8,Thank you!,1,0,1614896200,Drew_Woodruff
68,gppfajf,vega,4,0,1614896247,Headshots_Only
69,gppff58,[removed],1,0,1614896307,[deleted]
70,gppffkl,That's the case only if they sell naked calls.  If they cover their calls they don't need to buy anything.,29,0,1614896313,331GT
71,gppfgd8,[removed],1,0,1614896323,[deleted]
72,gppfi6f,UPVOTE THIS DD!,5,0,1614896346,DTX9218
73,gppfkis,$100k or bust,-24,0,1614896376,DistinguishedJB
74,gppfkrv,[deleted],3,0,1614896380,[deleted]
75,gppflwo,"You son of a bitch, I’m in",304,1,1614896394,Christothetee
76,gppfncb,[removed],1,0,1614896412,[deleted]
77,gppfni1,"Its not market makers. There was basically no options volume today relative to last week. There is just a handful of large players propping up the stock on low volume, establishing new support levels, then periodically spiking the price up 10-15 per share.",123,1,1614896414,BackgroundSearch30
78,gppfp3d,[APE NOISES INTENSIFY],160,0,1614896434,gaedikus
79,gppfpb2,[removed],1,0,1614896437,[deleted]
80,gppfrm3,Are those naked calls?,1,0,1614896466,Bluesteak98
81,gppfujk,"Agree. Last week nothing happened, even told they had till yesterday for Fridays deadline.",18,0,1614896503,TWhyEye
82,gppfxba,Or alternatively someone can loan me $120~$160k to exercise 😂,6,0,1614896539,chueu
83,gppfyuv,"I own one gme share lot.

I sell one call.

The call expires itm and is excersised.

I sell my share lot for that call option.

Nothing happens.


**How gamma squeeze takes place**

I buy deep otm calls. 

Seller sells me deep otm calls along with normal calls he is selling. 

I don't hedge it.

Seller panics, he has to remain neutral. He buys shares.

 Driving price up.

Panics more as delta has changed due to gamma and now he needs more shares to remain delta neutral.

Buys more.

Repeat.",29,0,1614896560,ashu54
84,gppg19q,"Guys, me tired of asking. Please splain in emojis.  No understand words. Only 🚀🚀🚀",-4,0,1614896592,blazeronin
85,gppg4do,[removed],1,0,1614896632,[deleted]
86,gppg7aq,If they are then shit will really hit the fan. There’s no really way of knowing but as ITM contracts reflect higher and higher proportions of float it becomes impossible to hedge,3,0,1614896670,yodisc
87,gppgb66,[removed],1,0,1614896721,[deleted]
88,gppgbnv,Only if people exercise their contracts and buy those 100 shares,3,0,1614896727,shala0
89,gppgd3q,"True. The thing is most of the people do not exercise the call because the will get the same gains selling. 

I hope for the best",4,0,1614896745,Bluesteak98
90,gppgehc,[removed],1,0,1614896763,[deleted]
91,gppgex8,Could someone translate this into colors?,2,0,1614896768,MallStreetWolf
92,gppgjiq,[removed],1,0,1614896829,[deleted]
93,gppgjn1,"I can write a call,  for say 200 strike price.  I have shares already. I can bet the shares I bought at 50$ to cover the call,  in exchange for the call premium. As long as the price doesn't go over 200, I keep my shares and premium. 

If the shares become itm, then I forfeit the shares IF the call is exercised, I just sell them for 200. This is ok if the call is barely in the money.  It is bad if the price sky rockets to 300, when I lose out on 100 a share. 

I'm retarded but I think that is how it works.  🤷‍♂️🤷‍♀️🤷",20,0,1614896830,solidgryffin
94,gppgkfy,"""GME"" had me at you",228,0,1614896841,Jimmy-Falcone
95,gppgkpz,"Oh man, my 22 shares are ready to print LETS FUCKING GO",810,0,1614896845,CastlePokemetroid
96,gppgl6n,[removed],1,0,1614896851,[deleted]
97,gppgm3c,"Mate, with all those words you are probably right. The gist I got is maintain 💎✋ as we are about to 🚀🌛 with GME.",56,0,1614896862,Modorox
98,gppgmoc,"You convinced me to forget my legendary caution in investing and throw a couple of thousands in GME.

EDIT: **// THIS IS HUMOR //** Thanks for the financial advice, you are a great advisor and if I get rich I will pay the lawyers who will have to protect you for convincing me to invest. **// THIS IS HUMOR //**",-6,0,1614896870,CountGeeTee
99,gppgmw0,[removed],1,0,1614896872,[deleted]
