,comment_id,text,score,awards,timestamp,author
79,gpm1wpf,"I like the idea, but to punch holes in the thesis, GameStop cannot simply become ""another Steam competitor"", that would be a true death knell on the coffin. Even if they dropped their cut of game sales to 10%, the problem is Steam has a locked in userbase that isn't going to move platforms. Epic Games and Twitch are giving away games to users for their platforms and (I'm assuming) their userbases are still dwarfed compared to Steam. Likewise, users have entire libraries on Steam they aren't going to abandon, and jumping between platforms is more trouble than just working on one. Its like Mixer vs. Twitch or anything vs. Facebook - its just easier to stay on the more popular platform, regardless of the other's features.

But, theorycrafting to avoid work, I have one idea that could make GME a 'Steam killer' - `allow users to resell their games`.

First, its a cornerstone to their business, and a meme to the world. 

More importantly, it plays into a weakness of digital gaming platforms not currently addressed by the other companies. Anyone with a Steam account owns dozens of games they've never played or even downloaded. But those games are just licenses to the game and once your refund period is over, its just a dead license if you never touch it. I'd gladly sell my unused license of ""Oddworld: Abe's Oddysee"" for less than $2.99 (Steam's current price). Or even let users sell licenses to games they just no longer play, like my ""PAYDAY 2"" (currently at $9.99). Let the game developer and GME get a cut of the sale and boom, money. Assuming that it'd be difficult to exploit such a system (as the upperbound would be the platform's own price for the game), they could even offer bundle license sales where you get X copies of a game you can resell after the fact. However, I'd say they'd need an economist whose studied Warcraft Auction House goblins to truly secure it. Digging deeper into the rabbit hole, if they could get Steam/Epic/etc platforms on board to allow selling/trading of their platforms' licenses, I think then you could see a major adoption in users. The only issue there is a big one though, convincing the other companies to get on board.",1,0,1614827339,tsumnia
80,gpm2509,"Epic spent more than gme is worth today and barely dented steam. I'm gonna hard disagree. They can enter the space and get a bunch of hype the partner with xbox but they ain't fucking with steam. Remember when the trillion dollar m$ got it's ass handed to it by twitch a small baby company. Entrenched PC platforms can't be beat easily if ever from an external force all they can do is fuck it up from the inside and considering steam doesn't seem to do fuck all, all day I think it's fine.",3,0,1614827459,raddits
81,gpm2ald,"[https://en.wikipedia.org/wiki/Impulse\_(software)](https://en.wikipedia.org/wiki/Impulse_(software))  


learn something new everyday",11,0,1614827539,JEDWARDK
82,gpm2g1r,My plan has always been to ride the wave up from the squeeze and then purchase a ton for the value when it drops.,1,0,1614827617,Jb1210a
83,gpm2gh2,"These are assuming there will be complete inactions coming from Steam's side, while that is what's mostly happening right now even with Epic trying to compete, if you want to talk resources and capital, like you point out, Steam have hella capital that they have been amassing for a long time, who knows what Steam can do to stay leading if they wanted to?",4,0,1614827624,DashLeJoker
84,gpm2war,Also expanding pc games to other computer formats such as Mac and Linux if that would be possible. They would dominate the market.,1,0,1614827851,mrwhiskey1814
85,gpm3u7q,"100bn market cap would be pretty tough to hit, the gaming industry in its entirety (including mobile) is only a 150bn a year industry. They would have to become a borderline monopoly in order to achieve that in the near term.",3,0,1614828326,ethandavid
86,gpm40x8,"I really hope you're right. It feels like such a monumental shift from where they're at right now it's hard to believe that's a direction they want to go, but given what we've seen them alluding to, a monumental shift does feel like it's in the works. I just hope it's able to pan out and doesn't implode before it takes off.

I've wanted to invest in Steam for years, but, you know. Private company. But that role in the industry prints so much money.",1,0,1614828423,exveelor
87,gpm5hb6,Add in the physical stores for good PC hardware...,1,0,1614829193,CopperSavant
88,gpm70j4,"Alpha Centauri is the closest star system to earth, so what’s past it is 99.9999999999% of the universe. See you in Andromeda, my friends.",1,0,1614830041,dominnate
89,gpm7pj8,[removed],1,0,1614830435,[deleted]
90,gpm8bd1,"I thought that’s why we liked the stock? GME is going to become the next distribution platform, esports stadium/teams/broadcaster etc",1,0,1614830769,lead_alloy_astray
91,gpm8fon,"Interesting idea, I’m sure they are excitedly working harder than your wife’s boyfriends big toe at niching hard into the market. I like the stock",1,0,1614830836,tigebea
92,gpm96ta,Valve has IP that they don't use (or leave on the shelf to collect dust). Steam is where virtually all of their revenue is generated by selling other developers' games. But I understand and appreciate your point.,4,0,1614831263,GroundhogExpert
93,gpm9ur3,"I know, I'm saying while you started by saying how Steam is shit, but went on to describe how they rely on microtransaction and don't update their own games frequently enough,  i.e csgo, while both Steam and csgo came from Valve, pivoting to discussion of their game development doesn't help too much in this discussion, you could say the way Valve treats their own games are shit and therefore they will treat Steam shitty the same way, but its better to point out the actual flaws of the Steam platform itself if you would say its shit, to me I feel like user wise its definitely the leading platforms out there, but to developers the 30% cut is less and less attractive in the face of other competing platform like Epic",6,0,1614831644,DashLeJoker
94,gpma2m2,lol,1,0,1614831769,RVinnyT
95,gpmabb8,"GameStop has more clout with console manufacturers than a lot of people realize. The store I work at just had brand new fixtures put in (TVs, light up cases, and more) entirely paid for by Nintendo, Sony, and Microsoft. These changes will soon be implemented in most/all gamestops. 

Then GameStop asked if they could slightly change the agreement in their favor (after getting the money) and the console companies said yes.",6,0,1614831910,SunflowerSupreme
96,gpmbnq8,"I don't know why anyone would invest in a company thinking ""they're definitely gonna become a completely different company""... they could just buy a company better equipped to compete with steam than convert their retail company to do that.

it's true, physical release games are becoming less and less relevant, but hardware isn't... and no other chain trades in used hardware.  focusing on hardware is smart.  I have a few gamestop-branded controllers, and i've bought a couple used consoles from gamestop.  Their expansion into PC gaming is smart.  I'd buy an inspected or refurbished GPU from gamestop, and I'd trust them over some random vendor on Newegg for my next PC build.

it just seems like some top-level delusion (or a prime example of the bargaining stage of grief) to think Gamestop is gonna just become Steam or any completely different company, but it's worth looking at what actually works in the company and what they're doing to expand on that.",1,0,1614832717,melkatron
97,gpmclbc,lmfao if you think GME has literally any chance against steam you're a retard.,5,0,1614833292,rasijaniaz
98,gpmcmmb,Gamestop is under valued. But them putting together an online distribution service to take down steam and then be valued at $1400 a share is a MASSIVE long shot.,1,0,1614833314,Crossett
99,gpmcn6g,oh im sorry whats VR? the thing they essentially brought back from the dead?,2,0,1614833324,rasijaniaz
