,comment_id,text,score,awards,timestamp,author
0,gphjjiv,Definitely a lot of shills but I’m not a bot. I bought at $26. I’m just gunna hold,6,0,1614736761,DOGEAN0N
1,gphjjua,I appreciate your Apeness. 🦍,7,0,1614736766,AeternaSoul
2,gphjjyp,"&gt; I have puts.

Ok, I’m listening...",4,0,1614736767,McPowPow
3,gphjk0y,[removed],1,0,1614736768,[deleted]
4,gphjluc,Bruh people on this sub really are autistic. Literally the sentiment now is anything not GME is a manufactured shill from hedge funds to distract form GME. Like seriously can we please just appreciate the fact that people made money off a play and not sound like the HF bots we hate some much. We sound exactly the same as the bots saying SELL SELL SELL SO YOU CAN BUY BUY BUY MORE GME.,41,0,1614736794,Orykau
5,gphjri7,124 day old account whose first comment is 34 days ago on this sub. Coincidentally the second link also has a user whos first comment is on this sub 34 days ago.,4,0,1614736874,LickMyCockGoAway
6,gphjrtt,With all of the hedge funds/institutions starting to track Reddit (Remember the $200K annual job posting to browse Reddit from a hedge fund?) I wouldn't be surprised if they start manipulating the forum to hype up stocks they own,19,0,1614736879,Misofire
7,gphjt0r,The media (cnbc business) and others having been blasting that it has a short squeeze. They are desperate,27,0,1614736896,Taketheride07
8,gphjw7q,It was the same with GME and AMC,-2,0,1614736941,Left-Fee-4315
9,gphjwko,Literally only have puts because of all the shills.,2,0,1614736946,LickMyCockGoAway
10,gphjx74,Bought at $25 and just holding. I also have GME,1,0,1614736955,sk8124
11,gphjxi4,I’m just here to check for my username,0,0,1614736960,ThanksButNoThanks_
12,gphk27j,"194 day old account with 21 karma. First comment here was 33 days ago... interesting the 33-34 number that keeps popping up.

But in the case of GME and AMC, the bots were mostly FUD spreadsrs",5,0,1614737030,LickMyCockGoAway
13,gphk3n5,"""...if they start...""

A bit late for that.",19,0,1614737051,_nkultra_
14,gphk4cf,Your account is 34 days old as well... this is real interesting,8,0,1614737061,LickMyCockGoAway
15,gphk55c,Tbh made 20k of the run and took profit so I couldn’t give 2 shits if it manufactured or not,6,0,1614737072,Orykau
16,gphk8ph,"These newbie got too excited to post their gain porn. It's the new WSB now, it will get spammed with useless post.",6,0,1614737123,holengchai
17,gphkcmn,They really think we can read?,0,0,1614737179,thedude2020
18,gphkdm8,Exactly! What in the flying FUCK MAN!,1,0,1614737193,Stopitsomemorek
19,gphke1s,[removed],1,0,1614737200,[deleted]
20,gphkens,I also noticed this and just started blocking their accounts lolll,4,0,1614737209,exeJDR
21,gphkfuo,Lol there was one person who posted about Rocket 4 times and only had like 10 karma at the beginning. I bough a week ago and already sold. I’m not sticking for whatever weird shit is going on,6,0,1614737226,Next-Seaweed-1310
22,gphkg0v,"Yea negetive hype!!!!!! Trying to get people to sell....nobodys selling before a dividend....
Gilbert isnt selling his shares so they can short and then he has to pay the divenden to the people he is ""dumping to"".....thats just stupid....rockets going up!!!",1,0,1614737229,jopoole84
23,gphkj50,Dude I literally only joined this sub a while go and mostly lurk on reddit. It ian't hard to be karmaless and still be active.,66,0,1614737276,mazurbnm
24,gphkl3m,Explains your bullshit post!!!! You have puts lmao thanks for the change son!!!,1,0,1614737304,jopoole84
25,gphkmr8,Dude I’ve been clicking on every account like you and I keep seeing the same thing. If I see a 30-40 day old account with little comment history I assume it a shill.,1,0,1614737328,derichsma23
26,gphkrbk,"Holy fuck you guys are 1000% Q anon delusional. Check my comment history too, not a shill",5,0,1614737392,an0therreddituser73
27,gphktl8,"Lmao you literally cannot write this level of funny. “I am not a bot”... but shit do they have not tendencies haha

Edit: lmao I just looked at my profile and saw that even MY profile is 33 days old. Then I remembered that I created a new profile so that I can shitpost on here because my actual profile could give away my real name. But yes, with all of the people who saw the GME hype, many new users started about that timeframe",2,0,1614737424,neldalover1987
28,gphktxu,"I just got here because of GME and I wanted to participate in sticking it to the man.  Once I opened up my own personal investment account (not controlled by a broker) it broke the ice.  GME wasn’t going well so I was looking for something else.  I happened across a few DDs and largely decided not to pursue.  But RKT made sense to me.  Large profits, potentially undervalued, a buy back which was announced but did not seem to take place yet, forthcoming earning report where people speculated the announcement of a dividend, and apparently it was strangely highly shorted so if there was movement that would help.

I went in on it at a comfort level for a newb @$20.15.

I bet you there are tons like me who enjoy being here and are trying to be a part of the community.  I don’t think bots were pushing rkt; however, now they may be as more investors means more $$$",6,0,1614737428,Familiar_Anteater178
29,gphkv3g,Hm... 275 day old act.... kinda sus man.. 😂,4,0,1614737445,Lost_in_A_
30,gphkv9x,I brought one share in it with left over money in account. Thought may aswell,1,0,1614737447,Ok_Compote_6937
31,gphkwcp,[removed],3,0,1614737462,[deleted]
32,gphkxwb,So you're telling me we have bots that can predict the future 34 days in advance? 🤔,2,0,1614737484,sdevil713
33,gphkz6t,How bout me i took over 10k in profits from today from rkt gonna let the rest ride and probley execute my 4.  27 strike price contracts on mother fucken friday!!!!!so holding!!!!!,0,0,1614737503,jopoole84
34,gphl2o3,Wsb went from like 2 million to 8 million members in the last 1.5 months so 75 % of the people on here joined then...  you’re overthinking it..  RKT is legit,2,0,1614737550,tech1983
35,gphl4hb,"Ur delusional, im a fucking human, go fuck yourself",-6,0,1614737575,Big_Lemons_Kill
36,gphl6j8,Dfv also had no karma when he started his account,5,0,1614737604,Big_Lemons_Kill
37,gphl8nu,Have fun losing tard,0,1,1614737635,Big_Lemons_Kill
38,gphl8wu,I'd never heard of this sub before GME and I imagine that goes for a lot of people. So I'd take the first comment date with a grain of salt. The influx of people here about a month or so ago was massive.,1,0,1614737638,nokillswitch4awesome
39,gphla2d,"It’s not even that crazy, mass accounts coming out of inactivity 34 days ago to be active on this sub is bizarre is it not?",10,0,1614737655,LickMyCockGoAway
40,gphlaff,"tbh, i created a new account just to be involved with this sub...im guessing there are others like me",2,0,1614737660,stockboi81
41,gphlb5i,"Absolutely, take money where it is. It is just a trend to notice",5,0,1614737670,LickMyCockGoAway
42,gphlcvk,"Because like 7 million people signed up for this sub and Reddit starting about 34 days ago. I get the suspicion and I’m sure there are hedgies playing names all over the sub just like they played off other meme stocks, but I’m going with Occam’s razor on the 34 day coincidence",2,0,1614737695,TheArtistsApprentice
43,gphld67,Why are you so mad? If I’m wrong go make yourself some money.,3,0,1614737699,LickMyCockGoAway
44,gphlfem,Up 4 grand today ty,-6,0,1614737731,Big_Lemons_Kill
45,gphli2i,"It’s confirmation bias. Lots of their comment histories are different, and many accounts posting about RKT don’t have the history you’re talking about.",0,0,1614737768,an0therreddituser73
46,gphlipm,"318 day account and your avatar is wearing black shoes. 

Obvious bot.",3,0,1614737777,raj710
47,gphll2b,RKT = Hedgie Punp N Dump.,8,0,1614737810,Betorox101
48,gphlv8l,"This is certainly something to think about. 34 days ago is about when GME was at 70, was this sub flooded by then?",0,0,1614737956,LickMyCockGoAway
49,gphlvor,[deleted],1,0,1614737962,[deleted]
50,gphlvvr,Been here for about 18 months and literally half of my karma for reddit it came off of one comment from this sub and it said “this is insane “,3,0,1614737965,DevinCapell95
51,gphlwq4,GME holders forever strong apes 🤲💎 RKT is  a P&amp;D shit.. we got the GME  🍌🦧🍌🦧,0,0,1614737977,Elie86
52,gphlyna,This was me. There was Tons of solid DD on RKT for a few weeks now. That dividend announcement was icing on the cake for me.,2,0,1614738004,seagens
53,gphm0o4,I’m just excited to be up over 20% my guy. Fomo for me trading and thanks be to gad that it did. I like it a lot and I didn’t even know rocket was a meme stock whatever just kept hearing it on 1010 wins then read about on here and said I will buy 200! Worth. Next day or 2 days later idk maybe more days.  It shot up. I’m trying to find out if it’s good idea to sell and I see mad crazy talk on here about rocket next gme so I think I’m holding. Idk I’m pretty stupid so maybe I’m wrong help me please.,2,0,1614738033,mrjamesoerkins
54,gphm16o,"I second that as I’m in the same boat lol

OP’s post is some stolen-election, COVID is fake, Jew space-laser type sheit.",4,0,1614738040,SaltNPepperonSalmon
55,gphm1ca,"I’d say the difference here is that you’re active in other subs, most of these accounts are solely based in WSB with their only other comments being in other subs 5 years ago",1,0,1614738042,LickMyCockGoAway
56,gphm59t,"Take money where you see it, not saying its a bad stock just pointing out the trend",2,0,1614738098,LickMyCockGoAway
57,gphm5j0,Good point I mainly lurk here but I’m active elsewhere I definitely think you’re probably right,1,0,1614738101,DevinCapell95
58,gphm89q,Heck.....what is a shill?   figured out most other things and I am not a bot or a spy or anything else.......just trying to get the hang of things,1,0,1614738142,Mission-Life-8029
59,gphmeui,Lmao thanks!!!,2,0,1614738237,jopoole84
60,gphmgdt,"What have you been smoking and why are you only seeing ""34""? Does 34 mean something? Should I buy 34 shares?",1,0,1614738259,TipsyBuffalo
61,gphmhm1,Do android redditors dream of electric tenders?,0,0,1614738276,LickMyCockGoAway
62,gphmhrb,So say I’m feeling like I’m sure a stock I own is going to dip in price can I  sell short ?? Like how do I take an option out to say I think it’s gonna go to this price or lower and make money if I am corect,2,0,1614738279,mrjamesoerkins
63,gphmjve,So can we sue CNBC if it tanks?,6,0,1614738309,Smash_4dams
64,gphml5t,"This one is just too obvious, again, 34 days old.",2,0,1614738328,LickMyCockGoAway
65,gphml88,Is $UWMC going the same path as $RKT?,2,0,1614738329,Chickencutletsupreme
66,gphmmti,"That was definitely around the time the numbers started going up by the hundreds of thousands. I’m seeing 34 days a lot all over the place. Some of them are against, some of them are for, some are still focused on gme and amc. Like I said, I’m sure there’s plenty of hedge funds with 34 day old accounts but I can’t see a clear pattern or strategy that would lead me to believe they’re all together unless it’s pure chaos and confusion (which I can’t rule out completely)",2,0,1614738352,TheArtistsApprentice
67,gphmoj3,"No one is desperate, hedge funds are making as much money as always",4,0,1614738377,blooberrymuffins
68,gphmqmm,"I find it interesting how many of these accounts were created exactly 34-33 days ago, in your case its 32. It’s interesting because it coincides with not only an influx of new users, but of accounts used to shill for certain stocks to either drive to price of the stock up, or to make it seem like that’s what we’re trying to do.",2,0,1614738407,LickMyCockGoAway
69,gphmtfa,I went 6 years no karma. I’m the boss of lurking,25,0,1614738446,axsant
70,gphn23c,"I’m just pointing out a trend. It’s just ignorant to write the post off when accounts all made within the same time frame start saying the exact same things.

Some of them are even dedicated to talking about nothing but RKT for 34 days",1,0,1614738570,LickMyCockGoAway
71,gphn2k5,I wanna make money and  I’m with whatever else. I need money. This stock shit is a gold mine I never realized. I was blinded. In a stupor.  Not any more. Now I upload to the exchange and hopefully but not always. Make the corect move. But for real. I need help. How dkk ok I make more money. Like these options I see people hitting. I need to do that.,1,0,1614738577,mrjamesoerkins
72,gphn55j,"Yeah, but there was one person called like tiger blood who wrote the same thing about RKT 4 different times in 30 minutes. Bots need to be called out but other people need to make sure that it actually sounds like a bot ha",3,0,1614738613,Next-Seaweed-1310
73,gphn8zq,"Does it make is money, yes, then who cares.",1,0,1614738669,Sp00dge
74,gphnayf,"Shills or not, I wouldn't expect this to be the next squeeze-to-the-moon stock. Ever since [the ticker that I can't mention because I'll get banned] it seems like everything has to be a squeeze. It's not. RKT is just another ride the hype up and sell before you become the bagholder. If you're not already in it's probably too late. Just my opinion.",1,0,1614738696,clever_af_name
75,gphnbfm,[removed],1,0,1614738703,[deleted]
76,gphndon,No problem for me. As long as you hop out at the right time you can score decently,3,0,1614738735,Gurthbrooks92
77,gphnknl,"i had to make a new acct becauss of ban from other sub.  I was called bot and shill when I was able to get back.  Maybe I am a bot duuun dunn duuun.  jk, fuck off 🙂",1,0,1614738835,Sp00dge
78,gphnm6b,I literally don't give a shit I'm making money here,1,0,1614738857,ahungrylilsandwhich
79,gphnm7b,"Maybe a shitload of people were really drunk or really high and looking for the next thing to feel sorry about after the election. Somebody whispered WallStreetBets and 34 in their ears exactly 34 days ago, and the rest is history...

 i can see the influx of turds like me though.  oO someone made money, i bet i could do that, i have phone, let looks at it and try. Then you get the shit from the hedgies at the same time... 

But back to the question - what do i do with 34??",1,0,1614738857,TipsyBuffalo
80,gphnmu8,So I'm a bot now? I didn't even know that,1,0,1614738866,Uchia_Zero
81,gphnnmz,It’s a set up,4,0,1614738877,Bar10D
82,gphnore,"Different comment histories mean nothing if the accounts are bought which is exactly why you see time gaps of 5+ years occasionally. Like I said, it’s not everyone. It is however, a LOT of accounts, more than enough for concern",4,0,1614738893,LickMyCockGoAway
83,gphnsas,[removed],1,0,1614738944,[deleted]
84,gphnthh,"Yup, not delusional confirmation bias at all",-2,0,1614738961,an0therreddituser73
85,gphnuui,"Well good for you, looks like you have no reason to be rude then...",1,0,1614738981,LickMyCockGoAway
86,gphnxbe,Mmkay!,2,0,1614739017,LickMyCockGoAway
87,gphnyl5,Why not just make our profit on RKT then bring the profits back into GME? GME and AMC both had lackluster trading volume today.,1,0,1614739036,ProfessionalBite1
88,gpho10v,"I’m one of those lurkers with no Karma. Got beat down on GME with paper hands, but going to the moon on RKT. 20 contracts of June $24 Calls. 🚀 🚀 🌙 🚀 🚀 🪐",1,0,1614739071,CDNrisk
89,gpho1ay,I’m sure you’ll find other tickers that young accounts have promoted.. anyways all hail GME!💎🚀,2,0,1614739075,SaltNPepperonSalmon
90,gpho7q3,"GME HODLer here. No RKT. Also, only 30 days old. Look at the date that’s 34 days ago. Yeah, that’s Jan 27th. So far the peak for GME. Also the biggest spike in new accounts for wallstreetbets... you may not know much about RKT, but also not much about what has happened to wallstreetbets.",1,0,1614739167,Lawlpaper
91,gpho8yf,This sub gained like 7 million subscribers in a few weeks it's not surprising there are a lot of new accounts. There are also about a billion more posts about gme than all other tickers combined.,1,0,1614739185,29ofakind
92,gpho9ru,"GME HODLer here. No RKT. Also, only 30 days old. Look at the date that’s 34 days ago. Yeah, that’s Jan 27th. So far the peak for GME. Also the biggest spike in new accounts for wallstreetbets... you may not know much about RKT, but also not much about what has happened to wallstreetbets.",1,0,1614739196,Lawlpaper
93,gphoc48,"Shorting is pretty complicated but you borrow shares from a broker and buy them back when the price goes down, Robinhood doesn’t allow short selling, so if you think the price will go down a put is what you’re looking for.

Investopedia is a good resource",3,0,1614739230,LickMyCockGoAway
94,gphof94,[deleted],1,0,1614739275,[deleted]
95,gphoi7q,"There are definitely bots on WSB. Those that deny it are sus. 

To touch on some other, larger points. The bottling on Reddit, and especially WSB is so bad that some outlets are reporting on the most mentioned tickers, and quotes from users right at market close, citing that they have AI and bots that scan WSB all day long. The one quote that comes to mind is the u/Sir_Jack_A_Lot yoloing into RKT not soon after I actually saw it on WSB myself. I wasnt insightful enough to save the articles I’ve been reading to post about it but I’m sure most of you have noticed. So definitely be careful, don’t be naive and always do your own DD.",1,0,1614739319,CriticallyThougt
96,gphomsu,"I’m sure I’m overthinking some of it, it is however worth noting that while new users came, sure, it is undeniable that a flurry of bots/shills came as well. Just something to look out for",1,0,1614739385,LickMyCockGoAway
97,gphon15,"Yeah it's hard to call it a distraction when so many people are making money off it. And to be fair, many people are using their RKT profits to buy more GME.",2,0,1614739389,sasibtyr
98,gphop5t,Why is this removed? It's an honest discussion... 🤔,1,0,1614739421,Kevin75004
99,gphopdn,I’m not calling it a distraction! Just something interesting,1,0,1614739424,LickMyCockGoAway
