,comment_id,text,score,awards,timestamp,author
0,gph60do,Fuck off.,9,0,1614729778,Keypenpad
1,gph6340,BAN!!!!!,7,0,1614729817,bbc2you
2,gph64l7,Prepare for the downvotes,2,0,1614729840,Eatmystringbean
3,gph659b,Gaaaaayyyyyyy,2,0,1614729849,willfo33
4,gph66pv,Ban,4,0,1614729870,ItsJustAltstatt
5,gph68mv,"Took you guys exactly 3 seconds, great job.",2,0,1614729898,Tombomb187
6,gph694f,Fuck you,3,0,1614729906,Ytsfbji
7,gph6bp3,Boring post. Why?,-1,0,1614729944,Grantimus420
8,gph6e1a,Where the fuck do you think you are? Support eachothers ideas? Getting offended over someone being called retarded? Go back to r/stocks lmao,9,0,1614729977,The_Moisturizer
9,gph6fm3,[removed],1,0,1614729999,[deleted]
10,gph6n09,"down ""syndrome"" voted",3,0,1614730106,orel2064
11,gph6ugm,  You done it now.,0,0,1614730211,PepeSwanson
12,gph6w9b,"&gt; If you don’t like a post down vote it. 

The only part of your shitpost I listened to",-1,0,1614730236,i-dm
13,gph6ybw,"Y’all are all wack asf, he’s just trying to be positive and help people make bank.",2,0,1614730265,NoWiFiUpHere24
14,gph729q,"This isn't a snowflake safespace, roll with the retard punches.  DFV was harrassed, look how that turned out, don't be a pussy.",0,0,1614730320,Sp00dge
15,gph73gw,How long have you been here cause clearly you don’t understand what it’s like here. You are actually an idiot,1,0,1614730338,Soupboy808
16,gph7cmi,Oh scary give me some too please. Ban,0,0,1614730468,BuckeyeGnome
17,gph7y1q,I guess I don’t like to see someone get so discouraged on their first post that they delete it cause somebody’s wants to be an asshole.,3,0,1614730773,Tombomb187
18,gph9ajh,"They shouldn't be sensitive to comments on the internet or in general. 
This place is full of trolls and bots. 
People should have the confidence to ""F the haters"" feel me?",1,0,1614731462,Grantimus420
19,gphp68x,Ask and you shall receive,1,0,1614739668,Eatmystringbean
