,comment_id,text,score,awards,timestamp,author
0,gqh2f82,Which article,1,0,1615399722,Okanemochi373628
1,gqh2f85,TheStockGuy,2,0,1615399722,Carlzzone
2,gqh2fa7,[removed],1,0,1615399722,[deleted]
3,gqh2f8y,Cant wait for all the stimmys to come in and add quad boosters to this rocket and we fly past pluto,17,0,1615399722,you_can_call_me_xdog
4,gqh2f7t,"Look like GME and AMC both massively dipped at the SAME TIME.

COINCIDENCE? Or HF manipulation?",5,0,1615399722,Hollywood_Zro
5,gqh2fbo,[removed],1,0,1615399723,[deleted]
6,gqh2fci,[removed],1,0,1615399723,[deleted]
7,gqh2fdk,"its okay gme, you can go to the moon whenever you’re ready",14,0,1615399723,Umadbro7600
8,gqh2fdb,I went from listening to edm earlier to deathcore now. See what you've done hedgefunds?,3,0,1615399723,Swiftest_Scout
9,gqh2fbg,I have mine at my break even point but that point's long gone,1,0,1615399723,Hammelj
10,gqh2fcx,[removed],1,0,1615399723,[deleted]
11,gqh2fe7,Only 1 share went through lol,1,0,1615399723,throwawaythep
12,gqh2fdp,SOME TURBULENCE BEFORE ENGINE IGNITION,6,0,1615399723,Zakshdw
13,gqh2fcm,tard,2,0,1615399723,The-Lil-Thnake
14,gqh2fct,"Who's going in for seconds, or thirds, or fourths, or fifths.",14,0,1615399723,CraigWesleySF
15,gqh2feq,Hedgefunds****,1,0,1615399723,Interesting-Sky-9142
16,gqh2fbz,Yo so it drops again it means I’m gonnabe able to buy more!!!! HOORAY!!!! But I got 5 and I ain’t selling for this chump change,2,0,1615399723,lonelydan
17,gqh2fd1,Reading a reddit thread is currently legal unless you live in china,1,0,1615399723,wizard_mitch
18,gqh2fhx,https://youtu.be/WF8fiKVsOeI,1,0,1615399724,haveexpresso_depreso
19,gqh2ffd,No do not fear death little hobbit,2,0,1615399724,EmbiidWeTrust
20,gqh2ffn,Can someone tell me if fidelity is halting trading on gme??? Etrade is halting it for me,2,0,1615399724,MeguminsThighz
21,gqh2fhc,Here we go again,6,0,1615399724,Hijosdelhuracan
22,gqh2fgw,GUH,1,0,1615399724,Lurking_Still
23,gqh2fh1,paper handed bitches. they're forgetting that this shit literally went down to 38 a share,2,0,1615399724,Simulation_Complete
24,gqh2fg6,What if you were told the dip was done deliberately by our ally to trigger SSR? Tomorrow and Friday will be wild,7,0,1615399724,BinBeanie
25,gqh2fhw,Switching off for a bit. Going to massage my wife’s boyfriends feet and come back at the bell when we hit 420,8,0,1615399724,Stonkmonster420
26,gqh2ffy,"yes sir please enjoy the exhibit and refrain from feeding the apes here, they enjoy an exclusive diet of crayons",2,0,1615399724,lemon01747
27,gqh2fg8,What platform? I've been seeing issues too.,1,0,1615399724,cluebone
28,gqh2fhl,They trying to shake everyone off,6,0,1615399724,wanderingwomensitems
29,gqh2fk0,Then 3/19 as well! Next week gonna be crazy!,1,0,1615399725,JupiterBronson
30,gqh2flm,Ape like tasty dip 🦍,11,0,1615399725,Captnblkbeard
31,gqh2fjs,Terrified. But I ain't going anywhere!,1,0,1615399725,drummerman55
32,gqh2fjz,Those who asked for a dip. This is it,15,0,1615399725,bowtiewonder
33,gqh2fjn,Is this the new HF tactic - wait until GME is halted and then launch the massive short sell attacks?,13,0,1615399725,dutchrudder7
34,gqh2fig,"Well I'm in for 50 at 260.
Tried to get in at 198 but fuck interactive brokers",25,0,1615399725,SilenceoftheSamz
35,gqh2fkr,# LAST TiME iT WENT FROM $350 to $250.... LET'S SEE... WHAT HAPPENED THEN?... OH RiGHT iT WAS FUCKING JANUARY 28th.. WE BEEN HERE BEFORE APES.,41,0,1615399725,-BobDoLe-
36,gqh2fij,Don’t tell him you have GME shares,2,0,1615399725,Mess_Tricky
37,gqh2fjc,Yea go up you bastard,1,0,1615399725,marley_d
38,gqh2fj9,Never ever ever do stop losses,1,0,1615399725,Contextual-Investor
39,gqh2fiu,This shit is going to blow in the hedgies face worse every time they do this shit lmao,15,0,1615399725,ParadoxJeT
40,gqh2fkq,Congratulations to whoever who manged to buy the dip,37,0,1615399725,maza66
41,gqh2fnu,bots/shills. every positive comment about gme is getting downvoted lmao,4,0,1615399726,Elkvomit
42,gqh2fni,"Diamond Hands 💎🙌🏻💎🙌🏻
Ape together strong 🦍",2,0,1615399726,Lazy-Fly5822
43,gqh2fn5,"""We are truly the common folk. 

The hedgies are making the mistake of utilizing strategies that only work when your opponents also know the rules of the game. These people are ACTUALLY retarded. You fling some white collar shit, and these people are just going literally poop in their hand and throw it back.""

-my best ape friend",30,0,1615399726,TenSecondsFlat
44,gqh2fms,"don't regurgitate terms you read if you don't actually know what they mean, absolutely nothing about that resembles a ladder attack.

That was a whale dumping millions of shares at once.",1,0,1615399726,outphase84
45,gqh2fm4,Who needs a plumber when you can just shit the bed?,6,0,1615399726,possiblyis
46,gqh2fnx,I was lucky to be feeding pigs during that dip. Missed having a little scare!,2,0,1615399726,Grassfedlife
47,gqh2foo,"Nah I’m still holding for now but don’t get tricked into thinking every little thing that goes against us is manipulation/illegal, that’s how you’ll end up being left holding the bag. Stay reasonable",1,0,1615399726,WeathOfTheBrild
48,gqh2fo7,"oh right-o, it kicked in right.",2,0,1615399726,darkmoose
49,gqh2fmm,[removed],1,0,1615399726,[deleted]
50,gqh2fm8,[removed],1,0,1615399726,[deleted]
51,gqh2fow,[removed],1,0,1615399727,[deleted]
52,gqh2fq7,"Major short order trying to fuck up, dropped to 172, but they all rebounded already",1,0,1615399727,ADampWedgie
53,gqh2fs2,Shouldn't have had a stop loss set 😔,1,0,1615399727,Professa333
54,gqh2fot,[removed],1,0,1615399727,[deleted]
55,gqh2fpp,"Haha. This is crazy. Apes, how u all doin?",16,0,1615399727,Kushaevtm
56,gqh2fp9,I got more,1,0,1615399727,greenthumbbumm
57,gqh2fr5,I'm 💎🙌 but how will we know when it's really the end?,1,0,1615399727,oyeme
58,gqh2frl,They are really trying hard to fuck with us. We didn’t sell at $45 we aren’t going to sell now either,7,0,1615399727,pnyluv16
59,gqh2fqc,"I know what a pump and dump is. While there is a risk, the reward far exceeds the possible risk.
The money I put in is the money I can lose",0,0,1615399727,squid_waffles2
60,gqh2fs9,[removed],1,0,1615399728,[deleted]
61,gqh2fsc,no :( still in green tho..,1,0,1615399728,c-r-t-n
62,gqh2fu5,Check GME subreddit a lot of discussion over there,2,0,1615399728,A_wild_putin_appears
63,gqh2fsn,[removed],1,0,1615399728,[deleted]
64,gqh2fu1,Price is dropping.  All the bid/asks are lots of 1s and 2s.,3,0,1615399728,Jackleber
65,gqh2ft6,"People crying for a dip all week here it is😍🚀short sale restriction is on for today and tomorrow, the rest of the week will be WHACK",26,0,1615399728,ovilagallant
66,gqh2ft5,we touched 198 briefly earlier,1,0,1615399728,iAbc21
67,gqh2ft7,"well shit on them, I bought one more on the dip :D",1,0,1615399728,marcus-87
68,gqh2ftr,"this is like the battle of 300, except we’re retards instead of spartan super warriors",23,0,1615399728,Weewus
69,gqh2ftw,this is the way,1,0,1615399728,Mirthless92
70,gqh2fui,Fucks are literally just trying to end the day red 😂 good luck with that,13,0,1615399728,lucasjhinton
71,gqh2fy9,"#HOLY MOLY!!


*I am a bot, and this action was performed automatically. Please [contact the moderators of this subreddit](/message/compose/?to=/r/wallstreetbets) if you have any questions or concerns.*",4,0,1615399729,AutoModerator
72,gqh2fxl,HA,1,0,1615399729,syncopatedsouls
73,gqh2fxh,"It was a big volume shift in a small amount of time, but it’s still not a ton of volume and we are sitting pretty for it!",2,0,1615399729,cheeseboardwhitegirl
74,gqh2fya,Nobody sold. They shorted insanely,2,0,1615399729,reeeeeb8
75,gqh2fxg,okay wtf happened? and why did it happen right when the first gme thread get locked ffs. I tried panic buying but I was in a meeting at work and uber eats was coming. worst timing ever,16,0,1615399729,og_zangief
76,gqh2fwj,"fucking webull making me wait 5days to tranfer my money
 thank god they gave me 1000to start. put it all on gme early monday morning. cant waitfor thw rest to come. why did it dip like that and suspend trading?! i know nothing pla help",7,0,1615399729,Xuguez
77,gqh2fwe,gotta be smart to be scared. We ain't scared.,2,0,1615399729,scsibusfault
78,gqh2fw8,[removed],1,0,1615399729,[deleted]
79,gqh2fws,[removed],1,0,1615399729,[deleted]
80,gqh2fvf,What do they not get about “come get  my shares at 100k a piece minimum”? 💎🙌🚀🚀,10,0,1615399729,lilrush
81,gqh2fx2,[removed],1,0,1615399729,[deleted]
82,gqh2fzv,Now we're just gonna hang out +/- $5 of yesterday's close? cool cool.,5,0,1615399730,Coleman2201
83,gqh2g14,"Just bought 500 more. Thanks for the extra cheap shared hedge funds. 

They're panicking. Watch them try to act cool on tv right now, it's hilarious.",12,0,1615399730,dustinq1990
84,gqh2g0f,I CAN ONLY BUY,1,0,1615399730,Weezingthefish
85,gqh2g01,[removed],1,0,1615399730,[deleted]
86,gqh2g00,Thanks for tagging along brother,1,0,1615399730,baaldlam
87,gqh2g0k,"No, mate. Hovered over ""BUY!""",1,0,1615399730,fightintxaggie98
88,gqh2g0n,"The attack you're doing hedgies is now a confirmation to us that you are wayyyyyy too fucked.


We are never fucking selling.

Put it to 50 again and we will buy more.

By the way, 🖕 here is the respect you deserve if you read this.

Diamond hands retards. 💎💎💎👐👐👐

Let's fucking go. 🚀🚀🚀🚀🚀",54,0,1615399730,IIDaredevil
89,gqh2fzz,I'm not going through all this stress to sell for a measly +40 per stock. Try harder HFs.,6,0,1615399730,DustinGoesWild
90,gqh2g0l,Yes,2,0,1615399730,Hacismo
91,gqh2g4x,HOLD MFS,8,0,1615399731,gottastaylowkey
92,gqh2g4v,Soon may the tendieman come,1,0,1615399731,EziosBlades
93,gqh2g31,Don’t think anyone here sold? Except you... STEVE!,10,0,1615399731,AnonymoDJ
94,gqh2g53,I lost a quarter million dollars from todays highs to now. Feels good man,24,0,1615399731,HonestManufacturer1
95,gqh2g2h,"1/27/2021 - GME price goes from $380 to $182, only to skyrocket to an all-time high of $513 AH.

HOLD",16,0,1615399731,partially__derived
96,gqh2g4p,[removed],1,0,1615399731,[deleted]
97,gqh2g5t,"There's too much volatility, they probably had it on the book and the price changed before execution",1,0,1615399731,the_axemurmurer
98,gqh2g4j,"Keep buying the dip!

Not financial advice",5,0,1615399731,fillet-o-piss
99,gqh2g6x,"I FEEL LIKE MORPHEUS
I FEEL LIKE MORPHEUS
I GOT MY WHOLE GANG
WE ON SOME OTHER SHIT

I JUST CHANGED MY SWAG

METAMORPHOSIS 

METAMORPHOSIS 

METAMORPHOSIS 

METAMORPHOSIS 

METAMORPHOSIS",7,0,1615399732,skipperjakers
