,comment_id,text,score,awards,timestamp,author
0,gqhxuwv,I smell paper hands,2,0,1615412896,doodddddd
1,gqhxv0u,"Shit you’re right, hold my wife",17,0,1615412897,onmlkjihgfedcba
2,gqhxv6g,yes but sayin is ape,2,0,1615412899,anthonyburcheatscum
3,gqhxv5d,"LOL, your wife is going to have my baby inside of her by tomorrow",11,0,1615412899,DeadPhishFuneral
4,gqhxv5z,[removed],1,0,1615412899,[deleted]
5,gqhxv5o,"Man, you are probably the biggest retard here and that’s saying something",5,0,1615412899,TheUnseenSights
6,gqhxvbm,Ok,1,0,1615412901,MolassesLate4676
7,gqhxvg7,Watch her creep back up in AH 🦍,9,0,1615412902,Donkeycow15
8,gqhxvkj,So hold now and buy friday?,12,0,1615412904,yokashi-monta
9,gqhxvlv,"Ok pep talk time. u/rensole and others on here predicted what happened today. They let the price run up to tease everyone, then they shorted the shit out of it while simultaneously flooding Reddit and the media with negativity. Make no mistakes about it, this is a war. It’s psychological warfare between you and big money, you’re trying to take what they have and they’re trying to stop you. Mentally prepare yourself for the fuckery because I fully expect them to drop another bomb on us on Friday. Today wasn’t shit, it’s the same old tactics that they’ve been doing since January. If you bought in in the two or three hundreds and can’t afford to lose the money then get out. This ride is going to get rougher before it takes us to the moon.  Everytime they try to pull these lame-ass shenanigans against us only strengthens my resolve, and it tells me we’re on the right track. What we’re doing (as a group of individuals) can work, otherwise the powers that be wouldn’t be moving Heaven and earth to stop us. It can fucking work, we just need to hold. Even if they end up stopping the big squeeze from happening, the outlook of the company is pretty fucking bright, the stock price will eventually settle in the 100’s (at minimum). Don’t lose your nerve, just keep holding.",200,0,1615412904,plzkevindonthuerter
10,gqhxvjl,He doesnt deserve dip anyway,3,0,1615412904,ScrewedUpDinosaur
11,gqhxvj6,The realised the bots were pushing this to reddit front page. Now they are resorting to reporting posts as spam,2,0,1615412904,coastalsfc
12,gqhxvyp,[removed],1,0,1615412909,[deleted]
13,gqhxvyn,[removed],1,0,1615412909,[deleted]
14,gqhxw0o,"This looks like spam. The mods have been notified.

*I am a bot, and this action was performed automatically. Please [contact the moderators of this subreddit](/message/compose/?to=/r/wallstreetbets) if you have any questions or concerns.*",1,0,1615412910,AutoModerator
15,gqhxw0h,$500 @ $203.77,1,0,1615412910,Fatherof10
16,gqhxw9c,HOOOOOOOOLD,5,0,1615412913,maddenallday
17,gqhxwdz,Hedgies are American so they won’t be as likely to attack the Europeans,5,0,1615412914,daddy_OwO
18,gqhxwe1,Fox business just did a hit piece joining rest of the jounralistic whores. I thought they'd be GME bullish just to spite liberal media outlets,4,0,1615412914,Sandvicheater
19,gqhxwha,"190 was the low today, are we expecting it to dip that low or lower tomorrow?",1,0,1615412915,sleepingbeauty_dnb
20,gqhxwie,"Guess it's a dinner of Xanax and whiskey tonight, then.",2,0,1615412916,lastcallhall
21,gqhxwka,"Simple brother, use new found gains and buy back in. Granted you didn't have a loss in there somewhere and get hit by the wash rule",1,0,1615412916,wildcard922
22,gqhxwlx,Why would some one fight so hard if there is nothing for them to loose?,3,0,1615412917,bents50
23,gqhxwmx,Yep lol,3,0,1615412917,doodddddd
24,gqhxwpy,Ummm. A lot of us already know what it tastes like? Right?,2,0,1615412918,A_Filthy_Mind
25,gqhxwob,Yes,3,0,1615412918,CastleBravo88
26,gqhxwpd,"Restrictions on shorts. 
They cant short if the stock is on a downtrend. 
+ they haven’t got many shorts left anyways..",4,0,1615412918,c-r-t-n
27,gqhxwvk,"I tell my friend GME is getting momentum is the next big thing.

He buys at 350

I tell him the stock is toppling

He averages up at 211

One mans retarded is another mans genius.",2,0,1615412920,_logic_victim
28,gqhxwtr,[removed],1,0,1615412920,[deleted]
29,gqhxx0j,full copy of article he is mentioning https://imgur.com/gallery/TOpWMwB I found it in my etrade app not online,2,0,1615412922,JsonPun
30,gqhxx18,[deleted],1,0,1615412922,[deleted]
31,gqhxx2b,huh? I just want to make sure you follow through when it hits those numbers. Or ban.,71,0,1615412923,Drippin_n_Trippin
32,gqhxx3c,"part 3, this is what i like to see. that means the bots are out boys",10,0,1615412923,tim3boomer
33,gqhxx2k,$40k ? ill take it,4,0,1615412923,flamindragonballz1
34,gqhxx71,"you know come to think of it Ive had multiple dreams this week of GME plummeting insanely and then rebounding tenfold in the blink of an eye...

am I psychic?",8,0,1615412924,TheElasticTuba
35,gqhxx7o,"Omg if this is the dip right before VW spiked for GME , I am gonna die. Remember during that squeeze Porsche paper handed and released the shares. Thwy could had gonna up thousands.",2,0,1615412925,TheIncredibleNurse
36,gqhxxcz,"&gt;TLDR: Since there has been millions of shares shorted over the past few days, and they have 3 days to use the shorted shares, I think that the dip was caused by hedgies hoarding shorts to release all at once.

Someone correct me but this isn't how shorting works at all. 

Hedgies can't borrow a bunch of shares then wait up to three days to sell them. The act of short selling is both borrowing *and* selling a share simultaneously. 

The three days (aka T+2) refers to the time the broker/MM has to actually locate the shares they lent to hedgies to short sell, and hand them over to whoever bought the shares from the hedgies.

The millions of shares you saw shorted in recent days went onto the market the instant they were short sold. They weren't saved up.

This dip was caused by a whale selling their shares en masse then buying them back at a discount due to all the paper hands and stop losses they triggered during the drop.",5,0,1615412926,smohyee
37,gqhxxe4,"Meh what did you guys expect? Just a nice straight line up and to the right? I mean, obviously sad to hear that, but that was kind of the entire point of Diamond Hands mantra.",2,0,1615412927,RelaxPrime
38,gqhxxdy,"Imagine the relief and excitement of waking up to a $280+ premarket tomorrow. 

Rocket landing on mars could take a bit but just hold on tight.",3,0,1615412927,verycoolgoat
39,gqhxxdu,"You have done an excellent job at wasting my time.


*I am a bot, and this action was performed automatically. Please [contact the moderators of this subreddit](/message/compose/?to=/r/wallstreetbets) if you have any questions or concerns.*",1,0,1615412927,AutoModerator
40,gqhxxjl,do we know why it dropped randomly like that? Hedge fund manipulation?,2,0,1615412928,SebastianPatel
41,gqhxxpa,"That picture lol. ""Hey hon, can you make sure to put the stimulus check in the college savings account for Little Leroy this afternoon?""...(Dude logging on to WSB)",1,0,1615412930,OneMoreNightCap
42,gqhxxt7,https://youtu.be/2-CnmVVHIzU,1,0,1615412931,yourmansconnect
43,gqhxxrl,[removed],1,0,1615412931,[deleted]
44,gqhxxw0,how are people following the number of shorts and other telling data? TDAmeritrade and Yahoo finance seem clunky at best,2,0,1615412932,electric4568
45,gqhxxul,"It is.  We have the ability to crash wall street.

See last week when everything else was red but GME was consistently rising.",3,0,1615412932,WoobyWiott
46,gqhxxtt,"Wake up.... Wake up and smell the moon dust, Mr. Freeman...",2,0,1615412932,Keagank
47,gqhxxy1,[removed],1,0,1615412933,[deleted]
48,gqhxxyq,why can they not keep repeating this trick each week? Why is it a single shot? I have held since Jan and bought more today at the discount.,3,0,1615412933,0rigin
49,gqhxxwh,[removed],1,0,1615412933,[deleted]
50,gqhxy29,https://youtu.be/0qCYabLy1ic,3,0,1615412935,plants_ribs
51,gqhxy2h,Roblox pulled some shady shit today so i just bought more GME with whatever I was going to put in 🤷,7,0,1615412935,HelloPillowbug
52,gqhxy6l,Yea I’m retarded tho and bought BB @ almost 17. I don’t see it getting back to that anytime soon,1,0,1615412936,Emma_Watsons_Tampon
53,gqhxy6k,It is known that you can't win against a retard because they don't follow rules or trends or anything except loading up dips and rockets to the moon.,2,0,1615412936,I_am_not_a_murderer
54,gqhxyed,"Show me your puts then, chief",7,0,1615412938,dreadstrong97
55,gqhxygs,[removed],1,0,1615412939,[deleted]
56,gqhxyjd,Ssr fun 🤩,7,0,1615412940,doodddddd
57,gqhxyl9,"Right? I mean they could've just changed the number with inspect element, but I'm not sure how someone would prove that. Is there anyway the article could've been archived with the 11:55 time?",2,0,1615412941,Matt__Larson
58,gqhxyqt,"I think there’s equal opportunities that we moon or die, why are a lot of outlets reporting short interest dropped significantly , how could they possibly know that",4,0,1615412943,23564987956
59,gqhxyrv,"Megathread part 3?  

WTF???",87,0,1615412943,theBigBOSSnian
60,gqhxyt0,"Short sale restriction. Basically, shorts cannot short on the downticks tomorrow. This is there for market stability for exactly what happened today. So they can’t tank the price with shorting. 

Means that and stimmy checks means should be a very green day tomorrow",6,0,1615412944,Obvious-Dinner-1082
61,gqhxyx6,"800,000 shares were shorted this morning and were used to attack us in an effort to make us sell.

GME still finished in the green. As of right now, only 50,000 of those 800,000 have been returned.

There's only 150,000 shares left to short.",18,0,1615412945,2ezyo
62,gqhxyvv,"I like that the shills are back, must mean one thing: BUY",14,0,1615412945,BriskaN
63,gqhxyw3,"Oh, you mean a real fucking moron.",5,0,1615412945,mrwhiskey1814
64,gqhxz30,The thread literally says this is not a Roblox thread. This comment was sarcastic. We are all going to the moon.,13,0,1615412947,money2feedmadaughter
65,gqhxz1p,This is the smart guy I was waiting for all day. Thank you for the beautiful explanation!,2,0,1615412947,stefm93
66,gqhxz24,[removed],1,0,1615412947,[deleted]
67,gqhxz17,What day/time is the next earnings statement?,3,0,1615412947,itmeliv
68,gqhxz3h,I don’t know what a stop loss is. I just like the stock,10,0,1615412948,Wide-Confusion2065
69,gqhxz7j,you're missing a few zeros retard.,6,0,1615412949,og_zangief
70,gqhxz7o,Fuck Fox News,12,0,1615412949,Diamond_handzz_420
71,gqhxz62,[removed],4,0,1615412949,[deleted]
72,gqhxzjy,lmaaaaaooooo hhooodddddlllllll,9,0,1615412953,Duckpicksnoscope
73,gqhxzi5,"The guy cheated on the sister of the 3 girls with another woman and their brother 👁👄👁

The chicken was obviously sent by hedgies to eliminate me because of my overwhelming influence over the market. My 5 shares are basically nuclear bombs",8,0,1615412953,Naveedamin7992
74,gqhxzr3,Amazing! try adding some random colored ones for extra feels good :),1,0,1615412956,nsk_nyc
75,gqhxzt9,Congrats. Thats a sweet fucking play.,3,0,1615412956,Shaggy_n_Saggy
76,gqhy04o,"this is false information, please read what the rule requires",1,0,1615412960,JsonPun
77,gqhy04l,if you use stop losses or robin hood ur a fucking retard,20,0,1615412960,h1ftw
78,gqhy084,"That's probably it, I have an exit strategy at the casino, I don't have one here, I think this whole thing is in uncharted territory and I just have to believe the DD, it's been right so far",1,0,1615412961,javeliner10000
79,gqhy0ao,I joined the 100k club for a short period of time and then you know what happened. I'll be back in the club tomorrow and staying for good.,16,0,1615412962,abeslton_Trees
80,gqhy09k,So why don't all stocks go up every Friday when calls expire?,9,0,1615412962,cough_e
81,gqhy0db,Wtf is a stop-loss?,1,0,1615412963,TheRealNoxDeadly
82,gqhy0eu,[https://www.youtube.com/watch?v=wPbzVoVn70k&amp;t=88s](https://www.youtube.com/watch?v=wPbzVoVn70k&amp;t=88s),2,0,1615412964,Core_S
83,gqhy0lq,Basically,2,0,1615412966,golobanks
84,gqhy0km,They’re scared of 350 because if it breaks through it’ll blast to 1k+,23,0,1615412966,live4rice
85,gqhy0mj,"Sorry, I just get banned like every other day and I’m not an asshole",10,0,1615412966,118naynay
86,gqhy0ow,Agreed. Who knows what's true though,4,0,1615412967,Matt__Larson
87,gqhy0p8,"today we survived our first wave of turbulence in weeks, and IM SO FUCKING PROUD of how well it was handled. To those who held and to those who BTFD, thank you for your service.",26,0,1615412967,Zmayy
88,gqhy0qo,DBZA Christmas Tree of Might is awesome though.,4,0,1615412967,thebonkest
89,gqhy0pt,"been buying a little every day, not really caring about when... todays purchase was... not well timed. 

onto tomorrow!",9,0,1615412967,Galbert123
90,gqhy0rc,"I agree. Whatever the outcome. HOLD. 
Its the only way we CAN reach our expectations.",3,0,1615412968,c-r-t-n
91,gqhy0si,Fuck son. Could’ve let the paper bitches know in advance,3,0,1615412968,onmlkjihgfedcba
92,gqhy0v5,Only if you are on our way to the moon,3,0,1615412969,sergiocj
93,gqhy0x9,"Its telling when even their response of ""no we just do our job with excellence"" begs the question why post about such dramatic price movement while volume was still very low relative the rest of the day, and not frame the article with proper context. The movement from 348 to 179 was so dramatically fast I literally walked into the adjoining room to grab a drink and returned moments later with most of the movement done already, if that isn't the article right there your just simply not doing THAT job.",5,0,1615412970,Splatacular
94,gqhy0xi,"how does a person know for sure ssr is in play

edit: i looked it up and it is not",3,0,1615412970,leroydudley
95,gqhy15b,"Losing. Where we’re going, we don’t need losing. 

Obligatory s/ and to the moon.",12,0,1615412973,Spawn6060
96,gqhy1bv,[deleted],1,0,1615412975,[deleted]
97,gqhy1gs,"Ape must not fear.
Fear is the mind-killer.
Fear is the little death that brings total obliteration.
Ape will face fear.
Ape will permit it to pass over Ape and through Ape.
And when it has gone past Ape will turn the inner eye to see its path.
Where the fear has gone there will be nothing.
Only Ape will remain.",8,0,1615412977,Raw-Fidelity
98,gqhy1i3,Ok well that further reiterates it wasn't someone on our side. Unless I guess they think they could make more money loading up on calls at the bottom while the IV goes through the roof?,1,0,1615412977,nekola90
99,gqhy1mb,Well fuck,1,0,1615412978,Jeedeye
