,comment_id,text,score,awards,timestamp,author
0,gqh1cbp,[deleted],1,0,1615399311,[deleted]
1,gqh25vk,[removed],1,0,1615399621,[deleted]
2,gqh25xt,"Reddit has a new paid team called **Anti-Evil Operations** which goes around permanently banning accounts for saying bad words. We made automod block them so you don't lose your account for saying a word and getting reported. It's not our rule, it's the entire website now, we're just trying to look out for our people. Sorry.

*I am a bot, and this action was performed automatically. Please [contact the moderators of this subreddit](/message/compose/?to=/r/wallstreetbets) if you have any questions or concerns.*",2,0,1615399622,AutoModerator
3,gqh2exn,Sir this is a Wendy's,2,0,1615399719,TheSaucePossum
