,comment_id,text,score,awards,timestamp,author
0,gq98dpy,[removed],1,0,1615238024,[deleted]
1,gq98dsh,Her pussy stank,1,0,1615238025,Corporate_shill78
2,gq98e0p,[removed],1,0,1615238027,[deleted]
3,gq98e1w,[removed],1,0,1615238027,[deleted]
4,gq98e1l,Wait till it’s at pre split levels,2,0,1615238027,icecoast44
5,gq98e4e,I own both GM and GME lol,1,0,1615238028,-MeatyPaws-
6,gq98e7w,[removed],1,0,1615238029,[deleted]
7,gq98e66,10k. Should bottom around there,1,0,1615238029,_penseroso_
8,gq98e9h,[removed],1,0,1615238030,[deleted]
9,gq98e92,Damn your puts are Killin you eh?,3,0,1615238030,Imnotabastard22
10,gq98edy,Same way it went up,2,0,1615238031,brianjoseph_
11,gq98ebu,"**OCGN**... *Have you.. not kept up with what’s going on?* I did the same as you but hopped back in. This is literally selling to over 70 countries the ceo has said. Nasal vaccine approval, closest to vac for kids, two new conferences this week, biden goes to India and is now cooperating with India on vaccine.. they are also located in PA and branching all over the country now.. moderna has pics going around of scarring from vaccine, Pfizer death toll is circulating around the internet, J&amp;J has fetus cells in it making religious groups fighting it.. **OCGN** is also the most effective after phase 3 trials..  old WSB wouldn’t have missed this one.",3,0,1615238031,Tayfoo
12,gq98ein,[removed],1,0,1615238033,[deleted]
13,gq98eie,All day boner tomorrow. Just knock things off of tables swinging it around. Those are my moves.,14,0,1615238033,Big_Green_Piccolo
14,gq98emw,I would say so. I’m looking to buy at a cheaper price like last week tho.,2,0,1615238034,tacofury-inc
15,gq98epu,U/peanutbuddacracker has to drink his piss do not let this go unnoticed,22,0,1615238035,leblaun
16,gq98epa,"PLTR has retard strength. It should be at 20 if it followed Friday's event with nasdaq dropping this much , but the retarded walls are too strong.",6,0,1615238035,lIlIlIlIlIlII
17,gq98eoj,SFIX is having a rough day. My puts approve!,1,0,1615238035,anonchurner
18,gq98eye,"Today was fun, up 89% in my Yolo account",6,0,1615238038,Killerslug
19,gq98eyg,whats your fav dip buy? TSLA SQ TDOC  PLTR ?,3,0,1615238038,KelbySmith
20,gq98exc,"When you hit that 100%, then you just close shop and open a new account and you start over! Whats 100% in losses when you can make that bad boy 200%",2,0,1615238038,CarlThe94Pathfinder
21,gq98ezs,[removed],1,0,1615238038,[deleted]
22,gq98f13,"Bought GME at 190. ""I'm doing my part""",19,0,1615238039,AAces_Wild
23,gq98f7x,Anyone holding APPS? I doubled down hard today around $66 thinking it was the bottom and oh boy it wasn't.,1,0,1615238041,nahog99
24,gq98fol,"Holding two calls, upside down on one and close to profitable on the other lol.

One exp this Friday and it's not looking good. Let's see if it benefits from the hot smoky gee em ee run",1,0,1615238047,se7en41
25,gq98fob,they only make money if the us buys in tho. and the us now has 700m vaccines ordered i just dont know if they need more,1,0,1615238047,Early_Forever1058
26,gq98fox,"Out of all the tech stocks that keep falling, NVDA is the one that makes the last sense. If this is your strategy I think you're gonna be real happy in a couple of months.",3,0,1615238047,Foman1231
27,gq98fr0,[deleted],1,0,1615238048,[deleted]
28,gq98fp0,"I'll still cheer for you, but tendies are tendies.",1,0,1615238048,siftt
29,gq98fuh,Proud of u x,2,0,1615238049,ColmM36
30,gq98fvl,Bois. HE IS STILL IN!!!!!,2,0,1615238050,Imnotabastard22
31,gq98fwq,Glad I didn't buy StitchFukt,1,0,1615238050,spyaintnobitch
32,gq98fzu,"i bought like 300 shares of GME. ya, that's right. lol",7,0,1615238051,winewithlunch
33,gq98g0z,"We found the floor, right guys? 




Guys?",3,0,1615238051,phiggie
34,gq98g1l,[removed],1,0,1615238052,[deleted]
35,gq98g1j,"Just bought into PLTR , what’s expected?",2,0,1615238052,cheffboiiird
36,gq98g9o,Why isn’t there an AMC mega thread ? This is long overdue,15,0,1615238054,marktrain1234
37,gq98g9k,How low will SPY go cause of GME,3,0,1615238054,but-this-one-is-mine
38,gq98gh3,"AAL calls and DASH puts got me up almost 40% today, who says you can't make money in this shit?",5,0,1615238057,lamada16
39,gq98gp5,Up 28% today! Lucky $777. I see good futures,6,0,1615238060,Bigpoppa2695
40,gq98gup,reading that made me grow a vagina,0,0,1615238061,TadpoleCreative
41,gq98gti,"Red days, hold long term for hulk dicks",8,0,1615238061,RoyalFail6
42,gq98h12,"Lmao, AMD has been slowly ripping my asshole apart.",1,0,1615238063,nahog99
43,gq98gzd,How is it a ponzi scheme?,1,0,1615238063,CarlThe94Pathfinder
44,gq98h3v,Going to buy 55 shares of AMC once my funds clear tomorrow!! I have no idea what I'm doing lol.,14,0,1615238064,gooch_taster
45,gq98h5i,Yahoo is already calling a correction on tech. Does that mean we’ve hit the bottom?,5,0,1615238065,PumpkinRice
46,gq98h99,Nah I want them but y’all are ruining an easy play for all of us. 😂,1,0,1615238066,BobbTheBuilderr
47,gq98hbb,3 straight weeks of red right before I leave for my ski trip 😎,8,0,1615238067,positivevitisop1
48,gq98hch,[removed],1,0,1615238067,[deleted]
49,gq98hbk,Who told you?,1,0,1615238067,WallStreetBets_
50,gq98hh7,Hmmmm buy GME retard,1,0,1615238069,52-75-73-74-79
51,gq98hh2,TSLA if it dips a bit further,2,0,1615238069,Robo_Puppy
52,gq98hiy,"Can't stop. Wont stop.

💥💥🚀🚀🚀",8,0,1615238070,YinzSauce
53,gq98hjt,A tale as old as time itself,5,0,1615238070,1811pharmx
54,gq98hqq,[removed],1,0,1615238072,[deleted]
55,gq98hw5,Yes,4,0,1615238074,Furloughedinvester
56,gq98hy9,Yessir,2,0,1615238075,AdministrativeBig754
57,gq98iac,How low is PLTR gonna go? Down 25% and keeps droping.,6,0,1615238079,negativeonex
58,gq98ifq,Nah it's the girthy elevator attack,2,0,1615238081,Killerslug
59,gq98iid,The legend himself,1,0,1615238082,XursExoticEngram
60,gq98ip3,Almost 1k comments in 15 minutes lol I love you retards so much 🚀🚀🚀🚀🚀🚀🚀🚀,8,0,1615238084,MrHandyHands616
61,gq98iou,There are 2 ways.,1,0,1615238084,BossMcHogg
62,gq98is2,I think its gonna dip hard the first week or so. Solely because of how the market is acting at the moment.,3,0,1615238085,BxBxfvtt1
63,gq98is1,I lost thousands on SOXL today and bought 1 GME call and sold it 90 seconds later at a 1500 dollar profit. AHHHHHHHHHHHH,6,0,1615238085,Cerion3025
64,gq98ivl,Stonks or options? If stonks hold. If options you might wanna sell and use the money for different options with different dates / prices.,2,0,1615238087,nahog99
65,gq98j1g,"""Your holding my bags"" 🚀",2,0,1615238089,dogeball40
66,gq98j30,"   For tomorrow, I think that I'm going with GME, PLTR, AMC, RKT &amp; BB.  I might switch BB for AMD, but I need more SCOTCH to decide.  

   'TARDS, what are you using to pick your stocks?  I like to check the websites below, but  I'm only focusing on the top 5 stocks...  (I'm not sure about AAPL or TSLA).  Don't follow foolishly, so do your own research before making any bets... any WALLSTREETBETS!

[https://stocks.comment.ai/trending.html](https://stocks.comment.ai/trending.html)

[https://www.highshortinterest.com](https://www.highshortinterest.com/)",9,0,1615238089,SPaniardz
67,gq98j2p,"If you are andrew left you hire a bunch of indians to post here so you can short the tech market and punish people on here.

Guys like him are the worst people on earth all they want to do is spread FUD and make money.",2,0,1615238089,tiger1873
68,gq98j5f,[removed],1,0,1615238090,[deleted]
69,gq98j9j,Did some portfolio rebalancing. Slowly dollar cost averaging solid tech names. Buying a bit of value reopening plays. Its all gonna work out beautifully in a month or two.,5,0,1615238091,Domethegoon
70,gq98j89,"Everyone is gonna take that money and buy food, rent, something through amazon, a new apple phone... they're gonna see google ads and talk on facebook about how they need to update their Microsoft software. 

I am seeing a surprisingly large amount of skepticism from liberals about the vaccine, people not wanting to get it. That's concerning. Nobody even knows how to get it yet the economy is pricing in that everything is going to go back to normal. People aren't gonna throw away their phones and go to bars and stop using tech.

This vaccine rollout is going to be botched or stalled for a long, long time. We may never reach herd immunity and COVID breakouts will rise as people become complacent.",1,0,1615238091,zwirlo
71,gq98jed,BABA,1,0,1615238093,Furloughedinvester
72,gq98jgl,"Yes, I will take one AH red RKT please. Extra red. With a side of red.",6,0,1615238094,Slave_to_the_bets
73,gq98jlu,Samsies,1,0,1615238096,ParzivalVonUbermench
74,gq98jo3,[removed],1,0,1615238096,[deleted]
75,gq98jpf,[removed],1,0,1615238097,[deleted]
76,gq98joa,I just wanna say. I fell for the green opening for 5 mins and then everything tanks.,6,0,1615238097,SantriCong
77,gq98k1o,Somebody lost money or missed the train twice now,1,0,1615238101,Cryonyx
78,gq98k8e,No it isn't.,1,0,1615238103,VaginalDischarge
79,gq98kbj,GAMESTOP,6,0,1615238104,MrHandyHands616
80,gq98kbd,"I think it's time I level up from RH. It was a great platform when I was first starting out, but now that I have a 200k+ account and do 100+ contracts at a time there bid and ask spread filling is just way to shity. It's a great platform to start out on and if you do a few plays at a time you won't notice the spread filling difference to much, but now that I'm bigger I definitely feel it dude. 100 or 200 dollars lost just to fill orders is adding up and I'm sick of it now. They also fuck you over by making sure your sells are always done cheap than buy, essentially you always are losing a bit on bid and ask spread so there clearing house makes money.",10,0,1615238104,coldiron03
81,gq98kh2,Probably avoid ever using the word pump unless you are truly retarded. We don’t do pump and dumps around here,2,0,1615238106,jaxsmithers
82,gq98kmp,"Or Friday, that'd be cool, too.",1,0,1615238108,cptspinach85
83,gq98km8,we mooning rest of the week,14,0,1615238108,harryburton420
84,gq98kls,Meme calls will ruin these people,3,0,1615238108,OneTrueDweet
85,gq98kmk,[removed],1,0,1615238108,[deleted]
86,gq98ko6,Estimates are around $18.,1,0,1615238109,gecemg
87,gq98kop,lol wqhat?,1,0,1615238109,Intfamous
88,gq98ksr,GME for life. Hold and buy the dips. 💎💎💎🤚🤚 let’s go! Ride this 🚀🚀 baby.,12,0,1615238110,etrybailey
89,gq98kyg,[removed],1,0,1615238112,[deleted]
90,gq98kzq,[removed],1,0,1615238113,[deleted]
91,gq98l32,"If you need liquidity, yes. If you can afford to hold long term, buy it and forget about it. I’ve been picking up a couple every week for about six months but don’t expect it to print for a loooong time.",1,0,1615238114,LyricRevolution
92,gq98l3g,GME AND AMC ALL DAY LONG!  💎🙌,16,0,1615238114,Wojtek0415
93,gq98l3q,[removed],1,0,1615238114,[deleted]
94,gq98l49,"""Don't do that... don't give me hope...""",1,0,1615238114,Frank_Caswole
95,gq98lgn,Chart says it’ll fill to $400-500. Being patient and waiting for sub-500s is my plan then buying calls expiring two weeks from that date 20% OTM,2,0,1615238118,fwoot_fwies
96,gq98lnv,"selling low and buying back in at peak, that way the stock goes way up and you autists get rich.

brb got some crayons that need eating",12,0,1615238121,Thelastret2
97,gq98lnx,Cocaine is bad for you,2,0,1615238121,lll_lll_lll
98,gq98lre,"I have GM, GME, and GE. I got all the bases covered",2,0,1615238122,VeniceRapture
99,gq98lsl,[removed],1,0,1615238122,[deleted]
