,comment_id,text,score,awards,timestamp,author
0,gqhnwwy,"Sir, this is a catnip lounge.

*I am a bot, and this action was performed automatically. Please [contact the moderators of this subreddit](/message/compose/?to=/r/wallstreetbets) if you have any questions or concerns.*",1,0,1615408592,AutoModerator
1,gqht4tp,"The main problem is that genz is playing wolf of wallstreet via apps on their smartphones and randomly pushing the completly overrated gme stock to the moon.

Its ok, doesnt bother me, the billion losses of hedgefonds doesnt bother me. The thousands of normal peopel who are the loosers of this whole gamestop thing makes me sad.

Its like you going on a heist with 6 peopel and 3 of them bail out with the money and 3 left with nothing.",1,0,1615410827,thelord1991
