,comment_id,text,score,awards,timestamp,author
0,gqhjhmf,It’s called instutions selling,2,0,1615406693,ecrane2018
1,gqhjk5t,What is SSR,0,0,1615406723,kingallison
2,gqhjlkf,[removed],1,0,1615406740,[deleted]
3,gqhjp48,This has nothing to do with hedges you 🤡,1,0,1615406783,Tyr312
4,gqhjqk9,"I am a bot from /r/wallstreetbets.                                You submitted one or more banned tickers: SSR.

                                Message /u/zjz if they're above 1.25 billion-ish market cap and not related to crypto/pennies/OTC/SPACs.",1,0,1615406800,VisualMod
5,gqhjqws,Pretty sure institutions are buying in from current public evidence lmao,1,0,1615406804,MostLikelyHasADHD
6,gqhjrj1,My smooth brain enjoyed this confirmation bias thank you,1,0,1615406811,adairyberry
7,gqhjs22,super secret retard?,1,0,1615406818,WillingDrawing3246
8,gqhjso8,Short sale restriction,1,0,1615406826,Herbstalk
9,gqhk1pg,I don’t know it’s kind of fishy tho,1,0,1615406935,aromaticsmeg
10,gqhk28z,Should I go to the doctor??  - I have gone blind and this Boner won’t go away... easily 8hrs.. oh i thought this was the Viagra counter .. told you I was blind,1,0,1615406942,tonystarks6969
11,gqhoqpg,"The post has been removed. Anyone who read, what did it say?",1,0,1615408938,SanEscobarCitizen
