,comment_id,text,score,awards,timestamp,author
0,gqepoe5,"Mods, re-ban this boomer",12,0,1615347116,ATMcalls
1,gqepp52,Easily a comment not a post,2,0,1615347128,whats-left-is-right
2,gqeppt0,Noo pls no lmao,2,0,1615347138,killmeplsdude
3,gqeprm3,Nope it's a discussion you are discussing good day sir.,0,0,1615347168,killmeplsdude
4,gqepspu,Are you like a child?,2,0,1615347185,HarbingerX111
5,gqepvfw,The fact that generation Z’s think they’re unique is hilarious lol,3,0,1615347229,NuckinFutsCanuck
6,gqepvtk,Depends if you want me to be papi... No homo,-1,0,1615347235,killmeplsdude
7,gqepxrh,I can discuss a discussion when a discussion decides to show up,1,0,1615347266,whats-left-is-right
8,gqeq0ab,Ahh sum1 who either got the post and took it to seriously or didn't get the post.  Or someone who is joking.  I need to work on reading signals now don't I...,0,0,1615347306,killmeplsdude
9,gqeq46g,It’s not that serious my dude.,1,0,1615347367,BandoTheRaccoon
10,gqeq6v8,Well this just got awkward...,1,0,1615347411,BandoTheRaccoon
11,gqeq7yk,Ah and you see now you are discussing a discussion that may last longer than a day and would be irrelevant to the daily discussion thread.,1,0,1615347429,killmeplsdude
12,gqeq8vx,Lmfao,1,0,1615347445,killmeplsdude
13,gqeqbyf,No shit Sherlock we are on Reddit remember?,1,0,1615347494,killmeplsdude
14,gqeqf0b,"I was gonna flair it as a shitpost, but seeing all the shit he’s throwing at visual mod, I may have to consider that",1,0,1615347545,Memetron9000
15,gqeqfaq,"Hey now my guy, no need for name calling.",1,0,1615347549,BandoTheRaccoon
16,gqeqfle,The discussion that I'm discussing is about the merit of discussing what could be a comment on the daily thread yet instead it's discussed as a discussion.,1,0,1615347554,whats-left-is-right
17,gqeqv58,Wait your name isn't sherlock...,1,0,1615347805,killmeplsdude
18,gqer26h,Ah but you forget that we are now stuck in an endless conversation making it a discussion that could potentially last year's.  Though I doubt I will live that long as I forgot to bring a helmet and thus rocket is taking me to mars.,1,0,1615347920,killmeplsdude
19,gqer311,"Discussion: the action or process of talking about something in order to reach a decision or to exchange ideas.

I mean...",1,0,1615347935,AlluriousVOLmoleCule
20,gqerwo2,"But you see I'm going to mars as well so this discussion discussing a discussion is destined to drone on in a downward direction dragging dully, determined to decend down to death.",1,0,1615348422,whats-left-is-right
21,gqes22d,But yet again you forget something once an object reaches space it never goes down only up.  This will happen to gme as it will happen to this conversation.,1,0,1615348512,killmeplsdude
22,gqes77y,Damn riperoni conversationvill,1,0,1615348600,whats-left-is-right
23,gqesblw,I I think it's over... Whatever you said left me so confused that you will not have to reply to this as I can not think of anything to say.  Thank you.  Thank you so much.  Now I can sleep.,1,0,1615348674,killmeplsdude
24,gqesee8,Goodnight sweet prince 😘,1,0,1615348721,whats-left-is-right
25,gqesosf,How could you traitor?  We could have ended it.  The suffering.  Now we must discuss TO THE DEATH!!!,1,0,1615348899,killmeplsdude
26,gqesz7j,"I challenge you to a dual to the death, format: endless meaningless discussion",1,0,1615349075,whats-left-is-right
27,gqetapp,Ok tomorrow you shall perish cuz I seriously have to sleep man.,1,0,1615349269,killmeplsdude
28,gqetlcj,I shall meet you soon the arrival of the next sun where we shall discuss to the death,1,0,1615349452,whats-left-is-right
29,gqi4xzx,Aha you had forgotten and now I shall message you till you're inevitable demise.,1,0,1615416171,killmeplsdude
30,gqivrsn,Your attack dose nothing the discussion shall last forever,1,0,1615430095,whats-left-is-right
31,gqiw3kf,Wow man you only reply at terrible times I can only reply until 10,1,0,1615430267,killmeplsdude
32,gqiwrhc,Perfect timing,1,0,1615430618,whats-left-is-right
33,gr249o5,Hah did you think I forgot?  Well actually I did but I remembered you shall perish.,1,0,1615843698,killmeplsdude
34,gr24btu,Ha you can't stop me I will end you,1,0,1615843743,whats-left-is-right
35,gr24f95,Yeah right... Hey side note I did win the previous discussion about this post being a discussion correct?,1,0,1615843815,killmeplsdude
36,gr24goc,I didn't hear no bell,1,0,1615843846,whats-left-is-right
37,gr24ic5,So then you admit you are a deaf pos?,1,0,1615843882,killmeplsdude
38,gr24lak,Negative Huston that's gonna be a no-go,1,0,1615843946,whats-left-is-right
39,gr2529i,Huh didn't realize that you were in contact with my dog Hutson.,1,0,1615844340,killmeplsdude
40,gr257nc,"That's affirmative, Huston is running ground control for this operation the barks are difficult to interpret but I make due",1,0,1615844469,whats-left-is-right
41,gr25acq,Huh I don't even have a dog... Sir would you like to be escorted to the nearest institution?,1,0,1615844535,killmeplsdude
42,gr25c56,It appears I have been bamboozled who's been barking in my ear for the last week?,1,0,1615844579,whats-left-is-right
43,gr26fhv,Probably you're friend at the old folks home marty,1,0,1615845505,killmeplsdude
44,gr27a93,Sound about right,1,0,1615846201,whats-left-is-right
