,comment_id,text,score,awards,timestamp,author
0,gqhfzsx,Going all in short gme. Get out now or lose $$$$,-5,0,1615405205,Stocks_Only_Go_Up1
1,gqhg4db,[removed],1,0,1615405259,[deleted]
2,gqhg8tp," Coming for you
I will never stop",1,0,1615405311,TheRoyalTouch510
3,gqhg8s0,[removed],1,0,1615405311,[deleted]
4,gqhga6z,"Not believing in memes is blasphemous, i hope Elon sends you a angry tweet",1,0,1615405328,Samuraikemp
5,gqhgaoo,Come on downvote me bro....,1,0,1615405333,TheRoyalTouch510
6,gqhgf5s,These HF AND MM HAVE NO CLUE,1,0,1615405385,TheRoyalTouch510
7,gqhgomw,I'm so locked in this it's like the hardest level on Zelda. I will never quit...,1,0,1615405499,TheRoyalTouch510
