,comment_id,text,score,awards,timestamp,author
0,gqc4v07,"I am a bot. A Gain/Loss/YOLO should be a picture of a closed gain, a closed loss, or an open position &gt; $2,500.",1,0,1615303778,VisualMod
1,gqc4v4m,"Sorry, I sold my AMC yesterday to buy more GME. I know I did bad. Ill go back in, when I get tendies from GME

But my wife's boyfriend still is in on AMC. So that's something",1,0,1615303780,Chefedout
2,gqc56gw,[removed],1,0,1615303905,[deleted]
3,gqc5p9k,Good bot,1,0,1615304109,Internal_Potato
