,comment_id,text,score,awards,timestamp,author
0,gqfiz50,~~positions or~~ ban,1,0,1615370564,clodtastic
1,gqfj25z,King of the shill,1,0,1615370647,Heterophobictendency
2,gqfj6z5,What’s up with all these fuckin people making claims with no DD what so ever?!,1,0,1615370780,Steelstrike309
3,gqfl287,Ban pls,1,0,1615372595,Goldensilver_EX
4,gqfl9qq,Not my post but I'll try.  I *think*..the thing we're talking about that we aren't supposed to talk about here..has crossed the 50K mark confidently now and that was in question because it had dipped back below it on the first attempt.  It *appears* to be leveling up right now...which would benefit MARA.,1,0,1615372802,jgpudlum
