,comment_id,text,score,awards,timestamp,author
0,gqi0us6,"Bro don’t tell my company who your eye doctor is, you are def getting finessed",15,0,1615414229,d3medical
1,gqi164j,[removed],1,0,1615414377,[deleted]
2,gqi16ba,Looks like its going to triple and charts never lie.,5,0,1615414380,Zauxst
3,gqi1gvi,Is that Batman on the left?,11,0,1615414519,kmaco75
4,gqi1ry8,Batman is watching over us.,3,0,1615414665,LameBMX
5,gqi2c29,"Yes, it's really similar looking to my left and right ball. Yet, I like the stock",6,0,1615414928,psychothepit
6,gqi4s5e,"The second leg up is a good indication the squeeze is going to be massive. Expect something much larger than the first. **DIAMOND HAND GME BECAUSE 1K is the new FLOOR**

See everyone on the MOON 📈🚀🌕",3,0,1615416093,Keepitlitt
7,gqi5cwy,I’m Batman,3,0,1615416373,AmericanJay
8,gqif8k0,This ape is colorblind and only see 🚀,1,0,1615421402,Hwhp209
9,gqjv19n,"Checks out.

Nobody has ever seen you and Batman in the same room.",1,0,1615451695,kmaco75
