,comment_id,text,score,awards,timestamp,author
0,gq9biwl,[removed],1,0,1615239416,[deleted]
1,gq9biym,BREAKING: Price Target DOUBLES for AMC. - WEDBUSH,5,0,1615239417,trainwreck001
2,gq9bj3r,So much green everywhere wth,2,0,1615239419,ButtersDaBeast
3,gq9bj92,"diamond hands, rocket

diamond hands, rocket

diamond hands, rocket

got the tendies in my pocket",7,0,1615239420,ltsPricedln
4,gq9bjk1,[removed],1,0,1615239424,[deleted]
5,gq9bjoq,Now that's the kind of FD I used to come here for.,1,0,1615239426,loopdieloop
6,gq9bjog,"Lol, how much did those cost?",4,0,1615239426,babalu_babalu
7,gq9bjna,Yeah like when do I just call it quits and toss what is left in something safe like an etf or apple shares and hold long,2,0,1615239426,TheOriginalRK
8,gq9bjqz,what stock to buy if you want to try anal but too afraid of the real thing?,18,0,1615239427,soAsian
9,gq9bjwv,"I hate AAPL so fucking much, I’ve rage sold it before and I’m about to do it again",23,0,1615239429,OGWan_Ked00bi
10,gq9bk1f,"What the fuck, I just got approved at Robin Hood and their interface absolutely fucking sucks. It's mostly designed for one way options trading or buying/selling shares only.",2,0,1615239431,oregon_forever
11,gq9bk80,"In the tech bubble, the old guys say they knew it was a bubble but couldn't tell the bubble popped until like a month after the nasdaq peaked.

The bust coincided with tax season - and with Yahoo's unwind following S&amp;P inclusion a few months earlier - 

The high flying ""Janus"" funds, ""the very symbol of tech bullishness"" collapsed with Yahoo, Cisco, and its other high P/E growth holdings by mid April.

The S&amp;P showed relative strength into mid-late March, before it too started to follow the Nasdaq as everyone liquidated. 

The Fed was also forced to raise it's overnight rates for the first time in 5 years in May, due to ""a risk of inflation down the road,"" finishing off the markets.

You can't make this shit up.",22,1,1615239433,looseinsteadoflose
12,gq9bkfd,She has to be a freak so yeah,4,0,1615239435,odogangledrummer
13,gq9bkcx,"Criminally, even",3,0,1615239435,idcwtfsmd
14,gq9bkgo,[removed],1,0,1615239436,[deleted]
15,gq9bkmk,[removed],1,0,1615239438,[deleted]
16,gq9bknv,this market is more retarded then i thought...,16,0,1615239438,Early_Forever1058
17,gq9bkn0,Koreans are pretty smart.,1,0,1615239438,chiefoogabooga
18,gq9bkqv,"Yea because I understand how options work and what subreddit I am on. Don't forget my yacht, which you won't be invited to",-2,0,1615239439,coldiron03
19,gq9bkqb,Id pay 3k to have my head crushed between her thighs,6,0,1615239439,haddonhopkins8
20,gq9bkzt,[removed],3,0,1615239442,[deleted]
21,gq9bl0o,"Bought the NIO dip. My third time buying dips. This shit is playing limbo to see how low it can go.

Someone get me a pina colada.",6,0,1615239443,JohnnyHopkins13
22,gq9bl2n,RemindMe ! 2 days let's find out,1,0,1615239443,bagtf3
23,gq9bl7g,Steel and other commodities,1,0,1615239445,BallsForBears
24,gq9blcn,You don't come to our house and trash our stock. Let it crash. WE STILL LIKE THE STOCK!,4,0,1615239447,Christian1762
25,gq9bld5,Fee like I should have. It was up exactly 100% and that didn’t make me cum yet so I held,1,0,1615239447,hlaz
26,gq9blja,I'm not in it but ya GME is the new TSLA for bears. I wouldn't fuck with it.,1,0,1615239449,TranquiloSunrise
27,gq9blip,"I got NO moves for tomorrow.  NOT moving at all. 

One could say I would be 💎🙌",16,0,1615239449,DrWeGotDis
28,gq9bliy,"Unfortunately the markets are tied inversely with GME and I want BOTH of them to top. Of course if I’m honest, I’ll get downvoted.",1,0,1615239449,mazaherh
29,gq9blmd,$AMD,5,0,1615239450,ltsPricedln
30,gq9blo2,25 at an avg of $142. It's dropped to the point that it's getting comical,1,0,1615239451,Apex_Fail
31,gq9blsw,[removed],2,0,1615239453,[deleted]
32,gq9blur,the year is 2022. SPY is at $500 and QQQ double digits. All EVs have been converted into petrol cars. GameStop has acquired Amazon and people literally cannot stop taking cruises/flying around,32,0,1615239453,beepitybop400
33,gq9blyx,that's why teachers don't like when you use wikipedia,4,0,1615239455,JPowsBestie
34,gq9bm7c,Got Yea. I live in Orlando and our theme parks have been hitting capacity on the weekends and Disney world is way bigger than Disneyland as a whole and they’ve been open for months at “limited” capacity.,1,0,1615239458,nomadofwaves
35,gq9bmfu,It's Cathie Wood,3,0,1615239460,The_Coward_Sorcerer
36,gq9bmio,Almost 10k,1,0,1615239461,coldiron03
37,gq9bmkv,I gotchu.,1,0,1615239462,Ursle
38,gq9bmnz,[removed],1,0,1615239463,[deleted]
39,gq9bmqi,GME of course,2,0,1615239464,NOCLXUD
40,gq9bmy5,Just saw a model Instagram page where a body builder cracked eggs into his mouth and **BIRD FED** a hot girl in a bikini,4,0,1615239467,Cowboyre
41,gq9bn03,[removed],1,0,1615239468,[deleted]
42,gq9bn7m,"Just want GME to take out the whole market so the slowly dying retards get a quicky mercy bullet to the dome.. win for us/ financial death for you
Quick and painless 😏🤣",-7,0,1615239470,Responsible_Fun6255
43,gq9bn9z,I think you misspelled “buy”,1,0,1615239471,haddonhopkins8
44,gq9bnav,[deleted],1,0,1615239471,[deleted]
45,gq9bna1,"yeah, you probably use schwab",5,0,1615239471,dogeball40
46,gq9bncb,PLTR,5,0,1615239472,Weight_Stunning
47,gq9bnew,[removed],1,0,1615239473,[deleted]
48,gq9bnky,European retail banks have a ways to go. Santander socgen bnp etc.,1,0,1615239475,FelWill
49,gq9bnjx,Time to liquidate....,-1,0,1615239475,Okayokaythatsnotgood
50,gq9bnqp,I might throw them a cracker or two,1,0,1615239477,Nomes2424
51,gq9bnsj,gme,4,0,1615239478,BringBackBrofist
52,gq9bo3o,damn son is that yacht the USS Saltyboi,4,0,1615239481,weed-futures
53,gq9bo4f,"Seeing gme go up while other tickers bleed kills the soul in so many ways, the second I touch that ticker tho it will go straight back to $40. I should accept some Venmo payments from put buyers in the meantime tbh",12,0,1615239482,aqjingson
54,gq9bodn,"Are you telling me a food delivery app that IPO during peak COVID isn't worth 2 billion?! 

&amp;#x200B;

120p 3/26",2,0,1615239485,escrocs
55,gq9bov3,"I LOVE DEL TACO, didn't know about their IPO tho lmao",3,0,1615239491,TadpoleCreative
56,gq9boyk,[removed],1,0,1615239492,[deleted]
57,gq9bp4y,Are they targeting the precovid price adjusted for dilution?  Because that'd be $4 LOL,4,0,1615239494,derprondo
58,gq9bphr,That premium tho,3,0,1615239498,BrokeAssImmigrant
59,gq9bpjs,[removed],1,0,1615239499,[deleted]
60,gq9bptg,"&gt;The Fed was also forced to raise it's overnight rates for the first time in 5 years in May, due to ""a risk of inflation down the road,"" finishing off the markets.

JPow wasn't in charge back then

Its a different fed this time",4,0,1615239502,dbgtboi
61,gq9bptl,Yeah the fundamental value is there just based ok the 🅱️TC they own. This is short of being an arbitrage situation if 🅱️TC stays at these levels.,1,0,1615239502,jardinero_de_tendies
62,gq9bpuj,[removed],1,0,1615239503,[deleted]
63,gq9bq07,[deleted],2,0,1615239505,[deleted]
64,gq9bq3z,Lmao you guys fucking kill me,2,0,1615239506,ohbillyyy
65,gq9bq53,IV crush,3,0,1615239506,the-faded-ferret
66,gq9bq83,Another dumb bubble I'm happy to see pop tbh,2,0,1615239507,el_hicham
67,gq9bqbi,Me too,1,0,1615239509,jbawgs
68,gq9bqgl,Disney came in clutch holy fuck,7,0,1615239510,RyFisch
69,gq9bqht,I can taste the salt,3,0,1615239511,nothanksreddit2
70,gq9bqpa,PLTR,4,0,1615239513,ButtersDaBeast
71,gq9bqnc,/r/hydrohomies,2,0,1615239513,MikeOx_Girthy
72,gq9bqzg,"Well I got to hand it to Michael Burry who tweeted weeks ago traditional stocks will grow while overvalued tech will plummet.  Aspergers...the real
autist.",13,0,1615239517,LarryGlue
73,gq9br7s,need my calls to print so i can do this,5,0,1615239519,gigantoir
74,gq9br6d,"You sure? This thing is going to get a retard pump when broke people get their Biden Bux. 

Not saying April puts won’t print. But maybe buy once checks are out.",2,0,1615239519,WhoaReddit7
75,gq9brbz,"Personally, I’m fine with Texans being too stupid for this. Picturing drunk inbred racists (and, I’m sure, some very nice people) with extra money is kinda gross.",0,0,1615239521,idcwtfsmd
76,gq9brew,Do not sell MRNA dude. You will regret it the rest of your life. Im averaging down daily,1,0,1615239522,tell442
77,gq9brhe,"this is definitely where you buy nvidia calls, right?",4,0,1615239523,cb_flossin
78,gq9brns,You mean we just replace it with ARK and the rest is spookishly accurate to right now?,2,0,1615239525,buhurns
79,gq9brop,What’s the best ticker to trade the Dow?,2,0,1615239525,Ricketycrick
80,gq9brqu,I need a 2 bagger to get back to all time high. Concerned that's gonna end with me saying I need a 4 bagger to get back to all time high,11,0,1615239526,ImWellEndowed
81,gq9brxy,Tech is dead it was all a big joke. We’re going back to typewriters now.,36,0,1615239528,SlimeCityKing
82,gq9brwl,Everything,2,0,1615239528,holyfuckbatman
83,gq9brww,You need help.,5,0,1615239528,fyuce
84,gq9bs0c,BUY RBLX IN 2 DAYS. THE NEW MEME STONK,12,0,1615239529,BringBackBrofist
85,gq9bryc,my UUP calls up 100+%.. why hold cash if you can hold more cash ?,2,0,1615239529,sdht_
86,gq9brzg,Selling my PS5 to buy GME lolol,14,0,1615239529,Christothetee
87,gq9bs2n,This is the way,3,0,1615239530,Juice_Cx
88,gq9bs6b,"I closed with over $25k in my account, I finally have day trading freedom!  Now if I could just not fuck it up that would be great.",25,0,1615239531,MyOldAolName
89,gq9bs5c,"what in the fuck is this horsefuckery?

https://twitter.com/DeItaone/status/1369038452868710403

ZOOM CEO transfer $6B worth of shares to unknown recipient. 

Chinese overlords taking their stake?",10,0,1615239531,larrykeras
90,gq9bs78,[removed],1,0,1615239532,[deleted]
91,gq9bs9h,That dude snowballs.,3,0,1615239533,nomadofwaves
92,gq9bseb,I got 4/16 140c and got them last week during the “dip” it’s continued to dip dip dip since then,1,0,1615239534,ds739147
93,gq9bshh,I mean yeah i lost money today,19,0,1615239535,Strangerdanger8812
94,gq9bsgz,"Pre-split it was being shitted on for overvaluations @ $500+. Split was 1/5 right? If so @ current  pricing, that means if it fully corrects to like Covid April-ish levels near lows, that means buy @ $100. I'll probably pick up a few shares @ $420 for the lulz and see if that gets some support.",2,0,1615239535,TWIYJaded
95,gq9bsfn,Why. Why would you sign up for that shit.,2,0,1615239535,DeepFuckingSquoze
96,gq9bsgy,Lol I feel it will crash sooner.,0,0,1615239535,AltcoinTraderNy
97,gq9bssp,What brokerage do they use at Tasty Trades?,-1,0,1615239539,oregon_forever
98,gq9bstg,I plan on executing them,2,0,1615239540,coldiron03
99,gq9bsxy,"If SPY can please just hit 400 real quick tomorrow so I can make some quick tendies I’ll yeet it all back into GME, thanks ❤️",0,0,1615239541,dontevenstartthat
