,comment_id,text,score,awards,timestamp,author
0,gqhmrdx,"amc is a dead meme stock. 
lost all of it's gains in one bad day",-12,0,1615408108,DumpedAt22
1,gqhmtvw,I'm hoping to hear good things in the earnings call at 4 cst,3,0,1615408138,Vast-Ad-1296
2,gqhmtzn,Some Asshole with his Retarded opinion said that AMC is worth $1 😂😂😂😂 I feel bad for the fools that Believe him.,6,0,1615408140,DannyRed423
3,gqhmubv,They report earning AH today.  Some people are taking their profits and running.,1,0,1615408143,Bottom_Wobbles
4,gqhmzdp,"I am a bot. A Gain/Loss/YOLO should be a picture of a closed gain, a closed loss, or an open position &gt; $2,500.",1,0,1615408203,VisualMod
5,gqhn0kk,[removed],1,0,1615408216,[deleted]
6,gqhn0pi,Of course the AMC earning report is going to be bad. They haven’t been opened in almost a year. This is a long term stock.,0,0,1615408218,Big_Stonky_Boi
7,gqhn5xl,[removed],1,0,1615408278,[deleted]
8,gqhnfat,[removed],1,0,1615408387,[deleted]
