,comment_id,text,score,awards,timestamp,author
0,gqj69or,[removed],1,0,1615436128,[deleted]
1,gqj6cvr,"No.  Stop losses are bad in that you released your shares into the open market, and the shorted HFs can scoop up your shares and cover their shorts.  The idea is to choke them so the float is NOT available to them.",1,0,1615436182,bluecoaster1
2,gqj6nnm,[removed],1,0,1615436364,[deleted]
3,gqj6snt,[removed],1,0,1615436449,[deleted]
4,gqj6v31,Paper handed bitches always messing things up. You only lose is you sell. Hold fast my GME family.,1,0,1615436490,scinerd82
5,gqj6vf8,Yep. Big fat Johnson,4,0,1615436496,RelaxPrime
6,gqj70og,Stop loss is loser-speak for people who like to sell low.,1,0,1615436586,SomeGuyNamedPaul
7,gqj76bk,This is the way,1,0,1615436682,Denetharo
8,gqj7b02,"Wow half the times I refresh the likes are down, screw you Shills",0,0,1615436760,Denetharo
9,gqj7cee,Mmmm no. I'm not going to jeopardize money we need for four medical procedures because of your Qanon bs.,-1,0,1615436784,IlliterateInvesting
10,gqj7jbk,"My stop loss is set at 41069.69, is that ok 🤷‍♀️",1,0,1615436902,RetardedNewbie69
11,gqj7qp2,I just set a trailing stop and profit from every spike from you FOMO retards.,1,0,1615437029,imamydesk
12,gqj7vj4,Haha hilarious /u/_Kozlo_ complaining about shills while pretending to be different users.,13,0,1615437113,imamydesk
13,gqj87d6,I must be a moron that doesn't know how to set up a stop loss cause I just roll with the punches...need my sippy cup and a nap now..,1,0,1615437321,mach_250
14,gqj8bwz,"If you need money for something important, you don’t set a stop loss, you sell. You also don’t invest money that you don’t have. 

Funny that you call it bs, when that’s the legit scenario. 

Telling people to set stop losses, saying you need it for 4 medical procedures, then calling it out as conspiracy. I’ve never called anyone a shill, but you sir, may just be one",2,0,1615437401,fatedMercy
15,gqj8i2w,[removed],1,0,1615437508,[deleted]
16,gqj8k82,[removed],1,0,1615437545,[deleted]
17,gqj8o8r,"&gt;Why can’t we apply that same idea algorithm to multiple PCs(and hardware) to look at that real-time data and make/buy positions?

Because you're too slow. You're too far from the servers. You have to go through brokerages and market-makers. There are so many reasons.

We're talking about firms trying to get an edge in their order milliseconds ahead of competitors by being physically closer to the servers so their orders go through shorter fiber optics cables.

So you're talking about receiving market data, distributing processing tasks to the rest of the cluster around the world, having their slow-ass computers crunch the numbers, sending the results back, recompiling them together, then sending in your order. By the time you received the market data 10 competing algo firms have already made their money.

Also, beyond high frequency trading, ***lots*** of people use programs to trade for them on a much longer timescale. You can set up your own automated orders, or interface with your broker's API and write your own program, etc. See /r/algotrading. You don't need a computing cluster - your desktop does just fine.

And you, as an individual, absolutely have access to the order book - it's called level 2 market data. You just have to pay your brokerage.",6,0,1615437615,imamydesk
18,gqj8o9b,"You have done an excellent job at wasting my time.


*I am a bot, and this action was performed automatically. Please [contact the moderators of this subreddit](/message/compose/?to=/r/wallstreetbets) if you have any questions or concerns.*",2,0,1615437615,AutoModerator
19,gqj8smq,This is not DD,1,0,1615437689,Rekeever
20,gqj8uzr,[removed],1,0,1615437729,[deleted]
21,gqj8y3u,[removed],1,0,1615437781,[deleted]
22,gqj90a2,[removed],1,0,1615437820,[deleted]
23,gqj91nj,"IF YOU'RE GOING TO FILIBUSTER, YOU SHOULD RUN FOR SENATE!


*I am a bot, and this action was performed automatically. Please [contact the moderators of this subreddit](/message/compose/?to=/r/wallstreetbets) if you have any questions or concerns.*",3,0,1615437845,AutoModerator
24,gqj938h,[removed],1,0,1615437875,[deleted]
25,gqj93b0,"I'M RECLAIMING MY TIME!!!


*I am a bot, and this action was performed automatically. Please [contact the moderators of this subreddit](/message/compose/?to=/r/wallstreetbets) if you have any questions or concerns.*",2,0,1615437876,AutoModerator
26,gqj988v,"&gt;You put 7k and a stop loss for a loss

By definition that is what a stop loss is. It's to cap your loss. Hence stop **loss**.",0,0,1615437967,imamydesk
27,gqj9b3k,"No, and no.",1,0,1615438021,imamydesk
28,gqj9kxh,What’s a stop loss? All I know how to do is buy,1,0,1615438209,Manodactyl
29,gqj9mk3,Been preaching this all day. Your smart.,1,0,1615438241,HardHustle84
30,gqj9rs9,You could’ve replied to their comment,4,0,1615438342,poopnip
31,gqja0v3,"Yea, what the fuck are you doing putting medical procedure money into GME? You’re either an idiot or a liar. Neither is great.",2,0,1615438518,Put_that_down_now
32,gqja67u,I saw a couple of comments about people that set stop losses that got executed way below their price because it dropped so quickly....like a 220 stop loss that executed at 180. That would suck.,1,0,1615438621,Put_that_down_now
33,gqja8e1,[removed],1,0,1615438662,[deleted]
34,gqja8m7,I could of. But I'm a dumb ape that hit reply on the wrong message.,1,0,1615438667,_Kozlo_
35,gqja9rc,What you are describing is essentially what we aren't allowed to discuss here. It has the initials CC and rhymes with fit loin,2,0,1615438689,natekay1996
36,gqjacu9,This is the way,1,0,1615438749,gochuuuu
37,gqjadwz,"Yup, I work in the forest and came out and saw it was up for the day, but lower than pre-market. Looked at the chart, ""hmmmm....""",1,0,1615438769,Mug_of_coffee
38,gqjavi4,"Cool deal, this is what I wanted to know!",1,0,1615439098,1Gumper1
39,gqjb2pf,"Community ran computing? I don't care about CC, I was only explaining the same idea that SETI has with their search for ETs. But point taken.",1,0,1615439232,1Gumper1
40,gqjbcnx,"I told my co worker I had an important call, that I’ll get back to him to buy the dip",1,0,1615439403,WilliamDaScotWallace
41,gqjbd3t,This is the way,2,0,1615439410,Iancostales
42,gqjbhi1,This is the confirmation bias that matters,1,0,1615439479,realcevapipapi
43,gqjc2um,"Pretty safe with stop losses, did you forget the conversation?",-1,0,1615439806,IlliterateInvesting
44,gqjc85b,"I'm a shill for hoping to pay the 20k i need? Fuck you, suit.",-1,0,1615439886,IlliterateInvesting
45,gqjcj9b,🤣🤣🤣🤣🤣,1,0,1615440058,fatedMercy
46,gqjgfhm,"Sure, you’re money’s “pretty safe” in a super volatile stock going through an unprecedented situation with congress and the SEC involved, and who knows what back door shady deals going on. What happens if trading is halted on GME completely for x amount of time? What happens if the stock plummets so sharply and quickly, your stop loss executes at a price well below your stop price? Your money’s “pretty safe” in the same way that diving in shark infested waters in a cage is pretty safe.",1,0,1615442237,Put_that_down_now
47,gqk597n,"If I've got to take on a position to set a stop loss for limited losses to my initial, then I probably went in too early, with too much powder, or both.",1,0,1615459408,robertleeblairjr
48,gqkvkkr,"If you only had 800 dollars and 20k bills coming, you'd probably understand why.
You're too busy being an asshole to get it.
I'm fucked either way, but at least i didn't lose money, and I still netted 2 shares for the cause.
Some kids pay off their student debt, you busting their chops too? Or are you only a jerk to people with health issues and a dream?",1,0,1615475458,IlliterateInvesting
49,gqkwgm0,"And before you call someone a liar or an idiot, don't forget the third option: desperate. Maybe it's a bit of both. I hope you never get there in your life.",1,0,1615475866,IlliterateInvesting
50,gqljjci,"You’re literally sending two conflicting messages: 1. “I’m desperate and rolling the dice cause I’m fucked either way” 2. “I’m not going to jeopardize money I need more medical bills”. I think you can why understand someone would be confused. 

But honestly, I only commented because YOU were being an asshole to the first guy that was telling you your stop losses helped out hedge funds. In the big scheme of things, nobody cares... nobody cares if you set stop losses for your two shares, how you spend your money, any of it. Just one asshole calling out another asshole.",1,0,1615486001,Put_that_down_now
51,gqm0jfa,"Thanks brother, see you on the moon with my two shares.",1,0,1615493355,IlliterateInvesting
