,comment_id,text,score,awards,timestamp,author
0,gqh444n,"Nobody tell him

*I am a bot, and this action was performed automatically. Please [contact the moderators of this subreddit](/message/compose/?to=/r/wallstreetbets) if you have any questions or concerns.*",9,0,1615400366,AutoModerator
1,gqh4bk1,Rocket is currently getting gas. We’ll be there soon,6,0,1615400447,daddyclappingcheeks
2,gqh4bkn,"Thanks for getting me out man, I've been stuck there a while.",-1,0,1615400447,RoboIcarus
3,gqh4d4r,[removed],1,0,1615400464,[deleted]
4,gqh4dfj,[removed],1,0,1615400468,[deleted]
5,gqh4dlm,No worries it's coming back up for you to hop back on 👍,3,0,1615400470,greyes_33
6,gqh4hl5,[removed],1,0,1615400514,[deleted]
7,gqh51mk,"We r coming back retards. Someone forgot to adjust the pressure on the hydrogen backflow Basin and then we discovered Hedgeys snuck on deck and assaulted Phil in engineering. Its okay though, we solved the issue and boarding has once again commenced!",2,0,1615400732,Herb_da_okay
8,gqh5oio,feels good we're recovering!,1,0,1615400975,HannesO13
