,comment_id,text,score,awards,timestamp,author
0,gqhokdk,[removed],1,0,1615408861,[deleted]
1,gqhokwc,[removed],1,0,1615408867,[deleted]
2,gqhoo43,Yeah this is going to have an 18+ rating and a warning for the faint of heart.,2,0,1615408906,zimmah
3,gqhoo9a,"Love NPR. The indicator did a good segment on the mechanics of a short squeeze, but never said whether you should get in on it or not.",17,0,1615408908,Im_A_Canadian_Eh
4,gqhoqc1,"Your friend is not a retard, he's simoly fucking stupid. Doesn't he like money? Weird",1,0,1615408933,PurityKane
5,gqhormx,It is only near the end of the beginning of the story.,2,0,1615408948,slade998
6,gqhorw6,Stop losses are stupid in a volatile and heavily manipulated market lol,159,0,1615408951,zimmah
7,gqhoun7,Not Selling 🦍🦍🦍🦍🦍,1,0,1615408984,bellamoonlite
8,gqhovmi,The news is and hedgers aren’t trying to pressure us to sell. They are trying to make people we know think we are idiots and hoping that will pressure us to sell.,1,0,1615408995,u2020vw69
9,gqhow9c,[removed],1,0,1615409003,[deleted]
10,gqhowc4,Imagine thinking WSB listens to CNBC for actual advice and not boomer tears,1,0,1615409004,Aretaxios
11,gqhoxc5,[removed],1,0,1615409016,[deleted]
12,gqhoxvy,"Love NPR. The indicator did a good segment on the mechanics of a short squeeze, but never said whether you should get in on it or not.",4,0,1615409023,Im_A_Canadian_Eh
13,gqhp0gy,The people that own the news are controlling the news!? Shocked!,1,0,1615409054,directionlessprose
14,gqhp3mj,Good (wo)man! Share the love with those who love you,35,0,1615409091,FartClownPenis
15,gqhp3us,Read the article. It says GME started crashing at 12:30. Article posted at 12:41 after no mention of GME's meteoric rise throughout the day. Conspiracy confitmed.,1,0,1615409094,reddi4reddit2
16,gqhp4ky,[removed],1,0,1615409103,[deleted]
17,gqhp6ma,[deleted],-5,0,1615409127,[deleted]
18,gqhp7hm,Holding cuz I like this stoc!,1,0,1615409137,superPowerRocket
19,gqhp7ju,They don't even hide it from the public anymore. LOL. I ain't going no where. Fuck them.,1,0,1615409138,KING_CPB
20,gqhp9kb,"I mean, he's not entirely wrong. These places absolutely have templates ready to go.

Shit, I wouldn't be surprised if most of it was able to be automated at this point. It's not exactly in-depth, hard-hitting journalism here.",4,0,1615409162,GasolinePizza
21,gqhp9rh,"The article was published at 12.41, but it was updated an hour later.

~~The likelyhood is that~~ the quotes and comments were added after it was uploaded. This isn't much of a smoking gun tbh.",1,0,1615409164,Nemisis_the_2nd
22,gqhpasb,"&gt;(reupload because it got removed due to flair)

Did you have at least 37 pieces?",1,0,1615409176,Mr_Lumbergh
23,gqhpaut,A post this important got removed for flair?  Are the janitors here insane?,1,0,1615409177,citizen3301
24,gqhpbua,Hodl and BUY!,1,0,1615409188,ClaytonBiggsbie
25,gqhpd78,I knew two...,2,0,1615409204,Vinnystill
26,gqhpdda,[removed],1,0,1615409205,[deleted]
27,gqhpds1,[removed],1,0,1615409210,[deleted]
28,gqhpffw,"My friend sold Monday at 180 and rebought today 

Geniuses",2,0,1615409229,CarnivorousGray
29,gqhpfs9,[removed],1,0,1615409234,[deleted]
30,gqhpg7a,"This is simply not true. First, lemme say I’ve been holding GME at $300+. I’m not a shill, and nor am I a fan of CNBC and how they’ve been covering this.

BUT, the fact that they published an article about today’s rise and dip in 20 mins isn’t “proof” CNBC is colluding with hedgies (I’m not saying they aren’t I’m saying OP’s reasoning is flawed).

Having worked as a journalist a few years ago (no longer, thank god), it is entirely possible for a professional journalist to pump out an article in 20 mins. You have to realize that CNBC most likely has a team of researchers and writers and editors on JUST the GME stuff. They have TEAMS of people whose job for the past couple of months would have been to keep an eye on this stock. They most likely had statistics and quotes ready to publish. Note how the quotes are from their own airtime, it’s not like they had to call up someone and get a quote (which isn’t that impossible to do within 20 mins either)

Again, I’m not defending the hedgies or CNBC, but this is just tinfoil hat theory and we should stop with these rampant speculations.",22,0,1615409239,3ananafish
31,gqhpg7m,[removed],1,0,1615409239,[deleted]
32,gqhpgb2,[removed],1,0,1615409240,[deleted]
33,gqhpgfm,Hey man don't put us crayon eating retards in the same category as this desk munching jabroni.,4,0,1615409241,grey_sky
34,gqhphvf,"Yeah, that’s what I did after the halt. If it dips again, I’m in!",1,0,1615409258,NvrWzACornflakeGirl
35,gqhpjl4,Isn't ThinkGeek the owner of Pornhub? I didn't think they had physical offices next to GameStop of all places. 🤔,1,0,1615409278,ContraCelsius
36,gqhpk7i,"You're right, they all died of internal bleeding at lunch haha",3,0,1615409286,antipiracylaws
37,gqhpl16,[removed],1,0,1615409295,[deleted]
38,gqhpmrv,Obvious manipulation is obvious.  I bought more at 260 to spite.,1,0,1615409315,DBAYourInfo
39,gqhpnpo,"Yep, nothing in the news the last 3 days about the rise but the news reporting the big dip within minutes. And it happens around lunch time when people are probably taking a break from work. Hold, hold, hold and buy the dips.",1,0,1615409326,Meg_119
40,gqhporv,What does it mean to sell? I never came across this word in my lifetime. Sounds like a bitch move.,1,0,1615409338,XGhosttearX
41,gqhpord,It's a Trap. Don't sell,1,0,1615409338,bro55man
42,gqhpppb,[removed],1,0,1615409349,[deleted]
43,gqhppzh,"You know what makes me happy? That people, at least most millennials, aren't that uneducated. I am glad we live in a time where we can fact check, screen shot, and research.

The greedy hedge funds and old folks have ran out of tricks! I hope they get shut down!",74,0,1615409353,Optimal_Impression
44,gqhpq36,[removed],1,0,1615409354,[deleted]
45,gqhps88,So foolish. Should just wear the helmet they make for us.,24,0,1615409380,synze
46,gqhpty1,Some guy said recently it was between 250% and 950%. Idk about it though,-1,0,1615409400,pigaroos
47,gqhpuw2,💎🙌🏽🦾🦍stronger then ever‼️,1,0,1615409410,ReindeerRich4553
48,gqhpy4i,hate to be that guy but news channels are pretty good at preparing stuff like that. you only really need to write the first few paragraphs which are only a few sentences and even that you can prepare in advance with placeholder for price and dates and the rest is just copy paste from older articles. Also it is online news and not print. takes way less time to get that shit out quick.,1,0,1615409448,mr_capello
49,gqhpy8s,Marketwatch did the same thing but less than 10min after the dip.,2,0,1615409449,tward3212
50,gqhpymr,"Looked more like some whale dumped 1.5 million shares all at once and cashed-out. Remember, apes aren't the only ones in this market. Could have easily been a fund pulling their chute and walking out with a fat sack of cash, too.",1,0,1615409454,YurMotherWasAHamster
51,gqhpzi0,[removed],1,0,1615409464,[deleted]
52,gqhq3g2,Boomer tactics!,2,0,1615409508,dust8103
53,gqhq3gz,[removed],1,0,1615409509,[deleted]
54,gqhq3jn,"“Retail investors are continuing to jump into the market in droves even after the dust has settled from the GameStop trading saga.”

What dust has settled? We’re up 12%. We fucking know what volatility looks like, dipshits.",1,0,1615409509,JustACookGuy
55,gqhq47k,What’s this selling you keep talking about? I never heard about it before,1,0,1615409517,Danibus18
56,gqhq5oq,[removed],1,0,1615409535,[deleted]
57,gqhq6gx,"This will need to be confirmed and proven, but it looks like MW posted their article 35 minutes before it even crashed.

&amp;#x200B;

[https://twitter.com/MrDavidNIO/status/1369733681259053061?s=20](https://twitter.com/MrDavidNIO/status/1369733681259053061?s=20)",1,0,1615409543,NickosaurousRex
58,gqhq7pp,[removed],1,0,1615409558,[deleted]
59,gqhq84h,"Luckily many here are retarded apes who won't sell till 10k and are willing to buy the dip








I can only hope after trying this attack only to see it go back up as people bought the dip that they looked at each other and said ""holy fuck, we're dealing with some real serious retards here""",34,0,1615409563,Juicy_Brucesky
60,gqhqb7s,[removed],1,0,1615409598,[deleted]
61,gqhqbz1,It's OK. We all need a friend that's stupid. Makes you grateful.,1,0,1615409607,nonetheless156
62,gqhqidx,Us AMC bois are suffering bad from it today ![gif](emote|free_emotes_pack|cry),1,0,1615409682,freeBobbyDAYVID
63,gqhqizz,And most of it would easily have been written before the market even opened (4th paragraph onwards),2,0,1615409689,Catprog
64,gqhqjw4,[removed],1,0,1615409700,[deleted]
65,gqhql3p,"I know one and today I came up with the new saying. No paper hands, don’t be a Kyle. LOL",1,0,1615409714,Pure-Classic-1757
66,gqhql5c,i did paper hand at $90 but then rebought when it got to $50 so I feel ok. Still messed up,7,0,1615409715,secrestmr87
67,gqhqljo,[removed],1,0,1615409719,[deleted]
68,gqhqmbf,"This isn't really anything new, CNBC has been up their ass and slinging their bullshit since late January.",1,0,1615409729,Nulaak
69,gqhqn0p,Exposing several industries at once with these beautiful shenanigans,1,0,1615409737,T_kash_ham
70,gqhqndy,Thanks for not calling me a pussy shill. Common sense goes a long way when dealing with large amounts of cash.,1,0,1615409741,Sasquatters
71,gqhqnhv,Wtf?,1,0,1615409742,Pure-Classic-1757
72,gqhqola,Lmao.....and they really think its going to work this time.,1,0,1615409755,savvyinvestor007
73,gqhqp7q,Nobody even watches the news anymore lmao,1,0,1615409763,ShibuyaChan
74,gqhqps3,[removed],1,0,1615409769,[deleted]
75,gqhqqd0,So AMC is still on? Glad i did not sell my precious 8 stocks,2,0,1615409777,kuflik87
76,gqhqrec,I believe it’s called journalisming.,6,0,1615409789,T_kash_ham
77,gqhqsih,[removed],1,0,1615409803,[deleted]
78,gqhqsmj,"So....does that mean, I should buy and hold a stock ? 🤣",22,0,1615409804,savvyinvestor007
79,gqhqtax,"I had a stop limit for my lowly 7 shares get triggered at 275.  I bought them right back at 265, though.  Down $30 a share from my previous average.",1,0,1615409813,The_Legend_of_Xeno
80,gqhqtib,I either lose everything or gain too much to know what to do with it. Either way I ain't selling for a lost or small profits,1,0,1615409815,Dead_Architect
81,gqhqtj5,"... but who exactly are they trying to convince?

The people who they really really really want to give up all their shares are in here... and we're laughing at thrm, even thanking them for opening our eyes and proving that the media are a massive pile of steaming shit...

Holding!!!!!",1,0,1615409816,coffeeplot
82,gqhqtyu,I didn't hear no bell,1,0,1615409821,buffalojay83
83,gqhqvey,Buy them hats with dildos glued to the brim.,1,0,1615409838,Nulaak
84,gqhqxkz,Zirconium hands...,12,0,1615409864,coffeeplot
85,gqhqywp,I read that wrong on second thought he is definitely a coworker not a friend LOL. And if he was then he would now not be a friend. LOL,1,0,1615409879,Pure-Classic-1757
86,gqhqz2p,"also this BULLSHIT.   


this dude predicted the 12:17pm crash/dump at 11:55am.  
[https://mobile.twitter.com/MrDavidNIO/status/1369733681259053061](https://mobile.twitter.com/MrDavidNIO/status/1369733681259053061)",2,0,1615409881,neuromorph
87,gqhr1kf,[removed],1,0,1615409912,[deleted]
88,gqhr1q3,Only solution. Buy more,1,0,1615409914,Hasnopantz
89,gqhr1pv,"i’ve been holding since before the January spike, if it was a pmp and dmp i would have been out at $483 back then but I 👏 like 👏 the 👏 stock 👏 long 👏",38,0,1615409914,IG_BansheeAirsoft
90,gqhr2w2,Sell? I heard that's for paper handed bitches.  Hard to do that with these diamonds.  Monkey brained,1,0,1615409927,emblem42
91,gqhr365,How bold of them to think I can read,1,0,1615409931,repfam99
92,gqhr3bw,your friend is punching air rn,2,0,1615409933,LizardCleric
93,gqhr3w1,"Jokes on them, I made money off my other stocks, and covered my initial risk on $GME, so I can buy more now XDXDXDXDXDXDXDXDXDXDXDXDXDXDXDXD",1,0,1615409939,TheLazySamurai4
94,gqhr4dq,"Ya know celebrity obituaries are published immediately upon announcement of death, right? Of course they have articles pre-written, just to fill in some details, so they can be first to break the story. 

20 minutes is a long time in news media. Find the stories that were published BEFORE the dip of you want an actual conspiracy.",1,0,1615409945,heavydisme
95,gqhr4in,"That's basically me. Except it was 6k and sold at 50$ :-\\  
Who could expect it could bounce again...",-3,0,1615409946,C_Clop
96,gqhr58a,AMC will probably dip due to bad earnings. You know what that means? Black Friday sale on AMC!!!! Buy more and hodl.,1,0,1615409955,livinIife
97,gqhr6ci,"Can't stop, won't stop, Gamestop. Bought more",1,0,1615409968,hiroue
98,gqhr6by,"I bought enough that it is a novelty. If it goes to zero, my other investments will float me, if it moons, awesome. I hold my couple of stocks as a momento of a time that I saw something and said ""i like the stock"". It does make me happy that it is $20 above what i bought it for, but that aint the moon yet.",6,0,1615409968,clintCamp
99,gqhr6aa,I really hope your friends S/O is enjoying an abundance of pleasuring by other people than your friend,8,0,1615409968,gr8pig
