,comment_id,text,score,awards,timestamp,author
0,gqgy5cp,I thank y’all for some quality entertainment,10,0,1615398244,barnorth
1,gqgy6vk,"im afraid theres more pussies than people with steel nutsacks and diamond hands, they are feeling pressured by this fucking illegal shit these hedgie cunts are doing right now",16,0,1615398258,Boybournie
2,gqgy9no,[removed],1,0,1615398284,[deleted]
3,gqgybno,[removed],1,0,1615398302,[deleted]
4,gqgyfra,Hahahaha love it,0,0,1615398340,RandomNarco
5,gqgyg3c,"Fucking disgusting what they are doing, screq8ng over retail investors in favor of the funds",4,0,1615398343,bobbabson
6,gqgyi0g,Why did I buy the rise all fucking day 🤣🤦🏻‍♂️,5,0,1615398361,billyjk93
7,gqgykay,"It’s going back up, trust me.",6,0,1615398381,ibraibra66
8,gqgysha,"Because your a fucking boss.

Keep that same energy through the rough patches and you will come out just fine",2,0,1615398455,WatchOut4myboyJJ
9,gqgz9pl," Provide some actual information or go home.

DUDE: "" THIS IS A TRICK ""     
OTHER DUDE: "" HOW DO YOU KNOW? ""  
DUDE: "" CUZ I SAID SO """,1,0,1615398613,calikid9one
10,gqgzngw,[removed],1,0,1615398742,[deleted]
11,gqhbbtm,It went up buddy. No way you would sell bc it went down unless you are genuinely retarded.,1,0,1615403254,ibraibra66
12,gqhrbq0,"I've been fucking up ever since I bought in Jan 28th
Should have sold when it's spiked up to 500$
Should I drop my whole life savings after when it came to 40$
Should have cashed out at 350$ today
Should have bought in at 120$
Imagine if you did that all perfect? 
Instead I haven't made s*** lmfaoo",1,0,1615410034,calikid9one
13,gqhulnp,"IF YOU'RE GOING TO FILIBUSTER, YOU SHOULD RUN FOR SENATE!


*I am a bot, and this action was performed automatically. Please [contact the moderators of this subreddit](/message/compose/?to=/r/wallstreetbets) if you have any questions or concerns.*",1,0,1615411472,AutoModerator
14,gqhuln0,"That's your mistake, not mine. I am planning on selling the second it hits $400, I could care less if it hits even $1000, I haven't made much because I only put it what I can afford to lose. Never put in your life saving into anything, just because others are making money doesn't mean that you will as well. This is what scares me in the stock market. I began around the same time as you, put in $1,100 in. Invested in $SNDL at its peak and lost around $600. I then sold and bought 4 shares of $GME at $127 each. I recovered and have made $187 above the original $1,100 I put in. I didn't invest in $GME because of this subreddit, I only use this sub to check out the news and memes, nothing more. I always imagine if I had bought at a low and sold at a high, but that is nothing near a reality. My advice, do your research about each stock and not just 10 minutes, do thorough research about the stock(s) you plan to invest in and trust your gut. My dad always said don't be greedy and be grateful for what you get, so this is what pushed me past the $SNDL incident and stopped me from having negative emotions about it, I think of it as a learning experience. Good luck with your shit mate, cheers.",1,0,1615411472,ibraibra66
15,gqls3cg,"never said it was your problem, and I wouldn't drop my life savings ever. 

"" Trust your gut. My dad always said don't be greedy and be grateful for what you get""  ─ Wise words, I always get that feeling in my gut and I don't listen and get screwed cuz what I felt would happen would happen, or didn't happen.

I only have  5 GME shares on TD account and 6 on Webull.  Pretty much around 120$ bought avg.  And I was thinking to sell at 350$ and when it got to it, I didn't trust my gut and waited and it dropped to where it is now.    
But for sure going to listen to what I feel is right now.  

GL",1,0,1615489649,calikid9one
