,comment_id,text,score,awards,timestamp,author
0,gq9icm8,It did. Im sure the regret not letting it play out. But they panicked hard.,27,0,1615242578,Spacer_Spiff
1,gq9indg,[removed],1,0,1615242722,[deleted]
2,gq9j6iz,Well plus people are watching closer. Notice no 1 share limit this time.,16,0,1615242979,hammer_416
3,gq9j9fn,[removed],1,0,1615243018,[deleted]
4,gq9k51g,"Exact same situation here. Found out about it after buying was stopped (didn't even know at the time). FOMO'ed in without thinking about it at $263 a share. Averaged down to almost $63 a share, and now boarding the rocket to Andromeda. 

If they just let it squeeze the first time I wouldn't even be on this rocket, and I'm sure it's the same for a lot of apes. Nevermind the second round of FOMO we're seeing now, like Conan O'Brien for one example.",14,0,1615243449,StinkyMonkey85
5,gq9k7bl,Yeah I’m also pretty sure. They actually might have done the biggest mistake in history. Would have been so much easier to just let it squeeze take their losses and continue their game making billions over and over again. Now the whole world is watching them and new regulations to stop their infinity money making train.,20,0,1615243481,Fantasybroke
6,gq9kdxo,Yes the change to the DTCC rules are very telling of how far they have dug the hole IMO.,17,0,1615243575,Spacer_Spiff
7,gq9l3pw,Exactly! It’s just not about the money they would have lost. Think how much less money the new regulations (hopefully) will stop them from making in future from this kind of plays.,3,0,1615243935,Fantasybroke
8,gq9lagv,Stop. No. They will for sure be wiser though. Huge kick in the nuts does that.,3,0,1615244030,Spacer_Spiff
9,gq9mc9l,"I didnt buy a lot at +300 and rode all the way down and bought more at 40. This slow ride from 40 is making me even more confident ive made a good choice. 500 aint shit, 750 aint shit, 1000 aint shit. Im not greedy (okay maybe a little) but im gaining confidence every day this is going pass 1000",9,0,1615244565,YourTypicalFriend
10,gq9mkd9,[removed],1,0,1615244682,[deleted]
11,gq9mvi6,Same here. We haven’t seen what their next move is if they have any. Maybe a selling halt when we getting closer to moon? 🤣,3,0,1615244844,Fantasybroke
12,gq9qsj7,"Let's just say the coils are as far back as can be sprung. 

I'd happen to agree with your hypothesis. How can this not have screwed them more. One it got rid of papers hands but the smart people who Brough high averaged down and to add to this. What do they think will happen when everyone hears at the same time GME is about to go MOON. Likes moths to a flame like myself I went in high and so will the same people who paper handed the last time because this time they can't halt us. 

More people will jump on turning the stock way more volatile than it was. Which goes back to my opening line. The coil is about to be released. And with that a stimmy in every yanks hand it's gonna get way worse for the hedges. Melvin will collapse for real this time.",2,0,1615246911,MrStormz
13,gq9rrmp,The Streisand Effect GME style,4,0,1615247416,oxyoxyboi
14,gq9s9or,"It’s classic Streisand effect. Had they shut the fuck up we would’ve all jumped off at $1,000 happy as hell. Now we’ve octupled in number and retardation and want $10,000",4,0,1615247680,anthro28
15,gq9sg0n,Very true!,1,0,1615247773,Fantasybroke
16,gq9sjdu,Psst.. $100k minimum!,5,0,1615247821,Fantasybroke
17,gq9tcpe,"Seriously though. I was primed to make some small cash and move along. Now I’m here for the ride, stock price be damned.",3,0,1615248252,anthro28
18,gq9tot3,Same! We’re in all or nothing mode and it feels fucking amazing,1,0,1615248430,Fantasybroke
19,gq9u5it,Me too. Nothing convinced me more on the play than the amount of work they put into trying to dissuade people from buying it.,1,0,1615248678,TDETLES
20,gq9vf3r,"Not satisfied with an unlucky number like 10K. It needs to be an even meme number like 69420, or 42069 at least.",1,0,1615249364,arondaniel
21,gq9w4qd,[removed],1,0,1615249746,[deleted]
22,gq9wuyp,"I'm optimistic, but let's see what happens when it crests 400 this time",1,0,1615250146,dreadstrong97
23,gq9wzhc,It's gonna be more than Melvin.  I'd imagine Citadel and few others will be packing their bags.,1,0,1615250216,dreadstrong97
24,gq9xdcj,"It was a bold strategy to see if they could get out clean. 

 Upside: free and clear, better rep for handling an unprecedented event.

Downside: lose it all including rep for losing to a bunch of apes",2,0,1615250425,TutekTheLegend
25,gq9ylqx,"Although it allowed them to manoeuvre it also allowed other rivals to get in position to fuck them into oblivion, which is what we are going to see soon.",2,0,1615251100,IwillDecide
26,gq9zgqj,If you think 42069 is even you definitely belong here.,3,0,1615251574,anthro28
27,gq9zz49,"You apes don’t get it. The brokerages like Robinhood and TD Ameritrade limited buys because they cannot let the HFs go under. Companies like Robinhood make money a couple of ways: 1) selling your order flow to market makers like Citadel. 2) lending your GME and other shares to short to HFs like Melvin Capital. 

If Melvin Capital went under, Robinhood would be on the hook for all the shares lent short. That’s why RH, TD and IBKRs step in to save HFs. 

I am surprised more people are not pointing this out.",1,0,1615251854,percypeerless
28,gqad73u,Full blown skull fuck I believe is the term HFs like to use,1,0,1615259115,therealdonpablo
29,gqaeryw,I’ve been thinking about this a LOT...,1,0,1615259992,YeahhYup
30,gqap3l9,$42069.00,1,0,1615266252,clockedinat93
31,gqapeus,This is probably why many many people switched from Robinhood entirely,1,0,1615266469,Dracox96
32,gqasei6,I think the counter argument is that HF recalibrated and loaded on calls etc after RH pulled the plug on retail. So now HF are hedged better or even making shit tons of cash on the current movement,1,0,1615268577,veryeducatedinvestor
