,comment_id,text,score,awards,timestamp,author
0,gqiglwx,"“What’s an exit strategy?”

Hedge fund tried to shake ape from tree today

Ape has diamond hands 💎💎",29,0,1615422126,zomg1117
1,gqigna2,"No coordinated exit, set your exit and leave then",15,0,1615422146,Fatanalyst2
2,gqignni,You guys are selling?,2,0,1615422151,Iman3477
3,gqigpcg,"Simple. Sell when you're happy. We can say we won't sell until 500k; but truthfully, when it gets to that point (even 1000) it's every ape for themselves.",16,0,1615422177,tsnides96
4,gqigpgz," 

# Will apes get left behind?-

no",6,0,1615422179,writersaccount
5,gqigq88,I’ll just use my normal exit strategy and pull out as I blast,19,0,1615422190,KillahKorona
6,gqigqvw,Ummm...you HODL !!! You sound like your using this vehicle as your own personal Pump and Dump. Day traders need not apply !,3,0,1615422200,TheKeese
7,gqigsf7,"Sell a little bit at a time on the way up, the goal should be to recoup what you bought the shares for.",7,0,1615422222,turnipmuncher1
8,gqigsol,[removed],1,0,1615422226,[deleted]
9,gqigy7p,[removed],1,0,1615422307,[deleted]
10,gqigylp,"It was good enough for my grandfather, good enough for my father, and it's good enough for me and my 26 half brothers.",14,0,1615422312,DrinkinRye
11,gqih02l,What does selling mean?,2,0,1615422335,ironburton
12,gqih292,"Nah doubt anyone will sell for 1k chum change. Majority will hold to like 10k or 20k then consider cashing out. (I say consider, not actually sell although some might idrk)",10,0,1615422368,GORShura
13,gqih31h,"There can’t be a coordinated exit strategy. That would be working together to manipulate a market. Honestly, sit down with your wife and discuss which scenarios would you be okay with.

Are you good with taking out your cash when it hits 2k, even though doing so means you could miss out on that 100k in the sky? Will you feel the same way if GME hits that mark? Will you feel the same of Armageddon comes and GME somehow drops back to dollars a share?

Only you can answer these questions. Either way, I hope you get what you’re looking for.",8,0,1615422379,RBradyFrost
14,gqih3g9,[removed],1,0,1615422385,[deleted]
15,gqih3qn,"there is a dark side of the moon you  know, in fact it ALL dark ... really",2,0,1615422389,hangin_nakedSF
16,gqih7qc,Smoke weed every day,2,0,1615422448,tremendous_machine
17,gqihdif,[deleted],2,0,1615422531,[deleted]
18,gqihdkf,"Ah the ol stop loss trick.....drops just low enough to trigger your sell and boom, right back up. Lesson 1: you should have STARTED your sell limit at $800 and gone up higher and higher. 

It sucks drinking your morning coffee and losing a few hundred or couple thousand bucks but it's the name of the game. You can't be discouraged about it. Have some faith in your own judgement, you buy into things because you believe it'll be profitable. I never understood why someone would sell for a loss on something they believed in. My monkee brain doesn't work like that.",2,0,1615422532,TheOmnisOne
19,gqihdz2,"Did anyone see Uncle Bruce's video today?  If, there was coordination by someone or entities this could be fraud.  Will take an investigation and the EU market was also Dipping with NYSE.  Also with real time cnbc article out B4 the dip this is something something something , I've no words",2,0,1615422538,Amethyst_Crystal
20,gqihgst,[removed],1,0,1615422580,[deleted]
21,gqihiz1,Apes will get left behind. Investors will come out on top.,0,0,1615422613,xdeath452x
22,gqihko8,"This is the response I needed, thank you! So if I have 2 stocks, and I sell one at a price that recovers what I paid for both originally plus profit, I've already won. Then I just hope the other one keeps blasting up and sell when I'm satisfied, that sounds reasonable? 
*Not asking for financial advice*",7,0,1615422639,ThanosvsShrek
23,gqihlr6,acab,-1,0,1615422655,__maddcribbage__
24,gqihodo,"I can't give you the answer but here's some things you should remember.

1. Bulls make money, bears make money &amp; pigs get slaughtered
2. Don't get emotional, the stock does not care about you
3. The first goal is to always protect the initial capital

You've already failed the second one I think. Stop reading WSB and realize that 100% or 200% gains are not normal and at some point this baby gonna come crashing down. Everybody is in it for themselves and realistically retail investors have a pretty insignificant piece of the pie. 

There are big players moving prices, not WSB. Also I eat crayons.",6,0,1615422694,shedmonday
25,gqihp1h,"I'm a humble ape, but strong. 💎🦍",6,0,1615422704,ThanosvsShrek
26,gqihqwh,[removed],1,0,1615422733,[deleted]
27,gqihxtj,[removed],1,0,1615422837,[deleted]
28,gqihybx,This is the way.. well put,2,0,1615422845,HughJasole_123
29,gqihz24,"So ideally, not even specific to GME, if you had more than 2 stocks lol, as a stock increases in value, you can sell off shares. Meaning as the price goes up, you have less shares but more money?",3,0,1615422856,ThanosvsShrek
30,gqihz6v,"Look at this guy tryna use word magic to make this seem like it’s an illegal hive mind of collusion. 

This isn’t an organized cell of highly trained beasts, sure some can finger paint with actual paint , most are just throwing shit at a wall and hoping it sticks. 
There was no organization in purchasing , did you receive a letter or cold call from someone asking you to buy the stonk? 
Let your wife keep hers. Sell your 2 , and use that money to let her and her boyfriend have the weekend alone.",3,0,1615422858,kromp10
31,gqii0p9,"The company is at 150% institutional ownership. AND has AT LEAST 8M (LET ME SAY THAT AGAIN: AT LEAST 8 MILLION) shares shorted. This is WAY bigger than vw. Sell when you want, but there is always a reason to leave a few bitco-- I mean, GME around.

127@89 and I don't have a sellout price but it's well above 42069.69. Need that screenshot for the insta.",3,0,1615422881,Dr_Lambo
32,gqii4zf,[removed],1,0,1615422945,[deleted]
33,gqii5jn,Me likey the way that sounds,2,0,1615422954,ThanosvsShrek
34,gqii84z,Sell after you think it has peaked. So whether that ends up being 1K or 100K you should be able to sell at $800 or $80K. If you sell on the way up you would not know what the peak is but if you are willing to miss out on the peak you will be on the best most reasonable selling position. (In my opinion),2,0,1615422992,oringedoorhinge
35,gqii8a9,"Fairly new as well and I spent a bunch of time sifting through all the DD, research and info available here and other sources I trusted and soaked it all in and based my decisions on what I felt to be true or valued information (had to weed through a ton of shill and fud info) but got to a good understanding of the situation at hand and what to try to expect along the way and planning accordingly based on my risk vrs. reward. As they say this is not financial advice and never invest more than your willing to lose, I don’t know anything about anything and learning along the way 🚀🦍",2,0,1615422995,Iamthejedeyemaster
36,gqiijni,Selling to recoup your principle investment is smart move most of the time. But for a stock with the potential that this one has you could potentially miss out on a huge amount of gains. I will sell after its peaked.,2,0,1615423165,oringedoorhinge
37,gqiikii,Set a stop loss where you take some profit and don’t get buried. Adjust it accordingly as GME goes up. If it hits a certain number it will trigger a sell.,2,0,1615423179,donkeypunchranch420
38,gqiil3f,Coordination at that scale would probably wind up with retail investors in prison,2,0,1615423188,BriefausdemGeist
39,gqiil3v,"I appreciate it. Like I said, we are interested in learning and figuring it out. And we both knew that it was a risk, which is why we didn't use life savings or anything, we try to be financially responsible. But I think it's also a lesson that hey, sometimes it's okay to take what you have (GME @ $345) and walk away and sometimes you have to risk it dipping below your initial investment in hopes that it will come back up.",1,0,1615423188,ThanosvsShrek
40,gqiiodb,[removed],1,0,1615423239,[deleted]
41,gqiioz4,[removed],1,0,1615423248,[deleted]
42,gqiiqbf,oh wait you’re all exiting? Damn i was just holding forever idk about you apes...,2,0,1615423267,Jolly-Construction49
43,gqiir00,"No ape left behind, you will know when it is time to jump off the ship. You will look towards the sky and you will see an eagle with a snakes between it's talons flying west... wait wrong movie... this is not financial advice.",2,0,1615423278,T1Fak3r
44,gqiix6f,"Haha true. We kind of looked at it how we look at going to the casino: we're not looking to turn $50 into 10,000, we are spending $50 to have a good time. We are okay losing it. And right now we are just trying to learn the rules of the game. I just get a little riled up when I think it's unfair! But hey, I guess that's Wallstreet!",1,0,1615423370,ThanosvsShrek
45,gqij5f3,"While the sarcasm is noted, so too is the point haha. Thanks. She and Scott will go to Applebee's, I'm sure",1,0,1615423493,ThanosvsShrek
46,gqij825,"Lessons are learned every day. The real one is ""you don't lose until you sell."" I tell myself that all the time. Eventually you'll have your window. You lose nothing until you click that sell button, so just look at it not like you're OUT any specific amount because you aren't, your liquidity is just tied up at the moment. That's all. You already got the second rule out of the way, just play with what you can afford to lose. I don't make big ass plays like these guys because my portfolio isn't anywhere near theirs and I don't pretend that I'm swimming in ITM calls and have 600k of buying power. Lol, I wish. But I also don't use margin, so....",2,0,1615423533,TheOmnisOne
47,gqijb80,[removed],1,0,1615423580,[deleted]
48,gqijcwb,So you know that it has indeed peaked and that it's time to sell?,1,0,1615423605,ThanosvsShrek
49,gqijgw7,"What's happening right now im my dumbass completely uneducated opinion (no really junior in college at 30 😂) Every time they short, the faked shares are legitimately being bought. That's a problem and will cause the shares to be counted. We... want... that.",2,0,1615423663,Dr_Lambo
50,gqijiqf,"That makes sense and I appreciate it. Because I suppose no one truly knows when it's peaked, though some may just get lucky.",1,0,1615423690,ThanosvsShrek
51,gqijo0e,All this time I thought pigs get fat and it’s the hogs that get slaughtered.,1,0,1615423769,Three9Fine
52,gqijr0l,"Yeah it's a lot to take in. But we were were hoping to do is make enough off the initial $5-600 we invested to pull out our original and just play with the profits. So that no matter what, whether it be $50 or $500,000, we never really lose OUR money. It is fun playing the market",2,0,1615423813,ThanosvsShrek
53,gqijr8p,No problem best of luck to you,2,0,1615423816,oringedoorhinge
54,gqijv34,"At first light, on the fifth day, look to the west 😂",1,0,1615423873,ThanosvsShrek
55,gqijwok,"You too, see you on the moon",2,0,1615423897,ThanosvsShrek
56,gqik0kj,Soooo....hodl and buy the dips?,2,0,1615423957,ThanosvsShrek
57,gqik8xs,I mean... yeah? I eat crayons.,2,0,1615424081,RBradyFrost
58,gqikc83,"yaaaassssssss which means, purple crab stone in SpEnortugech. obviously. 💎🤲💎",2,0,1615424130,Dr_Lambo
59,gqiknx8,"So typically, meme stocks, per say, are dangerous because it shoots up almost with unwarranted then drops back to where it should be, and takes longer to recover your loss unless you sell for a profit quickly. Most trading would look like buying a stock like Axon, where in the next few years I believe there's gonna be more emphasis put on police accountability and less lethal options, and they are the leader in that field. So you buy them now and in a few months or even years you could sell for profit? If that what I'm getting? High risk high reward, low risk, low reward?",1,0,1615424304,ThanosvsShrek
60,gqiktxf,"I do too, I just can't afford Crayola. I just have to buy the generics...",1,0,1615424394,ThanosvsShrek
61,gqil2s3,"Scott’s a good dude , pass a hellooooo for me. 

Good luck out there shrek. 

DISCLAIMER:   I am not a financial advisor... how ever my relationship advice is pretty solid.",2,0,1615424525,kromp10
62,gqil454,"Typically yeah....

This whole thing is an anomaly beyond anything else. This is other worldly.",2,0,1615424546,TheOmnisOne
63,gqil748,"Yeah he's solid, usually brings me home a Bloomin' Onion. Thanks Donkey",1,0,1615424591,ThanosvsShrek
64,gqil9m9,Well at least I'll be able to tell my grandapes I was there.,1,0,1615424627,ThanosvsShrek
65,gqilu0a,We never sell. We never collect our winnings. We’re here for the ride,1,0,1615424927,Treday237
66,gqimmb5,"Yes, buy 3 shares for 150 then sell 1.5 shares at 300 and you made back the 450 initial investment and still have 1.5 shares. So whether or not the stock goes up or down only impacts how much extra you make. Stocks are just sophisticated gambling so unless you’re prepared to lose on your initial investment I wouldn’t bother trying to time the peak.",2,0,1615425342,turnipmuncher1
67,gqimwmt,"Gotcha. So recoup the initial I put in in December, pull that out, play with the profits. If I ever lose I still never lose.",2,0,1615425493,ThanosvsShrek
68,gqj42op,u do u,1,0,1615434715,raxnahali
