,comment_id,text,score,awards,timestamp,author
0,gqfevx9,Only stock going to the moon is GME... RBLX just gonna be another over priced IPO,1,0,1615366687,johnnylaw54
1,gqfezry,It’s probably overpriced but I’m really bullish on it.,1,0,1615366791,jodatoufin
2,gqff50v,[removed],1,0,1615366935,[deleted]
3,gqff8tu,This guy fucks,1,0,1615367034,MrSleepyPT
4,gqffm6s,I am a bot. This Meme does not look like it has generated enough approval to stay on /r/wallstreetbets.                                    We algorithmically cull certain submission flairs whose response is not above a certain threshold to try and keep the page clean.,1,0,1615367364,VisualMod
5,gqfg7vg,And tell me oh wise one - what happens when GME reaches the moon? You think it's just going to stay up there forever,1,0,1615367901,Geoffs_Review_Corner
6,gqfgfea,Take tendies and buy an actual rocket ship... duh,1,0,1615368096,johnnylaw54
7,gqfgl1b,Right - it's gonna be a bunch retards left holding the bag yet again. How do you make sure you're not one of them?,1,0,1615368243,Geoffs_Review_Corner
