,comment_id,text,score,awards,timestamp,author
0,gqduahv,No? people have been doing this since the dawn of time. Problem with it is that typically price fluctuations occur before/after these dates so there’s potential to lose more than the %payout is.,1,0,1615330403,robin_the_rich
1,gqducar,[removed],1,0,1615330428,[deleted]
2,gqduj16,In theory that dividend is factored into the price - you pay a premium for the dividend - but in theory I am intelligent which I am not,0,0,1615330516,NachoStash
3,gqduote,The catch is that the stock price typically adjusts pre and post dividend so that this doesn’t really end up working. At least that’s the theory,4,0,1615330594,tangibletom
4,gqdupcx,[removed],1,0,1615330601,[deleted]
5,gqdvetk,[removed],1,0,1615330950,[deleted]
6,gqdw90z,I am a bot. This Discussion does not look like it has generated enough approval to stay on /r/wallstreetbets.                                    We algorithmically cull certain submission flairs whose response is not above a certain threshold to try and keep the page clean.,0,0,1615331374,VisualMod
7,gqdwoqj,you could also add dkl in there somewhere,1,0,1615331598,jeasvfa
