,comment_id,text,score,awards,timestamp,author
0,gqdynag,"Sir, this is a catnip lounge.

*I am a bot, and this action was performed automatically. Please [contact the moderators of this subreddit](/message/compose/?to=/r/wallstreetbets) if you have any questions or concerns.*",1,0,1615332599,AutoModerator
1,gqdyqi3,"I am a bot from /r/wallstreetbets.                                You submitted one or more banned tickers: VII.

                                Message /u/zjz if they're above 1.25 billion-ish market cap and not related to crypto/pennies/OTC/SPACs.",1,0,1615332644,VisualMod
2,gqdz0np,Bum bum bummmmm,1,0,1615332792,nateyp123
