,comment_id,text,score,awards,timestamp,author
0,gq7z1hm,[removed],1,0,1615218712,[deleted]
1,gq7zeul,"I thought it was dumb too, until every room in my house had them. 

They are a legit replacement for cable. You get certain live TV channels, and all your streaming services straight to your TV with no PC needed. 

They even have TV's now with Roku built in. It's the new smartTV IMO. 

Roku has a foot in the ""internet to TV"" market like nobody's business. 

I don't know how they will do stock wise in the future, but I do see them sticking around for a long time, or until a better alternative comes out. 

Have been definitely been on the fence about getting some stock.",5,0,1615218874,TheRumpletiltskin
2,gq7zf5a,Roku not make me broku 🤑,4,0,1615218878,Stonk_Wizard
3,gq7zjy7,Very quick response but Roku has the best ad algorithm. On average Roku gets viewers to watch adds for 2-3x the length of other targetted ad algorithms.,2,0,1615218936,fuckaguero
4,gq7zjz6,[removed],1,0,1615218936,[deleted]
5,gq7zlfu,[removed],1,0,1615218953,[deleted]
6,gq7zsib,😂,2,0,1615219036,htfu9
7,gq7zst2,Roku also comes in just about ever smart TVs out now,3,0,1615219039,ogKrzr
8,gq7zwez,We are to the point where TVs have WIFI and can house your streaming apps without Roku. I do not see all the TV brands carrying Roku when it will be pretty easy to develop everything in house. Why does Samsung need Roku?,1,0,1615219083,JPM_3000
9,gq7zx8r,Source for that? Very interesting,1,0,1615219093,fyzle
10,gq7zy16,"Ive been through 3 different ""smart"" Blu ray players. All of the interfaces sucked. They are slow. I bought a roku premiere for 25 bucks and the UI quality and responsiveness is way better.

I purposely bought a non smart TV because I just wanted a TV, none of the smart bullshit, no software updates, it just turns on and does TV stuff. I have had zero issues with my TV, but the reason I been through 3 blu-ray players is because they all died on me (good thing I had the Amazon protection plan).

Not financial advice, just anecdotal stuff and my personal opinion. Also roku works really well with plex.",2,0,1615219101,jlaudiofan
11,gq7zy7j,"Just redid all my AV equip in my home. Close friend owns a AV business. He told me he recommends either roku or apple tv to all his clients. He said when manufacturers make tvs, all the tech, etc is geared towards beautiful resolution, and whatever tech to stream is marginal at best. Another friend lives right up the street from me. Both have xfinity 1000mb down, both with youtube tv. His stream sputters and stops constantly (he streams with tv). Mine hasnt done it one time (roku).

Not sure if that would affect share price. But, I think there will always be a need for a device until manufacturers up their streaming components. 

I dont own any stock in Roku.",1,0,1615219103,Impossible-Sun-4778
12,gq7zzso,[removed],1,0,1615219122,[deleted]
13,gq804m8,just dont see what is going to stop TV companies building the app platforms into thier TVs without roku. i personally do not enjoy plugging those into every tv,1,0,1615219181,JPM_3000
14,gq806z8,or needing to spend the extra money when the TV should have the platform,1,0,1615219209,JPM_3000
15,gq80733,Remember TiVo?  Really unique stuff. Roku?   Keeping up with the times?  Have you seen a decent software or hardware update in years?,2,0,1615219210,JulianMarcello
16,gq80dv5,"As someone who never buys TVs but gets monitors instead, Roku is a sensible option until I get motivated enough to re-work one of these rpis.

But besides that, when I travel, I can just pack the roku with me. No more shitty hotel channel options.

Hosting a party with friends and watching some sports? Toss the roku in the bag and go.

No need to login to a dozen tvs every month or worry about if the tv actually deleted my login after I was done.",1,0,1615219287,JustAnotherQubesUser
17,gq80dxk,who tf is watching adds on roku?,1,0,1615219288,JPM_3000
18,gq80g91,for now. there used to be blockbusters in every neighborhood too,0,0,1615219316,JPM_3000
19,gq80j0f,because it's cheaper and easier to pay licensing fees than to do R&amp;D for a product that already exists.,3,0,1615219350,TheRumpletiltskin
20,gq80jgb,ive got a VCR you can borrow,0,0,1615219356,JPM_3000
21,gq80p9u,"My opinion...The poor.  Most of society is poor. Those working poor that can afford tech get the lowest tech and keep it forever (unit they can afford to replace with new lowest tech). Roku is free on the cheapest brand smart tv's. Do I need an amazon stick, nope...do I need a roku box, nope. Those cost money. I can also get local channel with no HD antenna. Do I want Roku on my Sony, Samsung, Panasonic, etc. Fuck No! but Ill take it on a visio, sceptre, etc. I just bought a $200 32inch Roku tv for my basement gym...it sucks! it took allday to sign into my streaming accounts and you have to stand ontop of the TV for the remote to work! So just like Radio which is still around to serve primarily the working poor, Roku is the lowest of your tech solutions and is here to stay. My opinion",1,0,1615219428,stefonte_s
22,gq80pbo,"Because a lot of dumbsumers (older people,non tech savvy ppl) use it I think, they’re happy with a mediocre product as long it works",1,0,1615219428,SE4NLN415
23,gq80spb,i doubt speed will be an issue for long. if it even is one,1,0,1615219469,JPM_3000
24,gq80xtr,"OK?  And how long were Blockbuster’s prevalent?  You’re asking people for some reason to convince you that a property is valuable, but you’re just dismissing everything.",1,0,1615219533,samsshitsticks
25,gq81347,so its great on the go? lol,1,0,1615219599,JPM_3000
26,gq8156h,"Bc Smart TVs don’t have the rights to ALL the apps. Roku does for the most part. It’s so fucking annoying buying a brand new smart TV and it doesn’t have access to HBO Max, or Hulu or Disney or peacock. Roku does.

I would start by actually researching the matter at hand that you said you have not researched.",1,0,1615219624,JohnDoses
27,gq819cw,"It doesnt seem like any of your replies to any of the comments that you want to hear feedback from others. 

You have quite a few people talking about their positive experiences, yet you come back with snide comments.

Why ask a ? when it seems like you dont care about the opinions of others?",2,0,1615219677,Impossible-Sun-4778
28,gq81ahf,you are making the case for why they dont have any long term competitive advantages,1,0,1615219692,JPM_3000
29,gq81dli,so its the people's company? ok i dont agree but i like the sentiment,1,0,1615219730,JPM_3000
30,gq81gbj,"Have you used the same systems built by the TV company? They generally suck. The TV manufacturers were doing smart TVs for years and they sucked even worse until Apple TV and Roku came along. Because the manufacturers suck so much, if they are smart, they will continue to focus on what they are good at (making TVs) and let someone else do the stuff they aren’t good at (Roku).

Besides all that, why couldn’t Roku build TVs? And/or make their own content?

In fact, why is cable even still a thing? Why haven’t computer screens replaced TVs?

A possible disruption could be content exclusive to certain TV manufacturers, but I suspect that will only happen if the manufacturer is the one producing the content (think Samsung exclusive content). Sony could do that, but I suspect it isn’t worth their money and it would be more of what they’ve done with PlayStation network exclusives.",1,0,1615219763,MichaelEvo
31,gq81mnt,I am a bot. This Discussion does not look like it has generated enough approval to stay on /r/wallstreetbets.                                    We algorithmically cull certain submission flairs whose response is not above a certain threshold to try and keep the page clean.,1,0,1615219837,VisualMod
32,gq81obt,"i posed a question to start a debate. and made my position known in advance. yes i am arguing with people. My apologies tho, ill try to check the snideness",2,0,1615219858,JPM_3000
33,gq81qi4,"They do 3 things really well.  They’re cheap, easy to use and reliable.  When I helped transition my elderly parents over to streaming, they were the option that best replicated the old tv watching experience for them.  

My house is also all-Roku because I value ease and reliability over all else.  I just want the device to work.  I sound like a shill but I don’t care.",1,0,1615219883,hambsc
34,gq81wwv,We have 2 cheap 40 and 50 inch TVs that came with Roku built in.  2 stream sticks we can move around if needed (they are just sitting on a shel right now) and a Roku stream bar we bought because our cheap 60inch tv has shitty sound. All cheap.  All easy to use.   As someone else mentioned our Sony tv doesn’t get a Roku but Roku serves its purpose and is simple easy and cheap,1,0,1615219961,nsspotted
35,gq81xvn,They build the TVs to sell them in the entire world and not just America so they have to do all of this already anyway. No extra R&amp;D needed,1,0,1615219971,Corentin_C
36,gq81xut,I mean I don’t know.  Roku was last to have HBO max.  The google interface on the new chrome I like very much so not sure why Roku leads... although I have 2 tcl with Roku.,1,0,1615219971,moomoopapa23
37,gq82qjx,"Why research when you can ask WSB for answers, then hand-wave away any contradictory opinions?!",2,0,1615220302,Eric-SD
38,gq830be,"Its easy. Never said it was great.

But you do you. I see people here championing GE so who am I to judge what people elect to like or not like?",1,0,1615220418,JustAnotherQubesUser
39,gq83fx0,"Not the peoples company, but Roku has found their lane; low brand tellies that most can afford and with companies that don't and won't design their own smart interface.",2,0,1615220606,stefonte_s
