,comment_id,text,score,awards,timestamp,author
0,gqgwipm,No I know what the break pop is. I was talking about last time it got to 400 Robinhood and others stopped people’s ability to buy and only let them sell.,1,0,1615397717,Lexx4
1,gqgwlma,[removed],1,0,1615397744,[deleted]
2,gqgwv5n,[removed],1,0,1615397827,[deleted]
3,gqgwxz0,LORD IS THIS LEGAL ITS SO LOW IM CRYN,1,0,1615397851,hahahan08
4,gqgxebc,"Paper hands got cold feet.

I'm still holding! 🤚💎✋",6,0,1615397998,SuperMegaUltraUser
5,gqgyzp3,[removed],1,0,1615398519,[deleted]
6,gqh030g,going back up and froze again?,2,0,1615398875,hahahan08
7,gqh0q0v,What a mess lol,2,0,1615399085,Spezia-ShwiffMMA
8,gqijffq,"this didn't age will,",1,0,1615423642,jOLLYw1722
