,comment_id,text,score,awards,timestamp,author
0,gqdu3oy,alright when WSB starts talking about their meme stock crashing the global economy... i think its time to sell lmfao.,1,0,1615330312,cloudyoutside
1,gqdu44b,I just like the stock,1,0,1615330318,BMWnoMoney
2,gqdu4jo,"I knew about the principle part, but not the 6k. Thanks!",1,0,1615330324,tedclev
3,gqdu4ws,I’ve got a direct investing account with my bank so I think I’ll just have to take advantage of the tfsa after GME is all said and done and we’re all billionaires,1,0,1615330329,Spammalanche
4,gqdu6b6,It was going to go into the thousands if RH didn’t fuck everyone. You’re the delusional one here.,0,0,1615330348,shrimpstar123
5,gqdu7il,"who cares, it's not my fault a bunch of douchebag hedgefunds made a mistake.  Apes will actaully make the world a bettter place",1,0,1615330364,j__walla
6,gqduael,[removed],1,0,1615330402,[deleted]
7,gqduakg,[removed],1,0,1615330404,[deleted]
8,gqdubtx,Boogaloo time,1,0,1615330421,Blumpkinatur
9,gqduc9h,"So far it's just me. And entirely hypothetical. A big, long, hard, thick, juicy, bulbous ""what if?""",1,0,1615330427,Alternative-Rub5676
10,gqducpg,[removed],1,0,1615330433,[deleted]
11,gqdudw3,[removed],1,0,1615330449,[deleted]
12,gqduf1c,I’d like to see the legal costs of running an operation like that.,1,0,1615330463,johnwithcheese
13,gqdufzi,"I forgot where the sell button was while ironing my brain. 

Melvin can take my shares from my cold dead hands.",1,0,1615330476,SpaceBoJangles
14,gqdugg2,Man...had a good point until you got to the UBI bullshit. But this is Reddit.,1,0,1615330482,OnlineWithLuke
15,gqdugek,"Pretty hard to tell me I’m day trading when the same stocks went 40-480-40-3000-500,000 no trades, am I right?",2,0,1615330482,mathilxtreme
16,gqdugfn,[removed],1,0,1615330482,[deleted]
17,gqduh6m,"Yep. I have been telling people that at the very least you need to be invested in GME as a hedge to your other investments, in order to protect against this scenario. I also brought this up on the GME subreddit and they called me a shill lol. I'm in 100 shares on GME though and holding",1,0,1615330492,UncleZiggy
18,gqduhs6,"This is Occupy Wall Street, quite literally.  Buy shares of GME and watch a bunch of rich fucks cry on TV.

I think some of you folks in deeper need to start doing more billboards, maybe TV Ads?",1,0,1615330500,DrWeGotDis
19,gqduhui,[removed],1,0,1615330501,[deleted]
20,gqdukwg,Thats why we don't let the money last a single one as they say we're old poor so we'll know how to thrive once its all been spread around the world helping those in need 🤟,1,0,1615330542,dontasslethehough
21,gqdul8i,"Bear in mind that there are limits to how much you can contribute to your TFSA.  If GME goes to the moon then,
a) You're paying tax on it
b) You can't put more than $75,500 total into a TFSA.",2,0,1615330546,Tower-Union
22,gqdulq9,What’s the difference between GME growing to that and BRK-A being already 380k a share,1,0,1615330552,WoiYo
23,gqdulwj,Well said you retard. You have many wrinkles in your brain. As many as there are on my wife’s boyfriends balls.,1,0,1615330555,wiioz
24,gqdun5i,"Exactly why would money changing hands ruin the economy lol. Instead of billions+ in the hands of few it would be reasonably spread out more than it ever has. And just like you said the new owners of that money would not hoard it. The spending frenzy on cheap stocks and local economies would be more than enough to equalize a ""crash"". 

I want my tendies just as much as the next guy but a massive wealth transfer is absolutely needed when the middle class basically no longer exists and there are more billionaires than ever. There needs to be some balance changes thats all",40,0,1615330572,23mikey
25,gqduo69,"Either some form of UBI is introduced, innovative moves reduce the cost of living dramatically, or the wealth gap continues to expand.",2,0,1615330585,Alternative-Rub5676
26,gqduq82,Compare to tech giants and their market caps and their multipliers.,1,0,1615330613,teslaboner
27,gqdurnz,[removed],1,0,1615330632,[deleted]
28,gqdursj,Worst part is being a US-Canadian dual citizen where having a TFSA fucks your US tax filings... :-(,2,0,1615330634,IllustriousProgress
29,gqdus6g,"I’m pretty sure You are taxed after your limit ie 50-70k if you made 100k your paying taxes.

Edit 
: yeah I’ve been corrected go 🇨🇦",1,0,1615330639,WoiYo
30,gqdusdb,"And that tax revenue goes back into government programmes that help people that need it, so GME helps LITERALLY EVERYBODY 🌍",1,0,1615330642,number1alien
31,gqdutdb,"The reality is, if things started getting to that level, the GameStop board could step in and do a stock offering that would cover the shorts. I do see the stock rising significantly still but my guess would be the gme board eventually steps in, either by choice or by force from outside forces, to issue new stock and puncture the rocket.",3,0,1615330655,americansherlock201
32,gqduudm,"I plan on ... I don't know. I've been poor all my life so when this does take off, I really have no clue. I do want to take a portion out and pay off my debts but money is literally nothing to me. I'll probably use it for helping friends/family etc, especially my one friend that had a fire and lost his business. Maybe keep portions in and learn more of the market. For now, I'll just be a dumb smooth brain ape and hold what I can.",2,0,1615330668,quarterpounder420
33,gqduxf4,Lol I'm probably going to max out my TFSA when GME squoozes the squeeze,2,0,1615330710,Dazzling_Rhubarb
34,gqduxm5,People will sell long before it hits 50k,1,0,1615330713,FallenWiFi
35,gqdv09v,"It would continue on basically the same path, the moon's speed relative to the earth (~1km/s) is rather sluggish compared to earth's relative to the sun (~30km/s). If you look at a [trace of their](https://www.youtube.com/watch?v=Dm68O0zB-XE) orbits around the sun, the moon doesn't orbit around the earth as much as it corkscrews around earth as they both orbit the sun.

Edit: I'm a liar. A lucky shot could get it to Mars/Venus where it could be kicked out of the solar system or into the sun.",3,0,1615330749,KrisSwenson
36,gqdv109,I'm walking away with a minimum $50K bag.,1,0,1615330759,Alternative-Rub5676
37,gqdv14s,Oh ok dope so I actually haven’t missed out on anything. Thank you for the TFSA education!,2,0,1615330761,Spammalanche
38,gqdv4zr,"When the crisis would adversely affect the rich.

&gt;hunt down a scapegoat

Wanna take turns guessing who that'll be?",4,0,1615330813,fc1b64d
39,gqdv5lx,"so, GME is unironically the key to saving the human race? i'm in until the end",1,0,1615330821,YouLostMeThere
40,gqdv5q3,[removed],1,0,1615330823,[deleted]
41,gqdv6od,[removed],1,0,1615330837,[deleted]
42,gqdv6vh,"If you genuinely believe the CRA is going to let you keep your millions in gains untaxed then you're naive as fuck. I wouldn't be surprised if they have their eyes out for any individuals that make even low 6 figure gains. The rules are declared loosely for a reason

People need to stop perpetuating this nonsense

EDIT: In fact, I've found several articles describing these exact cases happening over the past few years:  


[https://financialpost.com/personal-finance/tfsa/canadians-with-too-many-wins-in-their-tfsa-being-targetted-by-cra](https://financialpost.com/personal-finance/tfsa/canadians-with-too-many-wins-in-their-tfsa-being-targetted-by-cra)  
[https://www.moneysense.ca/save/investing/cra-tfsa-accounts-court/](https://www.moneysense.ca/save/investing/cra-tfsa-accounts-court/)  
[https://www.investmentexecutive.com/newspaper\_/news-newspaper/tfsas-setback-for-the-cra/](https://www.investmentexecutive.com/newspaper_/news-newspaper/tfsas-setback-for-the-cra/)",1,0,1615330839,Jellyking12
43,gqdv8j7,Could you imagine $GME crashes the global market 🤣🤣🤣 couldn’t even be mad at that because that’s just too hilarious,1,0,1615330862,Swole_Monkey
44,gqdv8op,"$5,000 a share is literally not possible. Sorry to break it to you.   


SEC would shut down trading for 10 days if things got way out of hand. Anyways, you're fooling yourself if you think institutional money isn't moving the stock right now. Hedge funds are making cash off it going up...no longer in puts...yet.",2,0,1615330864,WallStreetWarrants
45,gqdv8pu,"flash sale, 80% off fucking everything. I can't wait to see it happen and buy into loads of stocks with my GME earnings",9,0,1615330864,TheGangstaGandalf
46,gqdv8qz,Down payment for a house.,1,0,1615330865,Dot1red
47,gqdv8ty,"You have done an excellent job at wasting my time.


*I am a bot, and this action was performed automatically. Please [contact the moderators of this subreddit](/message/compose/?to=/r/wallstreetbets) if you have any questions or concerns.*",1,0,1615330866,AutoModerator
48,gqdv8td,"This is a great point. This isn't value simply disappearing from the global economy/market like in 2008, etc. where the global economy is negatively impacted. In this case the value is changing from one hand to another, not disappearing. Plus, there isn't the ability to simply hoard all of the value as many will sell some shares which will result in the tax revenue you mention. Also, and I know this is an intangible, given how the people who will be receiving the funds are wired differently from HFs, they will reinvest in market, or their communities, or any other venture where they can actually help and not resort to selfish short selling. You can make this point confidently given how strongly most people here feel about actually helping GME avoid bankruptcy and further helping employees keep their jobs. This is completely different from any situation before and can actually result in a net positive for the global economy.",1,0,1615330866,Huckleberry1127
49,gqdv8u9,"If the earth magically disappeared, the moon would most likely stay in orbit around the sun. It's velocity around the sun dwarfs the velocity around the earth, so it would keep doing it's thing.

Technically, if earth wasn't around, it might be considered a planet. Not sure about this, though.",2,0,1615330866,HomeGrownCoffee
50,gqdv9pa,"Wait, why? Its exchanging hands, not being printed.

The government would also get a shit ton in tax, then put it back where its needed",2,0,1615330878,Lexicon-Jester
51,gqdva2f,"Marx, Lenin, Tito, all my fuckin OGs would buy and hold.",1,0,1615330883,Iakobab
52,gqdvayk,[removed],1,0,1615330896,[deleted]
53,gqdvbdc,Who is they? And why all the CAPITALIZATION?,1,0,1615330902,Subject-Ad-3585
54,gqdvd7t,"IM pretty sure its going to be like Taco Bell in Demolition Man


*edit* 

I realize if you are young this sounds like a joke about diarrhea destroying a toilet but no, surprisingly that isnt the toilet joke from this movie.",1,0,1615330928,binkerfluid
55,gqdvdc7,Where's it needed?,1,0,1615330930,Subject-Ad-3585
56,gqdvds2,"There's only a couple of hedge funds who are short that *we know about*. I suspect there are much bigger players in this than we realize. Even some MMs may be implicated. The DTCC's new rule protects themselves against brokerages and MMs, so I feel if they are in trouble, there's a lot of people and institutions in trouble",1,0,1615330936,UncleZiggy
57,gqdve5f,[removed],1,0,1615330941,[deleted]
58,gqdveyz,Counterpoint: when has the government cared about homeless people?,3,0,1615330952,HomeGrownCoffee
59,gqdvf1x,"Institutional longs are going to sell way before any of this shit happens. Retards in this sub are too retarded for this own good. If shorts don't have the money to close the trade, we'll get just enough bankruptcies to wipe GMEtards out. Since some GMEtards are long investing firms, they'll just sell their positions before bankruptcy gets too attractive and retards in this sub will be the ones left holding the bag. For the love of God, if you have profit, take it. That's how you beat the hedge funds. Yall should already know what diamond handing past the top looks like. You don't have to sell it all, just readjust your position. This shit's not going to $1000, so please don't lose your shirt.",1,0,1615330953,HereGoesNothing69
60,gqdvf6r,buy a copy of The (Ultimate) Hitchhiker's Guide to the Galaxy and read from the beginning. best trilogy in 5 parts you'll ever read,8,0,1615330955,roryne
61,gqdvf9h,Chicken tendies price will sky rocket lol,1,0,1615330956,WoiYo
62,gqdvfw5,[removed],1,0,1615330966,[deleted]
63,gqdvgfu,"Inflation only rockets when a vast majority of the population is feasting on tendies....we are legion, but we ain’t a vast majority of the population....all of us on Reddit at GME $5000 probably equal one or two Plotkins...maybe 3?",2,0,1615330973,nofzac
64,gqdvir3,Who the hell has an IRA at 20 lol,-7,0,1615331005,InterestingRock0
65,gqdvj33,All im sayin 1 GME = 1 B’tc’on,1,0,1615331010,PandaChewing
66,gqdvj6m,"fuck the economy, I hope it burns and takes as many people with it as possible",1,0,1615331011,AcidicAlex
67,gqdvkoi,"Ah, so invest in weed stocks.. Gotcha",2,0,1615331032,Lexicon-Jester
68,gqdvmfn,In crooked politicians pockets*,1,0,1615331057,Milkpowder44
69,gqdvna2,"If what happened when it was in the short squeeze and RH shut down buying of the stock. If they didn't do that most likely the global economy would have crashed.

Likely every single brokerage would have gone bankrupt, as well as clearing houses. That means that the money you \*made\* off the stock...it's gone. No insurance policy is going to cover that much cash. No one would have made anything. Hedge funds = gone. Retail investor money = gone.

Your 90 year old grandmother who was happy to get a covid vaccine who lives off fixed income investments...those are gone, she's homeless now.

Gov. couldn't print enough cash to bail all those out, Chine would become the dominate world economy and the US would be like the fall of Rome. This is what would happen.",1,0,1615331069,WallStreetWarrants
70,gqdvorm,"Basically, yes it could be a lot of money but:

\- US economy will get fat taxes from it, so the government will benefit a lot. Given that the Fed is trying to sell bonds in order to remove money from M2 circulation, this might actually be their best shot at avoiding inflation.

\- The DTCC has $1.4 quadrillion of AUM/funds, they can take the hit.

\- Re-investment will be huge.

\- 'Young Money' spend their cash. Boomers are known for hoarding money in bank accounts but young irresponsible newly minted millionaires spend their money, this could be a huge boon for the economy, especially during this phase of kickstart.

&amp;#x200B;

The thing to remember with any of this is that it is like squeezing a water balloon, the water doesn't leave the balloon it just goes somewhere else. It's a transfer of wealth, not a deletion. Every penny lost is a penny gained somewhere else.",1,0,1615331091,Catch_0x16
71,gqdvp4v,"You are not.

https://www.canada.ca/en/revenue-agency/services/tax/individuals/topics/tax-free-savings-account/tax-payable-on-tfsas.html",1,0,1615331096,Tower-Union
72,gqdvpml,"They is the government. 

The capitalization was because I was hyped",2,0,1615331103,shrimpstar123
73,gqdvprb,"You know $500k means $500,000, not $5000 right?",1,0,1615331104,Subject-Ad-3585
74,gqdvq0w,Booo :(,1,0,1615331108,Tower-Union
75,gqdvqzo,"Nah, I’m a euroape, that shit covers daycare for my neighbours 💕",1,0,1615331121,number1alien
76,gqdvrq7,"So where do you think the gain will go? Thousands of retail investors who will invest into their local economy, paid a good chunk of it to the tax man and open other opportunities. Whereas the current situation is we have a few billionaires that control everything",1,0,1615331132,Aka_Diamondhands
77,gqdvsha,Nice aluminum foil hat,0,0,1615331142,Subject-Ad-3585
78,gqdvtzy,A lot of people do....,4,0,1615331163,Trollzore
79,gqdvucf,"And you're wrong, everyone invested in $GME would literally make ZERO DOLLARS because all the brokers are bankrupt, they can't pay you. Insurance companies won't cover that much cash, you'd lose 100% of what you had in $GME.  


Also...most of the $GME investors in here literally do not know how to buy a call option. you think those are the people who are going to invest in good tech? LOL",1,0,1615331168,WallStreetWarrants
80,gqdvuht,Oof lmfao,1,0,1615331170,l3reakdown
81,gqdvuzh,"Yeah no kidding.  What kind of bullshit is that.  There should hard defined rules that everyone knows.  Hmm.  Makes me wonder what my edge SEP rules for day trading are.  Pretty sure since its not a margin account, it cant be flagged as PDT.",2,0,1615331177,BarbequedYeti
82,gqdvvhw,[removed],1,0,1615331185,[deleted]
83,gqdvvoz,"My smooth brain can’t comprehend of a scenario where valuation gets as high as noted here.

At some point, the shorters will just default, declare bankruptcy, and go back to their mansions while their investor clients get cleaned out, no?

I could imagine it going to $1,000 if everything just goes insane, but people talking about even $10k sound like fantasists to me. Is there something I am missing?",1,0,1615331187,WTF_HomeSlice
84,gqdvwmt,[removed],1,0,1615331200,[deleted]
85,gqdvwvx,All I said was the government gets trillions back in taxes if it goes to 500k,2,0,1615331203,shrimpstar123
86,gqdvwyy,[removed],1,0,1615331204,[deleted]
87,gqdvyny,Ok,0,0,1615331229,Subject-Ad-3585
88,gqdvzx1,[removed],1,0,1615331246,[deleted]
89,gqdw242,"Whatever has been fucked over hard by who ever had to liquidate.

Basically bailing out companies.",2,0,1615331277,Lexicon-Jester
90,gqdw4of,"Absolutely. If, by some ridiculously unlikely reason, GME gets to $500k/share, I'm paying off my house, buying a new car, donating to charities, investing at least 50% of gains back into the market, and probably starting a small not-for-profit.

I wouldn't move houses/neighborhoods, buy a yacht, or even start to live lavishly. It would be enough to just not want for anything I need anymore. That's what's great about retail investors being at the heart of this whole thing. We're not rich pricks, we're regular ass people that are just trying to live our lives and get by.",6,0,1615331313,PMmeyourSchwifty
91,gqdw5jc,good dog,4,0,1615331325,shrimpstar123
92,gqdw631,I leave the pulling out to my couch.,15,0,1615331333,dla619
93,gqdw6ry,This is the stupidest post I’ve ever seen in my life on this sub. You really think the stock market would drop 80% because a couple hedge funds have several billion in shorts on one medium cap stock?,2,0,1615331342,Middle_Cockroach_709
94,gqdw7oc,Nothing will happen shorts will get forced out one by one in an orderly fashion as their holdings slowly unwind. It could very well be happening now which could explain the slow and steady hike up,1,0,1615331355,raddits
95,gqdwa9j,[removed],1,0,1615331392,[deleted]
96,gqdwc42,This is the dumbest thing I’ve ever read.  Congrats on that at least.,1,0,1615331417,the_real_simp
97,gqdwd9d,"....so GME moonshotting has been the Fed's exit strategy all along.  Twirls Mustache.  GME must go to 500k, it's in the best interest of national security",5,0,1615331434,aHipShrimp
98,gqdwde5,[removed],1,0,1615331436,[deleted]
99,gqdwf44,[removed],1,0,1615331460,[deleted]
