,comment_id,text,score,awards,timestamp,author
0,gqfgb7g,"My idiot ass woke up at 2 and somehow read that it was 5 on my watch. 

Took my legal, doctor prescribed, adderall (thinking it was wake up time) only to realize my error as I swallowed the pill and my watch lit up. I didn’t choose the smooth brain life, it chose me.",2,0,1615367991,Spdrcr0130
1,gqfgba3,🚀,1,0,1615367993,Musiq-man
2,gqfgb9r,[removed],1,0,1615367993,[deleted]
3,gqfgbd3,[removed],1,0,1615367995,[deleted]
4,gqfgbja,calm before the storm or,1,0,1615368000,TimmyC
5,gqfgbm4,[removed],1,0,1615368002,[deleted]
6,gqfgc2d,"The reason I think they won’t do that is in my reply to your initial comment. I could be wrong, but if Cohen et al genuinely believe in their vision, a bump in short term capital would not be worth the destruction in their brand image that would come with that.

Who gave a shit about GameStop two months ago? No one. This amount of publicity and positive sentiment is PRICELESS and likely to last well into the future if they play their cards right. Any firm willing to throw that away for a short term capital bump would be more retarded than I am.

Again, I could be wrong of course, and as a current shareholder am biased, but I don’t see it.",1,0,1615368012,wobshop
7,gqfgc25,[removed],1,0,1615368012,[deleted]
8,gqfgc36,"I cannot think of a worse time to sell, other than at flat 40",1,0,1615368013,reddit_is_meh
9,gqfgc3z,GME is easily three times more valuable than TSLA or AAPL,1,0,1615368013,hastoriesfan
10,gqfgc3y,GME price predictions? I'm thinking $400 EOD and $30m EOW,1,0,1615368013,doshgangit
11,gqfgc35,I'm glad I set my alarm for 4am.. you guys are here to pick me up!!,1,0,1615368013,xhaze_27
12,gqfgc47,Its either they buy or we buy. Which is cheaper for them?,1,0,1615368014,AdamsShadow
13,gqfgc4b,I have a theory deep fucking value is handing out these rewards 👀👀👀👀👀👀 because thank you 🥺,1,0,1615368014,kru_kush420
14,gqfgcby,hedgies,1,0,1615368019,Taurius
15,gqfgcgq,Fidelity,1,0,1615368023,monochrome_f3ar
16,gqfgcgf,How’d you turn $500 into $200000 off a 100% GME gain?,1,0,1615368023,shkrollin
17,gqfgcjb,Holla if you hear gME,1,0,1615368025,lululemonhead
18,gqfgcls,Wrong way Tesla Jesus fuck,1,0,1615368027,Noctis2488
19,gqfgcul,I like the stock!,1,0,1615368032,y0urselfish
20,gqfgcuy,GME got my portfolio up 81% all time,1,0,1615368033,howtoliveonearth
21,gqfgcwd,50 billion Stanley nickels,1,0,1615368034,Apollo_Thunderlipps
22,gqfgcwj,Idk. Feels weird not getting constantly fucked.,1,0,1615368034,DumonsterPT
23,gqfgcxh,[removed],1,0,1615368034,[deleted]
24,gqfgcz3,[removed],1,0,1615368035,[deleted]
25,gqfgd1t,"I talk shit cause I like to talk shit. But you wouldn’t get it, you are not ascended",1,0,1615368037,AssWrapSupreme
26,gqfgd5n,But marketwatch just updated?,1,0,1615368039,The-big-vitamin-D
27,gqfgd84,I LOVE THE STOCK,1,0,1615368041,BrandonDTK
28,gqfgdam,I bought a bunch more GME the first time around at 300. Looks like I’m doing it again....,1,0,1615368043,halfmanhalfrobot69
29,gqfgda7,Pure gain,1,0,1615368043,y0urselfish
30,gqfgdi3,Exceptional is better than normal.,1,0,1615368049,Equilibriator
31,gqfgdj1,Who needs picking up at 300? We getting you today🚀🦍,1,0,1615368050,0insertusernamehere
32,gqfgdkj,My buddy who eats crayons way better than me says gamma squeeze happens at 300.,1,0,1615368051,PeaceLoveAndBusses
33,gqfgdl3,"GME call holders

Please for the love of god...cash in the call and buy shares with SOME of your proceeds.

This stock has been fucked with once

Lock in gains and hold shares so the “big boys” cannot rip the gains from everyone again.",1,0,1615368051,gwh21
34,gqfgduh,"Unfortunately, I'm a little bit has no money.  So I'm holding a few shares and learning patience, honestly my exit point was originally like 185, but at this point I don't think I have an exit point.",1,0,1615368058,XionFa
35,gqfgdv5,1400 EOW,1,0,1615368058,iamzyb
36,gqfge00,Premarket has got me precumming,1,0,1615368061,KingOfVim
37,gqfge16,"Can’t stop. Won’t stop. GAME STOP

LETS FKING GOOOOO 🚀🚀🚀🚀🚀",1,0,1615368062,Karbonala
38,gqfge1u,[removed],1,0,1615368062,[deleted]
39,gqfge1w,It’s 4:20am and I haven’t slept yet. Extra smooth brain today.,1,0,1615368063,Evicted1
40,gqfge4q,"He'll get audited for ""manipulation"" :/",1,0,1615368065,Taurius
41,gqfge6d,Ja! Ja! Das ist gut!,1,0,1615368066,Musiq-man
42,gqfge78,"tomorrow is my anniversary, flair or i'll dump my fiance",1,0,1615368066,iurnaux
43,gqfge90,How does this still get asked. Nobody fuckin knows. It’s up to you when you think is the right time to sell. Which in my case is 1k+,1,0,1615368067,Drippin_n_Trippin
44,gqfge8j,"Bruh what.

Also you need to make this its own post.",1,0,1615368067,shkrollin
45,gqfgeat,"Lol ok jackass, way to spout off a bullshit meaningless answer when you have no idea what is going to happen with the stock.",1,0,1615368069,NervousTumbleweed
46,gqfgec6,Does anybody know if you’re able to trade stocks while transferring platforms? I’m moving from Robinhood to Schwab and don’t want to screw myself over if something big happens.,1,0,1615368070,JimmiesWhoRustled
47,gqfgecz,Why can’t GME be like this during the market open haha,1,0,1615368070,LifeSizedPikachu
48,gqfgeds,"Announcements since close - GME earnings the 23rd, and 3 new amiibo will be GameStop exclusives.

(I've no idea what amiibo is)",1,0,1615368071,PeteTheCameraman
49,gqfgeer,$CUM,1,0,1615368072,iAbc21
50,gqfgefw,[removed],1,0,1615368073,[deleted]
51,gqfgegx,"hold GME, just HOOOOOOOOOOOOLD",1,0,1615368073,43212321423
52,gqfgelu,Once your call hits break even price how much do you get after? Or should you sell if it hits break even?,1,0,1615368076,singh161798
53,gqfgeyb,Holy shit GME pre market!🚀🚀,1,0,1615368084,Aardkloot
54,gqfgeyg,"I'll help you get rid of that poison, send me some",1,0,1615368084,geismaikati
55,gqfgeyr,"In space, there's no high or low.",1,0,1615368085,SCUDDEESCOPE
56,gqfgez0,Yes you are a paper handed bitch.,1,0,1615368085,Virtua1Anarchy
57,gqfgezs,"Anyone seeing this and doubting, Watch the hearing. And watch it again.

January was mostly gamma. Several sources there said GME would have absolutely hit the thousandS per share. Plural. If RH didn't halt buying the stock.

RH had a mass exodus of users. We're talking 60% in 2 weeks. Other people opened accounts elsewhere.

Everyone is using a different broker. RH doesn't matter anymore.",1,0,1615368085,admiral_asswank
58,gqfgf0o,[removed],1,0,1615368086,[deleted]
59,gqfgf5r,The poor euros did good,1,0,1615368090,tingolalingo
60,gqfgf8g,I love fucking Melvin and Ken Griffin in the morning.,1,0,1615368092,phly
61,gqfgf8z,[I'M GONNA COME](https://www.youtube.com/watch?v=Gp0EpzWu_JM),2,0,1615368093,FuckOutTheWhey
62,gqfgf8u,[removed],1,0,1615368093,[deleted]
63,gqfgfb1,Nah exercise them,2,0,1615368094,iamzyb
64,gqfgfag,by just shifting over to an e-commerce Platform. Having 8 billion revenue in Sales in E-commerce by an Sales multiply of 10 equals a market cap of 80 billion. 80billion / 70million Shares = 1142,1,0,1615368094,Disn00bed
65,gqfgfb9,[removed],1,0,1615368094,[deleted]
66,gqfgfg1,"Say , you wouldn’t also have a spare prune would ya?",1,0,1615368097,Dhop2
67,gqfgfi8,My gold position is bleeding but who gives a flying fuck when I'm on a rocket,1,0,1615368099,TurboWalrusParty
68,gqfgflb,Hovering 280,1,0,1615368101,0insertusernamehere
69,gqfgfon,It’s gonna rocket after that too. There’s like a billion dollars of 300c options that are about to end up ITM,1,0,1615368104,halfmanhalfrobot69
70,gqfgfq9,GME is already up $31 in pre-market holy FUCK,1,0,1615368105,UndressedBreast
71,gqfgfqx,"Oh no, don't worry. When I say retire early, I only mean that I am not going to be a wage slave groveling for a paycheck for some god awful, soul crushing corporate job.

I absolutely have a ton of shit in mind that I will be pursuing. I'm a DJ and super interested in the music industry, and having all this money is going to open up a massive world of opportunity for me that I never though I would ever pursue. I'm likely going to buy out several struggling nightclubs in my city and start a little music empire. I just say I'm retiring, because that shit ain't work to me.",1,0,1615368105,Expensive_Wash5330
72,gqfgfr4,im buying [gamestop](https://www.reddit.com/r/wallstreetbets/comments/m1tm8j/the_story_of_udeepfuckingvalue_in_song_set_to_a/?utm_source=share&amp;utm_medium=web2x&amp;context=3),1,0,1615368106,Icypancakes81
73,gqfgfti,Huge stonks,1,0,1615368107,jeefuckingbee
74,gqfgfw1,"you guys think you're retarded but i'm texting some friends rn and i think they're actually retarded

friend 1: i sold gme at 180 because it's the peak
friend 2: what's a limit order?",1,0,1615368109,jcs801
75,gqfgfvh,Gme = Good Morning Everyone. (Retards),1,0,1615368109,BrandonDTK
76,gqfgfvm,Question of the next few weeks will be whether Apes can resist the temptation to sell at the funny numbers and can hold for the true tendies.,1,0,1615368109,LordCommanderhodor
77,gqfgg14,[removed],1,0,1615368114,[deleted]
78,gqfgg3q,It’s half 9 here so at least you’ll have peeps to talk to 😂,1,0,1615368116,Musiq-man
79,gqfgg90,You'll have money soon!! Just HODL,1,0,1615368120,Ok_Turnip9078
80,gqfggas,"Alexa, play Buss It 😍",1,0,1615368121,l3randii
81,gqfggc1,Damn it. Why did I sell a $250 covered call on my shares. I want more. Gimme more,1,0,1615368122,multiplythatmoney
82,gqfggcw,Thank u,1,0,1615368122,AvDaBomb
83,gqfgggw,Staring at mine to see if I should take it and then sleep or wake up and take it lol,1,0,1615368125,vancityboyo
84,gqfggiw,[removed],1,0,1615368126,[deleted]
85,gqfggj7,[removed],1,0,1615368126,[deleted]
86,gqfggn0,"4:20 am, can't sleep and I got class early tomorrow, but WE UP 13 PERCENT PRE MARKET BABY",1,0,1615368129,BarbedDildo
87,gqfggqs,"no, no you're not",1,0,1615368132,xxjohnnybravoxx
88,gqfggs2,Yeah ima do that on Friday,1,0,1615368133,singh161798
89,gqfggtl,Shorting is perfectly possible in AH and PH,1,0,1615368134,defabien
90,gqfggvu,dying inside for paper handing and breaking even with 4@200 🥲 I will continue watching GME moon because I deserve to be tortured and no stonks for me 😣,2,0,1615368136,Lakersfan240
91,gqfggyq,280 dollars a minute ago,1,0,1615368138,Musiq-man
92,gqfggz6,ɴᴏᴡ ᴘʟᴀʏɪɴɢ: [Erica Banks - Buss It (Offic](https://www.youtube.com/watch?v=NOoHJ_ZXlJU) ─────────⚪───── ◄◄⠀[▶](https://www.youtube.com/watch?v=NOoHJ_ZXlJU)⠀►►⠀ 2:19 / 3:29 ⠀ ───○ 🔊 ᴴᴰ ⚙️,1,0,1615368138,___alexa___
93,gqfggzq,[https://www.ls-tc.de/en/stock/gamestop-aktie](https://www.ls-tc.de/en/stock/gamestop-aktie),1,0,1615368138,mrarchangelgabriel
94,gqfgh2s,Dude GME $800 calls in July are selling for like $70/per contract. It is insanity.,1,0,1615368141,HonestManufacturer1
95,gqfgh44,GME 277 pre-market,2,0,1615368142,SwedishKillerChef
96,gqfgh6y,"me too, i like the stock",1,0,1615368144,jcs801
97,gqfgh8i,"Why not more? This is a chance of lifetime,",1,0,1615368145,hastoriesfan
98,gqfghab,"Easily over ATH. They can’t remove the buy button again. Would mean their downfall. Also there are no more shills for random shorted companies like UWMC, RKT etc if you haven’t noticed. GME is the main played shorted stock rn and I see it going over it’s ATH, where will it stop? No clue.",1,0,1615368146,youngfuture7
99,gqfghc5,I’m cool with people risking what they want but I am a huge advocate of locking in gains and playing with house money,1,0,1615368148,gwh21
