,comment_id,text,score,awards,timestamp,author
0,gqgxzd9,[removed],1,0,1615398190,[deleted]
1,gqgxzlj,🌈🐻,8,0,1615398192,stuartLJ
2,gqgy0g5,Same boat brother. could see it coming a mile off lol,1,0,1615398200,Shawesome_02
3,gqgy0op,[removed],1,0,1615398202,[deleted]
4,gqgy36p,Smart play expecting manipulation now use that to buy more if you like the stock!,6,0,1615398225,Wayne93
5,gqgy6ac,"sell it asap or you boutta be fucked lol
 
edit: lol do you retards realize he is making a bet that GME will go down? 
 
aka he is making the same bet that Melvin &amp; the hedgefunds made 
 
aka he is going to get DICKED
 
he had a narrow window where his $200 puts were going to print, but that ship has since sailed 
 
did I not put enough emojis in here to comfort yall enough? eat my ass",-5,0,1615398253,3internet5u
6,gqgy7fu,Dump those now if you like money. This was caused by a single whale,-6,0,1615398263,Trev0r_P
7,gqgydtf,[removed],1,0,1615398322,[deleted]
8,gqgygj1,I was about to buy 300 puts but got pulled away to do my job. Fuck me.,6,0,1615398347,Wolf1771
9,gqgyqit,Melvin spotted,-2,0,1615398437,twizzle889
10,gqgyrra,Big facts GME will be back up shortly,2,0,1615398448,TypesWithEmojis
11,gqgyvgp,Smart Play my dude,2,0,1615398481,TypesWithEmojis
12,gqh1696,lucky man,1,0,1615399249,3internet5u
13,gqh1gea,"lol my guy looking real retarded rn
 
btw he had $200 puts aka he is FUCKED if he didnt sell when it hit ~198",1,0,1615399353,3internet5u
14,gqh1jhn,[removed],1,0,1615399386,[deleted]
15,gqh1nmk,"read edit lmao
 
unless you were calling him melvin",1,0,1615399429,3internet5u
