,comment_id,text,score,awards,timestamp,author
0,gqa4od6,[deleted],-2,0,1615254421,[deleted]
1,gqa4om7,idk ...some work some don't.,5,0,1615254425,sleepybot0524
2,gqa4v13,[removed],1,0,1615254526,[deleted]
3,gqa4vga,Why not just buy $8655 worth of shares at that point?,9,0,1615254532,Hank-TheSpank-Hill
4,gqa4vjn,"When the market bottoms out, that's the best time for LEAPs",5,0,1615254534,I_DILL_E
5,gqa4x8k,Yes but they are pricey options to buy,1,0,1615254559,agreenfuture
6,gqa4xu4,"Depends on the delta, at some point they will just move exactly in line with the share price",1,0,1615254569,JinnPhD
7,gqa4ypb,"Long term options “lower your risk” by giving you more time - theta, to get to your predicted price.",2,0,1615254582,aloneforevaprolly
8,gqa51vj,[removed],1,0,1615254631,[deleted]
9,gqa52fp,Wait for the dip. Buy monthly calls. Give yourself time to sell on a climb or sharp peak. Be diligent.,4,0,1615254639,Hicklebear
10,gqa53qz,"I dont know a whole lot but im fairly sure some form of spread option would be the 'safest' way to do options as you can fine tune your exposure , and then you would also have a hedge to fall back on in the event it went the opposite way on you.",1,0,1615254660,BiteMyShinyMetalAth
11,gqa5ehg,"Yolo weeklies, sure you’ll loose 80%, but those 20% days are oh so sweet.
Also I pissed away 220k and then 130k this year... on the rise again, let’s see where this one takes me... 10k up today.",-3,0,1615254823,Genome1776
12,gqa5nbl,"I’m confused, because I think you’re confused.

~$86.55 is $8,655.00. For one contract. Sure, you’re ITM, but at what cost?

If you have $8,655.00 to blow, I’d buy straight up shares and don’t mess with options at that point.

Also, keep in mind you don’t necessary need a lot of price movement to affect ANY contract. You could buy $200 strike calls expiring Friday and the stock could move up $2 and you’d still be in profit. Sure, not a lot, but you’d still make profit (if you’re selling the contract, of course.)

It all depends on if you plan to exercise the contract, or if you plan to sell it once you’re happy with the gains. If you’re going to exercise it, it’s not worth the premium unless you have stacks on stacks of cash burning a hole in your pocket because the moment you exercise that contract, you forfeit the premium.

Take that Apple example. You decide to spend $8,655.00 on the contract. It expires ITM. You decide to exercise. You just threw away $8,655.00. I’m too lazy to do the math, but is it worth it? I really don’t think it is.

Then again, it’s your money and this isn’t financial advice. However I think there’s much better ways to spend your money, especially if you have over $8,000.00 burning a hole in your pocket.",9,0,1615254959,Verrsee
13,gqa5sh4,Seek help,2,0,1615255037,chrisfitpro
14,gqa651j,"Don’t buy options if you don’t understand them. You can ruin your financial situation for a long time. And judging by this post, you don’t understand them.",6,0,1615255230,Derpweest
15,gqa6eit,[removed],1,0,1615255378,[deleted]
16,gqa6n7q,"But you can buy calls much closer to the current price for way less money. Sure, you need the share price to move more to make a profit, but the point is to have the benefit of 100 shares for a fraction of the cash outlay.",1,0,1615255514,spinxter66
17,gqa7fxk,"So you buy a deep in the money call with a far out expiration for $8600. You can look at the other $30c options closer to expiry to see where the premium you paid is headed. 

That far in the money, the stock rises a buck, your option rises quite similar value X 100. It’s got stablity, but you’re still putting money up for it. 

The people that say go ahead and buy $8k worth of stock aren’t wrong, but they aren’t making the most advantageous play. You buy $8k worth of stock, you still have that stock. 

The benefit of owning the option is the ability to sell calls against the contract you own. This brings down your cost basis from $8k to maybe 4-5 by expiry and you’re able to make good money this way. 

If you buy $8k worth of stock, you’ll only have 75 shares and you won’t be able to write fully covered calls against those. You can still write OTM calls if you have enough dough to cover them, but it’s got more risk.

This is all provided the stock doesn’t tank and your call is worth far less than what you bought it for. It’s apple, so not too likely though.",1,0,1615255952,checkycheckster
18,gqa7ubi,"What the fuck are you talking about? How is an option with an ITM break even a waste of money? He could exercise immediately and profit at that point.

While, yes, ultimately costing a total of $12k if exercised, he can write calls while only putting up $8k instead of $12k without exercising.

He can bring down the cost basis lower by selling covered calls and not be a dipshit with naked calls.",2,0,1615256172,checkycheckster
19,gqa7ybg,"Because you can’t sell fully covered calls with 75 shares and make more money, my man.",3,0,1615256232,checkycheckster
20,gqa8hgu,[deleted],1,0,1615256521,[deleted]
21,gqa8y61,If you cared to sell covered calls just buy the 100 shares. If you are PMCC ing the fuck are you going to use an option that’s 75% of your cost basis for a delta that’s basically shares. It’s just a poor way of using leverage while incorporating an expiration that inherently adds risk with no real upside compared to just having shares even if less than 100,4,0,1615256773,Hank-TheSpank-Hill
22,gqa94lc,"1 🐒 Weekly options are for the pros, degenerates, and pro degenerates.

2🚀Longer dated options are better, I usually try to buy expiration date 60+ days out from when I intend to sell.. so, if I think aaple is going up to 150 in april, I'll buy June calls around that strike and sell them around April. This of course depends on how the stock moves until then, but the point is theta accelerates closer to expiration and expiring OTM is no fun. Give your smooth brain some runway for the call to get ITM. 

3 🦍The strike and cost you posted puts a wrinkle in my smooth ape mind because autists can sometimes have reasons to buy deep ITM calls, but those autists have reasons for such things that escape your regular ape mind.

4 🦍🦍Why the fuck would you buy deep ITM calls where your premium is almost 3x your strike? So you can lever up from 30 shares to 100? To my autismos, there are valid reasons to do this that escape me, Im aware of that. Just buy the dips if you want to 

5 🚀🚀OTM and ATM are how you make tendies on calls. deep ITM calls tend to move like stock. And you don't get any dividends if you're positioning yourself with LEAPS. And you're cost basis is fucking wonky because you're premium paid for the call is is disproportionately Intrinsic value and not extrinsic. At expiration all extrinsic value is melted away and Intrinsic value is what's left over. If you're buying in at 70% the FMV, I wouldn't do that, but if I did I would just buy stock dips and average in paying attention to ex-div dates.

Edit: 🚀🚀🦍💎 last one,
If you're wanting to lock up capital on a long call like this, why not gain more exposure by buying closer ATM so you can get more contracts? 

What I've found with newbies is they think they can buy deep ITM calls because then they minimize their downside losses because they have a lower strike price. That's not the right frame of mind for a lot of reasons, one being that you're pricing in the trade going against you. If you are more risk averse and want to price in a trade going against you, use an iron conder or PMCC, or debit spreads, or any of the other risk mitigation techniques to do so. 

Buying deep ITM calls is not risk averse, it's just stupid outside of a more robust trading strategy. I eat crayons so I don't fuck with them, but I know enough to tell ya that if you think the price is going up but you don't have a price target, and you don't know when, go ATM further out then you think. The wings of Elon will protect you so long as your price in your smooth brain and give your calls enough time to get in the direction you think it'll go.",2,0,1615256870,prodigalHernia
23,gqa99uq,"Because I have 8k and not 12, duh?",3,0,1615256949,checkycheckster
24,gqa9ctr,You are dumb fuck if you don’t have the money don’t do it not just do a stupid play.,-2,0,1615256994,Hank-TheSpank-Hill
25,gqa9oym,PLTR LEAPS are a great way.,1,0,1615257177,Sp00dge
26,gqaab26,"If you look at Nancy Pelosi’s portfolio it’s usually always LEAPS, and she was green even after the COVID crash.",1,0,1615257513,whackholez
27,gqaah2w,"I’m not saying I’d buy the same option as OP, but what OP is suggesting isn’t some crazy cookamommy bull shit. He’s got the wrong long call picked IMO, but the theory is the same.  

1.) Buy deep ITM call
2.) Sell OTM calls
3.) Profit.",4,0,1615257607,checkycheckster
28,gqadbjp,"i often buy calls for over a year out, so i can hold for a year to save that 15% on long term capital gains. 

its been very successful for me",1,0,1615259182,deweydecibels
29,gqaf08n,[removed],1,0,1615260117,[deleted]
30,gqaflo9,[removed],1,0,1615260455,[deleted]
31,gqagdzo,He’s in the right place to get the help he’s looking for,1,0,1615260900,midline_trap
32,gqagq0a,Lol. You like to gamble rather than invest eh? Do you,1,0,1615261091,99amgc55
33,gqagsj2,"The problem with leap spreads is if the underlying stock moons, early, your spread doesn't mature fully. I'm not sure what term I should be using or what greek was the major influencer... I had a 3 month out spread rip through the two legs where both are deep ITM, but the spread was only worth  worth a little over 1/3 of it's possible payout. This was a high IV stock, and that might have played  into why the gaps didn't close? Anyways, I believe spreads are best when you nail the exit time vs getting an early moon.",1,0,1615261131,lxnch50
34,gqahb72,"Lol, u didn't learn not buying options the first $10k around? If you really lost $350k in the market, take his advice and seek help... Or just give me half of your future losses rn and let me kick u in the balls... Saves you time and money for the same feeling...",2,0,1615261424,99amgc55
35,gqak0xf,"Lol noted. I’ll take you up on this if I fail to learn my lessons... and I didn’t loose any, over all I’m up many many thousand, but I didn’t realize those gains. Nbd, easy come easy go.",1,0,1615263023,Genome1776
36,gqak4xt,Doesn't need to be that deep itm.  Like $10 to 15 under current price would probably be fine.,1,0,1615263092,neothedreamer
37,gqanhb7,[removed],1,0,1615265179,[deleted]
38,gqao8tc,I’m doing weeklies as a 🌈🐻. Ez monies,1,0,1615265685,Nikkosaurus
39,gqavdug,"If you dont feel like giving money and still want the free kick to the balls , I can ask my wifes bf . He has really big feet .",1,0,1615270907,newportsnbeerxboxone
40,gqb4lna,"buying very deep ITM calls is useful when you're extremely bullish on a stock. It allows you to essentially own 100 shares of a stock without actually putting up the capital to buy them in the first place. That way, you have your capital freed up to make other plays in the market. So, sure, even if the premium for a very ITM call is high, if you're bullish and things go your way, you will hopefully land at the break-even price if not higher, at which point you can exercise later. After the break-even price, your profit will move just as if you actually owned the stock!  
In other words, you pay a premium for someone to hold a stock for you while you can make more moneyz off your actually capital.",1,0,1615279227,FsPhys
