,comment_id,text,score,awards,timestamp,author
0,gqem7hw,"If they bought shares to hold long, they’d drive the price up. Then when they sold to achieve said profits they’d still have to cover the shorts at the higher price

Do the maths, it nets them the same as covering —- they can’t get out of this, especially because they shorted it well over 2x all the shares that exist lol",12,0,1615345144,le_norbit
1,gqemeoi,"Eat my dongus you fuckin nerd.

*I am a bot, and this action was performed automatically. Please [contact the moderators of this subreddit](/message/compose/?to=/r/wallstreetbets) if you have any questions or concerns.*",3,0,1615345256,AutoModerator
2,gqemeo3,"Because they still have to buy the shares to cover their shorts, their long position will be negated due to the loss from the squeeze.  Plus who will be buying when the price is over 500k besides those who have to?  Go read the DD stickied on the sub specifically for this ticker.",2,0,1615345256,I_Love_Polar_Bears
3,gqemfqc,[removed],1,0,1615345273,[deleted]
4,gqemg6t,Gladly ❤️,2,0,1615345280,I_Love_Polar_Bears
5,gqemiyh,[removed],1,0,1615345324,[deleted]
6,gqemqfc,"Yeah. They tend to buy long to cover their position.

Thats whats happening now, possibly.",2,0,1615345438,Kilgoth721
