,comment_id,text,score,awards,timestamp,author
0,gqgyryr,[removed],1,0,1615398450,[deleted]
1,gqgyrxq,I AIN’T SELLING!! 🙌🏻💎,5,0,1615398450,Margaritamigo
2,gqgyrxx,Oh boy look at me saving all this money buying the dip on the latest GME discount!,6,0,1615398450,SUDDENLY_VIRGIN
3,gqgyrys,lol did you look at the chart?,0,0,1615398450,hdeck
4,gqgyrx8,"Do not get weak now, this is a War! BUY BUY BUY",1,0,1615398450,3eepwood
5,gqgys01,4 consecutive fucking halts,7,0,1615398450,fighterpilot248
6,gqgys0j,[removed],1,0,1615398450,[deleted]
7,gqgys06,IT JUST GOT HALTED WHILE IT WAS GOING UP WHAT THE FUCK,9,0,1615398450,Jequioloinks
8,gqgyrxl,[removed],1,0,1615398450,[deleted]
9,gqgyrwv,Ah yes perfect now I got the “you should sell GME it dropped” from my MarketWatch,7,0,1615398450,Odd_Tomatillo
10,gqgys05,BUT THE DIP,1,0,1615398450,Quelcris_Falconer13
11,gqgys0i,[removed],1,0,1615398450,[deleted]
12,gqgys0m,[removed],1,0,1615398450,[deleted]
13,gqgyrwr,[removed],1,0,1615398450,[deleted]
14,gqgys0n,Wonder how many paper hand bitches this has just cleared out 🤔 I’m gonna piss myself when it slingshots,5,0,1615398450,Keanos_Beard
15,gqgyryl,[removed],1,0,1615398450,[deleted]
16,gqgyrws,Did they just resume and halt again in a matter of 5 seconds?,11,0,1615398450,poopNgriddles69
17,gqgys0c,This is just a stage separation as we exit earth's orbit and set up thrusters to the moon right?,4,0,1615398450,PoptartPilot
18,gqgyrxz,[deleted],1,0,1615398450,[deleted]
19,gqgyrxo,and back up we go!,5,0,1615398450,AlwaysColdEric
20,gqgys43,[removed],1,0,1615398451,[deleted]
21,gqgys4d,Let’s gooooo 💎💎💎💎💎🙌🙌🙌🙌🙌🙌,2,0,1615398451,Larrybirdsuncle
22,gqgys1i,He bought?,4,0,1615398451,Shamamblers
23,gqgys29,"Get on, this is about to go right back up",9,0,1615398451,gggayppporn
24,gqgys2p,[removed],1,0,1615398451,[deleted]
25,gqgys37,This is a war lads. Don’t let the fuckers win.,11,0,1615398451,mechapaul
26,gqgys1d,It’s coming back boys buy the dip,8,0,1615398451,beepboopbop65
27,gqgys17,Starting to bounce back 🤝,5,0,1615398451,mychemhatepage
28,gqgys40,It’s called Game STOP because all it does is stop the stock market,5,0,1615398451,screwyouguys4351
29,gqgys28,"I just bought another share of this stock, which I like.

&amp;#x200B;

Does that make me a lunatic?   


No it makes me an ape. Pass me a crayon.

&amp;#x200B;

\*Not financial advice, apes can't use computers\*",8,0,1615398451,ExiledSixus
30,gqgys3g,"   
This dip is only artificial. They only want to scare us and to make us panic",1,0,1615398451,BriskaN
31,gqgys3a,"$150 price drip in literally 10 minutes isn’t us selling, this is an attack. 🦍 Strong!!!! Buy the dip! Discounts all around you filthy apes",24,0,1615398451,Kaden1420
32,gqgys39,[removed],1,0,1615398451,[deleted]
33,gqgys44,Lol you think they’ve just won?,1,0,1615398451,Angrybob21
34,gqgys21,Was going to buy at 198 but was thinking it may drop immediately again. Now went up. Will see once buffering is over.,9,0,1615398451,trennsport
35,gqgys2r,[deleted],2,0,1615398451,[deleted]
36,gqgys4f,"I'm here with my 1 share @ $96 munching popcorn, I like this ride",3,0,1615398451,haddest_matter
37,gqgys8n,Did they just halt trading again?  It barely even moved that time.,10,0,1615398452,Daethalion
38,gqgys8e,"Yes, within the span of a few minutes the price fell $150+

There is literally no way that retailers did that.",4,0,1615398452,My_Secret_Sauce
39,gqgys8c,Why would it halt again? Only went up 2%,19,0,1615398452,MarcLava9014
40,gqgys9b,No Ape is left behind!,1,0,1615398452,Linkaex
41,gqgys86,so did the major shorters just blow their entire arsenal on one attack?,10,0,1615398452,_Elrond_Hubbard_
42,gqgys8p,I'm insanely disappointed. This is just gross,4,0,1615398452,darkneji12
43,gqgys5o,[removed],1,0,1615398452,[deleted]
44,gqgys6h,[removed],1,0,1615398452,[deleted]
45,gqgys6i,"Do I have any GME stock? No.

Do I still come to every GME thread to read every comment? Absolutely.",50,0,1615398452,WarEagle9
46,gqgys56,ALL THREY DID WAS PUT THE PRICE BACK DOWN TO YESTERDAYS. THIS DOESNT SCARE,23,0,1615398452,killhill06
47,gqgys5g,Regrets. Nothing but regrets because I’m too greedy,3,0,1615398452,ThirdAltAccounts
48,gqgys4x,[removed],1,0,1615398452,[deleted]
49,gqgys5y,This is so much fun,9,0,1615398452,ThizzWhatitiz
50,gqgys5u,How can they do this?  How can they just get it halted to fuck with stop losses?  Bogus.,1,0,1615398452,Coppatop
51,gqgys4v,HERE WE GO APES,1,0,1615398452,brightladdy
52,gqgys7j,[removed],1,0,1615398452,[deleted]
53,gqgys7c,[removed],1,0,1615398452,[deleted]
54,gqgys75,"THANKS FOR THE SALE MELVIN, I just dumped all my other stocks to buy more GME",1,0,1615398452,2n2u
55,gqgys7q,[removed],1,0,1615398452,[deleted]
56,gqgys6m,...and it's gone......for now.,1,0,1615398452,PlausibleDeniabiliti
57,gqgysde,"4 halt in less than 10 min, wtf? FUCKING CRIMINAL.",7,0,1615398453,Puzzleheaded_Gift_18
58,gqgysd7,[deleted],1,0,1615398453,[deleted]
59,gqgysa5,Don't forget to let the hedgies eat your ass on the way to andromeda,6,0,1615398453,BearlyWizard
60,gqgysaa,I’M NOT FUCKING LEAVING,1,0,1615398453,whagarman123
61,gqgysa4,"THE SHORT SQUEEZE IS INEVITABLE 

IF THE DIP IS SCARING YOU THEN GTFOH

HOLD THE LINE AND BUY THE FUCKING DIP YOU RETARDS",15,0,1615398453,ratchetneega
62,gqgys9o,Caught the dip and bought more when the halt lifted twice now. I can do this all day.,6,0,1615398453,ScientisticalMystica
63,gqgysar,EVERYBODY HOLD THE LINE 🤑🤑🤑,11,0,1615398453,BladedAlpha
64,gqgysd4,Just checked the chart - huge dip back to low price before blast off 🚀🚀,1,0,1615398453,Jealous_Pass_7985
65,gqgysbc,I already held from 380 down to 40... why would I bail this time around?,15,0,1615398453,FollowDasFUhrer
66,gqgysbx, Like this is NOT market manipulation???,2,0,1615398453,Maxitraxxter
67,gqgyscb,Sameeee. Thats so fucking wild. Scary asf. But we aint paper hands we gonna hold till the tendieman takes us to the sun,1,0,1615398453,peepeepoopoo1017
68,gqgysc9,Why are the halts upwards so small compared to low it's allowed to drop?,11,0,1615398453,pottypotsworth
69,gqgysd2,Why?,1,0,1615398453,HouseDowningVicodin
70,gqgysbo,I won’t sent . I’m shaking but I’m not selling shit.,1,0,1615398453,Dkonpas
71,gqgysc0,Thanks hedgies. I wanted to lower my cost/share price a bit more anyways.,7,0,1615398453,The_Count_Von_Count
72,gqgysdj,[deleted],1,0,1615398454,[deleted]
73,gqgysdn,Huge buy at 203,6,0,1615398454,pixelwalrusca
74,gqgysek,Hahaha not even open for a minute ![gif](emote|free_emotes_pack|feels_good_man),1,0,1615398454,Just_an_Empath
75,gqgyseh,i haven’t sold when i bought in at $254 months ago. They think i’ll sell now lol,5,0,1615398454,SgtPepper7
76,gqgyse9,"#HOLY MOLY!!


*I am a bot, and this action was performed automatically. Please [contact the moderators of this subreddit](/message/compose/?to=/r/wallstreetbets) if you have any questions or concerns.*",2,0,1615398454,AutoModerator
77,gqgysf6,"Don't worry guys, it's just the mail in ballots coming in",3,0,1615398454,frankalliance
78,gqgysfe,This was a GREEN halt---halt UP,3,0,1615398454,Gallow_Bob
79,gqgysfi,THE DIP BEFORE THE SQUEEZE,8,0,1615398454,kscavoni
80,gqgysfd,"DFV is not happy lol

https://twitter.com/theroaringkitty/status/1369706302222503940?s=21",18,0,1615398454,Louieando
81,gqgysfj,[removed],1,0,1615398454,[deleted]
82,gqgysf9,If it dips again I’ll just buy more 💎🙌 I’ll tell you what I want for my shares,1,0,1615398454,Purple_Metal_9218
83,gqgysf3,which one of you mad lads picked up the firesale?,9,0,1615398454,CommieSuperSaiyan
84,gqgysgr,"I was born in the red, moulded by it",1,0,1615398454,rnlh
85,gqgysgj,HOLY MOLY APE BUY MORE SHARE 🐵🐵,6,0,1615398454,luffarpricken
86,gqgysh4,"#HOLY MOLY!!


*I am a bot, and this action was performed automatically. Please [contact the moderators of this subreddit](/message/compose/?to=/r/wallstreetbets) if you have any questions or concerns.*",2,0,1615398454,AutoModerator
87,gqgysgb,[removed],1,0,1615398454,[deleted]
88,gqgysk3,"🧻👐 bitches, wtf",6,0,1615398455,Data_Dealer
89,gqgysk1,From 150 back to 200 in 30 seconds (ignoring halts) LETS GOOO,9,0,1615398455,A_wild_putin_appears
90,gqgysjn,*furiously scribbles* WRITE THAT DOWN WRITE THAT DOWN!,14,0,1615398455,bullet494
91,gqgysi9,[removed],1,0,1615398455,[deleted]
92,gqgysht,Because it's an incredibly volatile stock,1,0,1615398455,Thosepassionfruits
93,gqgyshg,yes pls,1,0,1615398455,AlmondBoyOfSJ
94,gqgysiy,But wait! There’s more!,2,0,1615398455,legs_y
95,gqgysig,WHAT IF I PANIC BUY?,1,0,1615398455,EndlessSummerburn
96,gqgyshd,halted again for the 5th freaking time are you kidding me,2,0,1615398455,sirnicholas14
97,gqgysje,[removed],1,0,1615398455,[deleted]
98,gqgysj5,LETS BLAST THIS MOTHER FUCKER OFF. DOUBLE DOWN DOWNS.,8,0,1615398455,curb_your_enthusiasm
99,gqgysn7,I'm sad :(,3,0,1615398456,TofuPython
