,comment_id,text,score,awards,timestamp,author
0,gqgpk77,"you forgot a zero, silly ape. For real. Stop selling yourself short. This is not financial advice, I just love this goddamn stock.",1,0,1615395056,Glamdryne
1,gqgpk6l,A small dip will chill everything out for a sec,0,0,1615395056,Organic-Date
2,gqgpk65,Tough to say. No real clear answers atm,1,0,1615395056,Givemepie98
3,gqgpk7s,Your contract has been sealed. Prepare to eat shorts from now to within next week,3,0,1615395056,songohan12
4,gqgpk7v,Jim Cramer stores his farts in a pickle jar and then huffs them every time GME hits a new daily high.,9,0,1615395056,bwn69
5,gqgpk61,MSM maybe but the financials are obsessed,1,0,1615395056,Myclothesarecurtains
6,gqgpk7u,All signs point to super fucked,1,0,1615395056,CovertMidget
7,gqgpk6f,Hedge funds are finding out what it's like to get a pap smear today,7,0,1615395056,forever_useless
8,gqgpk95,Holding for my doggo who has cancer surgery this Friday!,19,0,1615395057,Arali1
9,gqgpkbo,"It’s not worth it .. if you like liquor get a nice bottle of your  favorite ..

Most people will tell you most champagnes are all the same after a certain price",2,0,1615395057,Productpusher
10,gqgpka5,No apes left behind on this rocket,5,0,1615395057,whosaprettyboy
11,gqgpkbi,I averaged up today to $150/share and I ain't even fuckin mad.,1,0,1615395057,Heath1872
12,gqgpkb5,"Unless I am missing something, there really isn't much resistance on the way up through 360+",7,0,1615395057,daddyspain69
13,gqgpkbk,NO MORE BAG HOLDING BABY LETS GOOOOOOOO NO APE LEFT BEHIND,4,0,1615395057,No_Big8543
14,gqgpka1,"No this is probably gamma squeeze not short squeeze, MM need to buy shares for all the 300 dollar calls and higher.",2,0,1615395057,ZeGreatBobinski
15,gqgpkb8,jesus h christ,7,0,1615395057,Unboxer445
16,gqgpk9l,[removed],1,0,1615395057,[deleted]
17,gqgpk9s,"It's so great to witness the joy of everyone, and not see any of the doubters at all.",1,0,1615395057,TheGiftOf_Jericho
18,gqgpkar,"Two days ago a fling had ended and I was sad. 

Here I am today still sad but now I’ll be rich to buy a lambo to let her know what she missed out on.",10,0,1615395057,surfsoccerstocks
19,gqgpke5,Man that dog is going to have a good day today.,18,0,1615395058,Ectomorpheus_
20,gqgpkbu,HELL YEAH,1,0,1615395058,My_Cringy_Video
21,gqgpkey,[removed],1,0,1615395058,[deleted]
22,gqgpket,This shit will hit $350 in AH and pre market unreal,13,0,1615395058,Doctorbuddy
23,gqgpkex,"Alexa, blast this shit 🚀🚀

https://youtu.be/rejpDqQUcV0",7,0,1615395058,Reilly896
24,gqgpkdi,I am down to 25 shares because I've been peeling some off on the way up so that I can get myself financially un-fucked. Paid off my house and our cars so far. I may just get myself the nicest gaming PC that money can buy.,10,0,1615395058,Hamilton_Quotes_Only
25,gqgpkd2,My bad for waking up at 5am to check gme price. Guess I ain't sleeping anymore...,9,0,1615395058,Eskerz
26,gqgpkdn,[removed],1,0,1615395058,[deleted]
27,gqgpkdr,Did you sell tho? T,1,0,1615395058,Wordperfectuser
28,gqgpkcv,My wife’s boyfriend is cumming rn,6,0,1615395058,mllgani21
29,gqgpkgw,75th Percentile of the VWAP is acting as support LOL. Never seen anything like it.,3,0,1615395059,CurtissVTwin
30,gqgpkic,Fat rails on the menu tonight everyone!,9,0,1615395059,Correct_Influence450
31,gqgpkft,The rocket came back for me!!! Hold now more than ever.,7,0,1615395059,Dahki
32,gqgpkg1,I got you on tape,3,0,1615395059,nagyabeni12
33,gqgpkia,[removed],1,0,1615395059,[deleted]
34,gqgpkif,"Seems like a weird reason to eat shorts for tomorrow’s dinner, but I’m not a financial advisor I just like games.",3,0,1615395060,ScottThompsonc107
35,gqgpklg,"Remember, set a stop loss a reasonable amount bellow.  Low enough that you don't get caught by a small dip, but high enough you don't lose all your tendies when it eventually drops back.

Then just keep updating it every now and then and ride the gravy train allll the way up.",13,0,1615395060,Lt_Duckweed
36,gqgpkl3,I really like their business model,2,0,1615395060,Legin_666
37,gqgpklo,"Let's bring you home soldier, but first we go to moon.",1,0,1615395060,jhonchaos
38,gqgpkjr,[removed],1,0,1615395060,[deleted]
39,gqgpklj,If vlad does that we will have to personally find him and take our tendies ourselves. Especially after they took the fucker to court.,1,0,1615395060,BasicAd3899
40,gqgpkjz,[removed],1,0,1615395060,[deleted]
41,gqgpkj6,Just imagine the tax returns coming in real soon and the stimmies 💎🙌 🚀🚀🚀🚀🚀🚀🚀🚀 hold strong,14,0,1615395060,Purple_Metal_9218
42,gqgpko8,Fuck yeah,1,0,1615395061,Darx97
43,gqgpkoi,SAME,2,0,1615395061,ah163316
44,gqgpkob,"&gt;  I'm 10k richer.

only if you sell",1,0,1615395061,likewhatalready
45,gqgpkmw,"# 300 bag holder gang we came to your rescue. Next, we shall save the 450 bag holders. #LeaveNoAutieBehind",45,0,1615395061,chodmode2
46,gqgpkoz,[removed],1,0,1615395061,[deleted]
47,gqgpkma,I double dare you,2,0,1615395061,Ingrimsch33
48,gqgpkp1,[removed],1,0,1615395061,[deleted]
49,gqgpkqr,Bwaahh bwaaahhh bwaaaaaaahhhh bwaaahhh bwaaahhhhhhhhh,2,0,1615395062,Dayngerman
50,gqgpkpg,420.69,1,0,1615395062,whomstd-ve
51,gqgpkrq,[removed],1,0,1615395062,[deleted]
52,gqgpkq4,That’s the kind of retarded shit I like to see,3,0,1615395062,ItsDrap
53,gqgpkrt,That score on the left side though? 10K CONFIRMED,2,0,1615395062,_Elrond_Hubbard_
54,gqgpkpz,[deleted],7,0,1615395062,[deleted]
55,gqgpkrx,I hope you retards won't actually sell at 420.69$ as a joke and cause a massive crash! 🦍🦍🦍,20,0,1615395062,Cyrlop
56,gqgpkrl,[removed],1,0,1615395062,[deleted]
57,gqgpkv9,He will go down in the history books for sure. 🚀,1,0,1615395063,Cris15569
58,gqgpkup,"The only thing that could make this better, since I wasn't able to jump on until waaaay too late to make the kind of coin a lot of you are, is if they pushed it back down to $40 again and gave me time to refuel before having it launch back up for the return trip.",-1,0,1615395063,spaceman757
59,gqgpkuh,"Fingering their own 🌈🐻assholes, using their own tears as lube.",3,0,1615395063,pfshfine
60,gqgpksw,same lol,1,0,1615395063,Redman2009
61,gqgpksp,[removed],1,0,1615395063,[deleted]
62,gqgpksr,So yeah if we maintain stable ship until the weekend next week is gonna be apeship,7,0,1615395063,Whoooooop92
63,gqgpksn,it's really gnarly now but friday is when shit gets real right?,7,0,1615395063,gydot
64,gqgpkvk,[removed],1,0,1615395063,[deleted]
65,gqgpksf,Convinced my coworker to buy in yesterday at 240 and he is currently happy as a clam.,2,0,1615395063,AcidTripAndABongRip
66,gqgpkub,Yes but I’m talking about people who won’t sell,1,0,1615395063,Clev_Man32000
67,gqgpkte,I love all you smooth-brained apes.,11,0,1615395063,cackalackattack
68,gqgpkx2,[removed],1,0,1615395064,[deleted]
69,gqgpkwo,[removed],1,0,1615395064,[deleted]
70,gqgpkxw,HELD THIS SINCE LAST MONTH AT 350 FUCK YOU IF YOY THINK IM SELLING FOR ANYTHING LESS THAN A LAMBO,19,0,1615395064,_DUMPEMOUT_
71,gqgpkyy,"Huh, cool, I was back in the green for a second for the shares I bought at $330 a while back",12,0,1615395064,pirhanaconda
72,gqgpkyu,lots of resistance at 330,6,0,1615395064,Zomoco
73,gqgpkw4,""" Oh yeah all the hedge funds that shorted GME at 400 are really hurting and just dying to cover their position......... "" - This guy on r/stocks 2 days ago saying GME is a pump and dump",9,0,1615395064,Cheeseman527
74,gqgpky5,[removed],1,0,1615395064,[deleted]
75,gqgpl0x,IT’S THE 69TH DAY OF THE YEAR LETS GET THIS BAD BOY TO 420 🚀🚀🚀💎🙌,22,0,1615395065,Notgaybutlovemiatas
76,gqgpl24,should I buy more now or no,17,0,1615395065,Renz95xx
77,gqgpl02,[removed],1,0,1615395065,[deleted]
78,gqgpl2b,This isn't even the squeeze IM DEAD HAHA,28,0,1615395065,ImActuallyUseless
79,gqgpl2s,"Crayon eaters, how we looking? Where we going?",16,0,1615395065,golobanks
80,gqgpl16,"Cancel your limit orders, we're going to fucking Pluto",25,0,1615395065,preafericitulChiarEl
81,gqgpl0v,[removed],1,0,1615395065,[deleted]
82,gqgpl5s,Maybe because they’re actually scared this time,1,0,1615395066,MarijuanoDoggo
83,gqgpl5n,[removed],1,0,1615395066,[deleted]
84,gqgpl75,[removed],1,0,1615395067,[deleted]
85,gqgpl6f,We come for the 800$ call itm fireworks 🎆 then it will shoot into the thousands,10,0,1615395067,MajorDiamondHands
86,gqgpl6a,just bought in bc i’m a goddamn idiot. let’s go,25,0,1615395067,peepeetipi
87,gqgpl86,[removed],1,0,1615395067,[deleted]
88,gqgpl61,"Same here buddy, came in at 307 and basically went straight down.",1,0,1615395067,astabooty
89,gqgpl7r,"Remember 18 days ago when this stock was at $40 and shills were laughing, saying the stock is going to bleed back to $5.00?

Who the fuck is laughing now? We coming for your god damn homes now.",64,0,1615395067,2ezyo
90,gqgpl8o,Keep on shorting us this rocket is unstoppable,18,0,1615395067,South_Return5156
91,gqgplc0,[removed],1,0,1615395068,[deleted]
92,gqgpl9p,tried it with my cats now my hands are covered in fur,1,0,1615395068,Westlin
93,gqgpl96,No. The ITM calls are triggering gamma squeezes.,1,0,1615395068,Lentil-Soup
94,gqgpl9c,This is your chud baby. Thank you.,2,0,1615395068,SWEET_BUS_MAN
95,gqgple9,You wear that fucking shirt until August. Do you understand your mission?,3,0,1615395069,foolishidot69
96,gqgplcw,I need a new neck,1,0,1615395069,Buttscritch
97,gqgplc8,Jesus christ i thought i was gonna be a productive member of society today and set alerts but shit keeps going off,32,0,1615395069,YourTypicalFriend
98,gqgplci,"&gt; Also why is there no “ladder attack” 

I'm thinking the same thing. Maybe they see there is no use because of all those diamond hands",1,0,1615395069,p4lcic4
99,gqgplge,"I says to 'em i says, ""I gotta bag you could hold right here, botta bing.""",1,0,1615395070,explosivelydehiscent
