,comment_id,text,score,awards,timestamp,author
0,gqbosb2,[removed],1,0,1615296144,[deleted]
1,gqboyx0,[removed],1,0,1615296250,[deleted]
2,gqbp4rp,"Same boat, I ended up buying enough at $40 to get down to $207 average, hindsight is a bitch.",1,0,1615296345,vizzoor
3,gqbq5e5,[removed],1,0,1615296923,[deleted]
4,gqbqy8x,"Hey man I feel you I don’t have the capital to really make big stacks off of this, but I’m working part time in an economically depressed area to try and get enough experience for a better job in the cities, and even making a few grand off my couple of shares would do wonders. 

We’ll be able to play with the big boys someday. For now clutch that banana",1,0,1615297362,DisgruntledTexansFan
5,gqbremd,"I followed this sub for a long time because it was hysterical to see how retarded traders are. Knowing nothing about finance or stocks, I decided it was a great time to start an account and throw money at shit and see what sticks. 

First couple of weeks I bought high and sold low because I was trying to learn “patterns” but now I see all of that is just bullshit. A lot of it is just about fucking the other guy and the gains will happen naturally. 

GME has been a great learning experience.",1,0,1615297613,ghostx78x
6,gqbt77x,"You guys are playing with the big boys. You just don’t know it yet. 

Making money in this game is a statistical anomaly. Clutch those bananas hard. 

Whatever you want to call it...conviction, perseverance, strength in the face of adversity, or pure autism...

You guys have it.",1,0,1615298555,cmmckechnie
7,gqbtogd,I’ve been investing in the market for over 20 years.  I’ve learned nearly as much in the last 2 months as I have my whole time investing,1,0,1615298810,BillMahersPorkCigar
8,gqbtt2u,"Stay Humble, the gravy train is coming",1,0,1615298879,coldboyz
9,gqbvw6g,[removed],1,0,1615299932,[deleted]
10,gqbvyrb,"Similar here. Got low number but avgd out @ $153

Wife wanted to chuck more in at the dip, but my balls weren't big enough - thats on me.

Still on board this crowded rocket",1,0,1615299964,Pro_Moriarty
11,gqbzrjf,[removed],1,0,1615301697,[deleted]
12,gqc01tu,"First share at $272 to be part of the movement....then bought 8 more to get my average down to $140. At $40 I really wanted to buy....but my balls hadn't dropped, at about $48 my balls dropped and I bought 42 shares to have 50 at $62 per. Then bought last share at $151. So I have 51 shares an an average of $64. 

Really hoping to see this thing BLOW UP to $1000.....more than that?? I dont know but it's been a fun ride and profitable....eventually",1,0,1615301813,tim24601
13,gqc06iu,lost some on the way but thank goodness for other diamond handed apes back in the game hehehe ![gif](emote|free_emotes_pack|sunglasses),1,0,1615301864,-jujubean-
14,gqc1iyp,You could have easily missed the train if you didn't buy in at 207 if you think of it that way. If trading wasn't haulted I think we would have seen 1k on first run and I don't think this second one would be happening.,1,0,1615302421,eblackham
15,gqc3it9,Was that a prequels reference!?,1,0,1615303251,AgainstTheDark
16,gqc44f2,Started at 306 average . Crashed . Averaged down all the way to 80 . Started to take off . Bought more an average is now 105 . Boy does it feel good my fellow apes 🚀🚀,1,0,1615303477,Jpharmz
17,gqc56xg,[removed],1,0,1615303910,[deleted]
18,gqc5854,[removed],1,0,1615303923,[deleted]
19,gqc85we,"Both my friends went hard in GME and then paperhandsed it when it started to drop. I'm holding a measly 1 share at $195, but now I'm the only one of the crew on the way to the moon. Sometimes being clinically braindead and cheap can pay off.",1,0,1615305066,AHappyCat
20,gqc8jao,[removed],1,0,1615305218,[deleted]
21,gqcafit,Damn that’s impressive. I’ve only been trading for a month but I’ve watched The Price is Right on TV my whole life and I’m really fucking good at it.,2,0,1615305948,ghostx78x
22,gqche0f,&gt;Hello there!,2,0,1615308486,iwantedthatwaffle
23,gqcjysb,Can you PM me next time you think about buying? It's for a friend who needs to know when to sell,1,0,1615309447,esreverengineer_
24,gqcp2ax,"So many people wish they had the courage to  buy at 40$, myself included.",1,0,1615311677,vbfx
25,gqcplyi,"Overall I’m down $3000 right now after starting with $16000. After taking the (unrealized, I know ) hit by not executing my plan of taking small gains on items at ATH, by holding to see if it goes up further, I lost the courage to buy when poeple were doubling down and buying at $40.
 Bought another at $242.",1,0,1615311913,vbfx
26,gqcq1h5,1 ticket to the moon is better than no tickets to the moon.,2,0,1615312101,Montagemz
27,gqcqym0,"That one share could be worth $1,000,000 by the time the apes rule Mars.",2,0,1615312502,Deesco5
28,gqd0qu7,[removed],1,0,1615317052,[deleted]
29,gqd43h5,"It seems like loads of people are experiencing this today. It bought at the peak and averaged down, and now I'm actually making some profit from it!",1,0,1615318560,_Gandalf_the_Black_
30,gqd6qvy,"Averaged my 2 shares at 360 to 13 shares at 137, feels good. Just keep it coming. I am out of money, so I can't sadly average up lol",1,0,1615319752,tomas_f
31,gqdh3rd,"Not to be that guy, but you haven't made a penny until you sell it.",1,0,1615324342,marks1995
32,gqfpwej,General Kenobi!,1,0,1615376937,AgainstTheDark
