,comment_id,text,score,awards,timestamp,author
0,gqj3pkc,There's simply NO WAY that they're holding onto that many shares.,12,0,1615434477,willpowerlifter
1,gqj3qss,$3k contract that I wish I could buy for 1k at this point,8,0,1615434494,Capernikush
2,gqj489k,"This author is also claiming that the short squeeze is essentially over and that everything right now is a gamma event, which is likely untrue. It's a mix of the two.",18,0,1615434819,willpowerlifter
3,gqj48ox,Theres no way they have that many shares!!! No way weve been sitting on them holding along with a bunch of instutional investors!!,7,0,1615434827,jopoole84
4,gqj4f9j,[removed],1,0,1615434951,[deleted]
5,gqj5lrp,[removed],1,0,1615435724,[deleted]
6,gqj68vh,"""The Swarm Factor - The old market networks operated (legally or otherwise) with perhaps a few dozens of participants; the Reddit’s r/wallstreetbets is said to have 9.4 million members. If even a fraction of them coordinate their efforts, they can overrun the market.

This leverage has changed the game. It will be “interesting” to watch as traders probe the market with this new instrument, to find out what it can really do. I’m not sure they even know yet what power they have.""

🦍 Apes Stronk Together 🦍",6,0,1615436114,metalupyourazz
7,gqj6gw7,Not True. Every ETF with it is shorted to oblivion. They are just stripping it out of the ETFs so I doesn’t show as short interest. But peek the SI of those ETFs. It’s so obvious.,10,0,1615436250,KyFly1
8,gqj6ksg,"note the shrewd way they are shifting the terminology from ""squeeze"" to ""swarm""

this opinion piece is a C-4 wrapped in a giant banana skin",10,0,1615436316,nomad80
9,gqj6mgz,"It's a mix of the two, but I bet a lot of the current short interest is from the meltdown from $483 to $300. We've gotta jump a bit more to get those guys sweating, assuming they haven't covered yet.",9,0,1615436344,ethandavid
10,gqj7o42,I mean people can say that the author convinced them to buy those calls which would be a giant uno reverse card if the intention was negative.,3,0,1615436985,BVdubs
11,gqj7rqd,it would be hilarious if this backfired as well,3,0,1615437047,nomad80
12,gqj8flb,[removed],1,0,1615437465,[deleted]
13,gqj8ibr,I tried to get some cheap calls during the dip but I wasn’t about to market order and volatility meant by the time I clicked buy the order was doa,2,0,1615437512,tunafun
14,gqj8jak,"$420,690 is not a meme",2,0,1615437529,xDsmiLesCx
15,gqj8m8u,Ape strongest together market manipulators bad APE FIX MARKET!!🦍🦍,5,0,1615437580,jopoole84
16,gqj9yv8,Reddit “swarm”...it’s honestly cringe,1,0,1615438480,STONKZgodownonme
17,gqjcr2g,"Forbes is shit, buuutttt i like what theyre saying, so that makes them a trustworthy legitimate source",1,0,1615440187,ShyftyyIV
18,gqjeq4k,"the author ain't stupid

yet he describes afterwards what has been posted here as DD by several really intelligent people.

By calling eachother 'retards' I think this is a classic example of an army (MM/HFS) severely underestimating its 'enemy' (wsb in general, dfv in particular setting this up)

You won't be underestimated from now on. Even when they'll use the media to describe y'all as sorry retail gamblers who should leave them alone in their WS bubble

Guys: if you and I didn't stick it to 'em, you and I  sure showed them",2,0,1615441272,iamjustinterestedinu
19,gqji7bf,[removed],1,0,1615443350,[deleted]
20,gqjiqwg,[removed],1,0,1615443666,[deleted]
21,gqjkh8p,The real question is in which direction?,1,0,1615444701,8an5
22,gqjnka8,"&gt;Reddit’s r/wallstreetbets is said to have 9.4 million members. If even a fraction of them c-o-o-r-d-i-n-a-t-3 their efforts, they can overrun the market

I'm not staying anything but.....",1,0,1615446660,FutureTyrant
23,gqjshpv,That would be hilariously delicious to watch.,1,0,1615449936,bchrzfg215
24,gqjsztv,[removed],1,0,1615450260,[deleted]
25,gqjt30x,[removed],1,0,1615450316,[deleted]
26,gqk4eb5,I was too lazy to buy a 285c for a premium of 7.00 back when it was starting to gain momentum again. That sucker would have been worth 7k at the peak yesterday :(,1,0,1615458772,Velocilobstar
27,gqk89f2,The thing I don’t understand is what bridged the gap between the first short squeeze and this gamma squeeze,1,0,1615461458,king-of-caterpillars
28,gql2t35,"The day before it went from. $50-100 I was looking at GME and was like should buy some options.. then was like nah, its not gonna go crazy again.... well... it went crazy again... and I knew it could go again..  Shoulda bought em as a just in case.. .. now kicking myself... again...",2,0,1615478736,pencilpushin
29,gql3eyd,I feel ya. Sold on the way down last time like a true retard. Bought back in but my break even point doubled from $250 to $500. One call could have wiped my losses. Oof,1,0,1615479011,Velocilobstar
30,gqnjbbl,[removed],1,0,1615520654,[deleted]
