,comment_id,text,score,awards,timestamp,author
0,gqe5adw,"I am planning on using etoro in the future, I have no experience right now.

I guess if we all buy enough well own GameStop outright.",2,0,1615336079,SupahBlue
1,gqe636j,Check out r/etoro it’s just as bad as RH and some people are even having trouble processing withdrawals. I would find an alternative if possible as they 100% are not reliable and will freeze buys and force sells when things get hot.,1,0,1615336503,Nyamzz
2,gqe6gyz,I am a bot. This Discussion does not look like it has generated enough approval to stay on /r/wallstreetbets.                                    We algorithmically cull certain submission flairs whose response is not above a certain threshold to try and keep the page clean.,0,0,1615336706,VisualMod
3,gqe6l9u,"My application on etoro wasnt cleared in time to bag hold the peak in Jan but haven't had any issues (so far) trading on etoro in the last month. But this isn't financial advice, I'm not even an ape. Just a monkey playing around on the edge.

I'd imagine any financial service would do what it takes to protect themselves from massive volatility that poses a threat. Only put in what you can afford to lose mate. Its a fun flutter.",1,0,1615336768,theknightone
4,gqe7spr,"I have no problem losing money if my investment fails, which is far different from losing money because a service fails at the exact time it mustn't.",1,0,1615337401,nicosomma
5,gqe8nra,[removed],1,0,1615337861,[deleted]
