,comment_id,text,score,awards,timestamp,author
0,gqdak9u,"100k is one share. I only have 5, so the others will go for 200k, 400k, 800, and the 5th, if I get anywhere close to the targets on the other 4? The 5th I get certified and hang on my fuckin wall.",2,0,1615321465,jnlroc
1,gqdanzr,"Why not buy a LOT of way OTM calls and let it ride way the fuck up as quickly as possible?

Would that not offset the losses?",1,0,1615321511,EverythingIsNorminal
2,gqdaodj,"This could have just been a market thing. A freak thing but a market thing. But the fact that they kept on is just obviously an attack. 

Too bad we have more apes.",1,0,1615321515,alxndrblack
3,gqdaq3x,"if they are in front of congress begging for bailouts, than that infers that I should be able to afford to donate money to a crack legal team that would defend the American people against those cretins.",2,0,1615321537,Often_i_am
4,gqdaq7i,"All the apes are on the pass line with a half hour roll and the HFs are just doubling down on the dont and don't comes, hoping we lose.",2,0,1615321538,lionheart832
5,gqdaun3,"You're probably right, since they took away the Buy button that one day to stop the squeeze/manipulate the ""free market.""

Good thing none of us use RH anymore, RIGHT EVERYONE!?",3,0,1615321592,actraiser2
6,gqdawk2,[removed],1,0,1615321616,[deleted]
7,gqdaxsy,"I respect the fight in you, man, but we will absolutely let it happen. We aren't like France setting things on fire because they *considered* reducing maternity leave. This population is exceptionally cowed and docile and will 100% allow any bailout to occur, despite some ruffled Twitter feathers and a milquetoast demonstration or two.",1,0,1615321631,123581321U
8,gqdb3bh,Laughed out loud at “fun hobby time”. Take my upvote you stereotyping ape,2,0,1615321697,indy_trckstr
9,gqdb4o0,If this post gets deleted it is proof that the short interest that is around 900%!!! GME will really hit at least 500k with these figures 🚀🚀🚀🚀,1,0,1615321714,flyingrubberduck
10,gqdb5wv,[removed],1,0,1615321730,[deleted]
11,gqdb7a0,Theyre working with gme,2,0,1615321747,Gym-rat321
12,gqdbd58,Thank god there was a tldr tldr. I was so confused,1,0,1615321820,SCHUUG
13,gqdbfgn,I tried to find it today but hit the buy button instead :/,1,0,1615321848,ImpressiveExplosion
14,gqdbgiy,[removed],1,0,1615321861,[deleted]
15,gqdbhus,"Come on bro we’re retards, not racists!",1,0,1615321876,FootyG94
16,gqdbi4o,[removed],1,0,1615321880,[deleted]
17,gqdbk4w,[removed],1,0,1615321905,[deleted]
18,gqdbq73,I agree there is money to be made with the talent. The current $16.5b valuation is too low in my opinion - the market doesn't understand the stock yet and what it could become.,1,0,1615321982,OneOfAwe
19,gqdbrxk,[removed],1,0,1615322004,[deleted]
20,gqdbxj2,Hah! I love this.  Just rent out the screen and set up a potato phone to livestream the screen the whole day.  Make it sideways but not autorotated for more lulz,5,0,1615322075,wildkarde07
21,gqdc17c,Im too retarded to understand this but basically what I'm hearing is hold?,1,0,1615322123,Mcstuud
22,gqdc290,[removed],1,0,1615322136,[deleted]
23,gqdc3w7,"Think of the most nepotistic, incestuous part of the US military.

Now that you're thinking of the Air Force Academy, you need to understand that wall street is worse. It is *made* by the nepotistic, inherited, dark power of wealth, not merely co-opted by it through religion or politics. It is a place where the intersection of power and competence is a *fluke*, not the norm, but because of the tools power gives, the consequences of incompetence are often trivial anyway.

That triviality can fuel an infinite quantity of arrogance. If nothing has the power to stop you... why stop?

Hopefully some of the establishment realizes that arrogance can be monetized, as well as retail investors. Last I checked retail held like twenty five percent what institutional investors controlled.",1,0,1615322157,Indon_Dasani
24,gqdc8rw,"On an absolutely different subject but interesting and sad, and very true.  Prior to having Lewy Body Dementia my IQ was 149, genius level and I was able to do the math you’ve done (excellent work btw) in my head.  I could multiply up to 5 rows of #’s (10,000+) faster than a calculator.  Now, adding 157+148 I can do correctly 3 of 5 times",1,0,1615322218,Thestockbroker22
25,gqdcba7,"I read, I buy. Thanks for thinking for me. 💰🚀",1,0,1615322249,grumpyoats
26,gqdcfdj,[removed],1,0,1615322300,[deleted]
27,gqdcgbn,"Nope. As far as I know its a normal practice and, as OP said, its how MMs make money (especially those that don’t have commission fees)",6,0,1615322312,MyLastIdea
28,gqdck3a,I better get my piss bottle ready.,1,0,1615322358,runtimemess
29,gqdckai,Good god the entire financial system is going to burn to the ground and we'll be trading sticks for stones as we punch trees to build new houses ala minecraft IRL.,2,0,1615322360,Geoclasm
30,gqdcmic,[removed],1,0,1615322387,[deleted]
31,gqdcyvo,"If you havent been paying attention to the government in the last few months, you might have confidence in them. However, if you have been paying attention, you'd know you cant trust them at any level, they are outrigh evil and rules dont apply to them nor the people they protect. Additionally, the media will absolutely cover for them if told to shut up and color for the sake of the hedgies. 

So if we can fuck them all in one big swoop, please make it happen",1,0,1615322542,lispychicken
32,gqdd0wo,[removed],1,0,1615322567,[deleted]
33,gqdd0yo,I like what I skimmed. I hodl. ✋💎🦍🚀🌛,2,0,1615322568,GrowUpAmericaDotOrg
34,gqdd19q,You mean 50k to 100k right? Im sorry I just saw your mispelling there.,5,0,1615322572,dundledorfx
35,gqdd5x7,[removed],1,0,1615322630,[deleted]
36,gqdd6mc,"Too many words, I'm just guna hold till a million",1,0,1615322639,Bazillebick
37,gqdd7nu,"Damn. I really want to buy more but I would be fucken' BROKE till payday. Guess I'll take my 4 shares and FUCKEN' HODL for that 10k floor
💎🙌",1,0,1615322651,Rhiis
38,gqddda3,"In your opinion, do you think  MOASS would still occur?  If so, what range would you predict to hit its highest peak?  And at what circumstance would that occur? Im not seeking financial advice.  Just wanted to pick your brain.",2,0,1615322723,Theforgottenman213
39,gqddgcc,[removed],1,0,1615322761,[deleted]
40,gqddkft,[removed],1,0,1615322811,[deleted]
41,gqddnuu,"Feels more like its the MM that is going to feel the pain. Shorters might see no way out, leverage all they can, and attempt to move the money where it can't be touched (the word we can't say here?). Shorters get the funds, MM is owed stock that will never come.",1,0,1615322854,appmapper
42,gqddseb,Hedge funds are just really big versions of wall street bets And since they have so much money they’re able to manipulate the market to actually make their stupid YOLO plays work,1,0,1615322910,aromaticsmeg
43,gqddsmp,"I think realistically it's going to go back to like $20. So they're betting that the squeeze is over and that it'll drop down again and soon. It's a pretty risky bet by them, to say the least.",1,0,1615322913,kevindlv
44,gqde4g2,"Bro bro I'm with you and I'm sure there are plenty of people with the exact same thoughts but the problem isnt the people. The last major crash due to ridiculous assfuckery was in 2008 during a people friendly administration and bailouts were aplenty. Last massive protest against inequality and the elite was Occupy Wall Street just a few years after that and it fizzled out after accomplishing next to nothing. What's really needed are people high up in government who are much more sympathetic to our cause and who can actually make wall street bleed. However without getting dark money out of politics that shit won't change because politicians don't like chopping off their own hands.  Bailouts will likely happen and the only lessons learned by Wall Street will be how to fuck us over in new ways. We do not have control because the people in power do not actually represent us.

I wish I lived in an America where what you are saying made sense.",1,0,1615323057,JdsPrst
45,gqde4gs,"You have done an excellent job at wasting my time.


*I am a bot, and this action was performed automatically. Please [contact the moderators of this subreddit](/message/compose/?to=/r/wallstreetbets) if you have any questions or concerns.*",0,0,1615323058,AutoModerator
46,gqde6qm,[removed],1,0,1615323085,[deleted]
47,gqde6q3,"It helps my confirmation bias, so I'm fine reading it 15x a day, maybe even more.",2,0,1615323085,cakeclockwork
48,gqdeb66,"Buy and hold, I assume sell is some form of translation for this. Just in some retard language I don't understand",1,0,1615323139,JHAMBFP
49,gqdebqv,"Your replies on this thread have been spot on, thanks brother.",2,0,1615323146,Wisdem
50,gqdecd4,You guys really don't understand the word interest do you?,1,0,1615323153,S_T_Nosmot
51,gqdella,[removed],1,0,1615323263,[deleted]
52,gqdeoh0,This guy fucks!,2,0,1615323297,Hewn_U
53,gqdep49,"&gt;short of 100 shares is recorded. This also explains how you see ridiculous volumes and ridiculous # of shorts every day for a stock that has a 50M float. The MM isn’t “going short” GME. They short it for a millisecond then buy a fraction of a penny lower a millisecond later.
&gt;
&gt;-So high short volume in the FINRA report (which is ONLY reflecting off exchange trades (dark pools) does NOT necessarily reflect high levels of actual shorting. It often reflects high levels of buying! Um. Like we just saw this week. Repeat that It does also does NOT reflect exchange trades. 
&gt;
&gt;You don’t have to believe me you can read this super interesting piece here. Generally speaking, the idea that large short volume in the report is good news for holders seems true!",1,0,1615323304,myownightmare
54,gqdewgw,"Oh dude this is an account reddit created for me but I just need you to believe me when I say I agree. Especially on the voting. Do not get me started on voting. 

Like, literally the only two systems non boomers adapted from boomer times were:
  1) public education, horrible

  2)voting, also horrible",1,0,1615323394,Scary_Replacement739
55,gqdez3e,I lost it \_ laughing with extreme stomach pain...,2,0,1615323425,amir_s89
56,gqdf04l,[removed],1,0,1615323437,[deleted]
57,gqdf3g4,[removed],1,0,1615323477,[deleted]
58,gqdf5gq,[removed],1,0,1615323500,[deleted]
59,gqdf8vd,[removed],1,0,1615323539,[deleted]
60,gqdf94l,Ok. Knowing this (thank you for explaining this btw!). So there was no reasonable metric to measure short interest from the beginning and the nature of GME’s price these last two months has been reliant on a nonexistent “short interest” and strictly on sentiment and speculation? The squeeze occurred or there is not reliable metric in determining squeeze “stages”? Sorry I don’t know technical lingo...dumb ape here.,4,0,1615323542,lrosa00
61,gqdfbpk,"&gt;Think of the most nepotistic, incestuous part of the US military.  
&gt;  
&gt;Now that you're thinking of the Air Force Academy

Ooof.... LOL

I have family who attended who would thoroughly agree.",1,0,1615323573,JustAnotherQubesUser
62,gqdffiy,[removed],1,0,1615323618,[deleted]
63,gqdfgs8,[removed],1,0,1615323631,[deleted]
64,gqdfidu,"Yea, the entire assumption that short volume over 50% cant be fully covered that day is flawed since you could technically have 100% short volume with no change interest.  Person A sales 100 shares to open a short position to person B who is buying 100 shares to close a short position.  If this is the only trade of the day you have no increase in short interest despite 100% short volume.",1,0,1615323649,ereturn
65,gqdfjt0,I really like the TLDR of the TLDR. It really speaks to my inner smooth brain.,1,0,1615323665,legoheadman-
66,gqdfu75,Tell me more how I can get rich but not logging into my broker app,1,0,1615323788,ramplay
67,gqdfx4w,[removed],1,0,1615323824,[deleted]
68,gqdfyz3,So no squeeze then? Ape have hard time with word,1,0,1615323847,ravenousmind
69,gqdfznm,"No the exchanges report short interest twice a month. It’s delayed by 9 days. A few services use algos to estimate the short interest and they’re pretty good (S3 and Ortex) people here like to ignore them because they’re showing short interest going down TBH. 

These are all relatively accurate. The 2/28 update is our (today) shows SI in GME declined to 14.4M shares from 16M",6,0,1615323855,Verb0182
70,gqdg0e3,OP is our quant 🚀🚀🚀,1,0,1615323864,LaurenCosmic
71,gqdg5fs,[removed],1,0,1615323927,[deleted]
72,gqdgav0,Yoooo hook me up. My paper hands need an out.,1,0,1615323994,bigdawgruffruff
73,gqdgb3l,So what's a reasonable peak price here,1,0,1615323997,Aeon1508
74,gqdgck5,[removed],1,0,1615324014,[deleted]
75,gqdge3s,"Perfect! Ok and thank you! I was wondering why it was stated that short interest was stated to have been reported twice a month but didn’t display until way later. Thanks a million.

Edit: To add further to the discussion since this a bull thread. When I look at the S3 report of AMC it has doubled from the Jan 26 levels when it rose to 20 dollars. AMC short interest is the highest it’s been and buying in AMC has increased: hence the price increase today. In this case how is the percentage effected if both buying and short interest is increasing?",2,0,1615324033,lrosa00
76,gqdgisw,"Not hedge funds. Hedge funds are not banks. Hedge funds require clients to agree that all their capital is at risk. Hedge funds are for people that can afford to lose their capital. That’s why you need minimum salary/net worth to buy in.

Ain’t no way there is going to be bailouts for rich fucks, did Bernie madoff’s clients get bailouts? Nope. Neither will these guys .

The brokers may. The clearing houses may. Not the hedge funds though",2,0,1615324089,wsbfangirl
77,gqdgj48,"This man is explaining the concept with bulletpoints. Solid DD, I shall hold",1,0,1615324093,stayfitgoofynIT
78,gqdgkew,"""250% to 967% ""? That's a HUUUUUUGE margin. There's no way these calculations are correct.",2,0,1615324109,PacoWaco88
79,gqdglep,"And then we didn't account for RH to pull the plug on buys. If we can get fucked, so can they. Only we did it legitimately.

EDIT: We didn't get fucked legitimately lol, we fucked them legitimately... I guess is what I'm saying.",2,0,1615324121,Blzer_OS
80,gqdgnc2,Sooooo deposit more money into TD and buy GME got it,3,0,1615324143,3dplug
81,gqdgnx0,I got some more calls for you todayyy jennayy,2,0,1615324150,blueoceanfun
82,gqdgrul,Don’t. OP is wrong. SI float is NOT number of shares shorted. But I am still hopeful that the shares shorted are ridiculously high.,4,0,1615324199,brewmax
83,gqdguz0,this made my nether regions tingle,3,0,1615324236,GiDSmusic
84,gqdh0ab,I am 100% okay for settling for the DTCC going bankrupt and stopping there. They have a 64 TRILLION dollar insurance.,2,0,1615324300,Stenbuck
85,gqdh5ae,"All options trades are mathematically zero sum. The seller loses when the buyer wins. 

The only time things get wonky is early exercisement, and that’s fairly rare.",1,0,1615324360,PussySmith
86,gqdh78u,😭😭😭 i’m but i have fidelity now just don’t trust them to not prolong a transfer.,2,0,1615324383,Jaybird327
87,gqdh9f2,"Give me that sweet sweet confirmation bias, its like oatmeal, It sustains you.",1,0,1615324409,Ramone89
88,gqdhcbr,"Don't let the fight be over before it even starts. I won't try to convince you of anything if you think there is no chance, but if the pandemic lets up, and it looks like bailouts for wall street are on the way, I'll fucking put my personal life on hold over here in south america to fight (peacefully, I hope) along people in the US.

Trust your fellow apes. Macaco junto forte.",3,0,1615324443,Stenbuck
89,gqdhfki,Can you please elaborate on this. I use fidelity,1,0,1615324482,Xarguz
90,gqdhgx9,"Man, I try to be objective and make a bear case whenever I see something like this so that I don't fall into a confirmation bias trap - but I honestly can't figure out a way that it could be less than 250% (ish). We're going to a completely different solar system.",2,0,1615324498,zeebow77
91,gqdhlxl,[removed],1,0,1615324557,[deleted]
92,gqdhocq,"I m in the same rowboat, Ape 😄🚀",2,0,1615324586,18Shorty60
93,gqdhr0c,"I have been led to believe, that if I hold a zillion shorts I can hold them indefinitely, and trade them with you, who ALSO hold z zillion shorts, back and forth forever.",2,0,1615324618,tommygunz007
94,gqdhs1g,Any way to tell if these are new shorts or old shorts that never got squoze? I didn’t read the whole post too many words.,2,0,1615324630,Cm0nstr
95,gqdhu3d,"Alright, which one of you guys really is the smooth-brained mastermind behind these hedgefunds?

If they are THAT retarded, it can only be someone from here right..

Give this man a medal!",2,0,1615324655,financieelbeleid
96,gqdhugp,It’s a normal practice when there is enough daily liquidity to close the net short volume,2,0,1615324659,board-man-gets-paid
97,gqdhuh4,"I mean, I don’t know if this is accurate or not. I don’t think anyone could really know for sure... 

But the fact that it went up to $500... Then plummeted back down to $40... and now has pushed back up to $250 tells me there’s fuckery going on. That fuckery is from BIG money. 

There’s definitely shit going on that isn’t happening just because of retail investors. There are definitely a lot bigger things going on that are being kept from us.",2,0,1615324659,LoF77
98,gqdi4a5,Short shorts get too high up to the point they’re basically naked. After that they get fucked. This how ape babies get made.,2,0,1615324778,LemonNey72
99,gqdi5uq,"Your wife's boyfriend is so retarded, makes me think I have a shot with your wife.

On a serious note, either they are so fucking stupid, OR they KNOW they can get away with another bigger trade halt and burying GME so deep nobody would post a rocket emoji anymore ..",1,0,1615324798,TheHigherSpace
