,comment_id,text,score,awards,timestamp,author
0,gqh9evk,[removed],1,0,1615402464,[deleted]
1,gqh9kbx,"Violation of content guidelines. Rules are literally fucking stickied. Go read them.

&gt; Gain / Loss / YOLO Screenshots are the exception, and the minimum requirement here is a $2.5K change in value in options or $10K change in value in shares. YOLOs must be above $10K regardless. Posts must include screenshot of positions, and comments must include rationale for why you made these particular trades.",2,0,1615402525,The_Three_Nuts
2,gqh9kcv,"Eat my dongus you fuckin nerd.

*I am a bot, and this action was performed automatically. Please [contact the moderators of this subreddit](/message/compose/?to=/r/wallstreetbets) if you have any questions or concerns.*",5,0,1615402526,AutoModerator
3,gqh9ufq,Good bot,1,0,1615402637,manitowoc2250
