,comment_id,text,score,awards,timestamp,author
0,gqj5puq,This is wrong...ALL wrong. And if you don't know whats wrong then I'm not gonna tell you,-10,0,1615435793,arushus
1,gqj5t7x,[removed],1,0,1615435850,[deleted]
2,gqj6zpn,Short Dash. Puts are a fortune. That tells you something.,6,0,1615436569,phil_hubb
3,gqj7lbl,"If 90 days from IPO pricing is March 9th, why are you saying its March 12th?",1,0,1615436936,lucifer_alucard
4,gqj9tbd,So yolo on 100 puts tomorrow?,2,0,1615438372,norealtalentshere
5,gqjacjd,"Interesting. Could very well be the case. The wording is very ambiguous. According to the original filing, March 12th should indeed be the date. The 8-k is poorly worded, it could be either the 12th or the 9th, but the wording favors the 9th I feel.

There were ~4M shares traded at the open on Tuesday. This is larger than expected if the shares didn’t unlock, but it’s not nearly what I’d expect if the shares did unlock.

Hard to say. Hope you’re right, I’ve got bear spreads on DASH",1,0,1615438743,Natural_Profession_8
6,gqjag8j,The original filing said the shares would be eligible for sale 3 days after the 90 day condition was met,5,0,1615438811,Natural_Profession_8
7,gqjb11t,The 90 days condition is “such date is at least 90 days after the date of this prospectus”. What is the date of the prospectus?,1,0,1615439202,Natural_Profession_8
8,gqjb2t1,"Look at Mr. ""I can read the whole post"" over here.",7,1,1615439233,Suicide_Necktie
9,gqjfzww,"&gt; st 90 days after the date of this prospectus”. What is the date of the prospectus?

I think it is the same as the IPO date. This is my main doubt...
In another location in the prospectus they rephrased the condition as 90 days from the IPO pricing date, which is the IPO date.",3,0,1615441990,chmod-007-bond
10,gqjha13,"Found it. The final prospectus is dated December 8th:

https://www.sec.gov/Archives/edgar/data/0001792789/000119312520313884/d752207d424b4.htm",2,0,1615442784,Natural_Profession_8
11,gqjiald,Nice work. So the early lock-up expiration **determination** date is at least after March 8th. Is that why 8-k say March 9th. Thus the actual expiration is March 12th? I don't see how this is wrong?! See table on page 261 of the final prospectus.,3,0,1615443405,chmod-007-bond
12,gqjioid,"Yeah, from the prospectus that seems to be the case. However, the prospectus also says the share price would have to be 25% over the IPO price on the day of the determination date. But the 8-k was filed before this info could be known. Maybe they’re allowed to change the terms of the early lockup?",1,0,1615443628,Natural_Profession_8
13,gqjjifz,You're right about the 25%. Now i am doubtful again.,1,0,1615444123,chmod-007-bond
14,gqjkoy6,[removed],1,0,1615444834,[deleted]
15,gqjmslf,[removed],1,0,1615446168,[deleted]
16,gqjnlan,I’m looking at those right mow myself,1,0,1615446678,carlcapo77
17,gqjp189,maybe this is why they propped it up over $130 on Monday/Tuesday?,1,0,1615447636,AnaLaCervix
18,gqjqdyq,Are you saying that DASH dropping is priced in?,1,0,1615448558,cheesemites
19,gqjqp08,For put premiums yes.,1,0,1615448760,ggnight184
20,gqk06z2,Hope you feel better at some point,1,0,1615455603,GBaby_Blue
21,gqk8ryt,"&gt;If 90 days from IPO pricing is March 9th, why are you saying its March 12th?

what are your bear spreads for DASH? I have a bunch of naked puts but I'm looking to open some spreads today , not sure if I should be picking Friday expiry, or wait it two weeks out",1,0,1615461799,Crepesoleswaffleknit
22,gqkixq2,"Got 30X 8/21 $100 Puts  that are up about 100% since I bought them. After seeing what happened with PLTR, which I believe is going to be worth a lot more in the coming years, I was on board with the thinking this thing will tank once lock-up is over. It is held by companies that invested in it early on and I am confident it will be a race to the exits to come out a few billion ahead.",1,0,1615468974,aka0007
23,gqkxgyh,"Wow, I got wrecked for that. Just having a laugh guys....",1,0,1615476326,arushus
24,gqkxtti,Low volume today but I'm GUHHH with my doordash puts exiting march 19,1,0,1615476488,Crepesoleswaffleknit
25,gql1nsm,All the real retards are buying dash puts,1,0,1615478222,CanYouEvenCount
26,gql1o45,Jesus christ how did ppl (me) miss that. Thanks for posting the S1,1,0,1615478226,elmohasagun13
27,gql2138,I bought 3/12 puts on Tuesday. I’m royaly screwed rn.,1,0,1615478388,gradog82
28,gql2gcc,I feel bad but was it shitty DD like this that convinced you?,1,0,1615478578,CanYouEvenCount
29,gql2wfz,"Combination of that, and the fact that i KNOW door dash is a trash unprofitable company. They’re getting stomped by competition. I could’ve cleaned out for 90% profit if that 25k day trade rule wasn’t a thing but i woke up in the morning to them already worthless the next day.",1,0,1615478778,gradog82
30,gql3s60,"I know what you mean and you are clearly correct hence the large correction, but trust me long term they’re not going anywhere. And short term I think this is roughly to bottom. To much capital sitting at the sidelines trying to get in under 130. Also the lock up has clearly been priced in, most employees who don’t have much financial knowledge (bar what they’re told by their own company) aren’t going to sell at what they would perceive to be 50% less than the value. Good luck out there",1,0,1615479178,CanYouEvenCount
31,gql57nq,"I have 10x 3/19 puts 130P at $5.00. DIdn't think the IV for the puts were that high relative to where I think the value of the company should be.  don't think there'll be as big a sell, but today looks weird af to me -- no sell volume at all.

I'm convinced that this company shouldn't be valued more than Ebay -- thinking 120 or so but the stock market is being  crazy stupid right now... so anything goes. had the chance to offload the puts two days ago for 2K profit, but just gonna hold and see now -- may roll it back a couple of weeks and see what happens.",1,0,1615479816,Crepesoleswaffleknit
32,gql5gnv,"I didn't really thing that there were many other funds that would be looking to scoop up doordash as I think the company itself is pretty shitty. I'm not entirely convinced the lockup was priced in, but they're probably not going to sell all at once and crash the market. 

What do you think is a realistic price target for doordash in the long run?",1,0,1615479926,Crepesoleswaffleknit
33,gql5nl6,what strike are your puts?,1,0,1615480012,Crepesoleswaffleknit
34,gql7meq,"It’s pretty shitty but that’s like any new company they have the capital. The reason why I say the lock up was priced in is because realistically very few would actually sell and we already saw a huge correction. This coincided with the actual market correction which meant it fell even further than it should have. I agree it’s an overpriced company, but so is every company in this current market. And you’ve got to remember the lower the price goes the less people that will sell, unless they’re actually retarded (not in the good way). They would have to do something completely fucked to lose their market share.

If I were to give it a realistic price target 155-165, long term would be higher. What price target would you give it?",2,0,1615480878,CanYouEvenCount
35,gql8wah,"Ape put dash tendies in poo poo hole.
Ape have tootsie roll.",1,0,1615481430,And-he-war-haul
36,gql9ll3,"3/12 140p is RED right now
3/19 75p (for fun) RED
3/19 100p (why not) RED
3/19 140 RED
3/26 140p RED

I'd at least appreciate the $140's to cover the other two reds!",1,0,1615481735,And-he-war-haul
37,gqlinki,Volume at open on Tuesday was immense and higher than its ever been. Hard to see that being driven by the already unlocked shares. It was a whole day’s volume in 1 hour. https://imgur.com/gallery/6R7sMHE,1,0,1615485623,frankenstonks
38,gqlis7g,That said I hope to high heaven I’m wrong. 7x 3/12 135p,1,0,1615485678,frankenstonks
39,gqlj2vl,[removed],1,0,1615485806,[deleted]
40,gqlrg8t,People on edge since the market dumped that’s all,2,0,1615489378,GBaby_Blue
41,gqlsheu,"I guess so. Wont be trying to cheer people up with lame jokes anymore....then again, maybe I will😁",1,0,1615489821,arushus
42,gqltr3e,[removed],1,0,1615490373,[deleted]
43,gqlvwqb,"from what Im reading in the S-1, lock-up expiration ends on Friday but the underwriters can exempt some agreements(i.e. big money) once the conditions are met(which was Tuesday). If Im reading this correctly, everyone else should have their shares available to sell tomorrow.

I also think the volume on Tuesday seemed a little low for how many shares were unlocked. we'll find out tomorrow I guess",1,0,1615491324,AnaLaCervix
44,gqm3ica,[removed],1,0,1615494683,[deleted]
45,gqm3n1w,Interesting. Thanks for that. Fingers and toes and balls all crossed for good luck here.,1,0,1615494739,frankenstonks
46,gqm61hw,That's the  confirmation bias I need ( down 90% in my 3/19 put),2,0,1615495794,Federal-Percentage-8
47,gqmasr4,"Shares were up 6% today and the IV is way down from the start of the week. 

I did have puts but closed out already after the big dip never happened.",1,0,1615497897,kmaco75
48,gqmaybz,"I also read somewhere that it can take a few days to get people their shares, hence the 3 day period after the 9th? I have NO IDEA if that’s a true statement or not, but sounds logical for the 3 day wait",3,0,1615497967,Snertsnert
49,gqmidvy,Im loaded on Hopium...these 3/19's better print. They've been bleeding since Tuesday lol,2,0,1615501373,AnaLaCervix
50,gqmng66,But does this mean unlocked TOMORROW... or thats the last day they are LOCKED up? ( meaning not released for selling until monday ).  Position: I have 10 125p 3/12 ( guh ),2,0,1615503832,BitOfDifference
51,gqmob06,S-1 states they are tradeable on the 3rd day from the day conditions are fully met. Which would be tomorrow! I'll be GUHing with you if this is a nothing burger lol,1,0,1615504264,AnaLaCervix
52,gqmvu8i,"Down 40% on my 3/26 puts but averaged down by increasing my position 3x today. Sigh, probably going to ride it out even if tomorrow goes like today.",2,0,1615508187,HowGreatAreYourDanes
53,gqmvxso,Good luck good sir.,1,0,1615508240,HowGreatAreYourDanes
54,gqmw273,"Yes, 12 3/26 130p averaged at $4.8 by the end of today.",1,0,1615508305,HowGreatAreYourDanes
55,gqmzmwk,ride it out too,2,0,1615510183,Federal-Percentage-8
56,gqn26xg,[removed],1,0,1615511525,[deleted]
57,gqni21s,"It appears executive insiders did sell Tuesday according to SEC documents released today. I don’t know if this means we’re fucked, or if the lockup expiry for norms will help our cause tomorrow. My puts are destroyed right now. 

https://fintel.io/n/us/dash/yandell-keith",1,0,1615519946,danmac57
58,gqni41m,"It appears executive insiders did sell Tuesday according to SEC documents released today. I don’t know if this means we’re fucked, or if the lockup expiry for norms will help our cause tomorrow. My puts are destroyed right now. 

https://fintel.io/n/us/dash/yandell-keith",2,0,1615519976,danmac57
59,gqnidyz,As expected. I just hope we're right about the second part...I bought more 1dte puts at today's top that will be trashed if the price climbs tomorrow lol,1,0,1615520131,AnaLaCervix
60,gqnobz1,[removed],1,0,1615523632,[deleted]
61,gqns42r,"I don’t know what volume of locked up shares are accounted for, but if the executive large volume only pushed the price down 20 points it does have me concerned. I’m just wondering if there’s not a sell off tomorrow if I’m best to get out with a 70% loss, or may as well wait till expiry early April (although if this thing couldn’t die with institutional sell off then I think the retard train will take off)",1,0,1615526110,danmac57
62,gqnv60t,[removed],1,0,1615528251,[deleted]
63,gqo03x6,[removed],1,0,1615532101,[deleted]
64,gqo164t,I'm looking at the SEC filings today for the insiders that sold on Tuesday. Looks like they sold about 500k shares total,1,0,1615532979,python_js
65,gqo46uz,[removed],1,0,1615535570,[deleted]
66,gqogkpa,Yeah honestly I feel pretty good about 3/26. That said I closed some out at a loss yesterday and planned on buying deeper ITM ones instead but my limit buy never hit. Today looks like there will be some solid volatility... if you want to off load then,1,0,1615547795,Crepesoleswaffleknit
67,gqohpex,[removed],1,0,1615548829,[deleted]
68,gqote2d,"2x 3/12 130, 1x 3/19 140 :(",1,0,1615556920,mmmaibo
69,gqp0pbc,Still no crash and volume is crazy low. Welp that's the way it goes. -98% loss at time of writing this lol,1,0,1615560679,flatfalafel
70,gqppbdj,[https://finance.yahoo.com/news/doordash-inc-dash-cfo-prabir-111517221.html](https://finance.yahoo.com/news/doordash-inc-dash-cfo-prabir-111517221.html),2,0,1615571802,And-he-war-haul
71,gqpptv0,[removed],1,0,1615572028,[deleted]
72,gqpuh7l,[removed],1,0,1615574109,[deleted]
73,gqpy229,Who is buying this peace of shit?  ffs...  6k flush.,1,0,1615575727,BitOfDifference
74,gqqe9vc,[removed],1,0,1615583294,[deleted]
75,gqtc1z6,[removed],1,0,1615655494,[deleted]
76,gqtcayz,[removed],1,0,1615655623,[deleted]
77,gqu890m,[removed],1,0,1615672619,[deleted]
78,gqzewmf,Im $5 k up on one put!!  But that’s because i bought it  2 months ago when i heard some body elses dd. Its my first ever option play.,1,0,1615784635,Altruistic_Prior1932
79,gqzf8hh,That was funny. Balls crossed. Lmao.,1,0,1615784905,Altruistic_Prior1932
80,gqzfekp,Guys they are just pushing it up artificially to keep the conditions being met. No worries.,1,0,1615785044,Altruistic_Prior1932
