,comment_id,text,score,awards,timestamp,author
0,gqc41bf,This is one of the worst posts I’ve ever seen on this sub,5,0,1615303446,skunk_unk
1,gqc4208,[removed],1,0,1615303453,[deleted]
2,gqc42m1,I think you know our answer.,1,0,1615303459,ReasonableCitizen
3,gqc44cm,"Do what got you to the dance, buy high and sell low",1,0,1615303476,thedonjefron69
4,gqc44ez,"What kind of question is that? we will definitely pass $400 this week alone, don't lose hope.. every dollar helps/counts",1,0,1615303477,Lighter285
5,gqc465l,"lmao

If you're only in for $60 and you have to ask this question...then yes absolutely, take what little profit you can",0,0,1615303496,MortalDanger00
6,gqc46s0,It can only be your call bro.,1,0,1615303503,sirstephenthebrave
7,gqc48gt,[removed],1,0,1615303522,[deleted]
8,gqc4nv5,haha rip post,1,0,1615303702,LeViGang
