,comment_id,text,score,awards,timestamp,author
0,gqikhjr,Comment upvote whatever let’s get this floating around for as many eyes to see,3,0,1615424209,3rdGenDegenerate-
1,gqiktq6,Donations will happen with money or time but now trust the process and hold,1,0,1615424390,Substantial_Boss_619
2,gqikupa,I’d add a tl;dr otherwise your audience is like 8 people. Good tips though.,2,0,1615424405,JinnPhD
3,gqikz2p,Absolutely,1,0,1615424471,3rdGenDegenerate-
4,gqil131,Will go back in to edit that,1,0,1615424500,3rdGenDegenerate-
5,gqil3j9,If AMC let's me retire I am absolutely donating my time and as much of my platelets as I can,2,0,1615424537,Kodis_Maximus
6,gqil7ij,[removed],1,0,1615424597,[deleted]
7,gqil9s0,Awesome to hear! that investment will pay you back more than you can imagine,1,0,1615424629,3rdGenDegenerate-
