,comment_id,text,score,awards,timestamp,author
0,gqco8ai,"I bought high but averaged down to 10.86, almost even!  Lets go!",1,0,1615311309,Tmaccy
1,gqcod7g,I managed to average down to $9.29 from $10.86 I'm so happy to see green again,1,0,1615311369,AdditionalPassage424
2,gqcok3s,"I am a bot. A Gain/Loss/YOLO should be a picture of a closed gain, a closed loss, or an open position &gt; $2,500.",1,0,1615311455,VisualMod
3,gqcom0l,On the way to my original $17 buy in price!,1,0,1615311478,IHATEG0LD
4,gqcou6p,[removed],1,0,1615311577,[deleted]
