,comment_id,text,score,awards,timestamp,author
0,gqhshd3,"Set your expectations, Apes. They will probably hit it hard after-hours. Don’t panic, apes just HOLD",12,0,1615410539,ljgillzl
1,gqhshg3,my car to buy more GME 💎💎😈😈😈,19,0,1615410540,Fuvso
2,gqhshml,570 for Friday still in the green lol,2,0,1615410542,murmandamos
3,gqhshm5,indeed,1,0,1615410542,SoonSpoonLoon
4,gqhshrq,no volume,2,0,1615410544,Suspicious_Focus_169
5,gqhshsf,"Remember the price dropping $150 in the span of minutes?

Neither do I.

To the moon!",21,0,1615410544,Ukie3
6,gqhshsi,[removed],1,0,1615410544,[deleted]
7,gqhshw5,"The drop was after noon EST, its more likely that they just updated the article after the drop happened",1,0,1615410546,ShitPostingNerds
8,gqhshy9,Let this serve as proof that us retards are 💎 🙌,9,0,1615410546,ElChidro
9,gqhshxh,Yeah it's just capturing short positions on GME. There could also be shorts via etfs and stuff. Oh and its 2 week old data thats why its unreliable,1,0,1615410546,Flewrider2
10,gqhshw1,Get this trending,2,0,1615410546,Shields_1999
11,gqhsi1r,I would love for this to drag out till next year so that we can all tax our gains as long term capital gain and say fuck u to the government even more,7,0,1615410547,LabRealistic
12,gqhsi1v,Lol the hedgies must be FUMING right now,16,0,1615410547,canesfan09
13,gqhsi0x,105 shares at $134.78 💎👐🏾,10,0,1615410547,Redhawkk
14,gqhsi71,Support GME and buy some more,13,0,1615410549,pixelwalrusca
15,gqhsi4v,Sir. This is a GME thread,2,0,1615410549,Hardmeat_McLargehuge
16,gqhsi6m,Can't wait to see Cramer crying about today's action,12,0,1615410549,KyOatey
17,gqhsi81,"hedges sold in an attempt to induce panic selling 

it failed , people held

stock rose again",6,0,1615410550,codymiller_cartoon
18,gqhsi7t,"Three GME threads, sounds bullish to me!",20,0,1615410550,mcbagz
19,gqhsiba,"You’re gonna get downvoted to hell, so I upvotes you to make sure people know you’re being /s",3,0,1615410551,Tinjenko
20,gqhsib5,"This is what could have happened in January, if we weren't shut off from buying. Instead, there was no way to counteract their fuckery. This time we showed what we're capable of.",20,0,1615410551,gonfreeces1993
21,gqhsie5,Can't wait for the DD's explaining wtf happened today,11,0,1615410552,HyperKrille
22,gqhsik3,Yes today they tried to get some paper hands away and in the next days real shit will happen,1,0,1615410554,alexwes420
23,gqhsip6,20@187. Brought up my average by $30 but I like the stock.,1,0,1615410556,gruesome2some
24,gqhsipv,Suits on the events of today: Very legal. Very cool.,5,0,1615410556,lunakola
25,gqhsiqg,No one knows and if they say they know they're full of beans,2,0,1615410556,baws1017
26,gqhsiso,We are Still buy hedge cunts,1,0,1615410557,Donkeycow15
27,gqhsirp,Another organic day in the murican markets,9,0,1615410557,davey1343
28,gqhsivz,"1.7m shares sold in a 5 minute window, market is based on buy and sell pressure, 1/50th of the company was basically sold in 5 mins outweighing any buy pressure from retai.",3,0,1615410558,badras704
29,gqhsiy3,"Sold around 300 and bought back around 200, increased my shares by 50%",2,0,1615410559,agh1138
30,gqhsj08,And today wasn't,2,0,1615410560,meno22
31,gqhsj7p,"i left for reno and it was hailing, enough to look like a snowstorm. One hour later I come back and my town is iced over, all roads covered. what kinda shit is this",2,0,1615410562,kwaddell1997
32,gqhsj8v,Green crayon tasty,2,0,1615410563,b-7341
33,gqhsj83,"Ape wake. Ape happy. Ape feel good. Then ape shit himself. Ape heart try leap from chest. But Ape hold on, because Ape strong. And because Ape might be retarded.  🦧🍌",15,0,1615410563,Aryaisformurder
34,gqhsjg4,$350 buy in today WITNESS ME!!!!!!,24,0,1615410565,Sandvicheater
35,gqhsjfw,Media manipulation + huge coordinated short sell,3,0,1615410565,Chuckles77459
36,gqhsjhe,Look at the volume in the charts.  MASSIVE.,5,0,1615410566,spinxter66
37,gqhsjlh,[deleted],2,0,1615410567,[deleted]
38,gqhsjry,"Today was one giant exposure to Melvinthelioma, which means we are all now entitled to financial compensation.",11,0,1615410569,shstmo
39,gqhsjs5,"https://www.twitch.tv/gamestop

Time to follow apes",4,0,1615410569,2n2u
40,gqhsjqe,you live and you learn.  get back in ASAP,2,0,1615410569,ssaxamaphone
41,gqhsjqh,[removed],1,0,1615410569,[deleted]
42,gqhsjpr,"bought at the halt, filled at that lol",3,0,1615410569,Juicy_Vape
43,gqhsjum,"Imagine having your assets under Melvin's management, and then you lose $800m on FUCKING GAMESTOP. And then you google the nefarious financial wizards who are robbing you, and you find a video of a guy drinking his own piss, lmao.",15,0,1615410570,ContraCelsius
44,gqhsjsn,10k or nothing guys it’s that simple,14,0,1615410570,mattl1028
45,gqhsjuy,This has already been debunked,5,0,1615410571,JugglingKnives
46,gqhsjx0,Boomers are too busy waiting for the next golden age of fax machines.,2,0,1615410571,triskadecaf
47,gqhsjvk,Check out the posts by u/HeyItsPixeL . He's been right on the money for the last two weeks.,4,0,1615410571,Nix-7c0
48,gqhsjyu,man i love not having market manipulation,7,0,1615410572,AykoPredator
49,gqhsk0t,Theory is hedgies fn shorted all their borrowed shit to trigger stop losses in hopes ppl would get scared and sell,2,0,1615410573,jrarriesgado
50,gqhsk3a,"Honestly today really showed the strength of this community and everyone who’s in on GME right now. The fact that trading was halted momentarily, the price dropped significantly, and still managed to go back up into the green by market close is just astounding. You guys are great and are the reason I haven’t paperhanded. Keep it up and HODL!",63,0,1615410573,istrx13
51,gqhsk4g,Closing at a higher price each day... lovely 😊,13,0,1615410574,hamberheyy
52,gqhsk5w,"&gt;Is the whole thing just made up numbers?

Yes, actually.",12,0,1615410574,Giulio-Cesare
53,gqhsk9h,Sold the one I had with a stop loss for profit and bought shares during the dip,5,0,1615410576,murmandamos
54,gqhskeh,"Most I can give you is... Hedges blew their load today, and we still finished green.  I don't know what other ammo they could have after that, but Im pretty confident for our side.",4,0,1615410577,Feed_Bag
55,gqhskck,CNBC pushing that 40% drop story... so obvious what happened that everyone should be convinced at this point,27,0,1615410577,st0nkb0b
56,gqhskgp,Eurobros...Do it!,8,0,1615410578,Darthgangsta
57,gqhskeu,What exactly does it mean to “release” shorts?,2,0,1615410578,rileyjw90
58,gqhskix,Today reminds me of around two weeks ago where we shot up to 180 then ultimately closed above opening. I see only up and green crayons for snacking. I am no advisor. Only ape,11,0,1615410579,TheeGing3
59,gqhski3,[removed],1,0,1615410579,[deleted]
60,gqhskjd,Limit order. The trade will only execute if the price it AT or BELOW the price you specify.,8,0,1615410579,Random513Guy
61,gqhskm8,ATH?? Explain to this smooth brained ape please,3,0,1615410580,all_mighty_trees22
62,gqhskqh,GME 100k ✋💎 ape strong 🦍 Why say lot word when few word do trick?,5,0,1615410581,solazyitshazey
63,gqhskox,6 DAY RALLY,11,0,1615410581,Thurmod
64,gqhskx0,Wow,0,0,1615410584,civiksi
65,gqhskz6,"I love seeing all these paper handed bitches talk about *I aCcIdENtLy sEt a StOp OrDeR aNd sOlD*.

Nah, y'all paperhanding like the bitches you are. Hold or gtfo and go buy shitty $AMC.",22,0,1615410585,the-ghost-jedi
66,gqhsl69,SHINY APE 🦍,5,0,1615410587,Donkeycow15
67,gqhsl5t,"Hey guys, when we hit $100k I’m going to invite al you diamond handed assholes to my birthday party!",16,0,1615410587,DeadPhishFuneral
68,gqhsl65,YOU ARE GODDAMN RIGHT.,3,0,1615410587,iPoopWithMyJordansOn
69,gqhsldr,"Planned short sale, news articles came simultaneously (market watch even fucked up and released one 20 minutes early, check source code)",1,0,1615410589,ScrewedUpDinosaur
70,gqhslga,[removed],1,0,1615410590,[deleted]
71,gqhslh6,[removed],1,0,1615410591,[deleted]
72,gqhsli2,"Ridiculous is an understatement… 


Seriously…

That was a pre-meditated stock assassination attempt.",2,0,1615410591,PeteTheCameraman
73,gqhsllc,"&gt;What a day. I screwed up when I set ~~my~~ a stop.

Ftfy",2,0,1615410592,seanl1991
74,gqhslny,You fucking know it.,1,0,1615410593,hazonku
75,gqhslt4,"i thought your stop loss was 275 and you bought back at 205🧐🧐
Hedgies need to train their shills better!",3,0,1615410595,blitzenzit
76,gqhslsa,[removed],1,0,1615410595,[deleted]
77,gqhslzw,Saved the story for weeks. Published minutes before the drop. Seems legit.,24,0,1615410597,Graucus
78,gqhslyk,Today permanently altered the shape of my bum hole,9,0,1615410597,EuthanizedEjaculate
79,gqhslzg,25 @ 240,1,0,1615410597,Hellshield
80,gqhsm5l,10000 percent,4,0,1615410599,tigershark627
81,gqhsm9y,lot of calls in the money tonight [https://ibb.co/93FbfVW](https://ibb.co/93FbfVW),7,0,1615410601,scorpiounicorni
82,gqhsma4,Copying this and sending to my rep and both senators,3,0,1615410601,somnambulist80
83,gqhsmcc,Wrong it has to go 10% down at some point in the day,1,0,1615410602,Silversurfer237
84,gqhsmfx,We have to understand how important it has been to HODL today while they were shorting GME so badly. Iborrowdesk shows 100k shares available to borrow at closing. We have shown our diamond balls.,8,0,1615410603,Majorero81
85,gqhsmhx,"Makes sense as not a complete correlation with price volatility and Iborrowdesks availability yesterday 


Availability kept dropping with out price dips yest etc",2,0,1615410604,Dry-Sympathy-3451
86,gqhsmi0,[removed],1,0,1615410604,[deleted]
87,gqhsmn8,[removed],1,0,1615410605,[deleted]
88,gqhsmky,"I wrote this last month. This is pretty much psychological warfare. They tank the price to scare weak bulls into selling. They take off the selling pressure and let the price rise, making the weak bulls who didn't sell already think they've got another chance to exit. Strong bulls, on the other hands, kept hitting the buy button.

Of course, the thing you have to think about (i'm talking to the weak bulls here), if they could get the price to $60, 50, 40, 20, or 4 that's what the price would be. But after that short attack today, we 6% up since yesterday. That's just a fact.

But some people are not built for this, the real game just started and only strong bulls are going to survive. Weak bulls should probably take the bench and let the big boys and girls play.",34,0,1615410605,CraigWesleySF
89,gqhsmr3,"Stimulus bill passed by house today for $1.9T. Itincludes $400B in payments to people making under 75k, and the other $1.5T is for the hedgies to cover their shorts.",13,0,1615410606,CharminCity
90,gqhsmqg,"""How can we have insider knowledge, when we have no knowledge?""


*I am a bot, and this action was performed automatically. Please [contact the moderators of this subreddit](/message/compose/?to=/r/wallstreetbets) if you have any questions or concerns.*",5,0,1615410606,AutoModerator
91,gqhsmpr,Jim Cramer is the type of dude to lay on his back with his feet up to put on socks,11,0,1615410606,lo0oped
92,gqhsmo9,I’m at a loss for words. I’m happy it closed in the green but I feel fucking robbed,5,0,1615410606,jaydacosta
93,gqhsmpe,That's what she said,1,0,1615410606,iPoopWithMyJordansOn
94,gqhsmnv,Hopefully. I'm only human.,1,0,1615410606,jellytothebones
95,gqhsmsg,HOLY MOLY,6,0,1615410607,Magnusthehumble
96,gqhsmri,[removed],1,0,1615410607,[deleted]
97,gqhsmw5,8 more shares bought to go with that tasty dip,1,0,1615410608,DeliciousScheme4
98,gqhsmuo,So they are warning they are going to halt and people still use them?,2,0,1615410608,jfwelll
99,gqhsmzf,[removed],1,0,1615410609,[deleted]
