,comment_id,text,score,awards,timestamp,author
0,gqgz6vh,IT MEANS ITS ABOUT TO EXPLODE!,17,0,1615398587,Gym-rat321
1,gqgz9m8,Expected. Do not be afraid.,6,0,1615398612,ERR_INT_DISCONNECTED
2,gqgzdne,No volume = crazy volatility = crazy jumps and drops,6,0,1615398650,Zealousideal-Pride-7
3,gqgzsfj,Volatility,2,0,1615398787,SilverDollar_2021
4,gqh0fw7,"It's like a rollercoaster. You strap in, laugh and scream, then once you're done, you feel the adrenaline flowing and happy and excited.....with your gains. 

This is obviously a short ladder attack done by the hedges to try and ignite a panic sell. We are better then them. We are smarter apes. We ain't gonna fall for it again.",1,0,1615398990,MyPandaAssassin
