,comment_id,text,score,awards,timestamp,author
0,gqhy5ir,[removed],1,0,1615413027,[deleted]
1,gqhy5sy,my fidelity deposits clear within a couple hours. might need to upgrade your bank.,1,0,1615413030,xXxCOVIDfan420xXx
2,gqhy784,I am a bot from /r/wallstreetbets. News should be a screenshot or link to a news story.,1,0,1615413047,VisualMod
3,gqhycs9,Mine usually clears in a few hours too. I transferred money from my bank this morning and that cleared within a couple hours (says 1-3 business days),1,0,1615413117,Laserpantts
4,gqhzit2,Do you guys have margin on your account?  I have a feeling margin may have been part of the problem.  In all honesty I've spoken with 3 reps today and none of them seemed to know what was actually wrong with my accont.,1,0,1615413628,thefisher86
5,gqhzyze,"i did not sign up for a margin account.

i'm just a dumb ape that doesn't want to get into too much trouble. i buy stonk. i sell stonk.",1,0,1615413831,xXxCOVIDfan420xXx
