,comment_id,text,score,awards,timestamp,author
0,gqh8bh1,Why?,1,0,1615402026,Robe1912
1,gqh8ezl,Because it’s roblox and I want money. Is there a better reason?,1,0,1615402065,Bean-BeanBean
2,gqh8iqv,Stfu hedge fund clown. I fuck ur wife everyday,1,0,1615402108,LuffyXPat
3,gqhbock,I am a bot. This Discussion does not look like it has generated enough approval to stay on /r/wallstreetbets.                                    We algorithmically cull certain submission flairs whose response is not above a certain threshold to try and keep the page clean.,1,0,1615403401,VisualMod
4,gqhef9g,I am a bot. This Discussion does not look like it has generated enough approval to stay on /r/wallstreetbets.                                    We algorithmically cull certain submission flairs whose response is not above a certain threshold to try and keep the page clean.,1,0,1615404540,VisualMod
