,comment_id,text,score,awards,timestamp,author
0,gqdg6g9,"Paddlin to school, that's a paddlin",3,0,1615323939,bro55man
1,gqdg7q7,Dont  leave me dont leave me,2,0,1615323956,whereismynut
2,gqdg8ij,[removed],1,0,1615323965,[deleted]
3,gqdg947,you think this is gonna last that long??,1,0,1615323973,q-sizzzle
4,gqdgaxl,They intervene when the world elite are at risk of losing money and in this case it would bankrupt the most elite individuals and turn them homeless overnight. The world is an oligarchy there is no uncorrupt form of government. Saying there is or will be is naive and utopian,27,0,1615323995,GangBurrito
5,gqdgjve,"""They would have to"" turns into ""we won't do that, and will have the rules changed by our government cronies""",2,0,1615324102,Tfear_Marathonus
6,gqdgjzn,"The squeeze will last as long as the hedge funds do. If/when the shorters go out of business, a huge amount of upward pressure on the price is going to evaporate. If that happens the price is going to drop real fast to the point where banks/clearing houses are *willing* to buy shares. Once this starts, it becomes a race to the bottom and anyone still holding is going to be left holding that bag.

People are acting like buying GME at $200 in 2021 is like buying Apple at $3 in 1984. It's not. This is not a long term investment, this is musical chairs and the music **will** stop.",2,0,1615324104,Fight4Ever
7,gqdgm92,"The money doesn’t disappear any more than the profits of your labor disappearing into your CEO’s second yacht. Billionaires will go bankrupt, but that money will go back into the economy faster than any of these people ever would let it.",1,0,1615324131,SURGE_ACME_OFF
8,gqdgme4,"I see no reason RH won't do the same exact thing as last time. And as you can tell from the screenshots posted in this sub, most of the retards on this sub are still using RH.",1,0,1615324132,Neighbor_
9,gqdgmmq,"I'm Canadian with a TFSA also. Your post is inaccurate. GME is a US stock on NYSE, that means you still get slapped with a 15% tax payable to the IRS. Google will confirm this for ya. Your post is otherwise accurate if you were purchasing Canadian stocks on a Canadian exchange.

Edit: Getting a few replies on this. Here's some links that support my post. If you find anything to suggest otherwise,  please provide info. The Royal Bank of Canada even says you get taxed. 

https://www6.royalbank.com/en/di/reference/article/tfsa-faqs/imt5qgzm

https://www.moneysense.ca/save/investing/investing-u-s-stocks-in-a-tfsa/

http://www.lucierwealth.ca/Should-you-ever-hold-US-stocks-in-your-Tax-Free-Savings-Account-(TFSA).aspx#:~:text=Unlike%20Canadian%20income%20producing%20assets,avoid%20the%2015%25%20withholding%20tax.",0,0,1615324135,redditor6616
10,gqdgmr9,"Sad but true anything that doesn’t align with the American government’s agenda gets labeled. Good thing is the military is constructed of people, working class type of people.",1,0,1615324137,GangBurrito
11,gqdgowl,wouldn't that mean that other stock prices would immediately go up in value if gets re-invested?,1,0,1615324163,hanato_06
12,gqdgsy6,Why in ur anus?,1,0,1615324212,GLC_
13,gqdgua3,"I’ve heard that question in regards to everything from CitBoin, to Black Lives Matter, to Billie Eilish’s star power.

Yes. And it’s not that I “think” it’s going to last that long. Just like there will no doubt be more Star Wars films in the future, this will still be raging six months from now. It is inevitable.",1,0,1615324228,ShieldProductions
14,gqdgyay,"So global market will become a functioning trickle up economy, and not the bs trickle down that money men have been sysing for 100 years",1,0,1615324276,ttoften
15,gqdgzbl,[removed],1,0,1615324289,[deleted]
16,gqdh33g,"Not at all. The SEC has done it before, too. The SEC negotiating a short squeeze resolution wouldn't be a first or anything. Keeping the market stable/running is basically their entire job. Enforcing regulations is all part of pursuing that goal.",1,0,1615324334,GasolinePizza
17,gqdh3l8,"one word 

GUH",1,0,1615324340,123ocelot
18,gqdh9i5,I love winning at lottery in slow-motion,2,0,1615324410,bend_over69
19,gqdhgy1,I’m Canadian.  I have my gme split across a tax free savings account and a self directed retirement savings plan.  The tfsa will have zero tax (only 40 shares though).  I don’t pay tax on the sdrsp until I start withdrawing from the account... but it has 400 shares.,1,0,1615324498,NavyCuda
20,gqdhig9,"Be UK stock
Shares ISA  w00t",20,0,1615324516,123ocelot
21,gqdhizu,Not exactly how that works though. The entire point of margin calls is that they have to settle before they no longer can. So they sell off their entire holdings and what happens? A couple of HFs worth of assets being sold off isn't enough to destroy everything.,6,0,1615324522,GasolinePizza
22,gqdhnyq,"They’re on the cusp of their IPO and the negative press the received after halting GME the first time was massive. They aren’t about to risk it again so close to their live date. 

I don’t know though. Maybe they do. It’d just take the cake for “stupidest business decision” they’ve made this year. 

Look at their competitors. Fidelity opened something like 100,000 new accounts that week after RH halted trading. They opened more accounts that week than they did for the entire year of 2020. That Bulgarian boy might risk it again, but I’m optimistic that he wouldn’t make the same mistake twice.",5,0,1615324582,ShieldProductions
23,gqdhpjw,"There's just not a lot of historical precedent to extrapolate from. 

About the closest comparison I could think of would be the post-War economy of 1945-1960ish. It was great for the people that lived it (baby boomers), but arguably shitty for the people that followed (millennials, gen z, etc.). 

I'd like to think it'd be a net positive for more wealth in the populace overall, but I also personally anticipate some new regulation or other fuckery will interfere with the stock price, and thus there will be far fewer multi-millionaires entering the economy than you suggest.

Conjecture could be made about newer generations with different priorities and educational backgrounds coming into money on a mass scale, but I don't think you're going to get anything approaching the right answer on Reddit. Because we're just literal apes, here.",1,0,1615324601,bunch_of_hocus_pocus
24,gqdhr7n,[deleted],1,0,1615324620,[deleted]
25,gqdhr8z,Hm . You're right . But i couldnt Look myself in the eye If i loose my Mills. I Think i'd rather buy some Investments i can Touch . Like a few Flats and Rent Them Out . Having a steady income for Life . Then investing with Said income,7,0,1615324621,thatguyovertheresix9
26,gqdhrab,[removed],1,0,1615324621,[deleted]
27,gqdhzcq,"Enforcing regulations when millions of retail investors from around the globe, along with heavy-hitters like Blackrock, is entirely different than stepping in to stop a couple petulant hedge funds.

I agree that 500k-1m is delusional. At that point, the effect on the market can't really be predicted, but 100k is a paltry amount of money for the players involved. Market faith is just as important as market stability, and in either case, allowing the squeeze to happen and simply bailing out the DTCC with tax tendies if need be is absolutely the best course of action. The effects of shutting it down and leaving retail with nothing are as unpredictable as it squeezing to 500k.",4,0,1615324718,Broviet
28,gqdi1ri,[removed],1,0,1615324747,[deleted]
29,gqdi37m,Thank you for this. I hope more Canadian investors see this reply.,5,0,1615324765,paperboigang
30,gqdi3mr,We'll be the rich donors now,17,0,1615324770,Menonstilts
31,gqdi3w4,Once in a while you gotta flush the toilet. Global economy is no different.,2,0,1615324773,FrenCan16
32,gqdi701,"You can tell he's the type of zero responsibility person who is just going to do what Citadel says to do. And Citadel will most certainly tell them to do it again.

It's not even a hard excuse. Last time they said they needed 3 billion and were unpreparred. This time it's 10x as big so these clowns are still going to say ""there is no way we could have seen this coming, it's unprecedented!"". Even though the whole world knows this squeeze is coming.",2,0,1615324811,Neighbor_
33,gqdi7gj,[removed],1,0,1615324817,[deleted]
34,gqdiacn,What do you think the limit is in share price before regulators would step in and shut it down?,2,0,1615324851,saapphia
35,gqdiawk,[removed],1,0,1615324858,[deleted]
36,gqdibl9,"If you want a real answer, it's that it will never reach these values. It will cap at highest around 500 again.",0,0,1615324867,BasicBlood
37,gqdicu1,Représente le 450,2,0,1615324882,anser_one
38,gqdid0j,"'ruin the economy' is, and always has been, a dogwhistle for rich people losing their superyachts

Also, we NEED a crash. The stock market crashing is not an indicator of the economy. Post-crash, all the whales long on GME will hog up on all the cheap AAPL and MSFT they could possibly buy. Retail will pay monstrous tax dollars to the US gov (if the share price hits 500k that's 40% of 35T dollars, would wipe more than half of US national debt). Retail will not hoard their money like greedy bastards and will invest in their local economies. This 'crash' in the short term will benefit the planet long-term",21,0,1615324884,g1umo
39,gqdid7a,cheeky,1,0,1615324886,Y-not_Both
40,gqdiddw,So they'll know you are daytrading when they conveniently see it.  Nice.,13,0,1615324889,JStevie105
41,gqdidw4,"&gt;	There’s just not a lot of historical precedent to extrapolate from.

That’s why this is a fun exercise. I love hypotheticals so I’ve mulled this over since January but I don’t have the creativity to work government practices into the simulation. Kind of like how a true crime author will ask police about practices to make sure they get it accurately in their book, I’d pose the question to a large group of people in order to get different perspectives from different industries about the impact. Obviously the financial industry and the public sector might have viewpoints that I’d considered. 

Even apes have fun sometimes.",1,0,1615324895,ShieldProductions
42,gqdig5n,[removed],1,0,1615324923,[deleted]
43,gqdig9v,[removed],1,0,1615324924,[deleted]
44,gqdii2a,[removed],1,0,1615324946,[deleted]
45,gqdiiuq,[removed],1,0,1615324955,[deleted]
46,gqdil6t,Do not forget the big lamborghini shortage that is to follow.,39,0,1615324984,Shigurame
47,gqdil7q,"There is only so much money available. Yes the stock could hit 100,000$ per share. But the reality is that if someone doesn't have the money, and they are short. Then they will go bankrupt and you will get next to nothing. 

I can go short all the way today, and the worst you can do to me is take a few grand and my house (not really since the house would go first to my bank and then any leftovers would go to you). 

So people hyping it up, that's fine. It might hit that rate, but even if it does. When the funds don't clear because they hit their own margin limits, well then the share price will quickly drop. Back to 5$, it should but probably not. 

The big institutions that borrow this money for people to play around on margin, well they will be hurt and so will their shareholders, but again. They are probably insured so they may hit limits and have to stop transactions, just like Robinhood. 

Economically, I suspect a lot of shares will be sold in other markets to cover money owed for these shares. And as people pile on, on both sides, you will see a general market crash. Since the none diamond holders of companies that don't have profits, well they will sell, so expect shares of Tesla, Uber, Doordash, etc, all start crashing quickly and heavily. 

The institutional investors will try moving into a safe haven. I suspect gold, since it really hasn't performed like other commodities. 

The question is when, I suspect next few months. (Hope it's not April, since I get all my retro pay that month and will be putting it all on gold stocks (etf, producers).",1,0,1615324984,not_to_hot
48,gqdinp9,I'm dumb but I read a TFSA doesn't mean tax free for non Canadian stocks. Was that true or just a bunch of bullshit? I've started trading in my TFSA now but half of my portfolio is still in a personal account.,4,0,1615325015,Sloth-monger
49,gqdiqrc,"You can dream, but no. The entire economy isn't hinging on GME shorts. The players that are shorting without hedges would go bankrupt and winnings would be divided up in court. Courts aren't usually inclined to hand the world economy to a troop of baboons.",1,0,1615325051,heskey30
50,gqdiy49,"*listen up
 
 It will be a temporary blip. Yes A BLIP. Things will go down due to a huge money transfer. If we reinvest the proceeds things continue to rise from where they are as the global economy picks up. Plus you'll get a silly amount of return % if something like Amazon suddenly dropped 75%. Greed is powerful, unity is absolute. Pay it forward to accelerate the engine. Not stall it. You want mars, well dang it... invest in mars.",4,0,1615325138,Thunder_drop
51,gqdizvb,[removed],1,0,1615325159,[deleted]
52,gqdj1ol,"People will be able to pay for their healthcare.

People will be able to breath after ridding themselves of debt.

People will re-invest. 

People will donate to charities. 

People will spend their money. 

The bottom line is that the retail investor is more likely to make a bigger impact improving the quality of life rather than hoard it for 1% parties. Tell me how this option is bad. Sorry hedge fund babies, you’ll have to wait to buy your yacht.",9,0,1615325180,Stevey019
53,gqdj4zd,"I believe you’re wrong, but please feel free to correct me. The way I understand it, the 15% withholding tax applies to dividend income, not capital gains, if it’s a US stock in your TFSA. 

http://www.lucierwealth.ca/Should-you-ever-hold-US-stocks-in-your-Tax-Free-Savings-Account-(TFSA).aspx",19,0,1615325219,baaldlam
54,gqdj5mr,"The thing that keeps crossing my mind is... If something dodgy was done to limit the rocket last time round by vested interests.. What happens when those vested interests are governments and a plethora of the biggest players in global markets? There's no limit to what kind of shiz you can expect if that's really a potential.
What won't these people do to protect their wealth and power? It's worrying.",3,0,1615325227,BilgePomp
55,gqdj6ga,Time value money (TVM),1,0,1615325237,hyoguro
56,gqdj8uy,"I thought it was only income (dividends) that's subject to foreign witholding, not cap gains. Is that wrong?",6,0,1615325267,beatlemaniac007
57,gqdj8z7,"Outside of tfsa, Is the 15% on top of Canadian capital gains tax?",3,0,1615325269,wsbfangirl
58,gqdj9hc,"I understand that this is a bubble and that is what you are saying. But there does not seem to be any idea of what that pop will be like or what will cause it as there is millions of shorted shares that just don’t exist. 

Those shares need to be provided or a share must be bought at market price once called. Once that starts happening more and more the price will continue to go up. My question is, what will trigger that? Or will it be slow gains for the next few weeks while shorts try to cover and find shares, and then go bankrupt trying to do so, causing the banks to buy the shares up. Once that happens then we can see the bubble expand and pop pretty fast. But there is now way to know what the price will look like. I agree we won’t see a market cap in the trillions but I do think we will see 5-10k share price before tanking back down and stabilizing",2,0,1615325275,christopher33445
59,gqdj9na,"As a college student, yes. 7 shares for this 🦍",0,0,1615325277,Lil-Boss_2102
60,gqdja67,"Yep. 8 million retards paying 37% income tax on 60,000,000,000,000 in gains is gonna change some shit.",1,0,1615325284,Micokerts
61,gqdjbsl,[removed],1,0,1615325304,[deleted]
62,gqdjcsu,YOLO!,2,0,1615325315,combatcameraguy
63,gqdjf47,Aren't America like the UK? Isn't the deficit just money owed by the government to themselves on account of economic stimulus?,1,0,1615325344,BilgePomp
64,gqdjfni,[deleted],1,0,1615325350,[deleted]
65,gqdjfu5,Thats a huge dip to buy then,3,0,1615325352,vincentk1996
66,gqdjjmr,[removed],1,0,1615325400,[deleted]
67,gqdjl5i,My koi pond will be 25% of my 100x70” yard. That thing will cost more than my car but I’ll be filling it with HF tears from the multi acre estates 2 blocks down. Smallest and cheapest house within a mile is going to have a koi pond and diamond handed water fountains.,16,0,1615325419,lablizard
68,gqdjmdn,"I'm not telling anyone to do anything, but I'm probably not going to make it to the ""500k floor"" gang. I recognize that it's a normalcy bias to some extent, and none of this is normal at all, but I cant foresee this getting higher than 100k, if that. 

I'm also kinda scared that if we hold out for enough, even the short crash might fuck things up all over the world, and the last thing we need is more unemployment, even for a short time.

But I suppose nothing ventured, nothing gained. In for a penny, and all that jazz. I'll keep a few to see just how high the peak goes.",5,0,1615325435,Manbearbeardy
69,gqdjnqv,Tyson Foods will top the S&amp;P,1,0,1615325452,ionlyhold
70,gqdjo9b,"Interesting, I never knew about this rule. 
Thank you for the info!",1,0,1615325458,Bourque25
71,gqdjowi,"I’m probably goon to wait a while before O start investing again, maybe for it like 3-6 months just so I can shake off any bad juju, but after that I’m ping hard. Investing into solar and wind power, Cannabis and Psychadelic stocks, maybe toss some shares Papa Elon’s way as a thank you for helping spread the word. I’m going to do my research, and companies that abuse or exploit their workers or the environment will not see a dime from me",1,0,1615325465,MrRedorBlue
72,gqdjqfr,"I'm putting a lot of my tendies into a spread of SPY puts to add to my SPY puts that I already own, because when GME moons its going to cause havoc and the market is already at a tipping point. They gonna have to pull that money from other companies to pay us because they don't have that cash on hand.",1,0,1615325484,burninmedia
73,gqdjqxn,"As I mentioned in a reply above, I believe this is dividends only. However, no one else seems to be making this distinction, so I might be wrong. Best to look into it yourself.",5,0,1615325490,beatlemaniac007
74,gqdjsa3,"apes will be rich, a couple Hedge Funds won't be anymore ahahahah . Apes will put the money in economy instead of sitting on billions and billions",1,0,1615325507,erttuli
75,gqdjud8,"I am not 100% sure, but I've seen that dividends are taxed, but capital gains are not? Something like that.",4,0,1615325533,Bourque25
76,gqdjwx4,"stranger things have happened.  Oil went to like -$37 this year, so anything's possible.  Can you imagine the gainz on that recovery.",1,0,1615325565,Lahdeedah1980
77,gqdjzg7,What is a reasonable number? I can't watch this all day and would like to have a limit set to catch the squeeze...it's currently at $1000 a share.,-1,0,1615325597,DumbWalrusNoises
78,gqdk0m5,"I agree with all you said, but the last part. Aren't Cohen (owns 9M shares) and a lot of board members not allowed to sell before Q1 2021 ends? I read somewhere that they can't sell a single share in some timeframe, correct me if I'm wrong.",1,0,1615325611,Imnotfckingselling
79,gqdk12j,"Growth in TFSA bears no tax. Tax Treaty. 15% only on dividends. So we're safe.

Edit: So long as the security you're trading is done so on a major exchange...ie the NASDAQ, NYSE, etc. Still safe.",5,0,1615325617,chandlben
80,gqdk27c,"As far as I know, as a Canadian, when we sell stock on the NYSE, the US government automatically takes 15% before you see profits in your account.
The US doesn't see a TFSA as a registered plan. 
But, also consider with the exchange rate, we're still on an advantage.",3,0,1615325631,redditor6616
81,gqdk33x,"We were trillions in the red before the pandemic hit. 
Remember when trump said that Mexico wasn’t sending their best to america? Well applying that same logic towards our government, we don’t send our best or brightest to the White House. We elect morons who appoint other morons so they can get themselves rich while fucking over the bottom line. It’s why democrats fought so hard against Bernie. It’s why the right elected Trump. They’re so anti-establishment (or anti-current establishment, or at least they play the part of being anti-establishment) and we’re sick of seeing the rich get richer, the prices on everything increasing, and we don’t get any sort of relief, UBI, or pay increases.",5,0,1615325643,ShieldProductions
82,gqdk3n4,"Chanting USG, USG, USG! With newly minted Nobel prize winner for peace and economics, DFV, as president.",10,0,1615325650,Flightlevel800
83,gqdk5mi,"The highest stock traded on the stockmarket cots over 300k a share.We are in a position where the people who shorted the shares HAVE TO buy once a certain point is reached, at which point the price is irrelevant as they have to cover.

If you are in the desert and dieing of thirst how high could I price a glass of water?

Find the answer to that question and you have the answer to how much you can ask for your gme shares.",1,0,1615325675,Shigurame
84,gqdk5vx,That's the difference between your country and America. If someone goes to the unemployment line they deserve it. If this thing doesn't rocketship I'll never be able to afford a house or pay my old age medical bills.,2,0,1615325678,joyosects
85,gqdk606,[removed],1,0,1615325679,[deleted]
86,gqdk701,"It isn't just a couple hedge funds behind this, though, this is the chance for ALL hedgefunds and financial institutions to feed off whomever was short. The NSCC is trying to push laws so that they get some protection when it blows up, but the problem the worry is about how to ensure there's cash at the opposite side of the trade. If there's no way to secure trades like this, then why the hell should I, you or anyone on this planet play in the stonk market? 

So again, the pecking order is hedge fund, brokers, clearing houses, then banks. Hedge fund are always leveraged up to the tits and it's very apparent, so that's a decent problem. Brokers got massively spooked back in Jan because they likely could have been blown up as well. Next, the clearinghouses called the trading halts, so they definitely had liquidity problems back in Jan. It's likely that shit is going to travel up the ranks pretty fast, given the amount of money at stake at each of these lower levels.",7,0,1615325692,Camposaurus_Rex
87,gqdk70u,"You have done an excellent job at wasting my time.


*I am a bot, and this action was performed automatically. Please [contact the moderators of this subreddit](/message/compose/?to=/r/wallstreetbets) if you have any questions or concerns.*",5,0,1615325692,AutoModerator
88,gqdk78s,Wasn't there a post earlier about some company named dryships that had a 52-week high at almost 800K?,1,0,1615325695,takenaka92
89,gqdkd7p,Lambo,1,0,1615325769,wobaleno
90,gqdkepo,"This moment, when the bot reply makes me spit coffee on the coke mirror. Thank you fucking much, bot! I reclaim my snot.",7,0,1615325787,Flightlevel800
91,gqdkf27,"So I just did some reading- the 15% is on dividends or interest, not on capital gains. That’s treated as capital gains would be in Canada. So unless GameStop starts paying dividends, no unforeseen taxation here. Phew!",5,0,1615325791,wsbfangirl
92,gqdkgw6,[removed],1,0,1615325813,[deleted]
93,gqdki5p,Goddamn bro😂how much you got invested in this if you don't mind me asking?,1,0,1615325829,Rapsy112
94,gqdkias,That is also a point the recent DTCC rule changes covered. I would recommend reading up on it.,2,0,1615325831,Shigurame
95,gqdkj94,[removed],1,0,1615325843,[deleted]
96,gqdkjd6,"Do you, bud. I’m going to diversify into a bit of real estate as well once the rent moratorium ends and people start getting evicted.",8,0,1615325844,JBarkle
97,gqdkni4,Sorry I disagree,1,0,1615325895,wobaleno
