,comment_id,text,score,awards,timestamp,author
0,gqje6ps,Just ask her boyfriend.,5,0,1615440970,jt004c
1,gqje7bd,[removed],1,0,1615440978,[deleted]
2,gqjea97,Proof or ban.,7,0,1615441025,0674788emanekaf
3,gqjefq3,I like looking at the pretty pictures,2,0,1615441120,christodanto
4,gqjeg7p,[removed],1,0,1615441125,[deleted]
5,gqjelif,Marklark?,2,0,1615441207,moneymotivated711
6,gqjesvw,This is the best TA I ever saw,2,0,1615441317,Puts_on_you
7,gqjetps,How would you know?,5,0,1615441331,JMLobo83
8,gqjeu5d,"I absolutely lost it at the salmon tube part, the video alone was so stupid it was fantastic. Is that actually a thing?",2,0,1615441339,excelsior127
9,gqjevyc,Proof or ban,4,0,1615441370,JMLobo83
10,gqjex3c,I actually thought this was serious technical analysis for a moment.,2,0,1615441387,PowerOfTenTigers
11,gqjexwa,Ok I was just mildly chortling to myself but that fish ladder bit made me lose my shit,22,0,1615441399,taipeileviathan
12,gqjf4zs,Yes or no?,6,0,1615441507,taipeileviathan
13,gqjf505,"Let me start from the beginning, when I was a boy in Bulgaria...

*I am a bot, and this action was performed automatically. Please [contact the moderators of this subreddit](/message/compose/?to=/r/wallstreetbets) if you have any questions or concerns.*",9,0,1615441507,AutoModerator
14,gqjf82o,"So wait. Are the bears gay, or the salmon? Cuz the salmon is pulling in some rough on that last picture and I just want to make sure my gay bears aren’t just after me for one thing.....

Also, tendies good, I like the stonk",2,0,1615441556,FullyRisenPhoenix
15,gqjfkzq,[removed],1,0,1615441763,[deleted]
16,gqjfl3n,"This is surreal, I'm in",2,0,1615441765,granoladeer
17,gqjfoke,I just caught myself trying to calculate how high your salmon shooter rose on the y-axis. WTF is wrong with me.,2,0,1615441817,Zino82
18,gqjftg7,You had me at Salmon chart,2,0,1615441890,Drew_Woodruff
19,gqjftxo,Good bot.,3,0,1615441897,youngbudding
20,gqjfv4b,[removed],1,0,1615441915,[deleted]
21,gqjfytz,DD unclear. Fucked my girlfriend while her other boyfriend watched.,2,0,1615441972,DrunkSpartan15
22,gqjg2in,[removed],1,0,1615442030,[deleted]
23,gqjg4j1,"I am still fucking laughing, this is way too good",4,0,1615442063,adnelik
24,gqjg4lx,Holy shit!  They have a Futurama tube for fish?,2,0,1615442064,Knull_Gorr
25,gqjg6k8,"Finally some understandable DD.
Even if you can’t read, the pictures speaks volume.",2,0,1615442094,LikeADawg
26,gqjg6xz,"This is the greatest post ever, thank you!",2,0,1615442100,boatsnhoes801
27,gqjg70e,I’ve finally been here long enough to understand this,23,0,1615442101,Shazam10-SAP
28,gqjg774,[removed],1,0,1615442104,[deleted]
29,gqjg7aa,Those fish fuck.,2,0,1615442106,ptparkert
30,gqjge5w,Fuckin love you apes.,2,0,1615442214,popejiii
31,gqjgeyo,Looks legit to me!,2,0,1615442227,MadFlava76
32,gqjgnwy,I cant wait to spawn so hard at the top I literally die,2,0,1615442390,beauchh
33,gqjgo73,Im too drunk to know if this is real or not either way dont care i aint selling,2,0,1615442395,thor-ragnorcock
34,gqjgpd0,Christ. This has officially been the best thing I’ve ever seen on the internet in my life. Wish I had a gold to give you.,3,1,1615442416,PremierPepe
35,gqjgryc,I respect you for taking the time to make all these charts lol 😂,2,0,1615442462,The_Real_King713
36,gqjgx5y,[removed],1,0,1615442557,[deleted]
37,gqjgzjc,He caught a whiff of the boyfriend's fingers.,2,0,1615442598,FrankieSaints
38,gqjh0qx,"I honestly can’t tell if this is a real thing or you just came up with it off the top of your head. Regardless of who came up with it, it’s fucking brilliant",3,0,1615442619,highandautistic
39,gqjh1l4,I love how well this is formatted,3,0,1615442634,NocturnesOp9
40,gqjh3ps,Hang in there!!!,2,0,1615442673,RoShenanDoah
41,gqjh3q6,"I am not a cat.

*I am a bot, and this action was performed automatically. Please [contact the moderators of this subreddit](/message/compose/?to=/r/wallstreetbets) if you have any questions or concerns.*",1,0,1615442674,AutoModerator
42,gqjh9kc,Gotcha my nose isn't that good.,3,0,1615442777,JMLobo83
43,gqjhbtw,"The fucking writers voice tho: ""...wacky shit for the ventral fin."" and ""That's right, it's salmon tube time."" so beautifully followed up by the tube clip. 
I love this ape creator and I like the stock. 10/10",7,0,1615442818,Zestyclose_Way_9109
44,gqjhiil,[removed],1,0,1615442938,[deleted]
45,gqjho26,This is so fucking stupid it just might work!🍌🦍💎🤲,2,0,1615443037,Weary_Possession_535
46,gqjhqbk,[removed],1,0,1615443075,[deleted]
47,gqjhr6k,🍣,2,0,1615443089,Radio90805
48,gqjhwiy,[removed],1,0,1615443177,[deleted]
49,gqjhzd1,Makes sense to me. May we spawn in the pools of Valhalla!! 🚀 🐟 🌙,2,0,1615443221,WORKREDDITOMG
50,gqji0jy,"Perfect technical analysis, thank you for teaching me the ways of the stonks",2,0,1615443239,heymelio-fagabeefe
51,gqji3ne,This is the way,6,0,1615443289,kzgatsby
52,gqji4f9,"This is as clear a breakdown as I've seen of WSB trading.  A bunch of retards buy and hold, while they're salmon tubed to the moon by people who actually know what they're doing.",2,0,1615443301,drunkenstocktips
53,gqji75f,Can you feel it? That tingling sensation at the base of your balls? Yes or no?,2,0,1615443347,BurlyBreaux
54,gqji76a,[removed],1,0,1615443348,[deleted]
55,gqji7c2,Tube shaped like a long crayon. You son of bitch. I'm in.,2,0,1615443351,DigitalPixel07
56,gqjirau,Amazing,2,0,1615443672,Fernweh_0
57,gqjiwi8,[removed],1,0,1615443758,[deleted]
58,gqjizba,This is the most retarded shit I've ever read and I'm totally convinced,2,0,1615443806,NOFOSRFCSTR
59,gqjj3hj,That was a salmon attack,2,0,1615443877,thatsmyname3
60,gqjj7pq,"Senate: Dear redditors how did your DD look when you were about to invest so much money in a company?

Retards: Well let me present the salmon theory. 🚀🐟",2,0,1615443945,Wifeysboyfriend
61,gqjj90n,Good bot,2,0,1615443967,DrunkSpartan15
62,gqjjb6t,you must be well-versed in fish law.,2,0,1615444005,treesandbeers
63,gqjje6g,"I am not a hedge fund, or a cat, or a salmon🐟🌊",1,0,1615444055,Splashathon
64,gqjjgmj,"Salmon don’t have tits, this literally cannot go tits up",24,0,1615444093,Splashathon
65,gqjjhso,[removed],1,0,1615444112,[deleted]
66,gqjjnfz,Good enough for me,6,0,1615444205,tu_test_bot
67,gqjjnz3,The math checks out,2,0,1615444215,Just-a-Pea
68,gqjjqh8,"Nice, finally a chart I could understand
Do you like pan seared, smoked or sashimi salmon?
Yes or no",2,0,1615444257,sodiumbicarbonade
69,gqjjzo1,I don't understand it. But I think it means to buy and hold?!?,2,0,1615444401,Linkaex
70,gqjk1y2,Just keep swimming dude! HODL,2,0,1615444442,Splashathon
71,gqjk8qk,Holy shit this blasted me to a bee dimension... wrinkles achieved.,2,0,1615444560,SenseiNakamoto
72,gqjkbfm,This is the most informative dd in this sub,2,0,1615444605,P3_FemC_Best_Girl
73,gqjkf3k,I used to sell salmon for a living. This is all 100% accurate. We're all basically already rich.,2,0,1615444665,QuickSticks
74,gqjkgu9,I want whatever he’s been doing tonight,2,0,1615444695,large_block
75,gqjkluc,[removed],1,0,1615444784,[deleted]
76,gqjkqhg,I have a friend that is trying to get into the stock market sent him this and he actually believed it. lol won't last very long.,2,0,1615444861,0Determination0
77,gqjky0b,\#DUDE WTF YOU MUST LIVE IN THE PACIFIC NORTHWEST.,2,0,1615444996,F1_Playboy
78,gqjl296,"If we speak in emojis only the boomers will have to decipher the messages which will take time, and newspapers might have to quote it with emojis if they decide to quote it",10,0,1615445064,FuriousGremlin
79,gqjl7x8,"Is the tube lubed, tho? And also, how many crayons would you have to stack so they could also pass through? Beautiful ape drawings, btw. Finally hit a nerve.",1,0,1615445157,lemniscuslondon
80,gqjl8t5,"This broke my brain I'm literally cry laughing. Idk if I can handle this awakening, my husband and bf are both giving me side-eye.",1,0,1615445173,Thrawnbelina
81,gqjla2u,[removed],1,0,1615445192,[deleted]
82,gqjlkpo,[removed],1,0,1615445392,[deleted]
83,gqjlmr8,[removed],1,0,1615445426,[deleted]
84,gqjlv00,"As much as I enjoyed watching that man put a fish in a fleshlight.

Wtf?",1,0,1615445570,vms-crot
85,gqjlv3c,[removed],1,0,1615445572,[deleted]
86,gqjlysq,"I had a feline once and he ate my fish. Not happening this time. The desperation is abysmal. Don’t fear. Salmons migrate in schools. Some get taken out but holding together we shall be rewarded. There will be unfortunate losses but together, apes strong.",1,0,1615445644,xLogicx01
87,gqjlyxz,Yes baby! Lets fucking hold!,1,0,1615445647,PhilippoK05
88,gqjm9ee,And what about the double-balls hairy-beta-kappa-phi Black Cock pattern that appearead on January after RH fucked everybody? Can't see it anywhere now.,1,0,1615445840,Dull-Preference666
89,gqjmgqq,[removed],1,0,1615445960,[deleted]
90,gqjmkzv,Where can I buy your book and may i has your autograph. For my wife's bf. He fucks and read.,1,0,1615446035,georgesoo
91,gqjmuu7,Eyes are bloodshot and idk where I am,1,0,1615446204,JeecooDragon
92,gqjmwyg,Brilliant - you should get a Nobel Prize.,1,0,1615446240,WorriedBanker
93,gqjn1f0,"This entire movement is retarded, why is anybody surprised somebody made a retarded post 🤣🤣🤣🤣🤣 youre a fucking God for this!",1,0,1615446319,realcevapipapi
94,gqjn1rh,"Finally some REAL technical analysis, thank you!",1,0,1615446325,Infamous-Lifeguard-7
95,gqjn1sy,"This makes me want to build a potato gun, but for salmon.",1,0,1615446326,Chrisanova_NY
96,gqjn3yj,"How the literal fuck does this not have more up votes and awards? Best DD ever posted. If this gets to 2k awards, I'll get a fish tattoo.",1,0,1615446367,AlmostaVet
97,gqjn4sf,"My mind after reading this.

https://youtu.be/dDj7DuHVV9E",1,0,1615446380,detectivesolanas
98,gqjn61p,"Hi, how are you?",1,0,1615446404,misterpayer
99,gqjn7ac,[removed],1,0,1615446426,[deleted]
