,comment_id,text,score,awards,timestamp,author
0,gqifl2l,You Win 😆,-2,0,1615421588,J-Wagner
1,gqiflig,What is the borrow rate?,19,0,1615421595,HanlinBiness
2,gqifosm,"I'll be real with you, this is likely a good play by traditional standards.

But posting it here is you asking for it.",6,0,1615421644,Pimento_
3,gqifpn3,[removed],1,0,1615421656,[deleted]
4,gqifs0d,Apes gonna squeeze you,2,0,1615421690,-NotJimCramer-
5,gqifs4j,Good luck dumb fuck,15,0,1615421692,noname3311
6,gqifsba,"Yes. We need to see more contrarian plays, so have my upvote. I’m also long gme so fuck you!",85,0,1615421695,Independent_Vast4545
7,gqifter,What's your target?,1,0,1615421711,roamgnomeroam
8,gqiftrk,[removed],1,0,1615421716,[deleted]
9,gqifu47,Man you about to piss some people off. This guys  got balls big enough to impregnate all your wives.,21,0,1615421721,slampig3
10,gqifvcn,I hate you for this play. I hope you choke on a bag of penis,53,0,1615421740,stocktawk
11,gqifyq1,Baha you could have just used a Cashier's check to put that in my bank account bro.,3,0,1615421789,klasspirate
12,gqig2pt,[removed],1,0,1615421848,[deleted]
13,gqig7t9,Definitely retarded and NOT in the good way.🤪,7,0,1615421921,Down4TheUSA
14,gqig80a,Are you just looking to offload all of your money so that you can go live in the woods as a mountain man? 🏔️ 🌲,13,0,1615421924,Icy-Faithlessness239
15,gqig93g,[removed],1,0,1615421940,[deleted]
16,gqigdh0,Following,1,0,1615422003,likethejelly
17,gqigeb4,Curious too. How long can you weather the storm.,17,0,1615422015,likethejelly
18,gqigfkk,[removed],1,0,1615422033,[deleted]
19,gqigisg,Seeing tons of puts. She's going down. Roblox is a better buy,-17,0,1615422079,ChadSMASHya
20,gqigiv0,God speed friend. Hope you're at least hedged.,3,0,1615422080,LeKiwi
21,gqiglpi,"This isn’t a short, it’s just the holding term.",5,0,1615422123,methodangel
22,gqiglw0,Investing 16% of your cash is not YOLO. reported.,26,0,1615422126,GouraudPalm
23,gqigml5,Bro’s gonna make a lot of money.,-9,0,1615422136,CaptainWelfare
24,gqigxdr,[removed],1,0,1615422295,[deleted]
25,gqigxnn,[removed],1,0,1615422299,[deleted]
26,gqih8oc,[removed],1,0,1615422462,[deleted]
27,gqihfw7,I’m guessing both sides win depending on when you pull out... 💦,16,0,1615422566,joelgreen25
28,gqihk9m,"Well good luck to you , if you are indeed wrong please post your loss porn so that i can beat my meat to it.",7,0,1615422632,Pury101
29,gqihrjc,"No posts in over a month before this, and this account has -37 comment karma. 🤔",11,0,1615422742,meta-cognizant
30,gqihv0h,I’m long gme but always pulling in and out depending on where the T&amp;A are at,7,0,1615422795,Independent_Vast4545
31,gqiigeg,"There was a post today from a guy who bought puts on gme and said something like ""seems like a good time to go against WSB"" then like 30 mins later the 40% drop happened. He was the first thing I thought of. That guy must have made bank. Can he show up plz? Give an update homie.",2,0,1615423116,Homesober
32,gqiiu8o,[removed],1,0,1615423326,[deleted]
33,gqik2xb,[removed],1,0,1615423991,[deleted]
34,gqiklmt,Saw him elsewhere. 36k I believe.,2,0,1615424270,hikesnpipes
35,gqil1jr,you mad lad. Fuck you man. I love it. Make these GME tards choke on your dick,1,0,1615424507,Emonyc
36,gqillyw,[removed],1,0,1615424809,[deleted]
37,gqilpsh,Ty for the loss porn. Nobody’ll be mad when you short on the real way down.,2,0,1615424864,JinnPhD
38,gqim3k2,[removed],1,0,1615425068,[deleted]
39,gqim40e,"My wife’s boyfriend pulls out early, I never pull out",1,0,1615425075,elpikachar
40,gqimizg,I smell lose porn cooking,3,0,1615425294,Shwiftygains
41,gqin9oo,What a douche,3,0,1615425679,Treday237
42,gqinjm8,"Its a short though, so he might lose his entire account if he gets squeezed and has no stop loss.",19,0,1615425820,masterjarjar19
43,gqioq7z,to my understanding you shorted 300 shares at 253 and got 75k in credit which you need to return 79k as of the current price since the price went up. You are banking that the hf will try to drop it and cash in on the dip. If the hf fail and the price shoots up you will lose your house.,2,0,1615426440,Tigereatingonion
44,gqipv4t,May all the retards win! And also the best one but congrats and fuck that monkeh ass bwah (this is definitely not financial advice),1,0,1615427017,chungusxl94
45,gqipvt3,Easiest money of your life if you can ride it out,1,0,1615427027,f1_manu
46,gqipzz8,Lol get the fuck out of here acting like GME has fuck all to do with T&amp;A.,3,0,1615427086,Grits_N_Gravy_23
47,gqiqcd6,Fuck you and thank you for your contribution to the community,2,0,1615427262,BrokeOnOak
48,gqirilf,"Nice, future tears to drink and a little sip now.",2,0,1615427868,TimelostExile
49,gqisflu,Listen I like your contrarianism. But you opened the short at 250. This would have been a way better play when the rocket gets some super boosters instead.,1,0,1615428340,Alostsock
50,gqisfus,Infinite potential losses tho,5,0,1615428344,Flowa_13
51,gqit5c8,Hope your margin account is high,1,0,1615428714,Toomanykidstosupport
52,gqiuppc,I have 400k yolo’d 😇 check post history,1,0,1615429534,zezimas_fart
53,gqiv69t,I look forward to taking your money.,1,0,1615429779,reconoiter
54,gqivrri,Not a bad play. It has to go down sometime.,1,0,1615430094,medi3val6
55,gqiy2we,Enjoy your cleveland steamer tomorrow you cunt.,1,0,1615431329,JBMagi
56,gqj05ym,This guys rides the short bus,1,0,1615432480,buylowstacks
57,gqj0uyg,GME getting spitroasted over here,1,0,1615432877,NorCalAthlete
58,gqj767t,[removed],1,0,1615436680,[deleted]
59,gqj8xiz,You did witness what happened in January right?,1,0,1615437771,mygloveismyname
60,gqjaay5,[removed],1,0,1615438712,[deleted]
61,gqjdbyn,Should have gotten out of your short when it dropped to 180,1,0,1615440505,TTZZ101Y
62,gqjeoyx,I actively encourage people to short this stock. Go on. I dare you.,1,0,1615441256,onfire9123
63,gqjf0pb,GTFO you shill. Fake ass account,1,0,1615441448,dubweb32
64,gqjfbkz,inversing for tendies,1,0,1615441614,nissan_nissan
65,gqjhgak,[removed],1,0,1615442898,[deleted]
66,gqjhs47,[removed],1,0,1615443106,[deleted]
67,gqjjnu8,Some say the best strategy is to inverse this sub. I guess time will tell.,1,0,1615444213,PowerOfTenTigers
68,gqjo2mw,Yolo is like $10k plus,1,0,1615446979,SapientSausage
69,gqjp318,Have fun getting squeezed my guy,1,0,1615447673,bchrzfg215
70,gqjqufd,"If I had silver, I'd give you 1.",1,0,1615448858,UNLVBen
71,gqjqxiy,Have a seal that I got for free instead!,1,0,1615448911,UNLVBen
72,gqjr29b,It won't piss me off when he buys my shares for $75k each.,1,0,1615449000,UNLVBen
73,gqjr4p0,\+1 (but without the 'good luck' part),1,0,1615449043,UNLVBen
74,gqjug5o,[removed],1,0,1615451263,[deleted]
75,gqjxden,This is how hedge fund traders look showing their positions to each other and they definitely look retarded.,1,0,1615453422,DivingDeep21
76,gqk7of9,"Just give his wife one, everyone else does.",1,0,1615461068,APT69420
77,gqk9yyi,!remindme 2 days,1,0,1615462556,cenatoto
78,gqka0mi,"I will be messaging you in 2 days on [**2021-03-13 11:35:56 UTC**](http://www.wolframalpha.com/input/?i=2021-03-13%2011:35:56%20UTC%20To%20Local%20Time) to remind you of [**this link**](https://www.reddit.com/r/wallstreetbets/comments/m2d2qi/75k_gme_yolo_short_may_the_best_retard_win/gqk9yyi/?context=3)

[**CLICK THIS LINK**](https://www.reddit.com/message/compose/?to=RemindMeBot&amp;subject=Reminder&amp;message=%5Bhttps%3A%2F%2Fwww.reddit.com%2Fr%2Fwallstreetbets%2Fcomments%2Fm2d2qi%2F75k_gme_yolo_short_may_the_best_retard_win%2Fgqk9yyi%2F%5D%0A%0ARemindMe%21%202021-03-13%2011%3A35%3A56%20UTC) to send a PM to also be reminded and to reduce spam.

^(Parent commenter can ) [^(delete this message to hide from others.)](https://www.reddit.com/message/compose/?to=RemindMeBot&amp;subject=Delete%20Comment&amp;message=Delete%21%20m2d2qi)

*****

|[^(Info)](https://www.reddit.com/r/RemindMeBot/comments/e1bko7/remindmebot_info_v21/)|[^(Custom)](https://www.reddit.com/message/compose/?to=RemindMeBot&amp;subject=Reminder&amp;message=%5BLink%20or%20message%20inside%20square%20brackets%5D%0A%0ARemindMe%21%20Time%20period%20here)|[^(Your Reminders)](https://www.reddit.com/message/compose/?to=RemindMeBot&amp;subject=List%20Of%20Reminders&amp;message=MyReminders%21)|[^(Feedback)](https://www.reddit.com/message/compose/?to=Watchful1&amp;subject=RemindMeBot%20Feedback)|
|-|-|-|-|",1,0,1615462585,RemindMeBot
79,gqka0nd,"I'M RECLAIMING MY TIME!!!


*I am a bot, and this action was performed automatically. Please [contact the moderators of this subreddit](/message/compose/?to=/r/wallstreetbets) if you have any questions or concerns.*",1,0,1615462585,AutoModerator
