,comment_id,text,score,awards,timestamp,author
0,gqgr8il,[removed],1,0,1615395737,[deleted]
1,gqgr8rv,lay off the tang dude,0,0,1615395740,Han_Soldlow
2,gqgr9cs,Good luck 🚀,1,0,1615395746,umirinshreds
3,gqgri1e,Reading this makes me feel like the oxygen has been cut off to my brain for about 3 minutes too long.,9,0,1615395845,NorthCoast30
4,gqgrmmm,"Could have repurchased GME after making 5k and been up 16K, instead I’m holding shitty UWMC",3,0,1615395898,phantomofthej
5,gqgt0fn,"Only paper hand bitches lost, because you can't lose if you never sell.


Even i know that, and I ate 🖍️ crayons",4,0,1615396455,WawawaMan
6,gqgtou8,"I...sold at 147 to cut my losses, intraday traded back up to 300 and then just recently sold everything to buy more GME. I regret not holding and this experience has taught me a lot about trading stocks and the mentality required to do so. I am sorry for having been a fair weather ape and a paper handed bitch. 

I said this right before GME tanked and I sold fast enough to keep profits and buy back in once it starts soaring again.",5,0,1615396727,Darth_Cartsalot
7,gqguemf,[removed],1,0,1615397005,[deleted]
8,gqhl2ak,[removed],1,0,1615407375,[deleted]
9,gqidcb2,[removed],1,0,1615420400,[deleted]
10,gqifwt1,[removed],1,0,1615421761,[deleted]
11,gqj02ih,"You don’t have paper hands. You have a serious FOMO problem. Probably best if you take a break from Reddit, if you trade stocks out of FOMO you are doomed",1,0,1615432425,lokisk1155
12,gqkoe6s,"Mop chocolate bc d.  
Hoping high pipe pipkin",1,0,1615472003,tjboudreaux
13,gqvwnc7,"Yeah, I noticed that, After I sold GME again I decided to stop trading and following reddit for a bit. I made back my initial investment so it was time to step back and reevaluate.

Thank you for the advice. Definitely needed.",1,0,1615714748,Darth_Cartsalot
14,gqw1w8z,"Np in the long run you will be fine but it’s important to be real to yourself about FOMO. While gme is fun and I’m holding 5 shares @147 each, it’s pure gambling. The time to go all in was at 45, then 120, and now 250? You see what I’m getting at lmfao. There’s a stock that goes up 40-50% in a single trading day every week. Plenty of opportunities to come",1,0,1615720342,lokisk1155
