,comment_id,text,score,awards,timestamp,author
0,gqbnl0s,350-400 today most prob 🚀🚀🚀,1,0,1615295430,Madalin133
1,gqbnl5w,WHAT UK BROKERS LET ME BUY GME PREMARKET?,1,0,1615295432,uahimself
2,gqbnl6n,Moar 🍻,1,0,1615295433,Lyttald
3,gqbnlac,"Lmao, its literally so easy to know if its a bull trap or not, just look at gme if its up or not.",1,0,1615295434,jhonchaos
4,gqbnl9r,I'm someone who did,1,0,1615295434,chaotic646
5,gqbnlbr,"Put a tight stop limit on any stock that is as at a sort of peak now. It it goes up great, but if it comes down at least you will have only lost say 2%of your equity.

Maybe your businessmans risk is $200.

Better to lose that and be able to come back and buy it later on today when it’s cheaper",1,0,1615295435,TonyMontanaIsNice
6,gqbnlfx,"Today is the day my one month out $18c GE calls print.

(Do not refer to this later when it tanks, thank you)",1,0,1615295437,TheKingTodo
7,gqbnlkp,"I also really like the 10. It's not nearly as smooth as the 12 or 16, but it's got waaay more character",1,0,1615295439,funkgerm
8,gqbnlkd,tomorrow let the bulls have a false sense of hope for what’s to come in the next couple days,1,0,1615295439,mozzymemba01
9,gqbnlla,The Glenlivet 12,1,0,1615295440,jsb247
10,gqbnls7,Balvenie 14 Caribbean Cask,1,0,1615295443,Bananaman1229
11,gqbnlrj,"No, it would be a murder of dongs. Like your mother commits.",1,0,1615295443,getpiqued
12,gqbnlsq,Why did it surge and then immediately shit the bed just a few days ago?,1,0,1615295443,kramerica_intern
13,gqbnlxn,"No, i was joking",1,0,1615295446,MyBobber113
14,gqbnm1e,Forgot about state. Great headsup.,1,0,1615295447,manning18goat
15,gqbnm0e,"Can we post a GME thread? I hope you guys make it to the moon, but I dont want 9/10 posts here to be GME",1,0,1615295447,QueasyStrawberry
16,gqbnm4k,"No sense to this retard, but what do I know",1,0,1615295449,daymanlol
17,gqbnma4,How about we meet in the middle...Tepid Tuesday,1,0,1615295451,Original_betch
18,gqbnmab,Her funds all sank. Which is not an ideal characteristic of an ARK,1,0,1615295451,bagtf3
19,gqbnmal,The psychology of FOMO...TSLA was the epitome,1,0,1615295452,miket38
20,gqbnme3,GME go up today?,1,0,1615295453,Anusprolapsaucee
21,gqbnmdj,"I have tried Ardbeg (very solid whiskies), Laphroaig (the triple wood is incredible), Lagavulin (16 and DE are two of my favourites), Caol Ila (the 12 is great), G&amp;M’s Ledaig 12 (also one of my absolute favourites), but I’ve never had a Bruichladdich. It’s on my shortlist now, cheers :)",1,0,1615295453,TheCatInTheHatThings
22,gqbnmjn,Just buy puts at the point. 🤷🏾‍♂️,1,0,1615295455,BobbTheBuilderr
23,gqbnmht,"Imagine watching people tea bag an oil fryer and saying ""Wow! Let's do this!""",1,0,1615295455,TheClicketyBoom
24,gqbnmjh,"$42,069 seems okay",1,0,1615295455,Newhere84939
25,gqbnmlo,[removed],1,0,1615295456,[deleted]
26,gqbnmmd,I know it’s very dangerous but the word they use is called high-risk it’s still a strong buy but it’s a high-risk scared money don’t make money money can be replaced easily,1,0,1615295456,8444MyJail
27,gqbnmvn,Donguses.,1,0,1615295460,jhonchaos
28,gqbnmut,"better cover your shorts early melvin, dont want to have to cover when its over 250 after opening",1,0,1615295460,ILikeMyJob69
29,gqbnmwg,All the plays fly after I sell. Long rope,1,0,1615295461,Agent248
30,gqbnn3x,[removed],1,0,1615295464,[deleted]
31,gqbnn6l,"I mean, on a long enough time line you’ll be right... but you’re still wrong.",1,0,1615295465,jollyradar
32,gqbnnbn,[removed],1,0,1615295467,[deleted]
33,gqbnndm,I hope the bond auction drive yields down into the center of the earth,1,0,1615295468,thomaspeacock
34,gqbnng8,360$ eod,1,0,1615295469,SunniestSundays
35,gqbnnjz,"I don’t know but this is wholesome and I hope somebody gives you a good rec. 
Here’s one they drank on the TV show “Billions” for what it’s worth https://thebillionscompanion.net/all/want-a-taste The show is about taking down a corrupt hedgie so it’s fitting",1,0,1615295471,nyc-se
36,gqbnnjh,[removed],1,0,1615295471,[deleted]
37,gqbnniz,Yeah can we get a GME thread,1,0,1615295471,LabRealistic
38,gqbnnkh,"Can't really call it a bubble. It's a purely speculative play at this point, so it's just a matter of how much that idea and risk of it never happening is worth to people.",1,0,1615295471,Gigglebooster
39,gqbnnmm,You can’t get a retards hopes up like that,1,0,1615295473,Ehrenmeister
40,gqbnnny,Now I started buying boomer stocks and Dow stocks instead of all  in chadsdaq.,1,0,1615295473,stonkmarts
41,gqbnnnd,Alexa play REM Everybody Hurts,1,0,1615295473,ChannerT
42,gqbnntm,Yes I’ll watch it carefully and sell if I see it dip too far. At this point I prefer to by 10-20 $10-20 valuation stocks bc you see the profit faster but from what I’m seeing this morning I think GME will be a good bet for this morning. Thank you for the information!!!,1,0,1615295476,Ree131
43,gqbnnrp,Great whisky. Got a bottle here already tho ;),1,0,1615295476,TheCatInTheHatThings
44,gqbnnwj,"Gasp it’s 8 and SPY hasn’t broken my heart with a reversal yet?? You’re telling me this shit may actually
hold, LETS GOOOO",1,0,1615295478,BrokeDayTrader
45,gqbnnzs,So? We bull ran right through it last time. As long as you aren't holding Target you will be fine.,1,0,1615295479,Hadron90
46,gqbnnyv,It's coming.,1,0,1615295479,PhnomPenny
47,gqbno3o,I’m ready to fuck today.,1,0,1615295481,good-times-
48,gqbno5c,Look at me.  Look at me.  This is the Daily GME Thread now.,2,0,1615295482,ruck_my_life
49,gqbno5p,At this point if you aren't smart enough to dump junk and buy GME I feel bad for your wives boyfriends.,1,0,1615295482,wellletsfuckinggo
50,gqbno6n,[removed],1,0,1615295483,[deleted]
51,gqbno8l,Here we go you little stinkers 😘,1,0,1615295484,colonel-flanders
52,gqbnoab,Fireball?,1,0,1615295485,goosefire5
53,gqbnoea,GS2C,1,0,1615295486,Tommy-Tee123
54,gqbnoi6,"Me: ""I'm not falling for this again""....fuk",1,0,1615295488,Gigglemind
55,gqbnol1,25 by eow at best.  I doubt it goes in the 30s any time soon.,1,0,1615295489,pwnznewbz
56,gqbnols,so you can never sleep?,1,0,1615295489,FishnMagician
57,gqbnood,ɴᴏᴡ ᴘʟᴀʏɪɴɢ: [R.E.M. - Everybody Hurts (Of](https://www.youtube.com/watch?v=5rOiW_xY-kc) ─────────⚪───── ◄◄⠀[▶](https://www.youtube.com/watch?v=5rOiW_xY-kc)⠀►►⠀ 3:50 / 5:45 ⠀ ───○ 🔊 ᴴᴰ ⚙️,1,0,1615295490,___alexa___
58,gqbnou6,I came 29 times already today come on gme I making me rub Again,1,0,1615295493,Jizzings
59,gqbnou3,"Been eying $IAM, $NOTA and $CAT for a while, feel like there are buy signals everywhere.
Not financial advice, do your own DD",1,0,1615295493,LikeADawg
60,gqbnoyj,it's called volatility,1,0,1615295495,CobrinoHS
61,gqbnp00,"THIS MUTHAFUKKA THINKS WE'RE GOING TO PAY STUDENT LOANS .


fuck Navient",1,0,1615295496,bzboy
62,gqbnp2g,I’m from MN and the actual trial won’t start for a few weeks. Jury selection started yesterday and his lawyer is disputing an additional charge so everything is being delayed atm.,1,0,1615295497,left_hook_Walsh3
63,gqbnp4o,So many people being scared and feeling bearish means it’s finally over. Hardly anyone was celebrating futures last night. New ATH today,1,0,1615295498,MadmantheDragon
64,gqbnp5i,"That would be ironic ""we can't keep our employees because our stock purchase program is too lucrative""",1,0,1615295499,APHAbaghodler
65,gqbnp5y,"Remember that AMC’s market cap is up 600% since January because they’ve been converting debt to equity and dumping on WSB as fast as they can: https://ycharts.com/companies/AMC/market_cap

Market cap is currently the highest it has been since 2017. Keep holding the bag though noobs.",1,0,1615295499,chedrich446
66,gqbnp8j,[removed],1,0,1615295500,[deleted]
67,gqbnpbb,"Solid choice. It’s been a while since I last tried that one. I should get it again, you’re right!",1,0,1615295501,TheCatInTheHatThings
68,gqbnpet,[removed],1,0,1615295503,[deleted]
69,gqbnpfb,"imagine following a old lady who believes in creationism, for your stock picks. she even named her fund after the Ark of the covenant.",1,0,1615295503,Hexys_broken_dreams
70,gqbnphf,[removed],1,0,1615295504,[deleted]
71,gqbnpfy,Trial is going for a long time,1,0,1615295504,JugglingKnives
72,gqbnpga,"Yea, worth a shot. Is that right after their Q1 earnings report?",1,0,1615295504,Cheshire_Cheese_Cat
73,gqbnpja,All in on CSSE,1,0,1615295505,WillBeBannedSoon2
74,gqbnpkk,"Lagavulin 16 year, or if the tendies roll your way and you can find it the Lagavulin 25 year 🤤",1,0,1615295506,Samhq
75,gqbnpn7,Unless you’re talking about 2000 or 2008,1,0,1615295507,throwaway__3012
76,gqbnpmm,Everyone’s gangsta till Jpow starts printing. Bers r fucky,1,0,1615295507,Stranix49
77,gqbnpqb,This is WSB.......... Get you some Nighttrain or MD 2020 man,1,0,1615295508,RomanOctavius
78,gqbnpro,Ron Swanson tips his glass to you from across the room,1,0,1615295509,Moostucky_Stank
79,gqbnpvt,"Everything is a “distraction” these days.  

I very much enjoy GME going brrr... but when did GameStop start selling tinfoil hats?",1,0,1615295510,THOTsViews
80,gqbnpwh,This seems measured and reasonable therefore I hate it,1,0,1615295511,burninggreenbacks
81,gqbnpx8,"I wonder how to do this in Schwab.

Maybe I'll never know. Ahh.",1,0,1615295511,PhnomPenny
82,gqbnpz8,830 fam,1,0,1615295512,sikki_nixx
83,gqbnq0s,I went through a 6 month period of trying that month after month. GE is a tease. Hope you get paid tho 🍻,1,0,1615295513,DamascusWaygu
84,gqbnq5o,BB. Bears r fuk.,1,0,1615295515,Radiant_Plankton_303
85,gqbnq5f,"Def give that a shot, see how it works out.",1,0,1615295515,cl0akndagger
86,gqbnq81,Removed my limit sell at $195 last week... just removed my new limit sell of $350...,1,0,1615295516,SynfulEden
87,gqbnq9b,Dito!,1,0,1615295517,Maxitraxxter
88,gqbnqaz,Is burry still short tesla,1,0,1615295517,denniseveryone
89,gqbnqbh,I’ll save your comment! Thank you so much :),1,0,1615295518,TheCatInTheHatThings
90,gqbnqmq,Thanks!,1,0,1615295523,Tunes87
91,gqbnqr7,#It will always be on the menu along with desert as long as this shit continues.,1,0,1615295524,Empland
92,gqbnqrh,Don’t be a jackass. We are all in this game together trying to make a buck.,1,0,1615295525,Nuttin_Up
93,gqbnqrq,That GME premarket got me hard af,1,0,1615295525,good-times-
94,gqbnqsx,We got the bubble out of the way at Christmas time,1,0,1615295525,moon_buzz
95,gqbnqwt,I was referring to getting my wife a bf . Lol on the other hand I’m good. Thank you!,1,0,1615295527,nastygirl2020
96,gqbnr0y,TSLA bout to run BOI,1,0,1615295529,Bluerigg
97,gqbnr53,[removed],1,0,1615295530,[deleted]
98,gqbnr4g,"Ah an ape of culture I see. Peep edit if you’re open to gin, t’was my favorite before giving it up",1,0,1615295530,jsb247
99,gqbnr67,It’s hard to talk normie stonks when there’s men landing on Mars.,1,0,1615295531,Whatsitgonnatakeguys
