,comment_id,text,score,awards,timestamp,author
0,gqgzzo9,LOL WHAT THE FUCK IS HAPPENING I WENT FROM -4k to DOIN FUCKIN FINE,7,0,1615398847,ColeSomething
1,gqgzzp3,Huge green dildos!,2,0,1615398847,aveelance
2,gqgzzq8,Halted up again but at least they let it go for a couple minutes haha,5,0,1615398847,plimsickins16978
3,gqgzzoh,This is really some historic shit!! Apes strong,1,0,1615398847,she_may_be
4,gqgzzpl,this is the craziest fucking shit,9,0,1615398847,-plethorama
5,gqgzzq4,"Well, that was one way to clear out the stop losses.",10,0,1615398847,Dis_shite_rite_her
6,gqgzzo6,[removed],1,0,1615398847,[deleted]
7,gqgzzof,[removed],1,0,1615398847,[deleted]
8,gqgzzoi,"Fuck, 40% drop just to rocket back up to opening price. My blood pressure is as high as my gains",8,0,1615398847,pedantic_cheesewheel
9,gqgzzoe,[removed],1,0,1615398847,[deleted]
10,gqgzzr6,Really? Sure it’s not the halt?,1,0,1615398847,stocz
11,gqgzzpc,"We free-fall and rocket up. What is up? what is down? Who are apes? Who are suits?

Edit: when DFV gets elected as potus by us apes in 2024, I expect to be called to recite some poems on his Inauguration Day.",7,0,1615398847,lunakola
12,gqgzzr4,[removed],1,0,1615398847,[deleted]
13,gqgzzp8,uh oh its about to boom ;O,1,0,1615398847,cyan386
14,gqgzzpk,RIP to those who had stop loss,1,0,1615398847,TheRadishBros
15,gqgzzqw,god i bought that juicy dip,13,0,1615398847,blackiechan99
16,gqgzzqh,[removed],1,0,1615398847,[deleted]
17,gqgzzqy,You got me with this haha!,1,0,1615398847,Jealous_Pass_7985
18,gqgzzqf,🦍 like 🐋,2,0,1615398847,csguy97
19,gqgzzqn,HOOOLLY MOLLLY THE DIP WAS SO GOOOOOOD,10,0,1615398847,joemacross
20,gqgzzqv,We not fucking leaving! 🔹 🖐️,1,0,1615398847,eenigmaa
21,gqgzzo2,[removed],1,0,1615398847,[deleted]
22,gqgzzph,I want to buy but I dont have $200 available for a share,6,0,1615398847,SteamedArrow
23,gqgzzpz,just here to say I love all you filthy apes!,5,0,1615398847,goosebomb922
24,gqgzzrd,PHEW,5,0,1615398847,Jorte712
25,gqgzzo8,I hope they put this part in the movie! I nearly spit out my crayons.,2,0,1615398847,dramamuch
26,gqgzzt8,Is this the moon I see? Made of green cheese tendies?,9,0,1615398848,jenguish87
27,gqgzzrt,SLINGSHOT ENGAGED. SHAKE AND BAKE BOIS,1,0,1615398848,catz_with_hatz
28,gqgzzsb,"https://i.imgur.com/ewE9zoT.png

*I am a bot, and this action was performed automatically. Please [contact the moderators of this subreddit](/message/compose/?to=/r/wallstreetbets) if you have any questions or concerns.*",1,0,1615398848,AutoModerator
29,gqgzzrx,Well DANG! Looks like I missed my shot at 5 minute discount tendies.,10,0,1615398848,deliahhh
30,gqgzzsh,A dead cat bounces twice a day.,10,0,1615398848,Overcloak
31,gqgzzsl,I LOVE U FUCKING RETARDS LFG,1,0,1615398848,zionraw
32,gqgzzro,[removed],1,0,1615398848,[deleted]
33,gqgzzv8,[removed],1,0,1615398848,[deleted]
34,gqgzzu2,So scared I panic bought more,21,0,1615398848,DisreguardMe
35,gqgzzsu,Lmao IM ALREADY A BAGHOLDER FROM JANUARY U THINK THIS DROP SCARES ME?,17,0,1615398848,jelardbee
36,gqgzztb,Gap ups all the way to 1k today,7,0,1615398848,SignalSalamander
37,gqgzzv7,Should have got that dip :( didn’t want to drive my average up though as I’m at 120,9,0,1615398848,Lennon2016
38,gqgzzv0,This is like going down a waterslide with a bear behind you....,2,0,1615398848,Rahvinx
39,gqgzzvc,"Market circuit breakers. If there is a drop/increase of 10% or more within a certain amount of time it will halt trading for a time. How much the change and how many halts dictates the duration I believe.

https://www.investopedia.com/terms/c/circuitbreaker.asp",2,0,1615398848,gollito
40,gqgzztc,[removed],1,0,1615398848,[deleted]
41,gqgzzu1,rocket just had to refuel,9,0,1615398848,uhh_
42,gqgzzvv,[removed],1,0,1615398848,[deleted]
43,gqgzzvk,"This ain’t over.  I think the shorts will run out of ammo, while the longs can HODL forever.  Don’t paper hand you apes.",1,0,1615398848,honeybadger1984
44,gqgzzuu,[deleted],1,0,1615398848,[deleted]
45,gqgzzue,[removed],1,0,1615398848,[deleted]
46,gqgzzsp,"Or...or hedgies knew they could drive the price up because reddit is in love, they kept buying because y’all kept buying, then buy puts on the way up and sell off at lunch today while they make money on the fall.",1,0,1615398848,TarHeelTerror
47,gqgzztt,"Frickin paper hands probably sold around 300+ and also the bitch hedge funds did some magic market manipulation. DONT FUCKING SELL probably, its not advics. Im fucking retarded and want thjs to become 100k",1,0,1615398848,bas_e_
48,gqgzzt7,drinking hedgefund tears for happy hour tonight. just bought 50 more,1,0,1615398848,tdickles
49,gqgzzut,They can’t fucking stop us,7,0,1615398848,lfc8ynwa
50,gqgzztd,Halts on the way up now,10,0,1615398848,nickjane22
51,gqgzztq,What. The. Eff. David. Blaine.,1,0,1615398848,peternorthstar
52,gqgzzus,They deserve it loooool,1,0,1615398848,ThatCrazyDudee
53,gqgzzzt,[removed],1,0,1615398849,[deleted]
54,gqgzzyj,The diamond handed stay strong,6,0,1615398849,Sqantoo
55,gqgzzzs,[removed],1,0,1615398849,[deleted]
56,gqgzzwo,So how much is gme aiming for ? Realistically? 100k?1mil?,5,0,1615398849,sensei221
57,gqgzzyh,"As the souls of the dead fill the space of my eyes
And my boat listed over and tried to capsize
I'm this far from drowning, this far from the sea,
I remember the living do they think of me?
When my bones in the ocean forever GME",8,0,1615398849,Tomchambo
58,gqgzzwt,[deleted],1,0,1615398849,[deleted]
59,gqgzzwx,Alot,1,0,1615398849,turtle_explosion247
60,gqgzzzk,I noticed too. Wasn't saying shit all week about it going up. Didn't want any more people to know.,2,0,1615398849,civiksi
61,gqgzzww,FUCK THEM! 100k or nothing,9,0,1615398849,lordoma25
62,gqh0000,[removed],1,0,1615398849,[deleted]
63,gqgzzwk,Bought on every dip and so glad i did,6,0,1615398849,RecyclableTrashUS
64,gqgzzzv,I am so proud of everyone watching this pop right back up after the hedgies tried to fuck around.,22,0,1615398849,ElysianGuitars
65,gqgzzwu,Hahahaha just bought more. Hedge are FUK.,7,0,1615398849,whatchugonnad0
66,gqgzzzh,"i hope the SEC investigates what the fuck happend here. 

Stock will probably touch $300 again, but this was clear fuckery. 

Shorts are now so fucked",20,0,1615398849,wolfofballsstreet
67,gqgzzxl,LETS FUCKING GO YOU APES,6,0,1615398849,MechRxn
68,gqgzzx9,[removed],1,0,1615398849,[deleted]
69,gqh000t,Arise! arise my creation!,1,0,1615398849,dddnola
70,gqgzzy5,Hedgies needs some milk,1,0,1615398849,chrsry10
71,gqgzzxr,"Holy Shot, what a stock",3,0,1615398849,sealteamjerry
72,gqh000q,"HOLD, THE HEDGIES CANT BEAT THE SMOOTH BRAINS. SHOW THEM HOW LITTLE WRINKLES WE HAVE. LET THE ROCKET FLY",8,0,1615398849,chapions
73,gqgzzx8,Lmaoooo,5,0,1615398849,niceboatdownvote
74,gqgzzzg,Back in the green boys! 🔥🔥🔥sale still!,5,0,1615398849,larrybyrd1980
75,gqgzzzb,[deleted],1,0,1615398849,[deleted]
76,gqgzzz3,"DON'T USE STOP LOSSES  
  
THAT'S HOW THEY TRIGGERED THE SELLS FOR EVERYONE THAT HAD STOPS AT 300",14,0,1615398849,xSampleTextx
77,gqh000o,MY HEART CANT TAKE THIS WHAT THE FUCK,13,0,1615398849,BrilliantBleach
78,gqgzzx6,"ATTACK IS OVER, PREPARE FOR LIFTOFF!🚀💎🙌",2,0,1615398849,Aardkloot
79,gqgzzwr,[removed],1,0,1615398849,[deleted]
80,gqgzzw3,[removed],1,0,1615398849,[deleted]
81,gqgzzwy,#WHAT A DAY!,10,0,1615398849,LonelySwinger
82,gqgzzw1,Time for andromeda,1,0,1615398849,PleasantKnightmare
83,gqh0009,"Shit, I almost thought for a moment we would have a few more months to stack up on $40 shares. Fuck it, we back NOW!",1,0,1615398849,zmandarocks
84,gqgzzwg,"Just put another 4k in at 248 as soon as it let me, *inhales* discount fucking tendies",8,0,1615398849,Gurjot66
85,gqh004y,weeeeeeee haulted.,1,0,1615398850,j4k3b
86,gqh004o,I DONT I LIVE FOR THIS SHIT,1,0,1615398850,donutlad
87,gqh004g,"UP UP UP UP  


Omfg I'm having a heart attack",8,0,1615398850,Christimay
88,gqh003o,Halted again,1,0,1615398850,Taspeed
89,gqh003i,Monkey see monkey doooooo,5,0,1615398850,the-reus
90,gqh001a,[deleted],1,0,1615398850,[deleted]
91,gqh000z,No fucking way. Another halt!,9,0,1615398850,name_mcnameface
92,gqh001j,"halted again, insane",5,0,1615398850,Substantial-Lion-588
93,gqh001c,SIR THIS IS A CASINO,1,0,1615398850,-Faustian-Bargain-
94,gqh0028,"honeslty, what the hell is happening right now??",1,0,1615398850,Heraisacrazybitch
95,gqh001u,HALTED AGAIN LMAOOOOOO,10,0,1615398850,Brandofwb
96,gqh002b,[removed],1,0,1615398850,[deleted]
97,gqh0039,[removed],1,0,1615398850,[deleted]
98,gqh002p,TRY IT AGAIN I DARE YOU ILL BUY MORE,1,0,1615398850,bensiple
99,gqh001s,Everytime there is a dip... The boys holding at 400 throw a rope from up there so we can climb again.,11,0,1615398850,Guesswhat7
