,comment_id,text,score,awards,timestamp,author
0,gqjs5aa,"The other differences between VW and GME:

HFs
COVID
MOASS",1,0,1615449708,DMK5506
1,gqjsrju,Longest roller coaster I’ve seen. The peaks and lows are a hell of a ride,1,0,1615450109,RoninOni
2,gqjste8,Paper sells. Diamonds buy.,1,0,1615450143,RoninOni
3,gqjx6c6,I wouldn't include AOC in this list. She is fighting against lobbying and calls both sides out on their BS. If there's proof she is part of the corrupt by all means share and I'll read and become learned.,1,0,1615453281,Duderds
4,gqjxqc7,Perhaps it'll just be a hedge fund that is finally forced to close their short position.,1,0,1615453674,OddSituations
5,gqk287b,"I wouldn't have believed it two months ago, but my confidence in other retards have only increased over time.",1,0,1615457245,firmlyentrenched234
6,gqk2sh1,"You might be a shill, you might be not but it is kinda stupid to assume beforehand how it won't reach that high. The possibility is there. Having a plan is good but restricting yourself is not so smart. The more comments like this are posted the more people will paperhand and thus create a self-fullfilling proficy.",1,0,1615457650,lundoj
7,gqke0jk,"Did you not witness that huge downward spike yesterday? Went from about 350 to under 200 in less than 20 minutes then miraculously recovered?

That's a strong hold. Sure a few paper hands got shaken out, but the majority is holding. We've seen it work before in january when it went down to 40 then back up to 100.",1,0,1615465695,40ozT0Freedom
8,gqkk6qq,"500k is the floor, op is a paper handed bitch🤲🧻",1,0,1615469712,Bjarkifjarki03
9,gqklxaw,this is the way,1,0,1615470684,Bjarkifjarki03
10,gqkm0mn,[removed],1,0,1615470735,[deleted]
11,gql6w5p,You must’ve missed the sarcastic tone of my words 😂,1,0,1615480557,HammeredGolfer
12,gqlfo8s,[removed],1,0,1615484353,[deleted]
13,gqmjo93,[removed],1,0,1615501987,[deleted]
14,gqnn7kl,"I think paperhanding at 420 is the biggest issue. People that are nuts enough to stick to 1,000 are nuts enough to stick to 10,000.",1,0,1615522938,TeslaKickGas
