,comment_id,text,score,awards,timestamp,author
0,gq8vw8w,This happened at their last earnings too. I played that and got killed. Came back up and then some after a few months. Hate to say it but your calls are done for bud,2,0,1615232614,immatryitoutOK
1,gq8w8q8,"I just don't get it. I'm not an expert by any means, but looking at the charts, it looks *ripe*. Is MacD just completely fake then?",1,0,1615232763,MilesSteamed
2,gq8wb0w,My May 65$ contracts are bleeding but I been adding more and more. Two months is a good time to wait until they rise back up,2,0,1615232790,Alexolala
3,gq8we4e,I am a bot. This Discussion does not look like it has generated enough approval to stay on /r/wallstreetbets.                                    We algorithmically cull certain submission flairs whose response is not above a certain threshold to try and keep the page clean.,1,0,1615232826,VisualMod
4,gq8wi21,"I mean... technical analysis is great and all, but doesn’t really mean shit right now. No one knows for sure where market is headed right now. Crazy volatile and most likely headed for further correction",1,0,1615232873,immadunkonu
5,gq8z2d3,"TA works insofar as people want to use it. It can say whatever it wants, but on a low volume stock like PRPL, if people don't want to buy at that price, it's gonna go down.",1,0,1615233986,immatryitoutOK
