,comment_id,text,score,awards,timestamp,author
0,gqe4e7f,"AMC train is just leaving the station, it's not too late, retard. Cheaper pricepoint for entry, it's the poor man's GME. Not financial advice.",3,0,1615335605,Dxtuned
1,gqe4eaq,Futures r Fuk. When we gettin stimmy?,6,0,1615335606,TEdward504
2,gqe4ebi,"St Catherine of Ark

Buyer of Dips",15,0,1615335607,ExtensionAd2828
3,gqe4edj,"Ex-gf: If you don’t see how you’re being irresponsible with your money then I don’t want to have a partner that is financially unaware.

Me: “slaps bed” are you serious right now? yes i made 14k and then lost it, but it isn’t gambling. When I invest in the stock market, I learn. A lot of people don’t even know what a 401k is or does. This is a big lesson and I’m not going to repeat the same mistake. Doesn’t mean I SHOULDN’T be in the stock market. You don’t understand. Why can’t you see that I do this for our future?

Ex: it doesn’t matter. The fact is that you gambled more money than you could lose. If you had just gambled half of what you made, MAYBE you could have saved yourself from that mistake and still be up. I think YOU’RE the one that is being irresponsible. I don’t even invest and it’s a hell of a lot better than trying to gamble lost money back like you have to do now.

Me: I TOLD YOU, IT IS NOT GAMBLING. THE STOCK MARKET IS FOR ME TO INVEST FUCK MAN HOW DO YOU NOT GET THAT? 

Ex-gf: stomps and leaves and slams door shut loudly. I DO NOT WANT YOU TO TALK TO
ME ANYMORE IF YOURE GOING TO YELL LIKE THAT AND BE FINANCIALLY IRRESPONSIBLE. 

...

We are not together anymore.",6,0,1615335607,Fit-Mycologist-6951
4,gqe4elj,Tomorrow we tear down this $300 wall!,2,0,1615335610,stenglboy96
5,gqe4eof,I need something to buy,2,0,1615335612,ilikepie145
6,gqe4ewd,Open app close app open app close app every 10 seconds. I think I’m a true junky now.,15,0,1615335614,jbjokerr
7,gqe4ey7,This means that I now also own 1000000 shares of dkng lol,4,0,1615335615,thatsenoughMrLahey
8,gqe4ewz,"NY summers are almost worth dealing with the winter. Roads are shit. But definitely go to Lake George homie. Such a killer spot in the adirondacks, big camp grounds. Was drunk one year got lost in the woods and heard music in the distance. It was a massive log cabin club and a party in the middle of the woods. If you get a girlfriend that isn't afraid of nature, its a great time. Even climbing the mountains, took us 8 hours on one of them. Love that spot, solo is dope too",3,0,1615335615,Surfincloud9
9,gqe4f3m,Thanks.,1,0,1615335617,31andnotdone
10,gqe4f5m,Don’t joke about that. You will be eaten,-1,0,1615335618,wmzombie
11,gqe4f98,"If the 10 yr can drop below 1.5 so tech can have more green days like today, that would be great.",4,0,1615335620,edgedrazor
12,gqe4fke,Never listen to dumb fuck analysts putting price target at $3. I then proceeded to dump and not buy the dip in GME but invest more in PLTR 🤡,1,0,1615335624,Cliving01
13,gqe4fqv,Maybe when I get my stimulus check I’ll finally be able to start trading! I’ve just been watching you guys for 3 weeks now and feel like I’ve learned so much! I think I’m going to buy appl cause everyone has an iPhone! I’m so excited 🤪,8,0,1615335627,Daddy_wont_stop
14,gqe4ftf,Months ago. I was working mostly from home lately though so it didn’t matter until recently.,1,0,1615335628,Hate_WhenThatHappens
15,gqe4fxq,Bot,-3,0,1615335630,blaclaureate
16,gqe4g47,[removed],1,0,1615335632,[deleted]
17,gqe4g7f,[removed],1,0,1615335633,[deleted]
18,gqe4g72,[removed],1,0,1615335633,[deleted]
19,gqe4geq,Probably a inside bet,1,0,1615335636,LysergicFilms
20,gqe4gfv,"When the duck they gonna announce, I got 50c on it expiring soon.  Something tells me it won't be by then.",1,0,1615335637,HookersForDahl2017
21,gqe4ggi,I'm just accumulating at these prices and buying LEAPS.  Ez money,2,0,1615335637,watchthegaps
22,gqe4gn2,"As I understand it, it can't stop and/or it won't stop.",16,0,1615335640,EatinPussySellnCalls
23,gqe4gog,Bro that sub is toxic in a very weird way.,3,0,1615335640,thatsenoughMrLahey
24,gqe4gp3,My puts r ded  💀,1,0,1615335641,dennis8542
25,gqe4gsb,[removed],1,0,1615335642,[deleted]
26,gqe4gwi,What are some good pick up lines to flaunt the fact that I’m RICH and have a TESLA? My face is lacking,8,0,1615335643,Ricketycrick
27,gqe4h0u,These are literally the two people who got the worst deal on each option all day long. Still I’d take the c700 for cheaper. Feel bad for the other guy when friday closes at $750,2,0,1615335645,somedood567
28,gqe4h3c,Excuse my autist sentence structure but I am also a big fan of Minecraft ever since I got it still in beta mode,1,0,1615335646,Beautiful-Pace
29,gqe4h2b,[removed],1,0,1615335646,[deleted]
30,gqe4h8b,Yeah yolo it all and keep us updated no matter the outcome.,1,0,1615335648,LikeGatsby
31,gqe4ha0,Gonna yolo that play too tomorrow lol,1,0,1615335649,AxemanFromMA
32,gqe4h9g,[removed],1,0,1615335649,[deleted]
33,gqe4hb1,I don’t wanna talk about it.,2,0,1615335649,Lob_thrifty
34,gqe4hd9,That motherfucker. He should still pony up or get a ban. I know someone screenshot his original comment where he did not specify EOD.,6,0,1615335650,Im_A_Canadian_Eh
35,gqe4he8,I think the after hours spike in AMC was some of the call options getting covered (aka gamma squeezing). As long as the exercised options are held we can keep doing this week after week until the first paper handed hedge fund kick starts the short squeeze. 🚀🚀🚀,8,0,1615335651,ScottSilver12
36,gqe4hkk,[removed],1,0,1615335653,[deleted]
37,gqe4i4v,"Tesla’s incredible. I lost 2,000 on it today and I’m jut impressed. Wow. I won’t be betting against it again.",26,0,1615335661,Okayokaythatsnotgood
38,gqe4i6o,Downvote for you,0,0,1615335662,LysergicFilms
39,gqe4i9j,[removed],10,0,1615335663,[deleted]
40,gqe4idh,You know what mends a broken heart? Tendies.. lots of tendies.  I would say tesla shes rippin,2,0,1615335665,WeaponizedAutism12
41,gqe4ii9,[removed],1,0,1615335667,[deleted]
42,gqe4iro,"Lmao bro.. this is 100% gambling, she’s right, you’re a retard",28,0,1615335671,BrokeDayTrader
43,gqe4ixf,Does anyone else play the game where you notice your invested amount went up a small degree so you look through your whole porty to try to figure out which stock went up 12 cents AH?,17,0,1615335673,DothrakAndRoll
44,gqe4ixp,It’s not your money is it?,1,0,1615335673,silvertornado12
45,gqe4j31,[removed],1,0,1615335675,[deleted]
46,gqe4j1d,Get out while u can.,1,0,1615335675,SlickChickk
47,gqe4j3e,[removed],1,0,1615335676,[deleted]
48,gqe4j5j,[deleted],3,0,1615335676,[deleted]
49,gqe4j4f,Me probably cause I’m kinda retarded and this is my first time doing anything with stonks,2,0,1615335676,crete_surfer
50,gqe4j8h,"Yeah I've moved in and back out many times on AMC with options and stocks. Only losing $100 one time. The rest fairly big wins. I guarantee you if I had dropped 700k I would have been gorilla diamond handing that b**** until it came at least close to back even. 

He really never believed in the movie stock coming back or he wouldn't have sold. If you have 700k to drop on a meme stock you can surely wait a few months until it goes back up LOL",3,0,1615335678,AcesHidden
51,gqe4jdg,"I bought GME puts

what you gon do ape",1,0,1615335679,Successful-Avocado-8
52,gqe4jb1,There’s this magical thing called long term gainz tax,1,0,1615335679,donobinladin
53,gqe4jl6,"I don’t want to pull my money yet until they GME is over, then I’ll transfer to fidelity.",2,0,1615335682,gliz5714
54,gqe4jq7,"&gt;330 comments

shaved?",1,0,1615335684,MagnificentSchwantz
55,gqe4k40,That dhip has sailed for now. Today was lock up expiration and people myself included expected that the price would fall. It was a great catalyst but we couldnt expect that those people are literally brain dead apes that wouldnt sell at these inflated prices and even would buy more... Atm the stock is simply overvalued as fuck and with the pandemic being defeated dash wont make as mucj money,2,0,1615335690,Danilieri
56,gqe4k29,BB all the way 🚀🚀🚀🚀,15,0,1615335690,ShazamMan701
57,gqe4k6x,[removed],1,0,1615335691,[deleted]
58,gqe4kjk,Yeah I thought that after lmaoo.. china would have the bridge up in 2 days lmaoo puts on USA,1,0,1615335696,ButtersDaBeast
59,gqe4kjo,is this a fan fiction or a meltdown wth is going on bro,13,0,1615335696,imsilver4fukyou
60,gqe4koy,With the stimmy on its way...look to the stars no less,1,0,1615335698,Lil_Retweets
61,gqe4koc,"Cathie buying in 100 share lots, sign of a person who almost blew up their account",19,0,1615335698,popstockndropit
62,gqe4knw,I am not a cat.,12,0,1615335698,EatinPussySellnCalls
63,gqe4krv,New fast food restaurant,1,0,1615335700,dennis8542
64,gqe4l18,cash advance from credit card,1,0,1615335704,Hashashin455
65,gqe4lo2,Also AMC YEEE,10,0,1615335713,weezleheadjr
66,gqe4lnb,I have to sell 1 share at 500 just for my piece of mind and to be playing with house money. The rest of my 4 shares will go as high as they can.,2,0,1615335713,GreenArrowDC13
67,gqe4lqp,You ever have sex while gme gains? I tried the other day while my wife got dicked down by the milk man.,1,0,1615335714,Lob_thrifty
68,gqe4m83,Are we jumping on Roblox or is Roblox jumping us 🤔,1,0,1615335721,Hl_IM_MR_MEESEEKS
69,gqe4mbr,"Same brother, makes me feel stupid",2,0,1615335722,52-75-73-74-79
70,gqe4mbm,Fidelity is trash for options,0,0,1615335722,jaguarpawww
71,gqe4mf7,[removed],1,0,1615335724,[deleted]
72,gqe4mhw,"I think my dog is close to moving on. 

Puts on my mental health",19,0,1615335725,RH_Fucked_My_Account
73,gqe4miw,Really retarded for me to blow up my account. Just need 2 more days like today to maybe breakeven🤡,6,0,1615335725,11504
74,gqe4mjr,"Finance is mostly made up of scam artists. 

T/F?",4,0,1615335726,GrandSacko
75,gqe4mqr,[deleted],1,0,1615335728,[deleted]
76,gqe4mru,Thats the ticket.,1,0,1615335729,argusromblei
77,gqe4mtw,Gme AH,13,0,1615335730,Dry-Sympathy-3451
78,gqe4mug,Apes running outa money maybe? Get 2nd jobs now!,5,0,1615335730,SpiritedWrongdoer196
79,gqe4n5t,BLOOD RED FUTES BULLS R KILL,-2,0,1615335735,MuskIsAlien
80,gqe4n8h,Ok,6,0,1615335736,Butch_Cassidy109
81,gqe4nap,"To everyone that tried to convince me to sell a few weeks ago.... SUCK THESE DIAMOND HANDS, PAPER BOIS 💎🙌🚀",21,0,1615335737,artlanta
82,gqe4nb0,[deleted],-12,0,1615335737,[deleted]
83,gqe4njv,"If you invest in tesla girls will think you are a big dick baller, if you inveat in GME they will think you are some small dick retard child",0,0,1615335740,WeaponizedAutism12
84,gqe4no9,A M C fuckers,8,0,1615335742,weezleheadjr
85,gqe4nxg,Watch as they wither away worthless,11,0,1615335746,imsrrybby
86,gqe4o1m,I am now 0/3 and probably will just delete it from my watch list at this point lmao,7,0,1615335748,P33L_R
87,gqe4o7i,Damn I’m not even playing GME but I definitely wouldn’t bet against GME at this moment,19,0,1615335751,BrokeDayTrader
88,gqe4ob1,"And loose my rocket to the moon and liquidate all my GME shares, no way, I'm a gambler, if I gamble on GME at $40 a share,  i gamble on RobinHood",2,0,1615335752,lost_survivalist
89,gqe4ofb,Futures might be saying today was a dead cat but I wanna wait for Asia and Europe to open before I comment,2,0,1615335754,throwaway__3012
90,gqe4ohi,They probably figure they cannot get anything else to the front page. I'd be cool if other ticker mentions were weighted more than GME.,1,0,1615335755,Top-Turn1055
91,gqe4omx,[removed],2,0,1615335758,[deleted]
92,gqe4ozp,Wise man,3,0,1615335763,Unrealforreal112
93,gqe4pci,[removed],1,0,1615335769,[deleted]
94,gqe4pc2,[removed],1,0,1615335769,[deleted]
95,gqe4pj8,Aren’t you retarded?,1,0,1615335772,PumpkinRice
96,gqe4ppv,I can see it on tda,1,0,1615335775,tandin01
97,gqe4pun,Really? My experience in the Seattle area is the opposite. They are the fastest and most reliable compared to Uber Eats or any of the other offerings. I wonder if maybe it's regional?,2,0,1615335777,AcesHidden
98,gqe4pxp,"
What the fuck did you just fucking say about me, you little bitch? I’ll have you know I graduated top of my class in the WSB academy, and I’ve been involved in numerous secret shorts on Melvin, and I have over 300 confirmed dollars. I am trained in gorilla warfare and I’m the top ape in the entire US armed forces. You are nothing to me but just another target. I will wipe you the fuck out with precision the likes of which has never been seen before on this Earth, mark my fucking words. You think you can get away with saying that shit to me over the Internet? Think again, fucker. As we speak I am contacting my secret network of spies across the USA and your IP is being traced right now so you better prepare for the storm, maggot. The storm that wipes out the pathetic little thing you call your life. You’re fucking dead, kid. I can be anywhere, anytime, and I can kill you in over seven hundred ways, and that’s just with my bare hands. Not only am I extensively trained in unarmed combat, but I have access to the entire arsenal of JPow’s printer and I will use it to its full extent to wipe your miserable ass off the face of the continent, you little shit. If only you could have known what unholy retribution your little “clever” comment was about to bring down upon you, maybe you would have held your fucking tongue.

But you couldn’t, you didn’t, and now you’re paying the price, you goddamn idiot. I will shit fury all over you and you will drown in it.

You’re fucking dead, kiddo.",4,0,1615335778,manlygale
99,gqe4pym,"I'M RECLAIMING MY TIME!!!


*I am a bot, and this action was performed automatically. Please [contact the moderators of this subreddit](/message/compose/?to=/r/wallstreetbets) if you have any questions or concerns.*",1,0,1615335778,AutoModerator
