,comment_id,text,score,awards,timestamp,author
0,gqaz5pt,The fuk is this,1,0,1615274142,xdarkmanateex
1,gqaz6tz,Even Jack Ma knows,1,0,1615274168,KoalaKurupts
2,gqaz7cp,GME gang gang,1,0,1615274180,defendthecastle
3,gqaz7om,This idiot is typing out his aneurysm,1,0,1615274189,bartolocologne40
4,gqaz7qr,fuckin weirdo,1,0,1615274190,1for1succc
5,gqaz8rs,r/wallstreetbetssucksdik,1,0,1615274214,chasedog1967
6,gqaz961,Hitler modeled his military expansion plan after the US slavery model,1,0,1615274223,KoalaKurupts
7,gqaz9cv,You should try this sub: r/fuckwsbmods,1,0,1615274228,Dan_inKuwait
8,gqaz9di,"i belive its pronounced ""Buy and Hold""",1,0,1615274228,iprobablydied
9,gqaz9fa,[removed],1,0,1615274229,[deleted]
10,gqazibn,"Hitler incarnate to learn about we then tomorrow maybe then we might possibly could but HITLER DID THE USA BAD THINGS FIRE AND GOD BUT AMERICA IS SLAVERY OF TOMORROW IN ALL IDEOLOGY HITLER DREAMED


did I communicate right?",1,0,1615274448,cattmurry
