,comment_id,text,score,awards,timestamp,author
0,gqhmlf9,I think it’s ROBLOX,3,0,1615408036,budzene
1,gqhmlw4,[removed],1,0,1615408042,[deleted]
2,gqhmmyk,[removed],1,0,1615408054,[deleted]
3,gqhmphf,The kids like the stock. I like the stock.,2,0,1615408086,le_Menace
4,gqhmpps,"I like the stock

Don’t like the price rn tho. But I’m a professional bag holder so this should be easy😀",3,0,1615408088,blingbladeade
5,gqhmpwz,[removed],1,0,1615408091,[deleted]
6,gqhmqqs,Roblox to the moon,2,0,1615408101,antxnioh
7,gqhmv2v,This is some good DD.,1,0,1615408152,miles_crotch
8,gqhn1u1,my nephew said he fuks wit it. 30 shares deep.,1,0,1615408231,dRiP2oN
9,gqho6sp,[removed],1,0,1615408702,[deleted]
