,comment_id,text,score,awards,timestamp,author
0,gqngivv,Rain Man walks into the stock casino 😄,2,0,1615519104,Lucky2240
1,gqngpwn,[removed],1,0,1615519209,[deleted]
2,gqnhfbv,Thats a lot of assumptions,1,0,1615519596,utnag
3,gqnhpy8,"I like how he talks about coefficient like the market is actually an engineering problem and not a mass psychology problem.  And no, I don't believe in psychology.",7,0,1615519760,JMLobo83
4,gqni2ei,Saving this comment for tommorow,5,0,1615519951,jarredkh
5,gqnic5l,That is not Wall Street lmao you have clearly never been,1,0,1615520102,BashfulTurtle
6,gqnihh0,guh,2,0,1615520184,ComputerTE1996
7,gqnjf88,[deleted],1,0,1615520715,[deleted]
8,gqnji2x,[removed],1,0,1615520761,[deleted]
9,gqnkd36,He's gonna need to add another digit for labor needs calculations for next week.,2,0,1615521256,a_spicy_memeball
10,gqnklku,Fuck everyone who is trying to shit on you. Good luck dude,4,0,1615521391,TheBigLeboofski
11,gqnkm4b,"Inagine putting in this much work for a wrong theory, then placing a $90k bet on that wrong idea 😂",3,0,1615521401,ballgobbler96
12,gqnkqmp,Cant wait for op to lose it all. You are truly retarded buddy. Beautiful.,0,0,1615521475,babybrazil
13,gqnkwk9,"So my random assumptions, including expecting a guy he never met to double down again exactly 21 days later.

And a zero regard for how options work and how theta will kill his plays.

This is why WSB tells new traders to not fuck with options.",1,0,1615521572,Chicano_Ducky
14,gqnkz1m,please remind me when he reminds you,2,0,1615521613,saccharind
15,gqnkz0c,tbh I'm worried of a stimmy frontrun but LFG,2,0,1615521613,me_irI
16,gqnl3ur,"This is the worst DD I’ve ever read. Even the conspiracy theory DDs make more sense then this.

God speed, retard.",2,0,1615521690,rook785
17,gqnlk9y,[removed],1,0,1615521958,[deleted]
18,gqnlwsp,Please remind me you know where when he reminds you,1,0,1615522161,Mkulltra58
19,gqnm04z,stimmy is priced in with brrrrrrrrrrr,1,0,1615522215,maxorama
20,gqnm4m0,Please do that when this do the other thing,3,0,1615522288,WeDontLetHateWin
21,gqnmfhp,The real comment hero,1,0,1615522468,mirrari0
22,gqnmm1q,remind me hoe,1,0,1615522575,bradyreid
23,gqnmo7l,[removed],1,0,1615522613,[deleted]
24,gqnmv6g,[removed],1,0,1615522729,[deleted]
25,gqnn3jb,[removed],1,0,1615522870,[deleted]
26,gqnn3qp,[removed],1,0,1615522873,[deleted]
27,gqnn860,"stimmy priced in markets but the inflow to gme from individual stimmies is probs underestimated 

I just wished the deposits were right before next Friday so I could buy some cheap calls lol",1,0,1615522948,me_irI
28,gqnna2k,"I’m kind of cringey on this because I’ve had to do data analysis for many engineers and they are often more of an obstacle than anything else. Extremely intelligent, very A+B=C and thus, horrendous at statistical analysis. If you asked 90% of them to run a financial/economic simulation, you would get better results from a college freshman. There’s a reason they suggest MBAs for engineers-helps with real world thinking. Again, some of the most intelligent people I’ve ever met, but as mentioned by someone else above, they struggle when psychology comes into play/ when things aren’t textbook cases. My dad is an engineer, and do you know the only two college courses he got C’s in?  Accounting and Statistics. His hardest classes, according to him.  I’d be rolled over by a truck if I took half of the required engineering classes.",3,0,1615522980,kaybee513
29,gqnna2z,"Our AI tracks our most intelligent users. After parsing your posts, we have concluded that you are within the 5th percentile of all WSB users.

*I am a bot, and this action was performed automatically. Please [contact the moderators of this subreddit](/message/compose/?to=/r/wallstreetbets) if you have any questions or concerns.*",3,0,1615522980,AutoModerator
30,gqnnfrp,remind yourself bitch,2,0,1615523077,Mirfster
31,gqnnlog,"Exactly. He’s 100% an engineer. His process is methodical and well thought out from an engineering perspective. Except, it doesn’t have much real world application in financial analysis. It omits all potential outliers/the model has no real assumptions or inputs.",7,0,1615523176,kaybee513
32,gqnnyaa,But...does this mean the bottom or top 5%?!  😂😂,3,0,1615523395,kaybee513
33,gqnof58,[removed],1,0,1615523689,[deleted]
34,gqnogb0,[removed],1,0,1615523709,[deleted]
35,gqnornb,This is awesome If your right bro u will be a legend. I’m buying back in tomorrow now fml,1,0,1615523911,Cryptosinn
36,gqnosyt,"I do, but also very much do not want to see this",1,0,1615523933,alt717
37,gqnq3b8,[removed],1,0,1615524762,[deleted]
38,gqnr7in,(Retardedness of this post)x(Autism level of these comments)=yeah definitely gonna hit $350 tomorrow,1,0,1615525507,ShogoGarcia
39,gqnra7j,"Mr Meeseeks: Why’d you even rope me into this?

Mr. Meeseeks: Well, he roped me into this!

Mr. Meeseeks: Well, that guy over there roped me into this!",1,0,1615525555,Ophan_Pharaoh
40,gqnri1i,"Hahaha bro this is absolutely legendary, win or lose. I’m honestly rooting for you, this DD is hilarious. Possible wsb iconic bet",1,0,1615525698,Aaaaaaaaaaah12
41,gqnrks5,Lol this is fucked tho 😂,1,0,1615525749,Aaaaaaaaaaah12
42,gqnrm14,Better price in xrt rebalancing too while youre at it,1,0,1615525773,maxorama
43,gqns4hs,You're slow to miss that much sarcasm. You must be one of those people the /s is for.,2,0,1615526118,Questions4Legal
44,gqns6su,"Mmhm sure.

Not buying it",0,0,1615526164,BashfulTurtle
45,gqntgpz,[removed],1,0,1615527038,[deleted]
46,gqnti43,My exact words when I got to the bottom: “Of course he is an engineer!”,2,0,1615527066,Runningoutofideas_81
47,gqntm8g,"Gotta love them, they're so much smarter",2,0,1615527146,JMLobo83
48,gqntrd0,"Percentile always means ""bottom.""  😭",1,0,1615527247,JoeDirtTrenchCoat
49,gqntrz8,"I am dying here, even the WSB bots are fucking gold!",1,0,1615527259,Runningoutofideas_81
50,gqnu1cw,what's your play,1,0,1615527446,me_irI
51,gqnu9kt,[removed],1,0,1615527604,[deleted]
52,gqnuldv,"[Screenshot backup.](https://imgur.com/a/5fHdKv5)

!Remindme 18 hours",1,0,1615527835,Internep
53,gqnuxu5,[removed],1,0,1615528087,[deleted]
54,gqnvl2v,There is an XKCD about this.,1,0,1615528561,Karmic0
55,gqnw5tp,This is gourd levels of retardant,1,0,1615528994,HeavyHandedWarlord
56,gqnwltp,"Dude thank you. If you’re this retarded and have good job, I’m feeling good about finding a job after graduating.",1,0,1615529326,sxe_qs
57,gqnwnh3,[removed],1,0,1615529360,[deleted]
58,gqnx4wg,... The rest of the engineering departments called the IE’s - “Imaginary Engineers” - very fitting 🥴🥴🥴,1,0,1615529732,rhettski89
59,gqnxua3,If this works..,1,0,1615530276,Wootarn
60,gqnyjej,There is something called back testing. Would have saved you a lot of money.,1,0,1615530826,aMaG1CaLmAnG1Na
61,gqnz8xn,Prayers for you. 🙏🏻🙏🏻🙏🏻,1,0,1615531401,redsolocup6
62,gqnzuj9,"Remember on the end of every commercial for a financial advisor or brokerage that says “past performance is not indicative of future results.” Yeah, I have no damn idea what that means either, but I sincerely hope you’re spot on with this! Best of luck!",1,0,1615531891,Fabulous-Flan-3583
63,gqnzvwx,This guy completed the entire Dunning-Kruger effect in his field of engineering then took that momentum and switched to investing without realizing he is now back on the left side of the competence scale.,1,0,1615531922,StopTooManyPeople
64,gqo0ebe,"The problem with this starts at the basic assumption that a set amount of volume always leads to the same price increase. Since you’re using the closing and opening price. There could be 10, or 10k volume that lead to the same price increase. Volume doesn’t tell us who were the buyer and sellers. As a result your whole formula breaks down since it’s based on that premise. Best of luck tomorrow my dude.",1,0,1615532340,MrNutty
65,gqo2a53,[removed],1,0,1615533911,[deleted]
66,gqo4nzj,This has to be a troll😂😂,1,0,1615535997,dr_adder
67,gqo4og5,Oh my god this thing is the funniest shit I have ever read for “real DD” and without much feedback. Then went balls deep. Damn this one physically hurts me to know someone did this. Good luck OP!,1,0,1615536008,Tricera-clops
68,gqo5izp,"RemindMe! 1 day ""that one fucking retard that threw away his 90k""",1,0,1615536785,kdzo03
69,gqo6w40,Well how much do engineers make? Because this is legit the 5th guy I’ve seen on WSU yolo’ing this type of loot. Fuck it’s an entire years salary (main) lol. But fucj it I hope the price tickets and he made look,1,0,1615538079,ratsmdj
70,gqo7axn,...I know 😂,1,0,1615538484,kaybee513
71,gqo7cb6,....yea I know 😂,1,0,1615538521,kaybee513
72,gqo7uvg,I read it as percent and not percentile. So clearly the bot is right and I’ll just go back to my corner and eat more crayons.,1,0,1615539033,kaybee513
73,gqo8558,This is literally the dumbest thing I've ever read in my entire life and I fucking love you you sweet beautiful retarded spring child,1,0,1615539317,reverend_al
74,gqo8hzm,"Gme stock for only the next few days, then probably some boomer shit OTM calls around earnings in april (F, V, REITS)",1,0,1615539681,maxorama
75,gqo8y6k,"“I found a formula that predicts the future, because no one else has ever tried. I am the smartest. I know inverse $90,000.”",1,0,1615540140,apexdp266
76,gqoalcg,"Lol. A lot of engineers get attracted to the stock market. Because it has to do with numbers, they believe that it plays to their strengths. Almost all of them end up losing money. 

I think Separate Variation had an engineering background too from what I remember, and we know what happened with him.",1,0,1615541806,mylegbig
77,gqoci6j,How can one not believe in psychology?,1,0,1615543778,SirHawrk
78,gqod5p0,RemindME! 12 hours,1,0,1615544448,timin-oo-libin
79,gqodb8r,[removed],1,0,1615544605,[deleted]
80,gqoezra,"Mods, this comment right here.",1,0,1615546267,Innovationenthusiast
81,gqog5i6,Same,1,0,1615547393,jonnyl3
82,gqogbj1,"Insert the obligatory ""YOU ARE HERE"" marker 😂",1,0,1615547556,qwertyhole
83,gqohm5i,Read it with Ben Shapiro's voice....🤣🤣🤣,1,0,1615548747,sbow88
84,gqoj97b,This posts reads like Homer Simpson's prediction of the apocalypse,1,0,1615550154,Comprehensive-Yak493
85,gqonrg6,"I can't believe it, but I can see it happening so bad",1,0,1615553529,fiscotte
86,gqool36,It’s a mass psychology patty wrapped in an algo bun with insider sauce.,1,0,1615554068,ThorAlmighty
87,gqoqnwl,"I don't even want to go back into work from my break. I just want to sit here and keep reading these comments all day.

OP you're retarded and we love you here. This is a safe place for you always remember that.",1,0,1615555369,supersayanssj3
88,gqoqtde,Seperate variation was right until jpow turned on that printer quite literally,1,0,1615555463,PM_ME_TENDIEZ
89,gqoqu57,"Your mistake was basing this on Historical Data. When will people learn that human behavior is unpredictable. Now if you had based on this on existing options, you'd have a better idea of what others are forecasting and may have been closer to the money. Anyway; what the fuck do I know; I hope you print 6 figures today. Good luck!",1,0,1615555476,tsevni
90,gqorgu7,[removed],1,0,1615555848,[deleted]
91,gqov3m9,"As the study of the psyche, it is notorious for being incapable of providing reproducible experimental results.  Probably has something to do with the fact that our understanding of ourselves is quite limited.",1,0,1615557837,JMLobo83
92,gqow99p,"This is fucking legendary. Godspeed to you today, you either become retard of the month or the next DFV.

🚀🚀🚀",1,0,1615558444,CommanderCone
93,gqowie0,Yeah but it still exists. That's kinda like saying weather doesn't exist because we can't accurately predict it isn't it?,1,0,1615558575,SirHawrk
94,gqox150,That's an inexact analogy but so was my statement.  I don't believe in the scientific feasibility of psychology.  It's not a science.,1,0,1615558840,JMLobo83
95,gqoxcbq,More akin to meteorology which is the *study of* weather and not weather itself. The study of psychology is limited but that’s not saying that psychological processes aren’t happening all the time,1,0,1615558999,VicedDistraction
96,gqoxxqg,In for legend ... LFG!!!,1,0,1615559298,ratsmdj
97,gqoxzce,Gotchu,1,0,1615559320,SirHawrk
98,gqoz735,fine idiot i’ll remember,1,0,1615559929,bradyreid
99,gqp2ffi,Good luck,1,0,1615561512,ButterKnights2
