,comment_id,text,score,awards,timestamp,author
0,gqhigbr,"Nobody tell him

*I am a bot, and this action was performed automatically. Please [contact the moderators of this subreddit](/message/compose/?to=/r/wallstreetbets) if you have any questions or concerns.*",7,0,1615406252,AutoModerator
1,gqhir49,[removed],1,0,1615406377,[deleted]
2,gqhirik,"Yeah bud, there was possibly massive stock manipulation today. It stands a good chance all buys will be reversed if it’s proven correct. So just keep an eye out and let us know",5,0,1615406381,Theaudacity0fit
3,gqhirsr,Jumping Jehusifus!,1,0,1615406385,lifemanualplease
4,gqhit4l,"I am a bot. A Gain/Loss/YOLO should be a picture of a closed gain, a closed loss, or an open position &gt; $2,500.",2,0,1615406400,VisualMod
5,gqhiw2p,says who?,4,0,1615406434,Scottieg99
6,gqhj6mj,"Bro I hope it does, we must believe! Shan’t let the HF (hedge fuckers) win! We will pick you up again, do not worry.",1,0,1615406559,Amctothemoonplease
7,gqhkn5g,I thought it was a rule I’ll just double check the veracity of the statement.,1,0,1615407195,Theaudacity0fit
8,gqhlkkh,Was just genuinely curious if that was your opinion or fact,2,0,1615407594,Scottieg99
9,gqhntp5," Oh, it was an opinion which is why I told him to keep an eye out, because even if it was until it’s proven and made public we will never truly know. Let’s face it they haven’t been so forth coming with the truth this far",1,0,1615408554,Theaudacity0fit
10,gqifufw,Uhhh... stonk only go up...,1,0,1615421726,DaBakerTime
