,comment_id,text,score,awards,timestamp,author
0,gq9bohu,No one lost money on apple😂 they’re up 100% this year,2,0,1615239486,tossserouttt3483726
1,gq9btfq,"A lot of suits on TV are licensed where they are allowed to give investment advice. The thing is, not all advice is good advice.",11,0,1615239548,Two_trays
2,gq9burk,"As far as I know as a new investor something being down is the time to buy so that it'll come up. Maybe they lost money short term but in the next year, who knows what growth will happen on some of the old stocks. I haven't bought into any of them but I'm using the same concepts to get into the Green energy and cannabis sectors. They're down rn but I'm betting on the etfs and stocks to rise in the next 5 years to bring me some flexing gains",2,0,1615239564,ScarecrowNinja
3,gq9bw2o,[removed],1,0,1615239581,[deleted]
4,gq9bw69,How do you know they aren't financial advisors?,1,0,1615239582,BDCB5
5,gq9c732,"Suits on TV only give over saturated news. They don’t understand that Reddit DD has a significantly lower time lag than TV advise. My 2 cents; if you’re here and you’re able to analyze WSB, keep doing that. If you want your portfolio to increase slowly keep listing to boomers on TV. Young people naturally are more risk adverse hence why WSB keeps making risky moves which sometimes pay off. It’s not because WSB investors are reckless, it’s that ppl here are more likely to take risks",1,0,1615239719,farid9966
6,gq9ccig,[removed],1,0,1615239788,[deleted]
7,gq9cruv,"Unless they know your specific financial situation, they should not be giving advice.  A certified financial advisor cannot just say “put your money here” without knowing your situation.",5,0,1615239979,FlatBrokeEconomist
8,gq9czoh,And they’ll probably bounce back up. Apple is working in making cars now. Fucking cars. They’re bound to make some moves the farther along in progress they get on that.,2,0,1615240079,boonby
9,gq9d9fz,"You haven’t seen the GUH video, have you 🤨",1,0,1615240202,realmenus
10,gq9df8e,I missed the part where they held a gun to your head and forced you to buy,0,0,1615240276,whiskeydicking
11,gq9dgmk,[removed],1,0,1615240294,[deleted]
12,gq9dvqa,"""Bunch of suits"" seriously?",0,0,1615240488,MGaCici
13,gq9e9hp,[deleted],1,0,1615240660,[deleted]
14,gq9ekxh,They are giving solid investment advice. GME is a high risk GAMBLE,7,0,1615240804,S_A_R_K
15,gq9f18g,I they are on before the talking heads,1,0,1615241013,S_A_R_K
16,gq9fv7l,I’m just starting in with all of this. My Apple stock is down 4% today. My meme stocks are all up today. I’m not worried about the Apple that’s down because it’s an investment. It’ll come up eventually. I’m worried as hell about my meme stocks because even though they’re up today I’m being killed overall and they’re all gambles.,2,0,1615241400,narcolepticdoc
17,gq9glf3,"Sauce? Only thing I’ve seen related to that is fisker is going to use the same company Apple does to produce their cars, you sure you’re not thinking of that?",0,0,1615241741,CreativeUsername-1
18,gq9hboi,"https://www.google.com/amp/s/mobile.reuters.com/article/amp/idUSKBN28V2PY

There’s a lot more links if you Google it I chose the first one",1,0,1615242087,boonby
19,gq9hckx,"Non-AMP Link: [https://www.reuters.com/article/us-apple-autos-exclusive-idUSKBN28V2PY](https://www.reuters.com/article/us-apple-autos-exclusive-idUSKBN28V2PY)

I'm a bot. [Why?](https://np.reddit.com/user/NoGoogleAMPBot/comments/lbz2sg/) | [Code](https://github.com/laurinneff/no-google-amp-bot) | [Report issues](https://github.com/laurinneff/no-google-amp-bot/issues)",2,0,1615242099,NoGoogleAMPBot
20,gq9jslp,"Interesting, thank you!",2,0,1615243278,CreativeUsername-1
21,gq9oqv5,"For some reason people think they need to say that or else they will get in trouble.

You aren't a financial advisor unless you get paid for it. If you don't get paid for what you say you don't have to tell people you aren't a financial advisor, because you can't get in trouble anyway.",0,0,1615245829,GGnerd
22,gq9stse,[removed],1,0,1615247974,[deleted]
23,gq9xgk4,"&gt;Young people naturally are **LESS** risk adverse hence why WSB keeps making risky moves which sometimes pay off. It’s not because WSB investors are reckless, it’s that ppl here are more likely to take risks

Used the wrong word.",3,0,1615250474,neothedreamer
24,gqa16d0,Mb thanks,1,0,1615252512,farid9966
25,gqa1xsn,"They'll make a killing, Apple fanbois will buy a new car every year if they tell them to roll their loans over into the newest model!",1,0,1615252926,Sekioh
26,gqa80ng,Sir this is the nasdank exchange,1,0,1615256268,LightLune
27,gqecr67,"The entire point of their advice is not to chase day-to-day trends and to invest for the long haul. Under that philosophy, Apple dipping over the course of a month is not 'losing money'.",1,0,1615340051,bootcamper64
