,comment_id,text,score,awards,timestamp,author
0,gqh8h6c,"There’s always margin.

Also show positions or ban",-16,0,1615402090,blast4310
1,gqh8vyr,[removed],1,0,1615402253,[deleted]
2,gqhca5a,Bro do not recommend margin on a stock like GME. That’s just asking to get fucked.,20,0,1615403651,SlappyBag420
3,gqhdq8v,"Sir, this is a Wendy’s. 

You should already know what you’re getting yourself into when posting on this sub.

Also, I Find Your Lack of Faith Disturbing",-14,0,1615404251,blast4310
4,gqhdx2d,It’s pretty clear that you don’t completely grasp how margin works. Go ahead and ask all the people who got free automatic debt today when prices dropped 50%,6,0,1615404330,SlappyBag420
5,gqhnlmj,[removed],1,0,1615408462,[deleted]
