,comment_id,text,score,awards,timestamp,author
0,gqgih2w,It was a joke lol,1,0,1615392317,redrocketinn
1,gqgih2q,[removed],1,0,1615392317,[deleted]
2,gqgih5o,By my calculations that's a fuckton of shares,4,0,1615392318,SanderVdW
3,gqgih5r,[removed],1,0,1615392318,[deleted]
4,gqgih8b,"Ok boys and girls, 3rd time is the charm!",7,0,1615392319,JulesDescotte
5,gqgih9e,Let’s blow back over 300,20,0,1615392319,plomii
6,gqgihag,Dip the thread. Upvote the buy,2,1,1615392320,whowantstogo
7,gqgihay,"At 10k, I would like you to eat one of your own kidneys.",3,0,1615392320,ZestyMordant
8,gqgihbj,"MY NEW PLAN:

IF IT GOES UP, I HOLD

IF IT GOES DOWN, I BUY

NOT FINANCIAL ADVICE, I HAVE SUB 50 IQ",37,0,1615392320,jimmyzer
9,gqgihau,[removed],1,0,1615392320,[deleted]
10,gqgihav,There was a time where a shift of 5% in a stock would send the sub to the fucking madhouse.,1,0,1615392320,TheCultist
11,gqgihf0,[removed],1,0,1615392321,[deleted]
12,gqgihdm,"Yeah I did buy during that time, but not enough...",0,0,1615392321,ArcanoBot
13,gqgihf3,[removed],1,0,1615392321,[deleted]
14,gqgihfk,"True, what was the call though? Could of got a major discount with the equity you already had. But then again, I didn’t turn $1500 into $80k+. congrats, that’s a big win",1,0,1615392321,sammcclue
15,gqgihg5,"no, you've got a growing bank account!",1,0,1615392322,sirrahtap
16,gqgihh1,lol i'd buy more,1,0,1615392322,PuckIT_DoItLive
17,gqgihhx,[removed],1,0,1615392322,[deleted]
18,gqgihgs,"""Any and all suggestions""

Should've been more careful with your wording there buddy",2,0,1615392322,numberjuan10
19,gqgihjh,We have done 18mm in 2 hours and the average is around 48mm. I’d say we’re right on track. Fuck outta here with the FUD,0,0,1615392323,Rufio-1408
20,gqgihjg,"She won't, but it's nice to know she CAN",4,0,1615392323,Humavolver
21,gqgihly,Had to sell my shares to pay for my dog's surgery. Bought in Feb at 223 and 💎 ✋ until yesterday where I sold at 225. Its been fun and god speed to all of you. Have a tendie on the moon for me,31,0,1615392324,BuntsyWelpstein
22,gqgihqp,![gif](emote|free_emotes_pack|heart_eyes_rainbow),3,0,1615392325,Hoppus87
23,gqgihof,I have yet to see any DD that’s convinced me the shorts haven’t covered. Do you have a link to any good posts? I will happily change my opinion after reading some good DD.,2,0,1615392325,Thosepassionfruits
24,gqgihr6,I'd buy that dip,4,0,1615392325,abeslton_Trees
25,gqgihst,What do you mean umemployed? Don't you mean *PROFESSIONAL STONKS TRADER??* 🚀🚀🚀🚀🚀,40,0,1615392326,coqdorysme
26,gqgihry,"I think theres a lot of sell orders we're gonna have to pass, if there are buyers then to make up for it its gonna go fuckin nuts",1,0,1615392326,Do_eM_alott
27,gqgihr9,Halts got me horny to buy more,7,0,1615392326,Super_Flyy_
28,gqgihu8,You paper-handed twice? Fuckin lol.,1,0,1615392327,pisspoorplanning
29,gqgihvf,Bought 1 more since it jumped from 90 to 300 CAN In a matter of days before my order went through,1,0,1615392327,AHxCode
30,gqgihwg,"Likewise, didn't buy in for the money. I was just along for the ride.",1,0,1615392327,Icarusthegypsy
31,gqgihy5,"Bears R Fuk 

🤲🏼💎",20,0,1615392328,CallsonBobRoss2024
32,gqgihyr,As many as you can fit.,4,0,1615392328,Baschoen23
33,gqgihy8,If we get to 1k my goal is 10k,1,0,1615392328,coneofdepression
34,gqgii26,yeah we have seen that lunchtime dip a lot but it might be different this time around with more and more hype building. Either way I'm taking this to the grave or to intergalactic exploration,1,0,1615392329,Dovitk
35,gqgii4c,[removed],1,0,1615392330,[deleted]
36,gqgii2z,I like this. Everyone Do this and it WILL happen!!!,1,0,1615392330,HoIyGhost09
37,gqgii4w,No...,1,0,1615392330,ethaza
38,gqgii65,Obviously we take out loans on our homes and children's future earnings,2,0,1615392331,Drace3
39,gqgii5l,Its to late to get in dont convince me. Wish you all the best tho i really hope it will go to the moon!!,-3,0,1615392331,sonic_gottagofast_11
40,gqgii63,"Yeah, you don't have enough yet. Keep buying.",1,0,1615392331,SortaPolyish
41,gqgii79,"Take your FUD to /r/stocks 

This is wsb",26,0,1615392331,jessicavotingacc
42,gqgii5g,Looks like op sold their account to the shills. No history of commenting in stock subreddits til this comment today. FUD,0,0,1615392331,rbizzy
43,gqgii5i,"Not financial advice, but this appears to be just the run up to the squeeze.  We are small fish bro.  Big money is in on our side &amp; the price is steadily stepping up and consolidating.  I am holding.  If you’re worried your gonna paper hand, or miss the peak, put a stop loss order 20% under current &amp; quit looking.  I think we’re in for a long steady rise until d day on 19th...  I think shorts are hedging by buying in to offset losses...  wtf knows, I am surely clueless but happy!",2,0,1615392331,5ilverback5
44,gqgii56,U mean hundreds of thousands,7,0,1615392331,justMasn
45,gqgiidb,I have yet to see any DD that’s convinced me the shorts haven’t covered. Do you have a link to any good posts? I will happily change my opinion after reading some good DD.,1,0,1615392333,Thosepassionfruits
46,gqgiicx,"Arnie says 

""bottom line there are 18 hours in the day. Sleep faster.""",1,0,1615392333,kjs100
47,gqgiifc,[removed],1,0,1615392334,[deleted]
48,gqgiif0,We're gonna need a bigger alphabet,1,0,1615392334,PonyWanKenobi
49,gqgiiie,GME AND AMC both haulted at the same time&gt;? lol,-2,0,1615392335,Suspicious_Focus_169
50,gqgiigp,I’m good! Got a buddy’s wedding  coming up and the rehearsal dinner is that day. This weekend will be most excellent. Hope you’re well and also have a stellar one too!,2,0,1615392335,ChanceMan
51,gqgiij0,Average up is the game. We’re retards!,1,0,1615392335,PradaOnPanda
52,gqgiijg,"\*past 300 again. Since we already hit it today, and hopefully shook off the weak sell orders.",2,0,1615392335,JohnQx25
53,gqgiile,"#TAKIN’ CARE OF BUSINESS 


🚀🦍🚀🎶🚀🦍🚀🎶🚀🦍🚀


*his business was buying more GME shares for himself*",13,0,1615392336,disneysinger
54,gqgiikt,Line up and feed those stimmys to the machine retards let's move this mother fucker,12,0,1615392336,ryanpun
55,gqgiik7,I'm gonna get a little bit in this dip ... Mmmm,7,0,1615392336,Revolutionary-Duck-7
56,gqgiijj,"yeah, it’s been nice to see it actually hold it’s value. was just wondering if people thought it would go up more or stabilize around here 🤷🏽‍♂️",1,0,1615392336,cherrypayaso
57,gqgiimq,I hope paper hands dont sale soon,8,0,1615392337,marcos0955
58,gqgiio7,10k,5,0,1615392337,No_Big8543
59,gqgiinq,"Video ends with hit combo 10,000+ 


Maybe hinting $10k is not a meme?",1,0,1615392337,Zhawk1992
60,gqgiipe,[removed],1,0,1615392338,[deleted]
61,gqgiiqz,"I’m finally in the green!!!
Thanks I’m for coming to get me!! Love y’all! Still holding for everyone else!!!",11,0,1615392338,PeasAndPotats
62,gqgiiq9,No,3,0,1615392338,onmlkjihgfedcba
63,gqgiiu4,[removed],1,0,1615392339,[deleted]
64,gqgiitt,[removed],1,0,1615392339,[deleted]
65,gqgiitz,"Wish I couldve gotten more. New to this sub, and its already a new favorite. Love you all, brothers. Apes together, strong",24,0,1615392339,DannyilloX8
66,gqgiiun,"I'm so excited, they said they were not going to bother me all day long, as long as I don't bother them in the back office.",2,0,1615392339,DalaMoose
67,gqgiitm,"Remember you retard apes.

We ain’t getting off at $420.69.

You better hold that diamond hand of yours till we discover aliens on Uranus 🚀 💎",28,0,1615392339,AlmightyGoddess
68,gqgiixe,“Work”,2,0,1615392340,Horror_Author_JMM
69,gqgiiva,[removed],1,0,1615392340,[deleted]
70,gqgiiyf,"Guys - the $300 sell was is because of the $150 sell wall we had. Basically, a lot of people got in at $75 when it got stuck, and tried to double - thus wall at 150.

Then a lot of people got in at 150, and now people are trying to double again... thus wall at $300. 

If y'all do *not* remove your sell limits from $300, it'll be stuck here for a few days, and if we do blow past it, we'll get stuck *again* at $600. 

(Same goes for 420-lulz sells vs the rippled $800 sell wall).   


tl;dr - remove your limits if you want this to keep going up.",55,0,1615392341,TheProdigalMaverick
71,gqgiixt,Nice,2,0,1615392341,2020JD2020
72,gqgij1w,The longer you wait for upvotes the more money your losing. Get in now,3,0,1615392342,lifeoflovehealing
73,gqgij1r,Welcome retard,1,0,1615392342,Dredog83
74,gqgij23,What if I just like the stock though?,1,0,1615392342,RealPropRandy
75,gqgij2l,[removed],1,0,1615392342,[deleted]
76,gqgij4k,I'm hoping for $400 on Friday,1,0,1615392343,Fantastic_Bar3109
77,gqgij3t,300+,1,0,1615392343,Why_Not_Dead
78,gqgij7y,"Diamond hands, diamond PP, it's just all kinda diamonds up in this place.  My wife's boyfriend is taking us on a nice vacation on DA MOOON.",1,0,1615392344,kdlaz
79,gqgij8t,I might just have it painted like a rocket.,2,0,1615392344,Bass2Mouth
80,gqgij8g,"FUD spells backwards is DUM

Don't listen to em!",1,0,1615392344,blueyelie
81,gqgij6g,[removed],1,0,1615392344,[deleted]
82,gqgij6l,"I'm a bit curious actually, why is all of the price movement these days in the pre-market? It seems like most of the open market hours are pretty tame this week.",15,0,1615392344,LittleGaia
83,gqgija0,"CNBC is so fucking salty about Tesla hahahahaha.

Suck it bitches.",24,0,1615392345,helpmefindthetruth
84,gqgijbd,Thanks for sharing!,1,0,1615392345,etrulzz
85,gqgij9o,Ignore the FUD bots...this is another great day for GME!,16,0,1615392345,Lucky2240
86,gqgijch,I have yet to see any DD that’s convinced me the shorts haven’t covered. Do you have a link to any good posts? I will happily change my opinion after reading some good DD.,1,0,1615392346,Thosepassionfruits
87,gqgijgl,[removed],1,0,1615392347,[deleted]
88,gqgijfy,$300 new resistance,2,0,1615392347,maxmeade
89,gqgijfb,I delisted my last child! I like my children like my goldfish with 47 chromosomes,1,0,1615392347,Mr-turtlefucker
90,gqgijiy,"I'm selling the second it hits 400, I'm sick of staring at stock all day and I want my money back 😔😔😔",-89,0,1615392348,we_deater
91,gqgijkm,"I just donated to a lecture group, they go to schools and read books to the kids.

Thanks GME, thanks Apes.

Let's keep this thing moving. We can all help each other if we like the stock :)  


PS: I'm sharing this info cause I want everyone to know that this money can be used in good causes. Explore your options and be a gentile ape.",23,0,1615392348,Paradigma23
92,gqgijhz,"I just bought back in, 1 share at $293. I hope there's still some room in the rocket... I guess I can squeeze into the utility closet.",16,0,1615392348,Entity-2019
93,gqgijls,Haha I do the same and have to keep reminding myself these gains are incredible.,1,0,1615392349,dontaskwilltell
94,gqgijlw,[removed],1,0,1615392349,[deleted]
95,gqgijok,"Like a lot of you who got burned by Robinhood, I still have my $GME in RH due to their absurd lockup time to transfer – I can't afford to have my shares locked up when this moons. So let's say $100k plays out – or even half that for argument's sake – does anyone really think RH is going to be able to support 100's of thousands of shares being liquidated at once at that price??",20,0,1615392350,Mediocritologist
96,gqgijsr,Hope your dogs ok,5,0,1615392351,ragormack
97,gqgijt5,"Have you ever heard of the moon? If so, get your camera ready for the pass by",1,0,1615392351,magichronx
98,gqgijsh,welcome back brother,1,0,1615392351,toorad4momanddad
99,gqgijul,"You have now passed the Little Dipper. Feel free to take off your seatbelts and float around a while, still a ways to go until the Moon. Thanks for launching off with GME Spacelines.",26,0,1615392352,beameduplikescotty
