,comment_id,text,score,awards,timestamp,author
0,gqf4nd2,I’d be happy with holding $25,1,0,1615357286,slinkymaster
1,gqf4ndu,"Yep I cashed in a nice chunk of change this morning and then rebought in it at16. Last time I checked fintel the interest for shorting was 81.28% apy with only 100k available for shorting.

https://fintel.io/ss/us/eyes",1,0,1615357286,AcesHidden
2,gqf4ne1,Are you actually retarded?  It has an AVERAGE trading volume of 58 million.  Look at the options 🤦‍♂️,1,0,1615357287,BasedMueller
3,gqf4ngk,$RBLX &amp; $GME GANG CHECKING IN,1,0,1615357288,Jbaked3
4,gqf4nij,find the lynch pin,1,0,1615357289,tuthegreat
5,gqf4nqx,"If you wanna feel like shit, sure.",1,0,1615357295,tacofury-inc
6,gqf4nwh,"Yo, real shit...how much are you guy's levered up? Like what % margin are dudes working with out here, especially with highly volatile meme stonks. 

I have a margin account, but I'm too much a pussy to deploy the 40k in buying power 😶",1,0,1615357299,BaronJomini
7,gqf4nz2,How much you pay for it?,1,0,1615357300,thatradsguy
8,gqf4ny8,Well that doesn’t help. But just looked on yahoo finance. Market cap gonna be 24b,1,0,1615357300,Bossmon25
9,gqf4o00,Everyone better buy some bonds tomorrow for the greater good,1,0,1615357301,FelWill
10,gqf4o3n,"It’s autistic, you’re retarded you wouldn’t understand",1,0,1615357303,Manbearpup
11,gqf4o79,"There's always another potential GME, or a KODK, the latter being preferable since it's wayyyy cheaper.",1,0,1615357305,caezar-salad
12,gqf4oa0,never heard of Grimes but billie eillish is disgusting,1,0,1615357307,howtoliveonearth
13,gqf4obf,No cash to enter $RBLX 🥺 tied up in GME,1,0,1615357308,AuroraT245
14,gqf4odq,What did this comment say? It was deleted too fast,1,0,1615357310,RoyalFail6
15,gqf4ody,Depends when you bought it.,1,0,1615357310,27onfire
16,gqf4oiq,Rick or king,1,0,1615357313,ShickyMicky
17,gqf4oi7,[removed],1,0,1615357313,[deleted]
18,gqf4oku,Apple fanboys will buy an Apple car just because it has an Apple sticker.,1,0,1615357314,ph0xer
19,gqf4oln,CARL,1,0,1615357315,BorderCollie509
20,gqf4onn,"Oh, hey! I lost my prison tat!",1,0,1615357316,redcedar53
21,gqf4oqo,Sending GTT to the moon!,1,0,1615357318,sdclimbing
22,gqf4ou4,"Weeklies? Ehhh too risky IMO, but then again we are talking about FDs but I guess I just like to play them a bit safer 🤣",1,0,1615357320,Ok_Yak_6448
23,gqf4oxw,The greater good,1,0,1615357322,Runster91
24,gqf4p6k,Vin diesel with a pussy,1,0,1615357327,tradefundtrade
25,gqf4pbp,Yeah but I'm selling so...,1,0,1615357331,FelWill
26,gqf4pkj,Backbone of the economy,1,0,1615357336,RoyalFail6
27,gqf4pq1,Or it’s gonna be a flat day,1,0,1615357340,DrHarrisonLawrence
28,gqf4ptq,[removed],1,0,1615357343,[deleted]
29,gqf4pwr,Coraaaall!,1,0,1615357345,improvamy
30,gqf4pzk,Flair,1,0,1615357346,sdevil713
31,gqf4q0i,Just don't leave out KNEE and TOES,1,0,1615357347,AcesHidden
32,gqf4q24,Oh shiit.,1,0,1615357348,27onfire
33,gqf4q1s,"If I get 50 upvotes, I will ride my bike as many miles as GME gains in dollars on 3/10 (including premarket) in ONE ride on 3/11 :)",1,0,1615357348,samstrayer21
34,gqf4q39,Ehem... Jayden Jaymes,1,0,1615357349,tittiesforeveryone
35,gqf4q57,I agree!,1,0,1615357350,PlayerHunt3r
36,gqf4q6q,I only root for GME to moon when i have puts on other shit,1,0,1615357351,tb9090tb
37,gqf4q7x,"If you’re not using all your margin all the time, what are you even doing here?",1,0,1615357352,Runster91
38,gqf4qai,"Yeah, me too man. This is a casino",1,0,1615357353,struggleman55
39,gqf4qaj,You said add a comment dumbass not reply to my comment,1,0,1615357353,DjangoVonShaft
40,gqf4qam,Nice,1,0,1615357353,hammydwnjizzblanket
41,gqf4qjg,I’m thinking about getting in on it anyway.,1,0,1615357359,manfis
42,gqf4qjn,Cash account gang,2,0,1615357359,choose282
43,gqf4qm7,[removed],1,0,1615357361,[deleted]
44,gqf4qn5,[removed],1,0,1615357361,[deleted]
45,gqf4qnj,[deleted],1,0,1615357362,[deleted]
46,gqf4qpe,The British are CUMMING,1,0,1615357363,Ihopeitsacankersore
47,gqf4qq5,"There are 9 million people in the sub and you might see 100 screenshots of legit solid 'nailed it' gains on any given day.  About as much, if not more, loss porn.

That said, every single thing you see is something to learn from.  You might miss a run, but the chart's there, old comments are there, and when you see someone posting gains, you can absolutely be that person on some future thing if you're in the right place at the right time.

People say 'don't FOMO' but a lot of things you can jump in a little late and play the momentum, the more you look back at past run-ups and pops the more you'll look at future things and more accurately determine if it's going to continue to go up.  If you throw your money into something before it pops it's just a dud, and if you throw money into something that falling (contrarian, catching a knife) you'll be on the bad side of the trade right off the bat because it's dropping, but if you buy into momentum, generally, you'll be in the green within seconds and it makes exiting a little easier and less painful.

I think the biggest rookie mistake is to buy into things that aren't even trending in the right direction in hopes that will be the next big thing and to avoid buying into momentum out of fear that it'll instantly reverse.  Spend some time watching some of these trains and eventually get that IDGAF confidence and try throwing some money you don't worry about losing at one and get out at a small profit, even if it's 5 minutes later, get a feel for jumping into momentum and identifying when it might be too late.",1,0,1615357363,Bcron
48,gqf4qpm,"Waiting for my ban, this is boring.",1,0,1615357363,27onfire
49,gqf4qt3,GME CHECKING IN,1,0,1615357365,p00nslyr_86
50,gqf4qxl,Max it out otherwise you’re leaving money on the table,1,0,1615357368,FudgieThaWhale
51,gqf4r18,"Damn, the call volume on $UNFI before close yesterday really snapped👀. With some good earnings and maybe a CEO announcement this will be a fucking flesta.",1,0,1615357371,Riflebursdoe
52,gqf4r47,I’m at this comment flair or ban,1,0,1615357372,Fontec
53,gqf4ra2,[removed],1,0,1615357376,[deleted]
54,gqf4rbq,Yeah I noticed that too.,1,0,1615357377,27onfire
55,gqf4rdl,I can’t wait to go nuclear tomorrow,1,0,1615357379,randydp39
56,gqf4rfh,Like right now,1,0,1615357380,struggleman55
57,gqf4ri7,SPX 3850 here we come,1,0,1615357381,cheesemites
58,gqf4rmc,"Nope. Highly shorted with an approved product from the FDA to sell now.

https://fintel.io/ss/us/eyes",1,0,1615357384,AcesHidden
59,gqf4rnv,"straight up, that's what I needed to hear",1,0,1615357385,BaronJomini
60,gqf4rp9,My wife told me I couldn't make her wet anymore so I had to find something else to flood,1,0,1615357386,Two_trays
61,gqf4rp3,Mine better,1,0,1615357386,sunsource
62,gqf4rur,It’s redder :/,1,0,1615357390,tacofury-inc
63,gqf4rvc,"Elon’s child with her is named like that bc she’s Elfin, not human",1,0,1615357390,RoyalFail6
64,gqf4rxd,[removed],1,0,1615357391,[deleted]
65,gqf4saq,"#got this sick feeling we screwed tonight. I’ve got no powder, do I buy lube?",1,0,1615357400,Covid19tendies
66,gqf4sdf,Yeah but being the emporer of mars is way fucking cooler than being the king of the underground city,1,0,1615357401,DorkHonor
67,gqf4sm2,Now set a stop loss. It's all fun and games until you're held upside down and shaken for your pocket change.,1,0,1615357407,hystericallymad
68,gqf4smc,Ban 10 days,1,0,1615357407,sdevil713
69,gqf4spv,Flair and ban,1,0,1615357409,DjangoVonShaft
70,gqf4sqg,I don't use my margin.  Maybe I'd be fucked if I did.  Who knows,1,0,1615357410,27onfire
71,gqf4sqx,😂😂😂😂😂,1,0,1615357410,StockNewbs
72,gqf4ss3,Cathie about to play 4d chess and buy out all the bonds that don’t get scooped 🤯,1,0,1615357411,swshrXX
73,gqf4stc,1775,1,0,1615357411,struggleman55
74,gqf4stn,"probability extremely low. I wonder what has a higher chance to becoming a millionaire. 1. a single stock  of GME, or 2. buying a lottery ticket.",1,0,1615357412,tuthegreat
75,gqf4stl,"That’s all I’m buying. Well, already bought GME, 50 shares at $52, another 50 at $149. So holding GME and buying RBLX",1,0,1615357412,Bluebird439
76,gqf4su7,So many Robinhood screenshots... you can’t teach a retard new tricks I guess. Hope you have stop losses on when the Buy and Sell buttons suddenly stop working again.,1,0,1615357412,thedudebro989
77,gqf4t0u,Can someone give me any made up bullish news for TSLA ? German markets will do . Something that has absolutely no actual impact on open that will help mE sleep,1,0,1615357417,angryirishman
78,gqf4t2u,Atleast if you are banned you have an excuse for no one responding to you!,1,0,1615357418,ThomasMonaghan
79,gqf4t1w,The only excercizing (fuck it) we do around here is on calls,1,0,1615357418,kortokrizzle
80,gqf4t8z,4/23? Last time lasted like two weeks. I’ve got 4/1 calls,1,0,1615357422,DothrakAndRoll
81,gqf4t9x,what,1,0,1615357423,howtoliveonearth
82,gqf4t9u,I’m less bullish on RBLX after seeing the past history of DPO’s. Still gonna put some cash in but maybe not entire account lmao,1,0,1615357423,FalconGhost
83,gqf4tc9,Idk what anything in that second sentence means but you sound smart and said you’re rebuying at 16 so I’m going to do the same now,1,0,1615357424,tachycardia69
84,gqf4tjn,Thank you my friend!,1,0,1615357429,i-hate-emojis
85,gqf4tq2,Do you guys really see Roblox as a $50b company right now?,1,0,1615357433,Tradergurue
86,gqf4trb,"Look up ""Super League Gaming"" they are about to merge/buy the stonk everyone likes right now",1,0,1615357434,bayarea707xxx
87,gqf4twx,:( I didn’t get one,1,0,1615357437,SyncTitanic
88,gqf4txk,[removed],1,0,1615357438,[deleted]
89,gqf4u02,Likely downturn at some point before Friday..,1,0,1615357439,27onfire
90,gqf4u47,Definitely the lottery ticket.,1,0,1615357442,le672
91,gqf4uhm,I don’t really trade on margin,1,0,1615357450,FalconGhost
92,gqf4uj1,"Is it a good time to buy rolls-royce at 1.145, or more dippin ahead? In february it fell to 0,9 not sure if i should wait or just buy now",1,0,1615357451,BoofDaKratom419
93,gqf4uj4,"If it goes down, can you bike negative miles?",1,0,1615357451,cheesemites
94,gqf4uwl,[removed],1,0,1615357460,[deleted]
95,gqf4uyz,Mars is covered in continent sized dust storms and occasionally global dust storms that last months,1,0,1615357461,ohmy420
96,gqf4v31,Dude all I ever play is 120 day to a year. If you feel like you mad a bad choice you can hedge your bet with a deep put that costs very little just in case shit goes dead. This week beat the shit out of me but I still have TWELVE MONTHS. For the market to go up. Hold,1,0,1615357464,ekmaster23
97,gqf4v4j,I'm going to have to rethink my approach here 🦾,1,0,1615357465,BaronJomini
98,gqf4v75,Car go weeeeeeee,1,0,1615357467,beachbumyonst
99,gqf4vb9,"I'll beat off, thx",1,0,1615357469,punyn00b
