,comment_id,text,score,awards,timestamp,author
0,gqaqyuj,"Sir, this is a catnip lounge.

*I am a bot, and this action was performed automatically. Please [contact the moderators of this subreddit](/message/compose/?to=/r/wallstreetbets) if you have any questions or concerns.*",1,0,1615267556,AutoModerator
1,gqaqzpr,"I am a bot from /r/wallstreetbets. You submitted one or more banned tickers: MMT.

Message /u/zjz if they're above 1.25 billion-ish market cap and not related to crypto/pennies/OTC/SPACs.",1,0,1615267573,VisualMod
2,gqarig2,"nice post op, rescued it from the bot. I'll add you to approved submitters if you submit this kind of stuff",2,0,1615267936,zjz
3,gqarzo4,Yes please. This is exactly the kinda shit I wanna read after a handful of IPA's.,1,0,1615268282,se7en41
4,gqasp6j,[removed],1,0,1615268794,[deleted]
5,gqatkwt,nice analysis take my upvote.,1,0,1615269460,fn-AU
6,gqatl7d,"So how does $15 minimum wage fit in there if full employment and raising wages is, bad.",1,0,1615269467,novosuccess
7,gqatvr1,So puts or calls. Am retard,1,0,1615269697,PuhtatoGod
8,gqaus91,"George Bush. Doesn’t care. About EV’s, and the most important industry of life saving autonomous vehicles.

Beyoncé had the best album",1,0,1615270409,KoalaKurupts
9,gqauw92,Both🚀,1,0,1615270497,immafivestarman
10,gqauyjg,Don't forget about the fed's unofficial third mandate: financial stability,1,0,1615270549,CoacHdi
11,gqavbf0,And the 4th: keep the rich doing no manual labor.,1,0,1615270851,KoalaKurupts
12,gqawmfp,So does this mean tech growth stocks will keep dumping or no?,1,0,1615271943,PowerOfTenTigers
13,gqawrhl,[removed],1,0,1615272061,[deleted]
14,gqayy2p,That TLDR was a good way to save it. I was starting to get confused at the end,1,0,1615273958,onishchukd5
15,gqb1np9,Sure. Let's pretend the fed is in control.,1,0,1615276405,pvr90
16,gqb39jw,Sir this is a Wendy's,1,0,1615277924,gautxorija
17,gqb3rlw,"You lost me when you mentioned Gay Dildo, I mean Ray Dalio.

Is his fund returning positive returns yet?",1,0,1615278409,Upset_Tourist69
18,gqb4m3t,"Raising wages actually don't cause that much of an impact on prices (inflation). When McDonald's had to increase the minimum wage, they raised the price of a Big Mac by 12cents. Sorry, I don't recall the source on this :( The major effects of raising minimum wage are raising people out of poverty and businesses making a little less profit, but obviously this can hurt smaller companies more than major corporations.",1,0,1615279239,Camposaurus_Rex
19,gqb4v6x,"Ya, something along these lines. I believe the Fed's words were that they would keep doing QE until the jobs participation rate increased (number of people working and applying for jobs). If you compare the Fed's balance sheet with the participation rate, they're inversely correlated. Meaning, the Fed *is* the problem or *is making the economy worse*.",1,0,1615279488,Camposaurus_Rex
20,gqb6pl6,"Great post, but I’ll never understand what compels a person to wake up and decide to write a detailed post on fiscal policy first thing in the morning.",1,0,1615281361,SECwontletMEB
21,gqb8fmp,"This may be true on a limited scale, such as McDonald's.  Widespread, drastic, instant wage increases can be a problem.  Raising the minimum wage won't bring people out of poverty.  The actual dollar amount of wages is meaningless.  What matters is where you are on the scale in relation to other people.  The minimum wage could be $100/hr. and the lowest paid would still be the lowest paid.  Their buying power would still reflect that.

The people that would be hurt the most by drastic wage increases are seniors.  They are commonly living on a fixed income.  Their investments are typically very conservative since they don't have the advantage of time to recover from losses.  Major increases in wages and inflation would decrease their buying power and leave them in a vulnerable position.  I know many people bash the boomers, but I don't think we really want to fuck over our parents and grandparents so high school kids and people that never bothered to pick up a skill can feel better about themselves.",1,0,1615283099,chiefoogabooga
22,gqb8fn3,"IF YOU'RE GOING TO FILIBUSTER, YOU SHOULD RUN FOR SENATE!


*I am a bot, and this action was performed automatically. Please [contact the moderators of this subreddit](/message/compose/?to=/r/wallstreetbets) if you have any questions or concerns.*",1,0,1615283099,AutoModerator
23,gqb8gu4,Good bot,1,0,1615283132,chiefoogabooga
24,gqbdwb5,"I dont think I agree with your reasoning.

After 2008 the phenomena of credit cycles have gone away more and more with the years. This evolution of the market is something economists are still trying to understand and we lack the theoretical frameworks to make accurate guesses about how credit cycles have changed. ([https://creditmarketdaily.com/credit-cycle-what-credit-cycle/](https://creditmarketdaily.com/credit-cycle-what-credit-cycle/))

The way I've been looking at the future of inflation for the dollar is through the MV=PT formula where we see both a big increase in the total monetary supply but also a increase in the velocity which is both the big diffrence to the 2008 quantitive easing and the reason there should be more inflation. Now there is an argument to be made that the debt present in the avarage household will counteract this inflation so god knows how things will actualy work out.",1,0,1615288318,Sunt123
25,gqbf4ka,Coffee,1,0,1615289419,redshirt1972
26,gqbga46,Don't question it lol. Wsb is lucky to have such wrinkly brained retards,1,0,1615290391,Walking-Pancakes
27,gqbgkob,A nice iron butterfly condor,1,0,1615290613,Plate-toe
28,gqbkjde,"Sonic took the opportunity to raise the price on their burgers by $1. Which was probably a substantial increase on their profit margin even after the additional wages, but could also represent an increase in their food costs from the wage increase mandate. I'd like to see their books. In general, minimum wage increasing is good for big business and bad for small labor intensive businesses. A few of the local owned pizza places switched their driver's to waitress wages during the last increase to stay afloat, which lead to those driver's switching to national chains and those small businesses closing shop eventually (after they switched back to standard minimum wage and increased their prices).",1,0,1615293474,Alphawog
29,gqbl1zf,"It'll probably drop stock prices of labor intensive industries because of the expected cut into profit margins. In my opinion, buying big players like Walmart or Amazon at the bottom of that dip would be a good play, because they can weather the wage increase and invest in/utilize technology to decrease the man-hours required while smaller competitors are driven out of the market. It'll benefit them in the long run.",1,0,1615293819,Alphawog
30,gqboovk,Good point.,1,0,1615296092,novosuccess
31,gqc93sr,clever,1,0,1615305434,Darminian
32,gqc9nug,Great post OP. Thanks for letting us know that we don’t really have to worry yet.,1,0,1615305651,Ragnaroktogon
33,gqcnsxb,That's a good point about fixed income.,1,0,1615311120,Camposaurus_Rex
