,post_id,text,title,upvote_ratio,date,author
0,lwi3fe,[removed],Are we going to see some good volumes in restaurants after the covid restrictions are lifted in dem states,1.0,1614735700,hampsterstomper
1,lwi3jg,,Too the Moon !,1.0,1614735710,Fickle_Cut7233
2,lwi3mq,,I’m just now realizing...WE ARE LEGION,1.0,1614735718,TwistGloomy
3,lwi3o8,,Even Small Accounts Can 🚀🚀,1.0,1614735722,firecannon99
4,lwi3p9,Obviously these are substantial gains and i have 2 contracts expiringing 3/19. can any experienced investor give me my best play option. Is there a chance this moons to $100 by friday or next friday or the following friday? Do i average up and buy more contracts? Do i Take profits and sit out and maybe miss the gains of a life time. I feel a lot of people are in a similar situation as me and don't know what to do right now. What if this is the next $Gme?? What are your thoughts(please back up with stats or research) #apes,RKT 3/19 $28 Calls up %200 What do i do now?,1.0,1614735724,cozygotthejuice
5,lwi3s6,,NIO 🚀 🚀 🚀 🚀,1.0,1614735731,oNelly999
6,lwi3wr,"Fellow retards,
I'm not here with any financial advice. I'm just demonstrating my interest on buying Roblox as soon as the IPO hits. The question is where? Does any of you know where I'd be able to do so? I usually trade using capital.com, but there are no news it will be for sale there. Any help? Thanks a lot!",Roblox IPO soon,1.0,1614735745,thesuperstig
7,lwi406,"I've invested once before this on oil at the start of the pandemic. It was a terrible buy and the company filed for bankrupty like a month after I bought.

GME reignited my interest and after this I think I'm gonna use whatever my earnings are to create a portfolio for myself.

What about you guys? Here for the one time gain or long-term investing?",What are you new investors gonna do once this squeeze business is over?,1.0,1614735755,petitehughie
8,lwi43r,,10K worth of GME! Keep holding the line! 🚀🚀,1.0,1614735764,snjjain22
9,lwi46t,Will 🐕 🪙 ever reach $1.00?,Coins,1.0,1614735771,Derekrgrs
10,lwi4ap,"You guys picked a good one this time....RKT could get interesting.
Much better fundamentals, well run company, blowout quarter, special div.
Should never have had a 40% short interest in my opinion....Wall St. got this 
one wrong I’m afraid.",ROCKET,1.0,1614735781,Adventurous-Owl-7593
11,lwi4cy,"It is not a cat. It will be squished not squozed.

This is not financial advice.",Detailed DD on cat of u/squishedpeter,1.0,1614735787,Jelly_bean_420
12,lwi4f7,"When’s the SKT squeeze, seems like a good follow up for RKT!?!",SKT to the moon,1.0,1614735792,Arevir_5000
13,lwi4jb,,UWMC - doesn’t this mean there are more people ready to sell at open vs buying? Noob here wondering if you’d position to buy at open with this.,1.0,1614735802,AlienMoonPies
14,lwi4kl,,"I’ve seen DD about SKT and I’ve done a little researching against other stocks, but to a noob this looks good right? Good short interest and short % right?",1.0,1614735805,eljefe2254
15,lwi4rb, $UWMC has been included in the preliminary list of IPO additions for the Russell 1000 and Russell 3000 indexes.,Investing,1.0,1614735817,yul05
16,lwi4xx,,My GME Position Part 2. I think it's a sign folks. GME $420 EOW?,1.0,1614735833,Kind-Appearance7307
17,lwi4xy,[removed],Why You Do Dis,1.0,1614735833,Johnlighthouse
18,lwi4y7,[removed],Working Smart and Hard to become Rich,1.0,1614735834,PhysicalElevator4427
19,lwi56i,"Fellow apes, our main goal is to bring GME and AMC to the fucking moon and beyond. **DO NOT** GET DISTRACTED FROM THE TASK AT HAND. 

This is what the hedgies want. They want us to take the eye off the ball. We must not let this happen.

It is clear that the HFs are pumping up RKT to entice us to move away from GME and AMC, this can be seen through the obvious flood of positive news (propaganda much like the Silver pump last month) all over TV and online.

**DO NOT** BLOW THE CHANCE TO FLY TO THE MOON BY TRYING TO MAKE A QUICK BUCK THROUGH A PUMP AND DUMP!!!!!",RKT IS A DISTRACTION!!!!,1.0,1614735856,EoghanD72
20,lwi585,My average in rocket was $18 and change with 5k commons. Market cap and RKT price... it was only time until RKT said nah eff this I'm running up 😁🤑 100 shares left for fun. Even those in GME were selling their shares jumping in RKT. Can't blame them as they were chasing that $$$$. The sell volume on GME and the buy volume on RKT was crazy. You could easily see the GME jumpers. Hope people made their profits!!!!! Who was lucky to get those RKT calls that made bank????,RKT soared and GME holders waiting,1.0,1614735860,DeepBuddy5
21,lwi5at,,I’m ready,1.0,1614735867,Sobree-no
22,lwi5i7,,I like the stock $GME$,1.0,1614735885,Supermarket_Salt
23,lwi69z,[removed],A LOT OF SHILLS PUMPING $UWMC. BE CAREFUL. A LOT OF NEW ACCOUNTS ARE PUMPING $UWMC.,1.0,1614735955,ifindithumerus
24,lwi6fc,"I’m not good at DDs so here’s a simple discussion:

TSM - currently at 126. 52 week high was 142 only 2 weeks back
KTOS - currently at 27. 52 week high was 34 only 2 weeks back
TSLA - currently at 688. 52 week high was 900 only 1 month back
ARKK - for those who don’t have TSLA money but want exposure to TSLA with less risk, currently at 133. 52 week high was 159 2 weeks back

None of these stocks are goners. They will bounce back higher and they are on sale right now.

I have multiple OTM calls for each of these starting 4/16 close to their 52 week high and a lot of stocks going long on them. But I’m not a financial advisor, just a fellow autist.",I know everyone is still obsessed with GME but here are a lot of stocks currently on a discount for a value investor,1.0,1614735968,I_am_Not_a_Planet
25,lwi6m2,[removed],Nio to the moon 🚀,1.0,1614735984,oNelly999
26,lwi6o0,,"All my money is in $GME, so I had to make this meme on snapchat",1.0,1614735989,StudentExchange3
27,lwi77o,"Check out the head and shoulders pattern: [https://yhoo.it/303lvFI](https://yhoo.it/303lvFI)

Teslas evaluation is as unreal as the science fiction novel that Elon Musk lives in. How does he have time to run a company worth 650 billion and also have dreams of space travel while ranting off with Joe Rogan. Its all a fantasty ! Let me tell you. Tesla has this CEO that has become somewhat pop-culture. Its disorded. No one should be able to afford a tesla when resteraunts, hair salons, and many other businesses are closed down. Commercial property owners are bleeding out, residental houses are selling 30% over true market value, the game is over!!! All the shorters are dried up from years of thinking the market was gonna crash those selling at the top then moving into shorts will make a killing. My short positions have been performing strong! Lets take down the cult investing nature of what this company has become.",Short Tesla Like Me and Michael Burry! (Head and Shoulder Pattern),1.0,1614736039,jacobcards
28,lwi7bk,"TL:DR
They’re the ones producing J&amp;J’s Covid vaccine. More vaccines needed, more money for MRK. 


Who is Merck &amp; Co (MRK)?

MRK is a research intensive biopharmaceutical company that brings forward medicine and vaccines. They research for medicines and vaccines for viruses like cancer, HIV, etc that affect animals and humans. But lately, they’ve been working on COVID-19.
https://www.merck.com/company-overview/ 


Why MRK will go up 

With the recent announcement from Biden that we’ll have enough vaccines for all American adults by May, J&amp;J needs someone to manufacture their single shot vaccine. This is where MRK comes in. As the number of vaccines produce increase and the number of people getting vaccinated increase it’ll only increase the stock price of MRK. 
https://www.google.com/amp/s/www.washingtonpost.com/health/2021/03/02/merck-johnson-and-johnson-covid-vaccine-partnership/%3foutputType=amp 

Fundamentals as of 2/2/2021

Market Cap:
 184.33B
Enterprise Value: 
208.62B
P/S: 
3.84 (which for a bio company is surprisingly low) 
Beta: 
0.44 (less volatile than the market) 
50 DMA: 
77.63 (coming up on Golden Cross) 
200 DMA:
 80.65
Institutional Holdings:
 75.98% (Vanguard and Blackrock are top 2 holders) 
Profit Margin
14.72%
Gross Profit:
34.57B
Operating Cash Flow:
10.25B

Source: yahoo finance",Merck &amp; Co (MRK) partnering with Johnson and Johnson (JNJ) to produce single shot Covid vaccine,1.0,1614736048,timmycforbes
29,lwi7cf,,$COMS short squeeze,1.0,1614736050,Tecaterpjo
30,lwi7fr,,My financial adviser is taking requests,1.0,1614736058,Trigger_happy_neuron
31,lwi7mi,"Fellow apes, our main goal is to bring GME and AMC to the fucking moon and beyond. **DO NOT** GET DISTRACTED FROM THE TASK AT HAND.

This is what the hedgies want. They want us to take the eye off the ball. We must not let this happen.

It is clear that the HFs are pushing up RKT to entice us to move our money away from GME and AMC, this can be seen through the obvious flood of positive news (propaganda much like the Silver pump last month) all over TV and online.

**DO NOT** BLOW THE CHANCE TO FLY TO THE MOON BY TRYING TO MAKE A QUICK BUCK THROUGH A PUMP AND DUMP!!!!!",RKT IS A DISTRACTION!!!!!,1.0,1614736073,EoghanD72
32,lwi7tw,,"UPDAT: Venus in retrograde, jupitor to align with Saturn AND full moon this Friday = $GME to plutoooo",1.0,1614736092,tyKCub
33,lwi840,[removed],Nio to the moon,1.0,1614736117,oNelly999
34,lwi8jn,[removed],SKT to the Moon 🚀🚀🚀🌕🌕,1.0,1614736153,Arevir_5000
35,lwi8p7,"Hello guys! After making the best decision of my life( buying GME at 443.15) I’m left with around 125$ to battle with.
I just need some fellow apes to guide this 125$ into a stock.
More GME? 
P.S.: of course i haven’t fucking closed my GME position",Proud broke APE asking for inspiration,1.0,1614736167,Background_Jaguar666
36,lwi8vw,I’m looking to buy more GME and am unsure whether to buy now or to wait until the price drops lower. What I’m wondering is if it’s likely for the price to drop before it rockets to the moon 🚀🌓,Buying GME and need help,1.0,1614736182,nanorm987
37,lwi92w,"3rd time trying to post this, I think it keeps getting removed because of all of the links. **MODS PLEASE DO NOT REMOVE AS THIS WILL HELP MANY PEOPLE.** I LOVE YOU MODS, I AM ETERNALLY GRATEFUL TO YOU AND YOUR POWER, AND WILL GIVE YOU EQUITY IN MY ANUS IF YOU DON'T REMOVE THIS.

Just so this doesn't get removed bc all of the links, I put all of the links on a post in my account. The link number in the post corresponds with the link in this post. Here is that post:

[https://www.reddit.com/user/HomeDepotHank69/comments/lwhwiw/links\_for\_gme\_dd\_compilation/](https://www.reddit.com/user/HomeDepotHank69/comments/lwhwiw/links_for_gme_dd_compilation/)

**THE ACTUAL POST:**

I’m sure many of you apes are in the same situation as me: smooth brain, ADHD meds, and wife’s boyfriend constantly forcing me to refresh the DD page when I could/should be masturbating to cuck porn. To help with this problem, I have made a compilation of all of the DD for GME that I could find. This is by no means complete, so please add more links in the comments. ENJOY.

**First post:** Here’s a link to the first DD that I did on GME, I still stand by everything I said in that. This covers prevois price action, volume, brokerages, etc: 

**SEE LINK 1**

**ETFs:** Hedge funds are massively shorting ETFs that contain GME or have a bearish sentiment in order to hide their positions, drive down the price, delay the squeeze, and make interest in GME decrease. Here are the links: 

**SEE LINK 2**

**Borrow Rate:** Use this link from iborrowdesk to see that the available short shares of GME are behaving similarly to last time and that the borrow rate is hiking. Similar data can be found on fintel, but this site gives you more data: 

**SEE LINK 3**

**Short interest:** As I said, it is EXTREMELY difficult to get an accurate short interest number because the numbers are probably not being accurately reported, naked shorts, and ETFs leading to indirect shorting. Here are a bunch of posts on all that shit: 

**SEE LINK 4**

**Price action:** GME fractal pattern is repeating itself, which suggests that HFs keep trying to make it go down but it is resisting at every turn and is continuing to be bullish. My original post also has some information on price action.

**SEE LINK 5**

**Volume:** This is a great picture from someone on reddit, which shows how strangely similar volume and short interest are from January's squeeze to now. 

**SEE VOLUME PICTURE 1**

**Uncle Bruce:** Boomer who makes YouTube videos but is actually a smooth brain warrior with excellent insights about how some HFs are probably playing this long, which will only increase the price: 

**SEE LINK 6**

**VIX:** GME price spikes seem to be correlated with more volatility in the market as the VIX usually spikes and SPX drops precipitously (note that if you think buying calls on the VIX is a good idea because of this, I would think twice because this squeeze will likely take longer and theta decay will eat your ass on VIX calls in the process): 

**SEE LINK 7**

u/HeyItsPixeL: If you click on any of these links, click on this one. This is by far the best DD that I’ve ever seen on WSB. In short, he talks about the likelihood of a gamma/short squeeze all pointing to a specific date (March 19) because of naked shorts and provides a MASSIVE amount of data for it: 

**SEE LINK 8**

**Catalysts and personal notes:** I echo everything that u/heyitspixel said in the above link. I also want to emphasize other potential catalysts such as earnings on March 26, possible acquisitions, AMC earnings tonight, Ryan Cohen tweets, DFV’s 500 april ITM calls, and Elon/Chamath/other celebrities tweeting about more interest in the stock. I cannot stress enough that I think this squeeze will take longer than the last one but will be bigger especially if us smooth brains continue to hold and buy. Right now, it seems that the HFs are building an extremely steep house of cards because of naked shorts that will eventually come tumbling down in an even bigger way than last time. They are trying to delay the squeeze so that people get bored and sell but all that it’s doing is building up the gas for the inevitable squeeze. I want to emphasize further than brokerages WILL be the end of this like they were last time, but I believe that because they have more liquidity and don’t want another media nightmare like last time, that they will let this last much longer. I also want to emphasize that their actions only have power if people actually do sell when they restrict buying. Finally, I want to emphasize heyitspixels sentiment that many other institutions seem to be long on this and want to profit from the squeeze as well, which only helps us. Right now, it seems like it’s WSB + some institution(s) v. HFs (Melvin, citadel, etc). Great posts about catalysts and future action: 

**SEE LINK 9**

**Finally, I want to address 2 common arguments that I keep seeing:**

1. “the squeeze is already squoze, this information is public, it’s not gonna happen again” – to that I say, take a look at any post before the January squeeze and you will see the exact same shit. Based on the information I’ve provided above, it’s hard to deny that another squeeze is not imminent, but if you wanna miss out, your brain is smoother than mine.
2. “No way hedge funds will let this happen again, they learned from last time” – to which I say, 2007 has entered the chat. If you really think that these guys learn from massive mistakes, your brain is smoother than silk. Most of these fuckers who are short are shorting out of rage and spite, which is making them act illogical. The fact that there is still AT LEAST 60% short interest on this after that massive squeeze shows that most of them didn’t cover and want to dig this thing into the ground. Don’t be naïve.

**Date:** I don't like when people give date predictions with no data, so I will be giving a range: March 17th - 31st. I say this because March 17th is 2 days before heyitspixel's prediction about the quadruple witching day on March 19th. March 25th is after hours earnings. I'm saying that it could happen at any time in this range because of the T-3 rule for exercising deliveries (because March 26th is a Friday, we might not see the full action until sometime that next week). There could be giant run ups before these dates, but if there are, they are not the full squeeze as I believe that the volume on and after earnings will be the highest, which will be the perfect time for the squeeze. In short, stay strong throughout this entire month. 

**Conclusion:** (This is from my first post). Like I said, I think that this squeeze will take longer than the last one, but could easily be bigger. I can't emphasize enough how important I think the earnings call catalyst will be and the date of March 19. Be strong apes, don't get down over days or weeks of red because it is likely that we will take a rash of shit for a little but you must stay strong. Yes, RKT and AMC look nice rn, but GME will be soooooooooo much bigger, so the potential gains for holding GME compared to AMC/RKT are not even comparable (I like those stocks, but I like GME infinitely more).

""There’s some shady stuff going down. God, this is intimate. I feel like I’m financially inside of you or something. I'm jacked right, now. I'M JACKED TO THE TITS."" I'll be reporting back when our tenddietown rocket launches past the moon. HOLD THE LINE APES, I LIKE THE STOCK. (Not a financial advisor and this is not financial advice, I'm just a dude with a masturbation problem).

For those of you interested, my wife’s boyfriend has promised to let me go to the park with him WITHOUT MY LEASH ON if the stock goes above 1k. He already said that I can sleep in the garage instead of under the deck if it hits 800, so he has even more riding on this than the hedge funds.

TL;DR: I like the stock.",Smooth Brain DD compilation/summary for GME,1.0,1614736200,HomeDepotHank69
38,lwi940,,Sold my RKT calls YESTERDAY. You retards should’ve told me it’d go to $38 today.,1.0,1614736204,MissingJongUn
39,lwi9ax,"Fellow apes, our main goal is to bring GME and AMC to the fucking moon and beyond. **DO NOT** GET DISTRACTED FROM THE TASK AT HAND.

This is what the hedgies want. They want us to take the eye off the ball. We must not let this happen.

It is clear that the HFs are pushing up RKT to entice us to move our money away from GME and AMC, this can be seen through the obvious flood of positive news (propaganda much like the Silver pump last month) all over TV and online.

**DO NOT** BLOW THE CHANCE TO FLY TO THE MOON BY TRYING TO MAKE A QUICK BUCK",RKT IS A DISTRACTION!!!!!,1.0,1614736219,EoghanD72
40,lwi9cv,"CloudMD 
This is one of many new and recent acquisitions. 
Go to YouTube and search CloudMD.  Do the research for yourself.  

From CloudMD 
We have partnered with @MedavieBC, to provide plan members on disability with timely access to care and treatment. 

Improved outcomes including: access a specialist 220 days sooner on average, &amp; six-month reduction in duration of disability



bit.ly/2NV78R9",CloudMD (DOCRF),1.0,1614736224,Far-Working-2680
41,lwi9lj,,I wonder if Seth will take his company public..,1.0,1614736249,robert62201
42,lwi9tt,[removed],Lost as fuck and probably wasting my money,1.0,1614736272,helpfulneighborr
43,lwi9wm,Check it out....45 million short,CBDT 45 million short,1.0,1614736280,According_Ad4862
44,lwi9wp,,"They didn't have shitpost available for flair. When GeMEe squeezes, and the Tendieman comes, this should be our next anthem. Would love it if someone more creative/talented than this 🦍 would actually remix this to make sense.",1.0,1614736280,Harry-Maybourne
45,lwi9ya,Guys if 9 million retards go to the movies the next couple of weekends that will help with the upcoming quarter earnings report especially if its unexpected....Take your wifes boyfriend too..sit him behind you guys.,Going to the movies,1.0,1614736284,Ben_Dover_isthename
46,lwia0s,,u/Blink_Bull delivering his great speech on the Rights of the Retards before the Virgin Assembly. 🍗🍗🍗,1.0,1614736291,xPatchman
47,lwia17,"$HALO Will be taking off this week, the dip is at its tail end, just my opinion. Worth watching ! 🌙🚀",$HALO 🚀🚀 don’t miss it,1.0,1614736292,Buckets_Galore
48,lwia5d,"Total noob on here. How does a noob like me figure out what top investments people are talking about on any given day. Today I read a headline about how Reddit helped drive RKT, I didn’t even see it mentioned. I got late to the GME party. I am not looking for financial advice, just an ape trying to figure out how to stay current on here",Help me understand,1.0,1614736303,al1873
49,lwiacq,"Just looking into similar fundamental in companies and tried to see if I could find another RKT. Today was awesome and didn’t expect RKT to break $30 but glad I got in right after earnings report. 
This brings me to ASO
Background: Online and brick and mortar business that does sports gear, outdoor supplies, etc. Basically a Scheels, Dicks Sporting Goods. 

Why this could double in the next month.
Majority of shares held by institutional investors. Same as RKT 

High short interest
Similar to that of RKT 

Earnings blowout the last two quarters. 
Same as RKT 

Lower market cap and huge revenue. 
Better ratio than RKT 
(Different Business Model-Changes a Few things) 

Last week sell off did not affect this stock. 
Better than RKT 

Low volume low IV 
Similar to RKT last week 

Earnings report April 8th 
Catalyst: If they have another earnings report like they did last quarter this will do a RKT move. 

Recent IPO in less than a year.
Same as RKT 

Majority of business for this company is brick and mortar and being a pandemic and in a shutdown this company somehow crushed every single earnings beat the last two quarters. With everything opened up and new seasons coming up for recreational sports this thing will moon. 

Way undervalued based on last year results and market cap around 2 billion.",(ASO) Academy Sports and Outdoors Next RKT similar fundamentals,1.0,1614736325,Either_Loan_6516
50,lwiaef,[removed],"$LGHL DD (broker, digital currencies, mining) undervalued rocket ship in waiting",1.0,1614736330,villagepsychic
51,lwiags,,"I want to buy some of these calls. If I put in an order right now, will they execute tomorrow morning?",1.0,1614736335,arobben
52,lwiauy,,"RKT! Managed to get in early on some shares, but now I wish I BOUGHT MORE!",1.0,1614736369,superxavi
53,lwib5z,,Late weed gains,1.0,1614736395,zfiregodz
54,lwibd4,,"Last month’s bag holders are this month’s Diamond hands. Not tryna distract from GME, so here’s a loss on another ticker.",1.0,1614736412,fakingglory
55,lwibdn,,Power to the Players 💎🙌,1.0,1614736414,kngstr
56,lwibe5,,"FREE TRIP TO THE MOON ANNOUNCEMENT{1}: $ON Semiconductor ($ON) - TENDIES INCLUDED, EXTRA SAUCE DD🚀🚀🚀",1.0,1614736416,[deleted]
57,lwibgu,[removed],XL fleet,0.99,1614736423,Ballsdeepinyourmum69
58,lwibof,"So- I’m not saying RKT is a bad investment, I don’t know dick about it. THAT BEING SAID. I have noticed a disturbing amount of 1 year+ accounts with less than 100 karma, or accounta that were created in the last month that are dedicated to RKT shilling.

Below are some references, with anything on this sub, comment or post LOOK AT THE ACCOUNT OWNERS HISTORY. Just to see if they’re active, because accounts that are new/dedicated to shilling one thing/old with no comments

Are bought/bot accounts used to shill. Be very careful and question why exactly there is so much manufactured shilling for it. It doesn’t mean ignore opportunities, it just means be careful. I have puts.

Below are some examples

https://www.reddit.com/r/wallstreetbets/comments/lwh4u8/168k_gain_in_2_days_holding_for_more/?utm_source=share&amp;utm_medium=ios_app&amp;utm_name=iossmf

https://www.reddit.com/r/wallstreetbets/comments/lwhbtz/rkt_not_selling/?utm_source=share&amp;utm_medium=ios_app&amp;utm_name=iossmf

https://www.reddit.com/r/wallstreetbets/comments/lwh0uh/rkt_lets_go_who_else_post_screenshot/?utm_source=share&amp;utm_medium=ios_app&amp;utm_name=iossmf


https://www.reddit.com/r/wallstreetbets/comments/lwgq5k/dont_have_tunnel_vision_on_just_gme/?utm_source=share&amp;utm_medium=ios_app&amp;utm_name=iossmf


https://www.reddit.com/r/wallstreetbets/comments/lwgcmw/rocket_prediction/?utm_source=share&amp;utm_medium=ios_app&amp;utm_name=iossmf","A disturbing amount of pumping RKT by year old accounts with no post history, or baby accounts",1.0,1614736444,LickMyCockGoAway
59,lwibpl,"Fellow apes, our main goal is to bring GME and AMC to the fucking moon and beyond. **DO NOT** GET DISTRACTED FROM THE TASK AT HAND.

This is what the hedgies want. They want us to take the eye off the ball. We must not let this happen.

It is clear that the HFs are pushing up RKT to entice us to move our money away from GME and AMC, this can be seen through the obvious flood of positive news (propaganda much like the news spread about Silver last month) all over TV and online.

**DO NOT** BLOW THE CHANCE TO FLY TO THE MOON BY TRYING TO MAKE A QUICK BUCK",RKT IS A DISTRACTION!!!!!,1.0,1614736447,EoghanD72
60,lwibss,,Nice,1.0,1614736455,kermy_the_frog_here
61,lwibtc,I’m sure robinhood has drastically dropped in popularity due to obvious reasons. What trading app do you recommend and why?,What is your preferred means of transportation to the moon?,1.0,1614736456,fr0ty
62,lwic3a,,"Only 15,000 short shares left for RKT! We can do this 🚀🌕",1.0,1614736479,Big_green_bull
63,lwic76,,$HALO is getting ready for its Takeoff. 🚀🚀🌙🌙,1.0,1614736488,Buckets_Galore
