,post_id,text,title,upvote_ratio,date,author
64,lwicar,,This article is trash. Lol this isn't WSB. Your ethics should be questioned. You cab sift through the thousands of articles every day by the millions of members. You will see it barely mentioned. Next you're bound to find some discussion on every stock. Lol it's a stock board. 😂,1.0,1614736497,Rastaman-coo
65,lwicau,[removed],What would you invest for 1000$ ?,1.0,1614736497,pop2d
66,lwicbh,"I like GME, hmmmm yamyam good.Tastes like green.

The comment was:"" Your post must contain post flair""
So I do everything right, right?

I like the smell of bananas,, hmmmm yamyam good.Tastes like banans.",Post flair - GME - I like,1.0,1614736499,ChainLegitimate6830
67,lwicbq, $UWMC has been included in the preliminary list of IPO additions for the Russell 1000 and Russell 3000 indexes 💎💎💎💎,To the mood,1.0,1614736500,yul05
68,lwiclq,,"Seems like $RKT happened in perfect timing to set up $GME for success, time to cash out and prepare for the real SQUEEZEEE!",1.0,1614736525,RawDawgStonk
69,lwicsp,"So- I’m not saying RKT is a bad investment, I don’t know dick about it. THAT BEING SAID. I have noticed a disturbing amount of 1 year+ accounts with less than 100 karma, or accounta that were created in the last month that are dedicated to RKT shilling.

Below are some references, with anything on this sub, comment or post LOOK AT THE ACCOUNT OWNERS HISTORY. Just to see if they’re active, because accounts that are new/dedicated to shilling one thing/old with no comments

Are bought/bot accounts used to shill. Be very careful and question why exactly there is so much manufactured shilling for it. It doesn’t mean ignore opportunities, it just means be careful. I have puts.

Below are some examples

https://www.reddit.com/r/wallstreetbets/comments/lwh4u8/168k_gain_in_2_days_holding_for_more/?utm_source=share&amp;utm_medium=ios_app&amp;utm_name=iossmf

https://www.reddit.com/r/wallstreetbets/comments/lwhbtz/rkt_not_selling/?utm_source=share&amp;utm_medium=ios_app&amp;utm_name=iossmf

https://www.reddit.com/r/wallstreetbets/comments/lwh0uh/rkt_lets_go_who_else_post_screenshot/?utm_source=share&amp;utm_medium=ios_app&amp;utm_name=iossmf


https://www.reddit.com/r/wallstreetbets/comments/lwgq5k/dont_have_tunnel_vision_on_just_gme/?utm_source=share&amp;utm_medium=ios_app&amp;utm_name=iossmf


https://www.reddit.com/r/wallstreetbets/comments/lwgcmw/rocket_prediction/?utm_source=share&amp;utm_medium=ios_app&amp;utm_name=iossmf",Disturbing amount of RKT hype from old accounts with no karma/baby accounts,1.0,1614736545,LickMyCockGoAway
70,lwid1g,,Came home from work to see my 4 year old had made this at school today while learning her R’s. It’s a sign. GME to the moon 🚀🚀🚀,1.0,1614736570,Electronic_Thanks885
71,lwid2a,[removed],"Ate only lead paint chips and crayons as a child, so now I only use the cash app to stock. Also, ETF's seem like they'd take the fun out of gambling. But is meme stock ETF legit? Thoughts?",1.0,1614736572,Motor-Donkey-2020
72,lwidgs,,Been a long day. Remember to hydrate and save some for the morning.,1.0,1614736606,Klutzy-Dig-1427
73,lwidng,,"Roblox posted its earnings, and 2021 expectations.",1.0,1614736623,Neural_Blockade
74,lwido4,,I'm just trying to learn but this market is not making it easy.,1.0,1614736624,RangerRickC137
75,lwidqv,,#UWMC 1000 🚀🚀,1.0,1614736630,Exciting-Lettuce-239
76,lwids8,,Institutional Investors,1.0,1614736634,salihveseli
77,lwie0z,"Been looking at the 529 a lot but almost would rather invest it myself. 

Would probably do like 60% ETFs 20% stocks and 20% digital money

What long term ETFs would you invest in?

My thoughts are VTI or VOO, SPY, QQQ. Would also do ARKs probs for 5 years or 10 years and until they are tapped out.

What would you do? 

Thoughts?  In the end since id have to pay a 15% long term capital gains tax would the tax free 529 be better? The advantage i see to doing it myself is the control and having all my investments in one place. I like the idea of watching it all myself.",Using a 529 kid college invest account vs doing it myself,1.0,1614736656,DaddyDersch
78,lwie5v,,OFFICIAL WSB $250 Give away,0.5,1614736670,ExcitableSharpness
79,lwiedb,,"FREE TRIP TO THE MOON ANNOUNCEMENT{1}: $ON Semiconductor ($ON) - TENDIES INCLUDED, EXTRA SAUCE DD🚀🚀🚀",1.0,1614736688,[deleted]
80,lwieis,[deleted],100K down on GME less than 24 hour,0.5,1614736703,[deleted]
81,lwieme,[removed],Van Eck Social Sentiment ETF,1.0,1614736713,skullcandy33
82,lwiev2,[deleted],A hundred is enough?,1.0,1614736737,[deleted]
83,lwiev7,,Wallstreet RKTs,1.0,1614736737,[deleted]
84,lwifd1,[deleted],Celente &amp; Mannarino - WSB theme remix,1.0,1614736783,[deleted]
85,lwifjk,[removed],Why all the hate for RKT?,1.0,1614736802,Emoney302
86,lwifw4,[removed],"If everyone of us buys at least $33 dollars worth of powerball tickets for this Wednesday then theres a 100% certainty that one of us Autists could win and then buy more GME shares, therefore making us all winners.",1.0,1614736825,BidenTrade
87,lwifxb,[removed],good stock,1.0,1614736827,freudian20
88,lwig2u,,"THE ONLY PHOTO U NEED TO SEE: RKT GROWTH: 81,000% (yes 81 THOUSAND) HIGHER THAN INDUSTRY AVERAGE OF 0.25. The industry is Wells Fargo, Chase, etc. RKT IS A TECH COMPANY CRUSHING BILLIONS DOING IT OVER THE PHONE! The future is digital fintech. By now or regret forever",0.66,1614736839,namastetrader
89,lwig5b,"**Step 1:** switch that ""hot"" button to sort by ""new""

**Step 2:** ignore all things that say GME,  or RKT, or whatever the next big thing is at that time

**step 3:** look at all other tickers, if they are related to GME or RKT rather then just dd in any way (mortgage company like rkt, heavily shorted for gme) ignore it they're likely just after the hype caused by the rush.

**Step 4**: You've found a stock, coo, now look at its financials what's its share holders equity what's its net income? what's its market value? and how much do you weigh each of these? that's a personal thing, a lot of people have taken the stance that fundamentals are useless now siting TSLA and the like but that's still the easiest way to sort through the shit if you ask me.

**Step 5:** look for news, what's the sentiment? what are the aims its going for and when is this going to be revealed? you want something that has a clear way to burst through the market OTHER THEN EARNINGS, earnings are nice but it needs a clear cut reason it should go off. RKT's PE ratio was insanely good for its sector and what it was making giving it a clear cut above the rest.

**Step 6:** buy in with a A PORTION of your money into a call/put/stock based on your own taste. the more your in the market, the more you'll understand what your looking for better. i personally like to aim for previous lows within a bullish run.

**Step 7: Profit? lmao probably not**, i said to use a portion cause everything i said can help give you a better shot but lets be real here, **your using a sub who calls each other autists and retards, that recently got swamped with people who have no real stock knowledge,  when we were already struggling in the knowledge department before hand lmao. GL, your fucked either way**

Edit: A lot of people are putting ""I followed this and found xxx stock"" and let me tell you i hate most of their financials, JS, yall got some shitty understandings of step 4-5.

Also I got it I don't grammar/spell, what were you expecting? i put ""coo"" in step 4. I've been in this sub for years of course I'm retarded",How to find the Next thing (foreal),0.83,1614736843,blakes5353
90,lwigdq,,Investing,0.3,1614736864,yul05
91,lwignv,[removed],Forget RKT and all the other stocks,1.0,1614736886,Thrasher2299
92,lwigwn,,Are they talking about us?,1.0,1614736907,BBC_needs_a_stock
93,lwigx9,,"$ON Semiconductor ($ON) - TENDIES INCLUDED, EXTRA SAUCE DD🚀🚀🚀",1.0,1614736908,[deleted]
94,lwigzb,,"WSB Circa 2012. ""269 Gamblers""",1.0,1614736914,clickbaitads
95,lwih0w,[removed],Anyone else blocked on RH from selling RKT?,1.0,1614736918,PorkyBear21
96,lwih21,,PENN gain...is this good?,0.89,1614736922,QualitySure3456
97,lwih3k,,Robinhood - Jay Carter Martin Ft. LifeByLos (Prod. WNZ),1.0,1614736926,thamanjimmy
98,lwih6h,,"This is a growth stock averaging 81,000% higher growth than industry average. That’s higher value than Tesla.",0.5,1614736933,namastetrader
99,lwih9q,,"GAINS PORN: The FSR run continues. Basing at $28, and ready for the spike into Valhalla. 🚀🌛🪐✨ 🌈🐻😢 💪🐂🤑 🐱‍👤🐱‍💻🐱‍👓 It was prettier when it hit $32, but this here's the reality of shedding $60K of unrealized gains on the day and not blinking.",0.67,1614736940,God_Hates_You_Too
