,post_id,text,title,upvote_ratio,date,author
0,m5yqn1,[removed],Let’s not forget that GME is still shorted 27-30% of Float,1.0,1615861257,roth9640
1,m5yr15,,Which one of you did this?,1.0,1615861293,kittyloverblazeit
2,m5yr36,,Found this while scrolling through insta...more confirmation bias for this retard,1.0,1615861299,DudeExplorer
3,m5yrdy,,He’s signaling us! BUY,1.0,1615861328,Lootcifer_exe
4,m5yrea,,Had to yolo and adopt a Baby Orangutan.,1.0,1615861329,SliceAhBread
5,m5yrv8,[removed],AMC GAMMA SQUEEZE ON 19TH MARCH - Calls to Puts Options at 26:1 for $14 strike price,1.0,1615861373,cknight2020
6,m5ys1h,,Ape favorite cereal,1.0,1615861391,hagvarthemad
7,m5ysfs,,please dont fuck up roblox stocks,1.0,1615861426,Awesomecool64YT
8,m5yskk,,KMPH is a squeezin!!!!!🚀,1.0,1615861436,Haunting-Royal-3177
9,m5ysqo,Robin Hood=big gay does everyone still use it tho,What app is everyone using now,1.0,1615861447,SugardFlipFlop
10,m5ysxo,[removed],"Blew up 3rd account, 80k in debt, learn from my mistakes",1.0,1615861465,Inside-Reading-2079
11,m5yt16,,No Tendies Necessary... Let's keep up the good will in your own community 💎♥️,1.0,1615861474,chocolatecinnabar
12,m5yt5r,[removed],Which stock you like most going into may? GME AMD NOKIA PLTR?,1.0,1615861486,Molechole6-9
13,m5ytfc,Where’s the mega thread for posting adoption certificates?,Adopting apes,1.0,1615861509,Orthodoc007
14,m5ytse,,Can someone explain the options ? What is the way to do it or how to do it .,1.0,1615861542,Familiar_Orchid1405
15,m5ytsz,Anyone else?,Watching 20/20 Gamestopper,1.0,1615861543,LoveAnchoviePizza
16,m5ytwi,"There once was a stock that put to sea.
The name of the stock was $GME.
The price blew up, and the shorts dipped down.
Hold my bully boys, hold.

Soon may the Teslaman come.
To take us on his rocket into the Sun.
One day when the trading is done,
We’ll take our Tendies to go.

(Same as usual until the last part)

As far as I heard when the fight was done,
The Hedgies all cried - “The Apes have WON”.
The Teslaman made the best of calls,
Cause the Apes each got a Tesla to carry their balls.

So did the Teslaman come, 
The Apes strong together, went to the Sun.
And when the trading was done,
They took their Tendies to gooooo.",Our Catalyst should be be “The Teslaman.”,1.0,1615861553,SPCEMember593
17,m5yu96,,Let us not forget our other ape brethren. We must all work together if we want go to the moon 🚀🚀🚀,1.0,1615861586,BananaBees47
18,m5yv29,[removed],What is next?,1.0,1615861659,dingdongwhoshere
19,m5yv5e,,$TRISM NFT COIN IS MOONING🚀🚀🚀,1.0,1615861667,Best-Ad-3916
20,m5yv7v,,We’re on Hulu!?!,1.0,1615861674,THERADHATTER666
21,m5yvwc,"1. UWMC is going to be included in the Russell 1000 &amp; 3000
2. Largest wholesale mortgage lender in America
3. They use and own their own proprietary software and system. They're the quickest at approving and closing loans in the market and hold this as a key competitive differentiator over their competitors.
4. They benefit both B2C and B2B.
5. They've grown %545 this year alone with earnings forecasted to grow %4.83 per year. Market Cap: 16.58B.
6. They're also heavily undervalued. Currently going for around the $8 price range; The fair value analysis is between $19.34 - $40.00. 
7. Total outstanding shares is 1.61 Billion. Only 90.23 Million give or take is publicly traded. The remainder is institutionally owned. In short, only a fraction of the shares of the company are available for trading, that being 90.23 million.
8. Short interest is very high. Over the last 2 weeks, the short interest volume % has been between 28% - 31%. The latest short interest information from general market analysis companies are dated as of 02/26/2021, the most recent information for March isn't available yet. Short borrow rate fee is at %8.43 give or take. Don't forget this stock had a dividend payout on 03/09/2021 which is high at %4.82 (The shorts must cover that as well), so the potential for a short squeeze or gamma squeeze is very plausible, which is just another positive for us who invested in $UWMC. 
9. Major market analyst rate $UWMC as a buy. UWMC insiders have bought more shares then sold in the past 3 months.
10. This is both a good short-term and long-term play. You can invest in this company for the possible short squeeze/gamma squeeze or for the long-term growth and for it to reach it's actual fair value, which, if you buy in now you should be in for a nice ride. Plus, it has a dividend of %4.82, or $0.10 per share quarterly. I'm not a big fan of dividends, but I know a lot of investors are.

This is not financial advice, etc.",$UWMC - Key Points to the Company,1.0,1615861738,ShortChecker
22,m5yw4t,,Paper handed bitch,1.0,1615861758,kernalklink88
23,m5ywc0,,This is the way,1.0,1615861774,McNiggleBeats
24,m5ywwj,[removed],"WSB SHORT COVERING - $GME, $AMC, $PLTR, $RKT - “MEME-MANIA” - HEDGIES VS HODLERS” MARCH 16 - CITIDEL IS FUCKD",1.0,1615861824,bosshax
25,m5yxh9,,Industrial Hemp Market Size | Share | Trends | Forecast,1.0,1615861878,kb_396
26,m5yxph,"
Fuck Vlad, I cannot support robinhood anymore, morally I cannot trade there knowing fuck face (Vlad) blocked us ape tard retail investors from trading GME and many other stocks, yet allowed Hedge funds to continue buying. I hate his fucking shill face. 

I loved Robinhood, it’s a great tool but what they did to us apes was effffed. Robinhood can and did manipulate the market, and the most we got was a half assed apology and a free stock worth a couple bucks??? 

Fuck your Vlad. DONT TAKE OUR BANANAS! I know many of you have already moved away but we as a collective will come together again and move off of RH’s platform. Apes unite. We stick together. We are holding the line. I’m not selling my GME shares from robinhood based on principle, regardless of any loss I take, but I won’t buy any more GM there, nor any other stock for that matter. Who’s wit it? And where did you move to trade? I’ll be there","What platforms are all my fellow Apes using rather than Robinhood? I can’t do it anymore. Vlad took our bananas. YOU DON’T TAKE APE BANANA. We will shill you, u fucking Shill faced fuck head Vlad. What platform are my fellow apes using now? I’ll be there with you.",1.0,1615861899,dude_walrus_fart
27,m5yxr5,,Hello,1.0,1615861903,FeelingApartment4438
28,m5yxze,,Who else wants to buy GME in-store?,1.0,1615861921,Rexfee
29,m5yy3d,[removed],"2008 &amp; memory of $8.01 🚀 #AMC$2008.01 (Yes, it’s actually possible! do your DD!)",1.0,1615861930,SardonicGale
30,m5yy3x,"First time ever posting on WSB, so hello and bear with me.

&amp;#x200B;

Throughout the year, there's been a bunch of selloffs from executives at PetQ with the most recent being Friday, March 12 for shares worth over $100M. The shares in the most recent selloff were the exact same so I'm not sure if it was registered twice for the same entity or not, that may be the more likely scenario anyway. But regardless, that's a lot of money. There's also the consideration that these selloffs were scheduled and forced to prevent insider trading, but considering the large spread between each of them makes me think unlikely.

[Massive \\""Insider\\"" Selloff](https://preview.redd.it/qu13az9nvan61.png?width=1233&amp;format=png&amp;auto=webp&amp;s=34b7556dd15bd80ccc9e957c6e0629cbf0b202c3)

[My shitty TA](https://preview.redd.it/o7xc2tv2wan61.png?width=2468&amp;format=png&amp;auto=webp&amp;s=64cbfa10260aefc25be4fc956cc438b35c3bfc95)

There's a downward trend or ""channel"" forming and PetQ is currently peaking in that channel. Tomorrow (March 16, 2021) will show whether it's a breakout or a retracement. It's also currently overbought and the P/E ratio is THROUGH THE ROOF at 74.10. Not to mention their recent earnings report in December had a -296.78% surprise.

&amp;#x200B;

I'm personally gonna buy a put for this stock tomorrow if the conditions turn to show a retracement.

&amp;#x200B;

I'm not a financial advisor, this is simply for informational purposes.",PETQ might be a good long put,1.0,1615861932,anticrypt
31,m5yyu5,"And not just from a technical perspective of AMC, but think about what you can do with your **newly made life-changing money.** You would have enough money to become **financially free**, **buy** the **materialistic** things you have always **wanted**, **help out** your family and **pay their debts**, pay for dinner, and many other numerous things! I WILL POST PICTURES AND **HODL** UNTIL **2008.01. 2008.01** **IS VERY POSSIBLE**.

**Do your part, and share this post any way you know how! We must let AMC holders know this is possible!**

**V search up Trey's Trade video on AMC 2k!!!  V**

**Do your own analysis if you are still skeptical!**

**AMC TO THE FUCKING MOON!!!**  **🚀**🌑","2008 &amp; memory of $8.01 🚀 #AMC$2008.01 (Yes, it’s actually possible! do your DD!)",1.0,1615861996,SardonicGale
32,m5yzud,,Me ape me hold me have many banana,1.0,1615862089,moneylover999
33,m5yzup,[removed],100 STOCKS OR NOTHING !,1.0,1615862090,Paltoquet
34,m5z0b2,,150K Palantir (PLTR) YOLO Update 3/15/21,1.0,1615862130,RandomDoctor
35,m5z0g1,,Little love from DOMO Capital tonight? 🐒🍌,1.0,1615862143,mrcurlymoose
36,m5z0ky,[removed],Why was I kicked and had to rejoin?,1.0,1615862156,BryanDiesel
37,m5z0qc,[removed],"WSB SHORT COVERING - $GME, $AMC, $PLTR, $RKT - “MEME-MANIA” - HEDGIES VS HODLERS” MARCH 16",1.0,1615862171,bosshax
38,m5z159," THIS IS A REPOST FROM USER [u/AJDillonsMiddleLeg](https://www.reddit.com/user/AJDillonsMiddleLeg/) BECAUSE I THINK IT'S A GOOD READ 

I made a comment yesterday on a post that did some technical analysis on GME, and several people asked that I turn that comment into a post, so here it is.

Obviously I'm going to start by saying all of this is based on my opinion of what needs to happen to spark the squeeze.

**First, the comment as it was:**

\*I've seen lots of bullish TA on GME. Keep in mind, ALL TA requires volume to play out how it should. We haven't had any volume on GME in over a week.

Holding shares simply isn't enough - needs constant (all day every single day) buying of shares and IN THE MONEY options.

If you buy options that are 20-30% in the money they literally can't price pin because they can't get and keep the price 20-30% below current market. So you force immediate share buying by market makers to hedge, and virtually eliminate their means of counter-attack which has been price pinning at the point of maximum pain (price at which most contracts expire worthless).

If you are intending to help push the squeeze, buy shares throughout the day every day. If you are playing options, mostly buy calls in the money. If you're buying OTM calls, buy as close to current price as you can afford. The more imbalanced OTM calls are, the more they're just going to price pin at maximum pain. They literally cannot do this if there is a ridiculous amount of new ITM call interest that they have to buy shares to hedge.\*

Essentially, we cannot rely on normal technical indicators for movement with Gamestop. There are two major reasons.

1. Manipulation. We cannot do anything about this really, aside from buy and hold. Technicals actually have a tendencies to work in reverse when a stock is being manipulated at these levels. The shorts, while stuck in a stupid position, aren't stupid. They know when the TA is indicating a bullish setup, and that is the best time for them to attack the stock to break the setup.
2. Volume. All technical setups require volume to play out. If volume doesn't follow, the technical setup fails and the price action is unpredictable. Except in this case, it goes down because it's being shorted at every chance.

So what do we need to do? Hold? Yes. But that can't be it. If we are doing nothing but holding, this will be a stalemate that they will probably win as sections of retail gets bored or impatient. They can literally hold us in a stalemate for months/years if volume never shows up to move the price. *Yes, they pay more interest the longer they have to wait. They'll just manipulate other sectors of the market to force gains and cover their losses unless the SEC steps in to stop market manipulation.*

Volume

Without volume, there is no endgame. Look at every day we've had spikes. Look at the volume. Now look at the past week or two. We aren't making progress because nobody is buying shares, aside from some whale algos that are simply fighting off the short attacks. Believe it or not, the whales do need retail support to force the squeeze. The whales are the ones creating momentum from time to time. If it catches on, they can follow it up. But if they just go all out to create a surge and nobody follows behind them to buy, they are literally risking billions of dollars to fail.

This thing will likely happen in waves over the course of a few days. If you look at any day, there are surges in buy volume, but they're short. That's likely a whale, testing the market. If they see confirmation/follow-up from the market, it's less risky for them to send a second wave of buying pressure. So it will be something like, whale buy, retail confirmation buys, whale buy, runaway effect, gamma squeeze and then finally short squeeze. All of those things have to happen consecutively, fluidly and fairly quickly to beat any kind of counter attack.

Now this is going to sound counterintuitive, but in order to catalyze the squeeze, we have to stop just buying the dip. When volume picks up and the price is spiking, that's the most important time to buy. That's the point when additional buying pressure is most important. And until the retail market confirms pressure on one of those spikes, we are going to keep bouncing back and forth.

Options

The other side of the coin is options purchases. **Stop devoting the majority of your capital to far OTM lotto tickets.** This helps the short positions, because it forces the market makers to help the shorts. Market makers that sell call options have to hedge their risk. When you buy an $800c, it does two things.

1. They don't have to buy very many shares up front to remain risk neutral.
2. In incentivizes the market makers to pin the price.

You can do some additional reading on max pain price in options, but it is essentially the closing price at which the largest number of options expire worthless. When you buy OTM call options, you're increasing the maximum pain price, which makes it easier for market makers (and shorts) to pin the price there.

If, however, you're buying a ton of ITM call options, you're doing two things:

1. Deep ITM calls have a delta of essentially 1.00. This means that in order to remain risk neutral, the market makers essentially has to buy 100 shares immediately upon selling you the contract.
2. It lowers the max pain price by creating an imbalance towards lower strikes having the most OI. This means in order to pin the price at max pain, they would need to drop it from it's current price.

Not only do you force market makers to be risk neutral immediately (meaning they don't care where the price goes), you also force them to immediately put buying pressure on the stock price.

If you must buy OTM calls, buy ones that are at least closer to being ITM. The further OTM you buy calls, the more likely the price will go sideways. You can also sell calls and roll them into higher prices to remain leveraged as the price increases. Once it achieves a runaway squeeze, which will be easy to identify, you can start buying your lotto tickets.

Tl;dr: In my opinion, if you want to help catalyze the squeeze, you need to buy shares when the price is spiking and buy calls that are at least 10-20% in the money.

💎🙌🚀🌖",GME Trading Strategy to Catalyze the Squeeze,1.0,1615862207,omertahmaz23
39,m5z1eq,,SNDL$ NUMBER 4 ON 100 MOST POPULAR ANOTHER COMPANY GONNA MAKE IT TO THE MOON LETS DO THIS BOYS!,1.0,1615862230,Main-Berry9656
40,m5z1l9,,"Here, I made this gain porn for you apes with pictures and arrows to make it easier to read. Enjoy!",1.0,1615862245,RuinedXJosh
41,m5z1r2,Zynga (ZNGA) needs to launch to the moon!,Launch ZYNGA (ZNGA) to the MOON!!!,1.0,1615862259,No-Art4205
42,m5z1v8,,Apes Vs Humans - For once the one-percenters get nothing. ( from the They Might Be Giants live show ),1.0,1615862270,Revolutionary-Duck-7
43,m5z2s5,,Diamond hands,1.0,1615862360,Famous-Technology560
44,m5z33r,Let’s getit boys lets hear some criticism,$GNUS thoughts??,1.0,1615862389,maserspeaks
45,m5z3gh,,Short interest 78.59%. Gonna be heck of a squeeze.,1.0,1615862421,OneSchedule563
46,m5z3gr,We ALL hates bullies. Would you recommend outing the millionaire bully shitting on you or outing the bully and exposing them professionally  ? Asking for a friend.,Bullies,1.0,1615862421,CatherineBanning
47,m5z3hc,,Could AMC see $35 a share 👀? What’s your thoughts,1.0,1615862423,JoeRob7
48,m5z3ro,"i’m a sculptor looking at making sculptures of the team logo. only thing is idk how Mods or logo creator would be if i made sculptures for you lot. 

this is my art account so i gotta be formal and use uncivilised english here. i’ll jump in with my other account and be civil with y’all in a second.",i’m an artist interested in making WSB sculptures. would there be any legal issues if i made them and sold em?,1.0,1615862451,henrycm_com
49,m5z3u9,,Payment For Order Flow &amp; The Fleecing Of The Retail Investor,1.0,1615862457,Fearless_Leader99
50,m5z4iz,,Earlier I commented I would start buying shares when it dips. Am I still buying my shares at that price point when the market opens?,1.0,1615862522,theholyafro99
51,m5z4oe,"### Summary

- Forgotten Action Camera Hardware King
- $GPRO has a classic stock bust market history with units peaking almost immediately
after IPO in in the Summer of 2014 and despite extreme sports brand had never really
transitioned from pure consumer hardware commodity story
- GoPro has been pivoting to a DTC model w/subscriptions so as to improve and grow
brand experience with customer and their overall financial model
- This pivot/transformation has been occurring against the backdrop of a global pandemic
and thus gotten very little attention as even dominant outdoor/travel-oriented
businesses were out of favor for most of 2020
- The end of the pandemic combined with the progress they have made so far has created
an intriguing investment opportunity

### Past Narrative Issues

- Stock was an extremely overhyped IPO which quickly ran into Icarus type issues as units
peaked 12 months after 2014 listing
- Iphone/Samsung camera improvements and integration around ecosystem have
continued to chip away at stand-alone camera use cases in the action/adventure space
- Attempted IPO multiple justification via diversification into media company with
streaming and broader content also didn't pan out
- Drone adventure crashed and burned.

### Covid Transformation

- GoPro leveraged the pandemic to transform their distribution model and overall
commoditized camera hardware only identity
- Cameras mix has shifted from single digit DTC to 33% in 2020 with a guide for 40% in
2021 and 50%+ longer term
- Introduced subscription model to drive mix shift and improve model economics around
sticky vertical and drove significant subscriber growth with Hero 9 bundling. Company
exited 2020 w 761K SUBS (52% sequential growth &amp;145% yr/yr) and has guided for 2ml
exit by end 2021
- Company is introducing revamped app to tie all the pieces together in organization,
editing, and sharing of photos/videos. App will be rolled out to 5m' monthly existing
users for $10/yr and offered free to subscribers
- Recent changes drove favorable mix shift (90% 2020 rev and 80% units came from
cameras w $300+ msrp) and $200 million in operating cashflow in H2 2020

### New Investment Narrative

- Stronger financial model w/ bundled camera subscriptions driving improved margins
and cash flow from enthusiast customer base
- Improved brand connectivity from subscriptions with customer data and personalization
allowing for enhanced direct marketing capabilities
- New growth opportunities w Gen Z on the back of the end of Covid action/outdoor
refresh, a new open app experience, and strong Youtube channel presence

### Potential Outcomes

- Stock trades to $23 or 17x my estimated 2021 year -end EV/FCF by June
- Possible bluesky- GoPro adds 3ml+ subs on global reopen refresh in travel/leisure and
becomes open up momo darling. Stock trades $40 or 20x my forecasted EBITDA
- Bear Reopen Scenario (assumes no Covid revival)- GoPro finishes 2020 with just under
2ml subs and the multiple doesn't expand. Stock peaks by Independence Day and finds a
fair value closer to $15 for most of 2021

### Risks

- Subscriber churn proves to be far greater than expected for bundled camera purchasers
by year end
- New App launch is delayed
- Covid-19 returns in a far more deadly form within a few months and crushes the global
travel/outdoor refresh cycle before it gets going",$GPRO Investment Thesis,1.0,1615862537,jayohhh
52,m5z4ov,[removed],GME Buy in opportunity?,1.0,1615862538,nulliusinverba0
53,m5z550,,WSB goes long gorillas,1.0,1615862579,exportablue88
54,m5z56c,,"He who shall not be named is literally begging for you apes to come back. DONT DO IT. (I don’t have $$ in them anymore, moved to fidelity)",1.0,1615862582,Belgian__WAFFLE
55,m5z5ln,,Just sponsored a gorilla,1.0,1615862619,printThisAndSmokeIt
56,m5z5u9,,Shout out to this legend I just spotted in Dallas. I hope you’re able to buy a Tesla next with your gains.,1.0,1615862641,HolyScheizze
57,m5z5v9,,$JBL earning play? 👀 I’ve always loved their speakers. What do you apes think? I got a 3/19 $49c fuck it,1.0,1615862643,Sad-Dot000
58,m5z5x4,,In memory of Harambe,1.0,1615862649,Killingroughtime
59,m5z63l,,"$root with 78.59% short interest, and only 15M float. squeeze to the moon coming.",1.0,1615862662,OneSchedule563
60,m5z6rn,[removed],Gme,1.0,1615862726,FionaLilli
61,m5z6uw,,Gains Multiplied Exponentially,1.0,1615862736,Kilverado
62,m5z76h,[removed],🧈 to the moon 🌕,1.0,1615862768,newfrontierpolitics
63,m5z7eg,,Bro..... wut?,1.0,1615862787,scurvyduck1
64,m5z7ut,guys I've got a competition for schools in my state where if I make the most stocks profit I win $700. pls buy A2M stocks.,buy a2m,1.0,1615862832,b3astmonstar
65,m5z85u,,I’m new to the apes but this belongs here 💎🙌🏼🚀🦍 to the moon my fellow crayon eaters 🌙,1.0,1615862857,Bhinds239
66,m5z8bn,,Market Correction Soon heads up v(;;’’//5,1.0,1615862872,Electronic-Tension21
67,m5z8gm,,How GME went today,1.0,1615862884,Necessary-Dare-3630
68,m5z8ij,Our huts have to be shingled right?👀,Owens Corning,1.0,1615862889,Grand-Telephone7083
