,post_id,text,title,upvote_ratio,date,author
72,lwgdok,"Hoping this time I won't get immedately deleted.

&amp;#x200B;

IF you read my first DD and got in, congrats.

Check it out if you're late to the party.

[https://www.reddit.com/r/wallstreetbets/comments/lunv1h/the\_rkt\_is\_fueled\_and\_ready\_for\_liftoff\_launches/](https://www.reddit.com/r/wallstreetbets/comments/lunv1h/the_rkt_is_fueled_and_ready_for_liftoff_launches/)

There are exactly two reasons for why its NOT FUCKING OVER.

Reason 1: Dan and Jay hate the shorts

Wall street has never considered RKT to be a Fintech company.

You know what's happening tomorrow at 10:15 AM?

[https://ir.rocketcompanies.com/news-and-events/press-releases/press-release-details/2021/Rocket-Companies-to-Participate-in-Morgan-Stanley-Technology-Media--Telecom-Virtual-Conference/default.aspx](https://ir.rocketcompanies.com/news-and-events/press-releases/press-release-details/2021/Rocket-Companies-to-Participate-in-Morgan-Stanley-Technology-Media--Telecom-Virtual-Conference/default.aspx)

That's right. Jay Farner, the CEO is going live with Morgan Stanley during a TECH conference to have a fireside chat.

You're going to tell me that they just happened to have this scheduled smack in the middle of the week of hell for RKT shorts? You're going to tell me that there's no way they might drop a bomb that truly sends RKT to the stratosphere?

I have no fucking idea. But I trust in Dan Gilbert &amp; Co. to win. Because that's all they've done for the past 35 fucking years. WIN.

&amp;#x200B;

To make things even sweeter, more dry powder is coming in tomorrow- market makers making new options tomorrow. Remember the first time new options came out for GME? If you bought even the farthest OTM one, it printed.

🚨🚨MM WILL HAVE TO REMAIN DELTA NETURAL WITH THEIR NEW OPTIONS 🚨🚨, THUS THEY WILL HAVE TO BUY SHARES. THEREFORE, THE MORE NEW OPTIONS BOUGHT TOMORROW, THE MORE FUEL IS LOADED FOR A GAMMA SQUEEZE. 🚨🚨

&amp;#x200B;

To close things up, recall that RKT had 40% interest going into this week. Look at today's graph.

[https://imgur.com/vIgVH7l](https://imgur.com/vIgVH7l)

&amp;#x200B;

Notice those two drops where it halted? See the STRONG support that immediately followed? This is a textbook example of a ladder attack. The SHORTS HAVE RELOADED, AT A NEW PRICE. Shorts ATTEMPTED to shake the 💎👐 , but failed. Retail is NOT ALONE on this 🚀. The DIP is being purchased, even while at an ATH.  Someone is on the LONG side buying up shares with retail.

In my opinion, after today, short interest could potentially even end up way higher than 40%. Look at the candles during those short ladder attacks. Shorts had to have borrow MILLIONS of shares to attempt to short ladder today. I wouldn't be surprised if this is Melvin &amp; CO's latest play to dig themselves out of their Gamestop loss porn either.

MORE SHORTING = MORE SHORTS TO CHOKE

&amp;#x200B;

So that's reason 1. There's a nonzero chance Jay Farner drops a bomb tomorrow that takes us to the stratosphere. But what's reason 2?

🚨🚨MY PRICE TARGET FOR RKT IS $73.5 🚨🚨

Let's go through the numbers.

&amp;#x200B;

RKT's projected EPS for this year is \~ $2.45. (SOURCE IS ON SA, REMOVED LINK BECAUSE IT WAS GETTING MY POST DELETED)

&amp;#x200B;

To get P/E, take the price and divide by earnings. Thus, we can use this to calculate the forward P/E for RKT. RKT closed at $41.79, which divided by $2.45 is \~17.05. Thus, RKT currently trades at about a 17Forward P/E. Companies in this sector trade in between 15-30 P/E, and since I strongly believe RKT is a growth stock, I think it should trade at 30x P/E.

Thus, 30 x $2.45 is $73.5.

Therefore, my PT for RKT is $73.5. RKT is a fintech company, and is a PROFITABLE one. Think about how many fintech companies have crazier valuations and aren't even profitable?

You know what that means?

IT'S NOT FUCKING OVER. IF SUITS ARE BUYING AT ATH, IM BUYING AT ATH. IF SHORTS HAVE RELOADED, THE SQUEEZE HAS NOT SQUOZE. THE SUITS AGREE. RKT IS WORTH MORE THAN $40.

&amp;#x200B;

TLDR: SHORT INTEREST HAS PROBABLY GONE UP, SUITS ARE BUYING. CURRENT P/E is 17, GROWTH PE IN MY OPINION SHOULD BE AT LEAST 30. RKT IS STILL UNDERVALUED, AND MY PRICE TARGET IS $73.5

&amp;#x200B;

Remember, 🚀 fundamentally a great company. They are still NOT priced as a growth stock. They are still NOT considered Fintech by the suits. There is a reason why this stock closed strong at a new ATH.

I LIKE THE STOCK.

&amp;#x200B;

My PT is $73.5. NO 🧻👐

Not financial advice. I don't know anything.

Positions: 150 shares, 50 $23 C 3/5 EXP. I will be exercising almost all my calls as I am LONG.

I will be purchasing OTM calls tomorrow at open 🚀🚀",🚨🚨WHY ITS NOT OVER FOR RKT 🚨🚨MORE SHORTS HAVE RELOADED🚨🚨 🚀🚀 IMPORTANT DD INSIDE.🚀🚀,1.0,1614730240,brawnerboy
73,lwgdpx,,"Someone just bought 4,821,223 shares of AMC after-hours. 🚀🚀",1.0,1614730243,krush38
74,lwgdso,,$$$,1.0,1614730249,fryeaaron
75,lwgdup,Is UMWC worth buying call options tomorrow?,Will UWMC shoot up tomorrow? What are the chances?,1.0,1614730253,jfournier5
76,lwgdzq,Is this the next one? RKT...,The New GameStop?,1.0,1614730266,Nottingham69
77,lwge00,"If it isn't obvious enough, MARA is running parabolic.     


This means volatile, quick movements.. and when a drop comes, it'll be steep.   
SO what do we do from here?    


The market is still indecisive as we found out today, but that may have no impact on MARA. If we take a look at the chart below, notice that the volume is squeezing; yet there are still big moves each day due to volatility.  This explains two things:    
1. MARA is volatile   
2. When volume breaks out, it will go ballistic.    


Take a look at the last two bounces off support (circled in green). This should tell you that MARA typically pumps FAST and drops slowly, when there is a breakout on volume that is.   


Back to where we stand.. we have bounced off support, but volume has not spiked and we aren't moving like we do in the previous bounces.    


From all of this info, expect to possibly touch that support one last time before we blast off; otherwise, this is a small pullback in the process of taking off. In conclusion: Take an entry when you see the volume spike.. simple as that.     


And always, before entering a trade, be sure to check recent news to give yourself support and a sturdy wall to stand behind.    


Mid-Term Target: 55.00-60.00   
Popular Option Flow: 35c 3/12 exp @ 4.43

https://preview.redd.it/hrcpf5vigpk61.png?width=2508&amp;format=png&amp;auto=webp&amp;s=f7a9d668f1aba05306a81d967f13744d83390100",MARA Analysis: Expectations,1.0,1614730266,MoistBands
78,lwge89,,"My small RKT yolo paid off! 2300% in one day, holding until we reach the moon 🚀🚀🚀🌝🌝",1.0,1614730287,aidsfordays
79,lwgee0,,This shit should be illegal or at least a breach in Reddit’s security or SOMETHING.,1.0,1614730300,the_ryan_ford
80,lwgefe,"There are so many positive articles about $RKT it's insane.

CNBC and other news outlets already lied to us multiple times during the last weeks, why wouldn't they continue ?

Hate me all you want, but RKT is clearly diversion.

GME is and will only be the ONLY play. This opportunity will never again. We are making history.

Baffles me that mods allow and actually encourage people to buy RKT, breaking their own rule 4.","Yes, $RKT is a shill ticker, a p*mp-and-d*mp managed by HFs, designed to derive you from $GME.",1.0,1614730303,Aydenn7
81,lwgegw,[removed],I think $TWO is a kick ass value buy and will updoot.,1.0,1614730308,ManzoTheSawedOff
82,lwgekf,,Trying to discredit all of wives boyfriend.,1.0,1614730316,RustUponIron
83,lwgeo7,So I have tried following you guys bought some GME and hodl that! Missed the RKT ride today! How do I know which is a bot and what you guys are going for next before I’m too late again! I need money for this kids college fund! Help a mom out! 🚀🚀🚀,Retard mom paying for college,1.0,1614730325,jencorn1973
84,lwgev4,,J&amp;J Gang 🥵,1.0,1614730341,inthamoney
85,lwgew4,This is obvious they lose less and save their asses if people jump on RKT. Stay the course. GME and AMC,They’re using RKT to distract from GME and AMC,1.0,1614730342,bc22ok
86,lwgew6,"So my strategy is to sell and buy OTM puts at the same strike. That way you can buy at the lowest price.

If the price dips further than your strikes then you sell using your put and you’ve lost nothing and can keep using the strategy until it bottoms.

After the price rebounds you hold the security and let your put expire to profit.

This seems like a zero risk long bull strategy. Is there an easier way to do this I’m missing, or risk I’m not understanding?

Or am I making a bigger mistake? I can’t find anything online that mentions this strategy. Basically it’s just a hedged cash-secured put.

Or a preemptive married put. 

An engaged put if you will.",I can’t tell if I’m retarded or if I’m a genius.,1.0,1614730343,NinjaPirateKing
87,lwgexg,[removed],Ideas?,1.0,1614730346,bigbootylatinas03
88,lwgf7e,CCIV has some massive short activity and is being far too oversold. This needs some attention so it can rocket like it should!,CHECK OUT CCIV!!,1.0,1614730367,T_newt116
89,lwgf91,Someone please explain like I’m five I wanted to get into trading/stocks etc and figured this subreddit was the best place to learn. I must’ve been living under a rock for the past couple months because everyone is losing their minds over GameStop’s stock. I find the memes hilarious but I truly have no idea what’s happening.,What is happening???,1.0,1614730371,Additional-Baby9612
90,lwgfbk,"To start this off, I’m not a big baller like a lot of people posting on here I’m 4@124 GME and 2@39.76 for RKT (I was late to both but I’m holding GME till  🚀 🌙 )

Yesterday, I was browsing the posts and kept running across RKT, and some people were saying it was bots and others had a lot of mathematical data showing otherwise. I figured since I don’t have a whole lot of free’d up cash in my portfolio, I’d wait. The call options I was going to buy now would have netted in over $2000. So I’ve been beating myself up all morning. 

Today, I’ve been back at browsing the posts trying to read as much DD as I can on different things and I keep stumbling across this UWMC. The information is so scattered that I don’t know what to think. Can we get some good talking points as well as data going on in here to see whether or not we can get myself and the other retards that missed the RKT 🚀 another 🚀?

I’m an 🦍 , I follow other 🦍 🦍 🦍 . I’m new to the jungle, bring me to 🍌 and tendies",WHAT IS ALL THIS TALK ABOUT UWMC,1.0,1614730377,DewJave
91,lwgffh,,Got out of Robinhood!,1.0,1614730386,Hammar_onYT
92,lwgfg7,"**Ticker: MARA**   
If it isn't obvious enough, MARA is running parabolic.     


This means volatile, quick movements.. and when a drop comes, it'll be steep.   
SO what do we do from here?    


The market is still indecisive as we found out today, but that may have no impact on MARA. If we take a look at the chart below, notice that the volume is squeezing; yet there are still big moves each day due to volatility.  This explains two things:    
1. MARA is volatile   
2. When volume breaks out, it will go ballistic.    


Take a look at the last two bounces off support (circled in green). This should tell you that MARA typically rises FAST and drops slowly, when there is a breakout on volume that is.   


Back to where we stand.. we have bounced off support, but volume has not spiked and we aren't moving like we do in the previous bounces.    


From all of this info, expect to possibly touch that support one last time before we blast off; otherwise, this is a small pullback in the process of taking off. In conclusion: Take an entry when you see the volume spike.. simple as that.     


And always, before entering a trade, be sure to check recent news to give yourself support and a sturdy wall to stand behind.    


Mid-Term Target: 55.00-60.00   
Popular Option Flow: 35c 3/12 exp @ 4.43

https://preview.redd.it/03a0c97wgpk61.png?width=2508&amp;format=png&amp;auto=webp&amp;s=087e22ebd6547a743d64cf7c970a35c97b2e947b",MARA Analysis: Expectations,1.0,1614730388,MoistBands
93,lwgfie,"So I only read the first line of the DD that said buy RKT. Did that, up. Are we meant to be holding these? Can some smart apes tell me what the exit strategy is? I have no idea what I’m doing, just playing the casino.",RKT. What now??,1.0,1614730393,Eft_Reap3r
94,lwgfov,"Buy this NFT let's take down Wallstreet aUTISTS

[https://app.rarible.com/token/0xd07dc4262bcdbf85190c01c996b4c06a461d2430:194132:0x98bae92882d0ff2dd6b273877f399b4c3b0aad90](https://app.rarible.com/token/0xd07dc4262bcdbf85190c01c996b4c06a461d2430:194132:0x98bae92882d0ff2dd6b273877f399b4c3b0aad90)",Wallstreet WILL Die,1.0,1614730410,bobbybigbollox
95,lwgfu6,"Wish me luck doing grubhub tomorrow! I only only got 15 stonks but need more so I can retire my grandfather and parents!

Diamond Hands to the Moon!

WHEN GME actually hits 100k I'm getting my first tattoo dedicated to it.",Broke-College Ape need more bananas,1.0,1614730423,ChumFum
96,lwgfy4,"Are next on the chopping block. Also FCEL MP AMD etc. imho. Tesla will go to 500. Think, big ticket stocks you’ve seen or bought because of social media.

They’re going one place, and it rhymes with frown.

Which is an opportunity in my mind.",Semiconductors and Airlines,1.0,1614730433,personaanongrata
97,lwgfzi, [Webinar Registration Page (benzinga.com)](https://go.benzinga.com/webinar-registration1614549707198),Cathie to Appear on The Raz Report Wednesday,1.0,1614730437,AlwaysADelight
98,lwgg2a,,Trying to run our wives boyfriend through the mud.,1.0,1614730444,RustUponIron
99,lwgg78,,How many of your retards bought $RKTE instead of $RKT today and made 566% gain,1.0,1614730456,Odd_Breakfast_5042
