,post_id,text,title,upvote_ratio,date,author
0,lwg3xa,[removed],You guys wanna see probably the funniest thing you’ll ever see?,1.0,1614729437,wretchintheforce
1,lwg44o,,Bought my first stock with my dad! $AMC to the moon!🚀🚀🚀,1.0,1614729452,TropicalMoonlight
2,lwg44y,[removed],Go to r/gme instead of wsb if you are holding,1.0,1614729453,DanimalsCrushCups
3,lwg4a0,,Reopening trade: TSLA and ABNB,1.0,1614729463,redfre813
4,lwg4jo,[removed],XL to moon tomorrow.,1.0,1614729488,Broad_Baby_5422
5,lwg4mh,,~$280k gain in a day from RKT YOLO. 7x even though I bailed far too early.,1.0,1614729495,Rankith
6,lwg4u8,,When you should do customer calls but GME keeps calling YOU!,1.0,1614729514,Objective-Orange926
7,lwg4xg,,“a Reddit short target”,1.0,1614729521,ztwiggyy
8,lwg4z0,,"Fuck off Citadel, none of us are falling for it.",1.0,1614729525,viperfide
9,lwg54r,"&amp;#x200B;

MY sweet tendies.. Thank you papa Dan

&amp;#x200B;

https://preview.redd.it/1o5qvx7eepk61.jpg?width=1125&amp;format=pjpg&amp;auto=webp&amp;s=faeaafa0a7e574408f6430c43b149d472846a975",All-in on Rocket $RKT,1.0,1614729540,nguyenbahuy
10,lwg59g,,"More reasons not to trust Jim Cramer, he’s lied his entire career. Whatever he says, do the opposite!",1.0,1614729552,No-Yogurtcloset-763
11,lwg5dy,[removed],Those who gained in rkt don’t forget about your brothers in gme.,1.0,1614729561,MangoMan69x
12,lwg5h6,[removed],"Every single RKT Call option went ITM today, the gamma squeeze by friday is going to be EPIC",1.0,1614729568,Budget-Quality-1745
13,lwg5hr,,"I didn’t make as much off RKT as some of these posts but pretty sure I hold the record for getting booted off Stocktwerps the most times this week. THEY CANT HANDLE APES 🦧 🦍. RKT is a HOLD for me , going deep in UWMC. (the ticker that’s hard for a retard to remember) 🚀",1.0,1614729570,CNutz649
14,lwg5lr,I just bought some stock in GME but my hopes aren’t too high. Any idea on if it’ll go back up like it did in January?,GME,1.0,1614729579,Adamdsjs
15,lwg5sw,,"I lost 15k on GME. Made 15k in the AM, riding with the rest ~30k",1.0,1614729596,IFuckedUp_ALot
16,lwg5zr,"I'm super new to this and I swear I did read through past comments but this is really overwhelming. 

Mind pointing me at a Robinhood alternative?",Help - what app / platform?,1.0,1614729610,bpvanhorn
17,lwg609,,"Will Zom stock go up? The stock lies in the lower part of a very wide and strong rising trend in the short term, and this may normally pose a very good buying opportunity.",1.0,1614729610,EducationalRice1655
18,lwg67d,What do we think of NIO.  Bought this one at $4 almost 2 years ago sold some off in the low 60s and was going to buy back.  Do we think if goes lower or is $43 a good buy ??,Nio,1.0,1614729619,GreenPie321
19,lwg699,"So was cruising some analytics on webull of a few companies I have holdings in through stash. Noticed quite a high short interest on Crispr. Now my brain is pretty smooth so I don't know how to tell what the percentage of short interest is. Could one of you fellow retards help me out? Gene editing is definitely the future and what CRISPR is doing will revolutionize medicine at some point with the ability to cure almost any genetic diseases, birth defects, etc. But their EPS ratio recently took a dive which makes sense, they need to spend more on R&amp;D to drive this technology forward. Unfortunately it seems because of this it has accumulated a lot of short interest from traders/heggies or whomever..
Wondering if any of you apes think its sitting in a prime spot for a good squeezin, daddy likes his fresh squoze juices 🤤",CRSP possible squeeze?,1.0,1614729620,DabAssassin69
20,lwg6ai,"I'm a complete novice , rube , greenie , etc   i aspire to be an ape 

Draftkings is operating in only 7 states.  Looks like theres a tremendous upside going forward

can it be that simple ?",DraftKings DKNG opinion,1.0,1614729623,grover-dill
21,lwg6k7,I’m new to all of this. Been reading around and discovered the hot topic of RKT. Went and saw the massive spike...Is it too late to go in?,RKT - Is it too late?,1.0,1614729646,Pataract
22,lwg6ns,"Does anyone still have the DD on SENS?  Someone smarter than me said, ""SENS is more shorted than GME and RKT??"" Down 5% today with lower than average volume...",More shorted that GME and RKT,1.0,1614729655,OldHenrysHole
23,lwg6yo,"This is simple math: There are 1.7 billion more shares of RKT than there are of GME. It is mathematically impossible for it to squeeze like GME will. All the retail investors in the world do not have the combined purchase power to buy up enough RKT to truly squeeze it and hurt the hedgies. 

Right now all the retail investors basically hold the 20 million or so tradeable shares of GME; do the retail investors physically own all the tradeable shares of Rocket? You know, some 600+ million shares? Nope.

My guess is the HFs wanted the paper hands to sell GME and buy up RKT instead. Then these dorks will be left holding the bag.",Too many existing shares to properly squeeze RKT.,1.0,1614729675,Houstman
24,lwg7cu,[removed],Interesting,1.0,1614729705,B0off
25,lwg7h6,"I am already up 70% on RKT, does anyone think it will keep going up tomorrow? Or should I sell after hours and keep my profits?",Rocket Mortgage,1.0,1614729715,smi25810
26,lwg7i4,,I’m sorry what?,1.0,1614729717,Lukos413
27,lwg7ij,"Kohl's beat earnings and expects an increase in sales over 2021. This stock has hit the moon before, buckle up.",$KSS,1.0,1614729718,Gaddafo
28,lwg7kf,[removed],Don’t mess with the ZOHAN,1.0,1614729723,LazerMoneyMachine
29,lwg7km,"I have read so many people’s replies that are just really f*cking ignorant in the last few days. One guy had a decent post about March madness and he thought online betting stocks would rise. It was this guys first post after being a member  for a year. 
Now some POS tells him it’s already been priced into the stock then said he was retarded and needed to stick with his coloring book. What a fucking way to welcome someone to wallstreetbets. People need to support other people or try to steer them in a different direction if you believe their wrong. If you don’t like a post down vote it. If you want to bash people drag your wife’s boyfriend out your trailer and onto Jerry Springer. Don’t think because you learned a new word on Bloomberg radio this morning you know everything.",Stop being ignorant,1.0,1614729723,Tombomb187
30,lwg7lp,,"1 Share Bandit. Pins on the way, PM ME! 🚀🙌💎",1.0,1614729726,Bwhite462319
31,lwg7oj,,"I lost 15k on GME. Realized my losses in the AM, riding with the rest (3/5 24c, 3/12 32c, 3/19 45c)",1.0,1614729733,IFuckedUp_ALot
32,lwg7rn,"Bought this stock because they're working on a Covid treatment, but it's just been taking a dive recently.  With all the vaccinations, I start to despair, then I see... [Texas and Mississippi to lift mask mandates and roll back Covid restrictions (nbcnews.com)](https://www.nbcnews.com/news/us-news/gov-greg-abbott-lift-texas-mask-mandate-open-state-100-n1259329) and I start to feel better.",RDHL,1.0,1614729740,Black_Magic_M-66
33,lwg7wf,,I know what it means.. why don’t you tell me so I can tell you if you are right,1.0,1614729752,jakeod27
34,lwg7ys,"My fellow retards, 

  The time is upon us, grab ahold of your motherfucking rocket. The writing on the wall has been for some time, but in all of the worlds greatest of ironies, we even spelt it out on the god damn daily chart. **FUCK YOU MELVIN. WE'RE GOING TO THE FUCKING MOON. ALL OF YOU GOD DAMN SEXY APES, WE HELD, AND WE'LL KEEP HOLDING UNTIL THIS SHIT BLASTS OFF BEYOND THE MOON AND REACHES PLANET $420,690. THE CHART IS WITH US.** 

&amp;#x200B;

&amp;#x200B;

\*\* I'm not a financial advisor, this is not financial advice in any way shape or form. I just like the graph, I'm most definitely not a cat, but I am certainly a fat thumbed retard who loves the stonk \*\*",The Great F** You Melvin,1.0,1614729757,WBSdiamonds
35,lwg8e2,,“SLAP THAT $KMPH ASKING PRICE” Me:,1.0,1614729792,BushLeague101
36,lwg8h6,"Could be next streaming giant!! CIDM streaming up 150 percent and will keep on going! Heavily shorted!!
Let’s make it pop and hold!!",CIDM🔥🔥,1.0,1614729800,BigRed141414
37,lwg8hx,[removed],UWMC United Wholesale Mortgage NEXT!!,1.0,1614729801,abduriqbal
38,lwg8le,,RKT is more than just a squeeze play. They actually have results. More upside coming. 🚀🚀🚀,1.0,1614729808,Carlovb6993
39,lwg8vg,"Texas announced it would end its mask mandate (no discussion on that topic allowed) and quickly reopen heading in to the summer. 

We know what companies profited from COVID, such as home entertainment and delivery, while in person businesses suffered. What are some businesses that were hurt by COVID that may see a come back, specifically in part, to a large state reopening in time for summer? I'd instinctively assume amusement parks and attractions of the sort could see a boost, but I'm sure there's PLENTY more I'm not thinking of.",Texas opening up the state... what could spike?,1.0,1614729830,belacttu2
40,lwg90e,,AmC - just entering or setting up a daily squeeze here... with the 1hr as well...once this set up is complete next run 🏃‍♂️ will be set to lift off 🚀🚀🚀,1.0,1614729841,SCHMEDERLING33
41,lwg99g,Hey guys just curious any one who knows in Australia whats a good stonk app? I am new obviously like who knows how many people xD please no hate ive been here for a bit now its been fun learning this stuff from other posts.,App discussion?,1.0,1614729863,SupernaturalGardener
42,lwg9ac,,UWMC to the moon 🚀🚀 will follow RKT probably. I'm grabbing as many calls as I can tomorrow,1.0,1614729865,jdcl13
43,lwg9e7,[removed],$CLNE,1.0,1614729873,Bigbuddy145
44,lwg9fj,[removed],RKT DISTRACTION,1.0,1614729877,triqerinoir
45,lwg9se,"This was my first attempt at buying call options. I'm trying to learn.

I bought 100 3/12 @ 29 / .90 last night/AH when shares were less than $25.  Using RH (VG is slow approving) for options, the calls stayed in ""placed"" after open. Hours went by and the price continued to climb, and eventually passed $35. At that point i cancelled my placed calls thinking there was no way I was going to get them. 

I'm wondering if I just Fk'd myself and cancelled to soon or if I just picked a shit option call. Should I have just been more patient or was there no shot in hell of them ever going through?

Bummed I missed out on the sure thing this morning, but I'd like to at least execute/sell my next option attempt.","New retard, much question ask: RKT calls stayed in ""placed"" status",1.0,1614729905,xxp0loxx
46,lwg9tt,,"New months, fresh air, follow the plan, stop doing shitty trades. 42h later:",1.0,1614729909,DiamondHandsItaly
47,lwg9yt,[removed],UWMC MEGA Thread !!🚀🚀🚀🚀🚀🚀,1.0,1614729922,ScrappyMMA
48,lwga2u,Whats the play here? Can we expect a squeeze?,SOS!!!!!!!,1.0,1614729930,Humble_Camp_4049
49,lwga2x,[removed],RKT? Not RXT?,1.0,1614729930,wazboy2
50,lwga4j,,$AMRS - The Ten Year Tendie Play - Part 2 (DD in comments),1.0,1614729934,ICanFinallyRelax
51,lwga77,RKT is a distraction. Some HFs short on GME are long on RKT. Yeah its profitable and that's where the trap is most effective. You are only giving them more money to short more GME. This is the only way they can save their asses. Apes and smooth brains. STOP.,Stop buying RKT,1.0,1614729941,Rketype
52,lwgabl,So RH really does IPO...what can we do?,Robinhood IPO,1.0,1614729951,wumboxinferno
53,lwgarq,"Does anyone have an explanation on why after hours price jumps happen for SPAC's? I have seen this a few times - SPAC price goes down throughout the day, then after hours price jumps up only to open the following day at previous day close. It is after hours so I cannot imagine those with access are doing this unknowably. SPAC might close at $10.50, trade at $11.50 after hours, but then open the following day at $10.50 still.

I cannot imagine HF and those with access would be so stupid?  Then again they do short stonks.",Making Sense of After Hour Trading,1.0,1614729989,tiggers23
54,lwgat5,,I heard r/wallstreetbets was looking for a spokesperson,1.0,1614729993,drdalebrant
55,lwgb0r,[removed],If you are holding go to ǝɯƃ/ɹ instead.,1.0,1614730013,DanimalsCrushCups
56,lwgbfh,,"Tala still in downtrend, running between 100 and 50 daily moving average still waiting for good entery? What do you think",1.0,1614730048,drmoh1800
57,lwgbh3,The stock just jumped up significantly? I’m reading that hedge funds are shorting it? IDK what that means exactly DO NOT BUY BECAUSE I SAID THIS. I am uninformed what did it jump up so much?,WHATS GOING ON WITH ROCKET MORTGAGE ⁉️⁉️⁉️,1.0,1614730052,dior_goldxn
58,lwgbhz,,Sweet dreams 🌕,1.0,1614730055,Bleached_Blackhole
59,lwgbju,"Ok you apes, I know everyone is probably distracted by the rest of the shit going on in the market but GO just had their earnings call today 3/2 and they fucking crushed it. In typical fashion what happened? the stock TANKS all the way down to $34 which is an INSANE VALUE. This stick was a bargain around 37-38 but now it's just free money when this thing rebounds back to 45 where it was less than a month ago.

Here are the highlights of the earnings call today in case you missed it:

* Net sales increased by 23.1% to $806.8 million, which includes $53.3 million from the 53rd week.
* Comparable store sales increased by 7.9% on a 13-week basis over a 5.1% increase in the same period last year.
* The Company opened eight new stores ending the quarter with 380 stores in six states.
* Net income increased 146.8% to $24.3 million, or $0.24 per diluted share.
* Adjusted net income(1) increased 46.1% to $24.2 million, or $0.24 per non-GAAP diluted share.
* Adjusted EBITDA(1) increased 24.7% to $51.2 million.

This is all good news for us and only proves that after the sell off after earnings this thing is going TO THE FUCKING MOON!🚀

Here are some highlights from 2020 compared to 2019:

* Net sales increased by 22.5% to $3.13 billion.
* Comparable store sales increased by 12.7% on a 52-week basis compared to a 5.2% increase in the comparable period last year.
* The Company opened 35 new stores and closed two stores during the year.
* Net income increased 592.1% to $106.7 million, or $1.08 per diluted share.
* Adjusted net income(1) increased 86.9% to $112.7 million, or $1.14 per non-GAAP diluted share.
* Adjusted EBITDA(1) increased 32.4% to $222.9 million.

AND if that wasn't good enough here is what things are looking like moving forward for us.The Company currently expects to open between 36 and 38 stores this year with one closure. They anticipate that comparable sales for the first quarter will decline in the negative high-single digits reflecting the impact of cycling the initial demand surge related to the COVID-19 pandemic in March 2020. Excluding the impact of discrete items, they anticipates a normalized fiscal 2021 tax rate of 28%.apital expenditures, net of tenant improvement allowances, are estimated to be approximately $130.0 million.

This is an extremely cyclical stock and moving into spring and summer are the biggest months for GO as cooking and overall grocery shopping increases. I can't overstate how undervalued they are right now at $34 and the calls are DIRT CHEAP.

Positions or GFTO: 

 3/19 40$ Calls - 35

4/16 40$ calls - 50

6/16 40$ calls - 50

I know march 19th seems soon but this thing is going to rebound very quickly with the rest of the market and they are so cheap I couldn't pass them up. WE WILL see $45 by the end of March, I am NOT  financial analyst, I eat crayons with a straw, please do your own DD.

TLDR; GO is stupid cheap right now and is going to pump HARD the next couple weeks - don't miss out BUY THE FUCKING DIP!",Who is ready to $GO?? Grocery Outlet huge opportunity,1.0,1614730058,Mrsinister66
60,lwgbor,I don’t have much free money to lose but what happened today looks a lot like the beginning of what happened with GameStop a month ago.  Made my first investment into GameStop when it was at 100 about a week ago so I barely know what I’m doing.,Is now still a good time to invest in Rocket?,1.0,1614730070,ludovico21221
61,lwgbp6,Buy or hold $GME,"The only options that matter, as far as I’m concerned:",1.0,1614730071,The-Dick-Doctress
62,lwgbtr,"Ok look apes, I have been following the GME trends since before the first squeeze. Needless to say, much like the rest of you, I have spent hours upon hours looking at the trends, shorts, and data since the day of reckoning last month. 

**And with the jump last week there has been a lot of paper hand BS/ Misinformation being spread** (especially with RKT)

**To simply put it,** in my opinion, **we are on the verge of something big**... 

**TL:DR at the bottom for the most atuist**

Here is why my fellow tards,

1) **We have proven the community strength**, A LOT I MEAN A LOT of us have held and held until we were finally seeing some **green** for the first time in weeks. I mean serious green, despite the quote on quote ""**Lackluster day**"" we are still up **162.5%** the past WEEK!

2) **A stock with relatively little discussion on this page (RKT) is suddenly piking 50,60,70% increase???** Not to knock any fellow apes who invested (hopefully we will see a dump in GME soon after) but **it is so suspicious that a large movement into RKT aligns with the GME rise.** Don't take my word on this, but we have seen in the past other **""GAMMA SQUEEZE"" for fill in the blank as soon as GME has spiked, and what happens after? They fall and fall hard.** 

3) The HF are scared, bad. With news breaking about Melvin and Citadale breaking over the past week, we know **that they have lost billions.** Not only that , they have continued to short the stock with heavy volume. Now with naked shorting, no one knows what the present of the float is exactly, but the estimate remains high. 

SOURCE: Wall Street Journal, 5 days ago. 

*Processing img v59kaj2xapk61...*

**Now why you might ask losing roughly 50% of your entire capital important? If you are an autist, and I know you are, let me explain.** I mentioned this in my last post, but essential without capital, **how can HF run effective short latter attacks as we saw after the enormous initial spike? They can't- or at least we hope- with what we have seen over the past few days, GME has not seen any significant short latter attacks, heck we have gone up $20 alone this week!!! (EVEN WITH THE MARKET SHITTING ITS PANTS)** 

4) **With contracts being exercised last week at around $55 dollars, we saw a gamma squeeze occur.** Now I have seen 5+ people on here explain wildly differing theories ranging from, if we hit 130 it will trigger the next squeeze, or on 3/15 the squeeze will happen! Now we can all take this with a grain of salt, after all, we are apes. **But what we can do is hold and continue to break resistance, yesterday was $113, today it was $120.** In my opinion, if we continue to rise steadily we can trigger another ITM call and see another squeeze. 

[F ROBINHOOD](https://preview.redd.it/w55we4o6dpk61.png?width=933&amp;format=png&amp;auto=webp&amp;s=e211a49e42220b19f3998f6c764a4dbd428c5bb0)

5) **I know that to your paper hands this will kill you, but if the squeeze never happens GME is a great long-term hold. Here is why:** 

\-They have landed a **huge** multi-year deal with micro soft.

https://preview.redd.it/7dvfklepdpk61.png?width=993&amp;format=png&amp;auto=webp&amp;s=c5b6fb6667ffa99e41bb73b473f9ecb0f25e8f9d

\-**They fired their insanely incompetent CFO Jim Bell,** seriously look him up dude was a douche.

this shows seriously **promising financial redevelopment for GME.**

&amp;#x200B;

[STILL F ROBINHOOD](https://preview.redd.it/q5m4zzdjepk61.png?width=939&amp;format=png&amp;auto=webp&amp;s=44bddf0d683a160630575ae539c13438fff57204)

&amp;#x200B;

\-**New wave of modernization in the gaming world. As a gamer myself, not to brag, I would love to see GME rise and take over as the ultimate streaming platform, and with the new push for the future and deals that just landed, I think that there is a pretty good chance this will happen.** 

**TL:DR- IMO I think we have this. There is clear panic on the HF sides, we are up $20 from Monday with a shit ass entire market, there have been no outstanding short latter attacks, HF is down billions with high interest, there is a flood for a ""NEW SQUEEZE RKT"" (DISTRACTION), we have been stable and we are holding. IMO if we break resistance at 130, there will be some serious momentum.**   


**IN SORT HOLD THE MF LINES RETARDS- I am not an advisor we just like the stock.**",GME PLEASE READ,1.0,1614730082,Aric_Holbrook
63,lwgcmw,"This is not financial advise. 

First semi real post here so bare with me. I’ve noticed a trend between the last few days and the GameStop saga. I’m not sure if it will play out the same way but from my (recent) memory some of this set up seems familiar. 

1. Trade volume. Looked back at GameStop the two days prior to moon day (1/28), there was significantly higher volume. Today we saw even higher volume all within a single day. Not sure if there is any correlation but the lead up volumes seem to be similar. 
2. Broader market. I haven’t checked every ticket but I did notice that everything I’m tracking and a few other I spot checked were all down today. If memory serves correct, everything was down the day before  1/28
3. Hype. I never really saw what happened with that weed stock that gained momentum a week or two ago (I took a little time off after GME), but it seemed like it came and went before I noticed. Don’t remember the ticker so haven’t checked, but it had to be something like 3-4 days. Tomorrow is day 3 of hype

Not financial advise, but just a heads up with some anecdotal memories. Tomorrow may be the day.",Rocket Prediction,1.0,1614730149,Ironwrestler
64,lwgcpc,,For GME and the EMPIRE!,1.0,1614730155,Otherwise-Win8614
65,lwgcw5,[removed],What’s happening with rocket mortgage!!!!!,1.0,1614730170,dior_goldxn
66,lwgd17,"Guys it’s seriously immature to downvote something just because it’s not gme, I can promise u most ppl still have chunky positions in gme and are just in rkt until the 9th, 

Don’t be idiots we are literally sabotaging ourselves by downvoting juicy plays. GME is definitely about to rocket soon tho theres only like 85k shorts to borrow.

It’s been a long time since most have u diamond hands have seen green too take a breather collect yourselves and come back harder. Drip or drown baby

GME and yes even RKT to the moon 🚀💎
If this gets a thousand upvotes I’ll let you guys choose my first car how about that. Smh",Don’t downvote/hate on rkt,1.0,1614730184,xAsruo
67,lwgd3l,,Fisker to the moon!,1.0,1614730190,brainiac555
68,lwgd9u,,"My small RKT yolo paid off! 2300% in one day, holding until we reach the moon 🚀🚀🚀🌝🌝",1.0,1614730205,aidsfordays
69,lwgdfd,I use eToro and it doesn't offer RKT stocks. Any tips?,Where/HOW can you buy RKT stocks in Europe?,1.0,1614730218,MustiXV
70,lwgdfo,,Just bought some Rocket Fuel for the next flight to the moon 🚀 Doin my part,1.0,1614730219,JRskatr
71,lwgdm9,"Explanation from Exro about the fake news reported by Mariner Research.  It keeps getting moderated for some reason.  Investigate Mariner and you will see they have a -41% return rate which speaks for their success.  Here's the answer from Exro  and hopefully they are in contact with the SEC.

[https://www.newswire.ca/news-releases/exro-technologies-inc-integrity-statement-from-the-ceo-807672679.html](https://www.newswire.ca/news-releases/exro-technologies-inc-integrity-statement-from-the-ceo-807672679.html)",EXRO and Mariner Research,1.0,1614730234,Canadianpainter59
