,post_id,text,title,upvote_ratio,date,author
0,m49tcg,,Royalty is meaningless - diamond hands is everything,1.0,1615653348,cleverpunk
1,m49tm8,[removed],New to trading need to understand what calls are but in ape talk.,1.0,1615653373,kindabaldteen
2,m49u17,,"NOK, if anyone wants to votw, I'll add the link in the comments!",0.88,1615653406,P13r15
3,m49ubf,[deleted],Who did this again ?,1.0,1615653427,[deleted]
4,m49uk4,[removed],stop buying options buy stocks,1.0,1615653446,theboeboemaster
5,m49uok,,you know what this means boys...,1.0,1615653458,em-power
6,m49usm,,Who did it ?,0.95,1615653467,Internationa_Mudlark
7,m49vr3,,DFV and the Trade of Destiny,1.0,1615653547,Onboarding92
8,m49w1g,,What are your moves on Xiaomi on monday? (Sorry german retard who couldnt find an english articel) It basicaly says that Xiaomi will no long have any sanctions from the USA (🚀?),0.5,1615653571,Sir_van_zupiop
9,m49wiy,,Got mine today biatches,1.0,1615653612,Available-Marsupial8
10,m49wz5,[removed],OPTIONS,1.0,1615653652,ImFromTheMarianas
11,m49xee,[removed],New to this,1.0,1615653688,MathematicianClean57
12,m49xtj,,Jerry Klei on TikTok,1.0,1615653721,450bush
13,m49y3p,[removed],Why lend someone a stock?,1.0,1615653745,mezway
14,m49ycg,,Trust in currencies and everybody becomes billionaire. Promised.,1.0,1615653766,FRIEDRICHHECKER
15,m49yop,,Hold.,1.0,1615653794,urbangunslinga
16,m49yqa,,Apes together strong,1.0,1615653797,WizardPoppy
17,m4a001,[removed],$RIDE,1.0,1615653896,jonascyp
18,m4a054,,🦍 eating at Black Bear(ish) Diner sees sign of “Melvin” helping us...I keep seeing signs. Should I have a banana for dessert? 🍌😂,1.0,1615653909,BowflexWindsong
19,m4a0jj,,What do you like about this stoink?,1.0,1615653942,Spicytacos1997
20,m4a0oj,,Cash app dumbing down stocks for fellow ape. 💎 🙌🏼🙌🏼🙌🏼 be patient 🦍 🦍 🦍.,1.0,1615653955,Different-Fortune764
21,m4a0qm,[removed],What do you retards think about Xiaomi now that they dont have and sanctions against them anymore?,1.0,1615653960,Sir_van_zupiop
22,m4a1e9,[removed],About that stimulus check,1.0,1615654011,Fejimush
23,m4a281,[removed],EEENF OIL PLAY YOLO!! 🚀🚀🚀,1.0,1615654079,IncandescentPoop
24,m4a2me,,Can anyone enter this link?,0.5,1615654113,DianaPsyche
25,m4a3dc,,Round 2 - GME Congress Hearings,1.0,1615654178,brominated
26,m4a3hg,[removed],RIDE investment,1.0,1615654186,Rickster0123
27,m4a3lu,,The IRS reviewing my trading activity for the year,1.0,1615654195,Crazy-Cat-Gentleman
28,m4a41l,[deleted],To the Moon we go. Monday opening 🚀🦍,1.0,1615654229,[deleted]
29,m4a4be,,"I teach high school, which means I explain things to idiots every day. If you still don't understand options, I got you.",1.0,1615654250,[deleted]
30,m4a4nk,,EEENF OIL YOLO,1.0,1615654278,IncandescentPoop
31,m4a4xc,[deleted],Bolstering our forces,0.99,1615654300,[deleted]
32,m4a5sj,,To the Moon we go. Monday opening will be crazy,1.0,1615654366,Traditional_Base_584
33,m4a5ww,,Hold On Tight Monke!,1.0,1615654375,FearTheFlexPlex
34,m4a60k,,Anyone capable of seeing when I first made my account 100% Gamestop?,0.71,1615654382,mmgid
35,m4a67h,[removed],GME Bounce Tube,1.0,1615654397,SnooHamsters9058
36,m4a6au,,What do you retards think about Xiaomi now that they dont have and sanctions against them anymore?,1.0,1615654404,[deleted]
37,m4a6j3,[removed],i spent three weeks in /gme...ask me anything,1.0,1615654424,droiddekka
38,m4a6xu,,They will not stop; human psychology at work.,0.33,1615654457,Dear-Juggernaut5758
39,m4a7i2,,Spreading the word as much as I can,1.0,1615654502,Undundant
40,m4a7ua,[removed],Whats everyone's plans for their tendies?,1.0,1615654532,estatefounder
41,m4a87a,"I see a lot of people asking basic questions about calls on just about every thread that mentions them. So here you go.

Note: before the finance majors come out and nitpick small things, remember that this is a basic primer for idiots; some of it has been simplified.

WHAT IS A CALL OPTION: BASICS

A call option (hereafter referred to simply as a ""call"") is a contract that gives you the ability, though not the obligation, to buy 100 shares of a stock for a specific price by a specific date, called the expiration date. Example: You buy a $400 call for GME that expires on March 19th. What that means is that at any time between now and end-of-day on 3/19, you can buy 100 shares of GME for $400. If the price spikes to $700 dollars, you can still buy them for $400. That's a pretty good deal.

So I need the price of GME to get to $400 to break even, and anything above that is profit, right? Not quite. You have to pay a premium for the option, which is the amount of money you're giving to the option seller in exchange for the contract. The premium is listed as the price per share, so if the option has a $2 premium, that means that you have to pay $2 per share of GME in the contract, which means that you pay $200 the buy the call ($2/share x 100 shares). You give the seller $200, and they give you the call option. Since you paid $200 for the option, this means that your break even price is $402 dollars per share. Why? Because if the price only got to $400, you could have bought it for $400/share without buying the contract, which means the money you spend on the contract was a waste. However, if the price goes to $403/share, then you make a profit, because you effectively paid $402/share for a stock worth $403/share.

But what if the price doesn't go up, or even goes down? Do I have to still buy those shares for $400? No. You never have to buy the shares if you don't want to. Remember, a call gives you the ability to buy shares for $400, but not the obligation.

But what if the price of GME goes way up but I don't have $40,000 around to buy 100 shares at $400/share? Then you sell the contract to someone who either does have $40,000 sitting around, or (slightly advanced info here that you don't need to know) to someone who is trying to offset a position. Regardless of who buys it, they will pay you a lot of money for your option because it is ITM, or in the money. What does that mean? Let's look at some option vocabulary.

CALL OPTION VOCABULARY

Strike Price: This is the price that you are allowed to pay for the stock per the contract. In our $400 call option above, the strike price is $400. At any time before the expiration date, you are allowed to exercise the contract the contract and pay $400/share for the stock.

Exercise: Exercising an option means you are exercising your ability to buy the 100 shares of stock. In the example above, you would spend $40,000 for 100 shares of stock regardless of the stock's price at the time. Can I exercise and only buy 20 shares of stock? No. If you can't afford to exercise, then you can sell your option to someone else.

Expiration Date: This is when your call expires. if you have a 3/19 expiration date, that means that your call option is no longer good after 3/19

Premium: The premium is the price you pay to the call-seller for the contract, and it is listed as the price per share. Knowing that, how much will it cost to buy an option with a premium of .25? If you do the math, it will cost you $25, which is .25/share x 100 shares.

ITM and OTM: ""In the Money,"" and ""Out of the Money."" ITM calls are calls for which the stock price has exceeded the strike price. If you have a $400 call, and the price of GME goes to $405, then your call is ITM because you can buy a $405 stock for $400. If you then immediately sold the stock for $405, you'd make money. OTM calls are calls for which the stock price is below the strike price. If you have a $400 call and the price of GME is $350, then your call is OTM. It is important to realize that being ITM doesn't mean being profitable. In the example above of the $400 call with a $2 premium, if GME goes to $401, you are ITM because 401&gt;400, but you haven't broken even yet because your break-even price is $402.

FDs: FD is not an investment term, and you don't need to know what it means in order to understand calls. It is a WSB term, and it stands for maggot's delight (but with an F, because autmod won't let me define FDs). FDs are OTM calls with short expirations, and as such are a huge gamble. [The guy who spent 90k on 1dte \(1 ""day to expiration""\) OTM GME calls?](https://www.reddit.com/r/wallstreetbets/comments/m3r3v2/found_out_how_to_buy_call_options_yesterday/) Those were all FDs, and they all expired worthless. Why are they called FDs? Because when you buy FDs, you usually end up taking it in the ass.

WHEN PEOPLE LIST THEIR OPTION POSITIONS, THEY USE A BUNCH OF NUMBERS AND LETTERS THAT I DON'T UNDERSTAND. HOW DO I FIGURE OUT WHAT THEY'RE TALKING ABOUT

You have probably seen something like this: GME $400c 3/19. Let's break it down.

GME $400c 3/19 - The GME stands for Gamestop, which you probably figured out. The $400c is a call option with a strike price of $400. If it said $400p, it would be a put option, but we'll talk about those later. The 3/19 stands for the expiration date.

Now let's make it more complicated. If I said, ""I bought 10 $5 GME $800c 3/19,"" what do I mean?

It means that I bought ten contracts of GME $800 calls with a 3/19 expiration, and I paid $5 per share. If I paid $5 per share, how much did I spend on my contracts? I spent $5,000 ($5/share x 100 shares x 10 contracts).

Now you try it. A $700 call on GME that expires next week costs around seven bucks a share. How would you explain to me that you bought two of them?

You would say that you bought 2 $7 GME $700c 3/19. Now you can look like you know what you're talking about even though you still probably don't.

WHY DO PEOPLE BUY CALL OPTIONS?

This is confusing. Why do people even do this? People buy call options because you can make a lot of money. If you have the right to buy 100 shares of something for a fixed price, then for every $1 the share price goes above your break-even price, you make $100. If you have a $400c with a break even of $402, and the price gets to $412, then you make $1,000 profit. That's $10 of profit ($412-$402) times 100 shares. You can buy the shares and hold them, or you can buy them and sell them immediately to realize that profit. Or you can sell the contract to someone else and just take the money. It is usually better to sell the contract, but that's not an important distinction because most of you can't afford to exercise anyway, and will be selling contracts.

WHY ARE CALLS DANGEROUS?

When you buy a stock, at least you own the stock. If you buy an option and it expires worthless, then you have nothing. If the guy who bought 90k worth of FDs had bought 90k worth of GME and held, then he'd still have somewhere around 90k worth of GME, +/- 5% depending on when he bought on Thursday. Instead, he has nothing.

WHY DOES THE VALUE OF MY CALL KEEP CHANGING

So you bought a call option, and every time you look at it it's worth a different amount of money. That's because there are actually two types of value in an option: options have Intrinsic Value, and Extrinsic Value.

Intrinsic Value is the exercisable value of the option, If you own a $400c, and the price is $412, then the intrinsic value of the option is $12/share, or $1200, because that's the value you would get if you exercised it right now. as stock price goes up, intrinsic value goes up. Pretty easy.

Extrinsic Value has a more complicated definition, so we're going to call Extrinsic Value the potential the option has, and that potential is based on time and volatility. For example, if there is a long time before expiration, then that means that there is more potential for the option to go ITM, because more time = more chances for the price to rise. Therefore, options further from expiration will be worth more than options close to expiration. Conversely, less time to expiration = less value, which means that your option can constantly lose value as time goes on and the number of chances you have to go ITM decreases. This is called theta decay, but you don't need to worry about that.

Volatility is the second part of extrinsic value, and options for stocks that are more volatile can be worth more than options for stocks that trade steadily, because if a stock price swings wildly up and down, there's a greater chance that one of those upswings will put you ITM. This is reflected in a measurement called IV, or Implied Volatility. Like Theta Decay, IV is a more advanced concept that you don't need to understand now as long as you get the basics.

Due to the factors of time (theta) and volatility (IV) constantly changing, the extrinsic value of your option will also change over time. This is why the value of your option will constantly change. Is the stock calming down and starting to trade sideways (low volatility)? Your option value will decrease as IV drops. Is the stock starting to jump around? Your option value will increase as IV increases.

Sometimes the stock price can be climbing slowly but the value of your option can be decreasing. Why do you think that is? If the stock value is increasing slowly, but you're way OTM and running out of time because your option expires tomorrow, the downward price pressure of theta decay can overcome the upward price pressure of volatility and stock price rise, and your option value can decrease.

I BOUGHT A CALL AND I'M ITM! HOW/WHEN DO I SELL MY CONTRACTS

You can sell your contracts at any time. You don't have to wait until the expiration to sell your contracts. This is good, because if the price spikes, you can dump your options for profit and move on. There was a point yesterday when 90k FD guy's 275 and 285 calls were ITM when GME spiked to 290. If he had sold then, he wouldn't have lost everything by waiting until expiration.

I BOUGHT A CALL AND I'M ITM! HOW/WHEN DO I EXERCISE MY CONTRACTS

Make sure that you have enough money to cover buying all the shares and click the exercise button. They get your money, and you get their shares. This can take some time.

OK. I GET IT. BUT CAN YOU GIVE ME A TL:DR JUST IN CASE I ACTUALLY DON'T GET IT

A call option is a contract to buy 100 shares of a stock at a certain price. To buy the contract, you pay a premium to the contract seller. If the price of the stock goes above the price of your contract, you can either buy the shares or sell the contract for profit.

The End.

SO I'M AN EXPERT NOW AND CAN GO YOLO EVERYTHING ON CALLS AND MAKE MONEY?

No. You have a basic understanding of how calls work and know just enough to be dangerous. Don't go crazy. Buy a call. See how it works for real. Don't YOLO your life savings on your newfound knowledge. Or do. Live your life how you want; I'm not your dad. Just make sure you post the porn when you win or lose.","I teach high school, which means I explain things to idiots every day. If you still don't understand call options, I got you.",0.89,1615654565,The_Superbus
42,m4a945,,I’m only up in the thousands but these beauties need the money more than I do. Gorillas are not the only monke in need of protecting. All three orangutan species are critically endangered. Fuck palm oil and fuck hedgies!! 🦧✋💎🤚🚀,1.0,1615654642,sauce__bauce
43,m4a9np,[removed],What do you think about MITH?,1.0,1615654687,Altruistic-Long5681
44,m4a9qc,[removed],HCMC - Uptrend Singal,1.0,1615654694,Kushtybuds
45,m4a9rx,,Bolstering our forces.,1.0,1615654697,gridlactus
46,m4aa4v,,NO MORE MOON APES! We are going to the fucking SUN!,0.8,1615654727,Hot_Acanthisitta5947
47,m4aac5,[removed],Recommendation!!!,0.67,1615654746,Rockyturki
48,m4aace,,What do you retards think about Xiaomi now that they dont have and sanctions against them anymore?,0.67,1615654746,[deleted]
49,m4ab6u,[deleted],The money will arrive precisely when it means to.,1.0,1615654811,[deleted]
50,m4abbp,[removed],SNDL HAS A SHORT INTREST OF 230%,1.0,1615654815,Narrow_Slice_2998
51,m4ac0y,,Calling for an SEC Investigation into “Hindenburg Research” - Come RIDE with Lordstown,1.0,1615654860,[deleted]
52,m4acyw,,With great memestocks comes great responsibility.,1.0,1615654938,WilliamSaintAndre
53,m4adqi,[removed],Has anyone done DD on XLY.V? (Auxly Cannabis),1.0,1615654999,Aggressive-Run4569
54,m4aewy,,Ban short selling? There is a precedent . It was done in 2008. Wouldn’t put it past Orange man to go begging the SEC to implement a ban.,1.0,1615655091,DOCurbal
55,m4afdx,,My Wells Fargo Positions,1.0,1615655127,Luke_taylor
56,m4afj4,,Steddy!,1.0,1615655138,Village-Idiot-savant
57,m4afld,[removed],Poetry for Apes: Stopping by Shorts on a Reddit Evening,1.0,1615655143,Weglicki
58,m4afuh,,Visualized prediction of $GME price movement next week,1.0,1615655162,knutolee
59,m4afwp,,I learned about options this month,1.0,1615655167,iTicklyTaco
60,m4afy2,[removed],Ape manual to GME rocket (not financial advice),1.0,1615655170,Hoffa_185
61,m4agb0,[removed],Has anyone done any DD on XLY.V? (Auxly Cannabis),1.0,1615655201,Aggressive-Run4569
62,m4ageb,[removed],Its free 😁😁 1 pi,1.0,1615655208,james-bond007cro
63,m4agky,[removed],Splicket,1.0,1615655226,DennyDoge
64,m4agsn,,Dedicated to HARAMBE + WSB!,0.95,1615655243,ScantronBingBong
65,m4ah5l,[deleted],"To many, this is an AD for a future AD. To most, this AD is already an AD in itself. 🐕🪙",1.0,1615655276,[deleted]
66,m4ah65,[removed],Is it to late to join?,1.0,1615655277,Proof-Touch
67,m4ahe7,[removed],AMC 3/19 calls,1.0,1615655297,HNEWpodcast
68,m4ahel,,😅,1.0,1615655298,ElonMuks-earth2
69,m4ahvs,,We’re at “ABC Hulu-Exclusive” Level Famous now,1.0,1615655339,Right_Instance7991
70,m4aite,,"To many, this is an AD for a future AD. To most, this AD is already an AD in itself. 🐕🪙",1.0,1615655418,jeremykylem
71,m4aj7l,[removed],Gatsby Options Trading Platform,1.0,1615655449,Shorridea
72,m4ajad,[deleted],What do you retards think about Xiaomi now that they dont have and sanctions against them anymore? (Sorry german ape german news),1.0,1615655456,[deleted]
73,m4ajuz,,Low effort meme. I’m hungover.,1.0,1615655503,Mundane-Pipe-5426
74,m4ak9n,,What do you retards think about Xiaomi now that they dont have and sanctions against them anymore? (Sorry german ape german news),1.0,1615655539,Sir_van_zupiop
75,m4akb7,[removed],$CRO BIG TOKEN BURN !! Mainnet Launch Huge Step ?,1.0,1615655542,Mediocre-Reward6841
76,m4akcf,,Motto of WSB,1.0,1615655545,KenSpliffeyJr
77,m4akeh,,Calling for an SEC Investigation into “Hindenburg Research” - Come RIDE with Lordstown,1.0,1615655549,[deleted]
78,m4aki5,,Let’s keep this going! Save the gorillas!,1.0,1615655557,mrbrightsied
79,m4al42,[removed],"Hermanos y hermanas de México, digan presente!",1.0,1615655606,TipStandard2999
80,m4al6w,[deleted],"Thank you WSB, you guys have changed my life. Positions: GME 3/19 calls and 51 shares. Planning on holding my GME shares, and copping some BB leaps",0.5,1615655612,[deleted]
81,m4al8r,[removed],ONCY: Biotech drugs advancing in battle against numerous cancers,1.0,1615655616,ReggieLab
82,m4amag,,Thought WSB Might Appreciate This,0.75,1615655695,l0nelystoner420
83,m4amky,,ETC 1-Day Chart got me bricked up on a Saturday morning.,1.0,1615655718,Appstate1212
84,m4ane9,,I was also inspired and adopted a gorilla. Cheers to you all!,1.0,1615655788,rosanoman
85,m4anq4,[deleted],Gain porn. Positions were 3/19 calls and 51 shares,1.0,1615655816,[deleted]
86,m4anv9,,Before and After I Transitioned Into An Ape 🦍,1.0,1615655826,Slaypoons
87,m4ao4l,[removed],Shorting Should Be Illegal.,1.0,1615655845,Lucdogg
88,m4aoqs,,Donations for refueling tanks !!! monkeys to the moon !!! XRP rpUJKigvytgfaM77qC9bNTNQiUZgGemSiB 2039318909,1.0,1615655896,RaccoonNo8468
89,m4ap5u,,Calling for an Investigation into “Hindenburg Research” - Come RIDE with Lordstown,1.0,1615655931,[deleted]
90,m4ap6g,,"[Update] 🥱 Bought more Friday, revised to 64K deep in GME, buying more Monday. Why? TDA, suspends short selling on GME/RKT as of 3/12/21 4p. 💎🙌🏽🦍💚",1.0,1615655933,A_KY_gardener
91,m4apre,,🦍💎🙌🚀🌚,0.83,1615655982,Coderbob88
92,m4aq0n,[removed],What’s your best bets for penny stocks?,0.33,1615656007,BarooTangClan
93,m4aqp4,,This tickled my fancy. Yes we down under here performing like a Rocket ready for TakeOff. We just like the stock. 💎🙌🏻,1.0,1615656063,Hoosierproudboy
94,m4aqpd,[removed],"Please comment the apps you guys are using to stock trade, thanks",1.0,1615656063,Able_Engine_9515
95,m4aqq2,[deleted],Oakland likes the stock,1.0,1615656065,[deleted]
96,m4aqwc,,Just seen people walking out of this with bags in hand.....Salem NH,0.83,1615656080,Nhlandscaper
97,m4aqww,,Ape with video-making skills in here to build a GME-story with that video?,1.0,1615656081,TeamFelixTee
98,m4ar9v,,Calling for an Investigation into “Hindenburg Research” - Come RIDE with Lordstown,1.0,1615656111,[deleted]
99,m4arbo,,Oakland likes the stock,1.0,1615656115,50million
