,post_id,text,title,upvote_ratio,date,author
16,mfsgvo,"I'm taking the day off.

[https://www.holidayscalendar.com/event/national-crayon-day/#:\~:text=Observed%20annually%20on%20March%2031st,and%20the%20joy%20of%20coloring](https://www.holidayscalendar.com/event/national-crayon-day/#:~:text=Observed%20annually%20on%20March%2031st,and%20the%20joy%20of%20coloring).",BIG day coming up - March 31st (National Crayon Day),1.0,1617032917,RasputinModelNewbie
17,mfsgw4,,"GME have a new COO, Chief Operating Orangutan. Apes together strong. 🦧",1.0,1617032917,Eros-Flame
18,mfshfs,What you guys think will happen to invivo therapeutics?,Nviv,1.0,1617032959,Significant-Price-96
19,mfsibh,,"GME have a new COO, Chief Operating Orangutan, Apes Together Strong 🦧",1.0,1617033026,maximumfunpriv
20,mfsig4,,"It’s been a long first 3 years of investing, but I finally went green. What a journey. Ever since I joined WSB in late 2019 I have learned so much. Thank you Retards. Couldn’t have got here without you.",1.0,1617033037,hawnray
21,mfsk2w,Discuss.,"There are no new games in economics, just new suckers.",1.0,1617033160,Difficult_Unit_8651
22,mfsk37,,Scrabble is in on it. 🚀,1.0,1617033161,MegaDarthCreeper
23,mfskfq,,What Ya'll think of EGLX?,1.0,1617033187,FirmTooth1304
24,mfsksp,[removed],Its a sign!,1.0,1617033217,sbalaban
25,mfskxz,,[PENN] When a company is added to the S&amp;P 500 institutions are forced to buy up shares for their index funds causing the stock price to rise,1.0,1617033229,tangibletom
26,mfslh9,[removed],LMT,1.0,1617033274,EdwardBear1812
27,mfslt0,,"Good enough to snapshot, good enough to sell. RKT puts once again print before lunch.",1.0,1617033300,wiserone29
28,mfsm3j,"&amp;#x200B;

https://preview.redd.it/u0lj6nbqozp61.png?width=1076&amp;format=png&amp;auto=webp&amp;s=3db2dad634a8b2b4446d31e493c8b0751455bc56",BIG day coming up - March 31st (National Crayon Day),1.0,1617033323,RasputinModelNewbie
29,mfsm44,,"The irony isn’t lost upon anyone, except maybe CNBC",1.0,1617033324,MIA4real
30,mfsmgt,,Scrabble is in on it. 🚀,1.0,1617033352,MegaDarthCreeper
31,mfsmkg,"Hold or to fold on this shit show? Or buy the dip?! 
What are your thoughts?",Credit Suisse $CSGN.SW $CS,1.0,1617033361,EireLCH
32,mfsnpt,"Anyone holding:

- Desktop Metal
- Opendoor
- Palantir
- VOOV
- Mohawk Group
- NET
- ARKK
- ICLN

Bought mid-Feb. Trying to DCA, how long till we sit a support level? 

For those holding these positions, what is your mental strategy?","Hold, just hold?",1.0,1617033450,woodyshum
33,mfsnqi,"Was an F rating all up until today, Is this a sign?","GME was upgraded to a D class rating by charles schwab, up from F. Interesting",1.0,1617033452,richmoney46
34,mfsnqo,Thoughts on TLTFF,Thoughts on TLTFF,1.0,1617033452,shambamtymaammm
35,mfsnz4,,[PENN] When a company is added to the S&amp;P 500 institutions are forced to buy up shares for their index funds causing the stock price to rise,1.0,1617033469,tangibletom
36,mfso4v,,"Hey DFV, you’ve made millions, just sell already",1.0,1617033482,Brazda25
37,mfsoor,[removed],Help,1.0,1617033532,Astraset
38,mfsqi5,"Archegos- the definition"" one that takes the lead in any thing and thus affords an example, a predecessor in a matter, pioneer.

Hedge Fund liquidation - a pioneer, a first in what is coming.",Archegos,1.0,1617033656,LakeInvestment
39,mfsqim,,SKLZ YOLO May 21st @$30,1.0,1617033658,SirFinkleBottom
40,mfss5p," **L.B. Foster Company** (FSTR) is a company that makes railroad equipment. Infrastructure stocks have been booming, and this baby is starting to recover from a dip after all time highs. Some cool tidbits below!

\-RAIL (company that makes freight cars) has been on a rip lately.

\-CLF (company that produces steel) has also been on a rip. 

\-Biden will announce his infrastructure bill on Wednesday in Pittsburgh. (FSTR is located in Pittsburgh. (Don't actually think it has any relevance, but cool coincidence.)

\- Chart looks spicy. Last week it had volume above 2 standard deviations for 3 days in a row. (Someone is accumulating). Picture below. The bottom bar chart is the standard deviation chart I am talking about. 

(TIP FOR THE DAY) For those who do not know what the fuck a standard deviation is (this is for the smooth brains) basically the stock volume is trading at 95% above what the average volume is normally. Means someone with fat wads of cash is buying. Please for the love of god if you do not know what standard deviation is look it up. Learning is good for apes.

&amp;#x200B;

https://preview.redd.it/3i78vansozp61.png?width=1898&amp;format=png&amp;auto=webp&amp;s=2431f97119fc815b8a4f100e68bb875a9acc652f",The DD on L.B Foster Company (FSTR),1.0,1617033772,knuckles2344
41,mfss6m,,Looks like Hedge Funds are in trouble !,1.0,1617033774,rabidgunter3456
42,mfsscg,,Hi guys!,1.0,1617033786,Ok_Cobbler_4711
43,mfsspx,,"Team $PLTR, Team Cathie",1.0,1617033813,LuciusTheBruce
44,mfsta8,,Feeling bullish on BJs 😂,1.0,1617033857,Psychoknights
45,mfsu5d,"#FUBO  
#CEI
#WKHS
#RIDE",Lets push these up.,1.0,1617033922,Melianawoody2021
46,mfsvlt,,Doing it for Spongebob (VIAC),1.0,1617034025,RonArouseme
47,mfsw5e,[removed],lady investor looking forward to contributing!!,1.0,1617034063,lfermanis
48,mfsw9k, https://www.nasdaq.com/articles/6-words-from-pfizers-ceo-that-mean-trouble-for-moderna-and-biontech-2021-03-27,"HELLO PFIZER, GOODBYE MODERNA!",1.0,1617034071,withthepeople
49,mfswz3,,"I dip, you dip, we dip...",1.0,1617034123,UM222
50,mfsx5g,,Trading halted again?,1.0,1617034135,IhaveTP4Bunghole
51,mfsx64,,Maverick Capital just invested $87.7M in $GME,1.0,1617034137,ChestyBro
52,mfsym2,[removed],Undervalued digital media agency valued by stupid algos like a dying newsPAPER company,1.0,1617034240,wussel1978
53,mfsyta,"XL Fleet, such a cheap EV stock! Actual product and revenue",XL Fleet,1.0,1617034255,Alextullman
54,mfsz5d,,FUN EASTER COLORING PACK for kids,1.0,1617034280,StoreReasonable6282
55,mfsza5,,We making this GME part 2?,1.0,1617034291,ItsBobandy
56,mfszab,I feel like some of you are forgetting that this isn’t over. A lot of you are cheering and counting your chickens before they hatch. Just remember all we have to do is BUY AND HOLD. BUY AND HOLD PEOPLE TO THE MOON BABY 💎🙌🚀🚀,BUY AND HOLD💎🙌,1.0,1617034292,Rammer95420
57,mfsznm,,$2 billion? We call that a margin small...,1.0,1617034318,Covdoge
58,mfszxd,,We making this GME part 2?,1.0,1617034337,ItsBobandy
59,mft00r,HQGE jump coming?,HQGE next moon launch?,1.0,1617034344,B_S_invest
60,mft057,[https://www.marketwatch.com/story/bluebird-bio-upgraded-to-buy-from-hold-at-stifel-nicolaus-2020-03-27](https://www.marketwatch.com/story/bluebird-bio-upgraded-to-buy-from-hold-at-stifel-nicolaus-2020-03-27),$BLUE - Bluebird Bio - Upgraded to Buy. FDA Approval and Pipeline Full,1.0,1617034353,Irish_Luck_1
61,mft0a4,"I have noticed that there is a very strong resistance at 110 which corresponds to an almost exact 30% correction from its peak.

I have see the price always defending itself at 110 as if someone is delebrately trying not to let it fall more than 30% from peak.

Especially considering it is a fund containing many stocks, it looks like ""someone"" wants to ensure the ""correction"" in ARKK doesn't exceed 30% lest it creates a panic in leading to more selloff.",Notice anything strange on ARKK?,1.0,1617034363,DoomComing
62,mft0ij,,They finally opened a retail store for options,1.0,1617034382,Buildintotrains
63,mft0pt,,No offense 😜,1.0,1617034397,BGoupil603
64,mft1y2,"Here is another one that Short sellers are making money on by shorting! A short seller has been raising doubts about the viability of the hydrogen economy in general. That has scared off a lot of investors. PLUG stock has created a buying opportunity for those who believe,Naysayers and Short Sellers Cast Doubt on Hydrogen",Short sellers!,1.0,1617034484,Water4ski
65,mft28f,,What the fuck is this keeping me from selling!?,1.0,1617034505,Spankyjnco
66,mft2ly,,Space SPACs Soar as Cathie Wood’s ARK Invest Expected To Launch the ARK Space Exploration ETF (ARKX) This Week,1.0,1617034533,MrULTRALONG
67,mft359,Anyone know what is going on? ACB is halted,ACB Halted,1.0,1617034577,Missseeingstars
68,mft3ds,,All in a day’s work. Not worried though. $KBNT,1.0,1617034597,hodlingcompany
69,mft3wp,,AMC DD,1.0,1617034635,mcpr11
70,mft4no,,So what do you guys think of this? 216% is this even legal ???,1.0,1617034690,Parking-Many7898
71,mft4vn,,AMC DD,1.0,1617034706,mcpr11
72,mft51y,,GSX is way oversold look at rsi + macd + support line I don’t care if it’s a Chinese company the graph looks solid for next week,1.0,1617034718,WallStreetOutlet
73,mft555,"This is not financial advice, this is my opinion, don't listen to me.

IF YOU WANT GME TO MOON SOONER THAN LATER, IT IS IMPERATIVE YOU STOP BUYING OTM CALLS. You are literally just giving free money to shitadel, for the love of god, STOP BUYING OTM CALLS.",GME and Call options,1.0,1617034725,Headshots_Only
74,mft5dj,,ARKX- Top 10 Holdings Revealed,1.0,1617034743,Misofire
75,mft5ys,"HBAR has started to pump and with a little help from the WSB Team it can be GME!  

Check out their governing council = $$$$$

Exodus + Bittrex 

$0.41 —&gt; Moon",HEDERA HBAR to GME,1.0,1617034788,Dvolk9
76,mft5zh,"The recent HF explosions prompted an important question I think we all need to understand. Liquidation preference, aka who will get the money at the end. It's a similar question people ask during government bailout. Who gets pay first?

Looking at the current Archegos Capital event, let's assumed that they are shorting Gamestop and got squeezed, and got liquidated. (no evidence indicating they are at this point, let's make that clear) 

Right now, it looks like Goldman Sachs, Nomura, Credit Suisse, the banks will get the money first, nothing left for whatever people they supposed to pay for their crime. 

Am I missing something here?

&amp;#x200B;

&amp;#x200B;

[LP](https://preview.redd.it/sug5zp92tzp61.png?width=1200&amp;format=png&amp;auto=webp&amp;s=5c59b079c28125e509bd45d41528491110c509c7)",Liquidation Preferences??? Who Gets the Money When Hedge Funds Bankrupted,1.0,1617034790,tianababy
77,mft69h,can someone smarter than me explain how this is even possible?! Over 200% of shares are being shorted!,$SOS crazy % shares shorted?!?,1.0,1617034809,RawCheese4me
78,mft6e2,But as the fight continues against gme are there any planned rally’s against digital assets ? I feel like that’s a whole move to clap with if it can be organized educate me pls,Unpopular opinion,1.0,1617034819,encryptedkraken
79,mft6nr,,"Serious question for the retarded, non- financial advisors out there. Are you buying Robinhood IPO?",1.0,1617034841,Hon-Doward
80,mft6qq,,$26.5k Yolo for $ASO Earnings report,1.0,1617034849,Lcarn2949
81,mft7ma,what do you guys think of QBAN stock,QBAN,1.0,1617034918,Alarming-Bite-1186
82,mft8cg,C'mon people we need to start buying gnus and pltr and pushing these stocks to the moon.  Two great companies that we can all get behind and make some money. GME and AMC days are done.,Buy,1.0,1617034972,darrenwlewandowski
83,mft8ie,,Can you autistic mongloids make NIO fly. My dog needs a surgery . I'll even let you nail my GF,1.0,1617034984,IntroductionSpare287
84,mft8l6,"Ark Invest's space exploration ETF to begin trading on Tuesday

https://www.cnbc.com/2021/03/29/ark-invests-arkx-space-exploration-etf-to-begin-trading-on-tuesday.html?__source=androidappshare",🚀🚀🚀 Space ETF taking off tomorrow... All aboard?????,1.0,1617034989,WeakEnthusiasm2257
85,mft8s3,"Ark Invest's space exploration ETF to begin trading on Tuesday

https://www.cnbc.com/2021/03/29/ark-invests-arkx-space-exploration-etf-to-begin-trading-on-tuesday.html?__source=androidappshare",🚀🚀🚀 Space ETF taking off tomorrow... All aboard?????,1.0,1617035002,WeakEnthusiasm2257
86,mft92r,"&amp;#x200B;

![video](50x6cv2gtzp61)","GME meets The Crazies - My first, was hard, please love",1.0,1617035024,BeelzebubNatlPark
87,mft9eq,,Banks tumble after U.S. fund wilts,1.0,1617035050,kinkdong
88,mftajo,[removed],r/NIO is a BUY,1.0,1617035142,Familiar_Carob470
89,mftb90,,Any moment now..,1.0,1617035200,0RabidPanda0
90,mftbok,[removed],$ATNF buy and hold,1.0,1617035230,Less-Cardiologist266
91,mftc07," Six Flag stakes its claim as the world's largest regional theme park operator and North America's largest water park operator based on number of parks. With 23 of its 26 properties in the U.S., its operations rely on domestic authorities lifting stay-at-home orders and the economy improving. Of the company's other three theme parks, two are in Mexico and the other in Montreal. So with a limited international presence, it cannot rely on the international business to prop up weak results at home. Granted, the company's attendance numbers are expected to drastically improve as states begin to reopen.",6 FLAGS STOCKS TO SKYROCKET,1.0,1617035254,MarkBohner
92,mftcd2,[removed],Where to buy stocks,1.0,1617035280,Seahobbs
93,mftcgi,"So gents, how can we profit from what's going on in Egypt? There's got to be some certain stocks that will provide a good gain from this.",Sue Canal,1.0,1617035287,Jdtukua
94,mftci3,,Theyre watching how we move ;),1.0,1617035290,Unlucky_Weekend
95,mftd1s,,Made these yesterday! Just killing time till the market opens!,1.0,1617035335,Zealousideal-Cut-142
96,mftdeu,"The world is constantly changing at a rapid pace and we have all witnessed major events across the globe such as natural disasters, economic crises, wars between countries and Covid-19 is the most recent one. These events have directly or partly impacted the global economy and changed the way we live.

For this reason, whether you are considered a beginning investor or a long term trader. You need to continue to expand your knowledge horizon by reading more books, and learn great tips and proven practical advice from successful investors in books- it will help you to weather through the most volatile market.

[Best modern investing book: Financial Autonomy.](https://millennialmoney.page/2021/03/the-5-best-investing-books-for-a-beginner-of-2021/)

[The New York-Time Best selling book : Unshakeable](https://millennialmoney.page/2021/03/the-5-best-investing-books-for-a-beginner-of-2021/?swcfpc=1).

[Value investing book: Intelligent Investor.](https://millennialmoney.page/2021/03/the-5-best-investing-books-for-a-beginner-of-2021/)

Ri[ch Dad and Poor D](https://millennialmoney.page/2021/03/the-5-best-investing-books-for-a-beginner-of-2021/?swcfpc=1)ad.

[One Up On Wall Stre](https://millennialmoney.page/2021/03/the-5-best-investing-books-for-a-beginner-of-2021/?swcfpc=1)et.

Based on my personal experience and honest review about those books, and I hope you guys will find it's helpful for your investing.",The 5 Best Investing Books For a Beginner in 2021.,1.0,1617035362,duyquang111
97,mftdpb,[removed],"GME shitpost: poem, rap, whatever you want to call it that literally no one asked for. Mods, shitpost flair wasn't available.",1.0,1617035385,cindy-tron
98,mfteev,[removed],"My friend asked me to join IM Academy, is this company legit? It seems like an MLM but I’m not sure",1.0,1617035436,NadxCH
99,mftf2e,,Yolo GME??,1.0,1617035487,Steeley0831
