,post_id,text,title,upvote_ratio,date,author
0,m2a5m4,"I had some money in my Public account, and was looking to move it over to my Schwabb account so it was all in one place. I had some GME on there from weeks ago that I had bought at ~$250 a share, so I was excited to sell it, and rebuy it so that it was all on one account.

I set up a [sell option on my Public account at 7:51](https://imgur.com/2wcpLPO) this morning for 11 shares at $320 a share. GME was at 295 at that point and growing, so I figured if it hit $320, it would trigger the sale, and once I got the notification, I'd buy on the Scwabb to move it over.

At 8:35am, GME passed $320 a share, and stayed above $320 a share for over a half hour, reaching over $344 a share at 9:15am. Then the strange market collapse happened. 20 minutes after that collapse, [I get a notification from Public that they sold my 11 shares, but sold them for $184.25](https://imgur.com/EZtwTMi). 

How is this legal? How can they agree to a pending sale at $320/share, and then sell it for nearly half that value?",Can someone explain to me how this Stop Sell from Public is legal?,1.0,1615413795,Kristic74
1,m2a5pr,"Was joining the rocket to save the apes stuck at 300 and 400.  Now I need saving!

&amp;#x200B;

&amp;#x200B;

https://preview.redd.it/pe26hn52x9m61.png?width=2744&amp;format=png&amp;auto=webp&amp;s=29575c141d22aed311a3039ca8cb4bf95d3b79ec",Bought $GME at $293.72 today before it dumped,1.0,1615413801,usadeadpoo
2,m2a5z7,,Sundial ready for boost,1.0,1615413819,Which-Advance6917
3,m2a613,,HODL you apes !!!,1.0,1615413823,LegendaryX88
4,m2a6fa,,spooderman wednesday price action,1.0,1615413852,THRAGFIRE
5,m2a6k1,,Hedge-Fund Short Covering Seen as Big Driver of Nasdaq Rally,1.0,1615413862,khunter123
6,m2a6o7,[https://twitter.com/MrDavidNIO/status/1369733681259053061?s=19](https://twitter.com/MrDavidNIO/status/1369733681259053061?s=19),Marketwatch accidently posts article before the dip today.,1.0,1615413871,cvoyles97
7,m2a6ow,,"You son of a bitch, I’m in. $20k on GME",1.0,1615413872,oStorMx
8,m2a79m,[removed],Roblox RBLX Income Statment,0.5,1615413916,tianababy
9,m2a7fy,,But what if...,1.0,1615413929,averynormaltaco
10,m2a7l6,"Just making sure, after one hell of a day, you're safe and stable.","Hey, you, how's your stress level?",1.0,1615413937,FarceMultiplier
11,m2a7si,,Me waiting for the inevitable DD explaining why the dip and rebound was a good thing and thus confirming my bias:,1.0,1615413948,mediocre_comic_art
12,m2a84a,"Yo guys,

i just thought a bit around, and what if because of this huge massive squeeze cumming on us AND THEN TOO THE MOOOOON,

the sale rate on lamborghini supercars or other supercar vehicles increases in the next time, also after the HISTORICAL MOMENT when we defeat the fucking hedgefonds.

&amp;#x200B;

like because all the freakin diamond headed retards livin in moms basement, will have a freakin green or yellow or red or whatever color lamborgini standing in the garage, just imagine in a street normal cars the one day, next day THEY ARE EVERYWHEEERE okay im pretty high rn so maybe this doesnt make sence at all but maybe :D 

&amp;#x200B;

this thought actualkly makes me smyle sooo hard :D 

or we all buy rockets and fly to mars either way, or teslas they cool too i like the sound they make when drive-

brumm brumm

I LIKE THE STOCK",Can someone make a statistic over lamborghini because of §GME,1.0,1615413968,SilentImagination703
13,m2a86g,,The IRS waiting to get their slice of the GME tendies,1.0,1615413971,reeeeeecolla
14,m2a87e,,ARE YOU FREAKING KIDDING ME!,1.0,1615413973,TheeMrBlonde
15,m2a8mw,[removed],I found this useful if you want an explanation of what happened today. Hold + delete your stop limits = 🚀🌑 credit to user @u/heyitspixel,1.0,1615413996,anon921302
16,m2a8nr,"https://cathiesark.com/ark-combined-holdings-of-pltr

Assuming ARK is not the only firm buying up PLTR I see $30+ soon. Not to mention all the apes like me buying big

Another set of catalysts are coming in the next few months. If this isn't back at ATH by the next ER I would be surprised",This chart puts into perspective how much Cathie has been accumulating PLTR during this dip,1.0,1615413998,ajcunningham55
17,m2a8uh,,My ‘buy the dip’ margin trade tonight:,1.0,1615414009,Imadetommy
18,m2a8vi,250 to the moon,Hold the line,1.0,1615414011,Basic-Item-5100
19,m2a97b,,Strange up arrow and colour appearing today right before dip. HODLing,1.0,1615414031,Tiochfaidharlads
20,m2a99f,,"Paper handed bitch here, I’m sorry...",1.0,1615414034,theegyptiancowboy
21,m2a9id,"Hello retards, I've learned a lot about the market over the last couple months, and I've been teaching myself how to do some very basic analysis through this reddit and YouTube. One of the things I've been doing is finding the P/S ratio for companies, so I tried my hand at finding the ratio for two big stonks: AMZN and AAPL. 

I'm basically just asking for someone with wrinkles on their brain to check my work.

For AMZN I got 3.99 (for 2020 earnings)
For AAPL I got 7.58 (also 2020 earnings)

These seem a bit high, so if anyone can tell me where I messed up, that would be great 👍🏻",Practicing Fundamental Analysis,1.0,1615414047,ZDguy
22,m2a9ii,If yes where should I buy?,Is it worth starting to buy right now?,1.0,1615414047,cuulas
23,m2a9lx,,Classic cock and ball formation boys,1.0,1615414052,Basedxgodx
24,m2a9yx,,"I mean, I've had an hour of ink time paid for, for 18 months.",1.0,1615414072,the-ghost-jedi
25,m2aa2r,,To all the hedfie MF's!,1.0,1615414080,retailvictim
26,m2aa3w,"&amp;#x200B;

https://preview.redd.it/v2r10h3lx9m61.jpg?width=1920&amp;format=pjpg&amp;auto=webp&amp;s=64ed7d4f2149a25c5b55b9505fc8924a8cb9fca1

So I found a yellow crayon and decided to draw some technical analysis.

To me these look like the could be similar....so if these patterns rhyme as they say.... we could see some x5  action incoming putting us easily over the $1000 mark.

Does anyone have another color crayon for me",Could this be similar?,1.0,1615414082,Extra_Injury595
27,m2aa5t,"It seems that the difference on the loss wasn't big. Expected was 2.8$ per share and AMC reported a loss of 3.15$ per share. Revenue was surpassed .
 https://www.newstimes.com/business/article/AMC-Entertainment-Q4-Earnings-Snapshot-16015999.php",AMC earnings.,1.0,1615414085,BrandNewGraySun
28,m2aacw,"I have a simple question for all you retards out there. How do we know when we arrived at the destination moon?   


Myself, I am just a degenerate who wonders what the moon actually looks like.",GME What does the moon look like?,1.0,1615414097,reppien
29,m2aada,,Classic cock and balls formation boys,1.0,1615414097,Basedxgodx
30,m2aade,"https://investor.amctheatres.com/corporate-overview/default.aspx

A lot of people were betting on a BK announcement.",AMC opens earnings call with surprise Good News reveal.,1.0,1615414098,drteq
31,m2aanq,,Proof the hedge funds planned the dip and the media knew.,1.0,1615414115,Glittering-Work-4950
32,m2aarv,So i did a Wayback crawl. Tried to post it here but the bot deleted. Any way Dianomi(crunchbase) wrote that article on marketwatch yesterday. [wayback](https://web.archive.org/web/20210310201848/https://www.marketwatch.com/story/gamestop-stock-was-reaching-new-heights-but-shares-in-the-meme-stocks-just-plummeted-11615398208?redirect=amp),Way Back,1.0,1615414124,CrazyHabenero
33,m2aau7,,"Donde están todos los que resistieron y esperaron sin vender GME yo soy una de esas personas, el sol 🌞 está alumbrando mi cartera💎💎💎🚀🚀🚀",1.0,1615414129,Werita503
34,m2ab60,,Any thoughts on SOS stock?,1.0,1615414150,Vegasguy0801
35,m2abbd,,GME is the beating heart of an Ape 🦍 ❤️🚀,1.0,1615414158,MTrujillo_10
36,m2abvl,,Created this poster for my fellow retards.,1.0,1615414193,einsimar
37,m2abz6,,To all the Hedgie MF's! Important message!,1.0,1615414200,retailvictim
38,m2ac07,,Nice,1.0,1615414202,YourBoyBigAl
39,m2ac7p,,"I think they meant ""$GME is 40% off 🚀🚀""",1.0,1615414213,aster__
40,m2accy,,RH GME Analytics vs My GME Analytics,1.0,1615414223,DatBoiTizzy
41,m2achz,,What about Rolls Royce? They can't seem to sell some old junk to Russia...at $1 and change a share it would be nice to get it to like $20,1.0,1615414231,Coydog7
42,m2aclh,[removed],Cryptocurrency,1.0,1615414237,Mission_Importance80
43,m2acs5,,Me explaining how big my balls are during that dip today.,1.0,1615414248,Valuable-Eye1452
44,m2acs6,,RIDING THE GME DEATH FALL. PRO ROBINHOOD DAY TRADING. FILL OR NO FILL? MOBILE APP ONLY! YA YA YA YA APE STRONG,1.0,1615414249,Healingkush
45,m2acse,,Graph with my favorite crayon flavors,1.0,1615414249,imbadatgrammar
46,m2acy5,,'Meme stocks' will be losers in the end: advisor | Reuters Video,1.0,1615414261,stars537
47,m2ad06,,GME on the dip today,1.0,1615414264,Fudgcicle
48,m2ad1k,,Someone Teach Me Their Ways😞,1.0,1615414267,thebudajourney
49,m2ad5u,[removed],Me and my three Stonks,1.0,1615414276,MakeTaxationTheftAgn
50,m2ad96,,We aren’t the same breed of scared ass bitches that they could run off like in the past. We will win!!!,1.0,1615414282,dissmember
51,m2ad9u,,The battle for $300 is real! And it’s so entertaining! 💎🙌🚀🌝🦍,1.0,1615414284,McNasty1304
52,m2adag,"FINTEL

EYES Shorted 25% with 150,000 short shares available, interest rate 88.56%

ANPC Shorted 27% with 25,000 short shares available with interest rate of 147.57%",EYES &amp; ANPC,1.0,1615414285,Karen337
53,m2adl4,This paper certificate stock goes on the wall and no worries to sell you just wont be able to react lol,How to handle price fluctuations,1.0,1615414305,Weekly_Wish_4430
54,m2adtt,,My son drew this in school today....totally random. He is 5 years old. Coincidence? I think not!!! I think he is smarter then most of us.,1.0,1615414321,Ben-Thor
55,m2ae18,,I'm fuckin proud of each one of you even if i dont know you! Didnt sell a fuckin share! Canadian Ape holding GME in the snow. Were more retarded than they think,1.0,1615414334,FTS007
56,m2ae6j,,Diamond Hands sculpture 💎🙌,1.0,1615414344,ManOfLowMoralFibre
57,m2ae8x,,Someone Teach Me Their Ways😞,1.0,1615414349,thebudajourney
58,m2aeaw,,I LIKE THE STOCK!!!!!,1.0,1615414353,liftingtailsofcats
59,m2aebn,,While people panic sold during the halts I panic purchased..,1.0,1615414355,Critical_Lurker
60,m2aem6,,Why would Coinbase do and IPO and not ICO?,1.0,1615414376,lopezjessy
61,m2aeqg,,What's correct for you Apes? The Red Line or the Blue Line? Where se are now? 💎🙌,1.0,1615414386,DoBiStp
62,m2aeqp,,Soo.... Roblox to the moon boys?,1.0,1615414386,CarlosInvestor
63,m2aerc,The car was amazing still going on but what I heard so far we’re in for a big jump let’s do it apes,AMC to the moon,1.0,1615414388,Biglou100
64,m2afjo,[deleted],"When Hedgies launched their ultimate ability dropping us $150, and we bounced back.",1.0,1615414445,[deleted]
65,m2afku,"Looking at US CPI report, China’s PPI and CPI report,  and the treasury offering this week. Yield spike beginning to look more like drama.

With CPI reported in line with expectation, or slightly below within some sectors, it does indicate that inflationary pressure is likely temporary and is driven by supply and logistic disruption due to the pandemic. In addition, with China PPI reported in line or slightly higher while core CPI was also slightly under expectation, further add to the idea of a temporary inflation driven by supply-logistic disruption.

US treasury 10 year offering today went well, with over $2.7 bid per dollar offered. And foreign interest bounded back to over 58%, just slightly below high.  

Its looking more and more likely that the recent yield spike is caused by dramatized media covering of the bad auction of the 7-year bills few week ago. Looking at the today and yesterday’s auction result, the demand is strong, and that’s taking into account that USD has declined about after a 8-9%. 

The reality is that the giant global government bond market has no better choice. US , is practically the only one issued by developed country that still has a positive rate. So there are only 3 options: safe bonds with negative rate, risky bonds with positive rate, or US bills which is safe but dismal positive rate. The reality is that, at the moment, US bills offering is still seem as the best out of a basket of crappy choices.","Looking at US CPI report, China’s PPI and CPI report, and the treasury offering this week. Yield spike beginning to look more like drama.",1.0,1615414447,sendokun
66,m2afm5,,Even my balance history is diamond handing. Continuing the pattern with that 4.20 gain - Mostly $GME,1.0,1615414450,GMEguru
67,m2afnd,,"$SLGG to the Moon, maybe Mars by EOM!!",1.0,1615414453,MrRuggster
68,m2afr7,[removed],AMC all in,1.0,1615414461,xBitterkAz
69,m2afre,,Market Watch article got it all wrong. Should have been a poop throwing 🐒 eating crayons. Diamonds 💎,1.0,1615414461,essray22
70,m2afy0,,LET'S TALK ABOUT THE FLASH SALE.,1.0,1615414473,sproutsatoshi
71,m2ag1f,,Yeah GME is cool and all but how are you apes doing with PLTR?,1.0,1615414480,RedditIsYogurt
72,m2ag3g,[removed],GET IN HERE APES! Why today’s AMC earnings win is HUGE FOR tomorrow’s GME,1.0,1615414484,imayam
73,m2ag56,,Only way from here is up... right?,1.0,1615414488,thebudajourney
74,m2age0,,They are still shorting GME. When will they learn.,1.0,1615414506,Sea-Ad6039
75,m2agkl,,Created this poster for my fellow retards.,1.0,1615414517,einsimar
76,m2agn8,,After Hrs lookin good 😌,1.0,1615414521,Master-Variety3841
77,m2agu7,"**TL;DR**

IQ is undervalued and technically promising. It has a cocktail of factors similar to TSLA 4 months ago before the 1000% rise. If it breaks out of the trading range, it can soar very high.

**Fundamentals**

Iqiyi is currently the #1 video streaming site in China. Truly the Netflix of China, it has more users than any other platform. Competition is intense - Tencent and Alibaba have competitor platforms - but Iqiyi is still number 1, and that gives them the opportunity to grow their lead.

Iqiyi is a growth stock, currently being valued as if it isn't. It's heavily in debt - as you'd hope all growth stocks would be - and it continues to invest in producing original content, at the expense of more tangible assets. They don't seem to care about profit, and have very rough financials. This is typical for growth stocks with a high valuation - the valuation is usually based on speculation about the future. However, IQ has a low valuation. Speculation about the future is *not priced in*. Its market cap is just $22b. It is currently being viewed like a struggling company - which it isn't. This means it is highly susceptible to a huge change in valuation, just by viewing it as a growth stock and pricing in the value of the huge array of exclusive content, and more users than any other platform. This current valuation is insane.

IQ is also being shorted, based on some very, very, uninformed claims ('[faking their numbers](https://www.cnbc.com/2020/04/08/iqiyi-accused-of-fraud-by-wolfpack-muddy-waters.html)' - a company surveyed people in China and basically didn't find as many using Iqiyi as their numbers would suggest. A completely unreliable unscientific study that used a tiny sample size (1500) and drew sweeping conclusions, aided by a single ex-employee, and some unspecified *'data'*, this is garbage, probably produced for self-promotion purposes among the Sinophobic investment crowd. This study launched an SEC investigation, which heavily suppressed the stock price, but the whole thing is simply ridiculous). Regardless, shorts get squeezed when the price goes up, whether they're right or wrong.

**TECHNICALS**

*IQ has been in a trading range for 2 years
*It has just closed at the very top of that range.
*Momentum has been VERY strong approaching this level - rising almost every day, even when related stocks/indicies fell.

If it breaks out of the range, it will soar - due to: 

1. The technicals (the end of the trading range leading to a breakout)
2. The short squeeze
3. That price rise causing reevaluation as a growth stock and pricing in the intangible assets.
4. Then, renewed interest and maybe even the hype it deserves.

**SUMMARY**

This is a growth stock being wrongfully viewed as a struggling company, beset by shorts and in a trading range for 2 years. This is *essentially the exact same scenario that Tesla ($TSLA) was in 4 months ago*, before its 1000% rise. If it breaks out, it can go very high.

If it doesn't break out, it will likely go down to the $15-$17 area at the bottom of the range. Trading ranges do continue more than they change, but it's hard to see that happening now.",Iqiyi ($IQ) - the Netflix of China - poised to soar - TSLA all over again,1.0,1615414531,Charlielarch
78,m2ah20,,When we thought the spike was done with but we held ✊🏼🔥🚀,1.0,1615414548,Artdubstep
79,m2ah8f,,"All of us who didn't sell GME, shining like this beautiful sun. I am happy for everyone who kept a hope and stayed until the end.",1.0,1615414560,Werita503
80,m2ah8v,,After hrs lookin good 😎,1.0,1615414561,Master-Variety3841
81,m2ahbb,,"Technical Analysis GME 3/10 (I love you guys, in for 2 @ $360 💎🤲🚀🌕)",1.0,1615414565,MFrancisWrites
82,m2ahbu,[https://twitter.com/ChrisCamillo/status/1369699553193115661](https://twitter.com/ChrisCamillo/status/1369699553193115661),Chris Camillo announced at 9:19am today that he sold all his GME today. This precipitated the drop,1.0,1615414566,h3r3andth3r3
83,m2ahbw,[removed],Amc I’m not leaving 🚀,1.0,1615414566,Main-Ad-2894
84,m2ahkq,,"Who was responsible for the market manipulation in GME today? I heard on Uncle Bruce that it was 700,000 shares selling down to drive the price down.",1.0,1615414584,Reaperjlujeep
85,m2ai1n,[removed],Stupid gme retard wants explanation understandable by ape brain,1.0,1615414618,GoodDaysAreGone
86,m2ai38,,I’m saddened by their weak attempt to manipulate the market again. So for that we shall now ask for..wait for it..wait for it...,1.0,1615414621,Lord_flako
87,m2ai5u,,Heyyyy what the actual fork! Tried to buy this afternoon and nope.,1.0,1615414625,waffoline
88,m2aiby,,Schwab thanks us for holding 💎🤲,1.0,1615414637,nonsubmersiblenunone
89,m2aii3,,After hours price is a sign from the gods 🦍🚀 💎 🙌,1.0,1615414648,MightyAndy
90,m2aik7,"So, on Monday I threw over $6k into GME 500 calls, expiring 3/12.   


&amp;#x200B;

[My initial options trade on Monday.](https://preview.redd.it/eq2wovjhx9m61.png?width=952&amp;format=png&amp;auto=webp&amp;s=d72d142a410a5098aa15a197e85a1987c9e1b0c2)

&amp;#x200B;

On Tuesday, I was up to $11K in the first hour of market open, but that dwindled away fast as the sideways movement yesterday killed the premium on the options. I was glued to my screen, and watched as each minute my balance fell more and more.

&amp;#x200B;

https://preview.redd.it/mazqce0hy9m61.png?width=787&amp;format=png&amp;auto=webp&amp;s=28521c6e3a025872a7794ac6903df4c0727f6041

&amp;#x200B;

Then today, I was initially down in the morning just for a minute but suddenly, things picked up big time. At 11:00AM, **I was up $32,000.00.** I currently owe about twice that in student loans, and I told myself I wouldn't sell until the options were worth what I owed in student loans (I refinanced my loans so they are now privately held, and thus I have no hope for forgiveness).   


Then, the GME drop and halts happened.   


My $32,000.00 dropped to next to nothing in minutes.   


While a strike price of 500 for Friday is... doable, it's pretty fucking risky at this point. And with each passing day, the option premium drops significantly (theta at one point was like -4.2).   


So, I waited a tiny bit  after the batch of halts (I was basically gambling yet again), and the options were finally about double the price I originally paid. I didn't want to be a slaughtered pig, and rather than focus on the $32,000.00 I missed out on, I realized I should be fucking happy I was able to get out with over $5,000.00 in profit.  


&amp;#x200B;

[My balance after exiting my trade.](https://preview.redd.it/uu148jaqy9m61.png?width=598&amp;format=png&amp;auto=webp&amp;s=c7224f9da498338d55c4d9ba4601c8eae41a83ef)

  


**TL;DR: I don't have diamond hands, but I'm not ashamed.** I also am proud that my trade didn't have an impact on the hard work all you apes are doing in holding shares (since they are options contracts). Of course, it would've been great if I held and then they become ITM on Friday, but I'll take a $5K win over a $6K loss anyday.","My $6,000.00 YOLO on 3/12 GME 500 calls: at least I made a profit",1.0,1615414652,phillythompson
91,m2ail7,,GME huge trades after the dip 💎🚀,1.0,1615414654,can_dry
92,m2ailc,[removed],Sphere 3D,1.0,1615414654,WSB_bulls
93,m2aj1n,,Article on GME dip published at 11:55 am by Marketwatch. Dip began at 12:15pm.,1.0,1615414682,Glittering-Work-4950
94,m2aj4d,,True story.,1.0,1615414687,WhiskeyTangoFox4
95,m2aj5e,,A Lesson On Diamond Hands 🙌💎🚀,1.0,1615414689,TimThyTurtle
96,m2aj73,,Some of you need to see this,1.0,1615414693,Basil015
97,m2aj9j,,"It’s not much but it’s honest work, glad to be part of such a retarded community I fucking love it, gme till I die",1.0,1615414697,Deanrc13
98,m2ajb8,,Lol robbing hood analysts,1.0,1615414701,goldenmeow1
99,m2aje2,,The Return of the Apes,1.0,1615414706,Elieftibiowai
