,post_id,text,title,upvote_ratio,date,author
0,lwlh1g,,GO GO $RKT ! I' ll be having a beer with Perseverance on Mars today !,0.6,1614746725,Superman701
1,lwlhbi,,$GME Loss Porn,0.84,1614746751,sector7slums
2,lwlhcz,[removed],$LTHM to the moon 🚀🚀 Elon needs more Batteries,1.0,1614746755,SomeRandomSupreme
3,lwlhgf,[removed],PLTR,1.0,1614746764,Arman_moon
4,lwlhh1,,"My, how the tables have turned...",0.8,1614746766,downtothegwound
5,lwlhmo,,LOSS PORN - meant to put $500 in RKT. Turned into 11k loss,0.86,1614746781,pelleg1215
6,lwlhmw,,THE CANADIAN SHORT SQUEEZE VISN🇨🇦 BNVIF🇺🇸 10K dream,0.5,1614746782,Public-Counter-6089
7,lwlhtj,"Tldr; 
Nvax saves the fucking world along with multiple other companies.  Maybe usa last. Shorted to hell. Shares cheap as fuck rn. Primed for lift off. May get a lil cheaper first , so watch it a little b4 you buy. Ceo projected 20 billion dollars revenue 2022. Market cap is under 15. You do the math


Im here to tell you all what play im currently holding 30 shares in and plan to double down on in the morming because the price is insanely good, and tbh may even get better in coming days from a buyers perspective. It is currently down 43% from its ath, only reached due tl INTERIM p3 results. 
Lets start with the bad. 

In 33 years theyve never reached full fda approval for anything. Close but no cigar every time. 

It has held a steady slightly pessimist short interest of 10% for the entire time ive been invested, but in that time institutional ownership has climbed from 49% to about 88% now. I have strong reason to believe this short interest is now much larger. Please read on. 
When the nasdaq is down and theres no good news for the stock, it sinks. When theres mildly good news, the stock sinks. Shorts? Maybe.

Many big money vaccines already approved. US market share likely holding mass inventory of big pharma and baby oil vaccines by the time FDA approves. This doesnt matter too much, the united states has a contract with nvax for 100 million doses at 16 a pop that they buy on fda approval, period.  The big pharma vaccines efficacys vs variants and transmission are laughable. The world is a  breeding ground for variants right now. A problem novavaxs platform will easily develop quadralent boosters for. 

Honestly, theres not a whole lot of bad imo. These bad things seems good to me. 
The good.
Its absurdly cheap right now, almost as cheap as before p3 interim data. This is because the ceo sucks at talking and people dont like the 1 to 2 month timeline he mentiomed on nbc yesterday for approvals. That same morning he told new york times ""he loves burning shorts"".
Last week, boris johnson said novavax approval was coming soon. 
The market price never reacted to the covax deal of 1.1 billion doses because we dont know the price yet, and shorts are trying to say the 3 dollars poor countries will pay is what nvax will get per dose. Thats not how donation and subsidization works. Nvax is getting way more than 3. At least 10. 
Its efficacy is first class, please look it up, the scientists online have already explained it better than i can. 
Today the price tanked , due to his interview yesterday RIGHT AFTER SAYING HE LOVES BURNING SHORTS. Yes he said fda is 2-3 months out.
They have rolling approvals in dozens of places happening! And their final phase 3 data can drop anytime!. The short interest has been 10% for a while and i just KNOW its higher now.
Institutional holdings hasnt dropped. The name novavax is appearing in the news more and more. Its happening this month. Idk how long shares will be near 200, i wouldnt be surprised if you can pick some up for 180 tomorrow. But theres a squeeze coming. Not like gme was, this isnt hundreds of percent short. Its in the teens. That will still be a nice spike to an already large biotech spike.

B.riley eoy price target : 398. 
I think we see more than that. Weve already seen 330.
The news that propels us could happen any day. But dont leave gme. Im in there too. But if any of the squeezes your in do their thang, and nvax is still down, double check to make sure nothing bad happened with the stock and then bring those tendies over for more tendies!!!",DD NVAX Next Squeeze currently at absurdly good buy point.,0.66,1614746798,Laffingglassop
8,lwlhym,[removed],RKT to 60 $ by Friday,1.0,1614746812,Casey1219
9,lwlijx,[removed],DIABETICS NEED YOUR HELP!!,0.75,1614746868,theyubnub
10,lwlior,,Reactivated my rh account to buy shares of gme,0.65,1614746880,DIRTYKONEN
11,lwlip4,[deleted],"Not a Bull Pennant, a Bear Flag. Unfortunate proof within...",0.32,1614746881,[deleted]
12,lwlipf,,I’m so proud. If only it had been 69 cents too.,1.0,1614746882,grassyme
13,lwlixw,[removed],"POAI: AI for precision cancer cure @1.75, a 10x potential this year check it out. DD.",1.0,1614746905,Easy_Regular660
14,lwljfl,[removed],Is there a WSB Stock Market For Dummies??,1.0,1614746953,apaccione
15,lwljl1,,Hear me out...DNN,1.0,1614746966,[deleted]
16,lwljmx,[removed],#BITK TOMORROW BOYS,0.5,1614746971,Vegetable_Minimum_51
17,lwljpk,[removed],LOVE canadian weed stock,0.75,1614746977,HamNcheese2323
18,lwlkeo,[removed],Canadian Short Squeeze,1.0,1614747042,MuleyG
19,lwlkht,,If they’re behind you they should know why.,1.0,1614747050,Trescomashereicome
20,lwlkhy,[removed],3D Printing,1.0,1614747050,AMay101
21,lwlkrr,,Penny handed GME retard,1.0,1614747075,Seanykinzs
22,lwlku6,,UWMC,1.0,1614747082,rzsmoke
23,lwlkw0,[deleted],94 shares.. Today i have to get up to 150 shares. Whats do you think guys? Is it a good day to buy again? 🚀GME,1.0,1614747087,[deleted]
24,lwll1y,[removed],PLTR,1.0,1614747103,Arman_moon
25,lwllaa,,INO. Still holding. Wont sell. Keep going long!,0.67,1614747126,dartagnan18
26,lwllru,[removed],Is AMC undervalued?,1.0,1614747173,Psychoknights
27,lwlm00,,"No doubt, no doubt",1.0,1614747198,SkeetOne
28,lwlm1w,,Can we boost REITS next?,1.0,1614747203,Pey10terry
29,lwlm8b,,But he sends his regards,0.96,1614747221,dupree97
30,lwlmd8,[removed],Hold!!!!!,1.0,1614747235,JMV808
31,lwlmut,[removed],14 Years Pattern Breakout on MONTHLY chart ! Upside potential - 300% atleast,1.0,1614747278,Commercial-Neat-63
32,lwln1c,[removed],KMPH got FDA approval,0.5,1614747295,thelegend77
33,lwlni8,[removed],$UWMC Yolo,1.0,1614747344,Bartafix
34,lwlnic,[deleted],94 shares today.. So what is my today's plan? Yes your right guys. 150 shares are my goal for today 🪐🚀,1.0,1614747344,[deleted]
35,lwlnp4,,Hey mods the state of our sub is straight up shit you guys need to do something. The daily thread is being spammed by bots and retards.,1.0,1614747365,[deleted]
36,lwlnsz,"I'm looking for some help if anybody has gone through their 10-k. Yes i know there are some people here who can read words, i need your help. I don't own any Palantir and this is my own opinion and not financial advice. Am trying to determine if i should invest.

I get what Palantir does in terms of a business model. I also saw a post here comparing to $CRM, and here is where i need some help.

Looking at palantir's [10-k](http://d18rn0p25nwr6d.cloudfront.net/CIK-0001321655/97b89af1-0ad9-4daf-a411-6ca576744e7e.pdfhttp://d18rn0p25nwr6d.cloudfront.net/CIK-0001321655/97b89af1-0ad9-4daf-a411-6ca576744e7e.pdf), pg 111, 112

cash is 2b+, likely from the public listing, double 2019, a plus.

Revenue is 1.1b up from 742mm in 2019, and i believe guidance for 2021 was another 45% also good.

They only problem i have is stock compensation. I know the company went public and that's a large reason for the number, because if you focus on including it, they has a loss of 1.1b for the year. In of itself as a growth company i get, the only concern is the comparison to $CRM.

$CRM currently puts much of their salary expense into this category, and is maintaining the the business through acquisition. They've been hit hard in earnings as a result 260--&gt;220 and maybe lower? (keep growing revenue, but profit isn't materializing, and they are categorizing stock comp as CapEx because their employees derive compensation (in sales anyway) via stock

has anybody noticed anything similar on $PLTR?

i'm assuming if they deliver on estimates, that's $40 per share by the end of year if not 50 conservatively, but another bout of stock comp will drag the stock.

&amp;#x200B;

edit: after going through the comments, in for 200 shares at 24.5, and will average in.

edit 2: Picked up 10c LEAPS.",PLTR-Palantir DD Financial Analysis,0.88,1614747374,Farmer_eh
37,lwlo11,[deleted],Is my portfolio supposed to look like the heart rate monitor of someone dying?,1.0,1614747396,[deleted]
38,lwlo1o,[removed],Don’t let them politicize this. Don’t be scared. Hold. These are legendary times. Godspeed Apes,1.0,1614747398,Tobin1776
39,lwlo1t,[removed],Watch $SLGWF on Thursday 🚀🚀🚀 big pop coming.,1.0,1614747398,ODBTX
40,lwlo6e,[deleted],Day-trading Reddit-readers nearly crashed the stock market. Now they’re in an ETF.,1.0,1614747411,[deleted]
41,lwlohi,,So...anyone able to catch this article before it was taken down?,1.0,1614747443,GorillaP1mp
42,lwlohr,"AMD; Should we see a break out of this downtrend soon?  


We have been stuck in a consistent down trend on AMD for about 3 months.

**On Feb. 25th, Biden Seeks $37B In Congressional Funding To Counter Chip Crisis.** This news may help us bounce back up to the resistance on the downtrend, and hopefully break it.

&amp;#x200B;

**For now, setting a target at the 89.00 range**; If we are green tomorrow, 1/2 size position would be acceptable.

We must break the short term resistance of this uptrend @ 87.00; only then will I feel confident to buy other 1/2.

&amp;#x200B;

**Seeing some small put options flow on this ticker, so be cautious and be aware of your own risk management.**

[Daily Chart](https://preview.redd.it/r9jj60bnvqk61.png?width=2376&amp;format=png&amp;auto=webp&amp;s=6c074120e7a71c169a70c2b43723fb4a18e601ae)",AMD Analysis,0.84,1614747444,MoistBands
43,lwlol0,[deleted],Clsn- everyone buy 100 shares for good cause. This compnay is in phase 3 for breast cancer and they could help lot of people out there .,1.0,1614747452,[deleted]
44,lwlol7,"High Times is a - beloved - American monthly magazine and cannabis brand with offices in Los Angeles and New York City. The magazine was founded in 1974 by Tom Forçade and the publication advocates the legalization of cannabis. The magazine has been involved in the marijuana-using counterculture since its inception.

On Jan 29th, 2020, ditched dreams of [NASDAQ Listing](https://www.newcannabisventures.com/high-times-ditches-dreams-of-nasdaq-listing/)

&gt;Hightimes Holding Corp., parent of High Times, revealed that it has abandoned its efforts to list on the NASDAQ, a goal it had been pursuing for since mid-2017. The company launched an offering two years ago at $11 per share through the Reg A+ process, and it reported that it would extend its Reg A+ capital raise until 4.545 million shares had been sold or until March 31st. It disclosed in an SEC filing that it recently sold 363,636 shares at $5.50 in a private placement to Ontario-based Rayray Investments (Raymond Leach, an original investor in MedReleaf), a 50% discount to where it has been selling shares.

High Times securities lawyers, Stephen Weiss and Megan Penick of L.A. based Michelman Robinson LLP, confirmed in an email interview that the company can not accept sales until they get their annual report filed and publicly available for investors.

[High Times IPO - Sorry, No Refunds - Teri Buhl of Cannabis Law Reports Talks Reg A](https://vimeo.com/438846483)

**Harvest Acquisitions**

It was in March that Harvest Health announced an $80 million buyout of that entire company. Then, literally two months later, we see a letter of intent filed by Hightimes now and Harvest saying, 

&gt;""Okay well, we're actually going to buy the California assets of Have a Heart."" 

Why that was contradictory is that Harvest had just been on an investor call telling people, when an analyst asked, 

&gt;""Why are you doing this deal?"" They said, ""Well, we want a stronger footprint in California."" 

It didn't make sense that two months later they're getting rid of everything they just bought in California.

Additionally, in the last month there have been[multiple news reports](https://mjbizdaily.com/high-times-cannabis-retail-bid-complicated-by-web-of-owners-social-equity-partners/amp/) questioning if Harvest even has ownership or control of the cannabis licenses to sell to High Times.

Very little cash actually changes hands in the deals crafted by High Times; instead it has announced millions of stock *(which isn’t publicly traded yet)* will pay for the asset purchases. With the Harvest acquisition, High Times attorney Stephen Weiss confirmed for CLR that $1.5 million was paid to Harvest but at signing only $500k was given. The asset purchase agreement filed with the SEC said High Times would pay Harvest $1 million on signing.

This is just a complete lack of transparency, and it's completely unfair for the Main Street investor trying to get into cannabis.

**Done before starting**

The Securities and Exchange Commission has told a U.S. operated cannabis media and dispensary company, High Times Holdings, that they must halt accepting investments in their mini-IPO because they have failed to meet an extended deadline to file their audited annual report.

&gt;The last date the company was allowed to take investments was the middle of June.

High Times used a reporting extension the SEC created because of the Covid-19 pandemic to get a 45 day extension to file the annual report and said in recent SEC disclosure filings, called Form 1-U, that they promised investors to get them current revenue, cash flows, debt levels and asset values by June 12, 2020 via the annual report; but CLR has learnt that this never happened.

Adam Levin’s company has spent over two years trying to get main street to invest up to $US50 million without a successful close date that could lead to publicly traded stock on the OTC Markets under the ticker $HITM.

On June 30th, 2020 the company made an [SEC filing](https://www.sec.gov/Archives/edgar/data/1714420/000149315220012247/0001493152-20-012247-index.htm) announcing once again their mini-ipo would be extended for yet another three months but left out the important fact that they couldn’t actually accept sales.

When asked if it is normal practice for a Reg A issuer to continue to solicit investments when it can’t accept sales; securities attorney Sara Hanks said:

*”The SEC may have softened up in the Covid crisis but previously, both sales and offers were supposed to stop during such time as the issuer was delinquent in its filings, because there is no exemption under Reg A  for “offers” (advertising etc) while a company is delinquent.”*

High Times still has their investment offering page [live](https://hightimesinvestor.com/?utm_source=google&amp;utm_medium=search&amp;utm_campaign=hightimesx&amp;gclid=Cj0KCQjw3ZX4BRDmARIsAFYh7ZLylKUJKyHSWhczvAcJAdLVBjLED6hTfWbWCb4Oejeqm5j-yCs4zpgaAgzCEALw_wcB)

Since then investors have seen a rapid pace of public announcements about asset purchases, via signed letter of intents, hyping the potential growth of High Times followed up with quiet SEC filings announcing the deals had either fallen apart or been watered down. 

I have personally fallen for this sham (F), as I invested in 5000 units in 2018. They stopped responding to my inquires, in fact, there was a random charge on my credit card (from an airport in LA) the same day they charged my card for the IPO.. they stated that it would be refunded - never was. I can still log on and see the shares I have “invested” but they obviosuly don’t represent anything. Lesson learned..

**Recent Financials**

The company filed a[post-qualification amendment to its Form 1-A](https://www.sec.gov/Archives/edgar/data/1714420/000121390018007523/f1apos2018a1_hightimeshold.htm) with the SEC that suggests the financial condition has become even more precarious. In the first quarter of 2018, sales plunged 64.9% to just $1.481 million:

Most of the decline can be attributed to the events business, which fell almost 83%, but publishing revenue declined over 16% as well. The company indicated that its Cannabis Cup events will take place later in the year compared to the prior year, with one in Las Vegas and in Los Angeles taking place in the first quarter of 2017 and none in the first quarter of 2018. The $554K in sales were generated by smaller events, and the company expects the number of Cannabis Cups and small events to increase for the full year. It blamed the publishing decline on lower sales at the newsstands and through subscription and lower print advertising revenue, with digital partially offsetting these factors.

The company provided information about its cost of revenue, which was $503K, as well as its operating expenses, which declined substantially to $2.391 million, producing an operating loss of $1.413 million compared to an operating loss in the first quarter of 2017 of $6.54 million. Much of the year-ago operating expenses were due to a one-time non-cash charge of $6.689 million for equity compensation charges for consulting.

The last time the company filed official annual earnings was June 2019. High Times had told investors it would get updated financial information on June 12, but that did not happen. The company has extended the offering of shares for two years, initially telling investors that it would list its shares on the NASDAQ. Then it lowered those expectations to the Over-The-Counter Marketplace. 

**Still, it hasn’t happened.**

*I am not a Financial Advisor, so please do your own DD*",High Times IPO - A Dying Brand —&gt; From Selling Mags to Selling Bags,0.75,1614747453,seebz69
45,lwlon1,[deleted],Is my account supposed to look like the heart rate monitor of someone dying?,1.0,1614747458,[deleted]
46,lwlopm,,Apes to the moon for AMC,0.82,1614747464,outersite
47,lwlouh,,We Can’t Stop. We Won’t Stop💎🙌🏽,1.0,1614747478,WeR1Race
48,lwlp17,,"I fucked up today was half asleep and paper hands my GME and moved it into fubo earnings gamble, very depressed",1.0,1614747497,jmd2004
49,lwlpi5,,I have 150 what can I invest on?,0.5,1614747546,[deleted]
50,lwlpj7,[deleted],"Not a Bull Pennant, a Bear Flag. Proof in comments.",1.0,1614747548,[deleted]
51,lwlpk4,[removed],Help Deciding,1.0,1614747552,bravewolfman
52,lwlppu,[removed],Which App do you recommend best to trade shares and bitcoins? Thank you,1.0,1614747567,algut27
53,lwlpqv,"I don't know what I was really thinking at the time, but let's just say I bought 10 GME $800 calls as a joke.

https://preview.redd.it/7qyv2qa2vqk61.png?width=1080&amp;format=png&amp;auto=webp&amp;s=47b4a1b655ec3f3c751815fecb41f2b764e00e75

Unexpectedly, GME spiked and I was able to sell them for a decent profit the very next day.

https://preview.redd.it/nohx1pp9vqk61.png?width=1080&amp;format=png&amp;auto=webp&amp;s=03fe247410b1ebc9e7df70dea5675c02ca28e1b7

I have to admit, I just got extremely lucky. $7,980.00 profit off $90 comes to about 8,866% gain.",GME gains.,0.94,1614747570,ExceptionallyGreat
54,lwlpy2,[removed],$BUZZ,1.0,1614747590,Muricainvestments
55,lwlpyo,[removed],RUBY,1.0,1614747591,No-Garden2879
56,lwlq3q,[removed],"What does 14% short interest mean exactly (CCIV) short interest ""exploded"" today apparently?",1.0,1614747605,LostSpireGames
57,lwlq5o,[removed],New retard trying to get in on this,1.0,1614747608,Dholbdy315
58,lwlqxn,[deleted],🐸🍦I found her Facebook.. and she is FB friends with Ryan Cohen’s dad,0.33,1614747666,[deleted]
59,lwlqye,,"GME, free advert🙏",1.0,1614747667,krdemps
60,lwlr3q,,CBDT / EPWCF YOLO,1.0,1614747681,extrastupidspecial
61,lwlr8y,[removed],A simple discipline: one stock at a time,1.0,1614747692,XtrdinaryTerrestrial
62,lwlrdn,,You know you're winning big when your portfolio looks like the heart rate monitor of someone dying.,0.96,1614747705,BoredInClassRightNow
63,lwlrgs,[removed],"So I see you autists making these power moves and I have to say I'm astounded. I'm risk averse due to an unstable childhood but am interested in in stocks, where could I start? Are there classes ?",1.0,1614747713,The_EA_Of_Reddit
64,lwlrhx,,Rocket Rocket 🚀🚀🚀. Go long.Strong fundamentals. Great culture.,0.48,1614747716,dartagnan18
65,lwlrun,,Hey mods the state of WSB is shit as of right now. Bots and short bus dwellers are spamming retarded (not retarded in good way) shit about retarded stocks. For the sake of our subs survival please do something,1.0,1614747746,[deleted]
66,lwlrvj,[removed],DIS: The ultimate post-pandemic play,1.0,1614747748,1poundbookingfee
67,lwls5g,[removed],Congratulations 🎉,1.0,1614747775,Kashmiri-Saib
68,lwlsji,[removed],How dumb an idea is this (and is it a theta strategy?),1.0,1614747808,MuTangClan
69,lwlu27,,"Kuznicki Law PLLC Announces Class Actions on Behalf of Shareholders of APA, EH, FUBO and MPLN",0.57,1614747951,Observant-
70,lwlu51,[removed],REMEMBER HTZGQ???,1.0,1614747959,Sh-ShakeNBake
71,lwluch,[removed],Im an 18 yrs with a 1k budget,1.0,1614747977,Curry-_-30
72,lwlug6,,If you think you’re a retard you better be the biggest retard PLEASE HOLD AMC and fuck all those hedge founders #FUCK THE SYSTEM,0.5,1614747987,Last-Squirrel6887
73,lwlunw,[deleted],My wild RKT ride to nowhere today,1.0,1614748010,[deleted]
74,lwluo3,[deleted],https://investors.kempharm.com/news-releases/news-release-details/kempharm-announces-fda-approval-azstarystm-serdexmethylphenidate,0.43,1614748010,[deleted]
75,lwlusq,,Coinbase is a complete shit!!!! They disabled my account trading for the 5th time and this time they told me I’m not eligible to use their services. I invested $3000 in them.,1.0,1614748024,strange_alpaca
76,lwlv2i,,Let’s go #CCIV #LUCID #WSB,1.0,1614748050,Wise-Horror-165
77,lwlvxx,[deleted],My Wild RKT ride to nowhere today.,1.0,1614748132,[deleted]
78,lwlw3m,[removed],Dont buy RKT,1.0,1614748147,Remarkable_05
79,lwlwcw,[removed],What’s up w $OSCR ?,1.0,1614748173,HifiGator415
80,lwlwd2,,DFV after GME takes off 🚀🚀,0.89,1614748173,monkeygloo
81,lwlwom,,Drive time,1.0,1614748202,Wise-Horror-165
82,lwlwr8,[removed],Question about ADT,1.0,1614748209,9to5lol
83,lwlwsy,[deleted],"Designed a Shirt in Photoshop for myself, after gme and amc go to moon 🌝🚀🚀🚀🚀🚀🚀🚀🚀🚀🚀🚀🚀🚀🚀🚀🚀",1.0,1614748213,[deleted]
84,lwlwu6,[removed],Diamond Hands stock?,1.0,1614748216,alphafoxtrot1776
85,lwlwxc,[removed],RKT ITM options volume is nuts and any discussion on this is much appreciated,1.0,1614748224,BLAKEEMM
86,lwlwyg,[deleted],My Wild RKT ride to nowhere today.,1.0,1614748226,[deleted]
87,lwlx5l,[removed],For all you feeling Paper Hands for selling Vs. Diamond Hands,0.93,1614748244,Wolfofthewall
88,lwlx8m,[deleted],Should I Buy?,0.5,1614748253,[deleted]
89,lwlxdl,,Thank you $RKT $2K -&gt; $20k,1.0,1614748268,conartist101
90,lwlxku,,My wild RKT ride to nowhere today.,1.0,1614748289,digitalgoodtime
91,lwly8o,[removed],Amc buy 5 calls at 6.5 strike for March 19th? Buy or no,1.0,1614748357,No_Bug_7470
92,lwly9c,[removed],This is a Casino.,1.0,1614748358,gottie1
93,lwly9j,[removed],Daddy Elon is Calling,0.63,1614748359,classy-narwhal
94,lwlygm,,Gold. Is this a cup and handle formation or not yet?,1.0,1614748379,BrokeSteady
95,lwlyj4,[removed],Is it right time to buy Nokia?,1.0,1614748386,Lolith0514
96,lwlyjn,[deleted],UWMC to $20! Gotta pick up are call holders. Everyone gets dividends next week.,1.0,1614748388,[deleted]
97,lwlyqr,[removed],RE: RKT............just remember..........,1.0,1614748410,mikey8247
98,lwlyti,,How much did ole’ Griffy pay em ????,1.0,1614748417,Unable_Meal6285
99,lwlzgs,[removed],WHO IS THE LEADER,0.5,1614748484,Ill-Focus9485
