,post_id,text,title,upvote_ratio,date,author
0,m184v1,,RARE IMAGE OF DFVs LEFT TESTICLE,1.0,1615301971,alldawgsgotoheaven
1,m184zb,,The Second Great Squeeze™,1.0,1615301981,blachat
2,m1853x,$TELL &amp; $NOK how guys?,$TELL &amp; $NOK how?,1.0,1615301990,Leading_Surround6958
3,m1854n,"I'm a APE and here for the ride, but eventually we will let go of the rocket that will make us all MILLIONAIRES! But what price will you personally settle with? 600? 1k? 2k?",What price would you actually sell GME?,1.0,1615301991,ParadinNAE
4,m185a3,[removed],DRRX Monster News,1.0,1615302004,Biotech_Guru95051
5,m185an,Unless the numbers are off it would be a bettee bet than GME now.,Why arnt we looking at GE stock?,1.0,1615302004,TonyMontana214
6,m185mg,,Mr. Robot signal,1.0,1615302020,detectivesolanas
7,m185sg,,It ain't much but I might as well enjoy the ride with you all. Let's go to Pluto this time. 🚀🚀🚀,1.0,1615302031,Kevin_KOTS
8,m185yq,,#AMC 🚀🚀🚀,1.0,1615302046,chatman6021
9,m1868h,,"Live footage of DFV walking into his next GME congressional hearing, after they laughed him for saying he would buy at $45",1.0,1615302065,cstrife007
10,m186bi,,House layout of every WSB member,1.0,1615302072,skinnygritty
11,m186h1,,Wife's boyfriend got me a new plate cover,1.0,1615302084,wallstreetmoontime
12,m186lc,Can't find anything anywhere,Anyone have a link to the SEC meeting?,1.0,1615302094,YimYimYimi
13,m186q0,"There are some new options contract strikes 850, 900, 950 on GME for january 21, 2022 🚀",New options for GME up to strike 950,1.0,1615302104,nairboon
14,m186rs,"I’m currently holding 3 shares, and I’m looking at my options and figure that if I were to buy calls for 800 expiring the 19th, I could stand to make some good profits. But I’ve never traded options before. As it gets closer to the strike price if I were to sell the option, would I still be holding an risk at that point?  

I guess I’m short: is it worth selling my 3 shares for an options contract or should I just hold the shares?",Would buying calls for 800 be worth it?,1.0,1615302108,Saltnknepper
15,m186ry,,I cannot complain. 💰,1.0,1615302108,Leanny1399
16,m186sp,,Finally I know what it means to be a Baller,1.0,1615302110,DreamrSSB
17,m186wa,[removed],The Bag Raiders were Prophets...we just didn't know what they were prophesizing... $GME Raiders.,1.0,1615302119,Liftinglawman
18,m1873u,,House layout of every WSB member,1.0,1615302134,armin_horvath
19,m187b4,"With the recent shift from a retail outlet to a TECH company we need to think about how GameStop is valued. 

With an industry leading customer list, this is the GOOGLE and FACEBOOK of gaming. 

I could easily see a $100B valuation in three years, with the WORLD LEADER in online tech, our Tendie God Cohen at the helm.",GameStop is a Gaming TECH company and needs to be valued that way.,1.0,1615302149,SSPolcyc
20,m187eg,,House layout of every WSB member,1.0,1615302157,armin_horvath
21,m187vl,,The 2nd wave I needed,1.0,1615302193,Bajous
22,m187yc,UWMC $10 I need you 🙏🏽,UWMC,1.0,1615302199,No-Comparison-7639
23,m1882n,"You can hold me to them.
270+ eod, I’ll buy myself a flurry
500 a share I’ll buy a pizza party for local GameStop employees 
If we hit 2k a share I’ll quit my job 
5k a share I’ll take a homeless person on vacation 
6k a share I’ll egg my old job 
7k a share I’ll eat a lawn clipping salad 
8k a share I’ll go climb a tree as high as possible till I have to be rescued by FD
10k a share I’ll move to Mexico",My bets,1.0,1615302209,kissmaryjane
24,m188f5,[removed],WMC mega Squeeze,1.0,1615302236,Key_Emotion_1780
25,m188tc,,Got some Tesla options yesterday,1.0,1615302263,mightwonder
26,m188vi,"They literally only have one tool, shorting, which makes their problem worse.

12.20 interest, only 85k shares up for short. This is going to be even more awesome.",HF trying to dig their way out of the AMC hole,1.0,1615302267,Dr-ButtMonkey
27,m188wf,,"F*** it i‘m in there. Good luck fellow retards, greetings from good old Germany 🚀🚀🚀",1.0,1615302268,Tommink26
28,m188zd,"2 hr chart  
**Bullish wedge in action**

&amp;#x200B;

Looking for a **candle close above 36.70** along with increasing volume

[MARA 2 hr chart](https://preview.redd.it/t41o0w0gp0m61.png?width=2528&amp;format=png&amp;auto=webp&amp;s=fbf73ba73ad9d1acbc7d18769da61f28e9673f10)",MARA Analysis:,1.0,1615302275,MoistBands
29,m1890g,Lets awake this Krakennnnn!!!,SOS Limited Stock🎢,1.0,1615302277,RabbitFromWallStreet
30,m18918,,What .44 shares of GME will get you in the near future,1.0,1615302279,Gfnation
31,m1891y,,You silly apes are coming for me 👐 💎,1.0,1615302280,c016y
32,m1892k,,how each meme stock boom helped my portfolio,1.0,1615302281,RipZyzz_4eva
33,m1898d,,"Monke see, Monke do.🦧",1.0,1615302293,ChefBoiYadi
34,m189ui,"&amp;#x200B;

https://preview.redd.it/jus7lszep0m61.jpg?width=640&amp;format=pjpg&amp;auto=webp&amp;s=0fc920b8bebd7fa9624ea0f3472dd9ebca71c1ca",Got this manicure a week ago right before the takeoff :D,1.0,1615302339,pustozvonka
35,m189zy,"**Advanced Micro Devices ($AMD) is undervalued, well positioned against competition, and poised to take further market share in rapidly growing and high demand industries.**

AMD is mainly known for its presence in the gaming industry, and some of you may remember it as one of the OG WSB meme stocks. This subreddit has seen the potential of AMD multiple times in the past, and I believe the recent AMD dip has created an excellent opportunity.

**First, let's look at how AMD compares to some of its competition:**

* If you are into PC gaming at all, you will be aware of how CPU sentiment has shifted greatly away from INTC in favor of AMD.

* The main reasons AMD CPUs are becoming more and more preferable are because they offer significantly more bang for your buck versus Intel CPUs, INTC has recently had disappointing new product releases, even high budget PCs are often abandoning Intel entirely.
[CPU Comparison](https://www.cpubenchmark.net/high_end_cpus.html)

* AMD just released new GPUs last week, which are superior in performance and more affordable than many of NVDA's top of the line models. Even though they are still high in price, this shows that AMD is very able and willing to compete with NVDA's top of the line GPUs. They sold out initially within a couple hours of release.
[GPU Comparison](https://www.tomshardware.com/reviews/gpu-hierarchy,4388.html)

* AMD produces both the CPUs and GPUs in both the Playstation 5 and Xbox Series X. These consoles only just released a few months ago and will be in extremely high demand for the next 5 years or more.
[How AMD gained hold of the console market](https://itigic.com/ps5-vs-xbox-series-x-why-use-amd-cpu-gpu/)

NVDA Market Cap: $290B
INTC Market Cap: $245B
**AMD Market Cap: $89.5B**

Morningstar's research indicates that AMD's fundamental value is around $80 price per share. Meanwhile, they estimate NVDA's fundamental value to be around $330. These estimates tend to be conservative, yet even after this correction that tech has endured, most remain well above their fundamental value - except AMD.

**As I am typing this, AMD is currently under $75 price per share. Even if AMD somehow had extremely minimal future growth (I will further outline why future growth will actually be astronomical), it would still fundamentally be valued at $80 per share AT LEAST, and that's with boomer estimates.**

I don't claim that NVDA or INTC are bad companies, rather I seek to point out that AMD is being underestimated by Wall Street. There's more than enough room for all of these companies to have a future in the gaming industry and adjacent industries.

[The gaming industry experienced record growth in 2020, and isn't stopping any time soon.](https://www.marketwatch.com/story/videogames-are-a-bigger-industry-than-sports-and-movies-combined-thanks-to-the-pandemic-11608654990)

I see some claims that the end of lockdowns will mean less people playing video games or using computers, I don't think this claim is even worth seriously addressing. If you seriously think that you may be a little out of touch.

**Other Industries AMD Will Succeed In**

While my primary focus has been on AMD's success in the gaming industry, their GPU's are also widely used for mining the digital currencies that cannot be named or discussed on this subreddit, but it is still worth mentioning that market and the large demand that it brings. We've also seen NVDA branch off into the autonomous driving and AI industries, AMD could easily do the same.

[AMD CEO, Lisa Su, has previously expressed interest in branching towards EV and AI industries, and says AMD's technology is already there. (This is the best link I can find at the moment)](https://www.reddit.com/r/AMD_Stock/comments/b4w1hm/is_amd_getting_more_serious_about_autonomous/)

**Semiconductor Shortage?**

Some people cite the recent semiconductor shortage as a reason to be bearish on AMD and related companies. While this is an issue, it is clearly short term, and I think these shortages have been more than priced in by now, especially for AMD. [Demand is extremely high, which is good, and AMD is working on increasing their capacity.](https://www.crn.com/news/components-peripherals/lisa-su-shortages-constrained-amd-s-record-2020-and-will-continue) Lisa Su says she expects shortages to ease the second half of 2021, adding that they will have added capacity in the second half of 2021.

The demand for AMD products is extremely high, this is clearly bullish in the long term. AMD’s technology will continue to be very valuable in many industries, the potential for growth here is still astronomical. Lisa Su is a great CEO who has brought AMD in a great and very competitive direction, and there are few CEOs better suited to successfully navigate any future speedbumps.

If that still doesn’t sooth your mind, [the Biden Administration has already committed to easing the shortage.](https://www.cnbc.com/2021/02/24/biden-signs-executive-order-to-address-chip-shortage-through-a-supply-chain-review.html)

**Positions?**

I tried to keep this analysis relatively short and sweet. I believe I have made a compelling case to be bullish on AMD in the coming months/year. IV on $AMD calls at the moment is extremely low, historically low. As low as 45% on many, making this a great time to buy, shares are also a fantastic choice. I recommend you give yourself enough time in case AMD continues to dip along with the rest of tech, but YOLO to your heart’s content if you wish to do so.

$AMD $100c 7/16, $AMD $120c 01/21/22

**TL;DR: AMD is undervalue, buy calls or shares**

I dream of a day the front page of r/wallstreetbets is once again flooded with the face and worship of Lisa Su.","It is time to return to tradition. Re-introducing the OG meme stock, $AMD. A play based on actual logic and not mindlessly flinging poo at a board to see what sticks.",1.0,1615302351,DestroyerOfPussy69
36,m18ad7,Let go!,UWMC Mega Squeeze coming,1.0,1615302378,Key_Emotion_1780
37,m18adj,I AM GREEN I AM FINALLY GREEN MOTHERFUCKERS 😭 I ain’t selling yet,W,1.0,1615302378,WillingInvestigator6
38,m18ai8,"AMC WAAANTS TO BREAK FREE.....GOD KNOWS, AMC WANTS TO BREAK FREEEE.",AMC WANTS TO BREAK FREE,1.0,1615302388,manipulatinglaws4me
39,m18aii,,GME a little spooky this morning. Nm but I'm a 💎🙌 RETARD APE,1.0,1615302389,ludepde
40,m18amz,,"Opk crazy shorted, CEO and BI buying",1.0,1615302400,SunsOut1
41,m18an7,"Hi, im a student from latam and I want to get in the movement, how can I YOLO with my last $60 of this month?",A broke student wants to YOLO,1.0,1615302400,Jacobrd
42,m18aop,"This company MAKES MONEY. $1.5B net income this last quarter , an 800% increase in earnings and guess what? RATES RISING DO NOT DESTROY THE BIZ AS THEY DO NOT RELY ON REFINANCING LIKE ROCKET!!! 

Yield is around 4.5-5% at current levels .. added to the Russel 1000 and 3000 on 3/22... you know the drill 🚀",$UWMC - Not a Meme - But a hidden Gem.,1.0,1615302403,nadsks
43,m18b3z,[removed],GME,1.0,1615302436,jayvishrolia
44,m18bb4,,"Next up, cue the endless gain porn posts with the people who “definitely knew it was coming back” followed in a few days by the endless bag holder posts of people who got greedy or didn’t know when to quit.",1.0,1615302450,skithetetons
45,m18bcy,,Ladies and gentlemen,1.0,1615302455,Umbra427
46,m18bf1,BUY MOHAWK GROUP HOLDINGS WHILE IT IS LOW! IT'S GOING TO TAKE OFF,MWK Mohawk Group Holdings is the next one,1.0,1615302460,MinimumReindeer8
47,m18bhy,"So I downloaded and started trading on the Ameritrade app about a year ago.  I just ran across something for the first time, or maybe it is the first time I've noticed, so maybe one of you could help a newbie out.

I had some extra cash leftover yesterday so bought some cheap shares of TRX at $.6345/share just because.  I check my cost/share today and it says I bought them at $.79/share.  The filled order does not match my starting position.

Is there a reason for this I'm missing or is the app just glitched?",Why did my initial cost per share change without buying more shares?,1.0,1615302466,0RabidPanda0
48,m18bkz,,FOMO finally took over. 22k yolo.,1.0,1615302472,Quinnteligent
49,m18bol,"GUYS, Listen to me. ADA will be next Bitco*n. 
Trust me you should at least buy one. 
See you in a few months! ;)",ADA IS THE NEXT B I T C O I N TRUST ME PLEASE,1.0,1615302480,HADITMS
50,m18bop,[removed],MONEY TO BE MADE IN TICKER SINT,1.0,1615302480,brock8190
51,m18bpr,,It’s my lucky number🚀,1.0,1615302483,FactsRking
52,m18bx3,,Ape do work lifting all the tendies,1.0,1615302496,hehozezo
53,m18bxf,"After seeing how the last few weeks in the market have been looming, GME is literally the safest stock to be in and I’m loving. Let those 🌈 🐻 go screw themselves for not believing. Anyway strap on boys because we’re taking a ride to the motherfuckin moon 🚀",GME🚀🚀🚀,1.0,1615302497,Big-Vanilla3771
54,m18c1k,I only have 5 shares. I see everyone says to the moon and more but is it realistic to dream of 1k+ or more. I'm down to hold and keep buying when I can but just my question is is something that's realistic?,Little guy question,1.0,1615302506,Doc_Blumpkin
55,m18c4j,,I joined you apes today. Not that much but I am in 🦍 💪,1.0,1615302512,valueslice
56,m18c70,IMO AMC will crash hard today. Don’t be left holding the bag. 🤷🏻‍♂️,Don’t be an AMC bag holder,1.0,1615302517,Curious-Macaroon-883
57,m18c9k,,When you realize...,1.0,1615302522,DonLeo432
58,m18cew,,If GME hits $1000 this week.,1.0,1615302534,Frachesum
59,m18cf6,"It is going up and down lately, it is really volatile but I think it is undervalued what do you guys think I should sell, hold or buy extra?",What is your guys opinion on Pharming group(PHARM)?,1.0,1615302535,katje510
60,m18cft,[removed],GME,1.0,1615302536,jayvishrolia
61,m18cib,"I feel I have not heard from him since I started following. 

But I am also a retard so what do I know",I’d love to hear from DFV,1.0,1615302542,4stonks
62,m18cp4,I want to join this rebellion. Can I?,Im New,1.0,1615302553,killl-wallstreet
63,m18cq1,,DADS GOT PAPER HANDS 😭🚀🇺🇸,1.0,1615302554,FlorenceNightenguy
64,m18cu0,"Buckle up, because it's story time. Let's start with [this](https://imgur.com/a/RegJVHV) picture Friday night, I decided to stay up late, smoke some bud, and mess around on the computer. For whatever reason, I got the big brained idea of transferring my portfolio to TD Ameritrade. Great idea, I reasoned. So I initiated the transfer and being the smooth brain ape that I am, I did not realize it would take 5-8 business days. Fuck! This isn't good. So at 1am I called their support line and waited on hold for about 20 minutes and spoke to a very nice lady. She told me that the transfer team comes in Monday and since I called early enough, they could most likely stop it. Great! No worries! Monday rolls around and I get a response from support to confirm that it was indeed early enough to cancel and I should be ok. Last night, after an awesome day of GME gainz, I get an email from RH that said they received the ACATS transfer request and my account is now deactivated and it will take 5-8 business days. FUCK! By locking my own self out of my account, I have officially graduated from smooth brained ape to smooth brained retarded ape 🧠🦍,. This is a new type of 💎🙌 that I'd like to refer too as Forced 💎🙌 I suggest you apes join me. Can't sell what you can't access.","I got super high, and then my smooth brain and extra chromosome kicked in. My story of how became an official member of WSB 💎🙌🧠🦍",1.0,1615302563,vaelon
65,m18cub,,Ape Edit Smart Wikiman Lines,1.0,1615302564,number_player
66,m18cx0,,Dang 😔 Sold all GME,1.0,1615302569,SamWinny
67,m18cxg,,"I'm probably in the wrong sub, but as a single parent, I generally have little money to spare. And even if it is $20 you all inspired me to dabble a little to start understanding how the stocks work. So thank you!",1.0,1615302571,Cloud_Additional
68,m18d38,,Keep your foot on the gas boys! Just added 31 more AMC 💎🤲🚀🚀🚀🚀🚀🚀 I also love you retarded apes.,1.0,1615302583,whitetrash08
69,m18d3h,,I like these stonks. Had 16k in October thanks WSB on the way to 1milli. Deff not investment advice,1.0,1615302584,dislike-tau
70,m18d3w,,So what you're saying is: This material would not sell GameStop right now.,1.0,1615302585,funnybillypro
71,m18d9p,,Ape help Ape 🤝,1.0,1615302598,noimdirtydan14
72,m18db8,,What is the current view on MGNI?Everyone has been talking about demand side platforms but not the sell side. Seems to be a lot of volatility and misunderstanding about the impacts of google cookies changes with regard to the adtech space as it relates to ctv.,1.0,1615302601,S3cretBoy
73,m18dcc,,What is everyone’s input on Grifin?,1.0,1615302603,SmallTownGeniuz
74,m18dhy,Amc is having its earning call mar 10th after hours. We are right around the corner for a lot more openings. Everyone buy and hold now and we will make go to the moon!,BUY AMC WHILE ITS STILL AFFORDABLE. EARNINGS CALL TOMORROW!😎,1.0,1615302615,thedooth75
