,post_id,text,title,upvote_ratio,date,author
66,mg2vk5," 

TLDR: keep at least 1 share. keep 2 or 3 if you have alot of them

Already so everybody knows it's about buy and hold. and everybody want's to be rich and burn the shorts. You always have to think ""what next?""

Info:

1)EVERYBODY wants money, even the shorts, and they will play all the tricks they got. Illegal and Legal. No news we all have seen it.

2) This is a War. Shorts vs Longs (everyone should read ""The art of War - by Sun Tzu. Best book for everything in your life)

3) What is our fuel? - 200% to 2000% short rate - EVERY SHARE HOLDED MATTERS

4) Their strenghts? - knowlege; softwares; teams; capital; tricks and manipulation; power;

5) their weakness? - Dept; greed; leverage; regulations; alot of different tickers to cover; It's their home and they need it to live; And now, Chaos

6) Our strenghts? - Time; no extra costs; upper hand; 1 goal (squeeeezeeee); the actual shares; Free knowlege; big whales

7) our weakness? - paperhands that trade and get scared (me in the past - regret) ; sometime chaos; no knowlege sinse it's their market; no vision (alot of people will sale before 1k)

Alright, sorry for this info, but what is my point? I have 3 points:

1. They can keep draggins this for months- years, IF people trade. They can buy 1M shares a day... 10M shares a day, if people sold. they own 2000% shares? alright... 10M a day, 100 days = 1B shares

1 FUCKING BILION SHARES with 10M shares a day (average day is 15M shares traded). That is why it's SO FUCKING IMPORTANT not to trade, because they can pay back little by little (like you asking for a House Loan to the bank, and then paying month after month for 50 years)

Not only that, but if they keep dragging it, they make money along the way (same way. you work, you get paid, you pay or bills. next month same thing)

2) So yhea, everybody HOLD, they get fucked, their invester cutted (happening right now with banks)... And they get called, and cover their shorts... IT'S DONE RIGHT? FUCK NOOO!!! - IT'S NOT DONE!!

In order for them to buy, people have to sell... they could buy the 2000% shares for 1$ each if people sold at that price. WE ARE THE PEOPLE - WE MAKE THE PRICE

People will get scared! ""from 5k to 1k? oh shiiit!!!i better sell before it gets even lower! 1k is enough for me!""

People that never saw money, will get crazy with 500k in a day, will sell!! (500k is alot right? well if you have 100 shares, it's only 5k/share... not much)

You see... in the End game, it's a team game ""The enemy of my enemy, it's my friend"". Sure, there will be chaos, there will be sellfishness... It's all normal, we are all humans... that's why we need to be selfish but smart!! If we think alone, we will sell first then the rest... there is no rush in selling. I will tell them when they can suck my dick, no rush... and I'll thell by how much

I want to sell at 1M a share? I'll put a sell order at 5M! Do you really think they gonna let you sell the price you want? it will reach 999K and fall to 1k. And you will sell, why? - Because it was so close... you can lose 100k... better than nothing right? sure... but you just lost! and everyone that wanted to sell at 1M or higher. It's all mental, and we are common/basic. We all have the same price target, it's easy to predict

3) Final point, sorry guys. KEEP ONE SHARE. They need to buy those 55M shares. There is not enough illegal, corrupt shit they can to, to erase 55M shares. They can ""delete"" the extra shares that don't exist, they can do whatever the fuck they want. But those 55M shares (not even one less, because they can trade that 1 floating share, 100000000000x times, and get free) Will need to be covered.

End game, everybody is selfish and wants their milion... That 1 share that you don't sell, will get you EVERYTHING and its the only way to make sure everybody sells fucking high. And it's our job, to make sure each one of us makes our part part. Do it for yourself!

""But I can sell that share for an extra 5M"" - Fuck it, set you target price 5M Higher on the other share

Let's burn the roof, the floor, the walls! We want blood and money $$$$

Ps. Our taxes will pay for all the inocente people that will get burn in the process

I can lose whatever I have invested, it's all profits from the past. I'm not leaving without enough money to build schools, build shelters, build a better society, and invest in green energys. 1M is not allot, we just think it is because we are poor!

sorry for bad english, not native",GME keep at least 1 share!! Why?,1.0,1617061650,Cashmoneyblingbl1ng
67,mg2w2h,,GameStop: 3.2 TRILLION Volume today on Yahoo Finance - Try to look at the 11:32 on the chart now; it’s been deleted.,1.0,1617061693,SaintHakop
68,mg2wld,,I wish I had more money for CCIV lmao,1.0,1617061736,Sir_Giraffe161
69,mg2x2n,Its making gains so far so why not,How about we move on to funko stocks?,1.0,1617061781,niloc1987
70,mg2xvq,,TRMB is the largest holding in ARKX,1.0,1617061854,zhouyu24
71,mg2yg7,,Spaceship 3 coming on the 30th march 7.30 am ET.,1.0,1617061904,wolf_of_Geneva
72,mg2z35,,Reserves depleted,1.0,1617061963,Sir_Giraffe161
73,mg2zl6,,VIAC Hedge funds trying to destroy SpongeBob but we like the stock!!! https://finance.yahoo.com/news/exclusive-tiger-cub-archegos-liquidation-015109185.html,1.0,1617062003,MrBigglesworth308
74,mg2zxv,,$ROOT $50k yolo. 43% Short Int. Will be adding another $50k in ITM calls tomorrow morning.,1.0,1617062039,aBetterNation
75,mg3134,,88e on the brink,1.0,1617062140,Glittering_Heart6156
76,mg325t,,Reserves depleted,1.0,1617062243,Sir_Giraffe161
77,mg32je,,CNN to the Moon!,1.0,1617062276,drunkwasabeherder
78,mg32xu,,"A digital leaving card for my friend at work, everyones normal and here I am being a total retard.",1.0,1617062314,Total-Instruction364
79,mg33fx,[removed],INVU,1.0,1617062361,Response_Alive
80,mg352n,,"A digital leaving card for an ape leaving at my work, my colleagues will think I’m retarded now.",1.0,1617062487,Total-Instruction364
81,mg366d,Boys... elongate meme coin was founded 5 days ago and has been rocketing. This Fr could make a life changing amount of money for people. It’s getting posts from big social media pages and steadily gaining traction. Has gained over 20k holders in 4 days. This is the next shot to the moon🚀🚀,ElonGate,1.0,1617062575,Zealousideal_Owl8434
82,mg367m,,AMC YOLO UPDATE. PATIENTLY 💎🙌,1.0,1617062577,Whole_Personality_81
83,mg36vv,,A digital leaving card for a fellow ape leaving at my work. My colleagues will now think I’m retarded.,1.0,1617062635,Total-Instruction364
84,mg372m,,view it,1.0,1617062651,Historical_Meat_7731
85,mg37g7,[removed],INVU(Investview),1.0,1617062679,Response_Alive
86,mg389z,[removed],Earning money by taking photos,1.0,1617062747,Vegetable_Ad_906
87,mg3afe,"&amp;#x200B;

https://preview.redd.it/1r87jyof42q61.png?width=420&amp;format=png&amp;auto=webp&amp;s=5109bb76b9e579748ba84629d5991b6d1718bbde",Look at me and my lil cash app acc tryn get 100 to 200 75$ in GME and 25 In AMC holding with little profit to the moon lmaoo,1.0,1617062940,Fluid_Cabinet9315
88,mg3anq,"&amp;#x200B;

*Processing video bfxyebgl42q61...*",An Ape goes to the doctor,1.0,1617062961,RaidSlayer
89,mg3clh,,"$RKT BLASTING OFF PT 2! 35 EOW and I’ll get Dan Gilbert, the king of ape’s, face tattooed on my anus!",1.0,1617063135,Strangoid
90,mg3d0h,,"Looks like Acorns is investing in a very sophisticated way, didn't realize I might be holding additional shares in my mini account. Big 🦍 energy",1.0,1617063173,Balsamic_Scrobbler
91,mg3e0e,[removed],Petition to designate anyone who YOLOs their protfolio with a 100% loss a life long member of Hwang gang,1.0,1617063260,CooCoo4Seppuku
92,mg3f9f,[removed],This subreddit sucks,1.0,1617063375,YTChaosTheAB
93,mg3fzf,,"Gonna be honest. I have 0 idea how the stock market works , wtf is a “buy the dip” but I also just bought 5 shares of JetBlue (19$ each) because I figure that after this virus leaves travel will boom.... did I make a stupid decision ?",1.0,1617063436,Yeeturmomsmadsus
94,mg3gcy,,US search interest for “inflation” at a 7 year high,1.0,1617063471,coinsmash1
95,mg3gmg,[removed],Just another stupid question about GME,1.0,1617063494,FarrelGrimwood
96,mg3gn5,"There is obviously some fuzzy, or straight out shady, math going on.  We know shares have been shorted, but it's apparently a giant secret just how many.  From what I've learned (and please correct any of this as I go) the hedgies don't need to disclose just how much they've shorted for 30 days.  It also seems they can play fast and loose with that rule.

Next, I've heard about volume glitches.  There's another post about trillion share volume and the chart just skips over some time so the numbers don't add up.

Basically what I'm wondering... With the kind of money that's being discussed (thousands, if not millions, per share) and the inside members only shit that goes on with the hedge funds, mutual funds, etc, it seems like the system is rigged to defend itself.  

Are these fuckheads just sitting there laughing at us, having already ""covered"" all their moves and we just don't know?

I'm not shitposting or anything, I really don't understand much of this other than that I know those bastards will circle the wagons to protect themselves and fuck us.  Any help is very very welcome.","New to this whole thing, so I have to ask some questions. Don't mean to be a downer...",1.0,1617063496,JimmyRickyBobbyBilly
97,mg3hb3,[removed],Aerojet Rocketdyne Holdings,1.0,1617063556,m3ai3a
98,mg3hm3,,Who else got wiped out on robinhood?,1.0,1617063582,Smoodee13
99,mg3hrm,,$PIT TO THE MOON,1.0,1617063597,Practical-Animator60
