,post_id,text,title,upvote_ratio,date,author
0,m6rvg4,,"Then they doubted Amazon, today it’s Tesla (history repeats itself!!!)",1.0,1615954312,ronifintech
1,m6rvm7,,My financial advisor sent me a risk tolerance survey.... I thought it needed an update to get with the modern times,1.0,1615954330,n8rman13
2,m6rvmn,,Analysts coming to their senses,1.0,1615954332,Sanchezjaime
3,m6rvor,,"Since the markets are closed I went to satisfy my other gambling fix and found this gem. You bet your fucking as I'm playing a game called Gorilla Diam💎nd! Also, my contribution to to adopting our brethren.",1.0,1615954337,falecf4
4,m6rvrn,,RH likes the cat,1.0,1615954344,Pshmurda69
5,m6rvyp,,Hope this loss porn makes some monkey out there who has lost less than me feel a little bit better. Have been investing and trading on and off since 2017. This is my net. It is nice that a space exists where a community of people can simultaneously understand and master-bate to this post.,1.0,1615954366,BitcoinStoners
6,m6rw1s,,"The SNDL family needs the good people at WSB. Help is WSB, you’re our only hope.",1.0,1615954375,Drop_D_1983
7,m6rwko,[removed],What are we buying now?,1.0,1615954432,dukeeee710
8,m6rx64,,Is this a sign from above? ATH &amp; Beyond = All Time High &amp; Beyond,1.0,1615954492,TeddyBearPanda777
9,m6rxr4,Sold all of my Bit to buy more AMC!  Let's go!!!,AMC,1.0,1615954548,Enough_Hall_2383
10,m6rxvn,Fidelity Surprise in my account. Hope it will stay until the morning.,Fidelity ANCN surprise,1.0,1615954558,zeta411
11,m6rxyr,,"Been offline for a little - if Gamestop is still the rage, just know that Bill Gross now your counterparty in that trade. Not saying it as a warning, just to put a face to you're trading against :)",1.0,1615954567,lowlyinvestor
12,m6ry7b,"This group is awesome, first takin down tha man, then saving gorilla's, what's next? Maybe you guys could end homelessness, that would be cool..","GME, Gorillas, And...",1.0,1615954585,Embarrassed_Mix371
13,m6ryda,,Me after joining WSB,1.0,1615954598,dinst
14,m6rywi,,Melvin’s part time job after being squeezed feat. $DASH,1.0,1615954645,ListerineInMyPeehole
15,m6rz4h,,Found this job opportunity writing due diligence reports.,1.0,1615954668,HeinoFolami
16,m6rzl2,[removed],Sold all *Bitttcooiin* to buy more AMC!,1.0,1615954718,Enough_Hall_2383
17,m6s0bf,,Panda Express is offering moral support for us retails traders,1.0,1615954799,lescrapps
18,m6s0kn,[removed],Physical delivery GME options,1.0,1615954825,appillz
19,m6s0ra,,"SOLIDARITY! $GME CARRY THEM ALL! I created this virtual portfolio in a scenario that you went in all of these stocks equally, to buy them at a fair bouncing back point, after each of the top and crash. And $GME alone is carrying the whole portfolio at almost NO LOSS. $GME IS THE SAVIOR. SOLIDARITY!",1.0,1615954844,jackyan006
20,m6s0ui,Buy the fuck out of the dip,Good Morning Everyone!,1.0,1615954851,Harry-man24
21,m6s1f6,,"Hey guy’s!!! Anything would be nice, we having a baby coming in a few weeks 🥰",1.0,1615954902,MastermindDon
22,m6s272,[removed],I know I’m retarded but here me out,1.0,1615954973,touchyshitmouth
23,m6s27e,[removed],Seeking some wisdom into entering calls etc,1.0,1615954974,Mikeymikemike3331974
24,m6s2gi,,I heard he likes the stock.,1.0,1615954996,kelpfractureblasfemy
25,m6s2ni,[removed],Sold all my biitcoinnn for more AMC! Let's go!!!,1.0,1615955012,Enough_Hall_2383
26,m6s2tu,[removed],WHAT POSITIONS SHOULD I TAKE FOR 4/17,1.0,1615955033,cityguidance
27,m6s3ky,,Can I call Congress and ask for an investigation into the hedges that violated me? I can show them on the doll where they touched me...,1.0,1615955112,YeetingDonkey
28,m6s3rg,[removed],This is not financial advice,1.0,1615955135,FlyFinesser
29,m6s3ub,,"Applying at AMC, I'm a tell them Im A share holder and kind of a big deal. 💎👐🦍",1.0,1615955145,Markus-Maximus
30,m6s3ug,[removed],"What's everyone's thoughts on BB ,",1.0,1615955145,Local-Satisfaction72
31,m6s43s,,"Just totaled my car, some tendies would be nice but I AINT SELLIN 💎💎👐🏻👐🏻",1.0,1615955171,its4thechildren
32,m6s4pl,[removed],If I didn’t sell at 2.3 mil what makes you think I’m going to sell at 1.7 mil???,1.0,1615955234,Juan-Gute
33,m6s4qz,,"Yahoo finance sustainability page doesn't have anything on it for GME... They really be like ""I have no fucking clue which side to pick""",1.0,1615955238,FuckingAppreciate
34,m6s4sq,"$CSTL DD smooth brains. 

I can’t sleep as I am preparing to go on nights, so I spent some time on FINRA’s website looking at short volumes because bears suck and I found $CSTL 

I have no position in $CSTL and I don’t plan to take one. 
$CSTL has a 1.6bn mktcp and little to no option interest and what interest there is all puts and those bears are going get fucked here. 

WTF is $SCTL
Castle Biosciences makes melanoma tests, and is using AI and genetic profiles to make predictive outcomes on melanoma cancer. 

In December CSTL got partial medicare approval for their most advanced Melanoma screening, on the LCD level. To you people who know nothing about biotechs, let me school you why this is huge. FDA approval is great, but if CMS (admin for Medicare and Medicaid) won’t pay for whatever widget the biotech is hawking than the company is going out of business. LCD approval means with a geographical area, the test is paid for. For CSTL that area represents 90% of the melanoma diagnoses in the US.

tl;dr CSTL is going to get PAID when hot girl summer starts and my wife and her boyfriend start fucking outside. 

Let’s talk pipeline, IE what have you done from me lately. CSTL is growing their testing portfolio from 2bn TAM to 5bn. They clearly are not planning on being a one-hit wonder looking for a buyout. 

Okay we know what the do and that they are going to get paid for it. Lets DD on their financials. 

This past year they retired all of their debt, ALL OF THEIR DEBT, and they quadruped their Cash on hand from 100mm to 400mm. No debt, tons of cash, test getting CMS payment approval, growth to the moon baby. 

Versus other biotech test companies, they have higher revenue growth and a higher profit margin. 
ROE, ROI, ROA all meet or exceed the industry. 

Let’s look at the negatives, their latest results showed a -.24 v estimate of -.12. No surprise there people were staying inside due to COVID and retiring all of their debt. With only 84% institutional ownership it shows skepticism for future growth, but the vaccine is here and people will be going outside. PT on the stock is 90.00 and it exceeded that back in march. Currently in 60’s there is a ton of room for growth. RSI is right at 50, so even more room to grow.","$CSTL DD, post-COVID people going outside and they will get cancer and CSTL will get paid",0.5,1615955244,colpuck
35,m6s4u6,,We're helping apes without 100% hair too right?,1.0,1615955249,flagcity
36,m6s4yf,Uhhhh. can we find a way to fuq APPLE or GOOGLE ??,DOWN WITH MONOPOLIES!,1.0,1615955260,AdRecent5330
37,m6s5jg,,Forget Lambos...Apes on Submarines!,1.0,1615955329,Space_Karen
38,m6s5l1,"Sorry if the quality of editing is bad. First attempt, can't stop won't stop 

*Processing video fi22ncr5nin61...*",First ever edit and tribute to all the HODLERS,1.0,1615955335,ss_goat
39,m6s5oa,"Although I’ve only got 6 shares in this GME roller coaster ride, I still consider myself an ape on the sidelines. It’s been such a crazy last couple of months and I honestly haven’t had this much (internet) excitement in my life. 

This is the very first and only stock that I’ve ever purchased and although I don’t know shit about stocks (I understand the concept but that’s it), this is something I’ll never forget. I’m happy for everyone who’s lives have changed for the better and it’s heart warming to see the good that this place does as far as charity. 

But I’m gonna be a negative Nancy ape for a bit. You guys saw it. You guys are seeing it. We’re all watching it live. How manipulative media outlets are. How quick they are at shooting their arrows. How our government basically just gave us an amateur horse and pony show when they “questioned” that Bosnian whatever the fuck from Robindahood. They tried to grill our boy DFV more than any of them. It really pissed me off watching that. 

They tried throwing attention away from GME (silver anyone? lol). They tried attacking this place. They tried attaching day traders. They tried attacking DFV. They tried every single thing they could and failed. I truly believe it’s because of the good intent in this sub gnat helped. That and you guys are seriously stupid as fuck. 

I mean, I know the cliche of “never trust the news,etc” but to be watching it live is just....I mean fuck. If you can’t see it by now you’re obviously on the other side. Not only is no one going to be held accountable, more than likely they’ll just change up the rules to punish the “little guys”. It really shows us whose best interest our government and media favor. 

You honestly couldn’t write a better scenario on exposing these slime balls. A fucking store that buys and sells used video games. A dude that seems like he’d make Keanu Reeves look like an asshole and goes by the name Roaring Kitty on YouTube and DeepFuckingValue on Reddit exposed them; but not because he wanted to fuck them over, but because he saw the value in it and liked the stock lol. 

It’s perfect.

TLDR;the media sucks","As fun and exciting it has been watching this fiasco unfold so far, it’s also equally frightening and a shame.",1.0,1615955345,ShakaZuluYourMom
40,m6s5xb,,Spreading the word on Gran Turismo Sport.,1.0,1615955371,Tlix
41,m6s6ij,[removed],I think might have potential to blow up! Drive Shack! Stock ticker (DS),1.0,1615955431,TCDStocks
42,m6s6m0,,What i feel the market is gonna be like tomorrow !,1.0,1615955442,Bipolar_investor
43,m6s7qh,,What's Beta? Basically this but for the market,1.0,1615955563,BeanDaddyMac
44,m6s805,"Thanks everyone for either

1- adopting a gorilla 

2- donating to gorillas

3- making the whole ‘wallstreetbets adopting gorillas’ thing so popular, it’s featured in an article on CNN!

Think you could do the same thing to bonobos? They’re pretty cool, as close to humans (genetically) as chimps and gorillas, but much more endangered.

Oh yeah, they’re known as the ‘sex monkeys’ for their tendency to have sex all the time. (Read “Bonobo Handshake” or “Sex Before Dawn” for more info on that).

What do you folks thing?

https://www.bonobos.org/",More apes to save,1.0,1615955595,Sturnella2017
45,m6s8ct,,Completely unrelated but the largest group I know that gets stuff done... let’s get this man a raise. T-Mobile tech support going above and beyond the call of duty.. #PayAljohnMore,1.0,1615955634,TANK822
46,m6s9w3,,"Different Brokers gave AMC different prices today. Webull and Robinhood were saying the same price but fidelity had their AMC listing an average of 20-30 cents higher, I noticed this at about 12:30 today, it went on for over a hour.",1.0,1615955797,workingdadmi
47,m6s9ye,"Hi friends. What about NIO? 
Will pump or .....?",NIO up or down,1.0,1615955804,Tenik007
48,m6sam6,,"I wonder if they will be ready for round 2? You know, when your master calls...",1.0,1615955874,SalvadorVayshun
49,m6sao3,"Once in the land of Terra in the City of MemeStonkia did the venerable James Cramer, level 5 wizard / level 1 warlock, perfect his spell of casting his visage upon the clouds above. Nightly would he prophesy about his visions of the future. 

One day he spoke of the fair weather to come, but instead Vikings from the West raided. Disappointed, the survivors put away their Beach gear and decided not every person with the power to cast their face upon the clouds was particularly worth listening to necessarily.

Years passed and the city was rebuilt. One afternoon a guild of magic using, upper-middle class mercenaries, devoid of any moral alignment, discovered the secret to James's spell and proceeded to have their own visions of the future and discuss them in the tavern sector of main Street, projecting their visages upon the buildings and discussing what they thought.

""Let's all Buy gamestop stocks"" they decided together, some of them being sober enough to notice GameStop stock price would rise with every console release. 

And so they did, but then they had a problem.

The stock was suddenly going to go to 50,000 gold pieces according to some visions. In others it only went to 100. Still others insisted just one share of the stock would grant the owner immortal Life, like a reverse lich or something I don't know. 

And in all the arguing over when to sell it became more and more clear that most would sell at a low price and only a few would wait for a higher one.

Now a certain gnome studying for his PhD in counting things said, ""how about we play a game to determine when we sell our stock? That way we all get maximum profits?""

And this was the game that they made up:

#Everyday you want to sell, flip a coin. On heads sell 10% of your GameStop stock, on tails sell 5%. You must wait 24 hours minimum to flip again.

This game ensured that no one got left with a bag of holding, which was a perfectly reasonable thing to discuss given the circumstances that all these investors found themselves in. 

This didn't mean one witlessely sold every day! It just meant at any time one wanted to sell you would have to flip a coin and wait 24 hours and then flip a coin and then wait 24 hours and then flip a coin and then wait 24 hours. They did the 5 or 10% thing to further maximize profits, using stochastic measured divestment strategies to further flatten volatility and prevent emotional human bias. So at most you would have to flip a coin 20 times in order to sell 100% of your shares, having sold 5% each time you sold. in the fastest you could possibly sell off would be 10 days before you would have zero stock left to sell.

This is part IV, and it seems the story is volatile. Part one got taken down due to a Clerical error on my part. I'm really just Paladin my karma anyway. Fighter flight isn't in my vocabulary, I just was bound to LEAP in, given all my options, and if that's not enough I'll cleave it alone. Whirlwind strike took out part two and three. 

* * Authors note: The magical power of projecting your face on the wall is pretty annoying but not illegal in the City of MemeStonkia to this day. *","Power to the Player's Hands Book of Holding: A Dungeon Masters Guide to maximizing Profits &amp; Prophets; Session IV - Too Many Puns, a short story told long positions, our band of Heroes discovers!",1.0,1615955879,artmagic95833
50,m6sasl,"DD: Their user interface is absolute shit and I couldn’t find the music I wanted. Signed up for Apple Music and was blown away instantly. This is not an endorsement. But seriously the Spotify jig is up. 

Someone teach me how to short this absolute shit of a company. I hate the stock.",How do I short $SPOT?,1.0,1615955892,WhyNotMTBInstead
51,m6sb49,,u/coinforce is a bad actor engaging in market manipulation and then making a whole post calling out others for doing exactly what he’s doing... ???,1.0,1615955928,poopstar21
52,m6sbuk,[removed],Predictions for tomorrow?,1.0,1615956004,Successful_Tune5650
53,m6sc3s,,Buy AMC!,1.0,1615956030,smervisstonks
54,m6sc8l,"Karp's interview is being overblown.  The headlines are clickbait.  He talks America needing software(pure software/AI) that is the best to AVOID conflict in order to stay ahead of America's adversaries. Basically he's claiming Palantir Technologies to be S class disruptive Tech that can lead future innovations for America.

Karp would rather put his focus on having the company put its ""best foot forward"" for the sake of protecting America and its private and public interests.

He was asked in the middle of the interview ""How would he entice new commercial customers?""

He then starts talking about the how Foundry and Gotham are unique technically speaking ( claims his tech is 5 years ahead of everyone else low key), and the way they do business is unique.  For example he explains that Palantir  in the commercial space, Foundry is a Finished product as opposed to other ERP systems that require you to do an entire IT installation that can take months.  Foundry can be installed as a whole stack in a few days!  That difference is how Karp and Palantir thinks Software companies will sell their products.  He mentions that typically ERP systems entice customers with Jargon that promises to deliver instead of providing a product that stands out from the rest.  He truly believes Palantir is in a class of its own.   He actually believes despite having Elite tech that he provides for the biggest companies in the word, he thinks that Palantir can provide a ton of value to smaller to medium companies by offering superior ERP Software transforming their business to save them millions of dollars.

They talk little bit about PLTRs partnerships including 3M, BP, IBM, and AWS.  They talk about how IBM and AWS were thought to be rival companies to Palantir but instead decided to join forces because those companies understand how difficult it is to build what Palantir built with Foundry and Gotham.

HE LIKES THE RETAIL INVESTORS, he HATES the ""INVESTORS"" who buy and sell the stock who don't have any clue about the company or its Tech.

He can't on camera ""PUMP"" the stock, so he just talks about how he's more focused on building the Company for the long-term.

TLDR

So about a fucking hour talking about how superior the tech( Foundry/Gotham) is compared to any other software company's tech and how Karps ideological view of supporting America and its western values by providing Superiority and Complexity in order to stay ahead of its adversaries.

Foundry is 5 years ahead of any other ERP software in the market.  IBM and AWS bow down to PLTR.

Intrigued yet?

I plan to hold this 10 years plus.

235 shares@ 24.68, 6x  PLTR 4/1 30c",AK Interview Summary,1.0,1615956044,Chrononubz
55,m6sckj,,Do you all think Crayola is catching on?,1.0,1615956078,purpleowl385
56,m6sczw,,GameStop Shuffle (GME Shuffle) [Music Video],1.0,1615956121,MichaelTen
57,m6sd7v,,PaddySTHooold! Top of da mornin to all ya Tontonites!,1.0,1615956139,AsiaEvents
58,m6sdlz,,GameStop’s Cup And Handle Long John,1.0,1615956180,l1lturbo
59,m6sdp4,,We're helping apes without 100% body hair too right?,1.0,1615956190,flagcity
60,m6sdpf,[removed],"2 days in WSB = 2 days in paradise, 🚀🚀🚀GME to the moon 🚀🚀🚀",1.0,1615956191,AlkalineShark89
61,m6se82," r/wallstreetbets

Hello, fellow retards and autists.  I need to borrow your diligent, Aspergers level analytics ability and earth-shatteringly, retarded reasoning to pile drive my portfolio into the red.  I can't believe I'm actually coming here for advice.  Please see the ""case study"" below.

I'm a huge fan of Dr. Michael Burry and how he manages Scion Asset Management, LLC. The guy does his due-diligence and thinks about his investment opportunities from an outside perspective. If the numbers and story pencil, he will bet against anyone and doesn't let the court of public opinion cloud his judgment.

I'm inquiring about the recent Lumen Technologies (formerly CenturyLink) $LUMN trade.

Based on my research, Scion Asset Management acquired 1.15M shares of $LUMN at an average value of $9.74 per share. This trade accounts for approx. 8.02% of Scion's portfolio. If we're looking at Burry's past investments, he's usually one of the first players to the table including both $GME (#diamond hands) and shorting the housing market. 

Lumen has not only rebranded their name and marketing efforts, but their entire business strategy moving forward by selling B2B data and fiber optic services since many customers are moving away from phone lines/services: (direct quotes from my research)...

1. ""**Lumen** is a measure of the brightness of light, and the company’s competitive advantage this century has come from its massive fiber network, stretching 450,000 route miles. That has helped CenturyLink survive even as consumers cut their home phone lines in favor of wireless providers and switched off DSL in favor of faster alternatives. But transporting light signals can also be a commodity service. Lumen is now pushing to offer more higher-value applications and enterprise services directly to its customers, reflected in the company’s new motto: “**The Platform for Amazing Things**.”
2. ""Lumen, which was primarily an ISP/Phone company, stepped up their B2B and backbone connectivity to major Internet companies which the purchase of Level3. They'll be key to serving as the fiber backbone for 5G.""

Earlier today, I submitted a limit buy order for $LUMN @ $14.00 which won't be executed until tomorrow when the market opens. I don't believe this trade will turn a real profit for 1-2 years as turning a battleship of this size takes a significant amount of time and resources. But looking at the story and fundamentals, the strategy is sound. Outside the rebranding and change of strategy, Lumen is using some of the newly minted capital to paydown, high interest, debt.

Am I too late on this trade or too retarded to function?  Good or bad, let me hear it.",Lumen Technologies Inc (LUMN) - Too Late To the Party?,1.0,1615956240,hfh7dc
62,m6secq,[removed],Why I believe Scholastic Corp $SCHL could double,1.0,1615956252,DallasDimondHands
63,m6seqd,,CALL WRITING: HOW IT WORKS,1.0,1615956284,MysteriousHome9279
64,m6sfm9,,A monthly chart of beauty! Apes can technically analyze for them self. I just like the stonk.,1.0,1615956372,cometburn4
65,m6sfy6,[removed],DFV HAS SPOKEN - PLEASE UPVOTE TO BE SEEN!,1.0,1615956401,NJDFan14
66,m6sg7r,,"Google news ‘market down’ , “Fed should buy GME”",1.0,1615956428,Coos-Coos
67,m6sgs7,,New Coded DFV Tweet!! This NEEDS to be seen!,1.0,1615956483,NJDFan14
68,m6sgzd,"This is not financial advise. 
Yeah, I have a newer account, fuck off about it.
This was done at 11Am, March 16th.

TLDR: AMC is showing signs of a reversal right out of open/premarket. Almost all MACD time charts support this, and so does RSI. 

GME is set for a red day. Yeah I know, I expected to be in a better spot, but unfortunately I'd expect more of a sell off most of tomorrow, we are seeing constant manipulation of Hedges painting the tape on stocks, bouncing sales back and forth at a volume of 60,61,62, shares etc. Whatever it is, go look at the order book most days, its completely obvious. We SHOULD have finally gotten  into an uptrend on March 16, but because of this we didn't. Unfortunately the MACD is poised for us to have another possibly bad run all of tomorrow and possible untill Friday. 

My opinion: I expect an abnormality to occur at some point. This isn't normal trading, we SHOULDN'T  be trading sideways like this, it isn't healthy or natural. I think similar to ENDGAME Dd, we will see a completely unpredictable abnormality between March 17th and 19. 

What we need to do: LOOK AT THE FUCKING MACD
LOOK AT THE FUCKING ORDER BOOK. 
You fucking apes want this shit to happen? Stop watching guys on YouTube not even displaying the information that matters, you NEED to learn how, and when to act on this reversal or your just going to fuck everyone. Whoever the good hedge is, or the whale, who is fighting for us, will act at some point, and it will be obvious to anyone watching MACD and order books.

YOU WANT TENDIES? 
GO WATCH A VIDEO ON HOW TO READ MACD NOW, YOU ARE A BLIND APE. GO SEE THE LIGHT, AND TRADE WITH YOUR EYES OPEN. 
 APEPOCOLYSE IS NYE, PREPARE YOUR BANANAS 
BUY HODL BUY HODL!!!!",MARCH 17th DD Gme/Amc,1.0,1615956503,Asmosewins
69,m6si7g,"Looking for a little help from the group Wall Street bets I understand you guys are willing to help those who are in need.  Well my wife just got our car totaled less and month ago and I didn't have you shirts covered for uninsured motorist our partner manager on duty Creamed our car if anybody can help I would certainly appreciate it. I'm a fully disabled so is my wife.  I don't get the pandemic payment because of Taxes my ex wife 21 years ago took her name off and made me responsible.   The low estimate on getting our car fixed is 3200 and the car is a Honda Accord 2004 w/ 143000 miles garage kept and maintained regularly.  I could sure use some help putting that car back together for us since we're both disabled, hit me up mrjcogs@gmail.com any help would be sincerely appreciated.",Trying to get over the hump,1.0,1615956627,Ok-Educator5387
70,m6siek,,Why was this on BlackBerry today?,1.0,1615956652,AutoThorne
71,m6sij7,,lmao,1.0,1615956665,you_knowwhoiam
72,m6sjll,"I was still a spry punk in my early 20’s when the 2008 crash happened. When it happened, I never fully understood what was happening.

As of recently, I decided to watch several documentaries around everything that had taken place as I have a better understanding of what’s going on.

After watching these documentaries, I’m even more determined to hold as long as I can now to ensure these short sellers are fucking bleeding out of their asses.

These people we are up against are fucking evil. And if history has taught us anything, we will not see anyone behind bars. So let’s take these mother fuckers to the cleaners.",More Motivation To Hold....,1.0,1615956778,KillahKorona
73,m6sjn8,"Always mining and ready to get this cuter millions

Here is my invitation link for BEE Network. Use the invitation code: tristianbattle. Download at https://bee.com/en/download",Let’s make millions before anybody else finds out about this.. you can be the first to have mined the newest cypto,1.0,1615956784,TristianBigBank
74,m6sjtp,,"He Built a Trading Bot to let Subscribers Trade his $25,000 on Twitch",1.0,1615956804,skausk
