,post_id,text,title,upvote_ratio,date,author
0,lxvdlw,[removed],What do you guys think about AESE did 29% today?,1.0,1614891828,NarwhalApprehensive5
1,lxvdso,,"Potential Squeeze on Genius Brands International, Inc",1.0,1614891843,[deleted]
2,lxvdtp,,RKT YOLO Update - Mar 4 2021,0.8,1614891845,SIR_JACK_A_LOT
3,lxvdy6,[removed],Covered Call GME?,1.0,1614891855,CamachoNotSure
4,lxve1n,[removed],"KMPH IS GETTING HEAVILY SHORTED, WE NEED YALLS HELP",0.33,1614891863,Rough_Garage3773
5,lxveb4,,CNK up next?? 👀,0.9,1614891882,coznova77
6,lxvect,,Look familiar?,1.0,1614891885,GME_dat_puh
7,lxved5,,"After the last couple of weeks, I decided it was time to rename my trading account",0.96,1614891886,MortalDanger00
8,lxvef4,[deleted],"Kids In Northern Europe Wants To Be Like You, Guys. Well done!",1.0,1614891890,[deleted]
9,lxveju,,Ground control to major Tom.. liftoff soon?,0.5,1614891902,UltraGoliath_
10,lxvep2,,"User grego45 said if RKT didn't close green today March 4th 2021 he would drink his own piss, a DEBT IS OWED TO WSB",0.98,1614891914,UpUpDownDownXO
11,lxvexg,[removed],Make Money On The Downturn,1.0,1614891933,maddog42069bbq
12,lxvf80,,"I wish you guys success but kick rocks, this is not just a Gee Em Eee sub",1.0,1614891955,Ethburger
13,lxvfe5,[removed],WSB and fucking proud,0.84,1614891969,joe7894321
14,lxvfhl,,Just hold on my fellow 🦍🦍s 💎🤲🏾 while the markets down we still rise 🚀 🚀🚀,1.0,1614891977,2flytofall88
15,lxvfj5,,"GME YOLO Update: $132,300,000 OR BUST",0.96,1614891980,mainingkirby
16,lxvfjo,"Whole week retail trader &amp; Institutional trader made huge bets on upcoming 16 Apr calls. As told earlier here([01-March - 15 Million](https://www.reddit.com/r/wallstreetbets/comments/lvg4q3/15_milliion_dollar_bet_on_upside_for_gme_look/)) &amp; here([02-March- More Retail Bets](https://www.reddit.com/r/wallstreetbets/comments/lw4k8v/bullish_momentum_continues_gme_judge_yourself/)).

When you have consistent momentum of Call Buying in large batches it is really referred as UOA, [Unusual Option Activity](https://www.warriortrading.com/unusual-options-activity/). Some people &amp; shops made business out of it like these [folks(from CNBC)](https://marketrebellion.com/members/getting-started-uoa/).

Other than this stock is trading in very tight channel of 100-150, which only tells us that each time selling pressure comes up either our apes brother come with buying or market makers are buying it.

Upcoming Catalyst for GME is yet not confirmed earning on 25 March, where people are expecting big announcement may be about Cr#\*to or [Ryan Cohen Ice Cream cone](https://www.reddit.com/r/RobinHoodPennyStocks/comments/lwlb6m/slgg_possible_connection_to_gme/). Point is either the expectation of catalyst of actual catalyst will catapult this stock to new highs.

Now back to today's UOA activity, where some ape bought 1300 Calls for 16 Million Dollar approx. now people might say it could be spread, sure may be but I don't see it here.

[UOA - 4 March](https://preview.redd.it/r6imk0lvr2l61.jpg?width=1987&amp;format=pjpg&amp;auto=webp&amp;s=16429d6cd5de4df03044b75f13eb82c2e28e5cc4)

Yes I do have Stock position &amp; Options positions myself. Here for April I will roll my own calls to April at right price.

Last to give PUT picture here it is:

[Raise Cheap PUTS to secure yourself](https://preview.redd.it/ypon9mq9t2l61.jpg?width=3276&amp;format=pjpg&amp;auto=webp&amp;s=18a7d6b08cd8e67081cb968347796a6cace84321)

Last people asked me how to see this in TOS, so [here is the link..](https://tlc.thinkorswim.com/center/howToTos/thinkManual/Trade/All-Products/Options-Time-and-Sales)

In end Ape Summary is : Lot of powerful high ranking apes are buying bunch of high priced bananas in hope to get rewarded with farms of bananas. While ape being ape they are consistent &amp; ape don't fight ape so let's not fight here on this thread.",Bullish Calls last hour - GME - Biggest trade is for 16 Million $$$,0.97,1614891981,vishalniit
17,lxvfm0,,I've just realized Vlad was probably inspired by the Wolf of Wallstreet?,1.0,1614891985,Stanssky
18,lxvfmq,[removed],SLGG to the moon,0.25,1614891987,Important_Tailor_589
19,lxvfrd,,"Bad day for $UWMC but 💎 hands will prevail. Good dividend coming up, possibly being added to the Russell, profitable company with good cash flow, and the CEO is a boss. 🚀 pretty soon.",0.74,1614891996,disturbedmoneybags
20,lxvftl,,412K QQQJ YOLO - March 4th 2021 - Im starting to regret buying these at 0.8 and not waiting for the correction. In other news volume today was 5.4x normal for these calls,0.8,1614892001,dvdgelman7
21,lxvfus,,I’m. Not. Fucking. Selling. #GME,1.0,1614892004,Camtheman6969
22,lxvfxq,[removed],OZSC on sale!!!!!,1.0,1614892011,boomhower13
23,lxvg3m,[deleted],Just a baby ape swimming in shark waters,1.0,1614892024,[deleted]
24,lxvg4d,[removed],RKT.,0.25,1614892025,Grasshoper1932
25,lxvgb9,,Shall I place the limit over 9000,0.87,1614892040,BrokeAsFuck-WSB-APE
26,lxvgbh,[removed],Is Hertz on anyone’s radar,0.67,1614892040,PoorestRichKid
27,lxvgcq,[removed],"HOMEDEPOT STOCK - DOWN BY 15% IN A WEEK - ANY ADVISE TO BUY - IS IT SHORT TERM DECLINE OR WAIT UNTIL BOTTOMS OUT..TRADED $285 ,10 DAYS AGO.",1.0,1614892044,ROCKISHERE81
28,lxvgcv,,YOLO using 100k of margin to buy Apple and Palantir not looking good.,0.81,1614892044,axjoti
29,lxvge1,,TESLA signs nickel deal with VALE for batteries,0.62,1614892046,Natural-Lunch
30,lxvgfe,,Don’t do it,1.0,1614892049,filpom
31,lxvgrh,[deleted],The options trade on Marathon Oil -This is as close as I get to DD,1.0,1614892073,[deleted]
32,lxvgru,,"Smooth Brain Explanation Needed, RobbingTheHood is Back :/",0.62,1614892074,[deleted]
33,lxvgrw,,"ANOTHER DISTRACTION: IGNORE THESE DUMB MEDIA COMPANIES!! EVERY DAY ITS A NEW COMPANY THEY CLAIM WE ARE SQUEEZING. BARRONS, CNBC, AND ALL YOU OTHER KNUCKLEHEADS QUIT MAKING UP BS!!! KEEP HOLDING MY FELLOW APES🦧🚀",0.88,1614892074,thegreatzach127
34,lxvgty,[deleted],i guess im supposed to be learning... lessons?,1.0,1614892079,[deleted]
35,lxvgx5,,"UNFI YOLO, March 4, 2021. Undervalued, Whole Foods contract extension, Big earnings next week.",0.83,1614892086,milzlam
36,lxvgy0,[removed],First time APE 🙈 Let´s go!,1.0,1614892088,Portuguese_Investor
37,lxvh7p,,I Gotta a Feelin....,0.95,1614892109,[deleted]
38,lxvh8a,,RC new tweet. I like your shorts.,1.0,1614892110,Classy_Chemical
39,lxvhhw,,"Reddit CEO Steve Huffman on WSB “At the end of the day, this community is fun and it’s funny”",0.81,1614892130,user100and1
40,lxvhna,[removed],Ape random thought GME AXDX QELL,1.0,1614892142,GmeSympathy2936
41,lxvhnt,[deleted],"Kids In Northern Europe Want To Be Like You. Well Done, Guys! 👍",1.0,1614892143,[deleted]
42,lxvhxs,,"$KMPH - NEWEST ADHD DRUG BEING SNUFFED BY SHORTS (ALREADY APPROVED!! WITH POTENTIAL TO 20-50x this year, EASILY!) upvote and comment everyone PLEASE THIS IS HUGE HUGE HUGE!!!",0.6,1614892164,nerso21
43,lxvhyj,[removed],CYDY,1.0,1614892166,Due_Meet_1560
44,lxvi04,,"Google apparently didn't screen for diversity on these ""Top stories.""",1.0,1614892168,Gyrgyl
45,lxvidm,,Some loss porn for you.,1.0,1614892195,darksoulmakehappy
46,lxviec,,Everything Is The New GME Apparently?,1.0,1614892197,Puzzleheaded-Team677
47,lxvift,[removed],Tendies!,1.0,1614892200,Embarrassed_Weird907
48,lxvija,[removed],Tendies!,1.0,1614892206,Embarrassed_Weird907
49,lxvils,,Pure Entertainment,1.0,1614892211,fluffman88
50,lxvimz,,Holding on till my hands bleed fellow apes 🚀🚀🚀🌙,1.0,1614892213,Curious_Bid3810
51,lxvipi,,It all started with 60 shares of $AMC at 14. This 🦍 first experience with this. Everything I touch turns to dust.,0.67,1614892219,_TrustMeImLying
52,lxvipq,,Be glad I didn't buy any GME. You'd all be broke.,0.85,1614892219,winterflipflop
53,lxviud,[deleted],My attempt to make a living not all based on meme stocks 😂,1.0,1614892229,[deleted]
54,lxviwa,[deleted],My retarded monkey dad paper handed pls help me,0.5,1614892233,[deleted]
55,lxvix2,,I'm in f**** it,0.63,1614892234,Miguel19208
56,lxviz1,"Positions:

[Gay bear here](https://preview.redd.it/tjyqxb4ms2l61.png?width=2015&amp;format=png&amp;auto=webp&amp;s=e3c32fb540d9799199b358c8819435bdc103e03a)

Reasons:

&amp;#x200B;

1.	We're in a bubble.
2.	Boomers gonna do their taxes, see they fucked, gonna withdraw more money from 401k, extra coz of deferred withdrawal + cares act says penalty free withdrawal till 10k.
3.	Quad witching gonna make the MMs offload some shares, gonna make for volatile shit.
4.	Treasury shit, idgi, i'm a retard
5.	I'm gay as fuck
6.	Someone told me to chart, so I found that spy just broke out of corona resistance line 

Probably gonna put upto 200k more in this if I believe in it more",60K YOLO in shorting the market (more to put in for the next bull trap),0.77,1614892240,Ike11000
57,lxviz7,[removed],learn how to make money while things are crashing!!!!!!!,0.21,1614892240,Hopeful_Tomatillo423
58,lxvj3l,[removed],Chuckles in Diamond hands,0.25,1614892250,Visible_Problem_4676
59,lxvjg8,[deleted],"Lost in space, or still 🚀🚀🚀 to the moon?",1.0,1614892277,[deleted]
60,lxvjhx,,Got this from a financial news page,1.0,1614892281,Hirsoma
61,lxvjjp,[removed],GME GO BRRRRRR! NEXT STOP TATOOINE!!!,0.9,1614892285,Greatsetoftools
62,lxvjli,,I guess stocks aren’t my thing ( can you tell where I had Gamestop),0.5,1614892289,Euphoric-Pilot81
63,lxvjog,[removed],3/4/2021 GME,1.0,1614892295,Lumpy-Leather2151
64,lxvjqv,[removed],SLGG is the move?,1.0,1614892300,Zealousideal_Algae82
65,lxvjs9,,Woohoo,0.8,1614892303,JeffM1986
66,lxvjxv,"You've probably heard the news by now that 6 Dr Seuss books will no longer be published for imagery that has been deemed racist. Regardless of your political beliefs, we're all here to make MONEY. Basic supply and demand indicates that discontinued books will skyrocket in value if demand increases. Sure enough, within two days, these banned Dr Seuss books are now worth their weight in [fucking gold](https://www.cbr.com/dr-seuss-banned-books-sell-high-pries-seconday-market/).

Here's a breakdown by numbers. I'm using data from Barnes and Noble online to establish the normal hardcover price, and then the lowest price on Amazon to establish approximate selling price after it was announced that they will no longer be published:

* The Cat's Quizzer
   * $9.99 ---&gt; $499.99 **(4,905% increase)**
* If I Ran the Zoo
   * $17.99 ---&gt; $594.00 **(3,202% increase)**
* On Beyond Zebra
   * $16.99 ---&gt; $425.25 **(2,403% increase)**
* Scrambled Eggs Super
   * $14.75 ---&gt; $325.00 **(2,103% increase)**
* McElligot's Pool
   * $19.99 ---&gt; $325.00 **(1,526% increase)**
* And to Think That I Saw it on Mulberry Street
   * $16.99 ---&gt; $224.25 **(1,220% increase)**

Every single one of these is a literal ten-bagger. What's even more crazy is that this [Insider article](https://www.insider.com/classic-childrens-books-that-havent-aged-well-2019-5#if-i-ran-the-zoo-by-theodor-seuss-geisel-aka-dr-seuss-has-been-criticized-for-containing-numerous-offensive-images-1) sort of called it almost two years ago—the first book on their list is If I Ran the Zoo. In addition to the above mentioned Insider article, I looked through several lists of books that are being challenged for racial content. My analysis leads me to believe that *The Indian in the Cupboard* by Lynne Reid Banks, currently being published by Harper Collins, is a prime candidate for a discontinued book squeeze. Here's why:

1. **Low Search Volume**. Here's a Google trends graph of how often the recalled Dr Seuss books were searched for on Amazon. 

https://preview.redd.it/d178buhtl2l61.png?width=2322&amp;format=png&amp;auto=webp&amp;s=4ad443bc373d439abe34e87d8fbd8c8d04ffd32a

Notice how there's nobody trying to buy these books? This makes sense. No publisher in their right mind would discontinue a popular children's book. This is why books like *The Cat in the Hat* or *Peter Pan*, which have also been criticized, will never go out of print. It would be a financial nightmare.

In contrast, look at how Indian in the Cupboard stacks up against some other contenders:

&amp;#x200B;

https://preview.redd.it/1xe9dbpun2l61.png?width=2306&amp;format=png&amp;auto=webp&amp;s=01e3995810de807ae599684cd690ba7efc2149b7

If you follow the red trendline, you will see that searches for ""Indian in the Cupboard Amazon"" are effectively 0 with some slight upticks every now and then. This contrasts with Amazon searches for titles like Little House on the Prairie, which sees consistent search frequency. Discontinuing further printings of The Indian in the Cupboard will probably have little impact on HarperCollins' margins.

2. **Broad readership base, particularly among middle-aged readers.** In addition to being discontinued, a book will need to have excess demand before the price will surge. This will happen only if the book has a broad readership base. In Dr Seuss's case, so many adults have probably read at least one of the 6 discontinued books growing up (hell I loved Mulberry Street when I was little), which is why they're actually buying up these books now that they've become limited edition items. It probably helps that Dr Seuss wrote his books to help children read and literally every elementary school still uses his writing to teach literacy skills.

Similarly, *The Indian in the Cupboard* was actually well-received in the 80s and was incorporated into school curriculums nationwide. You can still find entire teaching guides built around *The Indian in the Cupboard*, and I distinctly remember reading this book and filling out worksheets back in third grade 2009. Yeah, this book isn't as popular as it once was, but I'm willing to bet that in the 40 years that it's been out, it's been able to build a solid fanbase of readers who will buy a copy out of nostalgia once this book gets banned. This also gives *The Indian in the Cupboard* an advantage over books like *Pippi Longstocking,* which—despite being a children's book with low search volume—is beloved in Sweden but has a much smaller audience in America.

3. **History of contentious debate.** The controversy over Dr Seuss's books didn't just happen overnight (although it certainly felt that way). His books have been banned in libraries for years and there are [arguments](https://www.nbcnews.com/news/nbcblk/reckoning-dr-seuss-racist-imagery-has-been-years-making-n1259330) going all the way back to the 90s about whether his books are racist. This is the same situation that *The Indian in the Cupboard* finds itself in. It's been removed from numerous public libraries and the American Library Association leadership advised educators to avoid the book as far back as 1991. This is important because the decision to remove books is typically time-sensitive. Given almost 30 years to consider whether or not to discontinue publishing, Harper Collins likely has enough financial data and a good picture of consumer preferences, especially under the current political climate, to decide that they will stop further publications of *The Indian in The Cupboard*. 

It's important to keep in mind that there is significantly less liquidity with trading books than stocks. However, books are still less volatile and, like art pieces, tend to appreciate in value over time. I think that *The Indian in the Cupboard* is a long-term hold which has the potential to increase ten fold when it inevitably gets pulled from circulation.",Banned/Discontinued Book Investing,0.91,1614892316,Polytroposphere
67,lxvk1l,[removed],PEI - Pennsylvania Real Estate Investment Trust - How shorted is this Mall Property Group? 🚀 ?,0.33,1614892324,JimJamMcdonald
68,lxvki8,,$UWM Expanding Into Retail By essentially Making there Broker Relationships only do business with $UVM 🚀🚀🚀🚀🧨,0.68,1614892361,Strict_Attitude_6035
69,lxvksy,,My local CVS just restocked AMC gift cards,1.0,1614892381,CAMJAG88
70,lxvku2,[removed],SENS,1.0,1614892383,YOLOBOOMER
71,lxvkuu,[deleted],Am I doing this stocktok thing right?!,1.0,1614892385,[deleted]
72,lxvkv4,[removed],Slgg and AESE,1.0,1614892386,Unusual_Scale_8572
73,lxvkvc,[removed],Syn to fly in after hours ?,0.99,1614892386,YesterdayNo8851
74,lxvl1s,,We really are a force to be reckoned with,0.66,1614892400,tendieful
75,lxvl91,,"So like, ummm, byyyeeee robinhood.",0.67,1614892415,DewersHopScotch
76,lxvlfd,,"I’ll play the conservatively and say - If GME goes to $169.69 tomorrow, I’ll eat a pebble of my shit.",1.0,1614892429,[deleted]
77,lxvlij,[deleted],Yes I'm retarded and put my paycheck into $GME. Let's go🚀🚀🦍🦍,1.0,1614892436,[deleted]
78,lxvm2b,,$GME (GIANT MAN ENEMA) I pooped my diaper and my mom found all the crayons. Suck my autistic balls Vlad,0.91,1614892482,TumultuousWizard
79,lxvm5c,[removed],Newbie,0.5,1614892489,Eagle-1911
80,lxvmee,,"Lordstown Motors, $RIDE to announce earnings March 17.",0.7,1614892507,Neural_Blockade
81,lxvmfz,[removed],CAN WE PLEASE BOOST THE FUCK OUT OF SNDL,0.5,1614892510,Excellent_Fun6851
82,lxvmh7,,Mark Cuban with the POWERRR move!,0.5,1614892512,Big-Commission9697
83,lxvmmj,,"Mom, am I retarded?",1.0,1614892523,jmr1272
84,lxvmqh,[deleted],PLTR trying to catch some wind AH? 👍😁,1.0,1614892532,[deleted]
85,lxvn03,,My wife’s boyfriend approved this meme,1.0,1614892550,bigbigbigwow
86,lxvn3e,[removed],$ROOT. Where is it going? Why? Hint: huge short interest.,1.0,1614892556,tygerwolf76
87,lxvndv,[removed],PLTR,1.0,1614892577,Rated-R-Superstar85
88,lxvnlc,[removed],Rollercoin,1.0,1614892591,Professional-Ad7776
89,lxvnmz,[deleted],Are we doing that Phineas thing again?,0.67,1614892594,[deleted]
90,lxvnr0,[removed],After Hours Trading Seem Odd?,1.0,1614892602,SnooStrawberries1078
91,lxvnrn,[removed],Let’s have a social experiment; who here ACTUALLY owns 1 (or more) share(s) of GME?,1.0,1614892604,Hunter_Safi
92,lxvns0,,$GME daily chart as of March 4th. Looking good for next leg up,1.0,1614892605,RemarkableChapter167
93,lxvny7,[removed],KEMPFARM - KMPH (TIME TO LOAD UP),0.33,1614892620,Sama3000
94,lxvob6,,RC's Clever Tweet 😂😂😂😂,1.0,1614892644,[deleted]
95,lxvoo4,[removed],Why is there no talk regarding SLGG Insane Volume Today,0.5,1614892670,Headshots_Only
96,lxvosy,[removed],$CCIV 140% short interest? Really?,1.0,1614892682,petetheki11er
97,lxvoyb,[removed],Anybody got a link to the video of that old guy explaining gamma squeeze and how GameStop could’ve hit into the thousands in January?,1.0,1614892692,Repulsive_Ad1445
98,lxvpdp,[removed],Ryan Cohen's Clever Tweet,0.9,1614892724,godfathersgodson
99,lxvpoe,,"PLTR is happening big time tomorrow. I can feel it , queen cathie got our back! Let’s go!!!!",0.72,1614892747,Yoloalldaylong
