,post_id,text,title,upvote_ratio,date,author
0,mgnq6d,[removed],Getting Rid Of My Mercedes,1.0,1617132012,jshock727
1,mgnqmg,,Is this what they mean by diversify?,1.0,1617132050,SnooHobbies8248
2,mgnqoi,,Ayyee,1.0,1617132054,Professional-Size939
3,mgnr0s,[removed],"Are there any good bets other than GMC, AMC, NOK, BB and NAKD?",1.0,1617132078,diamondheaddragon
4,mgnr4i,[removed],All this new potential for GameStop and a focus for the future!,1.0,1617132087,23x3
5,mgnrkt,[removed],Is Disney Manipulated?,1.0,1617132124,shortdogemaster
6,mgnsiu,"Hi Apes,

I'm trying to figure out how anyone can short GameStop? I'm using TD Ameritrade, it doesn't allow me to short it for the past 2 months. And I asked other brokers too. It's not possible at the moment. 

So how on earth anyone can still short GameStop? Do the big funds have their own brokers?

&amp;#x200B;

&amp;#x200B;

[td](https://preview.redd.it/w8cr1jaqu7q61.png?width=336&amp;format=png&amp;auto=webp&amp;s=9dd0295f33f37443f137ee7440d286bebf9fc485)",How Can Anyone Short GameStop? Any Pro Here? (Legit &amp; Serious Question For DD),1.0,1617132198,tianababy
7,mgnt0e,,Stimmy challenge failed,1.0,1617132232,Burningwood69
8,mgnu45,,High short interest in XL fleet,1.0,1617132318,Embarrassed-Pair9362
9,mgnubq,Infrastructure play for Wed. WKHS?  Hope it goes green.,Infrastructure play for Wed. WKHS?,1.0,1617132336,Trop851
10,mgnuld,[removed],Newbie question,1.0,1617132359,Thehannahormiston
11,mgnv59,"What do you think are the actual likely events that will take place when this bitch goes into the stratosphere?  Circuit breakers, shutting down trading, lawmakers stepping in, straight up cheating, what sort of cock-blocking do you expect to see?  I keep running the scenarios over and over in my head, trying to measure out my hope and excitement so I don't go completely nuts.",What are the likely roadblocks that will pop up if/when the MOASS hits?,1.0,1617132406,UmbraPenumbra
12,mgnvba,,Spotted just south of Dallas as I was leaving my house. Factory production is in process I guess?,1.0,1617132418,hevea_brasiliensis
13,mgnwdi,"I’ll make this quick.

Upgraded PT to $19 a share today.
Currently sitting just under $11.
Small cap solar company.
 
Do your own DD this is not financial advice 

Current positions: 135 shares

Looking at $15 options a month out",$VVPR GOES BURRRR,1.0,1617132501,Quirky-Donut1269
14,mgnwmb,[removed],Can someone explain why anyone thinks AMC is good to buy?,1.0,1617132520,SteppeAdler
15,mgnx9z,Anyone have a link for the jpow club money printing gif meme?,Jerome Powell club money printing meme,1.0,1617132574,gli852
16,mgnxck,,Ok fuck it got my shares to 10k .. go broke or die trying,1.0,1617132580,Professional_War1998
17,mgnxlc,,These were posted by the same person... [u/TheHappyHawaiian],1.0,1617132599,Blattlauch
18,mgnxwx,[removed],iRobot on discount?,1.0,1617132620,iltraas
19,mgnybu,"And buy,ofcourse",Just hold,1.0,1617132652,TnsMih
20,mgnz7c,[removed],$ASO ready to go?,1.0,1617132722,Arcieri-03
21,mgnztn,"https://www.facebook.com/viceuk/videos/766825847445325/

This is a link to a video where Edward Snowden talks about the scary place the world is heading with tracking all citizens. With the little guys here changing the way the financial system works. Breaking the power of hedgefunds, isnt Wallstreetbets our only hope to take over 'the system'? To think freely for ourselves, to steer the world the way we want it to go. Instead of following wherever big money and big power takes us. 

Last year the poor people of the world lost $3,7 trillion (or so) and the rich people gained that amount. The Corona crisis is the largest robbery in history. And now 'they' want to keep things going right. I dont believe in a great conspiracy, but I know history. Everywhere I see countries giving money. But like saving an airline company. What are they paying? Sure the personel, but mostly the loans to finance the planes. Our trilions go to who?? If a plane is grounded for a year it has to be payed! Why? It is not used, a little conservation maintance maybe. But its like a car, the mileage stays the same. So its only the lones that HAVE to be payed. 

But what if they are not payed? The people receiving it are the ones now getting richer and richer. Why not pause contracts. 20 or 21 years. We all are in this together, why not pause....

So some powerful people benifit and now we hastly introduce a system of total control. Please r/wallstreetbets isnt there a little guy way for us apes to be together strong?

P.s. I know this might not be the best reddit post for this discussion, but I searched and dont know what else to do, or where else to post my thoughts. The words of Snowden made me so sad, we are heading into very very dangerous times. My hope is on the little guys. (Its the facebook video, on youtube it says not available on vice.com)",World power and money system needs r/wallstreetbets smart little guys steer up,1.0,1617132771,Space-techjunky
22,mgo0jm,,Donating Blood to Support GME!!,1.0,1617132829,SwiftPotomac1775
23,mgo0y7,[removed],I'll yolo my membership here. Safemoon?,1.0,1617132859,Zenomusic
24,mgo1hi,,ChucklesImInDanger.gif,1.0,1617132901,Trumbulhockeyguy
25,mgo1ni,[removed],Airborne,1.0,1617132913,DistrictGreat3597
26,mgo1z9,Time for major bets from the apes! 🦍,Who here is on the 88 energy Ltd gravy train??,1.0,1617132938,zook420
27,mgo28w,How the fuck do you build karma in this fucking place? I can not post comments because I do not have enough karma. Fucked up system!,This Sandbox Is Fucked,1.0,1617132960,azdog1
28,mgo2b6,,🚀🚀🚀🌚,1.0,1617132966,nahomz
29,mgo2cf,[deleted],ChucklesImInDanger.gif,1.0,1617132968,[deleted]
30,mgo2om,$FUV shorts are covering ahead of tomorrows earnings.  Huge short interest,$FUV,1.0,1617132996,Floridian82111
31,mgo2pk,,German News about GME - Only more shares of GME will save the company. Pah!!! HODL my fellow apes!🚀🦍💎👊,1.0,1617132998,Happy4Fingers
32,mgo37y,,Are these people from Robinhood that stupid??? I am abroad due to work and the blocked my account. I reached to them troughs Twitter and this stupid rep closed my account. So we are not allowed to travel abroad because they will be closing our accounts. I am transferring to Webull immediately.,1.0,1617133037,luiferres
33,mgo3k2,,I was told this would be welcomed here...,1.0,1617133062,porelamordelsol
34,mgo4j7,[removed],AITX stock - A Buy! We all win!,1.0,1617133140,Need_Money_626
35,mgo4ku,"Given the recent Hedgefund burning, are we going to see continual bleeding of these stocks or has the damage already been done? What is the precedent for these situations?",$CS &amp; $NMR timeline,1.0,1617133144,jsc149
36,mgo4pf,,LFG!,1.0,1617133155,Potential-Panda
37,mgo4td,The New York Senate has convened to debate and hopefully pass cannabis legalization.   Will this move by one of the world's most important cities drastically accelerate legalization in other parts of the world?  Which companies are best poised to capture this market?  MSOS or LPs?[https://www.nysenate.gov/calendar/sessions/march-30-2021/session-3-30-2021](https://www.nysenate.gov/calendar/sessions/march-30-2021/session-3-30-2021),New York Senate to pass legalization of cannabis,1.0,1617133162,bigbux82
38,mgo53d,,SUSAN GETS IT.... WE LIKE THE STOCK! 👀🙌🏼💎🚀,1.0,1617133184,Onboarding92
39,mgo5in,,Representing on cod,1.0,1617133216,0insertusernamehere
40,mgo5zu,,SoS SQUEEEEEZE - 216.85% SHORTS | 10k+ mining rigs B.T.C. Mining Play | Stronger than MARA and RIOT,1.0,1617133250,QuickWick
41,mgo600,,This way they know they own ya,1.0,1617133251,Box-Opening
42,mgo607,***PLUG / WKHS infrastructure on Wed?***,PLUG / WKHS 4/1?,1.0,1617133251,Trop851
43,mgo69m,,Holy mother of Cathie .. What a fuckton of calls on $TSLA !!! Up 4%,1.0,1617133273,TheHigherSpace
44,mgo6es,,SOS=FOOD,1.0,1617133280,Princess-Teacup
45,mgo6il,,Nio,1.0,1617133289,gtag5098
46,mgo6ln,"Sorry for the super basic question, I am the ape that fell out of the tree and hit my head, and now I'm a little extra retarded. 

&amp;#x200B;

Are there any platforms, or account types, that don't risk GFVs?

&amp;#x200B;

I want to be able to buy a dip, sell a pique, then turn around and do it again without waiting two days. I have a basic cash account on webull. Reading over their account types, I'm guessing I want a margin account?",Day Trading Smooth Brain Noob Question,1.0,1617133295,Rumbletastic
47,mgo6xt,,Could be a moon shot week!,1.0,1617133318,Professional-Size939
48,mgo75b,,I truly belong here,1.0,1617133336,thecrazyslopoke
49,mgo76v,[removed],Gme crashes Reddit users take to inovio,1.0,1617133339,Holding_1
50,mgo7qj,[removed],UAL Stock on the steady rise...,1.0,1617133384,AListCOD
51,mgo88a,,"Found a shirt for my wife and her BF at the thrift shop today,",1.0,1617133422,420CowboyTrashGoblin
52,mgo8eg,,Holy mother of Cathie .. What a fuckton of calls on $TSLA !!! No woner it's up 4%,1.0,1617133435,TheHigherSpace
53,mgo8kv,,🚀 go go go!!,1.0,1617133448,nahomz
54,mgo9a4,[removed],If all set 1 buy at 199$ we win easy.,1.0,1617133502,Dallaz69
55,mgo9jd,,Still holding 💎💎💎💎,1.0,1617133522,pots99
56,mgo9o2,,There's always money in the banana stand,1.0,1617133532,Krejar
57,mgo9ri,[removed],PLUG / WKHS 4/1,1.0,1617133541,Trop851
58,mgoa0j,[removed],Gummy’s,1.0,1617133562,Kidkalix
59,mgoa0k,"\*This is not financial advice\*

Hello fellow apes, the other day I posted a technical analysis on GME regarding a cup and handle pattern that I noticed while looking at the 3 month movement chart on my brokerage site. Due to my post gaining a decent amount of traction and there being a bit of confusion regarding the photos I posted, I just wanted to provide more information to everybody.

**1.)** In no way am I suggesting that anybody go and buy GME. I just happened to notice this formation and wanted to share it. I like the stock, what else can I stay?

**2.)** Everybody should know that a cup and handle chart can break three ways, it can break either up, down, or flat. However, based on the average daily volume that GME has been receiving over the last three months and the amount of people backing the stock I believe that this squeeze is very possible.

**3.)** Generally, the cup and handle shape takes a few months to form, it does not all happen in one day. That being said, the break will be gradual.

[GME \(3-month Growth Chart\)](https://preview.redd.it/lllhlb9dw7q61.png?width=1538&amp;format=png&amp;auto=webp&amp;s=2584c6d5a31e2480d05d4bfa80faf48bbb34bdf0)

[\(Cup and Handle Example\)](https://preview.redd.it/zpfu6gdqw7q61.png?width=1292&amp;format=png&amp;auto=webp&amp;s=852e9d43ef2ffdf648ae1bb17e084a5fb09ea5eb)

On top of this cup and handle analysis, I would like to talk about the fundamentals of GameStop as a company and why it is actually farther from a gamble than people think. Since January, the company has been building a fantastic team. They gathered executives from Google, Amazon, and the CEO of Chewy. On top of this, they have released news on how they plan on branching out into selling PC gaming products. Cohen has made it clear that he plans on fixing GameStop's e-commerce. PC  Since this past summer, they have been dipping their toes into hosting esports events. This with this being said, no, I don't think the stock will shoot to $500 over night, but does the company have the fundamentals to get their overtime? I definitely believe so.",Why GME is a long term investment,1.0,1617133562,OscarFromSharkTales
60,mgoadc,[removed],Large price range in options,1.0,1617133590,Fontec
61,mgoajp,"Wall streets bets has become that community that supports stocks of companies that all the people in suits want to shut down like GME. I have come across another company as such and that is NIO and I urge the mods of Wall Street bets to support to help take this to the moon 🚀🌙, because a company like Tesla is just bullying NIO and that is just unfair. It’s time to teach the top 1% how to be fair and this can only be done through Wall Street bets academy.",Attention: Wall Street Bets Mods,1.0,1617133604,fahadnadeeem123
62,mgoald,We must buy high to!,If all set 1 buy at 199$ we win,1.0,1617133607,Dallaz69
63,mgobhp,,Somewhere in Finland,1.0,1617133673,Complete-Zucchini-87
64,mgoca7,[removed],$WKEY has 135% shorts.,1.0,1617133731,Head-Hornet3017
65,mgoce8,[removed],"The naked shorting scam revealed: lending of market maker privileges, the married put trade and why inflicting max pain will bleed them dry",1.0,1617133740,broccaaa
66,mgochl,,Pretty much.....,1.0,1617133747,Ricq94
67,mgoczm,,holding strong on my big positions but gme j can’t stop ripping / these mfs can’t stop the inevitable 🙌🏼🦜,1.0,1617133785,CamelBest
68,mgod2v,,Viacom $7000 Yolo 50C 4/1 - Discovery is up 35% today basically recovering from Bill Hwang's block sale. I believe that Viacom can follow suite and I'm putting my money where my mouth is,1.0,1617133792,leveredarbitrage
69,mgod58,,"The naked shorting scam revealed: lending of market maker privileges, the married put trade and why inflicting max pain will bleed them dry",1.0,1617133796,broccaaa
70,mgodr8,,How The Hedge Funds Currently Look Knowing We've Won 💎🤲,1.0,1617133840,PlasmaTune
71,mgoe4x,HODL,GME,1.0,1617133873,Unique_placemat
72,mgoe6e,,holding strong on my big positions but gme j can’t stop ripping / these mfs can’t stop the inevitable 🙌🏼🦜 (supposedly that tickers banned here oops...),1.0,1617133877,CamelBest
73,mgoeim,,AMC to the moon Apes!,1.0,1617133905,HugoBossjr1998
74,mgoeuv,[removed],Shoulda kept my day job.,1.0,1617133930,kai_Kash
75,mgof3s,I'm just wondering what the APES on WSB think?,"Has the ship already sailed for SNDL, or is this a good play still at its current price?",1.0,1617133949,cooldad42197
76,mgofb8,"Because everyone who's in there so concerned about ""ShOrT LaDdEr AtTaCkS"" are just hoping it goes up some so they can bail out and get their money back.....",If you really had 💎✋🏼then there wouldn't be hundreds of people in the $GME daily thread posting every second. If you're holding forever...why are you watching the price 24/7 ????,1.0,1617133965,WallStreetWarrants
77,mgofm6,"After seing the Story of $ROOT and more impotantatly the shortrate of more than 60%, i think the stock will lift of from 12$ and land somwhere near to 69$",ROOT,1.0,1617133989,Benutzer104
78,mgofmq,,Arise UP APES to close at 35 @ Yesterdays close of 35. Don't loose the momentum! KEEP THE HIGH GROUND !,1.0,1617133990,-BlackRock-
79,mgofqf,Where we at ladies and gentlemen with AMC? We plan on another push up?,AMC,1.0,1617133998,JG626801
80,mgogj0,[removed],Help!!!…. TMGI TO A PENNY!!!! Or More!!!,1.0,1617134057,leeryT_1011
81,mgogj5,,"Diamond Hands Report, Power to the people. The Diamond Hands Report is a collection of the top mentioned stocks in this sub, purely data, no sentiment. Lotts of buying power in this sub and it's important to know where it lays.",1.0,1617134057,blackIV
82,mgogoq,,"Finally, my first submission here.",1.0,1617134071,TabularasaNow
83,mgogs4,Momo good China company?,Momo vs whatap,1.0,1617134077,Prize-Painting-1118
84,mgohc2,,nice swing today,1.0,1617134119,quanabol
85,mgohp8,,The Mighty $ASO Provided Tendies Today :D,1.0,1617134147,windrunner69
86,mgohv2,,Gonna need a clean energy miracle.,1.0,1617134159,pappa4484
87,mgoigg,[removed],🚀🚀🚀🚀$EEENF,1.0,1617134206,cd310
88,mgoimq,"Has anyone looked into lucid motors and Churchill Capital Corp IV stocks/shares, I've just been watching a few videos on YouTube about lucid motors and how the creator made the Tesla Model S, not sure if it's a good idea to invest thought I would ask for some opinions",Lucid motors,1.0,1617134220,World_orders
89,mgojb2,,Bought 5 $20 call options because some rando on fox business mentioned it...is that how you get the tendies?,1.0,1617134271,Vaughnbets
90,mgojdv,,Should I sell my 8 shares of GME and put it all on AMC?,1.0,1617134278,mrbrymr2
91,mgoje0,,Clean Energy has been manipulated since January. $ICLN should have been passed $35 already. Ready for it to return on the right track.,1.0,1617134278,NoCheetah7607
92,mgojs2,[removed],Super hungry to make my money double or triple.,1.0,1617134309,AListCOD
93,mgok0a,[removed],If reddit hates nestle why doesn't everyone just buy nestle stock and use that power to vote?,1.0,1617134328,Serversuper
94,mgokqz,What are you gonna do when your squeezy squeeze squeezes?,AFTER *SQUEEZE* DREAMIES,1.0,1617134385,Postoaster
95,mgokzb,[removed],DIAMOND BALLS,1.0,1617134402,bonfire1670
96,mgol0s,[removed],Safemoon to moon?,1.0,1617134404,400kman
97,mgol4b,"**\*This is not financial advice\***

Hello fellow apes, the other week I posted a technical analysis on GME regarding a cup and handle pattern that I noticed while looking at the 3 month movement chart on my brokerage site. Due to my post gaining a decent amount of traction and there being a bit of confusion regarding the photos I posted, I just wanted to provide more information to everybody.

**1.)** In no way am I suggesting that anybody go and buy GME. I just happened to notice this formation and wanted to share it. I like the stock, what else can I stay?

**2.)** Everybody should know that a cup and handle chart can break three ways, it can break either up, down, or flat. However, based on the average daily volume that GME has been receiving over the last three months and the amount of people backing the stock I believe that this squeeze is very possible.

**3.)** Generally, the cup and handle shape takes a few months to form, it does not all happen in one day. That being said, the break will be gradual.

[GME 3-Month Chart](https://preview.redd.it/i5n3zn2cz7q61.png?width=1538&amp;format=png&amp;auto=webp&amp;s=f497604c509b1a2d933d85d5c6a4c8eaeba84655)

[Example Cup and Handle Chart](https://preview.redd.it/3fdwcp7ez7q61.png?width=1292&amp;format=png&amp;auto=webp&amp;s=8857a21de73320641a917a6fad02205e3194c8f2)

GameStop is also on the way to having a very strong business model. Firstly, GameStop acquired Ryan Cohen, the CEO of Chewy. There is no doubt in my mind that Cohen isn't going to transform the fundamentals of GameStop for the better. On top of this, the company also acquired executives from both Amazon and Google. The company plans to fix their e-commerce situation as well as branch out into selling PC gaming material. Also, the company is dipping their toes into hosting e-sports tournaments. So, do I think the stock could potentially go up to $500? Yes. Do I think that will happen over night? No. This will all be gradual, and if the fundamentals do end up strengthening, then there will be no need for the stock to ever dip down to under $100 ever again. So with all of this being said, apes stay strong and stay retarded.",Why us Apes Should Think About GME Long Term,1.0,1617134409,OscarFromSharkTales
98,mgol98,"Your daily trading discussion thread. Please keep the shitposting to a minimum. 

^Navigate ^WSB|^We ^recommend ^best ^daily ^DD
:--|:--                                 
**DD** | [All](https://reddit.com/r/wallstreetbets/search?sort=new&amp;restrict_sr=on&amp;q=flair%3ADD) / [**Best Daily**](https://www.reddit.com/r/wallstreetbets/search?sort=top&amp;q=flair%3ADD&amp;restrict_sr=on&amp;t=day) / [Best Weekly](https://www.reddit.com/r/wallstreetbets/search?sort=top&amp;q=flair%3ADD&amp;restrict_sr=on&amp;t=week)
**Discussion** | [All](https://reddit.com/r/wallstreetbets/search?sort=new&amp;restrict_sr=on&amp;q=flair%3ADiscussion) / [**Best Daily**](https://www.reddit.com/r/wallstreetbets/search?sort=top&amp;q=flair%3ADiscussion&amp;restrict_sr=on&amp;t=day) / [Best Weekly](https://www.reddit.com/r/wallstreetbets/search?sort=top&amp;q=flair%3ADiscussion&amp;restrict_sr=on&amp;t=week)
**YOLO** | [All](https://reddit.com/r/wallstreetbets/search?sort=new&amp;restrict_sr=on&amp;q=flair%3AYOLO) / [**Best Daily**](https://www.reddit.com/r/wallstreetbets/search?sort=top&amp;q=flair%3AYOLO&amp;restrict_sr=on&amp;t=day) / [Best Weekly](https://www.reddit.com/r/wallstreetbets/search?sort=top&amp;q=flair%3AYOLO&amp;restrict_sr=on&amp;t=week)
**Gain** | [All](https://reddit.com/r/wallstreetbets/search?sort=new&amp;restrict_sr=on&amp;q=flair%3AGain) / [**Best Daily**](https://www.reddit.com/r/wallstreetbets/search?sort=top&amp;q=flair%3AGain&amp;restrict_sr=on&amp;t=day) / [Best Weekly](https://www.reddit.com/r/wallstreetbets/search?sort=top&amp;q=flair%3AGain&amp;restrict_sr=on&amp;t=week)
**Loss** | [All](https://reddit.com/r/wallstreetbets/search?sort=new&amp;restrict_sr=on&amp;q=flair%3ALoss) / [**Best Daily**](https://www.reddit.com/r/wallstreetbets/search?sort=top&amp;q=flair%3ALoss&amp;restrict_sr=on&amp;t=day) / [Best Weekly](https://www.reddit.com/r/wallstreetbets/search?sort=top&amp;q=flair%3ALoss&amp;restrict_sr=on&amp;t=week)

[Weekly Earnings Discussion Thread](https://www.reddit.com/r/wallstreetbets/search?sort=new&amp;restrict_sr=on&amp;q=flair%3A%22Earnings%20Thread%22)

**Read the [rules](https://www.reddit.com/r/wallstreetbets/wiki/contentguide) and make sure other people follow them.**

Try [No Meme Mode](https://www.reddit.com/r/wallstreetbets/search/?q=-flair%3AMeme%20-flair%3ASatire%20-flair%3AShitpost&amp;restrict_sr=1&amp;t=day&amp;sort=hot), also accessible through the top bar.

Follow [@Official_WSB](https://twitter.com/Official_WSB) on Twitter, all other accounts are impersonators.","What Are Your Moves Tomorrow, March 31, 2021",1.0,1617134417,OPINION_IS_UNPOPULAR
99,mgoli1,,🚀🚀🚀🚀🚀$EEENF,1.0,1617134430,cd310
