,post_id,text,title,upvote_ratio,date,author
0,mg1vn6,,Cramer wants Ryan on his show. I'd watch it.,1.0,1617058594,idontknowanyonehere1
1,mg1vpq,Listening to a guy at a bar talking about “dodge coins.” Smy,Dodge coins.,1.0,1617058601,Byronic_Rival
2,mg1vyh,,We’ll be famous you beautiful 🦍s. 💎🙌,1.0,1617058619,trailerparkzero
3,mg1w0r,[removed],GME goes brr,1.0,1617058625,ThePinkySuavo
4,mg1wee,Tell me y’all though boys apes fat kids make apes good food,What should I invest in,1.0,1617058660,Ye-Plan5285
5,mg1wi1,,I got literal diamonds in my hands 💎🖐🏻,1.0,1617058669,BijinRising
6,mg1wib,[removed],Show ♖ me,1.0,1617058670,PopularFollowing6104
7,mg1xxy,,Did i hit a call jackpot on $WMB? Whoa.,1.0,1617058795,Revolutionary_Box_24
8,mg1y1q,,Seen on the back of a semi trailer,1.0,1617058803,Coreyreally230
9,mg1yk5,"Can people stop praising Chamath. The guy sucks, there is no way he is on the side of the retail investors and I dont know how he got anyone to believe it. Dont buy any social capital Spac and dont post about him being a champion of the common investor.",Chamath is a fraud,1.0,1617058836,Jakoval_Tradesman
10,mg1yqm,,Spotted in Nashville. Do we buy Tesla or GME?,1.0,1617058850,TNDOC101
11,mg1zbt,,mr. buffet seems legit,1.0,1617058899,doublebee22
12,mg20p1,,Is it possible for GME to be just like Berkshire Hathaway ?,1.0,1617059001,akcooke
13,mg20ya,"\**UPDATE**
This morning, Humanigen released their [great P3 topline results](https://www.businesswire.com/news/home/20210329005301/en/Humanigen-Reports-Positive-Phase-3-Topline-Results-Demonstrating-That-Lenzilumab%E2%84%A2-Improves-Survival-Without-Need-for-Mechanical-Ventilation-in-Hospitalized-Patients-With-COVID-19) showing a 54%(!!!!) relative reduction (Lenz vs. standard of care) in the primary endpoint (ventilator free survival through day 28) in the mITT population - which was statistically significant. The stock soared to $29.20 (from 13ish) before coming back to earth and settled at $21.61 at market close (on a ton of volume - 88.56m vs 32.15m float).  This is still a great entry point and still below their February high of $23.83 when the market dipped and the shorts increased...

Also, Humanigen recently announced that they drew the $25 million loan from Hercules Capital and suspended their ATM agreement w/ Cantor Fitzgerald &amp; Co. ([Source](https://fintel.io/doc/sec-humanigen-inc-8k-2021-march-29-18715-40)]. They also announced an offering of 5mil shares ([Source](https://fintel.io/doc/sec-humanigen-inc-424b5-2021-march-29-18715-832)). $HGEN is gearing up for Lenz production.
 
Things to look out for ahead are the full results of the P3 study, chatter re: FDA/EUA approval, ACTIV-5 trial update, talks with governments, partnerships. I expect to see a lot of positive news in the future

Posted last thursday (&lt;1bil market cap at time)...
Humanigen ($HGEN), led by CEO Cameron Durant and CSO Dale Chappell, is a clinical stage biopharmaceutical company currently trading at $13.76 (market cap approx $740 million) that most notably makes the Anti-GM-CSF drug **Lenzilumab. It's phase 3 study for severe COVID has been completed and results will be out by end of march. With a successful phase 3 trial, Humanigen will apply and likely be granted Emergency Use authorization (EUA) for production and use of Lenzilumab

What is it?

Lenzilumab is a proprietary ( +100 Patents in GM-CSF, CAR-T, CRS, GvHD) Humaneered® anti-human granulocyte macrophage-colony stimulating factor (GM-CSF) monoclonal antibody that is designed to prevent and treat an immune hyper-response called cytokine storm, a complication considered to be a leading cause of COVID-19 death. Lenzilumab targets severe COVID – patients hospitalized w/ COVID and O2 saturation &lt;94% on room air (90% of hospitalized patients).

How does it work?

GM-CSF is an inflammatory signaling protein that causes a multitude of downstream effects. Blah blah blah, the details don’t matter, but what does matter is that this shit kills people with COVID. Here’s a recent bombshell article from Science Immunology that shows the distinct role of GM-CSF in severe COVID-19. What’s also very important is that this is produced by OUR BODIES. Not the virus. Lenzilumab doesn’t target the virus – it is not susceptible to resistance from mutant strains (\#variantagnostic)

From the article: “GM-CSF is elevated early, scaled with severity, and is central to the inflammatory response in COVID-19.”… “Our findings support therapeutic targeting of GM-CSF, as previously suggested on theoretical grounds”

Here’s another recent study that further implicated GM-CSF in COVID: Journal of Leukocyte Biology

From the article: ""Our findings fully support the emerging notion that GM‐CSF might be a key feature of SARS‐CoV‐2‐induced cytokine storm in COVID‐19 patients""

Does it work?

We will find out soon. The company consistently stated Phase 3 results will be released by end of March. 60 days from last date of patient enrollment will be Mar. 29, and with some secondary endpoints being at the 60 day mark, I would not be surprised if data is released on the Monday. Until that day comes, there has been a lot of evidence suggesting that it will be successful. I’ve already talked about GM-CSF and studies implicating it's involvement and role in severe COVID lung pathology, and here's more

Open-label study published by the Mayo Clinic --&gt; Study showed Clinical Improvement (defined as improvement of at least 2 points on the 8-point ordinal clinical endpoints scale) in 11 of 12 (91.7%) patients treated with lenzilumab and 22 of 27 (81.5%) untreated patients. The time to clinical improvement was significantly shorter for the lenzilumab-treated group compared with the untreated cohort with a median of 5 days versus 11 days (P=.006)

An interim analysis of HGEN’s Phase 3 RCT (NCT04351152) showed promising results – with a 37% increase in recovery rate at Day 28 vs. Standard of care treatment. Study size (small sizes being an issue w/ many COVID therapeutics thus far) was increased to help maintain power of the study at 90% based on these results. Source.

Otilimab – a drug from $GSK that also targets GM-CSF – recently failed their Phase 3 study. How is that good? Well, despite it being severely underdosed (single 90mg dose w/ shorter half life vs. 1800mg total dose of lenzilumab w/ longer half life) and including patients already on mechanical ventilation (further in disease course), they STILL proved statistical significance in their age 70+ group of patients. Lenzliumab has approx.. 45% of their patients age 65+ (which have a 35-80x risk of hospitalization and 1100-7900x risk of death compared to adolescents as per CDC) as per their interim phase 3 report as compared to 22% in the otilimab trial. The increased dose, greater drug half-life, and better patient population bodes very well for Lenzilumab’s chance of success

Here’s a recent bullish letter to the editor from [Mayo Clinic]: “Aware of the good safety profile of lenzilumab in this current study and previous analysis, the treatment is feasible and safe and the ongoing randomized phase III trial will extensively confirm the lymphocyte recovery in SARS-CoV-2 infection and the impact of the drug on coronavirus disease 2019 clinical improvement”

ACTIV-5 / Big Effect Trial (BET-B) for the Treatment of COVID (NCT04583969)

Funded and selected by the NIH – this studies Lenzilumab combined with Remdesvir for the treatment of COVID. Not hard evidence of lenzilumab’s efficacy, but evidence that Lenzilumab has showed enough promise to warrant being chosen for such a trial

Competition

- There is none right now. All COVID therapeutics that target severe COVID have been dropping like flies. It’s all for the taking if this phase 3 study succeeds and Emergency Use approval Is granted

COVID – getting worse

As many of you might’ve heard, COVID isn’t going away. In fact, there are multiple new variants that are more infectious, more deadly, and more resistant to current vaccinations. Across the globe, COVID cases are rising again and certain areas are being hit especially hard. CTV news article re: India w/ it’s new double mutant variant, CNN re: Europe dealing with a surge in cases, and global news re: Brazil hitting record number COVID cases, to name a few. New COVID cases in the US remain pretty low, but between lax restriction and the rise of variant strains as this nature article shows, we could be seeing another wave in the US as well.

How deadly are these new strains? Still much to be learned, but it’s looking like current vaccines leave a lot to be desired. Here’s a study from the New England Journal of Medicine, which studied viral neutralization of some new variants w/ our current vaccines (refer to Table 1). $PFE has decreased (in vitro) efficacy by 2x, 6.7x, &lt;6.5x vs. B117, P1, 501YV2 variants. $MRNA vaccine has decreased efficacy by 1.8x, 4.5x, &lt;8.6x

Google cases worldwide and you will see the # of new COVID cases/day have started to rise after hitting a trough in mid-Feb. Between COVID fatigue and places easing restrictions and the new variants mentioned above, COVID is here to stay and will be for years to come. Here’s an article from nature, which talks about COVID being a endemic virus that we will be dealing with on a year to year basis. Unfortunately, the market is huge for #lenzilumab

Partnerships

Humanigen was the only micro cap company chosen for Operation Warp Speed (an initiative to facilitate and accelerate the development, manufacturing, and distribution of COVID-19 vaccines, therapeutics, and diagnostics) -&gt; Source. Humanigen in collaboration with BARDA to increase manufacturing capacity

License agreement with KPM Tech/Telcon RF Pharamceutical company for Lenzilumab production in South Korea and the Phillipines. [Source]

Partnership with Thermo Fisher to scale up manufacturing. [Source]

Partnership with Emergent Biosolutions for development and manufacturing. [Source]

Partnership w/ Avid Bioservices for manufacturing agreement. [Source]

Not a partnership, but $HGEN recently announced an $80million loan w/ Hercules Capital on Mar. 10 to support manufacturing and commercialization. Bullish move close to P3 data release imo. [Source]

TL;DR - lots of partnerships and agreements in place for manufacturing if EUA approval granted

The Market

Here’s a PDF PowerPoint of $HGEN corporate presentation: Humanigen. The whole presentation gives a great overview of the company and I recommend a look through, but skip to slide 18 and you can get a rough sense of the market potential. There are 3 sources of incomes:

Stockpiling – US and ex-US

US market

Outside the US market

US market: Conservative estimates from the company believes there will be 1,000,000+ hospitalizations in the US this year, with approximately 100,000 patients as a market for Lenzilumab treatment. At 10k per dose, an approximate 1bil of revenue is up for the taking

Outside the US market:

The market is there with cases numbers rising across the globe

Humanigen has been in discussion with ex-US governments already about production of lenzilumab (skip to 24:00 on the Mar 16 fireside chat webcast)

Price forecasting:

Conservative estimates from the company project 100k doses for the US alone in 2021 if given EUA approval. This gives approximate revenue of 1bil. This doesn’t include any non-US sales or stockpiling.

With positive phase 3 trial data, I see the price share easily shooting up to 50-60+. The next step would be applying for Emergency Use Approval, with acceptance likely if P3 study is successful. If granted, and going by the very conservative estimate of $1billion in revenue, I think $HGEN’s market cap will easily be $5bil+, giving it a PPS of roughly $100+.

BONUS -&gt; HIGH SHORT INTEREST

$HGEN short interest has almost doubled from Feb 26-&gt;Mar 15!!!. Yahoo finance estimates a 26% short interest as of Mar 15 w/ a Short ratio of 4.12 given the stock’s low trading volume. With the recent drop in price the past couple days, I would not be surprised if this number was higher. TL;DR -&gt; more fuel for the rocket ships

BONUS BONUS – CAR-T implications and more

Lenzilumab is a cytokine storm drug, not a COVID drug. It is also in a phase 1b/2 study (ZUMA-19) where it is paired w/ a CAR-T drug Yescarta (by $GILD) for the treatment of relapsed/refractory Large B-Cell lymphoma. Car-T therapy is basically genetically engineered T-cells that can target a specific protein, or cancer. The main issue with CAR-T therapy is that it has significant side effects via cytokine storm and neurologic toxicity. Early studies have already shown that Lenzilumab significantly reduces cytokine storm side effects in CAR-T and actually IMPROVES overall efficacy. The readout for this study is planned for this year and there is precedent for CAR-T FDA approval based on phase 2 studies. I don’t have the energy to go into detail so I will leave it at that, but this has HUGE long term possibilities and gives $HGEN significant long term value outside of COVID

**Edit to expand on CAR-T a bit more: I don’t want to downplay this, I think it’s very promising and I’m very bullish on it, but I’m admittedly not as researched on the minutia and writing up covid stuff tired me out XD. There’s 3 main players in the Car-T space and Lenzilumab (which has the patent for preventing Cytokine storm and neurotoxicity related to T cell therapy) could be the missing piece to make this therapy safer. $GILD had dropped another anti-GM-CSF drug from $KNSA and decided to go ahead with just lenzilumab, as well.

Lenzilumab also is in a phase 2/3 study for preventing/treating acute GvHD and also CMML phase 2.

$HGEN also has ifabotuzumab, a drug for treating solid tumors, which is currently in phase 1

TL;DR: Short term covid play w/ ++high upside (potential 5-10x ROI) and high short-interest w/ long term CAR-T potential.

Imo, $HGEN is a very appealing short term, high risk phase 3 COVID trial play with extremely high reward. With successful P3 studies, I see the PPS skyrocketing to 60+ and w/ EUA to 100+ (5bil+ market cap) as a conservative estimate. With stockpiling and ex-USA partnerships, the PPS will soar past 100 and w/ CAR-T the potential is even greater. Of course, the downside is a failed trial and price plummets to around $6 I think. Given the stocks low float and low trading volume, it is very volatile and subject to easy price manipulation. It has dropped approx. 25% the past month down to $13.76 and is extremely appealing at this price range. There is downside, but the upside is much much greater.

PS: DFV had $HGEN on his [watchlist](https://www.reddit.com/user/tscott7070/comments/l8f68i/hgen_on_keith_gill_journal_that_was_posted_in_wsj/)

POSITION: 1250 @ $16.30",$HGEN - short term COVID play with positive phase 3 data. Possible 5-10x ROI w/ EUA application up next,1.0,1617059023,Godszn
14,mg211y,,$rkt 💎🙌 will prevail.,1.0,1617059032,rlcoolc
15,mg21gb,,Seen on the back of a semi trailer (reposted because I'm an idiot),1.0,1617059064,Coreyreally230
16,mg22vb,That way we can easily skip by not having to read the title,"Can we create a ""GME"" flair?",1.0,1617059180,holengchai
17,mg22vk,,"Can someone explain what would cause this? Ask $199,999.99? 🤔 #BLRX",1.0,1617059180,jenniferevon
18,mg23gu,,To the moon!,1.0,1617059229,RIP-Harambe16
19,mg23nm,,🐲🐉,1.0,1617059246,Huge_Homework7101
20,mg26yl,[removed],POSHMARK,1.0,1617059506,letsgetpaid2021
21,mg27oo,"Welcome to another in my legal series DD, where the long whales could be setting up the shorts for a major fall, and the shorties' tears don't matter.

How are we apes? 

**I'm going to have to preface all my DDs from now on that this is not suggestive of a strategy, nor am I providing any financial nor legal advice.**

**Where I provide speculation, this is my opinion and it is open to interpretation, both positive and negative, and where I'm wrong please let me know, and I'll happily amend.**

**Double, triple and quadruple check everything you read and be excellent to each other when correcting one other, including me as DD is often drawn from a good place to help people. It's never a good look to sit on a high horse with a better than thou attitude**

Let me also preface this by saying a mass recall is rare and tied to events such as important vote meetings or a company buy out, *but they tend to appear when the timing helps the longs*.

With that out of the way, I wanted to dive into what a share recall is and means, and what / who could trigger a recall, as I think many apes want to know.

Were a significant recall to happen to GME, I think it could spell doom for the shorts borrowing a ridiculous amount of stock from just about every corner of the market they can possibly get their greedy hands on.

**Onto the DD, wut is recal?**

Boiled down a share recall is the practice of a lender saying to a borrower who sold their stock short, you must provide me my lent shares back **now by buying it**, and find someone else to borrow from if you want to short.

This materially impacts those with a short position as in order to short a party must first 'locate' a lender willing to borrow their share (although not always, see my FTD DD); as their practice is to sell that share at market price to return it later, hoping they can turn a profit by buying it back at a cheaper price, or even not having to return it at all if the company shorted goes bankrupt.

Although a shorter pays a borrow fee to do this, they can generally hold onto this position for as long as they like, provided they have sufficient capital, which the majority of hedge funds and market players taking short positions are strapped with, unless they're stupidly leveraged of course and the price goes the wrong way **or, the lender issues a recall or both**.

**So that's short selling, and we know a recall forces a buy back, why is this important?**

Well if the other DD is true (and I'm minded to agree) and the stock is shorted **over the available float via rehypothecation (🦍 speak, lending out already lent shares) and FTDs**, should *all*, or at least a significant majority of lenders recall their shares, then that's a **big old problem for GME shorts**.

**But first, let's look at typical stock lending agreements**

A (typical) lending agreement generally favours a long, they collect a borrow fee and not just that, **they reserve the right to cancel the agreement at will and without penalty, forcing a short out from their position**.

Therefore **it doesn't matter whether a short has a signal the stock will drop, on recall they are FORCED to cover**, they say shorting is risky no?

In fact, this also presents a benefit to more *informed* longs in that, if they too receive the same information of a stock drop, they can recall and sell their position before the market adjusts to this information, robbing a short of profit.

*Rant - the problem is retail lacks the same kind of research and information, and hears about this kind of thing way later than when institutions and mutual funds have already made their moves, as they can access non public information*

*This is just one of the many reasons many advise others to hold cash accounts, as at least your position isn't being traded ahead of you on your borrowed stock, with superior information, on shares you didn't know were borrowed out - end rant*

An interesting point to note, at least for me, is that when a short position is voluntarily closed, it returns the borrowed share to the lending pool immediately for the next party who wishes to short.

In contrast, a forced liquidation of a short by recall **drains the liquidity of shares available to borrow, as those shares no longer get added to the borrow pool, this is important later**

Now this may seem all doom and gloom but wait wait, hold up, rewind, a lender can recall at any time? **Yup**

My point is, if an institution can see the stock going down in advance of retail, they'll have a good guess of when it'll go *up* too.

Tie this in with an event, say I don't know a general shareholder's meeting which you **know, from non public information** is about to drop a bombshell? You got yourself a golden egg. The important part is the *timing*.

Imagine you're a long institution with a heavily long position in GME. You saw what the others didn't and held onto it and lent your shares out, happily collecting your fee for doing so.

Others join in the shorts as GME is surely a brick and mortar destined to fail following the pandemic. You collect your fee.

You keep collecting fees for your lent shares, and GME's stock reaches a never before seen ~$500 share price and tanks, but you see it going higher. *More* short positions enter.

You **keep collecting fees on your lent shares** and GME has an average shareholder earnings call, and **more shorts enter positions**

Then? The Annual Shareholder Meeting (""AGM"") is announced. You and the long whales 🐳 around you look at each other and realise this stock is shorted **beyond belief**.

What do each of you do? **Recall**

And if everyone recalls? The **shorts are forced to cover and guess what? That pool shorts would ordinarily try and borrow from is essentially empty, and now they can't short it in the same way they did before**

This is a potentially huge catalyst, as each and every short buys back simultaneously and the pool to short again becomes a puddle.

Therefore the longs may have happily sat by, collecting their borrow fee until eventually, they can force this thing to moon.

When can they do this? It depends on when the AGM is announced, but last year shares were recalled on April 10, which falls on a Saturday this year so could be announced on April 9 or 12. Reuters has the date fixed as 11 June 2021, so this could be announced on April 12.

Whilst obviously setting dates on things isn't what this sub does, it's worth bearing (see what I did there?) In mind the price action on or around this date, or 60 days prior to the AGM being finalised, as if a significant majority of lenders force a recall, big things could happen on the stock, as long and the retail whale alike could see GME soar.",Share Recall - The Long Whale Bears Beware DD,1.0,1617059566,Leaglese
22,mg27uz,,🐲🐉,1.0,1617059580,Huge_Homework7101
23,mg27yq,So let me get this straight. Archegos was basically doing the ControlTheNarrative’s infinite money glitch but not with one vendor but with 7 large fucking banks and rn they “GUH” but on massive scale? mmmmky! lulz,Guh!,1.0,1617059590,Yssrmw
24,mg281f,"I have smooth brain interest about a stock listed on NYSE and I'm curious as to how much it is shorted.  I saw that NYSE offers to sell it to you, but i'm saving my tendies for bad ideas. Where can i find that deep knowledge?",Help request: How do you find the short interest on a stonk?,1.0,1617059596,beardfacekilla
25,mg28j6,,Delivered stimmys today so Buy the Dip you Apes,1.0,1617059634,bunnyofcheese
26,mg28nf,,Saw this driving home from work. Diamond hands and balls of steel? I think so.,1.0,1617059644,Terpicanna
27,mg2945,,How does the EV bubble compare to Tulip Mania (Dutch Tulip Bulb Market Bubble)?,1.0,1617059682,jamestonerusa
28,mg2a94,,Nakedshortreport.com. Nuttts!,1.0,1617059783,hhdvuez
29,mg2ajh,,Saw this on my way home from work today lol,1.0,1617059808,Terpicanna
30,mg2dce,,💻🗣💎👐🏼🦍🚀🚀🚀🌛,1.0,1617060048,truethatdoubletruex2
31,mg2f5y,,Double Down. Retards,1.0,1617060199,TransportationOk4467
